[{"gpt-4-1106-preview_direct_sole-planning_results": "Travel Plan:\n\nDay 1: March 15, 2022\nCurrent City: from Philadelphia to Richmond\nTransportation: Flight Number: F3730367, from Philadelphia to Richmond, Departure Time: 14:03, Arrival Time: 15:03, Cost: 73 * 1 = $73\nBreakfast: -\nAttraction: Virginia State Capitol, Richmond, Cost: $0 (assuming free entry)\nLunch: Sandpiper Restaurant & Lounge, Richmond, Cost: 20 * 1 = $20, Cuisines: \"Tea, Cafe, Desserts, Seafood\"\nDinner: Guang Zhou Chinese Restaurant, Richmond, Cost: 84 * 1 = $84, Cuisines: \"Desserts, Tea, Cafe, Fast Food, Chinese, Indian\"\nAccommodation: Inviting Brooklyn Studio, Richmond, Cost: 398 * 1 = $398, Maximum Occupancy: 3, House Rules: No parties & No smoking & No children under 10, Minimum Nights: 3\n\nNumber of People = 1\nTotal Cost for Day 1 = $73 (Flight) + $20 (Lunch) + $84 (Dinner) + $398 (Accommodation) = $575\nAccommodation Minimum Nights: 1/3\n\nDay 2: March 16, 2022\nCurrent City: Richmond\nTransportation: -\nBreakfast: Perfect Bake, Richmond, Cost: 33 * 1 = $33, Cuisines: \"Desserts, Tea, Italian, Bakery, Cafe, American\"\nAttraction: Maymont, Richmond, Cost: $0 (assuming free entry)\nLunch: Eat All Nite, Richmond, Cost: 55 * 1 = $55, Cuisines: \"Chinese, Bakery, Cafe, Fast Food\"\nDinner: Paradise, Richmond, Cost: 80 * 1 = $80, Cuisines: \"Tea, Pizza, Italian, Fast Food, Seafood\"\nAccommodation: Inviting Brooklyn Studio, Richmond, Cost: 398 * 1 = $398, Maximum Occupancy: 3, House Rules: No parties & No smoking & No children under 10, Minimum Nights: 3\n\nNumber of People = 1\nTotal Cost for Day 2 = $33 (Breakfast) + $55 (Lunch) + $80 (Dinner) + $398 (Accommodation) = $566\nAccommodation Minimum Nights: 2/3\n\nDay 3: March 17, 2022\nCurrent City: Richmond\nTransportation: -\nBreakfast: Sugarcraft Patisserie, Richmond, Cost: 38 * 1 = $38, Cuisines: \"French, Desserts, Fast Food\"\nAttraction: The Poe Museum, Richmond, Cost: $0 (assuming free entry)\nLunch: Defence Bakery, Richmond, Cost: 36 * 1 = $36, Cuisines: \"BBQ, Seafood\"\nDinner: Number 31, Richmond, Cost: 97 * 1 = $97, Cuisines: \"Tea, Chinese, Mexican, Pizza\"\nAccommodation: Inviting Brooklyn Studio, Richmond, Cost: 398 * 1 = $398, Maximum Occupancy: 3, House Rules: No parties & No smoking & No children under 10, Minimum Nights: 3\n\nNumber of People = 1\nTotal Cost for Day 3 = $38 (Breakfast) + $36 (Lunch) + $97 (Dinner) + $398 (Accommodation) = $569\nAccommodation Minimum Nights: 3/3\n\nDay 4: March 18, 2022\nCurrent City: from Richmond to Petersburg\nTransportation: Self-driving, from Richmond to Petersburg, Cost: 1 * 1 = $1\nBreakfast: -\nAttraction: Petersburg National Battlefield, Petersburg, Cost: $0 (assuming free entry)\nLunch: 5 Little Pigs, Petersburg, Cost: 46 * 1 = $46, Cuisines: \"Tea, French, Desserts\"\nDinner: Tea'se Me - Rooftop Tea Boutique, Petersburg, Cost: 49 * 1 = $49, Cuisines: \"Tea, Cafe, Desserts, Seafood\"\nAccommodation: Charming cozy bedroom in Clinton Hill!, Petersburg, Cost: 274 * 1 = $274, Maximum Occupancy: 2, House Rules: No smoking & No parties & No pets, Minimum Nights: 3\n\nNumber of People = 1\nTotal Cost for Day 4 = $1 (Transportation) + $46 (Lunch) + $49 (Dinner) + $274 (Accommodation) = $370\nAccommodation Minimum Nights: 1/3\n\nDay 5: March 19, 2022\nCurrent City: from Petersburg to Charlottesville\nTransportation: Self-driving, from Petersburg to Charlottesville, Cost: 7 * 1 = $7\nBreakfast: -\nAttraction: Monticello, Charlottesville, Cost: $0 (assuming free entry)\nLunch: Mama's Fish House, Charlottesville, Cost: 63 * 1 = $63, Cuisines: \"Tea, Pizza, Desserts, Fast Food\"\nDinner: Restaurant Andre, Charlottesville, Cost: 250 * 1 = $250, Cuisines: \"Desserts, Tea, BBQ, Fast Food, Chinese\"\nAccommodation: Williamsburg Hidden Gem, Charlottesville, Cost: 391 * 1 = $391, Maximum Occupancy: 2, House Rules: No visitors & No smoking, Minimum Nights: 1\n\nNumber of People = 1\nTotal Cost for Day 5 = $7 (Transportation) + $63 (Lunch) + $250 (Dinner) + $391 (Accommodation) = $711\nAccommodation Minimum Nights: 1/1\n\nDay 6: March 20, 2022\nCurrent City: Charlottesville\nTransportation: -\nBreakfast: Baking Bad, Charlottesville, Cost: 22 * 1 = $22, Cuisines: \"Desserts, Tea, Bakery, American, Seafood\"\nAttraction: The Fralin Museum of Art at the University of Virginia, Charlottesville, Cost: $0 (assuming free entry)\nLunch: Madras Cafe, Charlottesville, Cost: 15 * 1 = $15, Cuisines: \"Pizza, Fast Food\"\nDinner: Takamaka, Charlottesville, Cost: 72 * 1 = $72, Cuisines: \"Tea, Pizza, Italian, BBQ, Fast Food\"\nAccommodation: Williamsburg Hidden Gem, Charlottesville, Cost: 391 * 1 = $391, Maximum Occupancy: 2, House Rules: No visitors & No smoking, Minimum Nights: 1\n\nNumber of People = 1\nTotal Cost for Day 6 = $22 (Breakfast) + $15 (Lunch) + $72 (Dinner) + $391 (Accommodation) = $500\nAccommodation Minimum Nights: 1/1\n\nDay 7: March 21, 2022\nCurrent City: from Charlottesville to Philadelphia\nTransportation: Self-driving, from Charlottesville to Philadelphia, Cost: 20 * 1 = $20\nBreakfast: -\nAttraction: -\nLunch: -\nDinner: -\nAccommodation: -\n\nNumber of People = 1\nTotal Cost for Day 7 = $20 (Transportation) = $20\n\nTotal cost across all days = $575 (Day 1) + $566 (Day 2) + $569 (Day 3) + $370 (Day 4) + $711 (Day 5) + $500 (Day 6) + $20 (Day 7) = $3311\n\nUnfortunately, the total cost exceeds the budget of $1,800. Adjustments must be made to the plan to reduce costs, such as selecting cheaper accommodations, meals, and attractions, or removing certain elements from the plan.", "gpt-4-1106-preview_direct_sole-planning_parsed_results": [{"day": 1, "current_city": "from Philadelphia to Richmond", "transportation": "Flight Number: F3730367, from Philadelphia to Richmond, Departure Time: 14:03, Arrival Time: 15:03", "breakfast": "-", "attraction": "Virginia State Capitol, Richmond", "lunch": "Sandpiper Restaurant & Lounge, Richmond", "dinner": "Guang Zhou Chinese Restaurant, Richmond", "accommodation": "Inviting Brooklyn Studio, Richmond"}, {"day": 2, "current_city": "Richmond", "transportation": "-", "breakfast": "Perfect Bake, Richmond", "attraction": "Maymont, Richmond", "lunch": "Eat All Nite, Richmond", "dinner": "Paradise, Richmond", "accommodation": "Inviting Brooklyn Studio, Richmond"}, {"day": 3, "current_city": "Richmond", "transportation": "-", "breakfast": "Sugarcraft Patisserie, Richmond", "attraction": "The Poe Museum, Richmond", "lunch": "Defence Bakery, Richmond", "dinner": "Number 31, Richmond", "accommodation": "Inviting Brooklyn Studio, Richmond"}, {"day": 4, "current_city": "from Richmond to Petersburg", "transportation": "Self-driving, from Richmond to Petersburg", "breakfast": "-", "attraction": "Petersburg National Battlefield, Petersburg", "lunch": "5 Little Pigs, Petersburg", "dinner": "Tea'se Me - Rooftop Tea Boutique, Petersburg", "accommodation": "Charming cozy bedroom in Clinton Hill!, Petersburg"}, {"day": 5, "current_city": "from Petersburg to Charlottesville", "transportation": "Self-driving, from Petersburg to Charlottesville", "breakfast": "-", "attraction": "Monticello, Charlottesville", "lunch": "Mama's Fish House, Charlottesville", "dinner": "Restaurant Andre, Charlottesville", "accommodation": "Williamsburg Hidden Gem, Charlottesville"}, {"day": 6, "current_city": "Charlottesville", "transportation": "-", "breakfast": "Baking Bad, Charlottesville", "attraction": "The Fralin Museum of Art at the University of Virginia, Charlottesville", "lunch": "Madras Cafe, Charlottesville", "dinner": "Takamaka, Charlottesville", "accommodation": "Williamsburg Hidden Gem, Charlottesville"}, {"day": 7, "current_city": "from Charlottesville to Philadelphia", "transportation": "Self-driving, from Charlottesville to Philadelphia", "breakfast": "-", "attraction": "-", "lunch": "-", "dinner": "-", "accommodation": "-"}]}]