[{"gpt-4-1106-preview_direct_sole-planning_results": "Travel Plan:\n\nDay 1:\nCurrent City: from Minneapolis to St. Louis\nTransportation: Flight Number: F3491757, from Minneapolis to St. Louis, Departure Time: 21:30, Arrival Time: 22:50, Cost: $95\nBreakfast: -\nLunch: -\nDinner: El Super Burrito, St. Louis, Cost: $43, Cuisines: \"Tea, Cafe, Mediterranean, Fast Food\"\nAccommodation: Peaceful room in Bushwick, St. Louis, Cost: $79, Maximum Occupancy: 1, House Rules: No Parties, Minimum Nights: 1\n\nNumber of People = 1\nTotal Cost = 1 * $95 + 1 * $43 + 1 * $79 = $217\nAccommodation Minimum Nights: 1/1\n\nDay 2:\nCurrent City: St. Louis\nTransportation: -\nBreakfast: The Latitude - Radisson Blu, St. Louis, Cost: $18, Cuisines: \"Pizza, French, BBQ, American, Seafood\"\nAttraction: Saint Louis Zoo, St. Louis, Cost: $0 (assuming free entry)\nLunch: Burger King, St. Louis, Cost: $21, Cuisines: \"Tea, BBQ, Chinese, American, Seafood\"\nDinner: Moti Mahal Delux, St. Louis, Cost: $73, Cuisines: \"Bakery, BBQ\"\nAccommodation: Peaceful room in Bushwick, St. Louis, Cost: $79, Maximum Occupancy: 1, House Rules: No Parties, Minimum Nights: 1\n\nNumber of people = 1\nTotal cost = 1 * $18 + 1 * $21 + 1 * $73 + 1 * $79 = $191\nAccommodation Minimum Nights: 1/1\n\nDay 3:\nCurrent City: from St. Louis to Minneapolis\nTransportation: Flight Number: F3830375, from St. Louis to Minneapolis, Departure Time: 19:09, Arrival Time: 20:34, Cost: $108\nBreakfast: Startup Cafe, St. Louis, Cost: $31, Cuisines: \"Bakery, Pizza, American, Cafe\"\nAttraction: City Museum, St. Louis, Cost: $0 (assuming free entry)\nLunch: IndoCheen, St. Louis, Cost: $16, Cuisines: \"Tea, Mediterranean, Seafood\"\nDinner: -\nAccommodation: -\n\nNumber of people = 1\nTotal cost = 1 * $108 + 1 * $31 + 1 * $16 = $155\n\nTotal cost across all days = $217 + $191 + $155 = $563\nCuisines: The prompt specifies no cuisines, so all cuisines constraints are satisfied.\n\nNote: The attractions were assumed to be free of charge as no price was provided in the reference information. If there is an entry fee, it should be added to the total cost. The accommodation was chosen based on the lowest price and minimum stay requirements. The transportation was selected based on the cheapest available flight options. The meals were chosen based on the lowest cost while ensuring a variety of cuisines over the trip. The total cost is well within the budget of $1,000.", "gpt-4-1106-preview_direct_sole-planning_parsed_results": [{"day": 1, "current_city": "from Minneapolis to St. Louis", "transportation": "Flight Number: F3491757, from Minneapolis to St. Louis, Departure Time: 21:30, Arrival Time: 22:50", "breakfast": "-", "attraction": "-", "lunch": "-", "dinner": "El Super Burrito, St. Louis", "accommodation": "Peaceful room in Bushwick, St. Louis"}, {"day": 2, "current_city": "St. Louis", "transportation": "-", "breakfast": "The Latitude - Radisson Blu, St. Louis", "attraction": "Saint Louis Zoo, St. Louis;", "lunch": "Burger King, St. Louis", "dinner": "Moti Mahal Delux, St. Louis", "accommodation": "Peaceful room in Bushwick, St. Louis"}, {"day": 3, "current_city": "from St. Louis to Minneapolis", "transportation": "Flight Number: F3830375, from St. Louis to Minneapolis, Departure Time: 19:09, Arrival Time: 20:34", "breakfast": "Startup Cafe, St. Louis", "attraction": "City Museum, St. Louis;", "lunch": "IndoCheen, St. Louis", "dinner": "-", "accommodation": "-"}]}]