[{"gpt-4-1106-preview_direct_sole-planning_results": "Travel Plan:\n\nDay 1: March 12, 2022\nCurrent City: from Salt Lake City to Burbank\nTransportation: Flight Number: F3846241, from Salt Lake City to Burbank, Departure Time: 08:08, Arrival Time: 09:03, Cost: 157 * 7 = $1,099\nBreakfast: - (Assuming breakfast is before the flight or during the flight)\nAttraction: Warner Bros. Studio Tour Hollywood, Burbank, Cost: $0 (Assuming the attraction cost is not provided and is free)\nLunch: Mellow Mushroom, Burbank, Cost: 69 * 7 = $483, Cuisines: \"Tea, Pizza, Mexican, Fast Food, Cafe, American\"\nDinner: Caffe Tonino, Burbank, Cost: 28 * 7 = $196, Cuisines: \"Tea, Desserts\"\nAccommodation: Pleasant 1 bedroom apartment in Harlem Brownstone, Burbank, Cost: 500 * 2 = $1,000 (2 apartments needed for 7 people, maximum occupancy 5), Maximum Occupancy: 5, House Rules: No parties & No smoking, Minimum Nights: 1\n\nNumber of People = 7\nTotal Cost for Day 1 = $1,099 + $483 + $196 + $1,000 = $2,778\nAccommodation Minimum Nights: 1/1\n\nDay 2: March 13, 2022\nCurrent City: Burbank\nTransportation: -\nBreakfast: Hard Rock Cafe, Burbank, Cost: 33 * 7 = $231, Cuisines: \"Desserts, Tea, Bakery, BBQ, Chinese, Indian\"\nAttraction 1: The Mystic Museum, Burbank, Cost: $0 (Assuming the attraction cost is not provided and is free)\nAttraction 2: Stough Canyon Nature Center, Burbank, Cost: $0 (Assuming the attraction cost is not provided and is free)\nLunch: KB's Kulfi & Icecream, Burbank, Cost: 10 * 7 = $70, Cuisines: \"Tea, Pizza, Bakery, Fast Food, Indian\"\nDinner: Deepak Vaishno Dhaba, Burbank, Cost: 32 * 7 = $224, Cuisines: \"Italian, BBQ, Bakery, Fast Food, Indian, Seafood\"\nAccommodation: Pleasant 1 bedroom apartment in Harlem Brownstone, Burbank, Cost: 500 * 2 = $1,000 (2 apartments needed for 7 people, maximum occupancy 5), Maximum Occupancy: 5, House Rules: No parties & No smoking, Minimum Nights: 1\n\nNumber of People = 7\nTotal Cost for Day 2 = $231 + $70 + $224 + $1,000 = $1,525\nAccommodation Minimum Nights: 1/1\n\nDay 3: March 14, 2022\nCurrent City: from Burbank to Salt Lake City\nTransportation: Flight Number: F3977100, from Burbank to Salt Lake City, Departure Time: 09:29, Arrival Time: 12:16, Cost: 181 * 7 = $1,267\nBreakfast: - (Assuming breakfast is before the flight or during the flight)\nAttraction: - (No time for attractions due to the return flight)\nLunch: - (Assuming lunch is during the flight or after arrival)\nDinner: - (Assuming dinner is after arrival back in Salt Lake City)\nAccommodation: -\n\nNumber of People = 7\nTotal Cost for Day 3 = $1,267\nAccommodation Minimum Nights: -\n\nTotal cost across all days = $2,778 + $1,525 + $1,267 = $5,570\n\nRemaining Budget: $7,600 - $5,570 = $2,030\n\nCuisines: The prompt specifies no specific cuisines, so all cuisine constraints are satisfied.\n\nNote: The costs for attractions are assumed to be free as no pricing information is provided. If there are costs associated with the attractions, they would need to be factored into the budget. The accommodation choice adheres to the requirement for entire rooms and the minimum nights stay.", "gpt-4-1106-preview_direct_sole-planning_parsed_results": [{"day": 1, "current_city": "from Salt Lake City to Burbank", "transportation": "Flight Number: F3846241, from Salt Lake City to Burbank, Departure Time: 08:08, Arrival Time: 09:03", "breakfast": "-", "attraction": "Warner Bros. Studio Tour Hollywood, Burbank;", "lunch": "Mellow Mushroom, Burbank", "dinner": "Caffe Tonino, Burbank", "accommodation": "Pleasant 1 bedroom apartment in Harlem Brownstone, Burbank"}, {"day": 2, "current_city": "Burbank", "transportation": "-", "breakfast": "Hard Rock Cafe, Burbank", "attraction": "The Mystic Museum, Burbank;Stough Canyon Nature Center, Burbank;", "lunch": "KB's Kulfi & Icecream, Burbank", "dinner": "Deepak Vaishno Dhaba, Burbank", "accommodation": "Pleasant 1 bedroom apartment in Harlem Brownstone, Burbank"}, {"day": 3, "current_city": "from Burbank to Salt Lake City", "transportation": "Flight Number: F3977100, from Burbank to Salt Lake City, Departure Time: 09:29, Arrival Time: 12:16", "breakfast": "-", "attraction": "-", "lunch": "-", "dinner": "-", "accommodation": "-"}]}]