[{"gpt-4-1106-preview_direct_sole-planning_results": "Day 1:\nCurrent City: from Key West to Evansville\nTransportation: Self-driving, from Key West to Evansville, Duration: 18 hours 21 mins, Distance: 1,961 km, Cost: 98 * (Ceiling of 1/5) = 98\nBreakfast: -\nAttraction: -\nLunch: -\nDinner: -\nAccommodation: 1BR in Newly Renovated Apartment - Rm C, Bushwick!, Evansville, Cost: 288, Maximum Occupancy: 2, House Rules: No visitors & No children under 10 & No smoking, Minimum Nights: 1\n\nNumber of People = 1\nTotal Cost = 98 + 288 = 386\nAccommodation Minimum Nights: 1/1\n\nDay 2:\nCurrent City: Evansville\nTransportation: -\nBreakfast: Blue Orchid Thai Restaurant, Evansville, Cost: 86, Cuisines: \"Tea, Mexican, American, Desserts\"\nAttraction: Mesker Park Zoo, Evansville, Cost: -\nLunch: Punjabi Restaurant, Evansville, Cost: 29, Cuisines: \"Cafe, Bakery, Desserts, Fast Food\"\nDinner: Pao King, Evansville, Cost: 16, Cuisines: \"Pizza, Mexican, Bakery, Cafe, Seafood\"\nAccommodation: 1BR in Newly Renovated Apartment - Rm C, Bushwick!, Evansville, Cost: 288, Maximum Occupancy: 2, House Rules: No visitors & No children under 10 & No smoking, Minimum Nights: 1\n\nNumber of People = 1\nTotal Cost = 86 + 29 + 16 + 288 = 419\nAccommodation Minimum Nights: 1/1\n\nDay 3:\nCurrent City: from Evansville to South Bend\nTransportation: Self-driving, from Evansville to South Bend, Duration: 5 hours 1 min, Distance: 512 km, Cost: 25 * (Ceiling of 1/5) = 25\nBreakfast: J. Christopher's, Evansville, Cost: 39, Cuisines: \"Tea, Cafe, Desserts, Seafood\"\nAttraction: Burdette Park, Evansville, Cost: -\nLunch: Goli Vada Pav No. 1, Evansville, Cost: 28, Cuisines: \"Chinese, BBQ, Seafood, Fast Food\"\nDinner: -\nAccommodation: Just Right in Lovely Greenpoint, South Bend, Cost: 614, Maximum Occupancy: 1, House Rules: No smoking & No visitors, Minimum Nights: 7\n\nNumber of People = 1\nTotal Cost = 25 + 39 + 28 + 614 = 706\nAccommodation Minimum Nights: 1/7\n\nDay 4:\nCurrent City: South Bend\nTransportation: -\nBreakfast: Our Story Bistro & Tea Room, South Bend, Cost: 10, Cuisines: \"Tea, Pizza, Italian, BBQ, Mediterranean, Seafood\"\nAttraction: Studebaker National Museum, South Bend, Cost: -\nLunch: It\u6f74\u7c79 Sinful, South Bend, Cost: 26, Cuisines: \"Desserts, French, BBQ, Bakery, Seafood\"\nDinner: MOB Brewpub, South Bend, Cost: 67, Cuisines: \"Cafe, Mexican, American, BBQ\"\nAccommodation: Just Right in Lovely Greenpoint, South Bend, Cost: 614, Maximum Occupancy: 1, House Rules: No smoking & No visitors, Minimum Nights: 7\n\nNumber of People = 1\nTotal Cost = 10 + 26 + 67 + 614 = 717\nAccommodation Minimum Nights: 2/7\n\nDay 5:\nCurrent City: from South Bend to Key West\nTransportation: Self-driving, from South Bend to Key West, Duration: 22 hours 38 mins, Distance: 2,406 km, Cost: 120 * (Ceiling of 1/5) = 120\nBreakfast: Krips Restaurant, South Bend, Cost: 59, Cuisines: \"Tea, Mediterranean, Fast Food\"\nAttraction: -\nLunch: -\nDinner: -\nAccommodation: -\n\nNumber of People = 1\nTotal Cost = 120 + 59 = 179\n\nTotal cost across all days = 386 + 419 + 706 + 717 + 179 = 2407\n\nUnfortunately, the total cost exceeds the budget of $2,000. To stay within budget, we need to make adjustments. Let's choose the cheapest options for meals and accommodations where possible.\n\nAdjusted Travel Plan:\n\nDay 1:\nCurrent City: from Key West to Evansville\nTransportation: Self-driving, from Key West to Evansville, Duration: 18 hours 21 mins, Distance: 1,961 km, Cost: 98 * (Ceiling of 1/5) = 98\nBreakfast: -\nAttraction: -\nLunch: -\nDinner: -\nAccommodation: 1BR in Newly Renovated Apartment - Rm C, Bushwick!, Evansville, Cost: 288, Maximum Occupancy: 2, House Rules: No visitors & No children under 10 & No smoking, Minimum Nights: 1\n\nTotal Cost for Day 1 = 98 + 288 = 386\n\nDay 2:\nCurrent City: Evansville\nTransportation: -\nBreakfast: Punjabi Restaurant, Evansville, Cost: 29, Cuisines: \"Cafe, Bakery, Desserts, Fast Food\"\nAttraction: Mesker Park Zoo, Evansville, Cost: -\nLunch: Goli Vada Pav No. 1, Evansville, Cost: 28, Cuisines: \"Chinese, BBQ, Seafood, Fast Food\"\nDinner: Pao King, Evansville, Cost: 16, Cuisines: \"Pizza, Mexican, Bakery, Cafe, Seafood\"\nAccommodation: 1BR in Newly Renovated Apartment - Rm C, Bushwick!, Evansville, Cost: 288, Maximum Occupancy: 2, House Rules: No visitors & No children under 10 & No smoking, Minimum Nights: 1\n\nTotal Cost for Day 2 = 29 + 28 + 16 + 288 = 361\n\nDay 3:\nCurrent City: from Evansville to South Bend\nTransportation: Self-driving, from Evansville to South Bend, Duration: 5 hours 1 min, Distance: 512 km, Cost: 25 * (Ceiling of 1/5) = 25\nBreakfast: -\nAttraction: Burdette Park, Evansville, Cost: -\nLunch: -\nDinner: -\nAccommodation: Just Right in Lovely Greenpoint, South Bend, Cost: 614, Maximum Occupancy: 1, House Rules: No smoking & No visitors, Minimum Nights: 7\n\nTotal Cost for Day 3 = 25 + 614 = 639\n\nDay 4:\nCurrent City: South Bend\nTransportation: -\nBreakfast: Our Story Bistro & Tea Room, South Bend, Cost: 10, Cuisines: \"Tea, Pizza, Italian, BBQ, Mediterranean, Seafood\"\nAttraction: Studebaker National Museum, South Bend, Cost: -\nLunch: It\u6f74\u7c79 Sinful, South Bend, Cost: 26, Cuisines: \"Desserts, French, BBQ, Bakery, Seafood\"\nDinner: -\nAccommodation: Just Right in Lovely Greenpoint, South Bend, Cost: 614, Maximum Occupancy: 1, House Rules: No smoking & No visitors, Minimum Nights: 7\n\nTotal Cost for Day 4 = 10 + 26 + 614 = 650\n\nDay 5:\nCurrent City: from South Bend to Key West\nTransportation: Self-driving, from South Bend to Key West, Duration: 22 hours 38 mins, Distance: 2,406 km, Cost: 120 * (Ceiling of 1/5) = 120\nBreakfast: -\nAttraction: -\nLunch: -\nDinner: -\nAccommodation: -\n\nTotal Cost for Day 5 = 120\n\nTotal cost across all days = 386 + 361 + 639 + 650 + 120 = 2156\n\nThe adjusted plan still exceeds the budget. To further reduce costs, we can opt for the cheapest meal options and remove any non-essential meals or attractions. Additionally, we may need to find cheaper accommodation options or reduce the number of nights stayed. However, since the provided data does not include cheaper alternatives that meet the requirements, we cannot adjust the plan further without additional information.", "gpt-4-1106-preview_direct_sole-planning_parsed_results": [{"day": 1, "current_city": "from Key West to Evansville", "transportation": "Self-driving, from Key West to Evansville, Duration: 18 hours 21 mins, Distance: 1,961 km", "breakfast": "-", "attraction": "-", "lunch": "-", "dinner": "-", "accommodation": "1BR in Newly Renovated Apartment - Rm C, Bushwick!, Evansville"}, {"day": 2, "current_city": "Evansville", "transportation": "-", "breakfast": "Blue Orchid Thai Restaurant, Evansville", "attraction": "Mesker Park Zoo, Evansville", "lunch": "Punjabi Restaurant, Evansville", "dinner": "Pao King, Evansville", "accommodation": "1BR in Newly Renovated Apartment - Rm C, Bushwick!, Evansville"}, {"day": 3, "current_city": "from Evansville to South Bend", "transportation": "Self-driving, from Evansville to South Bend, Duration: 5 hours 1 min, Distance: 512 km", "breakfast": "J. Christopher's, Evansville", "attraction": "Burdette Park, Evansville", "lunch": "Goli Vada Pav No. 1, Evansville", "dinner": "-", "accommodation": "Just Right in Lovely Greenpoint, South Bend"}, {"day": 4, "current_city": "South Bend", "transportation": "-", "breakfast": "Our Story Bistro & Tea Room, South Bend", "attraction": "Studebaker National Museum, South Bend", "lunch": "It\u6f74\u7c79 Sinful, South Bend", "dinner": "MOB Brewpub, South Bend", "accommodation": "Just Right in Lovely Greenpoint, South Bend"}, {"day": 5, "current_city": "from South Bend to Key West", "transportation": "Self-driving, from South Bend to Key West, Duration: 22 hours 38 mins, Distance: 2,406 km", "breakfast": "Krips Restaurant, South Bend", "attraction": "-", "lunch": "-", "dinner": "-", "accommodation": "-"}]}]