[{"gpt-4-1106-preview_direct_sole-planning_results": "Travel Plan:\n\nDay 1:\nCurrent City: from Atlanta to Knoxville\nTransportation: Flight Number: F3645549, from Atlanta to Knoxville, Departure Time: 08:13, Arrival Time: 09:00, Cost: 35\nBreakfast: -\nAttraction: World's Fair Park, Knoxville, Cost: -\nLunch: Les 3 Brasseurs, Knoxville, Cost: 24, Cuisines: \"Desserts, Pizza, Italian, Cafe, Indian\"\nDinner: Cafe Arabelle, Knoxville, Cost: 29, Cuisines: \"French, BBQ, Desserts, Seafood\"\nAccommodation: Cozy Private Room in Chinatown/ Lower East Side, Knoxville, Cost: 132, Maximum Occupancy: 2, House Rules: No pets & No visitors, Minimum Nights: 7\n\nNumber of People = 1 (assuming 1 person since the number of travelers is not specified)\nTotal Cost = 35 + 24 + 29 + 132 = 220\nAccommodation Minimum Nights: 1/7\n\nDay 2:\nCurrent City: Knoxville\nTransportation: -\nBreakfast: Mamagoto, Knoxville, Cost: 14, Cuisines: \"Indian, Mediterranean, Desserts, Seafood\"\nAttraction: Knoxville Museum of Art, Knoxville, Cost: -\nLunch: Punjabi Flavour, Knoxville, Cost: 41, Cuisines: \"Tea, Bakery, Cafe, Indian, Seafood\"\nDinner: Open Kitchen, Knoxville, Cost: 13, Cuisines: \"Pizza, Bakery, BBQ, Cafe, Indian, Mediterranean\"\nAccommodation: Cozy Private Room in Chinatown/ Lower East Side, Knoxville, Cost: 132, Maximum Occupancy: 2, House Rules: No pets & No visitors, Minimum Nights: 7\n\nNumber of people = 1\nTotal cost = 14 + 41 + 13 + 132 = 200\nAccommodation Minimum Nights: 2/7\n\nDay 3:\nCurrent City: from Knoxville to Atlanta\nTransportation: Flight Number: F3517130, from Knoxville to Atlanta, Departure Time: 05:32, Arrival Time: 06:28, Cost: 30\nBreakfast: -\nAttraction: Sunsphere, Knoxville, Cost: -\nLunch: Tandoori Tadka, Knoxville, Cost: 23, Cuisines: \"Chinese, Pizza, Desserts, Fast Food\"\nDinner: -\nAccommodation: -\n\nNumber of people = 1\nTotal cost = 30 + 23 = 53\n\nTotal cost across all days = 220 + 200 + 53 = 473\nCuisines: The prompt specifies no cuisines, so all cuisines constraints are satisfied.\n\nNote: Since the number of travelers was not specified, I assumed a single traveler for this plan. If there are more travelers, especially children under 10 as mentioned, the accommodation choice may need to be adjusted to fit the house rules and occupancy limits. Additionally, the costs would increase proportionally with the number of travelers. The budget of $1,000 is sufficient for a single traveler as per this plan.", "gpt-4-1106-preview_direct_sole-planning_parsed_results": [{"day": 1, "current_city": "from Atlanta to Knoxville", "transportation": "Flight Number: F3645549, from Atlanta to Knoxville, Departure Time: 08:13, Arrival Time: 09:00", "breakfast": "-", "attraction": "World's Fair Park, Knoxville;", "lunch": "Les 3 Brasseurs, Knoxville", "dinner": "Cafe Arabelle, Knoxville", "accommodation": "Cozy Private Room in Chinatown/ Lower East Side, Knoxville"}, {"day": 2, "current_city": "Knoxville", "transportation": "-", "breakfast": "Mamagoto, Knoxville", "attraction": "Knoxville Museum of Art, Knoxville;", "lunch": "Punjabi Flavour, Knoxville", "dinner": "Open Kitchen, Knoxville", "accommodation": "Cozy Private Room in Chinatown/ Lower East Side, Knoxville"}, {"day": 3, "current_city": "from Knoxville to Atlanta", "transportation": "Flight Number: F3517130, from Knoxville to Atlanta, Departure Time: 05:32, Arrival Time: 06:28", "breakfast": "-", "attraction": "Sunsphere, Knoxville;", "lunch": "Tandoori Tadka, Knoxville", "dinner": "-", "accommodation": "-"}]}]