[{"gpt-4-1106-preview_direct_sole-planning_results": "Travel Plan:\n\nDay 1:\nCurrent City: from Appleton to Charlotte\nTransportation: Flight Number: F3796721, from Appleton to Charlotte, Departure Time: 06:58, Arrival Time: 10:25, Cost: 314\nBreakfast: -\nAttraction: Freedom Park, Charlotte, Cost: 0 (Free Entry)\nLunch: Prince Snacks & Momo's Point, Charlotte, Cost: 11, Cuisines: \"Tea, Cafe, Desserts, Fast Food\"\nDinner: Chicken Inn, Charlotte, Cost: 18, Cuisines: \"Tea, Pizza, Italian, BBQ, Seafood\"\nAccommodation: Elegant Studio Apt in Prospect Heights, Charlotte, Cost: 640, Maximum Occupancy: 5, House Rules: No parties, Minimum Nights: 2\n\nNumber of People = 7\nTotal Cost = 7 * 314 + 7 * 11 + 7 * 18 + Ceiling(7/5) * 640 = 2198 + 77 + 126 + 2 * 640 = 3681\nAccommodation Minimum Nights: 1/2\n\nDay 2:\nCurrent City: Charlotte\nTransportation: -\nBreakfast: Olive Tree Cafe, Charlotte, Cost: 23, Cuisines: \"Tea, Chinese, Desserts\"\nAttraction: Levine Museum of the New South, Charlotte, Cost: 0 (Assumed Free Entry)\nLunch: China Garden, Charlotte, Cost: 14, Cuisines: \"Tea, Mexican, BBQ, Mediterranean\"\nDinner: Grover's - The Baker Shop, Charlotte, Cost: 30, Cuisines: \"Pizza, Bakery, Chinese, Indian, Seafood\"\nAccommodation: Elegant Studio Apt in Prospect Heights, Charlotte, Cost: 640, Maximum Occupancy: 5, House Rules: No parties, Minimum Nights: 2\n\nNumber of people = 7\nTotal cost = 7 * 23 + 7 * 14 + 7 * 30 + Ceiling(7/5) * 640 = 161 + 98 + 210 + 2 * 640 = 1749\nAccommodation Minimum Nights: 2/2\n\nDay 3:\nCurrent City: from Charlotte to Appleton\nTransportation: Flight Number: F3788979, from Charlotte to Appleton, Departure Time: 22:52, Arrival Time: 00:07, Cost: 212\nBreakfast: Burger King, Charlotte, Cost: 15, Cuisines: \"Cafe, Pizza, Indian, Desserts\"\nAttraction: The Mint Museum, Charlotte, Cost: 0 (Assumed Free Entry)\nLunch: Bansi Vihar, Charlotte, Cost: 45, Cuisines: \"Cafe, Pizza, Bakery, Desserts\"\nDinner: -\nAccommodation: -\n\nNumber of people = 7\nTotal cost = 7 * 212 + 7 * 15 + 7 * 45 = 1484 + 105 + 315 = 1904\n\nTotal cost across all days = 3681 + 1749 + 1904 = 7334\nCuisines: The prompt specifies no cuisines, so all cuisines constraints are satisfied.\nHouse Rules: The accommodations chosen allow visitors, as per the house rules.\n\nPlease note that the cost for attractions is assumed to be free as no price information was provided. If there is an entry fee for the attractions, it should be added to the total cost. Additionally, the cost for breakfast on Day 1 is not included as the flight departs early in the morning, and it is assumed that the group will have breakfast either before the flight or on board.", "gpt-4-1106-preview_direct_sole-planning_parsed_results": [{"day": 1, "current_city": "from Appleton to Charlotte", "transportation": "Flight Number: F3796721, from Appleton to Charlotte, Departure Time: 06:58, Arrival Time: 10:25", "breakfast": "-", "attraction": "Freedom Park, Charlotte;", "lunch": "Prince Snacks & Momo's Point, Charlotte", "dinner": "Chicken Inn, Charlotte", "accommodation": "Elegant Studio Apt in Prospect Heights, Charlotte"}, {"day": 2, "current_city": "Charlotte", "transportation": "-", "breakfast": "Olive Tree Cafe, Charlotte", "attraction": "Levine Museum of the New South, Charlotte;", "lunch": "China Garden, Charlotte", "dinner": "Grover's - The Baker Shop, Charlotte", "accommodation": "Elegant Studio Apt in Prospect Heights, Charlotte"}, {"day": 3, "current_city": "from Charlotte to Appleton", "transportation": "Flight Number: F3788979, from Charlotte to Appleton, Departure Time: 22:52, Arrival Time: 00:07", "breakfast": "Burger King, Charlotte", "attraction": "The Mint Museum, Charlotte;", "lunch": "Bansi Vihar, Charlotte", "dinner": "-", "accommodation": "-"}]}]