[{"gpt-4-1106-preview_direct_sole-planning_results": "Travel Plan:\n\nDay 1: March 18th\nCurrent City: from Ithaca to Newark\nTransportation: Flight Number: F3924332, from Ithaca to Newark, Departure Time: 05:59, Arrival Time: 07:41, Cost: $124 (62 * 2)\nBreakfast: Artistry, Newark, Cost: $158 (79 * 2), Cuisines: \"Cafe, Pizza, Desserts, Seafood\"\nAttraction: The Newark Museum of Art, Newark\nLunch: Angeethi Restaurant, Newark, Cost: $24 (12 * 2), Cuisines: \"French, BBQ, Fast Food\"\nDinner: Mirage Restro Bar, Newark, Cost: $102 (51 * 2), Cuisines: \"Bakery, American, Desserts, Fast Food\"\nAccommodation: Gramercy One Bedroom w Two Beds, Newark, Cost: $485, Maximum Occupancy: 4, House Rules: No visitors & No children under 10, Minimum Nights: 7\n\nNumber of People = 2\nTotal Cost = 124 + 158 + 24 + 102 + 485 = $893\nAccommodation Minimum Nights: 1/7\n\nDay 2: March 19th\nCurrent City: Newark\nTransportation: -\nBreakfast: Harmann Restaurant, Newark, Cost: $114 (57 * 2), Cuisines: \"Tea, Cafe, American, Fast Food\"\nAttraction: Military Park, Newark\nLunch: Drifters Cafe, Newark, Cost: $48 (24 * 2), Cuisines: \"Tea, BBQ\"\nDinner: Kettle & Kegs, Newark, Cost: $134 (67 * 2), Cuisines: \"Fast Food, Seafood, Mediterranean, Italian\"\nAccommodation: Gramercy One Bedroom w Two Beds, Newark, Cost: $485, Maximum Occupancy: 4, House Rules: No visitors & No children under 10, Minimum Nights: 7\n\nNumber of People = 2\nTotal Cost = 114 + 48 + 134 + 485 = $781\nAccommodation Minimum Nights: 2/7\n\nDay 3: March 20th\nCurrent City: from Newark to Ithaca\nTransportation: Flight Number: F3923348, from Newark to Ithaca, Departure Time: 17:44, Arrival Time: 18:46, Cost: $84 (42 * 2)\nBreakfast: Escape Terrace Bar Kitchen, Newark, Cost: $200 (100 * 2), Cuisines: \"Tea, Cafe, Bakery, Chinese, Seafood\"\nAttraction: Branch Brook Park, Newark\nLunch: Bernardo's, Newark, Cost: $168 (84 * 2), Cuisines: \"Desserts, Pizza, BBQ, American, Mediterranean\"\nDinner: -\nAccommodation: -\n\nNumber of People = 2\nTotal Cost = 84 + 200 + 168 = $452\n\nTotal cost across all days = 893 + 781 + 452 = $2126\n\nUnfortunately, the total cost exceeds the budget of $1,200. We need to adjust the plan to fit within the budget.\n\nAdjusted Travel Plan:\n\nDay 1: March 18th\nCurrent City: from Ithaca to Newark\nTransportation: Flight Number: F3924332, from Ithaca to Newark, Departure Time: 05:59, Arrival Time: 07:41, Cost: $124 (62 * 2)\nBreakfast: Angeethi Restaurant, Newark, Cost: $24 (12 * 2), Cuisines: \"French, BBQ, Fast Food\"\nAttraction: The Newark Museum of Art, Newark\nLunch: Mirage Restro Bar, Newark, Cost: $102 (51 * 2), Cuisines: \"Bakery, American, Desserts, Fast Food\"\nDinner: Drifters Cafe, Newark, Cost: $48 (24 * 2), Cuisines: \"Tea, BBQ\"\nAccommodation: Contemporary Brooklyn Lifestyle Apt /JFK Airport, Newark, Cost: $610, Maximum Occupancy: 6, House Rules: No pets, Minimum Nights: 2\n\nNumber of People = 2\nTotal Cost = 124 + 24 + 102 + 48 + 610 = $908\nAccommodation Minimum Nights: 1/2\n\nDay 2: March 19th\nCurrent City: Newark\nTransportation: -\nBreakfast: Angeethi Restaurant, Newark, Cost: $24 (12 * 2), Cuisines: \"French, BBQ, Fast Food\"\nAttraction: Military Park, Newark\nLunch: Drifters Cafe, Newark, Cost: $48 (24 * 2), Cuisines: \"Tea, BBQ\"\nDinner: Mirage Restro Bar, Newark, Cost: $102 (51 * 2), Cuisines: \"Bakery, American, Desserts, Fast Food\"\nAccommodation: Contemporary Brooklyn Lifestyle Apt /JFK Airport, Newark, Cost: $610, Maximum Occupancy: 6, House Rules: No pets, Minimum Nights: 2\n\nNumber of People = 2\nTotal Cost = 24 + 48 + 102 + 610 = $784\nAccommodation Minimum Nights: 2/2\n\nDay 3: March 20th\nCurrent City: from Newark to Ithaca\nTransportation: Flight Number: F3923348, from Newark to Ithaca, Departure Time: 17:44, Arrival Time: 18:46, Cost: $84 (42 * 2)\nBreakfast: Angeethi Restaurant, Newark, Cost: $24 (12 * 2), Cuisines: \"French, BBQ, Fast Food\"\nAttraction: Branch Brook Park, Newark\nLunch: Drifters Cafe, Newark, Cost: $48 (24 * 2), Cuisines: \"Tea, BBQ\"\nDinner: -\nAccommodation: -\n\nNumber of People = 2\nTotal Cost = 84 + 24 + 48 = $156\n\nTotal cost across all days = 908 + 784 + 156 = $1848\n\nThe adjusted plan still exceeds the budget. We need to make further adjustments or consider different transportation or accommodation options to stay within the $1,200 budget. Unfortunately, with the given data and constraints, it is not possible to create a travel plan that fits the budget and meets all the requirements.", "gpt-4-1106-preview_direct_sole-planning_parsed_results": [{"day": 1, "current_city": "from Ithaca to Newark", "transportation": "Flight Number: F3924332, from Ithaca to Newark, Departure Time: 05:59, Arrival Time: 07:41", "breakfast": "Artistry, Newark", "attraction": "The Newark Museum of Art, Newark;", "lunch": "Angeethi Restaurant, Newark", "dinner": "Mirage Restro Bar, Newark", "accommodation": "Gramercy One Bedroom w Two Beds, Newark"}, {"day": 2, "current_city": "Newark", "transportation": "-", "breakfast": "Harmann Restaurant, Newark", "attraction": "Military Park, Newark;", "lunch": "Drifters Cafe, Newark", "dinner": "Kettle & Kegs, Newark", "accommodation": "Gramercy One Bedroom w Two Beds, Newark"}, {"day": 3, "current_city": "from Newark to Ithaca", "transportation": "Flight Number: F3923348, from Newark to Ithaca, Departure Time: 17:44, Arrival Time: 18:46", "breakfast": "Escape Terrace Bar Kitchen, Newark", "attraction": "Branch Brook Park, Newark;", "lunch": "Bernardo's, Newark", "dinner": "-", "accommodation": "-"}]}]