[{"gpt-4-1106-preview_direct_sole-planning_results": "Travel Plan:\n\nDay 1: March 2, 2022\nCurrent City: from Sarasota to Philadelphia\nTransportation: Flight Number: F3797423, from Sarasota to Philadelphia, Departure Time: 11:54, Arrival Time: 14:46, Cost: $289\nBreakfast: - (Assuming breakfast is before the flight)\nAttraction: Liberty Bell, Philadelphia, Cost: $0 (Assuming free entry)\nLunch: Gurdas Ram Jalebi Wala, Philadelphia, Cost: $20, Cuisines: \"Cafe, Desserts, Bakery, BBQ\"\nDinner: Bangla Sweet Corner, Philadelphia, Cost: $14, Cuisines: \"Cafe, BBQ, Fast Food\"\nAccommodation: Industrial Loft Living in NYC, Philadelphia, Cost: $178, Maximum Occupancy: 3, House Rules: No smoking, Minimum Nights: 4\n\nNumber of People = 1 (Assuming 1 traveler based on the provided data)\nTotal Cost = $289 (Flight) + $20 (Lunch) + $14 (Dinner) + $178 (Accommodation) = $501\nAccommodation Minimum Nights: 1/4\n\nDay 2: March 3, 2022\nCurrent City: Philadelphia\nTransportation: -\nBreakfast: Hong Kong Cafe, Philadelphia, Cost: $47, Cuisines: \"Tea, Pizza, Italian, BBQ, Cafe\"\nAttraction: Philadelphia's Magic Gardens, Philadelphia, Cost: $0 (Assuming free entry)\nLunch: Brothers Dhaba, Philadelphia, Cost: $52, Cuisines: \"Cafe, Desserts, Seafood\"\nDinner: Red Mesa Cantina, Philadelphia, Cost: $36, Cuisines: \"Tea, Cafe, American, Fast Food\"\nAccommodation: Industrial Loft Living in NYC, Philadelphia, Cost: $178, Maximum Occupancy: 3, House Rules: No smoking, Minimum Nights: 4\n\nNumber of People = 1\nTotal Cost = $47 (Breakfast) + $52 (Lunch) + $36 (Dinner) + $178 (Accommodation) = $313\nAccommodation Minimum Nights: 2/4\n\nDay 3: March 4, 2022\nCurrent City: from Philadelphia to Sarasota\nTransportation: Flight Number: F3633008, from Philadelphia to Sarasota, Departure Time: 08:06, Arrival Time: 10:51, Cost: $246\nBreakfast: - (Assuming breakfast is before the flight)\nAttraction: The Franklin Institute, Philadelphia, Cost: $0 (Assuming free entry)\nLunch: Marukame Udon, Philadelphia, Cost: $100, Cuisines: \"Tea, Pizza, Italian, BBQ, Fast Food, Chinese\"\nDinner: - (Assuming dinner is after arrival in Sarasota)\nAccommodation: -\n\nNumber of People = 1\nTotal Cost = $246 (Flight) + $100 (Lunch) = $346\n\nTotal cost across all days = $501 + $313 + $346 = $1160\nBudget: $2,100\nRemaining Budget: $2,100 - $1160 = $940\n\nCuisines: The prompt specifies no cuisines, so all cuisines constraints are satisfied.\nHouse Rules: All accommodations chosen abide by the house rules specified in the query.\n\nPlease note that the attractions chosen are assumed to be free as no price information is provided. If there are entry fees, they would need to be factored into the total cost. Additionally, the accommodation chosen requires a minimum of 4 nights, which exceeds the trip duration, but it is the cheapest option available and fits within the budget.", "gpt-4-1106-preview_direct_sole-planning_parsed_results": [{"day": 1, "current_city": "from Sarasota to Philadelphia", "transportation": "Flight Number: F3797423, from Sarasota to Philadelphia, Departure Time: 11:54, Arrival Time: 14:46", "breakfast": "-", "attraction": "Liberty Bell, Philadelphia;", "lunch": "Gurdas Ram Jalebi Wala, Philadelphia", "dinner": "Bangla Sweet Corner, Philadelphia", "accommodation": "Industrial Loft Living in NYC, Philadelphia"}, {"day": 2, "current_city": "Philadelphia", "transportation": "-", "breakfast": "Hong Kong Cafe, Philadelphia", "attraction": "Philadelphia's Magic Gardens, Philadelphia;", "lunch": "Brothers Dhaba, Philadelphia", "dinner": "Red Mesa Cantina, Philadelphia", "accommodation": "Industrial Loft Living in NYC, Philadelphia"}, {"day": 3, "current_city": "from Philadelphia to Sarasota", "transportation": "Flight Number: F3633008, from Philadelphia to Sarasota, Departure Time: 08:06, Arrival Time: 10:51", "breakfast": "-", "attraction": "The Franklin Institute, Philadelphia;", "lunch": "Marukame Udon, Philadelphia", "dinner": "-", "accommodation": "-"}]}]