[{"gpt-4-1106-preview_direct_sole-planning_results": "Travel Plan:\n\nDay 1: March 12, 2022\nCurrent City: from Houston to Pensacola\nTransportation: Self-driving, from Houston to Pensacola, duration: 7 hours 38 mins, distance: 845 km, Cost: $42 * (2/5 ceiling) = $42 * 1 = $42\n\nBreakfast: - (Assuming breakfast is had before departure)\nAttraction: Historic Pensacola Village, Pensacola, Cost: Free\nLunch: Frog Hollow Tavern, Pensacola, Cost: $20 * 2 = $40, Cuisines: \"American, BBQ, Fast Food, Cafe, Indian\"\nDinner: Berry Patch Restaurant, Pensacola, Cost: $13 * 2 = $26, Cuisines: \"Bakery, BBQ, Desserts, Seafood\"\nAccommodation: Chic Historic Harlem Brownstone, Pensacola, Cost: $526 * (2/2 ceiling) = $526 * 1 = $526, Maximum Occupancy: 2, House Rules: No smoking, Minimum Nights: 3\n\nNumber of People = 2\nTotal Cost = $42 + $40 + $26 + $526 = $634\nAccommodation Minimum Nights: 1/3\n\nDay 2: March 13, 2022\nCurrent City: Pensacola\nTransportation: -\nBreakfast: Bailey's Bar-B-Que, Pensacola, Cost: $13 * 2 = $26, Cuisines: \"Tea, Bakery, Mediterranean\"\nAttraction: Pensacola Museum of Art, Pensacola, Cost: Free\nLunch: Watershed Cafe, Pensacola, Cost: $12 * 2 = $24, Cuisines: \"Chinese, BBQ, Desserts\"\nDinner: Blue Point Grill, Pensacola, Cost: $75 * 2 = $150, Cuisines: \"French, Indian, Cafe, Desserts\"\nAccommodation: Chic Historic Harlem Brownstone, Pensacola, Cost: $526, Maximum Occupancy: 2, House Rules: No smoking, Minimum Nights: 3\n\nNumber of People = 2\nTotal Cost = $26 + $24 + $150 + $526 = $726\nAccommodation Minimum Nights: 2/3\n\nDay 3: March 14, 2022\nCurrent City: from Pensacola to Houston\nTransportation: Self-driving, from Pensacola to Houston, duration: 7 hours 37 mins, distance: 845 km, Cost: $42 * (2/5 ceiling) = $42 * 1 = $42\n\nBreakfast: Chicago Pizza, Pensacola, Cost: $32 * 2 = $64, Cuisines: \"Pizza, Mediterranean, Fast Food\"\nAttraction: Palafox Street Downtown Pensacola, Pensacola, Cost: Free\nLunch: Phantom, Pensacola, Cost: $94 * 2 = $188, Cuisines: \"Desserts, Pizza, Cafe, Mediterranean, Seafood\"\nDinner: - (Assuming dinner is had after arrival in Houston)\nAccommodation: -\n\nNumber of People = 2\nTotal Cost = $42 + $64 + $188 = $294\n\nTotal cost across all days = $634 + $726 + $294 = $1654\n\nUnfortunately, the total cost exceeds the budget of $1,100. To adjust the plan within the budget, we need to choose cheaper meal options and/or change the accommodation to a more affordable one that allows smoking.\n\nRevised Plan with Budget Consideration:\n\nDay 1: Same as above, Total Cost = $634\n\nDay 2:\nBreakfast: Jyoti Dhaba, Pensacola, Cost: $11 * 2 = $22, Cuisines: \"Tea, Bakery, Fast Food\"\nLunch: Bailey's Bar-B-Que, Pensacola, Cost: $13 * 2 = $26, Cuisines: \"Tea, Bakery, Mediterranean\"\nDinner: Kalpana Restaurant, Pensacola, Cost: $36 * 2 = $72, Cuisines: \"Tea, Cafe, Bakery, American\"\nAccommodation: Amazing apartment near museum, gardens & park!, Pensacola, Cost: $74 * (2/3 ceiling) = $74 * 1 = $74, Maximum Occupancy: 3, House Rules: No parties, Minimum Nights: 17\n\nNumber of People = 2\nTotal Cost = $22 + $26 + $72 + $74 = $194\nAccommodation Minimum Nights: 2/3\n\nDay 3:\nBreakfast: Jyoti Dhaba, Pensacola, Cost: $11 * 2 = $22, Cuisines: \"Tea, Bakery, Fast Food\"\nLunch: Kwality Restaurant, Pensacola, Cost: $29 * 2 = $58, Cuisines: \"Desserts, Tea, French, Fast Food, Chinese\"\nTransportation: Same as above, Total Cost = $42 + $22 + $58 = $122\n\nTotal revised cost across all days = $634 + $194 + $122 = $950\n\nCuisines: The prompt specifies no cuisines, so all cuisines constraints are satisfied.\n\nPlease note that the accommodation chosen for Day 2 and Day 3 has a minimum stay of 17 nights, which is not ideal for a 3-day trip. However, due to the budget constraints and the requirement for a smoking-permitted accommodation, this was the only option available within the budget. If the budget can be slightly increased, we can opt for the Chic Historic Harlem Brownstone for all three nights, which would be more suitable for a short stay.", "gpt-4-1106-preview_direct_sole-planning_parsed_results": [{"day": 1, "current_city": "from Houston to Pensacola", "transportation": "Self-driving, from Houston to Pensacola, duration: 7 hours 38 mins, distance: 845 km", "breakfast": "-", "attraction": "Historic Pensacola Village, Pensacola", "lunch": "Frog Hollow Tavern, Pensacola", "dinner": "Berry Patch Restaurant, Pensacola", "accommodation": "Chic Historic Harlem Brownstone, Pensacola"}, {"day": 2, "current_city": "Pensacola", "transportation": "-", "breakfast": "Bailey's Bar-B-Que, Pensacola", "attraction": "Pensacola Museum of Art, Pensacola", "lunch": "Watershed Cafe, Pensacola", "dinner": "Blue Point Grill, Pensacola", "accommodation": "Chic Historic Harlem Brownstone, Pensacola"}, {"day": 3, "current_city": "from Pensacola to Houston", "transportation": "Self-driving, from Pensacola to Houston, duration: 7 hours 37 mins, distance: 845 km", "breakfast": "Chicago Pizza, Pensacola", "attraction": "Palafox Street Downtown Pensacola, Pensacola", "lunch": "Phantom, Pensacola", "dinner": "-", "accommodation": "-"}, {"day": 2, "current_city": "Pensacola", "transportation": "-", "breakfast": "Jyoti Dhaba, Pensacola", "lunch": "Bailey's Bar-B-Que, Pensacola", "dinner": "Kalpana Restaurant, Pensacola", "accommodation": "Amazing apartment near museum, gardens & park!, Pensacola"}, {"day": 3, "current_city": "from Pensacola to Houston", "transportation": "Self-driving, from Pensacola to Houston, duration: 7 hours 37 mins, distance: 845 km", "breakfast": "Jyoti Dhaba, Pensacola", "lunch": "Kwality Restaurant, Pensacola", "dinner": "-", "accommodation": "-"}]}]