[{"gpt-4-1106-preview_direct_sole-planning_results": "Travel Plan:\n\nDay 1: March 22nd\nCurrent City: from Provo to San Diego\nTransportation: Self-driving, from Provo to San Diego, Duration: 10 hours 13 mins, Distance: 1,137 km, Cost: $56 * ceil(5/5) = $56\nBreakfast: - (Assuming breakfast in Provo before departure)\nAttraction: Cabrillo National Monument, San Diego, Cost: Free\nLunch: Open Yard, San Diego, Cost: $33 * 5 = $165, Cuisines: \"Chinese, Pizza, Cafe, Desserts\"\nDinner: Jetha Lal Ka Dhabha, San Diego, Cost: $22 * 5 = $110, Cuisines: \"Tea, Cafe, Indian, Italian\"\nAccommodation: Luxury 4BR Home, Spacious & Central to Trains, San Diego, Cost: $392 * ceil(5/3) = $784, Maximum Occupancy: 3, House Rules: No parties (No accommodations allow parties, choosing the one with the least minimum nights)\n\nNumber of People = 5\nTotal Cost = $56 + $165 + $110 + $784 = $1115\nAccommodation Minimum Nights: 1/3\n\nDay 2: March 23rd\nCurrent City: San Diego\nTransportation: -\nBreakfast: Burger King, San Diego, Cost: $20 * 5 = $100, Cuisines: \"Pizza, Italian, French, Fast Food, Seafood\"\nAttraction: SeaWorld San Diego, San Diego, Cost: Free\nLunch: Chaudhary Di Hatti, San Diego, Cost: $30 * 5 = $150, Cuisines: \"Desserts, Pizza, Italian, BBQ, Fast Food\"\nDinner: Gopala, San Diego, Cost: $98 * 5 = $490, Cuisines: \"Pizza, Mexican, BBQ, American, Seafood\"\nAccommodation: Luxury 4BR Home, Spacious & Central to Trains, San Diego, Cost: $784\n\nNumber of People = 5\nTotal Cost = $100 + $150 + $490 + $784 = $1524\nAccommodation Minimum Nights: 2/3\n\nDay 3: March 24th\nCurrent City: from San Diego to Santa Ana\nTransportation: Self-driving, from San Diego to Santa Ana, Duration: 1 hour 26 mins, Distance: 144 km, Cost: $7 * ceil(5/5) = $7\nBreakfast: Armaan's Restaurant, San Diego, Cost: $29 * 5 = $145, Cuisines: \"Fast Food, Cafe, Seafood, Italian\"\nAttraction: Bowers Museum, Santa Ana, Cost: Free\nLunch: The Bee's Knees, Santa Ana, Cost: $12 * 5 = $60, Cuisines: \"Cafe, Pizza, Desserts, Seafood\"\nDinner: Caf\u6106 Tu Tu Tango, Santa Ana, Cost: $88 * 5 = $440, Cuisines: \"Tea, Pizza, French, Bakery, Cafe, American\"\nAccommodation: Sun-filled Artist Home 1BR in convenient L.I.C !, Santa Ana, Cost: $1065 * ceil(5/5) = $1065, Maximum Occupancy: 5, House Rules: No children under 10 (No accommodations allow parties, choosing the one with the least minimum nights)\n\nNumber of People = 5\nTotal Cost = $7 + $145 + $60 + $440 + $1065 = $1717\nAccommodation Minimum Nights: 1/2\n\nDay 4: March 25th\nCurrent City: Santa Ana\nTransportation: -\nBreakfast: The Chai Cafe, Santa Ana, Cost: $52 * 5 = $260, Cuisines: \"Tea, American, Desserts\"\nAttraction: Santa Ana Zoo, Santa Ana, Cost: Free\nLunch: Shahi Chicken Corner, Santa Ana, Cost: $55 * 5 = $275, Cuisines: \"Bakery, BBQ, Italian\"\nDinner: Bottles and Barrels, Santa Ana, Cost: $81 * 5 = $405, Cuisines: \"Desserts, Tea, French, Bakery, Cafe\"\nAccommodation: Sun-filled Artist Home 1BR in convenient L.I.C !, Santa Ana, Cost: $1065\n\nNumber of People = 5\nTotal Cost = $260 + $275 + $405 + $1065 = $2005\nAccommodation Minimum Nights: 2/2\n\nDay 5: March 26th\nCurrent City: from Santa Ana to Bakersfield\nTransportation: Self-driving, from Santa Ana to Bakersfield, Duration: 2 hours 31 mins, Distance: 231 km, Cost: $11 * ceil(5/5) = $11\nBreakfast: Nawras Seafood Restaurant, Santa Ana, Cost: $83 * 5 = $415, Cuisines: \"Tea, Bakery, Desserts\"\nAttraction: Kern County Museum, Bakersfield, Cost: Free\nLunch: Kihei Caffe, Bakersfield, Cost: $47 * 5 = $235, Cuisines: \"Fast Food, BBQ, Desserts, Italian\"\nDinner: Tybee Island Social Club, Bakersfield, Cost: $83 * 5 = $415, Cuisines: \"Tea, Bakery, Fast Food, Cafe, American\"\nAccommodation: Cozy 2 Bedroom Condominium, Bakersfield, Cost: $55 * ceil(5/3) = $110, Maximum Occupancy: 3, House Rules: No parties (No accommodations allow parties, choosing the one with the least minimum nights)\n\nNumber of People = 5\nTotal Cost = $11 + $415 + $235 + $415 + $110 = $1186\nAccommodation Minimum Nights: 1/1\n\nDay 6: March 27th\nCurrent City: Bakersfield\nTransportation: -\nBreakfast: Domino's Pizza, Bakersfield, Cost: $19 * 5 = $95, Cuisines: \"Pizza, Mediterranean, Desserts\"\nAttraction: California Living Museum, Bakersfield, Cost: Free\nLunch: Pita Pit, Bakersfield, Cost: $23 * 5 = $115, Cuisines: \"Tea, Pizza, Italian, Bakery, Seafood\"\nDinner: Momo-Cha, Bakersfield, Cost: $68 * 5 = $340, Cuisines: \"Desserts, Pizza, BBQ, Fast Food, Mediterranean\"\nAccommodation: Cozy 2 Bedroom Condominium, Bakersfield, Cost: $110\n\nNumber of People = 5\nTotal Cost = $95 + $115 + $340 + $110 = $660\nAccommodation Minimum Nights: 1/1\n\nDay 7: March 28th\nCurrent City: from Bakersfield to Provo\nTransportation: Self-driving, from Bakersfield to Provo, Duration: 9 hours 34 mins, Distance: 1,063 km, Cost: $53 * ceil(5/5) = $53\nBreakfast: Twenty Four Seven, Bakersfield, Cost: $63 * 5 = $315, Cuisines: \"Chinese, Bakery, Seafood, Italian\"\nAttraction: - (Assuming travel back to Provo)\nLunch: - (On the road)\nDinner: - (Assuming dinner in Provo after arrival)\nAccommodation: -\n\nNumber of People = 5\nTotal Cost = $53 + $315 = $368\n\nTotal cost across all days = $1115 + $1524 + $1717 + $2005 + $1186 + $660 + $368 = $8575\nCuisines: The prompt specifies no cuisines, so all cuisines constraints are satisfied.", "gpt-4-1106-preview_direct_sole-planning_parsed_results": [{"day": 1, "current_city": "from Provo to San Diego", "transportation": "Self-driving, from Provo to San Diego, Duration: 10 hours 13 mins, Distance: 1,137 km", "breakfast": "-", "attraction": "Cabrillo National Monument, San Diego;", "lunch": "Open Yard, San Diego", "dinner": "Jetha Lal Ka Dhabha, San Diego", "accommodation": "Luxury 4BR Home, Spacious & Central to Trains, San Diego"}, {"day": 2, "current_city": "San Diego", "transportation": "-", "breakfast": "Burger King, San Diego", "attraction": "SeaWorld San Diego, San Diego;", "lunch": "Chaudhary Di Hatti, San Diego", "dinner": "Gopala, San Diego", "accommodation": "Luxury 4BR Home, Spacious & Central to Trains, San Diego"}, {"day": 3, "current_city": "from San Diego to Santa Ana", "transportation": "Self-driving, from San Diego to Santa Ana, Duration: 1 hour 26 mins, Distance: 144 km", "breakfast": "Armaan's Restaurant, San Diego", "attraction": "Bowers Museum, Santa Ana;", "lunch": "The Bee's Knees, Santa Ana", "dinner": "Caf\u00e9 Tu Tu Tango, Santa Ana", "accommodation": "Sun-filled Artist Home 1BR in convenient L.I.C !, Santa Ana"}, {"day": 4, "current_city": "Santa Ana", "transportation": "-", "breakfast": "The Chai Cafe, Santa Ana", "attraction": "Santa Ana Zoo, Santa Ana;", "lunch": "Shahi Chicken Corner, Santa Ana", "dinner": "Bottles and Barrels, Santa Ana", "accommodation": "Sun-filled Artist Home 1BR in convenient L.I.C !, Santa Ana"}, {"day": 5, "current_city": "from Santa Ana to Bakersfield", "transportation": "Self-driving, from Santa Ana to Bakersfield, Duration: 2 hours 31 mins, Distance: 231 km", "breakfast": "Nawras Seafood Restaurant, Santa Ana", "attraction": "Kern County Museum, Bakersfield;", "lunch": "Kihei Caffe, Bakersfield", "dinner": "Tybee Island Social Club, Bakersfield", "accommodation": "Cozy 2 Bedroom Condominium, Bakersfield"}, {"day": 6, "current_city": "Bakersfield", "transportation": "-", "breakfast": "Domino's Pizza, Bakersfield", "attraction": "California Living Museum, Bakersfield;", "lunch": "Pita Pit, Bakersfield", "dinner": "Momo-Cha, Bakersfield", "accommodation": "Cozy 2 Bedroom Condominium, Bakersfield"}, {"day": 7, "current_city": "from Bakersfield to Provo", "transportation": "Self-driving, from Bakersfield to Provo, Duration: 9 hours 34 mins, Distance: 1,063 km", "breakfast": "Twenty Four Seven, Bakersfield", "attraction": "-", "lunch": "-", "dinner": "-", "accommodation": "-"}]}]