[{"gpt-4-1106-preview_direct_sole-planning_results": "Travel Plan:\n\nDay 1: March 23, 2022\nCurrent City: from Denver to Seattle\nTransportation: Flight Number: F3519512, from Denver to Seattle, Departure Time: 06:27, Arrival Time: 08:32, Cost: $250\nBreakfast: -\nAttraction: Pike Place Market, Seattle, Cost: $0 (Assuming no entry fee)\nLunch: Ting's Red Lantern, Seattle, Cost: $24, Cuisines: \"Italian, Bakery, BBQ, Fast Food, Chinese, Seafood\"\nDinner: The Golden Dragon, Seattle, Cost: $15, Cuisines: \"BBQ, Mediterranean, Seafood\"\nAccommodation: New tidy room attached by PRIVATE FULL BATH, Seattle, Cost: $73, Maximum Occupancy: 2, House Rules: No parties & No smoking, Minimum Nights: 3\n\nNumber of People = 1\nTotal Cost = $250 (Flight) + $24 (Lunch) + $15 (Dinner) + $73 (Accommodation) = $362\nAccommodation Minimum Nights: 1/3\n\nDay 2: March 24, 2022\nCurrent City: Seattle\nTransportation: -\nBreakfast: The Test, Seattle, Cost: $18, Cuisines: \"Tea, Pizza, Bakery\"\nAttraction: Space Needle, Seattle, Cost: $0 (Assuming no entry fee)\nLunch: Hot Chimney, Seattle, Cost: $19, Cuisines: \"Tea, Pizza, Mexican, Bakery, Fast Food\"\nDinner: wagamama, Seattle, Cost: $21, Cuisines: \"Tea, Pizza, Desserts, Seafood\"\nAccommodation: New tidy room attached by PRIVATE FULL BATH, Seattle, Cost: $73, Maximum Occupancy: 2, House Rules: No parties & No smoking, Minimum Nights: 3\n\nNumber of People = 1\nTotal Cost = $18 (Breakfast) + $19 (Lunch) + $21 (Dinner) + $73 (Accommodation) = $131\nAccommodation Minimum Nights: 2/3\n\nDay 3: March 25, 2022\nCurrent City: from Seattle to Yakima\nTransportation: Flight Number: F3864441, from Seattle to Yakima, Departure Time: 12:54, Arrival Time: 13:32, Cost: $47\nBreakfast: -\nAttraction: Yakima Valley Museum, Yakima, Cost: $0 (Assuming no entry fee)\nLunch: Manzu, Yakima, Cost: $25, Cuisines: \"Cafe, Pizza, Seafood\"\nDinner: Sambo Kojin, Yakima, Cost: $57, Cuisines: \"Tea, Seafood, Cafe, Fast Food\"\nAccommodation: Large 4 BR West Village townhouse/roof garden, Yakima, Cost: $157, Maximum Occupancy: 3, House Rules: No pets, Minimum Nights: 2\n\nNumber of People = 1\nTotal Cost = $47 (Flight) + $25 (Lunch) + $57 (Dinner) + $157 (Accommodation) = $286\nAccommodation Minimum Nights: 1/2\n\nDay 4: March 26, 2022\nCurrent City: Yakima\nTransportation: -\nBreakfast: Mickey's Kitchen, Yakima, Cost: $13, Cuisines: \"Desserts, Italian, Bakery, BBQ, Seafood\"\nAttraction: Yakima Area Arboretum, Yakima, Cost: $0 (Assuming no entry fee)\nLunch: Roy's, Yakima, Cost: $45, Cuisines: \"Tea, Bakery, Seafood\"\nDinner: Flying Tandoor, Yakima, Cost: $99, Cuisines: \"Cafe, Indian, Fast Food\"\nAccommodation: Large 4 BR West Village townhouse/roof garden, Yakima, Cost: $157, Maximum Occupancy: 3, House Rules: No pets, Minimum Nights: 2\n\nNumber of People = 1\nTotal Cost = $13 (Breakfast) + $45 (Lunch) + $99 (Dinner) + $157 (Accommodation) = $314\nAccommodation Minimum Nights: 2/2\n\nDay 5: March 27, 2022\nCurrent City: from Yakima to Denver\nTransportation: Self-driving, from Yakima to Denver, Cost: $93\nBreakfast: -\nAttraction: -\nLunch: -\nDinner: -\nAccommodation: -\n\nNumber of People = 1\nTotal Cost = $93 (Transportation) = $93\n\nTotal cost across all days = $362 + $131 + $286 + $314 + $93 = $1186\nRemaining Budget = $4200 - $1186 = $3014\n\nCuisines: The prompt specifies no cuisines, so all cuisines constraints are satisfied.\nHouse Rules: All accommodations chosen abide by the house rules specified in the query.", "gpt-4-1106-preview_direct_sole-planning_parsed_results": [{"day": 1, "current_city": "from Denver to Seattle", "transportation": "Flight Number: F3519512, from Denver to Seattle, Departure Time: 06:27, Arrival Time: 08:32", "breakfast": "-", "attraction": "Pike Place Market, Seattle;", "lunch": "Ting's Red Lantern, Seattle", "dinner": "The Golden Dragon, Seattle", "accommodation": "New tidy room attached by PRIVATE FULL BATH, Seattle"}, {"day": 2, "current_city": "Seattle", "transportation": "-", "breakfast": "The Test, Seattle", "attraction": "Space Needle, Seattle;", "lunch": "Hot Chimney, Seattle", "dinner": "wagamama, Seattle", "accommodation": "New tidy room attached by PRIVATE FULL BATH, Seattle"}, {"day": 3, "current_city": "from Seattle to Yakima", "transportation": "Flight Number: F3864441, from Seattle to Yakima, Departure Time: 12:54, Arrival Time: 13:32", "breakfast": "-", "attraction": "Yakima Valley Museum, Yakima;", "lunch": "Manzu, Yakima", "dinner": "Sambo Kojin, Yakima", "accommodation": "Large 4 BR West Village townhouse/roof garden, Yakima"}, {"day": 4, "current_city": "Yakima", "transportation": "-", "breakfast": "Mickey's Kitchen, Yakima", "attraction": "Yakima Area Arboretum, Yakima;", "lunch": "Roy's, Yakima", "dinner": "Flying Tandoor, Yakima", "accommodation": "Large 4 BR West Village townhouse/roof garden, Yakima"}, {"day": 5, "current_city": "from Yakima to Denver", "transportation": "Self-driving, from Yakima to Denver", "breakfast": "-", "attraction": "-", "lunch": "-", "dinner": "-", "accommodation": "-"}]}]