[{"gpt-4-1106-preview_direct_sole-planning_results": "Travel Plan:\n\nDay 1: March 4, 2022\nCurrent City: from Lake Charles to Houston\nTransportation: Flight Number: F3932451, from Lake Charles to Houston, Departure Time: 07:02, Arrival Time: 08:27, Cost: $57 * 2 = $114\nBreakfast: -\nAttraction: Downtown Aquarium, Houston, Cost: $0 (Assuming free entry as no price is provided)\nLunch: Jalapenos, Houston, Cost: $57 * 2 = $114, Cuisines: \"Desserts, Tea, Cafe, Chinese, Seafood\"\nDinner: Sheetla Dhaba, Houston, Cost: $35 * 2 = $70, Cuisines: \"Desserts, Pizza, Bakery, American, Mediterranean\"\nAccommodation: Superhost 3 bedroom DISCOUNT, Houston, Cost: $746 * 1 = $746, Maximum Occupancy: 5, House Rules: No pets, Minimum Nights: 1\n\nNumber of People = 2\nTotal Cost = $114 + $114 + $70 + $746 = $1044\nAccommodation Minimum Nights: 1/1\n\nDay 2: March 5, 2022\nCurrent City: Houston\nTransportation: -\nBreakfast: Super Bakery, Houston, Cost: $30 * 2 = $60, Cuisines: \"Seafood, Fast Food\"\nAttraction: Space Center Houston, Houston, Cost: $0 (Assuming free entry as no price is provided)\nLunch: Royal Mart, Houston, Cost: $40 * 2 = $80, Cuisines: \"Tea, Bakery, Cafe, Mediterranean, Seafood\"\nDinner: Matchbox, Houston, Cost: $33 * 2 = $66, Cuisines: \"Tea, Italian, Bakery, Fast Food, Seafood\"\nAccommodation: Superhost 3 bedroom DISCOUNT, Houston, Cost: $746 * 1 = $746, Maximum Occupancy: 5, House Rules: No pets, Minimum Nights: 1\n\nNumber of People = 2\nTotal Cost = $60 + $80 + $66 + $746 = $952\nAccommodation Minimum Nights: 2/2\n\nDay 3: March 6, 2022\nCurrent City: from Houston to Dallas\nTransportation: Flight Number: F3673853, from Houston to Dallas, Departure Time: 07:46, Arrival Time: 09:09, Cost: $53 * 2 = $106\nBreakfast: Earthen Spices, Houston, Cost: $28 * 2 = $56, Cuisines: \"Tea, Mexican, Bakery, BBQ, Fast Food\"\nAttraction: The Dallas World Aquarium, Dallas, Cost: $0 (Assuming free entry as no price is provided)\nLunch: Coconuts Fish Cafe, Dallas, Cost: $38 * 2 = $76, Cuisines: \"Cafe, BBQ, Mediterranean, Fast Food\"\nDinner: 1918 Bistro & Grill, Dallas, Cost: $90 * 2 = $180, Cuisines: \"Tea, Pizza, BBQ, Seafood\"\nAccommodation: Take it now you won't find better, Dallas, Cost: $609 * 1 = $609, Maximum Occupancy: 4, House Rules: No pets, Minimum Nights: 1\n\nNumber of People = 2\nTotal Cost = $106 + $56 + $76 + $180 + $609 = $1027\nAccommodation Minimum Nights: 1/1\n\nDay 4: March 7, 2022\nCurrent City: Dallas\nTransportation: -\nBreakfast: Cafe Gatherings, Dallas, Cost: $17 * 2 = $34, Cuisines: \"Bakery, Indian, Desserts\"\nAttraction: The Sixth Floor Museum at Dealey Plaza, Dallas, Cost: $0 (Assuming free entry as no price is provided)\nLunch: Drifters Cafe, Dallas, Cost: $21 * 2 = $42, Cuisines: \"Tea, French, Mexican, Cafe, Seafood\"\nDinner: Uma Foodies' Hut, Dallas, Cost: $49 * 2 = $98, Cuisines: \"French, Bakery, Seafood\"\nAccommodation: Take it now you won't find better, Dallas, Cost: $609 * 1 = $609, Maximum Occupancy: 4, House Rules: No pets, Minimum Nights: 1\n\nNumber of People = 2\nTotal Cost = $34 + $42 + $98 + $609 = $783\nAccommodation Minimum Nights: 2/2\n\nDay 5: March 8, 2022\nCurrent City: from Dallas to Lake Charles\nTransportation: Flight Number: F3592512, from Dallas to Lake Charles, Departure Time: 16:41, Arrival Time: 17:52, Cost: $91 * 2 = $182\nBreakfast: Metro Fast Food, Dallas, Cost: $45 * 2 = $90, Cuisines: \"Tea, Pizza, Mexican, Bakery, BBQ, American\"\nAttraction: Reunion Tower, Dallas, Cost: $0 (Assuming free entry as no price is provided)\nLunch: MONKS, Dallas, Cost: $24 * 2 = $48, Cuisines: \"Tea, Pizza, Cafe, Mediterranean, Seafood\"\nDinner: -\nAccommodation: -\n\nNumber of People = 2\nTotal Cost = $182 + $90 + $48 = $320\nAccommodation Minimum Nights: -\n\nTotal cost across all days = $1044 + $952 + $1027 + $783 + $320 = $4126\nCuisines: The prompt specifies no cuisines, so all cuisines constraints are satisfied.\nHouse Rules: Accommodations were chosen where parties are allowed, as per the query's preference.\n\nRemaining Budget: $4600 - $4126 = $474\n\nPlease note that the cost of attractions is assumed to be free as no price is provided in the reference information. If there are entry fees for the attractions, they would need to be included in the total cost.", "gpt-4-1106-preview_direct_sole-planning_parsed_results": [{"day": 1, "current_city": "from Lake Charles to Houston", "transportation": "Flight Number: F3932451, from Lake Charles to Houston, Departure Time: 07:02, Arrival Time: 08:27", "breakfast": "-", "attraction": "Downtown Aquarium, Houston;", "lunch": "Jalapenos, Houston", "dinner": "Sheetla Dhaba, Houston", "accommodation": "Superhost 3 bedroom DISCOUNT, Houston"}, {"day": 2, "current_city": "Houston", "transportation": "-", "breakfast": "Super Bakery, Houston", "attraction": "Space Center Houston, Houston;", "lunch": "Royal Mart, Houston", "dinner": "Matchbox, Houston", "accommodation": "Superhost 3 bedroom DISCOUNT, Houston"}, {"day": 3, "current_city": "from Houston to Dallas", "transportation": "Flight Number: F3673853, from Houston to Dallas, Departure Time: 07:46, Arrival Time: 09:09", "breakfast": "Earthen Spices, Houston", "attraction": "The Dallas World Aquarium, Dallas;", "lunch": "Coconuts Fish Cafe, Dallas", "dinner": "1918 Bistro & Grill, Dallas", "accommodation": "Take it now you won't find better, Dallas"}, {"day": 4, "current_city": "Dallas", "transportation": "-", "breakfast": "Cafe Gatherings, Dallas", "attraction": "The Sixth Floor Museum at Dealey Plaza, Dallas;", "lunch": "Drifters Cafe, Dallas", "dinner": "Uma Foodies' Hut, Dallas", "accommodation": "Take it now you won't find better, Dallas"}, {"day": 5, "current_city": "from Dallas to Lake Charles", "transportation": "Flight Number: F3592512, from Dallas to Lake Charles, Departure Time: 16:41, Arrival Time: 17:52", "breakfast": "Metro Fast Food, Dallas", "attraction": "Reunion Tower, Dallas;", "lunch": "MONKS, Dallas", "dinner": "-", "accommodation": "-"}]}]