[{"gpt-4-1106-preview_direct_sole-planning_results": "Travel Plan:\n\nDay 1: March 3rd\nCurrent City: from Newark to Savannah\nTransportation: Flight Number: F4070563, from Newark to Savannah, Departure Time: 17:20, Arrival Time: 19:40, Cost: $194 * 2 = $388\nBreakfast: - \nAttraction: Forsyth Park, Savannah, Cost: $0 (Assuming no entry fee)\nLunch: Sr. Sol 1, Savannah, Cost: $30 * 2 = $60, Cuisines: \"Tea, French, Mediterranean, Desserts\"\nDinner: The Mad Teapot/The Wishing Chair, Savannah, Cost: $23 * 2 = $46, Cuisines: \"Mexican, Bakery, Fast Food\"\nAccommodation: MIDTOWN MANHATTAN-WALKING DISTANCE TO EMPIRE STATE, Savannah, Cost: $72 * 2 = $144, Maximum Occupancy: 2, House Rules: No pets & No parties, Minimum Nights: 2\n\nNumber of People = 2\nTotal Cost for Day 1 = $388 + $60 + $46 + $144 = $638\nAccommodation Minimum Nights: 1/2\n\nDay 2: March 4th\nCurrent City: Savannah\nTransportation: -\nBreakfast: Manohar Dairy And Restaurant, Savannah, Cost: $23 * 2 = $46, Cuisines: \"Tea, Indian, Fast Food\"\nAttraction: Savannah Historic District, Savannah, Cost: $0 (Assuming no entry fee)\nLunch: Bosphorous Turkish Cuisine, Savannah, Cost: $58 * 2 = $116, Cuisines: \"Pizza, Indian, Fast Food\"\nDinner: Sr. Sol 1, Savannah, Cost: $30 * 2 = $60, Cuisines: \"Tea, French, Mediterranean, Desserts\"\nAccommodation: MIDTOWN MANHATTAN-WALKING DISTANCE TO EMPIRE STATE, Savannah, Cost: $72 * 2 = $144, Maximum Occupancy: 2, House Rules: No pets & No parties, Minimum Nights: 2\n\nNumber of People = 2\nTotal Cost for Day 2 = $46 + $116 + $60 + $144 = $366\nAccommodation Minimum Nights: 2/2\n\nDay 3: March 5th\nCurrent City: from Savannah to Newark\nTransportation: Flight Number: F3903501, from Savannah to Newark, Departure Time: 06:02, Arrival Time: 08:11, Cost: $294 * 2 = $588\nBreakfast: Manohar Dairy And Restaurant, Savannah, Cost: $23 * 2 = $46, Cuisines: \"Tea, Indian, Fast Food\"\nAttraction: Wormsloe State Historic Site, Savannah, Cost: $0 (Assuming no entry fee)\nLunch: Bosphorous Turkish Cuisine, Savannah, Cost: $58 * 2 = $116, Cuisines: \"Pizza, Indian, Fast Food\"\nDinner: - \nAccommodation: -\n\nNumber of People = 2\nTotal Cost for Day 3 = $588 + $46 + $116 = $750\n\nTotal cost across all days = $638 + $366 + $750 = $1754\n\nUnfortunately, the total cost exceeds the budget of $1,400. To adjust the plan within the budget, we need to choose cheaper transportation options or reduce meal costs. Since we're not self-driving and the taxi cost is too high, we'll need to adjust meal costs.\n\nAdjusted Day 1 Dinner: Dhaba On Wheels, Savannah, Cost: $18 * 2 = $36, Cuisines: \"Tea, Bakery, Pizza, American\"\nAdjusted Day 2 Dinner: Dhaba On Wheels, Savannah, Cost: $18 * 2 = $36, Cuisines: \"Tea, Bakery, Pizza, American\"\nAdjusted Day 3 Lunch: Dhaba On Wheels, Savannah, Cost: $18 * 2 = $36, Cuisines: \"Tea, Bakery, Pizza, American\"\n\nAdjusted Total Cost for Day 1 = $388 + $60 + $36 + $144 = $628\nAdjusted Total Cost for Day 2 = $46 + $116 + $36 + $144 = $342\nAdjusted Total Cost for Day 3 = $588 + $46 + $36 = $670\n\nAdjusted Total cost across all days = $628 + $342 + $670 = $1640\n\nThe adjusted plan is still over budget. We need to find a cheaper flight option.\n\nCheapest Flight Day 1: F4070563, Cost: $194 * 2 = $388\nCheapest Flight Day 3: F3903501, Cost: $294 * 2 = $588\n\nWe can't change the accommodation as it's the cheapest option that meets the house rules requirement. Therefore, we need to adjust the flight options or attractions to fit the budget. However, without additional cheaper flight options or the ability to adjust attraction costs, we cannot create a plan that fits the $1,400 budget based on the provided data.", "gpt-4-1106-preview_direct_sole-planning_parsed_results": [{"day": 1, "current_city": "from Newark to Savannah", "transportation": "Flight Number: F4070563, from Newark to Savannah, Departure Time: 17:20, Arrival Time: 19:40", "breakfast": "-", "attraction": "Forsyth Park, Savannah;", "lunch": "Sr. Sol 1, Savannah", "dinner": "The Mad Teapot/The Wishing Chair, Savannah", "accommodation": "MIDTOWN MANHATTAN-WALKING DISTANCE TO EMPIRE STATE, Savannah"}, {"day": 2, "current_city": "Savannah", "transportation": "-", "breakfast": "Manohar Dairy And Restaurant, Savannah", "attraction": "Savannah Historic District, Savannah;", "lunch": "Bosphorous Turkish Cuisine, Savannah", "dinner": "Sr. Sol 1, Savannah", "accommodation": "MIDTOWN MANHATTAN-WALKING DISTANCE TO EMPIRE STATE, Savannah"}, {"day": 3, "current_city": "from Savannah to Newark", "transportation": "Flight Number: F3903501, from Savannah to Newark, Departure Time: 06:02, Arrival Time: 08:11", "breakfast": "Manohar Dairy And Restaurant, Savannah", "attraction": "Wormsloe State Historic Site, Savannah;", "lunch": "Dhaba On Wheels, Savannah", "dinner": "-", "accommodation": "-"}]}]