[{"gpt-4-1106-preview_direct_sole-planning_results": "Travel Plan:\n\nDay 1: March 12, 2022\nCurrent City: from Evansville to Texarkana\nTransportation: Self-driving, from Evansville to Texarkana, Duration: 8 hours 45 mins, Distance: 889 km, Cost: $44 * ceil(4/5) = $44\nBreakfast: - (Assuming breakfast is had before departure)\nAttraction: Museum of Regional History, Texarkana, Cost: $0 (Assuming no entry fee)\nLunch: Big City Bread Cafe, Texarkana, Cost: $61 * 4 = $244, Cuisines: \"Cafe, Pizza, Bakery, BBQ\"\nDinner: Club Mojo, Texarkana, Cost: $49 * 4 = $196, Cuisines: \"Desserts, Italian, BBQ, Cafe, American\"\nAccommodation: Large 2.5 BR Apt In Park Slope, Texarkana, Cost: $269 * ceil(4/3) = $269 * 2 = $538, Maximum Occupancy: 3, House Rules: No smoking & No visitors, Minimum Nights: 1\n\nNumber of People = 4\nTotal Cost = $44 + $244 + $196 + $538 = $1022\nAccommodation Minimum Nights: 1/1\n\nDay 2: March 13, 2022\nCurrent City: Texarkana\nTransportation: -\nBreakfast: The Beer Cafe - BIGGIE, Texarkana, Cost: $13 * 4 = $52, Cuisines: \"Cafe, Pizza, Mediterranean, Fast Food\"\nAttraction: Spring Lake Park, Texarkana, Cost: $0 (Assuming no entry fee)\nLunch: Purani Dilli Foods, Texarkana, Cost: $62 * 4 = $248, Cuisines: \"Indian, BBQ, Fast Food\"\nDinner: Polka Pastry & Snack Bar, Texarkana, Cost: $71 * 4 = $284, Cuisines: \"Fast Food, BBQ, Italian\"\nAccommodation: Large 2.5 BR Apt In Park Slope, Texarkana, Cost: $269 * ceil(4/3) = $269 * 2 = $538, Maximum Occupancy: 3, House Rules: No smoking & No visitors, Minimum Nights: 1\n\nNumber of People = 4\nTotal Cost = $52 + $248 + $284 + $538 = $1122\nAccommodation Minimum Nights: 1/1\n\nDay 3: March 14, 2022\nCurrent City: from Texarkana to Longview\nTransportation: Self-driving, from Texarkana to Longview, Duration: 1 hour 36 mins, Distance: 142 km, Cost: $7 * ceil(4/5) = $7\nBreakfast: Wah Ji Wah, Texarkana, Cost: $55 * 4 = $220, Cuisines: \"Tea, Pizza, Mexican, Bakery, Fast Food\"\nAttraction: Longview World of Wonders, Longview, Cost: $0 (Assuming no entry fee)\nLunch: Barbeque Nation, Longview, Cost: $26 * 4 = $104, Cuisines: \"Cafe, Bakery\"\nDinner: Momo Mia, Longview, Cost: $19 * 4 = $76, Cuisines: \"Desserts, Pizza, French, BBQ, Chinese\"\nAccommodation: Newly renovated 2 bedroom with FREE WIFI, Longview, Cost: $581 * ceil(4/5) = $581, Maximum Occupancy: 5, House Rules: No children under 10, Minimum Nights: 1\n\nNumber of People = 4\nTotal Cost = $7 + $220 + $104 + $76 + $581 = $988\nAccommodation Minimum Nights: 1/1\n\nDay 4: March 15, 2022\nCurrent City: Longview\nTransportation: -\nBreakfast: Green Chick Chop, Longview, Cost: $12 * 4 = $48, Cuisines: \"Tea, Chinese, Cafe\"\nAttraction: Gregg County Historical Museum, Longview, Cost: $0 (Assuming no entry fee)\nLunch: Apni Rasoi, Longview, Cost: $25 * 4 = $100, Cuisines: \"Desserts, Tea, Pizza, Italian, Seafood\"\nDinner: Not Just Paranthas, Longview, Cost: $54 * 4 = $216, Cuisines: \"Desserts, Bakery, BBQ, Seafood\"\nAccommodation: Newly renovated 2 bedroom with FREE WIFI, Longview, Cost: $581 * ceil(4/5) = $581, Maximum Occupancy: 5, House Rules: No children under 10, Minimum Nights: 1\n\nNumber of People = 4\nTotal Cost = $48 + $100 + $216 + $581 = $945\nAccommodation Minimum Nights: 1/1\n\nDay 5: March 16, 2022\nCurrent City: from Longview to Evansville\nTransportation: Self-driving, from Longview to Evansville, Duration: 10 hours 8 mins, Distance: 1,045 km, Cost: $52 * ceil(4/5) = $52\nBreakfast: Subway, Longview, Cost: $22 * 4 = $88, Cuisines: \"American, Desserts, Seafood\"\nAttraction: - (Assuming travel takes up the majority of the day)\nLunch: - (Assuming packed lunch or en route options)\nDinner: - (Assuming dinner upon arrival at home or en route options)\nAccommodation: -\n\nNumber of People = 4\nTotal Cost = $52 + $88 = $140\nAccommodation Minimum Nights: -\n\nTotal cost across all days = $1022 + $1122 + $988 + $945 + $140 = $4217\nCuisines: The prompt specifies no specific cuisines, so all cuisine constraints are satisfied.\n\nRemaining Budget: $9500 - $4217 = $5283\n\nNote: The costs for attractions are assumed to be free, which may not be the case. The actual costs could vary based on entry fees. The costs for lunch on Day 5 are not included, assuming the travelers will manage within the remaining budget or have packed meals. The accommodation chosen allows for parties as per the query's requirement.", "gpt-4-1106-preview_direct_sole-planning_parsed_results": [{"day": 1, "current_city": "from Evansville to Texarkana", "transportation": "Self-driving, from Evansville to Texarkana, Duration: 8 hours 45 mins, Distance: 889 km", "breakfast": "-", "attraction": "Museum of Regional History, Texarkana;", "lunch": "Big City Bread Cafe, Texarkana", "dinner": "Club Mojo, Texarkana", "accommodation": "Large 2.5 BR Apt In Park Slope, Texarkana"}, {"day": 2, "current_city": "Texarkana", "transportation": "-", "breakfast": "The Beer Cafe - BIGGIE, Texarkana", "attraction": "Spring Lake Park, Texarkana;", "lunch": "Purani Dilli Foods, Texarkana", "dinner": "Polka Pastry & Snack Bar, Texarkana", "accommodation": "Large 2.5 BR Apt In Park Slope, Texarkana"}, {"day": 3, "current_city": "from Texarkana to Longview", "transportation": "Self-driving, from Texarkana to Longview, Duration: 1 hour 36 mins, Distance: 142 km", "breakfast": "Wah Ji Wah, Texarkana", "attraction": "Longview World of Wonders, Longview;", "lunch": "Barbeque Nation, Longview", "dinner": "Momo Mia, Longview", "accommodation": "Newly renovated 2 bedroom with FREE WIFI, Longview"}, {"day": 4, "current_city": "Longview", "transportation": "-", "breakfast": "Green Chick Chop, Longview", "attraction": "Gregg County Historical Museum, Longview;", "lunch": "Apni Rasoi, Longview", "dinner": "Not Just Paranthas, Longview", "accommodation": "Newly renovated 2 bedroom with FREE WIFI, Longview"}, {"day": 5, "current_city": "from Longview to Evansville", "transportation": "Self-driving, from Longview to Evansville, Duration: 10 hours 8 mins, Distance: 1,045 km", "breakfast": "Subway, Longview", "attraction": "-", "lunch": "-", "dinner": "-", "accommodation": "-"}]}]