[{"gpt-4-1106-preview_direct_sole-planning_results": "Travel Plan:\n\nDay 1:\nCurrent City: from Omaha to Seattle\nTransportation: Flight Number: F3736891, from Omaha to Seattle, Departure Time: 14:43, Arrival Time: 16:28, Cost: 451\nBreakfast: -\nAttraction: Pike Place Market, Seattle, Cost: 0 (No entry fee listed)\nLunch: The Golden Dragon, Seattle, Cost: 15, Cuisines: \"BBQ, Mediterranean, Seafood\"\nDinner: Ting's Red Lantern, Seattle, Cost: 24, Cuisines: \"Italian, Bakery, BBQ, Fast Food, Chinese, Seafood\"\nAccommodation: New tidy room attached by PRIVATE FULL BATH, Seattle, Cost: 73, Maximum Occupancy: 2, House Rules: No parties & No smoking, Minimum Nights: 3\n\nNumber of People = 1\nTotal Cost = 451 + 15 + 24 + 73 = 563\nAccommodation Minimum Nights: 1/3\n\nDay 2:\nCurrent City: Seattle\nTransportation: -\nBreakfast: Hot Chimney, Seattle, Cost: 19, Cuisines: \"Tea, Pizza, Mexican, Bakery, Fast Food\"\nAttraction: Space Needle, Seattle, Cost: 0 (No entry fee listed)\nLunch: Ceviche Tapas Bar & Restaurant, Seattle, Cost: 86, Cuisines: \"Tea, Chinese, Desserts\"\nDinner: Caf\u6106 Burger BC, Seattle, Cost: 43, Cuisines: \"Tea, French, Bakery, BBQ, Seafood\"\nAccommodation: New tidy room attached by PRIVATE FULL BATH, Seattle, Cost: 73, Maximum Occupancy: 2, House Rules: No parties & No smoking, Minimum Nights: 3\n\nNumber of People = 1\nTotal Cost = 19 + 86 + 43 + 73 = 221\nAccommodation Minimum Nights: 2/3\n\nDay 3:\nCurrent City: from Seattle to Spokane\nTransportation: Flight Number: F3738208, from Seattle to Spokane, Departure Time: 11:28, Arrival Time: 12:38, Cost: 50\nBreakfast: wagamama, Seattle, Cost: 21, Cuisines: \"Tea, Pizza, Desserts, Seafood\"\nAttraction: Riverfront Park, Spokane, Cost: 0 (No entry fee listed)\nLunch: Chick-fil-A, Spokane, Cost: 83, Cuisines: \"Bakery, American, BBQ\"\nDinner: Moon River Brewing Company, Spokane, Cost: 79, Cuisines: \"Desserts, Cafe, French, Fast Food, Chinese\"\nAccommodation: Renovated 2 Bedroom Apartment, Spokane, Cost: 372, Maximum Occupancy: 2, House Rules: No parties & No visitors & No pets, Minimum Nights: 2\n\nNumber of People = 1\nTotal Cost = 50 + 21 + 83 + 79 + 372 = 605\nAccommodation Minimum Nights: 1/2\n\nDay 4:\nCurrent City: Spokane\nTransportation: -\nBreakfast: Just for Chai, Spokane, Cost: 32, Cuisines: \"Tea, Mexican, Desserts, Fast Food\"\nAttraction: Manito Park, Spokane, Cost: 0 (No entry fee listed)\nLunch: Friends Grille and Bar, Spokane, Cost: 69, Cuisines: \"Cafe, Desserts, Seafood\"\nDinner: Tanishk Gourmet Indian, Spokane, Cost: 83, Cuisines: \"Seafood, Mediterranean, Fast Food\"\nAccommodation: Renovated 2 Bedroom Apartment, Spokane, Cost: 372, Maximum Occupancy: 2, House Rules: No parties & No visitors & No pets, Minimum Nights: 2\n\nNumber of People = 1\nTotal Cost = 32 + 69 + 83 + 372 = 556\nAccommodation Minimum Nights: 2/2\n\nDay 5:\nCurrent City: from Spokane to Omaha\nTransportation: Self-driving, from Spokane to Omaha, Cost: 110\nBreakfast: Gurdasman Punjabi Khana & Caterers, Spokane, Cost: 85, Cuisines: \"Tea, Cafe, Bakery, Fast Food\"\nAttraction: -\nLunch: -\nDinner: -\nAccommodation: -\n\nNumber of People = 1\nTotal Cost = 110 + 85 = 195\n\nTotal cost across all days = 563 + 221 + 605 + 556 + 195 = 2140\n\nCuisines: The prompt specifies no cuisines, so all cuisines constraints are satisfied.\n\nNote: The attractions listed do not have an entry fee associated with them in the provided data, so they are assumed to be free of charge. The accommodation in Spokane is chosen for two nights to meet the minimum stay requirement. The transportation back to Omaha is by self-driving due to the lack of available flights on the specified date. The cost of self-driving is calculated based on the information provided. The total cost is well within the budget of $5,000.", "gpt-4-1106-preview_direct_sole-planning_parsed_results": [{"day": 1, "current_city": "from Omaha to Seattle", "transportation": "Flight Number: F3736891, from Omaha to Seattle, Departure Time: 14:43, Arrival Time: 16:28", "breakfast": "-", "attraction": "Pike Place Market, Seattle;", "lunch": "The Golden Dragon, Seattle", "dinner": "Ting's Red Lantern, Seattle", "accommodation": "New tidy room attached by PRIVATE FULL BATH, Seattle"}, {"day": 2, "current_city": "Seattle", "transportation": "-", "breakfast": "Hot Chimney, Seattle", "attraction": "Space Needle, Seattle;", "lunch": "Ceviche Tapas Bar & Restaurant, Seattle", "dinner": "Caf\u00e9 Burger BC, Seattle", "accommodation": "New tidy room attached by PRIVATE FULL BATH, Seattle"}, {"day": 3, "current_city": "from Seattle to Spokane", "transportation": "Flight Number: F3738208, from Seattle to Spokane, Departure Time: 11:28, Arrival Time: 12:38", "breakfast": "wagamama, Seattle", "attraction": "Riverfront Park, Spokane;", "lunch": "Chick-fil-A, Spokane", "dinner": "Moon River Brewing Company, Spokane", "accommodation": "Renovated 2 Bedroom Apartment, Spokane"}, {"day": 4, "current_city": "Spokane", "transportation": "-", "breakfast": "Just for Chai, Spokane", "attraction": "Manito Park, Spokane;", "lunch": "Friends Grille and Bar, Spokane", "dinner": "Tanishk Gourmet Indian, Spokane", "accommodation": "Renovated 2 Bedroom Apartment, Spokane"}, {"day": 5, "current_city": "from Spokane to Omaha", "transportation": "Self-driving, from Spokane to Omaha", "breakfast": "Gurdasman Punjabi Khana & Caterers, Spokane", "attraction": "-", "lunch": "-", "dinner": "-", "accommodation": "-"}]}]