[{"gpt-4-1106-preview_direct_sole-planning_results": "Travel Plan:\n\nDay 1: March 14, 2022\nCurrent City: from Manhattan to Texarkana\nTransportation: Self-driving, from Manhattan to Texarkana, Duration: 20 hours 36 mins, Distance: 2,218 km, Cost: $110 * ceil(3/5) = $110 * 1 = $110\nBreakfast: - (Assuming breakfast is had before departure)\nAttraction: Museum of Regional History, Texarkana, Cost: Free\nLunch: - (Assuming lunch is on the road)\nDinner: Big City Bread Cafe, Texarkana, Cost: $61 * 3 = $183, Cuisines: \"Cafe, Pizza, Bakery, BBQ\"\nAccommodation: Large 2.5 BR Apt In Park Slope, Texarkana, Cost: $269 * ceil(3/3) = $269 * 1 = $269, Maximum Occupancy: 3, House Rules: No smoking & No visitors, Minimum Nights: 1\n\nNumber of People = 3\nTotal Cost = $110 + $183 + $269 = $562\nAccommodation Minimum Nights: 1/1\n\nDay 2: March 15, 2022\nCurrent City: Texarkana\nTransportation: -\nBreakfast: Poets Cafe, Texarkana, Cost: $88 * 3 = $264, Cuisines: \"Chinese, Bakery, Indian, Desserts\"\nAttraction: Spring Lake Park, Texarkana, Cost: Free\nLunch: The Beer Cafe - BIGGIE, Texarkana, Cost: $13 * 3 = $39, Cuisines: \"Cafe, Pizza, Mediterranean, Fast Food\"\nDinner: Columbia Restaurant, Texarkana, Cost: $91 * 3 = $273, Cuisines: \"Desserts, Tea, Pizza, Indian, Seafood\"\nAccommodation: Large 2.5 BR Apt In Park Slope, Texarkana, Cost: $269 * ceil(3/3) = $269 * 1 = $269, Maximum Occupancy: 3, House Rules: No smoking & No visitors, Minimum Nights: 1\n\nNumber of People = 3\nTotal Cost = $264 + $39 + $273 + $269 = $845\nAccommodation Minimum Nights: 1/1\n\nDay 3: March 16, 2022\nCurrent City: from Texarkana to Dallas\nTransportation: Flight Number: F3603637, from Texarkana to Dallas, Departure Time: 18:17, Arrival Time: 19:14, Cost: $56 * 3 = $168\nBreakfast: Bansiwala Rasoi, Texarkana, Cost: $71 * 3 = $213, Cuisines: \"Tea, French, BBQ\"\nAttraction: Texarkana Museums System, Texarkana, Cost: Free\nLunch: Club Mojo, Texarkana, Cost: $49 * 3 = $147, Cuisines: \"Desserts, Italian, BBQ, Cafe, American\"\nDinner: Coconuts Fish Cafe, Dallas, Cost: $38 * 3 = $114, Cuisines: \"Cafe, BBQ, Mediterranean, Fast Food\"\nAccommodation: Luxury Williamsburg duplex, private roof terrace, Dallas, Cost: $241 * ceil(3/3) = $241 * 1 = $241, Maximum Occupancy: 3, House Rules: No visitors, Minimum Nights: 4\n\nNumber of People = 3\nTotal Cost = $168 + $213 + $147 + $114 + $241 = $883\nAccommodation Minimum Nights: 1/4\n\nDay 4: March 17, 2022\nCurrent City: Dallas\nTransportation: -\nBreakfast: Cafe Gatherings, Dallas, Cost: $17 * 3 = $51, Cuisines: \"Bakery, Indian, Desserts\"\nAttraction: The Dallas World Aquarium, Dallas, Cost: Free\nLunch: 1918 Bistro & Grill, Dallas, Cost: $90 * 3 = $270, Cuisines: \"Tea, Pizza, BBQ, Seafood\"\nDinner: Yanki Sizzlers, Dallas, Cost: $96 * 3 = $288, Cuisines: \"Cafe, French, Tea, Mediterranean\"\nAccommodation: Luxury Williamsburg duplex, private roof terrace, Dallas, Cost: $241 * ceil(3/3) = $241 * 1 = $241, Maximum Occupancy: 3, House Rules: No visitors, Minimum Nights: 4\n\nNumber of People = 3\nTotal Cost = $51 + $270 + $288 + $241 = $850\nAccommodation Minimum Nights: 2/4\n\nDay 5: March 18, 2022\nCurrent City: from Dallas to Manhattan\nTransportation: Flight Number: F3608417, from Dallas to Manhattan, Departure Time: 17:04, Arrival Time: 18:35, Cost: $121 * 3 = $363\nBreakfast: Drifters Cafe, Dallas, Cost: $21 * 3 = $63, Cuisines: \"Tea, French, Mexican, Cafe, Seafood\"\nAttraction: Reunion Tower, Dallas, Cost: Free\nLunch: Delhicacy, Dallas, Cost: $67 * 3 = $201, Cuisines: \"Desserts, Mexican, Bakery, Chinese, Seafood\"\nDinner: - (Assuming dinner is after arrival back in Manhattan)\nAccommodation: -\n\nNumber of People = 3\nTotal Cost = $363 + $63 + $201 = $627\n\nTotal cost across all days = $562 + $845 + $883 + $850 + $627 = $3767\nRemaining Budget = $3900 - $3767 = $133\n\nCuisines: The prompt specifies no cuisines, so all cuisines constraints are satisfied.\nHouse Rules: The accommodations chosen allow parties as they do not specifically prohibit them.", "gpt-4-1106-preview_direct_sole-planning_parsed_results": [{"day": 1, "current_city": "from Manhattan to Texarkana", "transportation": "Self-driving, from Manhattan to Texarkana, Duration: 20 hours 36 mins, Distance: 2,218 km", "breakfast": "-", "attraction": "Museum of Regional History, Texarkana", "lunch": "-", "dinner": "Big City Bread Cafe, Texarkana", "accommodation": "Large 2.5 BR Apt In Park Slope, Texarkana"}, {"day": 2, "current_city": "Texarkana", "transportation": "-", "breakfast": "Poets Cafe, Texarkana", "attraction": "Spring Lake Park, Texarkana", "lunch": "The Beer Cafe - BIGGIE, Texarkana", "dinner": "Columbia Restaurant, Texarkana", "accommodation": "Large 2.5 BR Apt In Park Slope, Texarkana"}, {"day": 3, "current_city": "from Texarkana to Dallas", "transportation": "Flight Number: F3603637, from Texarkana to Dallas, Departure Time: 18:17, Arrival Time: 19:14", "breakfast": "Bansiwala Rasoi, Texarkana", "attraction": "Texarkana Museums System, Texarkana", "lunch": "Club Mojo, Texarkana", "dinner": "Coconuts Fish Cafe, Dallas", "accommodation": "Luxury Williamsburg duplex, private roof terrace, Dallas"}, {"day": 4, "current_city": "Dallas", "transportation": "-", "breakfast": "Cafe Gatherings, Dallas", "attraction": "The Dallas World Aquarium, Dallas", "lunch": "1918 Bistro & Grill, Dallas", "dinner": "Yanki Sizzlers, Dallas", "accommodation": "Luxury Williamsburg duplex, private roof terrace, Dallas"}, {"day": 5, "current_city": "from Dallas to Manhattan", "transportation": "Flight Number: F3608417, from Dallas to Manhattan, Departure Time: 17:04, Arrival Time: 18:35", "breakfast": "Drifters Cafe, Dallas", "attraction": "Reunion Tower, Dallas", "lunch": "Delhicacy, Dallas", "dinner": "-", "accommodation": "-"}]}]