[{"gpt-4-1106-preview_direct_sole-planning_results": "Travel Plan:\n\nDay 1: March 8, 2022\nCurrent City: from Miami to San Diego\nTransportation: Flight Number: F3726825, from Miami to San Diego, Departure Time: 19:07, Arrival Time: 21:25, Cost: $1072 * 2 = $2144\nDinner: Open Yard, San Diego, Cost: $33 * 2 = $66, Cuisines: \"Chinese, Pizza, Cafe, Desserts\"\nAccommodation: Spacious Room in Large 2 Bedroom Prewar Apartment, San Diego, Cost: $585 * 1 = $585, Maximum Occupancy: 2, House Rules: No parties & No visitors, Minimum Nights: 1\n\nNumber of People = 2\nTotal Cost = $2144 + $66 + $585 = $2795\nAccommodation Minimum Nights: 1/1\n\nDay 2: March 9, 2022\nCurrent City: San Diego\nBreakfast: Jetha Lal Ka Dhabha, San Diego, Cost: $22 * 2 = $44, Cuisines: \"Tea, Cafe, Indian, Italian\"\nAttraction: Balboa Park, San Diego, Cost: $0 (assuming no entrance fee)\nLunch: Gopala, San Diego, Cost: $98 * 2 = $196, Cuisines: \"Pizza, Mexican, BBQ, American, Seafood\"\nDinner: Burger King, San Diego, Cost: $20 * 2 = $40, Cuisines: \"Pizza, Italian, French, Fast Food, Seafood\"\nAccommodation: Spacious Room in Large 2 Bedroom Prewar Apartment, San Diego, Cost: $585 * 1 = $585, Maximum Occupancy: 2, House Rules: No parties & No visitors, Minimum Nights: 1\n\nNumber of People = 2\nTotal Cost = $44 + $196 + $40 + $585 = $865\nAccommodation Minimum Nights: 1/1\n\nDay 3: March 10, 2022\nCurrent City: from San Diego to Sacramento\nTransportation: Flight Number: F3943115, from San Diego to Sacramento, Departure Time: 20:22, Arrival Time: 21:48, Cost: $103 * 2 = $206\nBreakfast: Open Yard, San Diego, Cost: $33 * 2 = $66, Cuisines: \"Chinese, Pizza, Cafe, Desserts\"\nAttraction: SeaWorld San Diego, San Diego, Cost: $0 (assuming no entrance fee)\nLunch: Chaudhary Di Hatti, San Diego, Cost: $30 * 2 = $60, Cuisines: \"Desserts, Pizza, Italian, BBQ, Fast Food\"\nDinner: Gujarati Samaj Santushti, Sacramento, Cost: $12 * 2 = $24, Cuisines: \"Tea, Pizza, Fast Food\"\nAccommodation: Free Cleaning & WiFi-Near Train + Bars & Nightlife, Sacramento, Cost: $237 * 1 = $237, Maximum Occupancy: 2, House Rules: No parties, Minimum Nights: 30\n\nNumber of People = 2\nTotal Cost = $206 + $66 + $60 + $24 + $237 = $593\nAccommodation Minimum Nights: 1/30\n\nDay 4: March 11, 2022\nCurrent City: Sacramento\nBreakfast: Gujarati Samaj Santushti, Sacramento, Cost: $12 * 2 = $24, Cuisines: \"Tea, Pizza, Fast Food\"\nAttraction: California State Capitol Museum, Sacramento, Cost: $0 (assuming no entrance fee)\nLunch: Metro Fast Food, Sacramento, Cost: $32 * 2 = $64, Cuisines: \"American, BBQ, Cafe, Indian, Seafood\"\nDinner: Bahama Breeze Island Grille, Sacramento, Cost: $31 * 2 = $62, Cuisines: \"French, Bakery, BBQ, Fast Food, Seafood\"\nAccommodation: Free Cleaning & WiFi-Near Train + Bars & Nightlife, Sacramento, Cost: $237 * 1 = $237, Maximum Occupancy: 2, House Rules: No parties, Minimum Nights: 30\n\nNumber of People = 2\nTotal Cost = $24 + $64 + $62 + $237 = $387\nAccommodation Minimum Nights: 2/30\n\nDay 5: March 12, 2022\nCurrent City: from Sacramento to Los Angeles\nTransportation: Flight Number: F3972853, from Sacramento to Los Angeles, Departure Time: 12:06, Arrival Time: 13:27, Cost: $79 * 2 = $158\nBreakfast: Gujarati Samaj Santushti, Sacramento, Cost: $12 * 2 = $24, Cuisines: \"Tea, Pizza, Fast Food\"\nAttraction: Griffith Observatory, Los Angeles, Cost: $0 (assuming no entrance fee)\nLunch: Palmshore, Los Angeles, Cost: $25 * 2 = $50, Cuisines: \"Desserts, Bakery, Fast Food, American, Seafood\"\nDinner: Punjabi Zaika, Los Angeles, Cost: $46 * 2 = $92, Cuisines: \"Pizza, Bakery, BBQ, Cafe, Indian\"\nAccommodation: Lovely studio, Los Angeles, Cost: $117 * 1 = $117, Maximum Occupancy: 3, House Rules: No visitors, Minimum Nights: 1\n\nNumber of People = 2\nTotal Cost = $158 + $24 + $50 + $92 + $117 = $441\nAccommodation Minimum Nights: 1/1\n\nDay 6: March 13, 2022\nCurrent City: Los Angeles\nBreakfast: Punjabi Zaika, Los Angeles, Cost: $46 * 2 = $92, Cuisines: \"Pizza, Bakery, BBQ, Cafe, Indian\"\nAttraction: Universal Studios Hollywood, Los Angeles, Cost: $0 (assuming no entrance fee)\nLunch: Chicken Minar, Los Angeles, Cost: $25 * 2 = $50, Cuisines: \"Bakery, Fast Food\"\nDinner: Heat - Edsa Shangri-La, Los Angeles, Cost: $148 * 2 = $296, Cuisines: \"Bakery, BBQ\"\nAccommodation: Lovely studio, Los Angeles, Cost: $117 * 1 = $117, Maximum Occupancy: 3, House Rules: No visitors, Minimum Nights: 1\n\nNumber of People = 2\nTotal Cost = $92 + $50 + $296 + $117 = $555\nAccommodation Minimum Nights: 1/1\n\nDay 7: March 14, 2022\nCurrent City: from Los Angeles to Miami\nTransportation: Flight Number: F3659468, from Los Angeles to Miami, Departure Time: 22:14, Arrival Time: 05:42, Cost: $489 * 2 = $978\nBreakfast: Punjabi Zaika, Los Angeles, Cost: $46 * 2 = $92, Cuisines: \"Pizza, Bakery, BBQ, Cafe, Indian\"\nAttraction: Santa Monica Pier, Los Angeles, Cost: $0 (assuming no entrance fee)\nLunch: Palmshore, Los Angeles, Cost: $25 * 2 = $50, Cuisines: \"Desserts, Bakery, Fast Food, American, Seafood\"\nDinner: - (Assuming dinner will be on the flight or after arrival in Miami)\nAccommodation: -\n\nNumber of People = 2\nTotal Cost = $978 + $92 + $50 = $1120\nAccommodation Minimum Nights: -\n\nTotal cost across all days = $2795 + $865 + $593 + $387 + $441 + $555 + $1120 = $6856\nCuisines: Mexican and American cuisine preferences are satisfied with multiple meals throughout the trip.\n\nPlease note that the attractions listed do not have prices associated with them in the provided data, so they are assumed to be free of charge. If there are entrance fees, they would need to be factored into the budget. Additionally, the accommodation in Sacramento has a minimum stay of 30 nights, which is not suitable for this itinerary, but due to the lack of other options in the provided data, it has been included for the sake of completing the plan. In a real-world scenario, alternative accommodation would need to be found.", "gpt-4-1106-preview_direct_sole-planning_parsed_results": [{"day": 1, "current_city": "from Miami to San Diego", "transportation": "Flight Number: F3726825, from Miami to San Diego, Departure Time: 19:07, Arrival Time: 21:25", "breakfast": "-", "attraction": "-", "lunch": "-", "dinner": "Open Yard, San Diego", "accommodation": "Spacious Room in Large 2 Bedroom Prewar Apartment, San Diego"}, {"day": 2, "current_city": "San Diego", "transportation": "-", "breakfast": "Jetha Lal Ka Dhabha, San Diego", "attraction": "Balboa Park, San Diego;", "lunch": "Gopala, San Diego", "dinner": "Burger King, San Diego", "accommodation": "Spacious Room in Large 2 Bedroom Prewar Apartment, San Diego"}, {"day": 3, "current_city": "from San Diego to Sacramento", "transportation": "Flight Number: F3943115, from San Diego to Sacramento, Departure Time: 20:22, Arrival Time: 21:48", "breakfast": "Open Yard, San Diego", "attraction": "SeaWorld San Diego, San Diego;", "lunch": "Chaudhary Di Hatti, San Diego", "dinner": "Gujarati Samaj Santushti, Sacramento", "accommodation": "Free Cleaning & WiFi-Near Train + Bars & Nightlife, Sacramento"}, {"day": 4, "current_city": "Sacramento", "transportation": "-", "breakfast": "Gujarati Samaj Santushti, Sacramento", "attraction": "California State Capitol Museum, Sacramento;", "lunch": "Metro Fast Food, Sacramento", "dinner": "Bahama Breeze Island Grille, Sacramento", "accommodation": "Free Cleaning & WiFi-Near Train + Bars & Nightlife, Sacramento"}, {"day": 5, "current_city": "from Sacramento to Los Angeles", "transportation": "Flight Number: F3972853, from Sacramento to Los Angeles, Departure Time: 12:06, Arrival Time: 13:27", "breakfast": "Gujarati Samaj Santushti, Sacramento", "attraction": "Griffith Observatory, Los Angeles;", "lunch": "Palmshore, Los Angeles", "dinner": "Punjabi Zaika, Los Angeles", "accommodation": "Lovely studio, Los Angeles"}, {"day": 6, "current_city": "Los Angeles", "transportation": "-", "breakfast": "Punjabi Zaika, Los Angeles", "attraction": "Universal Studios Hollywood, Los Angeles;", "lunch": "Chicken Minar, Los Angeles", "dinner": "Heat - Edsa Shangri-La, Los Angeles", "accommodation": "Lovely studio, Los Angeles"}, {"day": 7, "current_city": "from Los Angeles to Miami", "transportation": "Flight Number: F3659468, from Los Angeles to Miami, Departure Time: 22:14, Arrival Time: 05:42", "breakfast": "Punjabi Zaika, Los Angeles", "attraction": "Santa Monica Pier, Los Angeles;", "lunch": "Palmshore, Los Angeles", "dinner": "-", "accommodation": "-"}]}]