[{"gpt-4-1106-preview_direct_sole-planning_results": "Travel Plan:\n\nDay 1: March 19th\nCurrent City: from Houston to Wichita\nTransportation: Flight Number: F3811146, from Houston to Wichita, Departure Time: 14:17, Arrival Time: 16:13, Cost: $168\nBreakfast: - (Assuming breakfast is before the flight)\nAttraction: Old Cowtown Museum, Wichita, Cost: $0 (No price provided, assuming free entry)\nLunch: Jahanpanah, Wichita, Cost: $18, Cuisines: \"Indian, Desserts, Fast Food\"\nDinner: Chimney - The Takeaway, Wichita, Cost: $19, Cuisines: \"Pizza, Bakery, Cafe, Mediterranean, Seafood\"\nAccommodation: Secret Garden Apartment in Bed Stuy, Brooklyn, Wichita, Cost: $214, Maximum Occupancy: 3, House Rules: No smoking & No children under 10, Minimum Nights: 2\n\nNumber of People = 3\nTotal Cost = 3 * $168 + 3 * $18 + 3 * $19 + $214 = $823\nAccommodation Minimum Nights: 1/2\n\nDay 2: March 20th\nCurrent City: Wichita\nTransportation: -\nBreakfast: The Cake Affairs, Wichita, Cost: $15, Cuisines: \"Tea, Seafood\"\nAttraction: Sedgwick County Zoo, Wichita, Cost: $0 (No price provided, assuming free entry)\nLunch: The B.A.W.A, Wichita, Cost: $23, Cuisines: \"Tea, Chinese, Pizza, BBQ\"\nDinner: Veer Jee Restaurant, Wichita, Cost: $33, Cuisines: \"Desserts, Tea, Italian, BBQ, Fast Food\"\nAccommodation: Secret Garden Apartment in Bed Stuy, Brooklyn, Wichita, Cost: $214, Maximum Occupancy: 3, House Rules: No smoking & No children under 10, Minimum Nights: 2\n\nNumber of People = 3\nTotal Cost = 3 * $15 + 3 * $23 + 3 * $33 + $214 = $451\nAccommodation Minimum Nights: 2/2\n\nDay 3: March 21st\nCurrent City: from Wichita to Houston\nTransportation: Flight Number: F3827493, from Wichita to Houston, Departure Time: 17:52, Arrival Time: 20:18, Cost: $147\nBreakfast: Dinesh Ka Mithila Dhaba, Wichita, Cost: $12, Cuisines: \"Tea, Bakery, Mediterranean\"\nAttraction: The Keeper of the Plains, Wichita, Cost: $0 (No price provided, assuming free entry)\nLunch: Carbon Bistro, Wichita, Cost: $19, Cuisines: \"Seafood, Desserts, Italian\"\nDinner: - (Assuming dinner is after the flight)\nAccommodation: -\n\nNumber of People = 3\nTotal Cost = 3 * $147 + 3 * $12 + 3 * $19 = $534\n\nTotal cost across all days = $823 + $451 + $534 = $1808\nCuisines: The prompt specifies no cuisines, so all cuisines constraints are satisfied.\n\nNote: Since the query specifies that smoking is a necessity, the chosen accommodation does not meet this requirement as it has a \"No smoking\" house rule. However, due to the budget constraints and the available data, we are unable to provide an accommodation that allows smoking. It is recommended to seek an alternative accommodation that permits smoking or to make arrangements for smoking outside the accommodation premises.", "gpt-4-1106-preview_direct_sole-planning_parsed_results": [{"day": 1, "current_city": "from Houston to Wichita", "transportation": "Flight Number: F3811146, from Houston to Wichita, Departure Time: 14:17, Arrival Time: 16:13", "breakfast": "-", "attraction": "Old Cowtown Museum, Wichita;", "lunch": "Jahanpanah, Wichita", "dinner": "Chimney - The Takeaway, Wichita", "accommodation": "Secret Garden Apartment in Bed Stuy, Brooklyn, Wichita"}, {"day": 2, "current_city": "Wichita", "transportation": "-", "breakfast": "The Cake Affairs, Wichita", "attraction": "Sedgwick County Zoo, Wichita;", "lunch": "The B.A.W.A, Wichita", "dinner": "Veer Jee Restaurant, Wichita", "accommodation": "Secret Garden Apartment in Bed Stuy, Brooklyn, Wichita"}, {"day": 3, "current_city": "from Wichita to Houston", "transportation": "Flight Number: F3827493, from Wichita to Houston, Departure Time: 17:52, Arrival Time: 20:18", "breakfast": "Dinesh Ka Mithila Dhaba, Wichita", "attraction": "The Keeper of the Plains, Wichita;", "lunch": "Carbon Bistro, Wichita", "dinner": "-", "accommodation": "-"}]}]