[{"gpt-4-1106-preview_direct_sole-planning_results": "Travel Plan:\n\nDay 1: March 14, 2022\nCurrent City: from Washington to Los Angeles\nTransportation: Flight Number: F3779009, from Washington to Los Angeles, Departure Time: 17:20, Arrival Time: 19:32, Cost: $464 * 2 = $928\nBreakfast: -\nLunch: -\nDinner: Palmshore, Los Angeles, Cost: $25 * 2 = $50, Cuisines: \"Desserts, Bakery, Fast Food, American, Seafood\"\nAccommodation: Lovely studio, Los Angeles, Cost: $117 * 1 = $117, Maximum Occupancy: 3, House Rules: No visitors, Minimum Nights: 1\n\nNumber of People = 2\nTotal Cost for Day 1 = $928 (Flight) + $50 (Dinner) + $117 (Accommodation) = $1095\n\nDay 2: March 15, 2022\nCurrent City: Los Angeles\nTransportation: -\nBreakfast: Punjabi Zaika, Los Angeles, Cost: $46 * 2 = $92, Cuisines: \"Pizza, Bakery, BBQ, Cafe, Indian\"\nAttraction: Santa Monica Pier, Los Angeles\nLunch: Choco Kraft, Los Angeles, Cost: $20 * 2 = $40, Cuisines: \"French, BBQ, Fast Food, Cafe, Mediterranean\"\nDinner: Village - The House of Food, Los Angeles, Cost: $87 * 2 = $174, Cuisines: \"Chinese, Pizza, Cafe\"\nAccommodation: Lovely studio, Los Angeles, Cost: $117 * 1 = $117, Maximum Occupancy: 3, House Rules: No visitors, Minimum Nights: 1\n\nNumber of People = 2\nTotal Cost for Day 2 = $92 (Breakfast) + $40 (Lunch) + $174 (Dinner) + $117 (Accommodation) = $423\n\nDay 3: March 16, 2022\nCurrent City: from Los Angeles to San Francisco\nTransportation: Flight Number: F3744801, from Los Angeles to San Francisco, Departure Time: 05:54, Arrival Time: 07:22, Cost: $79 * 2 = $158\nBreakfast: -\nAttraction: Golden Gate Bridge, San Francisco\nLunch: Coffee & Chai Co., San Francisco, Cost: $10 * 2 = $20, Cuisines: \"Tea, Mexican, BBQ, Cafe, Seafood\"\nDinner: Bonne Bouche, San Francisco, Cost: $21 * 2 = $42, Cuisines: \"Tea, Chinese, American, Cafe\"\nAccommodation: Room in Down town Brooklyn Parkslop, San Francisco, Cost: $79 * 1 = $79, Maximum Occupancy: 2, House Rules: No visitors, Minimum Nights: 1\n\nNumber of People = 2\nTotal Cost for Day 3 = $158 (Flight) + $20 (Lunch) + $42 (Dinner) + $79 (Accommodation) = $299\n\nDay 4: March 17, 2022\nCurrent City: San Francisco\nTransportation: -\nBreakfast: Tokyo Sushi, San Francisco, Cost: $18 * 2 = $36, Cuisines: \"Cafe, Pizza, BBQ\"\nAttraction: Exploratorium, San Francisco\nLunch: Sudarshan, San Francisco, Cost: $53 * 2 = $106, Cuisines: \"Fast Food, Bakery, Mediterranean, Italian\"\nDinner: Empress, San Francisco, Cost: $24 * 2 = $48, Cuisines: \"Pizza, BBQ, Mediterranean, Fast Food\"\nAccommodation: Room in Down town Brooklyn Parkslop, San Francisco, Cost: $79 * 1 = $79, Maximum Occupancy: 2, House Rules: No visitors, Minimum Nights: 1\n\nNumber of People = 2\nTotal Cost for Day 4 = $36 (Breakfast) + $106 (Lunch) + $48 (Dinner) + $79 (Accommodation) = $269\n\nDay 5: March 18, 2022\nCurrent City: from San Francisco to Washington\nTransportation: Flight Number: F3907821, from San Francisco to Washington, Departure Time: 22:55, Arrival Time: 06:57, Cost: $551 * 2 = $1102\nBreakfast: -\nAttraction: San Francisco Museum of Modern Art, San Francisco\nLunch: Green Chick Chop, San Francisco, Cost: $39 * 2 = $78, Cuisines: \"Tea, Pizza, Italian, BBQ, Mediterranean, Seafood\"\nDinner: -\nAccommodation: -\n\nNumber of People = 2\nTotal Cost for Day 5 = $1102 (Flight) + $78 (Lunch) = $1180\n\nTotal cost across all days = $1095 (Day 1) + $423 (Day 2) + $299 (Day 3) + $269 (Day 4) + $1180 (Day 5) = $3266\n\nCuisines: Preferences for Chinese, Mexican, American, and Italian cuisines have been met with the selected restaurants.\n\nRemaining Budget: $4600 - $3266 = $1334\n\nPlease note that the cost of attractions has not been included as the pricing information is not provided. The remaining budget can be used for attractions, additional meals, or other expenses.", "gpt-4-1106-preview_direct_sole-planning_parsed_results": [{"day": 1, "current_city": "from Washington to Los Angeles", "transportation": "Flight Number: F3779009, from Washington to Los Angeles, Departure Time: 17:20, Arrival Time: 19:32", "breakfast": "-", "attraction": "-", "lunch": "-", "dinner": "Palmshore, Los Angeles", "accommodation": "Lovely studio, Los Angeles"}, {"day": 2, "current_city": "Los Angeles", "transportation": "-", "breakfast": "Punjabi Zaika, Los Angeles", "attraction": "Santa Monica Pier, Los Angeles;", "lunch": "Choco Kraft, Los Angeles", "dinner": "Village - The House of Food, Los Angeles", "accommodation": "Lovely studio, Los Angeles"}, {"day": 3, "current_city": "from Los Angeles to San Francisco", "transportation": "Flight Number: F3744801, from Los Angeles to San Francisco, Departure Time: 05:54, Arrival Time: 07:22", "breakfast": "-", "attraction": "Golden Gate Bridge, San Francisco;", "lunch": "Coffee & Chai Co., San Francisco", "dinner": "Bonne Bouche, San Francisco", "accommodation": "Room in Down town Brooklyn Parkslop, San Francisco"}, {"day": 4, "current_city": "San Francisco", "transportation": "-", "breakfast": "Tokyo Sushi, San Francisco", "attraction": "Exploratorium, San Francisco;", "lunch": "Sudarshan, San Francisco", "dinner": "Empress, San Francisco", "accommodation": "Room in Down town Brooklyn Parkslop, San Francisco"}, {"day": 5, "current_city": "from San Francisco to Washington", "transportation": "Flight Number: F3907821, from San Francisco to Washington, Departure Time: 22:55, Arrival Time: 06:57", "breakfast": "-", "attraction": "San Francisco Museum of Modern Art, San Francisco;", "lunch": "Green Chick Chop, San Francisco", "dinner": "-", "accommodation": "-"}]}]