[{"gpt-4-1106-preview_direct_sole-planning_results": "Travel Plan:\n\nDay 1: March 24, 2022\nCurrent City: from Atlanta to Chicago\nTransportation: Flight Number: F3492831, from Atlanta to Chicago, Departure Time: 20:59, Arrival Time: 21:47, Cost: $175 * 2 = $350\nBreakfast: - (Not applicable as the flight is in the evening)\nAttraction: - (Assuming arrival is too late for an attraction visit)\nLunch: - (Not applicable as the flight is in the evening)\nDinner: - (Not included in the plan, can be assumed to be personal time)\nAccommodation: NYC Firehouse-Greenpoint BRKLYN, Chicago, Cost: $109 * 2 (2 people) = $218, Maximum Occupancy: 3, House Rules: No smoking & No parties, Minimum Nights: 3\n\nNumber of People = 2\nTotal Cost = $350 (Flight) + $218 (Accommodation) = $568\nAccommodation Minimum Nights: 1/3\n\nDay 2: March 25, 2022\nCurrent City: Chicago\nTransportation: -\nBreakfast: The Black Pearl, Chicago, Cost: $63 * 2 = $126, Cuisines: Cafe, Bakery\nAttraction: Navy Pier, Chicago, Cost: $0 (Assuming no entrance fee or within budget)\nLunch: Bro's Kitchenette, Chicago, Cost: $38 * 2 = $76, Cuisines: Mexican, Desserts, Seafood\nDinner: Pantry d'or, Chicago, Cost: $53 * 2 = $106, Cuisines: Tea, BBQ, Fast Food, Cafe, Indian\nAccommodation: NYC Firehouse-Greenpoint BRKLYN, Chicago, Cost: $109 * 2 = $218, Maximum Occupancy: 3, House Rules: No smoking & No parties, Minimum Nights: 3\n\nNumber of People = 2\nTotal Cost = $126 (Breakfast) + $76 (Lunch) + $106 (Dinner) + $218 (Accommodation) = $526\nAccommodation Minimum Nights: 2/3\n\nDay 3: March 26, 2022\nCurrent City: from Chicago to Atlanta\nTransportation: Flight Number: F3505549, from Chicago to Atlanta, Departure Time: 09:28, Arrival Time: 12:58, Cost: $155 * 2 = $310\nBreakfast: - (Assuming breakfast at accommodation or personal time)\nAttraction: - (No time for attractions due to morning flight)\nLunch: - (Not applicable due to travel)\nDinner: - (Not included in the plan, can be assumed to be personal time after return)\nAccommodation: -\n\nNumber of People = 2\nTotal Cost = $310 (Flight)\n\nTotal cost across all days = $568 (Day 1) + $526 (Day 2) + $310 (Day 3) = $1404\nRemaining Budget = $1900 - $1404 = $496\n\nCuisines: The prompt specifies no specific cuisines, so all cuisines constraints are satisfied.\nAccommodations: All accommodations are entire rooms as requested.\n\nPlease note that the costs for attractions are assumed to be within the remaining budget or free of charge, as no specific pricing was provided. Any personal expenses outside of the planned meals and attractions are not included and should be managed within the remaining budget.", "gpt-4-1106-preview_direct_sole-planning_parsed_results": [{"day": 1, "current_city": "from Atlanta to Chicago", "transportation": "Flight Number: F3492831, from Atlanta to Chicago, Departure Time: 20:59, Arrival Time: 21:47", "breakfast": "-", "attraction": "-", "lunch": "-", "dinner": "-", "accommodation": "NYC Firehouse-Greenpoint BRKLYN, Chicago"}, {"day": 2, "current_city": "Chicago", "transportation": "-", "breakfast": "The Black Pearl, Chicago", "attraction": "Navy Pier, Chicago;", "lunch": "Bro's Kitchenette, Chicago", "dinner": "Pantry d'or, Chicago", "accommodation": "NYC Firehouse-Greenpoint BRKLYN, Chicago"}, {"day": 3, "current_city": "from Chicago to Atlanta", "transportation": "Flight Number: F3505549, from Chicago to Atlanta, Departure Time: 09:28, Arrival Time: 12:58", "breakfast": "-", "attraction": "-", "lunch": "-", "dinner": "-", "accommodation": "-"}]}]