[{"gpt-4-1106-preview_direct_sole-planning_results": "Travel Plan:\n\nDay 1: March 2, 2022\nCurrent City: from Philadelphia to Richmond\nTransportation: Flight Number: F3730354, from Philadelphia to Richmond, Departure Time: 13:39, Arrival Time: 14:52, Cost: 44 * 7 = $308\nBreakfast: -\nAttraction: Virginia State Capitol, Richmond, Cost: $0 (assuming free entry)\nLunch: The Spot, Richmond, Cost: 17 * 7 = $119\nDinner: Guang Zhou Chinese Restaurant, Richmond, Cost: 84 * 7 = $588\nAccommodation: Gorgeous studio in midtown Manhattan, Richmond, Cost: 212 * ceil(7/3) = $212 * 3 = $636, Maximum Occupancy: 3, House Rules: No parties & No children under 10, Minimum Nights: 30\n\nNumber of People = 7\nTotal Cost for Day 1 = 308 + 119 + 588 + 636 = $1651\nAccommodation Minimum Nights: 1/30\n\nDay 2: March 3, 2022\nCurrent City: Richmond\nTransportation: -\nBreakfast: Sandpiper Restaurant & Lounge, Richmond, Cost: 20 * 7 = $140\nAttraction: Maymont, Richmond, Cost: $0 (assuming free entry)\nLunch: Sugarcraft Patisserie, Richmond, Cost: 38 * 7 = $266\nDinner: Paradise, Richmond, Cost: 80 * 7 = $560\nAccommodation: Gorgeous studio in midtown Manhattan, Richmond, Cost: 212 * ceil(7/3) = $212 * 3 = $636\n\nNumber of People = 7\nTotal Cost for Day 2 = 140 + 266 + 560 + 636 = $1602\nAccommodation Minimum Nights: 2/30\n\nDay 3: March 4, 2022\nCurrent City: from Richmond to Jamestown\nTransportation: Self-driving, Cost: 4 * ceil(7/5) = $4 * 2 = $8\nBreakfast: -\nAttraction: Historic Jamestowne, Jamestown, Cost: $0 (assuming free entry)\nLunch: Cafe Soul Garden, Jamestown, Cost: 99 * 7 = $693\nDinner: Beyond Breads, Jamestown, Cost: 95 * 7 = $665\nAccommodation: New York City Manhattan Midtown Convenient Place, Jamestown, Cost: 795 * ceil(7/6) = $795 * 2 = $1590, Maximum Occupancy: 6, House Rules: No visitors & No parties & No children under 10, Minimum Nights: 1\n\nNumber of People = 7\nTotal Cost for Day 3 = 8 + 693 + 665 + 1590 = $2956\nAccommodation Minimum Nights: 1/1\n\nDay 4: March 5, 2022\nCurrent City: Jamestown\nTransportation: -\nBreakfast: Chauhan Hotel, Jamestown, Cost: 13 * 7 = $91\nAttraction: Jamestown Settlement, Jamestown, Cost: $0 (assuming free entry)\nLunch: Mughlai Flavours, Jamestown, Cost: 12 * 7 = $84\nDinner: Vine - The St. Regis, Jamestown, Cost: 98 * 7 = $686\nAccommodation: New York City Manhattan Midtown Convenient Place, Jamestown, Cost: 795 * ceil(7/6) = $795 * 2 = $1590\n\nNumber of People = 7\nTotal Cost for Day 4 = 91 + 84 + 686 + 1590 = $2451\nAccommodation Minimum Nights: 2/1\n\nDay 5: March 6, 2022\nCurrent City: from Jamestown to Charlottesville\nTransportation: Self-driving, Cost: 10 * ceil(7/5) = $10 * 2 = $20\nBreakfast: -\nAttraction: Monticello, Charlottesville, Cost: $0 (assuming free entry)\nLunch: Mama's Fish House, Charlottesville, Cost: 63 * 7 = $441\nDinner: Restaurant Andre, Charlottesville, Cost: 250 * 7 = $1750\nAccommodation: Williamsburg Hidden Gem, Charlottesville, Cost: 391 * ceil(7/2) = $391 * 4 = $1564, Maximum Occupancy: 2, House Rules: No visitors & No smoking, Minimum Nights: 1\n\nNumber of People = 7\nTotal Cost for Day 5 = 20 + 441 + 1750 + 1564 = $3775\nAccommodation Minimum Nights: 1/1\n\nDay 6: March 7, 2022\nCurrent City: Charlottesville\nTransportation: -\nBreakfast: Domino's Pizza, Charlottesville, Cost: 53 * 7 = $371\nAttraction: The Fralin Museum of Art at the University of Virginia, Charlottesville, Cost: $0 (assuming free entry)\nLunch: Takamaka, Charlottesville, Cost: 72 * 7 = $504\nDinner: Sandys Cocktails & Kitchen, Charlottesville, Cost: 82 * 7 = $574\nAccommodation: Williamsburg Hidden Gem, Charlottesville, Cost: 391 * ceil(7/2) = $391 * 4 = $1564\n\nNumber of People = 7\nTotal Cost for Day 6 = 371 + 504 + 574 + 1564 = $3013\nAccommodation Minimum Nights: 2/1\n\nDay 7: March 8, 2022\nCurrent City: from Charlottesville to Philadelphia\nTransportation: Self-driving, Cost: 20 * ceil(7/5) = $20 * 2 = $40\nBreakfast: -\nAttraction: -\nLunch: -\nDinner: -\nAccommodation: -\n\nNumber of People = 7\nTotal Cost for Day 7 = $40\n\nTotal cost across all days = 1651 + 1602 + 2956 + 2451 + 3775 + 3013 + 40 = $15478\n\nUnfortunately, the total cost of $15,478 exceeds the available budget of $2,900. Adjustments will need to be made to the plan to fit within the budget constraints. This could involve selecting cheaper accommodations, dining options, and attractions, or potentially reducing the number of cities visited.", "gpt-4-1106-preview_direct_sole-planning_parsed_results": [{"day": 1, "current_city": "from Philadelphia to Richmond", "transportation": "Flight Number: F3730354, from Philadelphia to Richmond, Departure Time: 13:39, Arrival Time: 14:52", "breakfast": "-", "attraction": "Virginia State Capitol, Richmond;", "lunch": "The Spot, Richmond", "dinner": "Guang Zhou Chinese Restaurant, Richmond", "accommodation": "Gorgeous studio in midtown Manhattan, Richmond"}, {"day": 2, "current_city": "Richmond", "transportation": "-", "breakfast": "Sandpiper Restaurant & Lounge, Richmond", "attraction": "Maymont, Richmond;", "lunch": "Sugarcraft Patisserie, Richmond", "dinner": "Paradise, Richmond", "accommodation": "Gorgeous studio in midtown Manhattan, Richmond"}, {"day": 3, "current_city": "from Richmond to Jamestown", "transportation": "Self-driving", "breakfast": "-", "attraction": "Historic Jamestowne, Jamestown;", "lunch": "Cafe Soul Garden, Jamestown", "dinner": "Beyond Breads, Jamestown", "accommodation": "New York City Manhattan Midtown Convenient Place, Jamestown"}, {"day": 4, "current_city": "Jamestown", "transportation": "-", "breakfast": "Chauhan Hotel, Jamestown", "attraction": "Jamestown Settlement, Jamestown;", "lunch": "Mughlai Flavours, Jamestown", "dinner": "Vine - The St. Regis, Jamestown", "accommodation": "New York City Manhattan Midtown Convenient Place, Jamestown"}, {"day": 5, "current_city": "from Jamestown to Charlottesville", "transportation": "Self-driving", "breakfast": "-", "attraction": "Monticello, Charlottesville;", "lunch": "Mama's Fish House, Charlottesville", "dinner": "Restaurant Andre, Charlottesville", "accommodation": "Williamsburg Hidden Gem, Charlottesville"}, {"day": 6, "current_city": "Charlottesville", "transportation": "-", "breakfast": "Domino's Pizza, Charlottesville", "attraction": "The Fralin Museum of Art at the University of Virginia, Charlottesville;", "lunch": "Takamaka, Charlottesville", "dinner": "Sandys Cocktails & Kitchen, Charlottesville", "accommodation": "Williamsburg Hidden Gem, Charlottesville"}, {"day": 7, "current_city": "from Charlottesville to Philadelphia", "transportation": "Self-driving", "breakfast": "-", "attraction": "-", "lunch": "-", "dinner": "-", "accommodation": "-"}]}]