[{"gpt-4-1106-preview_direct_sole-planning_results": "Travel Plan:\n\nDay 1: March 5, 2022\nCurrent City: from Fort Lauderdale to Houston\nTransportation: Flight Number: F3902913, from Fort Lauderdale to Houston, Departure Time: 09:18, Arrival Time: 10:58, Cost: $452\nBreakfast: - (Assuming breakfast is before the flight)\nAttraction: Water Wall, Houston, Cost: Free\nLunch: Jalapenos, Houston, Cost: $114, Cuisines: \"Desserts, Tea, Cafe, Chinese, Seafood\"\nDinner: The BrewMaster - The Mix Fine Dine, Houston, Cost: $104, Cuisines: \"French, Indian, Cafe, Seafood\"\nAccommodation: Superhost 3 bedroom DISCOUNT, Houston, Cost: $746, Maximum Occupancy: 5, House Rules: No pets, Minimum Nights: 1\n\nNumber of People = 2\nTotal Cost = 452 * 2 + 114 * 2 + 104 * 2 + 746 = $1982\nAccommodation Minimum Nights: 1/1\n\nDay 2: March 6, 2022\nCurrent City: Houston\nTransportation: -\nBreakfast: Vinayaka Mylari, Houston, Cost: $28, Cuisines: \"Fast Food, French, Cafe, Italian\"\nAttraction: Space Center Houston, Houston, Cost: Free\nLunch: Sheetla Dhaba, Houston, Cost: $70, Cuisines: \"Desserts, Pizza, Bakery, American, Mediterranean\"\nDinner: Al Arabian Express, Houston, Cost: $148, Cuisines: \"BBQ, Desserts, Seafood\"\nAccommodation: Superhost 3 bedroom DISCOUNT, Houston, Cost: $746, Maximum Occupancy: 5, House Rules: No pets, Minimum Nights: 1\n\nNumber of People = 2\nTotal Cost = 28 * 2 + 70 * 2 + 148 * 2 + 746 = $1216\nAccommodation Minimum Nights: 1/1\n\nDay 3: March 7, 2022\nCurrent City: from Houston to Dallas\nTransportation: Flight Number: F3673854, from Houston to Dallas, Departure Time: 07:44, Arrival Time: 09:06, Cost: $136\nBreakfast: - (Assuming breakfast is before the flight)\nAttraction: The Sixth Floor Museum at Dealey Plaza, Dallas, Cost: Free\nLunch: Coconuts Fish Cafe, Dallas, Cost: $76, Cuisines: \"Cafe, BBQ, Mediterranean, Fast Food\"\nDinner: 1918 Bistro & Grill, Dallas, Cost: $180, Cuisines: \"Tea, Pizza, BBQ, Seafood\"\nAccommodation: Luxury Williamsburg duplex, private roof terrace, Dallas, Cost: $482, Maximum Occupancy: 3, House Rules: No visitors, Minimum Nights: 4\n\nNumber of People = 2\nTotal Cost = 136 * 2 + 76 * 2 + 180 * 2 + 482 = $1180\nAccommodation Minimum Nights: 1/4\n\nDay 4: March 8, 2022\nCurrent City: Dallas\nTransportation: -\nBreakfast: Cafe Gatherings, Dallas, Cost: $34, Cuisines: \"Bakery, Indian, Desserts\"\nAttraction: Reunion Tower, Dallas, Cost: Free\nLunch: Drifters Cafe, Dallas, Cost: $42, Cuisines: \"Tea, French, Mexican, Cafe, Seafood\"\nDinner: Yanki Sizzlers, Dallas, Cost: $192, Cuisines: \"Cafe, French, Tea, Mediterranean\"\nAccommodation: Luxury Williamsburg duplex, private roof terrace, Dallas, Cost: $482, Maximum Occupancy: 3, House Rules: No visitors, Minimum Nights: 4\n\nNumber of People = 2\nTotal Cost = 34 * 2 + 42 * 2 + 192 * 2 + 482 = $1024\nAccommodation Minimum Nights: 2/4\n\nDay 5: March 9, 2022\nCurrent City: from Dallas to Fort Lauderdale\nTransportation: Flight Number: F3722771, from Dallas to Fort Lauderdale, Departure Time: 16:17, Arrival Time: 19:44, Cost: $730\nBreakfast: Cafe Hera Pheri, Dallas, Cost: $36, Cuisines: \"Cafe, Desserts\"\nAttraction: Dallas Museum of Art, Dallas, Cost: Free\nLunch: Uma Foodies' Hut, Dallas, Cost: $98, Cuisines: \"French, Bakery, Seafood\"\nDinner: - (Assuming dinner is after arrival back in Fort Lauderdale)\nAccommodation: -\n\nNumber of People = 2\nTotal Cost = 36 * 2 + 98 * 2 + 730 = $996\nAccommodation Minimum Nights: -\n\nTotal cost across all days = $1982 + $1216 + $1180 + $1024 + $996 = $6398\n\nCuisines: Indian, Italian, Chinese, and Mediterranean cuisines were included at least once in the meal plan.\n\nPlease note that the total cost exceeds the budget of $4,200. To stay within budget, cheaper accommodations or flights would need to be selected, or the number of attractions and meals would need to be reduced. However, given the constraints of the query, this is the best possible plan that includes accommodations allowing parties and preferred cuisines.", "gpt-4-1106-preview_direct_sole-planning_parsed_results": [{"day": 1, "current_city": "from Fort Lauderdale to Houston", "transportation": "Flight Number: F3902913, from Fort Lauderdale to Houston, Departure Time: 09:18, Arrival Time: 10:58", "breakfast": "-", "attraction": "Water Wall, Houston", "lunch": "Jalapenos, Houston", "dinner": "The BrewMaster - The Mix Fine Dine, Houston", "accommodation": "Superhost 3 bedroom DISCOUNT, Houston"}, {"day": 2, "current_city": "Houston", "transportation": "-", "breakfast": "Vinayaka Mylari, Houston", "attraction": "Space Center Houston, Houston", "lunch": "Sheetla Dhaba, Houston", "dinner": "Al Arabian Express, Houston", "accommodation": "Superhost 3 bedroom DISCOUNT, Houston"}, {"day": 3, "current_city": "from Houston to Dallas", "transportation": "Flight Number: F3673854, from Houston to Dallas, Departure Time: 07:44, Arrival Time: 09:06", "breakfast": "-", "attraction": "The Sixth Floor Museum at Dealey Plaza, Dallas", "lunch": "Coconuts Fish Cafe, Dallas", "dinner": "1918 Bistro & Grill, Dallas", "accommodation": "Luxury Williamsburg duplex, private roof terrace, Dallas"}, {"day": 4, "current_city": "Dallas", "transportation": "-", "breakfast": "Cafe Gatherings, Dallas", "attraction": "Reunion Tower, Dallas", "lunch": "Drifters Cafe, Dallas", "dinner": "Yanki Sizzlers, Dallas", "accommodation": "Luxury Williamsburg duplex, private roof terrace, Dallas"}, {"day": 5, "current_city": "from Dallas to Fort Lauderdale", "transportation": "Flight Number: F3722771, from Dallas to Fort Lauderdale, Departure Time: 16:17, Arrival Time: 19:44", "breakfast": "Cafe Hera Pheri, Dallas", "attraction": "Dallas Museum of Art, Dallas", "lunch": "Uma Foodies' Hut, Dallas", "dinner": "-", "accommodation": "-"}]}]