[{"gpt-4-1106-preview_direct_sole-planning_results": "Travel Plan:\n\nDay 1:\nCurrent City: from Richmond to Houston\nTransportation: Flight Number: F4041372, from Richmond to Houston, Departure Time: 08:27, Arrival Time: 10:43, Cost: 742 (371 * 2)\nBreakfast: -\nAttraction: Downtown Aquarium, Houston, Cost: -\nLunch: Jalapenos, Houston, Cost: 114 (57 * 2), Cuisines: \"Desserts, Tea, Cafe, Chinese, Seafood\"\nDinner: Sheetla Dhaba, Houston, Cost: 70 (35 * 2), Cuisines: \"Desserts, Pizza, Bakery, American, Mediterranean\"\nAccommodation: Spacious room in front of prospect park, Houston, Cost: 259, Maximum Occupancy: 1, House Rules: No smoking, Minimum Nights: 1\n\nNumber of People = 2\nTotal Cost = 742 + 114 + 70 + 259 = 1185\nAccommodation Minimum Nights: 1/1\n\nDay 2:\nCurrent City: Houston\nTransportation: -\nBreakfast: Vinayaka Mylari, Houston, Cost: 28 (14 * 2), Cuisines: \"Fast Food, French, Cafe, Italian\"\nAttraction: Space Center Houston, Houston, Cost: -\nLunch: The BrewMaster - The Mix Fine Dine, Houston, Cost: 104 (52 * 2), Cuisines: \"French, Indian, Cafe, Seafood\"\nDinner: Al Arabian Express, Houston, Cost: 148 (74 * 2), Cuisines: \"BBQ, Desserts, Seafood\"\nAccommodation: Spacious room in front of prospect park, Houston, Cost: 259, Maximum Occupancy: 1, House Rules: No smoking, Minimum Nights: 1\n\nNumber of people = 2\nTotal cost = 28 + 104 + 148 + 259 = 539\nAccommodation Minimum Nights: 1/1\n\nDay 3:\nCurrent City: from Houston to Texarkana\nTransportation: Flight Number: F3930024, from Houston to Texarkana, Departure Time: 17:56, Arrival Time: 19:00, Cost: 126 (63 * 2)\nBreakfast: Subway, Houston, Cost: 102 (51 * 2), Cuisines: \"Tea, Bakery, Desserts, Seafood\"\nAttraction: Houston Museum of Natural Science, Houston, Cost: -\nLunch: Truth Coffee, Houston, Cost: 58 (29 * 2), Cuisines: \"Pizza, American, Seafood\"\nDinner: Columbia Restaurant, Texarkana, Cost: 182 (91 * 2), Cuisines: \"Desserts, Tea, Pizza, Indian, Seafood\"\nAccommodation: Large 2.5 BR Apt In Park Slope, Texarkana, Cost: 269, Maximum Occupancy: 3, House Rules: No smoking & No visitors, Minimum Nights: 1\n\nNumber of people = 2\nTotal cost = 126 + 102 + 58 + 182 + 269 = 737\nAccommodation Minimum Nights: 1/1\n\nDay 4:\nCurrent City: Texarkana\nTransportation: -\nBreakfast: Big City Bread Cafe, Texarkana, Cost: 122 (61 * 2), Cuisines: \"Cafe, Pizza, Bakery, BBQ\"\nAttraction: Museum of Regional History, Texarkana, Cost: -\nLunch: Columbia Restaurant, Texarkana, Cost: 182 (91 * 2), Cuisines: \"Desserts, Tea, Pizza, Indian, Seafood\"\nDinner: Teasta, Texarkana, Cost: 188 (94 * 2), Cuisines: \"Pizza, Italian, French, Bakery, Cafe, Seafood\"\nAccommodation: Large 2.5 BR Apt In Park Slope, Texarkana, Cost: 269, Maximum Occupancy: 3, House Rules: No smoking & No visitors, Minimum Nights: 1\n\nNumber of people = 2\nTotal cost = 122 + 182 + 188 + 269 = 761\nAccommodation Minimum Nights: 1/1\n\nDay 5:\nCurrent City: from Texarkana to Richmond\nTransportation: Self-driving, from Texarkana to Richmond, duration: 16 hours 8 mins, distance: 1,773 km, Cost: 88 (since 2 people can share one car)\nBreakfast: Prime Bakery, Texarkana, Cost: 188 (94 * 2), Cuisines: \"Cafe, Pizza, BBQ, Fast Food\"\nAttraction: -\nLunch: -\nDinner: -\nAccommodation: -\n\nNumber of people = 2\nTotal cost = 88 + 188 = 276\n\nTotal cost across all days = 1185 + 539 + 737 + 761 + 276 = 3498\nCuisines: The plan includes multiple meals with Chinese and Indian cuisines, satisfying the cuisine preference.\n\nRemaining Budget: $6000 - $3498 = $2502\n\nNote: The cost of attractions has not been included as the provided reference information does not specify the cost for attractions. If there are entrance fees, they would need to be factored into the budget.", "gpt-4-1106-preview_direct_sole-planning_parsed_results": [{"day": 1, "current_city": "from Richmond to Houston", "transportation": "Flight Number: F4041372, from Richmond to Houston, Departure Time: 08:27, Arrival Time: 10:43", "breakfast": "-", "attraction": "Downtown Aquarium, Houston;", "lunch": "Jalapenos, Houston", "dinner": "Sheetla Dhaba, Houston", "accommodation": "Spacious room in front of prospect park, Houston"}, {"day": 2, "current_city": "Houston", "transportation": "-", "breakfast": "Vinayaka Mylari, Houston", "attraction": "Space Center Houston, Houston;", "lunch": "The BrewMaster - The Mix Fine Dine, Houston", "dinner": "Al Arabian Express, Houston", "accommodation": "Spacious room in front of prospect park, Houston"}, {"day": 3, "current_city": "from Houston to Texarkana", "transportation": "Flight Number: F3930024, from Houston to Texarkana, Departure Time: 17:56, Arrival Time: 19:00", "breakfast": "Subway, Houston", "attraction": "Houston Museum of Natural Science, Houston;", "lunch": "Truth Coffee, Houston", "dinner": "Columbia Restaurant, Texarkana", "accommodation": "Large 2.5 BR Apt In Park Slope, Texarkana"}, {"day": 4, "current_city": "Texarkana", "transportation": "-", "breakfast": "Big City Bread Cafe, Texarkana", "attraction": "Museum of Regional History, Texarkana;", "lunch": "Columbia Restaurant, Texarkana", "dinner": "Teasta, Texarkana", "accommodation": "Large 2.5 BR Apt In Park Slope, Texarkana"}, {"day": 5, "current_city": "from Texarkana to Richmond", "transportation": "Self-driving, from Texarkana to Richmond, duration: 16 hours 8 mins, distance: 1,773 km", "breakfast": "Prime Bakery, Texarkana", "attraction": "-", "lunch": "-", "dinner": "-", "accommodation": "-"}]}]