[{"gpt-4-1106-preview_direct_sole-planning_results": "Travel Plan:\n\nDay 1: March 5th\nCurrent City: from Colorado Springs to Moline\nTransportation: Self-driving, from Colorado Springs to Moline, Duration: 12 hours 49 mins, Distance: 1,467 km, Cost: 73\nBreakfast: -\nAttraction: Sylvan Island, Moline, Cost: 0 (Assuming free entry as no cost is provided)\nLunch: -\nDinner: Royal Hotel, Moline, Cost: 74, Cuisines: \"Tea, Pizza, Mexican, Chinese, Seafood\"\nAccommodation: Beautiful Sunlit Retreat in Manhattan, Moline, Cost: 268, Maximum Occupancy: 3, House Rules: No visitors & No parties & No smoking, Minimum Nights: 2\n\nNumber of People = 1\nTotal Cost = 73 (Transportation) + 74 (Dinner) + 268 (Accommodation) = 415\nAccommodation Minimum Nights: 1/2\n\nDay 2: March 6th\nCurrent City: Moline\nTransportation: -\nBreakfast: Lovecrumbs Bakery, Moline, Cost: 24, Cuisines: \"Tea, Pizza, American, Desserts\"\nAttraction: John Deere Pavilion, Moline, Cost: 0 (Assuming free entry as no cost is provided)\nLunch: Zoe, Moline, Cost: 15, Cuisines: \"French, Cafe, Fast Food\"\nDinner: ZASTY, Moline, Cost: 82, Cuisines: \"Pizza, Indian, BBQ, Cafe, American, Seafood\"\nAccommodation: Beautiful Sunlit Retreat in Manhattan, Moline, Cost: 268, Maximum Occupancy: 3, House Rules: No visitors & No parties & No smoking, Minimum Nights: 2\n\nNumber of People = 1\nTotal Cost = 24 (Breakfast) + 15 (Lunch) + 82 (Dinner) + 268 (Accommodation) = 389\nAccommodation Minimum Nights: 2/2\n\nDay 3: March 7th\nCurrent City: from Moline to Rockford\nTransportation: Self-driving, from Moline to Rockford, Duration: 2 hours 1 min, Distance: 194 km, Cost: 9\nBreakfast: Hucka, Moline, Cost: 29, Cuisines: \"Desserts, Tea, Pizza, Fast Food, American\"\nAttraction: Anderson Japanese Gardens, Rockford, Cost: 0 (Assuming free entry as no cost is provided)\nLunch: Flying Mango, Rockford, Cost: 20, Cuisines: \"American, BBQ, Seafood\"\nDinner: Coco Bambu, Rockford, Cost: 72, Cuisines: \"Tea, French, Bakery, BBQ, Cafe\"\nAccommodation: Park Side Zen Home - Terrace & next to CentralPark, Rockford, Cost: 250, Maximum Occupancy: 3, House Rules: No children under 10, Minimum Nights: 3\n\nNumber of People = 1\nTotal Cost = 9 (Transportation) + 29 (Breakfast) + 20 (Lunch) + 72 (Dinner) + 250 (Accommodation) = 380\nAccommodation Minimum Nights: 1/3\n\nDay 4: March 8th\nCurrent City: Rockford\nTransportation: -\nBreakfast: Nutri Punch, Rockford, Cost: 34, Cuisines: \"Tea, Chinese, Cafe, Desserts\"\nAttraction: Discovery Center Museum, Rockford, Cost: 0 (Assuming free entry as no cost is provided)\nLunch: Cafe Southall, Rockford, Cost: 56, Cuisines: \"Seafood, Pizza, Cafe, Fast Food\"\nDinner: Eggspectation - Jaypee Vasant Continental, Rockford, Cost: 77, Cuisines: \"Tea, Mediterranean, Seafood\"\nAccommodation: Park Side Zen Home - Terrace & next to CentralPark, Rockford, Cost: 250, Maximum Occupancy: 3, House Rules: No children under 10, Minimum Nights: 3\n\nNumber of People = 1\nTotal Cost = 34 (Breakfast) + 56 (Lunch) + 77 (Dinner) + 250 (Accommodation) = 417\nAccommodation Minimum Nights: 2/3\n\nDay 5: March 9th\nCurrent City: from Rockford to Colorado Springs\nTransportation: Self-driving, from Rockford to Colorado Springs, Duration: 14 hours 38 mins, Distance: 1,653 km, Cost: 82\nBreakfast: -\nAttraction: -\nLunch: -\nDinner: -\nAccommodation: -\n\nNumber of People = 1\nTotal Cost = 82 (Transportation) = 82\n\nTotal cost across all days = 415 + 389 + 380 + 417 + 82 = 1683\n\nRemaining Budget = 1900 - 1683 = 217\n\nCuisines: The prompt specifies no cuisines, so all cuisines constraints are satisfied.", "gpt-4-1106-preview_direct_sole-planning_parsed_results": [{"day": 1, "current_city": "from Colorado Springs to Moline", "transportation": "Self-driving, from Colorado Springs to Moline, Duration: 12 hours 49 mins, Distance: 1,467 km", "breakfast": "-", "attraction": "Sylvan Island, Moline;", "lunch": "-", "dinner": "Royal Hotel, Moline", "accommodation": "Beautiful Sunlit Retreat in Manhattan, Moline"}, {"day": 2, "current_city": "Moline", "transportation": "-", "breakfast": "Lovecrumbs Bakery, Moline", "attraction": "John Deere Pavilion, Moline;", "lunch": "Zoe, Moline", "dinner": "ZASTY, Moline", "accommodation": "Beautiful Sunlit Retreat in Manhattan, Moline"}, {"day": 3, "current_city": "from Moline to Rockford", "transportation": "Self-driving, from Moline to Rockford, Duration: 2 hours 1 min, Distance: 194 km", "breakfast": "Hucka, Moline", "attraction": "Anderson Japanese Gardens, Rockford;", "lunch": "Flying Mango, Rockford", "dinner": "Coco Bambu, Rockford", "accommodation": "Park Side Zen Home - Terrace & next to CentralPark, Rockford"}, {"day": 4, "current_city": "Rockford", "transportation": "-", "breakfast": "Nutri Punch, Rockford", "attraction": "Discovery Center Museum, Rockford;", "lunch": "Cafe Southall, Rockford", "dinner": "Eggspectation - Jaypee Vasant Continental, Rockford", "accommodation": "Park Side Zen Home - Terrace & next to CentralPark, Rockford"}, {"day": 5, "current_city": "from Rockford to Colorado Springs", "transportation": "Self-driving, from Rockford to Colorado Springs, Duration: 14 hours 38 mins, Distance: 1,653 km", "breakfast": "-", "attraction": "-", "lunch": "-", "dinner": "-", "accommodation": "-"}]}]