[{"gpt-4-1106-preview_direct_sole-planning_results": "Day 1: March 4th\nCurrent City: from Denver to Appleton\nTransportation: Flight Number: F3822209, from Denver to Appleton, Departure Time: 17:30, Arrival Time: 20:44, Cost: $286\nBreakfast: -\nLunch: -\nDinner: Mikata Japanese Steakhouse, Appleton, Cost: $72, Cuisines: \"Cafe, Pizza, Bakery, Italian\"\nAccommodation: Stylish, convenient, renovated- 2 min to subway -, Appleton, Cost: $64, Maximum Occupancy: 2, House Rules: No smoking & No pets & No children under 10, Minimum Nights: 1\n\nNumber of People = 1\nTotal Cost = $286 + $72 + $64 = $422\nAccommodation Minimum Nights: 1/1\n\nDay 2: March 5th\nCurrent City: Appleton\nTransportation: -\nBreakfast: Fat Lulu's, Appleton, Cost: $23, Cuisines: \"Tea, Cafe, Seafood, Fast Food\"\nAttraction: The History Museum at the Castle, Appleton\nLunch: Swati Snacks, Appleton, Cost: $84, Cuisines: \"Desserts, Bakery, BBQ, Fast Food, American\"\nDinner: Destination Live, Appleton, Cost: $30, Cuisines: \"Tea, Indian, BBQ\"\nAccommodation: Stylish, convenient, renovated- 2 min to subway -, Appleton, Cost: $64, Maximum Occupancy: 2, House Rules: No smoking & No pets & No children under 10, Minimum Nights: 1\n\nNumber of people = 1\nTotal cost = $23 + $84 + $30 + $64 = $201\nAccommodation Minimum Nights: 1/1\n\nDay 3: March 6th\nCurrent City: from Appleton to Denver\nTransportation: Flight Number: F3828308, from Appleton to Denver, Departure Time: 08:23, Arrival Time: 10:37, Cost: $295\nBreakfast: Mathew's Cafe, Appleton, Cost: $13, Cuisines: \"Mexican, Bakery, BBQ, Cafe, Indian\"\nAttraction: Hearthstone Historic House Museum, Appleton\nLunch: Side Wok, Appleton, Cost: $15, Cuisines: \"Tea, Italian, Bakery, Chinese, Seafood\"\nDinner: -\nAccommodation: -\n\nNumber of people = 1\nTotal cost = $295 + $13 + $15 = $323\n\nTotal cost across all days = $422 + $201 + $323 = $946\nCuisines: The prompt specifies no cuisines, so all cuisines constraints are satisfied.\n\nRemaining Budget: $1800 - $946 = $854\n\nNote: The attractions were chosen based on diversity and no repeat visits. The meals were selected to ensure a variety of cuisines. Accommodation was chosen based on the minimum number of nights and house rules. Transportation was selected based on the dates provided and the cheapest available options that fit within the budget.", "gpt-4-1106-preview_direct_sole-planning_parsed_results": [{"day": 1, "current_city": "from Denver to Appleton", "transportation": "Flight Number: F3822209, from Denver to Appleton, Departure Time: 17:30, Arrival Time: 20:44", "breakfast": "-", "attraction": "-", "lunch": "-", "dinner": "Mikata Japanese Steakhouse, Appleton", "accommodation": "Stylish, convenient, renovated- 2 min to subway, Appleton"}, {"day": 2, "current_city": "Appleton", "transportation": "-", "breakfast": "Fat Lulu's, Appleton", "attraction": "The History Museum at the Castle, Appleton", "lunch": "Swati Snacks, Appleton", "dinner": "Destination Live, Appleton", "accommodation": "Stylish, convenient, renovated- 2 min to subway, Appleton"}, {"day": 3, "current_city": "from Appleton to Denver", "transportation": "Flight Number: F3828308, from Appleton to Denver, Departure Time: 08:23, Arrival Time: 10:37", "breakfast": "Mathew's Cafe, Appleton", "attraction": "Hearthstone Historic House Museum, Appleton", "lunch": "Side Wok, Appleton", "dinner": "-", "accommodation": "-"}]}]