[{"gpt-4-1106-preview_direct_sole-planning_results": "Travel Plan:\n\nDay 1: March 27, 2022\nCurrent City: from Austin to Detroit\nTransportation: Flight Number: F3537034, from Austin to Detroit, Departure Time: 15:53, Arrival Time: 19:38, Cost: $240 * 3 = $720\nBreakfast: - \nLunch: -\nDinner: Southern Bliss Bakery, Detroit, Cost: $28 * 3 = $84, Cuisines: \"Tea, BBQ, Desserts, Seafood\"\nAccommodation: Comfy King Bed Feet from Subway, Detroit, Cost: $568 * 1 = $568, Maximum Occupancy: 1, House Rules: No parties, Minimum Nights: 3\n\nNumber of People = 3\nTotal Cost for Day 1 = $720 (Flight) + $84 (Dinner) + $568 (Accommodation) = $1372\nAccommodation Minimum Nights: 1/3\n\nDay 2: March 28, 2022\nCurrent City: Detroit\nTransportation: -\nBreakfast: N. Iqbal Restaurant, Detroit, Cost: $11 * 3 = $33, Cuisines: \"Tea, Cafe, Bakery, Desserts\"\nAttraction: Detroit Institute of Arts, Detroit, Cost: -\nLunch: BMG - All Day Dining, Detroit, Cost: $15 * 3 = $45, Cuisines: \"Desserts, Bakery, BBQ, Indian, Seafood\"\nAttraction: Detroit Historical Museum, Detroit, Cost: -\nDinner: Cafe And More, Detroit, Cost: $41 * 3 = $123, Cuisines: \"Tea, Bakery, Italian\"\nAccommodation: Comfy King Bed Feet from Subway, Detroit, Cost: $568 * 1 = $568, Maximum Occupancy: 1, House Rules: No parties, Minimum Nights: 3\n\nNumber of People = 3\nTotal Cost for Day 2 = $33 (Breakfast) + $45 (Lunch) + $123 (Dinner) + $568 (Accommodation) = $769\nAccommodation Minimum Nights: 2/3\n\nDay 3: March 29, 2022\nCurrent City: from Detroit to Alpena\nTransportation: Flight Number: F3852119, from Detroit to Alpena, Departure Time: 14:15, Arrival Time: 15:20, Cost: $78 * 3 = $234\nBreakfast: Desi Spice, Detroit, Cost: $16 * 3 = $48, Cuisines: \"Tea, Pizza, American, Desserts\"\nAttraction: Detroit Riverwalk, Detroit, Cost: -\nLunch: A Dong Restaurant, Detroit, Cost: $40 * 3 = $120, Cuisines: \"Tea, Cafe, Pizza\"\nAttraction: Great Lakes Maritime Heritage Center, Alpena, Cost: -\nDinner: A & A Pagliai's Pizza, Alpena, Cost: $72 * 3 = $216, Cuisines: \"Tea, American, Fast Food\"\nAccommodation: Ultimate 50th Floor Downtown Penthouse - 4000SqFt, Alpena, Cost: $1043 * 1 = $1043, Maximum Occupancy: 9, House Rules: No smoking & No visitors & No children under 10, Minimum Nights: 2\n\nNumber of People = 3\nTotal Cost for Day 3 = $234 (Flight) + $48 (Breakfast) + $120 (Lunch) + $216 (Dinner) + $1043 (Accommodation) = $1661\nAccommodation Minimum Nights: 1/2\n\nDay 4: March 30, 2022\nCurrent City: Alpena\nTransportation: -\nBreakfast: @Mango, Alpena, Cost: $38 * 3 = $114, Cuisines: \"BBQ, Cafe, American, Desserts\"\nAttraction: Besser Museum for Northeast Michigan, Alpena, Cost: -\nLunch: Shudh Restaurant, Alpena, Cost: $56 * 3 = $168, Cuisines: \"Cafe, BBQ, Fast Food\"\nAttraction: Mich-e-ke-wis Park, Alpena, Cost: -\nDinner: Maplai, Alpena, Cost: $63 * 3 = $189, Cuisines: \"Tea, Indian, Bakery, Fast Food, American\"\nAccommodation: Ultimate 50th Floor Downtown Penthouse - 4000SqFt, Alpena, Cost: $1043 * 1 = $1043, Maximum Occupancy: 9, House Rules: No smoking & No visitors & No children under 10, Minimum Nights: 2\n\nNumber of People = 3\nTotal Cost for Day 4 = $114 (Breakfast) + $168 (Lunch) + $189 (Dinner) + $1043 (Accommodation) = $1514\nAccommodation Minimum Nights: 2/2\n\nDay 5: March 31, 2022\nCurrent City: from Alpena to Austin\nTransportation: Self-driving, from Alpena to Austin, Cost: $123 * ceil(3/5) = $123\nBreakfast: Jain Chawal Wale, Alpena, Cost: $20 * 3 = $60, Cuisines: \"Desserts, Pizza, Italian, Mexican, Cafe\"\nAttraction: -\nLunch: -\nDinner: -\nAccommodation: -\n\nNumber of People = 3\nTotal Cost for Day 5 = $123 (Transportation) + $60 (Breakfast) = $183\n\nTotal cost across all days = $1372 (Day 1) + $769 (Day 2) + $1661 (Day 3) + $1514 (Day 4) + $183 (Day 5) = $5499\n\nRemaining Budget = $5900 - $5499 = $401\n\nCuisines: The prompt specifies no specific cuisines, so all cuisines constraints are satisfied.\nAccommodations: All accommodations are private rooms as requested.", "gpt-4-1106-preview_direct_sole-planning_parsed_results": [{"day": 1, "current_city": "from Austin to Detroit", "transportation": "Flight Number: F3537034, from Austin to Detroit, Departure Time: 15:53, Arrival Time: 19:38", "breakfast": "-", "attraction": "-", "lunch": "-", "dinner": "Southern Bliss Bakery, Detroit", "accommodation": "Comfy King Bed Feet from Subway, Detroit"}, {"day": 2, "current_city": "Detroit", "transportation": "-", "breakfast": "N. Iqbal Restaurant, Detroit", "attraction": "Detroit Institute of Arts, Detroit;Detroit Historical Museum, Detroit;", "lunch": "BMG - All Day Dining, Detroit", "dinner": "Cafe And More, Detroit", "accommodation": "Comfy King Bed Feet from Subway, Detroit"}, {"day": 3, "current_city": "from Detroit to Alpena", "transportation": "Flight Number: F3852119, from Detroit to Alpena, Departure Time: 14:15, Arrival Time: 15:20", "breakfast": "Desi Spice, Detroit", "attraction": "Detroit Riverwalk, Detroit;Great Lakes Maritime Heritage Center, Alpena;", "lunch": "A Dong Restaurant, Detroit", "dinner": "A & A Pagliai's Pizza, Alpena", "accommodation": "Ultimate 50th Floor Downtown Penthouse - 4000SqFt, Alpena"}, {"day": 4, "current_city": "Alpena", "transportation": "-", "breakfast": "@Mango, Alpena", "attraction": "Besser Museum for Northeast Michigan, Alpena;Mich-e-ke-wis Park, Alpena;", "lunch": "Shudh Restaurant, Alpena", "dinner": "Maplai, Alpena", "accommodation": "Ultimate 50th Floor Downtown Penthouse - 4000SqFt, Alpena"}, {"day": 5, "current_city": "from Alpena to Austin", "transportation": "Self-driving, from Alpena to Austin", "breakfast": "Jain Chawal Wale, Alpena", "attraction": "-", "lunch": "-", "dinner": "-", "accommodation": "-"}]}]