[{"gpt-4-1106-preview_direct_sole-planning_results": "Travel Plan:\n\nDay 1: March 24, 2022\nCurrent City: from Milwaukee to New York\nTransportation: Flight Number: F3649645, from Milwaukee to New York, Departure Time: 10:50, Arrival Time: 14:22, Cost: 180 * 2 = 360\nBreakfast: - (Assuming breakfast is had before departure or during the flight)\nAttraction: Central Park, New York, Cost: 0 (Assuming no entry fee)\nLunch: Aryan's Rajasthani Pyaz Ki Kachori, New York, Cost: 17 * 2 = 34, Cuisines: \"Cafe, Pizza, Indian, Seafood\"\nDinner: Seasons 52 Fresh Grill, New York, Cost: 30 * 2 = 60, Cuisines: \"Seafood, Indian, Desserts, Italian\"\nAccommodation: A Contemporary Homelike Stay in the Best of BK, New York, Cost: 228 * 2 = 456, Maximum Occupancy: 2, House Rules: No pets & No visitors & No children under 10, Minimum Nights: 2\n\nNumber of People = 2\nTotal Cost = 360 + 34 + 60 + 456 = 910\nAccommodation Minimum Nights: 1/2\n\nDay 2: March 25, 2022\nCurrent City: New York\nTransportation: -\nBreakfast: Green Chick Chop, New York, Cost: 26 * 2 = 52, Cuisines: \"Tea, French, Cafe, Seafood\"\nAttraction: Statue of Liberty, New York, Cost: 0 (Assuming no entry fee)\nLunch: Garam Masala Food Corner, New York, Cost: 40 * 2 = 80, Cuisines: \"Pizza, Bakery, Desserts\"\nDinner: Lord of the Drinks Forum, New York, Cost: 71 * 2 = 142, Cuisines: \"Cafe, Bakery, BBQ, Chinese, Indian\"\nAccommodation: A Contemporary Homelike Stay in the Best of BK, New York, Cost: 228 * 2 = 456, Maximum Occupancy: 2, House Rules: No pets & No visitors & No children under 10, Minimum Nights: 2\n\nNumber of People = 2\nTotal Cost = 52 + 80 + 142 + 456 = 730\nAccommodation Minimum Nights: 2/2\n\nDay 3: March 26, 2022\nCurrent City: from New York to Milwaukee\nTransportation: Flight Number: F3644990, from New York to Milwaukee, Departure Time: 15:20, Arrival Time: 16:27, Cost: 218 * 2 = 436\nBreakfast: Sir John Bakery Cafe, New York, Cost: 78 * 2 = 156, Cuisines: \"Pizza, Bakery, Desserts\"\nAttraction: The High Line, New York, Cost: 0 (Assuming no entry fee)\nLunch: Baltazar, New York, Cost: 46 * 2 = 92, Cuisines: \"Tea, Fast Food, Bakery, Seafood\"\nDinner: - (Assuming dinner will be had after arrival in Milwaukee or during the flight)\nAccommodation: -\n\nNumber of People = 2\nTotal Cost = 436 + 156 + 92 = 684\n\nTotal cost across all days = 910 + 730 + 684 = 2324\n\nUnfortunately, the total cost exceeds the budget of $1,900. To adjust the plan within the budget, we need to choose cheaper transportation options. Let's consider self-driving or taxi options:\n\nRevised Day 1 Transportation: Self-driving, from Milwaukee to New York, Cost: 70 * ceil(2/5) = 70\nRevised Day 3 Transportation: Self-driving, from New York to Milwaukee, Cost: 70 * ceil(2/5) = 70\n\nRevised Total Cost for Transportation = 70 + 70 = 140\n\nRevised Total cost across all days = 140 + 34 + 60 + 456 + 52 + 80 + 142 + 456 + 156 + 92 = 1668\n\nNow the total cost is within the budget of $1,900.", "gpt-4-1106-preview_direct_sole-planning_parsed_results": [{"day": 1, "current_city": "from Milwaukee to New York", "transportation": "Flight Number: F3649645, from Milwaukee to New York, Departure Time: 10:50, Arrival Time: 14:22", "breakfast": "-", "attraction": "Central Park, New York;", "lunch": "Aryan's Rajasthani Pyaz Ki Kachori, New York", "dinner": "Seasons 52 Fresh Grill, New York", "accommodation": "A Contemporary Homelike Stay in the Best of BK, New York"}, {"day": 2, "current_city": "New York", "transportation": "-", "breakfast": "Green Chick Chop, New York", "attraction": "Statue of Liberty, New York;", "lunch": "Garam Masala Food Corner, New York", "dinner": "Lord of the Drinks Forum, New York", "accommodation": "A Contemporary Homelike Stay in the Best of BK, New York"}, {"day": 3, "current_city": "from New York to Milwaukee", "transportation": "Flight Number: F3644990, from New York to Milwaukee, Departure Time: 15:20, Arrival Time: 16:27", "breakfast": "Sir John Bakery Cafe, New York", "attraction": "The High Line, New York;", "lunch": "Baltazar, New York", "dinner": "-", "accommodation": "-"}]}]