[{"gpt-4-1106-preview_direct_sole-planning_results": "Travel Plan:\n\nDay 1:\nCurrent City: from Dallas to Huntsville\nTransportation: Flight Number: F3601769, from Dallas to Huntsville, Departure Time: 17:14, Arrival Time: 18:57, Cost: 129 * 4 = 516\nBreakfast: - (Assuming travelers will have breakfast before departure)\nAttraction: U.S. Space & Rocket Center, Huntsville, Cost: -\nLunch: - (Assuming lunch will be on the flight or before departure)\nDinner: Cherry Comet, Huntsville, Cost: 16 * 4 = 64, Cuisines: \"Desserts, Tea, Pizza, Cafe, Mediterranean\"\nAccommodation: Sonder | 116 John | Simple 1BR + Gym, Huntsville, Cost: 290 * 2 = 580, Maximum Occupancy: 3, House Rules: No children under 10, Minimum Nights: 29\n\nNumber of People = 4\nTotal Cost = 516 + 64 + 580 = 1160\nAccommodation Minimum Nights: 1/29\n\nDay 2:\nCurrent City: Huntsville\nTransportation: -\nBreakfast: Lots of Food, Huntsville, Cost: 38 * 4 = 152, Cuisines: \"Tea, Cafe\"\nAttraction: Huntsville Botanical Garden, Huntsville, Cost: -\nLunch: Dosa Village, Huntsville, Cost: 40 * 4 = 160, Cuisines: \"Tea, Cafe, Pizza, BBQ\"\nDinner: Downtown Grill, Huntsville, Cost: 74 * 4 = 296, Cuisines: \"Pizza, Bakery\"\nAccommodation: Sonder | 116 John | Simple 1BR + Gym, Huntsville, Cost: 290 * 2 = 580, Maximum Occupancy: 3, House Rules: No children under 10, Minimum Nights: 29\n\nNumber of people = 4\nTotal cost = 152 + 160 + 296 + 580 = 1188\nAccommodation Minimum Nights: 2/29\n\nDay 3:\nCurrent City: from Huntsville to Dallas\nTransportation: Flight Number: F3607633, from Huntsville to Dallas, Departure Time: 09:26, Arrival Time: 11:26, Cost: 145 * 4 = 580\nBreakfast: - (Assuming breakfast will be at the accommodation or before departure)\nAttraction: Huntsville Museum of Art, Huntsville, Cost: -\nLunch: - (Assuming lunch will be on the flight or after arrival in Dallas)\nDinner: - (Assuming travelers will have dinner after arrival in Dallas)\nAccommodation: -\n\nNumber of people = 4\nTotal cost = 580\n\nTotal cost across all days = 1160 + 1188 + 580 = 2928\n\nUnfortunately, the total cost exceeds the budget of $2,700. To adjust the plan within the budget, we need to choose a cheaper accommodation option. Since the query requires entire rooms, we will select the next cheapest option that offers an entire home/apt.\n\nAdjusted Accommodation for Day 1 and Day 2:\nAccommodation: One bedroom; private house; great location, Huntsville, Cost: 301 * 2 = 602, Maximum Occupancy: 2, House Rules: No parties & No smoking & No visitors, Minimum Nights: 2\n\nAdjusted Total Cost for Accommodation: 602 * 2 = 1204\n\nAdjusted Total Cost across all days = 516 + 64 + 1204 + 152 + 160 + 296 + 580 = 2972\n\nThe adjusted plan still slightly exceeds the budget. To further adjust, we can opt for the cheapest flight option:\n\nAdjusted Transportation for Day 1:\nTransportation: Flight Number: F3601769, from Dallas to Huntsville, Departure Time: 17:14, Arrival Time: 18:57, Cost: 129 * 4 = 516\n\nAdjusted Transportation for Day 3:\nTransportation: Flight Number: F3593796, from Huntsville to Dallas, Departure Time: 05:24, Arrival Time: 07:19, Cost: 147 * 4 = 588\n\nAdjusted Total Cost for Transportation: 516 + 588 = 1104\n\nAdjusted Total Cost across all days = 1104 + 64 + 1204 + 152 + 160 + 296 = 2980\n\nThe plan is still over budget. We will need to make further adjustments, such as choosing a cheaper restaurant or removing an attraction. However, without additional reference information on the costs of attractions and the availability of cheaper restaurants, we cannot make further adjustments. Please provide additional information or increase the budget to accommodate the current plan.", "gpt-4-1106-preview_direct_sole-planning_parsed_results": [{"day": 1, "current_city": "from Dallas to Huntsville", "transportation": "Flight Number: F3601769, from Dallas to Huntsville, Departure Time: 17:14, Arrival Time: 18:57", "breakfast": "-", "attraction": "U.S. Space & Rocket Center, Huntsville", "lunch": "-", "dinner": "Cherry Comet, Huntsville", "accommodation": "One bedroom; private house; great location, Huntsville"}, {"day": 2, "current_city": "Huntsville", "transportation": "-", "breakfast": "Lots of Food, Huntsville", "attraction": "Huntsville Botanical Garden, Huntsville", "lunch": "Dosa Village, Huntsville", "dinner": "Downtown Grill, Huntsville", "accommodation": "One bedroom; private house; great location, Huntsville"}, {"day": 3, "current_city": "from Huntsville to Dallas", "transportation": "Flight Number: F3593796, from Huntsville to Dallas, Departure Time: 05:24, Arrival Time: 07:19", "breakfast": "-", "attraction": "Huntsville Museum of Art, Huntsville", "lunch": "-", "dinner": "-", "accommodation": "-"}]}]