[{"gpt-4-1106-preview_direct_sole-planning_results": "Travel Plan:\n\nDay 1:\nCurrent City: from Manchester to Charlotte\nTransportation: Flight Number: F3785421, from Manchester to Charlotte, Departure Time: 14:16, Arrival Time: 16:46, Cost: 223\nBreakfast: - \nAttraction: Freedom Park, Charlotte\nLunch: Prince Snacks & Momo's Point, Charlotte, Cost: 11, Cuisines: \"Tea, Cafe, Desserts, Fast Food\"\nDinner: China Garden, Charlotte, Cost: 14, Cuisines: \"Tea, Mexican, BBQ, Mediterranean\"\nAccommodation: Luxury 2 bdr/2 bath prime Williamburg, Charlotte, Cost: 218, Maximum Occupancy: 3, House Rules: No children under 10 & No smoking & No pets, Minimum Nights: 1\n\nNumber of People = 5\nTotal Cost = 5 * 223 + 5 * 11 + 5 * 14 + ceil(5/3) * 218 = 1115 + 55 + 70 + 436 = 1676\nAccommodation Minimum Nights: 1/1\n\nDay 2:\nCurrent City: Charlotte\nTransportation: -\nBreakfast: Olive Tree Cafe, Charlotte, Cost: 23, Cuisines: \"Tea, Chinese, Desserts\"\nAttraction: Levine Museum of the New South, Charlotte; The Mint Museum, Charlotte.\nLunch: Grover's - The Baker Shop, Charlotte, Cost: 30, Cuisines: \"Pizza, Bakery, Chinese, Indian, Seafood\"\nDinner: Kylin Skybar, Charlotte, Cost: 44, Cuisines: \"Tea, Cafe, Pizza, Italian\"\nAccommodation: Luxury 2 bdr/2 bath prime Williamburg, Charlotte, Cost: 218, Maximum Occupancy: 3, House Rules: No children under 10 & No smoking & No pets, Minimum Nights: 1\n\nNumber of people = 5\nTotal cost = 5 * 23 + 5 * 30 + 5 * 44 + ceil(5/3) * 218 = 115 + 150 + 220 + 436 = 921\nAccommodation Minimum Nights: 1/1\n\nDay 3:\nCurrent City: from Charlotte to Manchester\nTransportation: Flight Number: F3786316, from Charlotte to Manchester, Departure Time: 17:05, Arrival Time: 19:04, Cost: 208\nBreakfast: Burger King, Charlotte, Cost: 15, Cuisines: \"Cafe, Pizza, Indian, Desserts\"\nAttraction: NASCAR Hall of Fame, Charlotte\nLunch: Prince Snacks & Momo's Point, Charlotte, Cost: 11, Cuisines: \"Tea, Cafe, Desserts, Fast Food\"\nDinner: -\nAccommodation: -\n\nNumber of people = 5\nTotal cost = 5 * 208 + 5 * 15 + 5 * 11 = 1040 + 75 + 55 = 1170\n\nTotal cost across all days = 1676 + 921 + 1170 = 3767\nCuisines: The prompt specifies no specific cuisines, so all cuisines constraints are satisfied.\n\nNote: The accommodations were chosen based on the preference for entire rooms and the cheapest option that meets the minimum night requirement. Attractions were chosen based on diversity and no repeats. Meals were chosen based on the cheapest options available. Transportation was chosen based on the cheapest flight options available. The total cost is within the budget of $4,800.", "gpt-4-1106-preview_direct_sole-planning_parsed_results": [{"day": 1, "current_city": "from Manchester to Charlotte", "transportation": "Flight Number: F3785421, from Manchester to Charlotte, Departure Time: 14:16, Arrival Time: 16:46", "breakfast": "-", "attraction": "Freedom Park, Charlotte;", "lunch": "Prince Snacks & Momo's Point, Charlotte", "dinner": "China Garden, Charlotte", "accommodation": "Luxury 2 bdr/2 bath prime Williamburg, Charlotte"}, {"day": 2, "current_city": "Charlotte", "transportation": "-", "breakfast": "Olive Tree Cafe, Charlotte", "attraction": "Levine Museum of the New South, Charlotte;The Mint Museum, Charlotte;", "lunch": "Grover's - The Baker Shop, Charlotte", "dinner": "Kylin Skybar, Charlotte", "accommodation": "Luxury 2 bdr/2 bath prime Williamburg, Charlotte"}, {"day": 3, "current_city": "from Charlotte to Manchester", "transportation": "Flight Number: F3786316, from Charlotte to Manchester, Departure Time: 17:05, Arrival Time: 19:04", "breakfast": "Burger King, Charlotte", "attraction": "NASCAR Hall of Fame, Charlotte;", "lunch": "Prince Snacks & Momo's Point, Charlotte", "dinner": "-", "accommodation": "-"}]}]