[{"gpt-4-1106-preview_direct_sole-planning_results": "Travel Plan:\n\nDay 1:\nCurrent City: from Denver to Bozeman\nTransportation: Flight Number: F3856156, from Denver to Bozeman, Departure Time: 16:07, Arrival Time: 17:49, Cost: 108 * 8 = 864\nBreakfast: - (Assuming travelers will have breakfast before the flight)\nAttraction: Museum of the Rockies, Bozeman, Cost: Free (assuming no entry fee is provided)\nLunch: - (Assuming lunch time will be during the flight or upon arrival)\nDinner: Jiquitaia, Bozeman, Cost: 36 * 8 = 288, Cuisines: \"Tea, Pizza, American\"\nAccommodation: Sun-Filled Artist Loft in Private Townhouse, Bozeman, Cost: 214 * 4 = 856, Maximum Occupancy: 2, House Rules: No parties, Minimum Nights: 2\n\nNumber of People = 8\nTotal Cost = 864 + 288 + 856 = 2008\nAccommodation Minimum Nights: 1/2\n\nDay 2:\nCurrent City: Bozeman\nTransportation: -\nBreakfast: Saravana Bhavan, Bozeman, Cost: 38 * 8 = 304, Cuisines: \"Tea, American, Desserts\"\nAttraction: Gallatin History Museum, Bozeman, Cost: Free (assuming no entry fee is provided)\nLunch: Side Wok, Bozeman, Cost: 14 * 8 = 112, Cuisines: \"Tea, Pizza, Indian\"\nDinner: McGuire's Irish Pub & Brewery, Bozeman, Cost: 72 * 8 = 576, Cuisines: \"Fast Food, Desserts, Italian\" (Italian is close to Indian in terms of spices and flavors, hence selected)\nAccommodation: Sun-Filled Artist Loft in Private Townhouse, Bozeman, Cost: 214 * 4 = 856, Maximum Occupancy: 2, House Rules: No parties, Minimum Nights: 2\n\nNumber of people = 8\nTotal cost = 304 + 112 + 576 + 856 = 1848\nAccommodation Minimum Nights: 2/2\n\nDay 3:\nCurrent City: from Bozeman to Denver\nTransportation: Flight Number: F3899998, from Bozeman to Denver, Departure Time: 16:53, Arrival Time: 18:18, Cost: 109 * 8 = 872\nBreakfast: Adyar Ananda Bhavan, Bozeman, Cost: 22 * 8 = 176, Cuisines: \"Tea, Chinese, Bakery\"\nAttraction: American Computer & Robotics Museum, Bozeman, Cost: Free (assuming no entry fee is provided)\nLunch: Today Pizza, Bozeman, Cost: 27 * 8 = 216, Cuisines: \"French, Bakery, BBQ, Fast Food, Cafe, Indian\"\nDinner: - (Assuming dinner will be after arrival in Denver or during the flight)\nAccommodation: -\n\nNumber of people = 8\nTotal cost = 872 + 176 + 216 = 1264\n\nTotal cost across all days = 2008 + 1848 + 1264 = 5120\nCuisines: American and Indian cuisines were included in the meal choices.\n\nRemaining Budget: $7000 - $5120 = $1880\n\nNote: The cost of attractions is assumed to be free as no price information is provided. If there are entry fees, they would need to be factored into the budget. The accommodation was chosen based on the minimum nights and maximum occupancy to minimize costs. The meals were selected to include at least one American and one Indian cuisine as per the query's preference.", "gpt-4-1106-preview_direct_sole-planning_parsed_results": [{"day": 1, "current_city": "from Denver to Bozeman", "transportation": "Flight Number: F3856156, from Denver to Bozeman, Departure Time: 16:07, Arrival Time: 17:49", "breakfast": "-", "attraction": "Museum of the Rockies, Bozeman;", "lunch": "-", "dinner": "Jiquitaia, Bozeman", "accommodation": "Sun-Filled Artist Loft in Private Townhouse, Bozeman"}, {"day": 2, "current_city": "Bozeman", "transportation": "-", "breakfast": "Saravana Bhavan, Bozeman", "attraction": "Gallatin History Museum, Bozeman;", "lunch": "Side Wok, Bozeman", "dinner": "McGuire's Irish Pub & Brewery, Bozeman", "accommodation": "Sun-Filled Artist Loft in Private Townhouse, Bozeman"}, {"day": 3, "current_city": "from Bozeman to Denver", "transportation": "Flight Number: F3899998, from Bozeman to Denver, Departure Time: 16:53, Arrival Time: 18:18", "breakfast": "Adyar Ananda Bhavan, Bozeman", "attraction": "American Computer & Robotics Museum, Bozeman;", "lunch": "Today Pizza, Bozeman", "dinner": "-", "accommodation": "-"}]}]