[{"gpt-4-1106-preview_direct_sole-planning_results": "Travel Plan:\n\nDay 1:\nCurrent City: from Oakland to Tucson\nTransportation: Flight Number: F4002752, from Oakland to Tucson, Departure Time: 15:07, Arrival Time: 17:00, Cost: $190\nBreakfast: - (Assuming the traveler will have breakfast before departure or during the flight)\nAttraction: Pima Air & Space Museum, Tucson, Cost: $0 (Assuming free entry or covered by a pass)\nLunch: Villa Tevere, Tucson, Cost: $37, Cuisines: \"Mexican, Mediterranean, Desserts, Fast Food\"\nDinner: Magic Spice Wok, Tucson, Cost: $31, Cuisines: \"Cafe, Bakery, BBQ, Chinese, Seafood\"\nAccommodation: Private room with private bathroom, Tucson, Cost: $58, Maximum Occupancy: 2, House Rules: No smoking, Minimum Nights: 2\n\nNumber of People = 1\nTotal Cost = $190 + $37 + $31 + $58 = $316\nAccommodation Minimum Nights: 1/2\n\nDay 2:\nCurrent City: Tucson\nTransportation: -\nBreakfast: Consort Restaurant, Tucson, Cost: $54, Cuisines: \"Bakery, Pizza, Indian, Desserts\"\nAttraction: Arizona-Sonora Desert Museum, Tucson, Cost: $0 (Assuming free entry or covered by a pass)\nLunch: Pizza Street, Tucson, Cost: $22, Cuisines: \"Fast Food, Bakery, Seafood\"\nDinner: Chai Point, Tucson, Cost: $62, Cuisines: \"Tea, Bakery, Mexican, American\"\nAccommodation: Private room with private bathroom, Tucson, Cost: $58, Maximum Occupancy: 2, House Rules: No smoking, Minimum Nights: 2\n\nNumber of people = 1\nTotal cost = $54 + $22 + $62 + $58 = $196\nAccommodation Minimum Nights: 2/2\n\nDay 3:\nCurrent City: from Tucson to Oakland\nTransportation: Self-driving, from Tucson to Oakland, duration: 12 hours 42 mins, distance: 1,373 km, Cost: $68 (Since there is no flight available and the cost of a taxi would exceed the budget)\nBreakfast: Mocha, Tucson, Cost: $53, Cuisines: \"Cafe, Fast Food\"\nAttraction: Tucson Botanical Gardens, Tucson, Cost: $0 (Assuming free entry or covered by a pass)\nLunch: Uraki, Tucson, Cost: $12, Cuisines: \"Cafe, Bakery, Fast Food\"\nDinner: - (Assuming the traveler will have dinner after arrival in Oakland or on the way)\nAccommodation: -\n\nNumber of people = 1\nTotal cost = $68 + $53 + $12 = $133\n\nTotal cost across all days = $316 + $196 + $133 = $645\nCuisines: The prompt specifies no cuisines, so all cuisines constraints are satisfied.\n\nNote: The attractions are assumed to be free or covered by a pass as no cost information is provided. If there is an entry fee, it should be considered within the budget. The accommodation is chosen based on the minimum nights required and the house rules specified. The transportation back to Oakland is by self-driving due to the lack of available flights and to stay within the budget.", "gpt-4-1106-preview_direct_sole-planning_parsed_results": [{"day": 1, "current_city": "from Oakland to Tucson", "transportation": "Flight Number: F4002752, from Oakland to Tucson, Departure Time: 15:07, Arrival Time: 17:00", "breakfast": "-", "attraction": "Pima Air & Space Museum, Tucson;", "lunch": "Villa Tevere, Tucson", "dinner": "Magic Spice Wok, Tucson", "accommodation": "Private room with private bathroom, Tucson"}, {"day": 2, "current_city": "Tucson", "transportation": "-", "breakfast": "Consort Restaurant, Tucson", "attraction": "Arizona-Sonora Desert Museum, Tucson;", "lunch": "Pizza Street, Tucson", "dinner": "Chai Point, Tucson", "accommodation": "Private room with private bathroom, Tucson"}, {"day": 3, "current_city": "from Tucson to Oakland", "transportation": "Self-driving, from Tucson to Oakland, duration: 12 hours 42 mins, distance: 1,373 km", "breakfast": "Mocha, Tucson", "attraction": "Tucson Botanical Gardens, Tucson;", "lunch": "Uraki, Tucson", "dinner": "-", "accommodation": "-"}]}]