[{"gpt-4-1106-preview_direct_sole-planning_results": "Travel Plan:\n\nDay 1:\nCurrent City: from Las Vegas to Santa Maria\nTransportation: Self-driving, from Las Vegas to Santa Maria, Duration: 6 hours 17 mins, Distance: 634 km, Cost: 31 * ceil(4/5) = 31\nBreakfast: - (Assuming breakfast is had before departure)\nAttraction: Santa Maria Valley Discovery Museum, Santa Maria, Cost: Free\nLunch: Pirates of Grill, Santa Maria, Cost: 90, Cuisines: \"Bakery, BBQ, Fast Food, American, Mediterranean, Seafood\"\nDinner: Indian By Nature, Santa Maria, Cost: 45, Cuisines: \"Tea, Pizza, Bakery, BBQ, Mediterranean\"\nAccommodation: Large Bedroom on upper west/columbia, Santa Maria, Cost: 98 * ceil(4/2) = 196, Maximum Occupancy: 2, House Rules: No parties & No pets, Minimum Nights: 1\n\nNumber of People = 4\nTotal Cost = 31 + 4 * 90 + 4 * 45 + 196 = 871\nAccommodation Minimum Nights: 1/1\n\nDay 2:\nCurrent City: Santa Maria\nTransportation: -\nBreakfast: The Drunk House, Santa Maria, Cost: 91, Cuisines: \"Desserts, Tea, Bakery, Fast Food, American, Mediterranean\"\nAttraction: Santa Maria Museum of Flight, Santa Maria, Cost: Free\nLunch: Calendar Khana Laao, Santa Maria, Cost: 91, Cuisines: \"Desserts, Tea, Fast Food, Cafe, Indian\"\nDinner: RiverDine Restaurant & Bar, Santa Maria, Cost: 71, Cuisines: \"Chinese, BBQ, Seafood\"\nAccommodation: Large Bedroom on upper west/columbia, Santa Maria, Cost: 98 * ceil(4/2) = 196, Maximum Occupancy: 2, House Rules: No parties & No pets, Minimum Nights: 1\n\nNumber of people = 4\nTotal cost = 4 * 91 + 4 * 91 + 4 * 71 + 196 = 1220\nAccommodation Minimum Nights: 1/1\n\nDay 3:\nCurrent City: from Santa Maria to Las Vegas\nTransportation: Self-driving, from Santa Maria to Las Vegas, Duration: 6 hours 19 mins, Distance: 636 km, Cost: 31 * ceil(4/5) = 31\nBreakfast: Nashta, Santa Maria, Cost: 13, Cuisines: \"Tea, Chinese, Bakery, Mediterranean\"\nAttraction: Presqu'ile Winery, Santa Maria, Cost: Free\nLunch: Eat & Gulp, Santa Maria, Cost: 52, Cuisines: \"Fast Food, Pizza, Mediterranean, Italian\"\nDinner: - (Assuming dinner is had after arrival)\nAccommodation: -\n\nNumber of people = 4\nTotal cost = 31 + 4 * 13 + 4 * 52 = 291\n\nTotal cost across all days = 871 + 1220 + 291 = 2382\nCuisines: American and Mediterranean preferences are met with meals at Pirates of Grill, Indian By Nature, The Drunk House, Calendar Khana Laao, Nashta, and Eat & Gulp.\n\nRemaining Budget: $3,700 - $2,382 = $1,318\n\nNote: The attractions chosen are free of charge, and the accommodation meets the minimum night's requirement. The transportation is self-driving as there are no flights available, and the cost is calculated based on the number of people and the cost per self-driving trip. The meals are chosen based on the preferred cuisines and the budget.", "gpt-4-1106-preview_direct_sole-planning_parsed_results": [{"day": 1, "current_city": "from Las Vegas to Santa Maria", "transportation": "Self-driving, from Las Vegas to Santa Maria, Duration: 6 hours 17 mins, Distance: 634 km", "breakfast": "-", "attraction": "Santa Maria Valley Discovery Museum, Santa Maria;", "lunch": "Pirates of Grill, Santa Maria", "dinner": "Indian By Nature, Santa Maria", "accommodation": "Large Bedroom on upper west/columbia, Santa Maria"}, {"day": 2, "current_city": "Santa Maria", "transportation": "-", "breakfast": "The Drunk House, Santa Maria", "attraction": "Santa Maria Museum of Flight, Santa Maria;", "lunch": "Calendar Khana Laao, Santa Maria", "dinner": "RiverDine Restaurant & Bar, Santa Maria", "accommodation": "Large Bedroom on upper west/columbia, Santa Maria"}, {"day": 3, "current_city": "from Santa Maria to Las Vegas", "transportation": "Self-driving, from Santa Maria to Las Vegas, Duration: 6 hours 19 mins, Distance: 636 km", "breakfast": "Nashta, Santa Maria", "attraction": "Presqu'ile Winery, Santa Maria;", "lunch": "Eat & Gulp, Santa Maria", "dinner": "-", "accommodation": "-"}]}]