[{"gpt-4-1106-preview_direct_sole-planning_results": "Travel Plan:\n\nDay 1: March 2, 2022\nCurrent City: from Buffalo to Atlanta\nTransportation: Flight Number: F3502691, from Buffalo to Atlanta, Departure Time: 18:48, Arrival Time: 20:51, Cost: $240\nBreakfast: -\nLunch: -\nDinner: Saffron, Atlanta, Cost: $39, Cuisines: \"Tea, Cafe, Fast Food, Seafood\"\nAccommodation: Spacious private room close St. Barnabas Hospital, Atlanta, Cost: $144, Maximum Occupancy: 1, House Rules: No smoking, Minimum Nights: 2\n\nNumber of People = 1\nTotal Cost = $240 (flight) + $39 (dinner) + $144 (accommodation) = $423\nAccommodation Minimum Nights: 1/2\n\nDay 2: March 3, 2022\nCurrent City: Atlanta\nTransportation: -\nBreakfast: Adda, Atlanta, Cost: $22, Cuisines: \"Tea, Mexican, Bakery\"\nAttraction: Georgia Aquarium, Atlanta, Cost: $0 (assuming free entry or covered by a city pass)\nLunch: Ahata, Atlanta, Cost: $17, Cuisines: \"Tea, Indian, Desserts\"\nDinner: Baba Au Rhum, Atlanta, Cost: $27, Cuisines: \"Desserts, Pizza, Mexican, BBQ, Fast Food\"\nAccommodation: Spacious private room close St. Barnabas Hospital, Atlanta, Cost: $144, Maximum Occupancy: 1, House Rules: No smoking, Minimum Nights: 2\n\nNumber of People = 1\nTotal Cost = $22 (breakfast) + $17 (lunch) + $27 (dinner) + $144 (accommodation) = $210\nAccommodation Minimum Nights: 2/2\n\nDay 3: March 4, 2022\nCurrent City: from Atlanta to Buffalo\nTransportation: Flight Number: F3502694, from Atlanta to Buffalo, Departure Time: 15:47, Arrival Time: 17:42, Cost: $209\nBreakfast: Asian Bistro, Atlanta, Cost: $27, Cuisines: \"Tea, Bakery, Seafood\"\nAttraction: World of Coca-Cola, Atlanta, Cost: $0 (assuming free entry or covered by a city pass)\nLunch: Chef Style, Atlanta, Cost: $59, Cuisines: \"Pizza, American, Desserts, Seafood\"\nDinner: -\nAccommodation: -\n\nNumber of People = 1\nTotal Cost = $209 (flight) + $27 (breakfast) + $59 (lunch) = $295\n\nTotal cost across all days = $423 (Day 1) + $210 (Day 2) + $295 (Day 3) = $928\n\nRemaining Budget: $1,100 - $928 = $172\n\nCuisines: The prompt specifies no cuisines, so all cuisines constraints are satisfied.\n\nNote: The cost of attractions is assumed to be free or covered by a city pass as no pricing information is provided. If there is a cost associated with the attractions, it would need to be factored into the budget. The accommodation is chosen based on the minimum nights required and the budget. The cheapest flight options within the budget are selected for transportation.", "gpt-4-1106-preview_direct_sole-planning_parsed_results": [{"day": 1, "current_city": "from Buffalo to Atlanta", "transportation": "Flight Number: F3502691, from Buffalo to Atlanta, Departure Time: 18:48, Arrival Time: 20:51", "breakfast": "-", "attraction": "-", "lunch": "-", "dinner": "Saffron, Atlanta", "accommodation": "Spacious private room close St. Barnabas Hospital, Atlanta"}, {"day": 2, "current_city": "Atlanta", "transportation": "-", "breakfast": "Adda, Atlanta", "attraction": "Georgia Aquarium, Atlanta;", "lunch": "Ahata, Atlanta", "dinner": "Baba Au Rhum, Atlanta", "accommodation": "Spacious private room close St. Barnabas Hospital, Atlanta"}, {"day": 3, "current_city": "from Atlanta to Buffalo", "transportation": "Flight Number: F3502694, from Atlanta to Buffalo, Departure Time: 15:47, Arrival Time: 17:42", "breakfast": "Asian Bistro, Atlanta", "attraction": "World of Coca-Cola, Atlanta;", "lunch": "Chef Style, Atlanta", "dinner": "-", "accommodation": "-"}]}]