[{"gpt-4-1106-preview_direct_sole-planning_results": "Travel Plan:\n\nDay 1:\nCurrent City: from Chicago to Albuquerque\nTransportation: Flight Number: F4005732, from Chicago to Albuquerque, Departure Time: 08:23, Arrival Time: 10:14, Cost $260\nBreakfast: - (Assuming breakfast is had before the flight or during the flight), Cost $0\nAttraction: Petroglyph National Monument, Albuquerque, Cost $0 (Assuming no entrance fee)\nLunch: Genghis Grill, Albuquerque, Average Cost $24\nDinner: Thatcher's Barbeque and Grill, Albuquerque, Average Cost $30\nAccommodation: Harlem apartment, Albuquerque, Cost $133\n\nTotal cost: The total cost is the sum of cost from transportation, Breakfast, Attraction, Lunch, Dinner, and Accommodation. It is $260 + $0 + $0 + ($24 x 3) + ($30 x 3) + $133 = $260 + $72 + $90 + $133 = $555.\n\nDay 2:\nCurrent City: Albuquerque\nTransportation: -, Cost $0\nBreakfast: Cantina Famiglia Mancini, Albuquerque, Average Cost $40\nAttraction: Albuquerque Museum, Albuquerque, Cost $0 (Assuming no entrance fee)\nLunch: Punjab Grill, Albuquerque, Average Cost $26\nDinner: Barbeque Nation, Albuquerque, Average Cost $85\nAccommodation: Harlem apartment, Albuquerque, Cost $133\n\nTotal cost: The total cost is the sum of cost from transportation, Breakfast, Attraction, Lunch, Dinner, and Accommodation. It is $0 + ($40 x 3) + $0 + ($26 x 3) + ($85 x 3) + $133 = $120 + $78 + $255 + $133 = $586.\n\nDay 3:\nCurrent City: from Albuquerque to Chicago\nTransportation: Flight Number: F3603308, from Albuquerque to Chicago, Departure Time: 05:41, Arrival Time: 09:35, Cost $371\nBreakfast: - (Assuming breakfast is had before the flight or during the flight), Cost $0\nAttraction: - (No time for attractions due to early flight), Cost $0\nLunch: - (Assuming lunch is had after arrival in Chicago or during the flight), Cost $0\nDinner: - (Assuming travelers are back home), Cost $0\nAccommodation: -, Cost $0\n\nTotal cost: The total cost is the sum of cost from transportation, Breakfast, Attraction, Lunch, Dinner, and Accommodation. It is $371 + $0 + $0 + $0 + $0 + $0 = $371.\n\nThe total cost of this trip is the sum of the cost from day 1, day 2, and day 3. It is $555 + $586 + $371 = $1512, which is less than the required budget of $1600.", "gpt-4-1106-preview_direct_sole-planning_parsed_results": [{"days": 1, "current_city": "from Chicago to Albuquerque", "transportation": "Flight Number: F4005732, from Chicago to Albuquerque, Departure Time: 08:23, Arrival Time: 10:14", "breakfast": "-", "attraction": "New Mexico Museum of Natural History and Science, Albuquerque;", "lunch": "Cantina Famiglia Mancini, Albuquerque", "dinner": "Thatcher's Barbeque and Grill, Albuquerque", "accommodation": "Harlem apartment, Albuquerque"}, {"days": 2, "current_city": "Albuquerque", "transportation": "-", "breakfast": "Punjab Grill, Albuquerque", "attraction": "Albuquerque Museum, Albuquerque;Explora Science Center and Children's Museum of Albuquerque, Albuquerque;", "lunch": "Genghis Grill, Albuquerque", "dinner": "Barbeque Nation, Albuquerque", "accommodation": "Harlem apartment, Albuquerque"}, {"days": 3, "current_city": "from Albuquerque to Chicago", "transportation": "Flight Number: F3603308, from Albuquerque to Chicago, Departure Time: 05:41, Arrival Time: 09:35", "breakfast": "-", "attraction": "-", "lunch": "-", "dinner": "-", "accommodation": "-"}]}]