[{"gpt-4-1106-preview_direct_sole-planning_results": "Travel Plan:\n\nDay 1: March 4, 2022\nCurrent City: from Lake Charles to Houston\nTransportation: Flight Number: F3932451, from Lake Charles to Houston, Departure Time: 07:02, Arrival Time: 08:27, Cost: $57 x 2 people = $114\nBreakfast: - , Cost: $0\nAttraction: Space Center Houston, Cost: $0 (assuming free entry or covered by a city pass)\nLunch: Jalapenos, Houston, Cost: $57 x 2 people = $114\nDinner: The BrewMaster - The Mix Fine Dine, Houston, Cost: $52 x 2 people = $104\nAccommodation: Sunny and Airy near Manhattan, Houston, Cost: $499 x 2 nights = $998 (minimum nights: 2)\n\nTotal cost for Day 1: $114 + $0 + $114 + $104 + $998 = $1330\n\nDay 2: March 5, 2022\nCurrent City: Houston\nTransportation: -, Cost: $0\nBreakfast: Super Bakery, Houston, Cost: $30 x 2 people = $60\nAttraction: Houston Museum of Natural Science, Cost: $0 (assuming free entry or covered by a city pass)\nLunch: Earthen Spices, Houston, Cost: $28 x 2 people = $56\nDinner: Cyber Adda 24, Houston, Cost: $73 x 2 people = $146\nAccommodation: Sunny and Airy near Manhattan, Houston (already paid for Day 1)\n\nTotal cost for Day 2: $0 + $60 + $0 + $56 + $146 + $0 = $262\n\nDay 3: March 6, 2022\nCurrent City: from Houston to Dallas\nTransportation: Flight Number: F3673853, from Houston to Dallas, Departure Time: 07:46, Arrival Time: 09:09, Cost: $53 x 2 people = $106\nBreakfast: - , Cost: $0\nAttraction: The Sixth Floor Museum at Dealey Plaza, Cost: $0 (assuming free entry or covered by a city pass)\nLunch: Coconuts Fish Cafe, Dallas, Cost: $38 x 2 people = $76\nDinner: 1918 Bistro & Grill, Dallas, Cost: $90 x 2 people = $180\nAccommodation: Luxury Williamsburg duplex, private roof terrace, Dallas, Cost: $241 x 2 nights = $482 (minimum nights: 4)\n\nTotal cost for Day 3: $106 + $0 + $0 + $76 + $180 + $482 = $844\n\nDay 4: March 7, 2022\nCurrent City: Dallas\nTransportation: -, Cost: $0\nBreakfast: Cafe Gatherings, Dallas, Cost: $17 x 2 people = $34\nAttraction: Reunion Tower, Cost: $0 (assuming free entry or covered by a city pass)\nLunch: Drifters Cafe, Dallas, Cost: $21 x 2 people = $42\nDinner: Delhicacy, Dallas, Cost: $67 x 2 people = $134\nAccommodation: Luxury Williamsburg duplex, private roof terrace, Dallas (already paid for Day 3)\n\nTotal cost for Day 4: $0 + $34 + $0 + $42 + $134 + $0 = $210\n\nDay 5: March 8, 2022\nCurrent City: from Dallas to Lake Charles\nTransportation: Flight Number: F3602526, from Dallas to Lake Charles, Departure Time: 09:30, Arrival Time: 10:39, Cost: $114 x 2 people = $228\nBreakfast: - , Cost: $0\nAttraction: - , Cost: $0\nLunch: - , Cost: $0\nDinner: - , Cost: $0\nAccommodation: -, Cost: $0\n\nTotal cost for Day 5: $228\n\nThe total cost of this trip is the sum of the costs from Day 1, Day 2, Day 3, Day 4, and Day 5. It is $1330 + $262 + $844 + $210 + $228 = $2874 which is less than the required budget of $4600.\n\nPlease note that attraction costs are assumed to be free or covered by a city pass, and the accommodation choices are based on the preference for places where parties are allowed, as per the available data. If the attractions have an entry fee, this will need to be adjusted within the budget.", "gpt-4-1106-preview_direct_sole-planning_parsed_results": [{"days": 1, "current_city": "from Lake Charles to Houston", "transportation": "Flight Number: F3932451, from Lake Charles to Houston, Departure Time: 07:02, Arrival Time: 08:27", "breakfast": "-", "attraction": "Downtown Aquarium, Houston;", "lunch": "Jalapenos, Houston", "dinner": "The BrewMaster - The Mix Fine Dine, Houston", "accommodation": "Sunny and Airy near Manhattan, Houston"}, {"days": 2, "current_city": "Houston", "transportation": "-", "breakfast": "Super Bakery, Houston", "attraction": "Space Center Houston, Houston; Water Wall, Houston;", "lunch": "Sheetla Dhaba, Houston", "dinner": "Matchbox, Houston", "accommodation": "Sunny and Airy near Manhattan, Houston"}, {"days": 3, "current_city": "from Houston to Dallas", "transportation": "Flight Number: F3673853, from Houston to Dallas, Departure Time: 07:46, Arrival Time: 09:09", "breakfast": "-", "attraction": "The Dallas World Aquarium, Dallas; The Sixth Floor Museum at Dealey Plaza, Dallas;", "lunch": "Coconuts Fish Cafe, Dallas", "dinner": "1918 Bistro & Grill, Dallas", "accommodation": "Luxury Williamsburg duplex, private roof terrace, Dallas"}, {"days": 4, "current_city": "Dallas", "transportation": "-", "breakfast": "Yanki Sizzlers, Dallas", "attraction": "Reunion Tower, Dallas; Dallas Museum of Art, Dallas;", "lunch": "Aravali Owls, Dallas", "dinner": "Kebab Xpress, Dallas", "accommodation": "Luxury Williamsburg duplex, private roof terrace, Dallas"}, {"days": 5, "current_city": "from Dallas to Lake Charles", "transportation": "Flight Number: F3602526, from Dallas to Lake Charles, Departure Time: 09:30, Arrival Time: 10:39", "breakfast": "-", "attraction": "-", "lunch": "-", "dinner": "-", "accommodation": "-"}]}]