[{"gpt-4-1106-preview_direct_sole-planning_results": "Travel Plan:\n\nDay 1: March 24, 2022\nCurrent City: from Milwaukee to New York\nTransportation: Flight Number: F3643145, from Milwaukee to New York, Departure Time: 18:36, Arrival Time: 21:58, Cost: $226 x 2 = $452\nBreakfast: - (Assuming travelers will have breakfast before the flight), Cost: $0\nAttraction: - (Assuming arrival in New York is too late for attractions), Cost: $0\nLunch: - (Assuming travelers will have lunch before the flight), Cost: $0\nDinner: Seasons 52 Fresh Grill, New York, Average Cost: $30 x 2 = $60\nAccommodation: A Contemporary Homelike Stay in the Best of BK, New York, Cost: $228 x 2 nights = $456 (minimum nights: 2)\n\nTotal cost for Day 1: $452 (Transportation) + $60 (Dinner) + $456 (Accommodation) = $968\n\nDay 2: March 25, 2022\nCurrent City: New York\nTransportation: -, Cost: $0\nBreakfast: Lord of the Drinks Forum, New York, Average Cost: $71 x 2 = $142\nAttraction: Central Park, New York, Cost: $0 (Assuming free entry)\nLunch: Gurgaon Hights, New York, Average Cost: $46 x 2 = $92\nDinner: Rambhog, New York, Average Cost: $95 x 2 = $190\nAccommodation: Already paid for on Day 1.\n\nTotal cost for Day 2: $142 (Breakfast) + $92 (Lunch) + $190 (Dinner) = $424\n\nDay 3: March 26, 2022\nCurrent City: from New York to Milwaukee\nTransportation: Flight Number: F3644990, from New York to Milwaukee, Departure Time: 15:20, Arrival Time: 16:27, Cost: $218 x 2 = $436\nBreakfast: Green Chick Chop, New York, Average Cost: $26 x 2 = $52\nAttraction: Statue of Liberty, New York, Cost: $0 (Assuming free entry)\nLunch: G Dot, New York, Average Cost: $75 x 2 = $150\nDinner: - (Assuming travelers will have dinner after arriving back in Milwaukee), Cost: $0\nAccommodation: - (Returning to Milwaukee)\n\nTotal cost for Day 3: $436 (Transportation) + $52 (Breakfast) + $150 (Lunch) = $638\n\nThe total cost of this trip is the sum of the costs from Day 1, Day 2, and Day 3. It is $968 (Day 1) + $424 (Day 2) + $638 (Day 3) = $2030\n\nHowever, the total cost exceeds the budget of $1,900. To adjust the plan within the budget, we can opt for the self-driving option from Milwaukee to New York and back, which costs $70 each way.\n\nAdjusted Transportation Costs:\nDay 1: Self-driving from Milwaukee to New York, Cost: $70\nDay 3: Self-driving from New York to Milwaukee, Cost: $70\n\nAdjusted Total Costs:\nDay 1: $70 (Transportation) + $60 (Dinner) + $456 (Accommodation) = $586\nDay 2: $424 (Same as before)\nDay 3: $70 (Transportation) + $52 (Breakfast) + $150 (Lunch) = $272\n\nAdjusted Total Trip Cost: $586 (Day 1) + $424 (Day 2) + $272 (Day 3) = $1282\n\nThe adjusted total cost of $1282 is now within the budget of $1,900.", "gpt-4-1106-preview_direct_sole-planning_parsed_results": [{"day": 1, "current_city": "from Milwaukee to New York", "transportation": "Flight Number: F3643145, from Milwaukee to New York, Departure Time: 18:36, Arrival Time: 21:58", "breakfast": "-", "attraction": "-", "lunch": "-", "dinner": "Seasons 52 Fresh Grill, New York", "accommodation": "A Contemporary Homelike Stay in the Best of BK, New York"}, {"day": 2, "current_city": "New York", "transportation": "-", "breakfast": "Lord of the Drinks Forum, New York", "attraction": "Statue of Liberty, New York;Central Park, New York;", "lunch": "Gurgaon Hights, New York", "dinner": "QD's Restaurant, New York", "accommodation": "A Contemporary Homelike Stay in the Best of BK, New York"}, {"day": 3, "current_city": "from New York to Milwaukee", "transportation": "Flight Number: F3644990, from New York to Milwaukee, Departure Time: 15:20, Arrival Time: 16:27", "breakfast": "Sir John Bakery Cafe, New York", "attraction": "Empire State Building, New York;", "lunch": "Baltazar, New York", "dinner": "-", "accommodation": "-"}]}]