[{"gpt-4-1106-preview_direct_sole-planning_results": "Travel Plan:\n\nDay 1: March 25, 2022\nCurrent City: from Billings to Dallas\nTransportation: Flight Number: F3606099, from Billings to Dallas, Departure Time: 13:42, Arrival Time: 17:08, Cost: $455\nDinner: Coconuts Fish Cafe, Dallas, Cost: $38\nAccommodation: 1BR, elevator, kitchen, doorman!, Dallas, Cost: $475\nTotal cost: $455 (flight) + $38 (dinner) + $475 (accommodation) = $968\n\nDay 2: March 26, 2022\nCurrent City: Dallas\nBreakfast: Cafe Gatherings, Dallas, Cost: $17\nAttraction: The Dallas World Aquarium, Dallas, Cost: (Assumed cost, not provided in reference data)\nLunch: 1918 Bistro & Grill, Dallas, Cost: $90\nDinner: Yanki Sizzlers, Dallas, Cost: $96\nAccommodation: 1BR, elevator, kitchen, doorman!, Dallas, Cost: $475\nTotal cost: $17 (breakfast) + (attraction cost) + $90 (lunch) + $96 (dinner) + $475 (accommodation) = $678 + (attraction cost)\n\nDay 3: March 27, 2022\nCurrent City: from Dallas to Longview\nTransportation: Flight Number: F3589721, from Dallas to Longview, Departure Time: 12:29, Arrival Time: 13:21, Cost: $69\nLunch: Barbeque Nation, Longview, Cost: $26\nAttraction: Longview World of Wonders, Longview, Cost: (Assumed cost, not provided in reference data)\nDinner: Monster's Cafe, Longview, Cost: $94\nAccommodation: Cozy, bright Bohemian pad in NYC's Epic Village, Longview, Cost: $478\nTotal cost: $69 (flight) + $26 (lunch) + (attraction cost) + $94 (dinner) + $478 (accommodation) = $667 + (attraction cost)\n\nDay 4: March 28, 2022\nCurrent City: Longview\nBreakfast: Apna Restaurant, Longview, Cost: $17\nAttraction: Gregg County Historical Museum, Longview, Cost: (Assumed cost, not provided in reference data)\nLunch: Apni Rasoi, Longview, Cost: $25\nDinner: Bikaner Sweets & Restaurant, Longview, Cost: $98\nAccommodation: Cozy, bright Bohemian pad in NYC's Epic Village, Longview, Cost: $478\nTotal cost: $17 (breakfast) + (attraction cost) + $25 (lunch) + $98 (dinner) + $478 (accommodation) = $618 + (attraction cost)\n\nDay 5: March 29, 2022\nCurrent City: from Longview to Texarkana\nTransportation: Self-driving, from Longview to Texarkana, duration: 1 hour 36 mins, distance: 141 km, cost: $7\nLunch: Big City Bread Cafe, Texarkana, Cost: $61\nAttraction: Museum of Regional History, Texarkana, Cost: (Assumed cost, not provided in reference data)\nDinner: Columbia Restaurant, Texarkana, Cost: $91\nAccommodation: sunny airy bohemian rm, private bath! hip 'shwick, Texarkana, Cost: $592\nTotal cost: $7 (transportation) + $61 (lunch) + (attraction cost) + $91 (dinner) + $592 (accommodation) = $751 + (attraction cost)\n\nDay 6: March 30, 2022\nCurrent City: Texarkana\nBreakfast: Poets Cafe, Texarkana, Cost: $88\nAttraction: Spring Lake Park, Texarkana, Cost: (Assumed cost, not provided in reference data)\nLunch: Club Mojo, Texarkana, Cost: $49\nDinner: Bansiwala Rasoi, Texarkana, Cost: $71\nAccommodation: sunny airy bohemian rm, private bath! hip 'shwick, Texarkana, Cost: $592\nTotal cost: $88 (breakfast) + (attraction cost) + $49 (lunch) + $71 (dinner) + $592 (accommodation) = $800 + (attraction cost)\n\nDay 7: March 31, 2022\nCurrent City: from Texarkana to Billings\nTransportation: Self-driving, from Texarkana to Billings, duration: 21 hours 43 mins, distance: 2,434 km, cost: $121\nBreakfast: Columbia Restaurant, Texarkana, Cost: $91\nTotal cost: $121 (transportation) + $91 (breakfast) = $212\n\nThe total cost of this trip is the sum of the costs from day 1 to day 7. Since the attraction costs are not provided, they will be denoted as (attraction cost) and should be calculated when the actual prices are known.\n\nTotal trip cost = $968 (day 1) + $678 + (attraction cost) (day 2) + $667 + (attraction cost) (day 3) + $618 + (attraction cost) (day 4) + $751 + (attraction cost) (day 5) + $800 + (attraction cost) (day 6) + $212 (day 7) = $3994 + (total attraction costs)\n\nRemaining budget = $8500 - $3994 = $4506 - (total attraction costs)\n\nPlease note that the costs for attractions are not provided in the reference data, and therefore, the actual total cost may vary. Additionally, the accommodation costs are based on the assumption that the traveler will stay at the same place for the entire stay in each city. The traveler should ensure that the total attraction costs do not exceed the remaining budget.", "gpt-4-1106-preview_direct_sole-planning_parsed_results": [{"day": 1, "current_city": "from Billings to Dallas", "transportation": "Flight Number: F3606099, from Billings to Dallas, Departure Time: 13:42, Arrival Time: 17:08", "breakfast": "-", "attraction": "-", "lunch": "-", "dinner": "Coconuts Fish Cafe, Dallas", "accommodation": "1BR, elevator, kitchen, doorman!, Dallas"}, {"day": 2, "current_city": "Dallas", "transportation": "-", "breakfast": "Cafe Gatherings, Dallas", "attraction": "The Dallas World Aquarium, Dallas;The Sixth Floor Museum at Dealey Plaza, Dallas;", "lunch": "1918 Bistro & Grill, Dallas", "dinner": "Yanki Sizzlers, Dallas", "accommodation": "1BR, elevator, kitchen, doorman!, Dallas"}, {"day": 3, "current_city": "from Dallas to Longview", "transportation": "Flight Number: F3589721, from Dallas to Longview, Departure Time: 12:29, Arrival Time: 13:21", "breakfast": "-", "attraction": "Longview World of Wonders, Longview", "lunch": "Barbeque Nation, Longview", "dinner": "Apna Restaurant, Longview", "accommodation": "Cozy, bright Bohemian pad in NYC's Epic Village, Longview"}, {"day": 4, "current_city": "Longview", "transportation": "-", "breakfast": "Monster's Cafe, Longview", "attraction": "Gregg County Historical Museum, Longview;Longview Museum of Fine Arts, Longview;", "lunch": "Apni Rasoi, Longview", "dinner": "Bikaner Sweets & Restaurant, Longview", "accommodation": "Cozy, bright Bohemian pad in NYC's Epic Village, Longview"}, {"day": 5, "current_city": "from Longview to Texarkana", "transportation": "Self-driving, duration: 1 hour 36 mins, distance: 141 km, Cost: 7", "breakfast": "-", "attraction": "Museum of Regional History, Texarkana", "lunch": "Big City Bread Cafe, Texarkana", "dinner": "Columbia Restaurant, Texarkana", "accommodation": "sunny airy bohemian rm, private bath! hip 'shwick, Texarkana"}, {"day": 6, "current_city": "Texarkana", "transportation": "-", "breakfast": "Poets Cafe, Texarkana", "attraction": "Spring Lake Park, Texarkana;Four States Auto Museum, Texarkana;", "lunch": "Club Mojo, Texarkana", "dinner": "Bansiwala Rasoi, Texarkana", "accommodation": "sunny airy bohemian rm, private bath! hip 'shwick, Texarkana"}, {"day": 7, "current_city": "from Texarkana to Billings", "transportation": "Self-driving, duration: 21 hours 43 mins, distance: 2,434 km, Cost: 121", "breakfast": "Purani Dilli Foods, Texarkana", "attraction": "ArtSparK, Texarkana", "lunch": "The Beer Cafe - BIGGIE, Texarkana", "dinner": "-", "accommodation": "-"}]}]