[{"gpt-4-1106-preview_direct_sole-planning_results": "Travel Plan:\n\nDay 1: March 3rd, 2022\nCurrent City: from Newark to Savannah\nTransportation: Flight Number: F4070527, from Newark to Savannah, Departure Time: 08:54, Arrival Time: 11:27, Cost: $242 x 2 = $484\nBreakfast: - (Assuming breakfast will be had before departure or during the flight), Cost: $0\nAttraction: Forsyth Park, Savannah, Cost: $0 (Assuming public parks have no entry fee)\nLunch: Sr. Sol 1, Savannah, Average Cost: $30 x 2 = $60\nDinner: Bosphorous Turkish Cuisine, Savannah, Average Cost: $58 x 2 = $116\nAccommodation: Lapp House, Savannah, Cost: $118 x 1 night = $118 (Suitable for children and meets the minimum nights requirement)\n\nTotal cost for Day 1: $484 (Transportation) + $0 (Breakfast) + $0 (Attraction) + $60 (Lunch) + $116 (Dinner) + $118 (Accommodation) = $778\n\nDay 2: March 4th, 2022\nCurrent City: Savannah\nTransportation: -, Cost: $0\nBreakfast: Manohar Dairy And Restaurant, Savannah, Average Cost: $23 x 2 = $46\nAttraction: Savannah Children's Museum, Savannah, Cost: $0 (Assuming public museums have no entry fee or minimal fee covered by the budget)\nLunch: The Mad Teapot/The Wishing Chair, Savannah, Average Cost: $23 x 2 = $46\nDinner: Dhaba On Wheels, Savannah, Average Cost: $18 x 2 = $36\nAccommodation: Lapp House, Savannah, Cost: $118 x 1 night = $118 (Continuing the stay from the previous night)\n\nTotal cost for Day 2: $0 (Transportation) + $46 (Breakfast) + $0 (Attraction) + $46 (Lunch) + $36 (Dinner) + $118 (Accommodation) = $246\n\nDay 3: March 5th, 2022\nCurrent City: from Savannah to Newark\nTransportation: Flight Number: F3903501, from Savannah to Newark, Departure Time: 06:02, Arrival Time: 08:11, Cost: $294 x 2 = $588\nBreakfast: - (Assuming breakfast will be had before departure or during the flight), Cost: $0\nAttraction: - (No time for attractions due to early flight), Cost: $0\nLunch: - (Assuming lunch will be had upon arrival back in Newark), Cost: $0\nDinner: - (Not included as the travelers will have returned to their origin city), Cost: $0\nAccommodation: - (Not needed as the travelers will have returned to their origin city), Cost: $0\n\nTotal cost for Day 3: $588 (Transportation) + $0 (Breakfast) + $0 (Attraction) + $0 (Lunch) + $0 (Dinner) + $0 (Accommodation) = $588\n\nThe total cost of this trip is the sum of the costs from Day 1, Day 2, and Day 3. It is $778 + $246 + $588 = $1,612\n\nUnfortunately, the total cost exceeds the budget of $1,400. To adjust the plan to fit the budget, we can consider the following changes:\n\n1. Choose a less expensive flight option if available.\n2. Opt for more budget-friendly meals.\n3. Find a more economical accommodation option that still meets the requirements for children under 10.\n\nPlease note that the provided attractions are assumed to be free of charge, which may not be the case. Additional costs for attractions would further increase the total cost.", "gpt-4-1106-preview_direct_sole-planning_parsed_results": [{"day": 1, "current_city": "from Newark to Savannah", "transportation": "Flight Number: F4070527, from Newark to Savannah, Departure Time: 08:54, Arrival Time: 11:27", "breakfast": "-", "attraction": "Forsyth Park, Savannah;", "lunch": "Sr. Sol 1, Savannah", "dinner": "The Mad Teapot/The Wishing Chair, Savannah", "accommodation": "Lapp House, Savannah"}, {"day": 2, "current_city": "Savannah", "transportation": "-", "breakfast": "Country's Barbecue, Savannah", "attraction": "Savannah Historic District, Savannah;Savannah's Waterfront, Savannah;", "lunch": "Bosphorous Turkish Cuisine, Savannah", "dinner": "Manohar Dairy And Restaurant, Savannah", "accommodation": "Lapp House, Savannah"}, {"day": 3, "current_city": "from Savannah to Newark", "transportation": "Flight Number: F3903501, from Savannah to Newark, Departure Time: 06:02, Arrival Time: 08:11", "breakfast": "-", "attraction": "-", "lunch": "-", "dinner": "-", "accommodation": "-"}]}]