[{"gpt-4-1106-preview_direct_sole-planning_results": "Travel Plan:\n\nDay 1: March 18, 2022\nCurrent City: from Denver to Buffalo\nTransportation: Flight Number: F4026791, from Denver to Buffalo, Departure Time: 13:07, Arrival Time: 18:00, Cost: $505 x 2 = $1010\nDinner: Shokitini, Buffalo, Average Cost: $41 x 2 = $82\nAccommodation: Cozy Studio in Heart of Ft Greene, Buffalo, Cost: $200 x 2 nights = $400\n\nTotal cost for Day 1: $1010 (Flight) + $82 (Dinner) + $400 (Accommodation) = $1492\n\nDay 2: March 19, 2022\nCurrent City: Buffalo\nBreakfast: Shokitini, Buffalo, Average Cost: $41 x 2 = $82\nAttraction: The Buffalo Zoo, Buffalo, Cost: Free (assuming no entrance fee is listed)\nLunch: Tibby's New Orleans Kitchen, Buffalo, Average Cost: $48 x 2 = $96\nDinner: Ammu's South Indian Restaurant, Buffalo, Average Cost: $80 x 2 = $160\nAccommodation: Cozy Studio in Heart of Ft Greene, Buffalo, Cost: Included in Day 1\n\nTotal cost for Day 2: $82 (Breakfast) + $96 (Lunch) + $160 (Dinner) = $338\n\nDay 3: March 20, 2022\nCurrent City: from Buffalo to New York\nTransportation: Flight Number: F3651086, from Buffalo to New York, Departure Time: 10:54, Arrival Time: 12:08, Cost: $73 x 2 = $146\nBreakfast: Shokitini, Buffalo, Average Cost: $41 x 2 = $82\nLunch: Seasons 52 Fresh Grill, New York, Average Cost: $30 x 2 = $60\nDinner: Gurgaon Hights, New York, Average Cost: $46 x 2 = $92\nAccommodation: Versatile private room in Harlem/Hamilton Heights!, New York, Cost: $398 x 2 nights = $796\n\nTotal cost for Day 3: $146 (Flight) + $82 (Breakfast) + $60 (Lunch) + $92 (Dinner) + $796 (Accommodation) = $1176\n\nDay 4: March 21, 2022\nCurrent City: New York\nBreakfast: Gurgaon Hights, New York, Average Cost: $46 x 2 = $92\nAttraction: Statue of Liberty, New York, Cost: Free (assuming no entrance fee is listed)\nLunch: Lord of the Drinks Forum, New York, Average Cost: $71 x 2 = $142\nDinner: Gurgaon Hights, New York, Average Cost: $46 x 2 = $92\nAccommodation: Versatile private room in Harlem/Hamilton Heights!, New York, Cost: Included in Day 3\n\nTotal cost for Day 4: $92 (Breakfast) + $142 (Lunch) + $92 (Dinner) = $326\n\nDay 5: March 22, 2022\nCurrent City: from New York to Denver\nTransportation: Flight Number: F3766607, from New York to Denver, Departure Time: 07:23, Arrival Time: 09:56, Cost: $327 x 2 = $654\nBreakfast: Gurgaon Hights, New York, Average Cost: $46 x 2 = $92\n\nTotal cost for Day 5: $654 (Flight) + $92 (Breakfast) = $746\n\nThe total cost of this trip is the sum of the costs from Day 1, Day 2, Day 3, Day 4, and Day 5. It is $1492 + $338 + $1176 + $326 + $746 = $4078, which is less than the required budget of $6300.\n\nPlease note that attraction costs are assumed to be free as no entrance fees are listed in the provided data. Also, the accommodation costs are calculated based on the minimum nights required. The prices for meals are based on the average cost for two people at each restaurant. The flight costs are for two people.", "gpt-4-1106-preview_direct_sole-planning_parsed_results": [{"day": 1, "current_city": "from Denver to Buffalo", "transportation": "Flight Number: F4026791, from Denver to Buffalo, Departure Time: 13:07, Arrival Time: 18:00", "breakfast": "-", "attraction": "-", "lunch": "-", "dinner": "Tibby's New Orleans Kitchen, Buffalo", "accommodation": "Cozy Studio in Heart of Ft Greene, Buffalo"}, {"day": 2, "current_city": "Buffalo", "transportation": "-", "breakfast": "Punjab Grill, Buffalo", "attraction": "The Buffalo Zoo, Buffalo;Buffalo and Erie County Botanical Gardens, Buffalo;", "lunch": "Shokitini, Buffalo", "dinner": "Tibby's New Orleans Kitchen, Buffalo", "accommodation": "Cozy Studio in Heart of Ft Greene, Buffalo"}, {"day": 3, "current_city": "from Buffalo to New York", "transportation": "Flight Number: F3640942, from Buffalo to New York, Departure Time: 12:55, Arrival Time: 14:12", "breakfast": "-", "attraction": "Statue of Liberty, New York", "lunch": "Seasons 52 Fresh Grill, New York", "dinner": "Gurgaon Hights, New York", "accommodation": "Versatile private room in Harlem/Hamilton Heights!, New York"}, {"day": 4, "current_city": "New York", "transportation": "-", "breakfast": "Lord of the Drinks Forum, New York", "attraction": "Central Park, New York;Empire State Building, New York;", "lunch": "G Dot, New York", "dinner": "Gurgaon Hights, New York", "accommodation": "Versatile private room in Harlem/Hamilton Heights!, New York"}, {"day": 5, "current_city": "from New York to Denver", "transportation": "Flight Number: F3494235, from New York to Denver, Departure Time: 19:53, Arrival Time: 22:21", "breakfast": "G Dot, New York", "attraction": "The High Line, New York", "lunch": "Seasons 52 Fresh Grill, New York", "dinner": "-", "accommodation": "-"}]}]