[{"gpt-4-1106-preview_direct_sole-planning_results": "Travel Plan:\n\nDay 1: March 27, 2022\nCurrent City: from Miami to Dallas\nTransportation: Flight Number: F3677538, from Miami to Dallas, Departure Time: 10:07, Arrival Time: 12:00, Cost: $346 x 3 = $1038\nLunch: 1918 Bistro & Grill, Dallas, Cost: $90 x 3 = $270\nAttraction: The Sixth Floor Museum at Dealey Plaza, Dallas, Cost: $0 (no cost provided, assuming free entry)\nDinner: Yanki Sizzlers, Dallas, Cost: $96 x 3 = $288\nAccommodation: Luxury Williamsburg duplex, private roof terrace, Dallas, Cost: $241 x 2 nights = $482\n\nTotal cost for Day 1: $1038 (Flight) + $270 (Lunch) + $0 (Attraction) + $288 (Dinner) + $482 (Accommodation) = $2078\n\nDay 2: March 28, 2022\nCurrent City: Dallas\nTransportation: -, Cost: $0\nBreakfast: Cafe Gatherings, Dallas, Cost: $17 x 3 = $51\nAttraction: Dallas Museum of Art, Dallas, Cost: $0 (no cost provided, assuming free entry)\nLunch: Kebab Xpress, Dallas, Cost: $93 x 3 = $279\nAttraction: Reunion Tower, Dallas, Cost: $0 (no cost provided, assuming free entry)\nDinner: Aravali Owls, Dallas, Cost: $53 x 3 = $159\nAccommodation: Luxury Williamsburg duplex, private roof terrace, Dallas (already paid for Day 1)\n\nTotal cost for Day 2: $0 (Transportation) + $51 (Breakfast) + $0 (Attraction) + $279 (Lunch) + $0 (Attraction) + $159 (Dinner) = $489\n\nDay 3: March 29, 2022\nCurrent City: from Dallas to Houston\nTransportation: Flight Number: F3718944, from Dallas to Houston, Departure Time: 10:21, Arrival Time: 11:22, Cost: $64 x 3 = $192\nLunch: Pebble Street, Houston, Cost: $73 x 3 = $219\nAttraction: Space Center Houston, Houston, Cost: $0 (no cost provided, assuming free entry)\nDinner: Al Arabian Express, Houston, Cost: $74 x 3 = $222\nAccommodation: Sunny and Airy near Manhattan, Houston, Cost: $499 x 2 nights = $998\n\nTotal cost for Day 3: $192 (Flight) + $219 (Lunch) + $0 (Attraction) + $222 (Dinner) + $998 (Accommodation) = $1631\n\nDay 4: March 30, 2022\nCurrent City: Houston\nTransportation: -, Cost: $0\nBreakfast: Super Bakery, Houston, Cost: $30 x 3 = $90\nAttraction: Houston Museum of Natural Science, Houston, Cost: $0 (no cost provided, assuming free entry)\nLunch: The BrewMaster - The Mix Fine Dine, Houston, Cost: $52 x 3 = $156\nAttraction: Houston Zoo, Houston, Cost: $0 (no cost provided, assuming free entry)\nDinner: Earthen Spices, Houston, Cost: $28 x 3 = $84\nAccommodation: Sunny and Airy near Manhattan, Houston (already paid for Day 3)\n\nTotal cost for Day 4: $0 (Transportation) + $90 (Breakfast) + $0 (Attraction) + $156 (Lunch) + $0 (Attraction) + $84 (Dinner) = $330\n\nDay 5: March 31, 2022\nCurrent City: from Houston to Miami\nTransportation: Flight Number: F3658491, from Houston to Miami, Departure Time: 05:32, Arrival Time: 08:50, Cost: $290 x 3 = $870\nBreakfast: Jalapenos, Houston, Cost: $57 x 3 = $171\nAttraction: Gerald D. Hines Waterwall Park, Houston, Cost: $0 (no cost provided, assuming free entry)\nLunch: Truth Coffee, Houston, Cost: $29 x 3 = $87\nDinner: - (Assuming dinner will be in Miami or on the flight), Cost: $0\nAccommodation: - (Last day, returning home), Cost: $0\n\nTotal cost for Day 5: $870 (Flight) + $171 (Breakfast) + $0 (Attraction) + $87 (Lunch) + $0 (Dinner) = $1128\n\nThe total cost of this trip is the sum of the costs from Day 1, Day 2, Day 3, Day 4, and Day 5. It is $2078 + $489 + $1631 + $330 + $1128 = $5656, which is less than the required budget of $8500.", "gpt-4-1106-preview_direct_sole-planning_parsed_results": [{"day": 1, "current_city": "from Miami to Dallas", "transportation": "Flight Number: F3677538, from Miami to Dallas, Departure Time: 10:07, Arrival Time: 12:00", "breakfast": "-", "attraction": "The Sixth Floor Museum at Dealey Plaza, Dallas;", "lunch": "1918 Bistro & Grill, Dallas", "dinner": "Aravali Owls, Dallas", "accommodation": "Luxury Williamsburg duplex, private roof terrace, Dallas"}, {"day": 2, "current_city": "Dallas", "transportation": "-", "breakfast": "Cafe Gatherings, Dallas", "attraction": "The Dallas Arboretum and Botanical Garden, Dallas;Reunion Tower, Dallas;", "lunch": "Uma Foodies' Hut, Dallas", "dinner": "Kebab Xpress, Dallas", "accommodation": "Luxury Williamsburg duplex, private roof terrace, Dallas"}, {"day": 3, "current_city": "from Dallas to Houston", "transportation": "Flight Number: F3718944, from Dallas to Houston, Departure Time: 10:21, Arrival Time: 11:22", "breakfast": "-", "attraction": "Space Center Houston, Houston;", "lunch": "Pebble Street, Houston", "dinner": "Al Arabian Express, Houston", "accommodation": "Sunny and Airy near Manhattan, Houston"}, {"day": 4, "current_city": "Houston", "transportation": "-", "breakfast": "Super Bakery, Houston", "attraction": "Houston Museum of Natural Science, Houston;Gerald D. Hines Waterwall Park, Houston;", "lunch": "The BrewMaster - The Mix Fine Dine, Houston", "dinner": "Matchbox, Houston", "accommodation": "Sunny and Airy near Manhattan, Houston"}, {"day": 5, "current_city": "from Houston to Miami", "transportation": "Flight Number: F3658491, from Houston to Miami, Departure Time: 05:32, Arrival Time: 08:50", "breakfast": "-", "attraction": "-", "lunch": "-", "dinner": "-", "accommodation": "-"}]}]