[{"gpt-4-1106-preview_direct_sole-planning_results": "Travel Plan:\n\nDay 1: March 28, 2022\nCurrent City: from Boston to San Juan\nTransportation: Flight Number: F3764584, from Boston to San Juan, Departure Time: 14:04, Arrival Time: 18:16, Cost: $366\nBreakfast: - (Assuming breakfast is not required as the flight is post-breakfast time), Cost: $0\nAttraction: Castillo San Felipe del Morro, San Juan, Cost: $10 (Assumed cost as it's not provided)\nLunch: Hoka-Hoka Japanese Steak & Sushi, San Juan, Cost: $27\nDinner: Oh My!, San Juan, Cost: $18\nAccommodation: FLUSHING APT!! BEST DEAL IN NYC!!!, San Juan, Cost: $135\n\nTotal cost for Day 1: $366 (Flight) + $0 (Breakfast) + $10 (Attraction) + $27 (Lunch) + $18 (Dinner) + $135 (Accommodation) = $556\n\nDay 2: March 29, 2022\nCurrent City: San Juan\nTransportation: -, Cost: $0\nBreakfast: Coldpress Company, San Juan, Cost: $11\nAttraction: Museo de las Am\u00e9ricas, San Juan, Cost: $10 (Assumed cost as it's not provided)\nLunch: Christian and Jake's Bistro, San Juan, Cost: $59\nDinner: Go! Dimsum, San Juan, Cost: $54\nAccommodation: FLUSHING APT!! BEST DEAL IN NYC!!!, San Juan, Cost: $135\n\nTotal cost for Day 2: $0 (Transportation) + $11 (Breakfast) + $10 (Attraction) + $59 (Lunch) + $54 (Dinner) + $135 (Accommodation) = $269\n\nDay 3: March 30, 2022\nCurrent City: from San Juan to Boston\nTransportation: Flight Number: F3764590, from San Juan to Boston, Departure Time: 18:50, Arrival Time: 23:02, Cost: $569\nBreakfast: Gulshan Dhaba, San Juan, Cost: $40\nAttraction: Paseo de La Princesa, San Juan, Cost: $0 (Assuming no entry fee)\nLunch: Maison Des Desserts, San Juan, Cost: $70\nDinner: - (Assuming dinner is not required as the flight is post-dinner time), Cost: $0\nAccommodation: - (Returning to Boston), Cost: $0\n\nTotal cost for Day 3: $569 (Flight) + $40 (Breakfast) + $0 (Attraction) + $70 (Lunch) + $0 (Dinner) + $0 (Accommodation) = $679\n\nThe total cost of this trip is the sum of the cost from day 1, day 2, and day 3. It is $556 + $269 + $679 = $1504\n\nNote: The total cost exceeds the budget by $104. To stay within the budget, we may need to choose a cheaper flight or adjust meal and accommodation options. However, since the provided data does not include cheaper flights or accommodations that fit within the remaining budget after accounting for the cheapest flight, this is the best possible plan with the given data. Additional information or adjustments to the budget would be necessary to finalize a plan within the $1,400 budget.", "gpt-4-1106-preview_direct_sole-planning_parsed_results": [{"day": 1, "current_city": "from Boston to San Juan", "transportation": "Flight Number: F3619758, from Boston to San Juan, Departure Time: 08:17, Arrival Time: 12:48, Cost: 466", "breakfast": "-", "attraction": "Castillo San Felipe del Morro, San Juan;", "lunch": "Christian and Jake's Bistro, San Juan", "dinner": "Hoka-Hoka Japanese Steak & Sushi, San Juan", "accommodation": "FLUSHING APT!! BEST DEAL IN NYC!!!, San Juan"}, {"day": 2, "current_city": "San Juan", "transportation": "-", "breakfast": "Coldpress Company, San Juan", "attraction": "Museo de Arte de Puerto Rico, San Juan; Paseo de La Princesa, San Juan;", "lunch": "Oh My!, San Juan", "dinner": "Go! Dimsum, San Juan", "accommodation": "FLUSHING APT!! BEST DEAL IN NYC!!!, San Juan"}, {"day": 3, "current_city": "from San Juan to Boston", "transportation": "Flight Number: F3619791, from San Juan to Boston, Departure Time: 12:02, Arrival Time: 16:27, Cost: 744", "breakfast": "Gulshan Dhaba, San Juan", "attraction": "Parque de las Palomas, San Juan;", "lunch": "-", "dinner": "-", "accommodation": "-"}]}]