[{"gpt-4-1106-preview_direct_sole-planning_results": "Travel Plan:\n\nDay 1: March 11, 2022\nCurrent City: from Rapid City to Colorado Springs\nTransportation: Taxi from Rapid City to Colorado Springs, duration: 6 hours 59 mins, distance: 735 km, Cost: $735\nBreakfast: - (Assuming breakfast is had before departure), Cost: $0\nAttraction: Garden of the Gods, Colorado Springs, Cost: $0 (Assumed free entry)\nLunch: Raglan Road Irish Pub and Restaurant, Colorado Springs, Average Cost: $97\nDinner: Derby, Colorado Springs, Average Cost: $67\nAccommodation: Large sunny park slope apartment, Colorado Springs, Cost: $82 x 7 people = $574\n\nTotal cost for Day 1: $735 (Taxi) + $679 (Meals) + $574 (Accommodation) = $1988\n\nDay 2: March 12, 2022\nCurrent City: Colorado Springs\nTransportation: -, Cost: $0\nBreakfast: Club Tokyo - Best Western Skycity Hotel, Colorado Springs, Average Cost: $64\nAttraction: Cheyenne Mountain Zoo, Colorado Springs, Cost: $0 (Assumed free entry)\nLunch: GoGourmet, Colorado Springs, Average Cost: $66\nDinner: New Spice World, Colorado Springs, Average Cost: $43\nAccommodation: Large sunny park slope apartment, Colorado Springs, Cost: $574\n\nTotal cost for Day 2: $0 (Transportation) + $637 (Meals) + $574 (Accommodation) = $1211\n\nDay 3: March 13, 2022\nCurrent City: from Colorado Springs to Denver\nTransportation: Flight Number: F3822851, from Colorado Springs to Denver, Departure Time: 05:54, Arrival Time: 06:43, Cost: $16 x 7 people = $112\nBreakfast: - (Assumed on flight or before), Cost: $0\nAttraction: Denver Zoo, Denver, Cost: $0 (Assumed free entry)\nLunch: The Fatty Bao - Asian Gastro Bar, Denver, Average Cost: $93\nDinner: Tasty Fare, Denver, Average Cost: $79\nAccommodation: Harlem cozy nights, Denver, Cost: $457 x 7 people = $3199\n\nTotal cost for Day 3: $112 (Flight) + $1204 (Meals) + $3199 (Accommodation) = $4515\n\nDay 4: March 14, 2022\nCurrent City: Denver\nTransportation: -, Cost: $0\nBreakfast: The Urban Socialite, Denver, Average Cost: $34\nAttraction: Denver Botanic Gardens, Denver, Cost: $0 (Assumed free entry)\nLunch: Woods Spice, Denver, Average Cost: $69\nDinner: Al Yousuf, Denver, Average Cost: $32\nAccommodation: Harlem cozy nights, Denver, Cost: $3199\n\nTotal cost for Day 4: $0 (Transportation) + $805 (Meals) + $3199 (Accommodation) = $4004\n\nDay 5: March 15, 2022\nCurrent City: from Denver to Alamosa\nTransportation: Flight Number: F3837889, from Denver to Alamosa, Departure Time: 16:17, Arrival Time: 17:15, Cost: $69 x 7 people = $483\nBreakfast: Cafe Diva, Denver, Average Cost: $44\nAttraction: San Luis Valley Museum | Alamosa, Alamosa, Cost: $0 (Assumed free entry)\nLunch: Atlanta Highway Seafood Market, Alamosa, Average Cost: $68\nDinner: Riverwalk Cafe, Alamosa, Average Cost: $97\nAccommodation: Comfortable studio suite in midtown Manhattan, Alamosa, Cost: $67 x 7 people = $469\n\nTotal cost for Day 5: $483 (Flight) + $623 (Meals) + $469 (Accommodation) = $1575\n\nDay 6: March 16, 2022\nCurrent City: Alamosa\nTransportation: -, Cost: $0\nBreakfast: Coffee to Cocktail Bar - Hyatt Place, Alamosa, Average Cost: $35\nAttraction: Rio Grande Farm Park, Alamosa, Cost: $0 (Assumed free entry)\nLunch: Burger Singh, Alamosa, Average Cost: $95\nDinner: Street Foods by Punjab Grill, Alamosa, Average Cost: $55\nAccommodation: Comfortable studio suite in midtown Manhattan, Alamosa, Cost: $469\n\nTotal cost for Day 6: $0 (Transportation) + $555 (Meals) + $469 (Accommodation) = $1024\n\nDay 7: March 17, 2022\nCurrent City: from Alamosa to Rapid City\nTransportation: Self-driving from Alamosa to Rapid City, duration: 9 hours 27 mins, distance: 998 km, Cost: $49 x 7 people = $343\nBreakfast: Cafe LazyMojo, Alamosa, Average Cost: $26\nAttraction: - (Assuming travel day), Cost: $0\nLunch: - (On the road), Cost: $0\nDinner: - (Assumed after arrival in Rapid City), Cost: $0\nAccommodation: - (End of trip), Cost: $0\n\nTotal cost for Day 7: $343 (Self-driving) + $182 (Meals) + $0 (Accommodation) = $525\n\nThe total cost of this trip is the sum of the costs from Day 1 to Day 7. It is $1988 + $1211 + $4515 + $4004 + $1575 + $1024 + $525 = $14842, which is less than the required budget of $16,300.\n\nPlease note that the costs for meals are based on average costs per person and may vary. Attractions are assumed to have free entry, which may not be the case, and should be verified. The accommodation costs are based on the price per person, assuming the entire room/apt is booked for 7 people. Transportation costs are calculated based on the provided data.", "gpt-4-1106-preview_direct_sole-planning_parsed_results": [{"day": 1, "current_city": "from Rapid City to Colorado Springs", "transportation": "Self-driving, from Rapid City to Colorado Springs, Duration: 6 hours 59 mins, Distance: 735 km, Cost: 252", "breakfast": "-", "attraction": "Garden of the Gods, Colorado Springs;", "lunch": "Raglan Road Irish Pub and Restaurant, Colorado Springs", "dinner": "Derby, Colorado Springs", "accommodation": "Large sunny park slope apartment, Colorado Springs"}, {"day": 2, "current_city": "Colorado Springs", "transportation": "-", "breakfast": "Club Tokyo - Best Western Skycity Hotel, Colorado Springs", "attraction": "Cheyenne Mountain Zoo, Colorado Springs;", "lunch": "Deepak Rasoi, Colorado Springs", "dinner": "GoGourmet, Colorado Springs", "accommodation": "Large sunny park slope apartment, Colorado Springs"}, {"day": 3, "current_city": "from Colorado Springs to Denver", "transportation": "Flight Number: F3822851, from Colorado Springs to Denver, Departure Time: 05:54, Arrival Time: 06:43, Cost: 112", "breakfast": "-", "attraction": "Denver Zoo, Denver;", "lunch": "The Fatty Bao - Asian Gastro Bar, Denver", "dinner": "The Urban Socialite, Denver", "accommodation": "Harlem cozy nights, Denver"}, {"day": 4, "current_city": "Denver", "transportation": "-", "breakfast": "Tasty Fare, Denver", "attraction": "Denver Botanic Gardens, Denver;", "lunch": "Woods Spice, Denver", "dinner": "Al Yousuf, Denver", "accommodation": "Harlem cozy nights, Denver"}, {"day": 5, "current_city": "from Denver to Alamosa", "transportation": "Flight Number: F3837889, from Denver to Alamosa, Departure Time: 16:17, Arrival Time: 17:15, Cost: 483", "breakfast": "-", "attraction": "Rio Grande Farm Park, Alamosa;", "lunch": "Riverwalk Cafe, Alamosa", "dinner": "Viva Hyderabad, Alamosa", "accommodation": "Comfortable studio suite in midtown Manhattan, Alamosa"}, {"day": 6, "current_city": "Alamosa", "transportation": "-", "breakfast": "Coffee to Cocktail Bar - Hyatt Place, Alamosa", "attraction": "Alamosa National Wildlife Refuge and Visitor Center, Alamosa;", "lunch": "Burger Singh, Alamosa", "dinner": "Street Foods by Punjab Grill, Alamosa", "accommodation": "Comfortable studio suite in midtown Manhattan, Alamosa"}, {"day": 7, "current_city": "from Alamosa to Rapid City", "transportation": "Self-driving, from Alamosa to Rapid City, Duration: 9 hours 27 mins, Distance: 998 km, Cost: 343", "breakfast": "-", "attraction": "-", "lunch": "-", "dinner": "-", "accommodation": "-"}]}]