[{"gpt-4-1106-preview_direct_sole-planning_results": "Travel Plan:\n\nDay 1: March 19th, 2022\nCurrent City: from St. Petersburg to Appleton\nTransportation: Flight Number: F3574992, from St. Petersburg to Appleton, Departure Time: 22:51, Arrival Time: 00:42, Cost: $542\nAccommodation: Cozy room + bright apartment + rooftop lounge, Appleton, Cost: $666\nTotal cost for Day 1: $542 (Transportation) + $666 (Accommodation) = $1208\n\nUnfortunately, the cost for Day 1 already exceeds the budget of $1,200. Therefore, we need to adjust the accommodation to fit within the budget.\n\nRevised Day 1:\nAccommodation: Stylish, convenient, renovated- 2 min to subway -, Appleton, Cost: $64\nTotal cost for Day 1: $542 (Transportation) + $64 (Accommodation) = $606\n\nDay 2: March 20th, 2022\nCurrent City: Appleton\nAttraction: The History Museum at the Castle, Appleton, Cost: $0 (assuming no entrance fee is listed)\nLunch: Swati Snacks, Appleton, Average Cost: $84\nDinner: Mikata Japanese Steakhouse, Appleton, Average Cost: $72\nAccommodation: Stylish, convenient, renovated- 2 min to subway -, Appleton, Cost: $64\nTotal cost for Day 2: $0 (Attraction) + $84 (Lunch) + $72 (Dinner) + $64 (Accommodation) = $220\n\nDay 3: March 21st, 2022\nCurrent City: from Appleton to St. Petersburg\nTransportation: Flight Number: F3578689, from Appleton to St. Petersburg, Departure Time: 07:19, Arrival Time: 11:01, Cost: $332\nBreakfast: Destination Live, Appleton, Average Cost: $30\nTotal cost for Day 3: $332 (Transportation) + $30 (Breakfast) = $362\n\nThe total cost of this trip is the sum of the costs from Day 1, Day 2, and Day 3. It is $606 + $220 + $362 = $1188, which is within the required budget of $1,200.\n\nPlease note that the costs for attractions are assumed to be free as no price is listed, and the costs for meals are based on the average cost for an individual at each restaurant. The accommodation chosen for Day 1 has been revised to fit within the budget constraints.", "gpt-4-1106-preview_direct_sole-planning_parsed_results": [{"day": 1, "current_city": "from St. Petersburg to Appleton", "transportation": "Flight Number: F3574992, from St. Petersburg to Appleton, Departure Time: 22:51, Arrival Time: 00:42", "breakfast": "-", "attraction": "-", "lunch": "-", "dinner": "-", "accommodation": "Cozy room + bright apartment + rooftop lounge, Appleton"}, {"day": 2, "current_city": "Appleton", "transportation": "-", "breakfast": "Mikata Japanese Steakhouse, Appleton", "attraction": "The History Museum at the Castle, Appleton;Hearthstone Historic House Museum, Appleton;", "lunch": "Swati Snacks, Appleton", "dinner": "Brick 29, Appleton", "accommodation": "Cozy room + bright apartment + rooftop lounge, Appleton"}, {"day": 3, "current_city": "from Appleton to St. Petersburg", "transportation": "Flight Number: F3578689, from Appleton to St. Petersburg, Departure Time: 07:19, Arrival Time: 11:01", "breakfast": "-", "attraction": "-", "lunch": "-", "dinner": "-", "accommodation": "-"}]}]