[{"gpt-4-1106-preview_direct_sole-planning_results": "Travel Plan:\n\nDay 1: March 7, 2022\nCurrent City: from Wichita to Alamosa\nTransportation: Self-driving from Wichita to Alamosa, duration: 8 hours 27 mins, distance: 819 km, Cost: 40\nBreakfast: - , Cost: 0\nAttraction: San Luis Valley Museum, Alamosa, Cost: -\nLunch: Atlanta Highway Seafood Market, Alamosa, Average Cost: 68\nDinner: Riverwalk Cafe, Alamosa, Average Cost: 97\nAccommodation: Comfortable studio suite in midtown Manhattan, Alamosa, Cost: 67 (minimum nights: 30, not suitable for a 7-day trip)\nAlternative Accommodation: Spacious Room with Private a Patio!, Alamosa, Cost: 605 (minimum nights: 2)\n\nTotal cost: 40 (Transportation) + 0 (Breakfast) + 68 (Lunch) + 97 (Dinner) + 605 (Accommodation) = 810\n\nDay 2: March 8, 2022\nCurrent City: Alamosa\nTransportation: -, Cost: 0\nBreakfast: Coffee to Cocktail Bar - Hyatt Place, Alamosa, Average Cost: 35\nAttraction: Rio Grande Farm Park, Alamosa, Cost: -\nLunch: Burger Singh, Alamosa, Average Cost: 95\nDinner: Cafe LazyMojo, Alamosa, Average Cost: 26\nAccommodation: Spacious Room with Private a Patio!, Alamosa, Cost: 605\n\nTotal cost: 0 (Transportation) + 35 (Breakfast) + 95 (Lunch) + 26 (Dinner) + 605 (Accommodation) = 761\n\nDay 3: March 9, 2022\nCurrent City: from Alamosa to Grand Junction\nTransportation: Self-driving from Alamosa to Grand Junction, duration: 4 hours 29 mins, distance: 396 km, Cost: 19\nBreakfast: Street Foods by Punjab Grill, Alamosa, Average Cost: 55\nAttraction: Museum of the West, Museums of Western Colorado, Grand Junction, Cost: -\nLunch: Austin's BBQ and Oyster Bar, Grand Junction, Average Cost: 15\nDinner: 2 Dog, Grand Junction, Average Cost: 29\nAccommodation: NYC Apartment near Central Park!, Grand Junction, Cost: 1118 (minimum nights: 3)\n\nTotal cost: 19 (Transportation) + 55 (Breakfast) + 15 (Lunch) + 29 (Dinner) + 1118 (Accommodation) = 1236\n\nDay 4: March 10, 2022\nCurrent City: Grand Junction\nTransportation: -, Cost: 0\nBreakfast: Shanghai Bar & Lounge - The Bristol Hotel, Grand Junction, Average Cost: 31\nAttraction: Eureka! McConnell Science Museum, Grand Junction, Cost: -\nLunch: Pind Balluchi, Grand Junction, Average Cost: 17\nDinner: Cocoa Tree, Grand Junction, Average Cost: 68\nAccommodation: NYC Apartment near Central Park!, Grand Junction, Cost: 1118\n\nTotal cost: 0 (Transportation) + 31 (Breakfast) + 17 (Lunch) + 68 (Dinner) + 1118 (Accommodation) = 1234\n\nDay 5: March 11, 2022\nCurrent City: from Grand Junction to Durango\nTransportation: Self-driving from Grand Junction to Durango, duration: 3 hours 33 mins, distance: 269 km, Cost: 13\nBreakfast: Punjab Da Pind, Grand Junction, Average Cost: 52\nAttraction: Animas Museum, Durango, Cost: -\nLunch: Samurai Japanese Cuisine & Sushi Bar, Durango, Average Cost: 67\nDinner: Dub's High on the Hog, Durango, Average Cost: 98\nAccommodation: Lux 1BR in the heart of NYC Theater district!, Durango, Cost: 81 (minimum nights: 30, not suitable for a 7-day trip)\nAlternative Accommodation: UES studio walking distance to central park, Durango, Cost: 997 (minimum nights: 7)\n\nTotal cost: 13 (Transportation) + 52 (Breakfast) + 67 (Lunch) + 98 (Dinner) + 997 (Accommodation) = 1227\n\nDay 6: March 12, 2022\nCurrent City: Durango\nTransportation: -, Cost: 0\nBreakfast: Hot & Tasty Chinese Food, Durango, Average Cost: 17\nAttraction: The Powerhouse, Durango, Cost: -\nLunch: Chickenette, Durango, Average Cost: 31\nDinner: Burger King, Durango, Average Cost: 11\nAccommodation: UES studio walking distance to central park, Durango, Cost: 997\n\nTotal cost: 0 (Transportation) + 17 (Breakfast) + 31 (Lunch) + 11 (Dinner) + 997 (Accommodation) = 1056\n\nDay 7: March 13, 2022\nCurrent City: from Durango to Wichita\nTransportation: Self-driving from Durango to Wichita, duration: 11 hours 15 mins, distance: 1,078 km, Cost: 53\nBreakfast: Hot Pot, Durango, Average Cost: 21\nAttraction: - , Cost: 0\nLunch: King Bikaneri, Durango, Average Cost: 87\nDinner: - , Cost: 0\nAccommodation: -, Cost: 0\n\nTotal cost: 53 (Transportation) + 21 (Breakfast) + 87 (Lunch) + 0 (Dinner) + 0 (Accommodation) = 161\n\nThe total cost of this trip is the sum of the cost from day 1 to day 7. It is 810 + 761 + 1236 + 1234 + 1227 + 1056 + 161 = 6485 which is over the required budget of $5,900.\n\n**Note: The provided accommodation options often have a minimum stay requirement that exceeds the duration of the trip in each city. Therefore, alternative accommodations with suitable minimum nights should be considered. Additionally, the cost of attractions has not been included as they were not provided. Adjustments to the plan, such as choosing different accommodations or reducing meal costs, would be necessary to stay within the budget.", "gpt-4-1106-preview_direct_sole-planning_parsed_results": [{"day": 1, "current_city": "from Wichita to Alamosa", "transportation": "Self-driving, from Wichita to Alamosa, Duration: 8 hours 27 mins, Distance: 819 km, Cost: 40", "breakfast": "-", "attraction": "-", "lunch": "-", "dinner": "-", "accommodation": "Comfortable studio suite in midtown Manhattan, Alamosa"}, {"day": 2, "current_city": "Alamosa", "transportation": "-", "breakfast": "Atlanta Highway Seafood Market, Alamosa", "attraction": "San Luis Valley Museum, Alamosa", "lunch": "Riverwalk Cafe, Alamosa", "dinner": "Viva Hyderabad, Alamosa", "accommodation": "Comfortable studio suite in midtown Manhattan, Alamosa"}, {"day": 3, "current_city": "from Alamosa to Grand Junction", "transportation": "Self-driving, from Alamosa to Grand Junction, Duration: 4 hours 29 mins, Distance: 396 km, Cost: 19", "breakfast": "-", "attraction": "Rio Grande Farm Park, Alamosa", "lunch": "-", "dinner": "Austin's BBQ and Oyster Bar, Grand Junction", "accommodation": "NYC Apartment near Central Park!, Grand Junction"}, {"day": 4, "current_city": "Grand Junction", "transportation": "-", "breakfast": "2 Dog, Grand Junction", "attraction": "Museum of the West, Museums of Western Colorado, Grand Junction", "lunch": "Thakur Bakers, Grand Junction", "dinner": "Shanghai Bar & Lounge - The Bristol Hotel, Grand Junction", "accommodation": "NYC Apartment near Central Park!, Grand Junction"}, {"day": 5, "current_city": "from Grand Junction to Durango", "transportation": "Self-driving, from Grand Junction to Durango, Duration: 3 hours 33 mins, Distance: 269 km, Cost: 13", "breakfast": "-", "attraction": "Eureka! McConnell Science Museum, Grand Junction", "lunch": "-", "dinner": "Samurai Japanese Cuisine & Sushi Bar, Durango", "accommodation": "Lux 1BR in the heart of NYC Theater district!, Durango"}, {"day": 6, "current_city": "Durango", "transportation": "-", "breakfast": "Dub's High on the Hog, Durango", "attraction": "Animas Museum, Durango", "lunch": "Standard Chicken Point, Durango", "dinner": "Hot & Tasty Chinese Food, Durango", "accommodation": "Lux 1BR in the heart of NYC Theater district!, Durango"}, {"day": 7, "current_city": "from Durango to Wichita", "transportation": "Self-driving, from Durango to Wichita, Duration: 11 hours 15 mins, Distance: 1,078 km, Cost: 53", "breakfast": "-", "attraction": "Durango Wildlife Museum, Durango", "lunch": "-", "dinner": "-", "accommodation": "-"}]}]