[{"gpt-4-1106-preview_direct_sole-planning_results": "Travel Plan:\n\nDay 1: March 24, 2022\nCurrent City: from Fort Lauderdale to Atlanta\nTransportation: Flight Number: F3510231, from Fort Lauderdale to Atlanta, Departure Time: 05:24, Arrival Time: 06:56, Cost $125 x 2 = $250\nBreakfast: Saffron, Atlanta, Cost $39 x 2 = $78\nAttraction: Georgia Aquarium, Atlanta, Cost $39.95 x 2 = $79.90\nLunch: Asian Bistro, Atlanta, Cost $27 x 2 = $54\nDinner: Chef Style, Atlanta, Cost $59 x 2 = $118\nAccommodation: Bright, Modern, Clean, Spacious, Brooklyn Home, Atlanta, Cost $1034 (minimum 3 nights stay)\n\nTotal cost for Day 1: $250 (Flight) + $78 (Breakfast) + $79.90 (Attraction) + $54 (Lunch) + $118 (Dinner) + $1034 (Accommodation) = $1613.90\n\nDay 2: March 25, 2022\nCurrent City: Atlanta\nTransportation: -, Cost $0\nBreakfast: Baba Au Rhum, Atlanta, Cost $27 x 2 = $54\nAttraction: World of Coca-Cola, Atlanta, Cost $18 x 2 = $36\nLunch: Pizza Central, Atlanta, Cost $75 x 2 = $150\nDinner: Daawat-e-Kashmir, Atlanta, Cost $19 x 2 = $38\nAccommodation: Bright, Modern, Clean, Spacious, Brooklyn Home, Atlanta, Cost $1034 (already accounted for on Day 1)\n\nTotal cost for Day 2: $54 (Breakfast) + $36 (Attraction) + $150 (Lunch) + $38 (Dinner) = $278\n\nDay 3: March 26, 2022\nCurrent City: from Atlanta to Decatur\nTransportation: Taxi, from Atlanta to Decatur, Cost $10 x 2 = $20\nBreakfast: Shri Ram Restaurant, Atlanta, Cost $55 x 2 = $110\nAttraction: DeKalb History Center Museum, Decatur, Cost $6 x 2 = $12\nLunch: Joey's Pizza, Decatur, Cost $69 x 2 = $138\nDinner: Carnatic Cafe, Decatur, Cost $66 x 2 = $132\nAccommodation: Cozy Private Room, Decatur, Cost $69 (minimum 2 nights stay)\n\nTotal cost for Day 3: $20 (Taxi) + $110 (Breakfast) + $12 (Attraction) + $138 (Lunch) + $132 (Dinner) + $69 (Accommodation) = $481\n\nDay 4: March 27, 2022\nCurrent City: Decatur\nTransportation: -, Cost $0\nBreakfast: Cafe Coffee Day, Decatur, Cost $46 x 2 = $92\nAttraction: Glenlake Park, Decatur, Cost $0 (Assuming no entry fee)\nLunch: Dawat-E-Chaman, Decatur, Cost $42 x 2 = $84\nDinner: Hwealthcafe, Decatur, Cost $44 x 2 = $88\nAccommodation: Cozy Private Room, Decatur, Cost $69 (already accounted for on Day 3)\n\nTotal cost for Day 4: $92 (Breakfast) + $0 (Attraction) + $84 (Lunch) + $88 (Dinner) = $264\n\nDay 5: March 28, 2022\nCurrent City: from Decatur to Augusta\nTransportation: Self-driving, from Decatur to Augusta, Cost $11 x 2 = $22\nBreakfast: Subway, Decatur, Cost $40 x 2 = $80\nAttraction: Augusta Riverwalk, Augusta, Cost $0 (Assuming no entry fee)\nLunch: B Merrell's, Augusta, Cost $74 x 2 = $148\nDinner: The Charcoal Chimney, Augusta, Cost $86 x 2 = $172\nAccommodation: Planta Baja Studio, Augusta, Cost $637 (minimum 1 night stay)\n\nTotal cost for Day 5: $22 (Transportation) + $80 (Breakfast) + $148 (Lunch) + $172 (Dinner) + $637 (Accommodation) = $1059\n\nDay 6: March 29, 2022\nCurrent City: Augusta\nTransportation: -, Cost $0\nBreakfast: Fish Tales Lakeside Grille, Augusta, Cost $37 x 2 = $74\nAttraction: Morris Museum of Art, Augusta, Cost $5 x 2 = $10\nLunch: Nikhil Food Point, Augusta, Cost $87 x 2 = $174\nDinner: Karari Kurry, Augusta, Cost $29 x 2 = $58\nAccommodation: Planta Baja Studio, Augusta, Cost $637 (already accounted for on Day 5)\n\nTotal cost for Day 6: $74 (Breakfast) + $10 (Attraction) + $174 (Lunch) + $58 (Dinner) = $316\n\nDay 7: March 30, 2022\nCurrent City: from Augusta to Fort Lauderdale\nTransportation: Self-driving, from Augusta to Fort Lauderdale, Cost $46 x 2 = $92\nBreakfast: Haldiram's, Augusta, Cost $41 x 2 = $82\nAttraction: Phinizy Swamp Nature Park, Augusta, Cost $0 (Assuming no entry fee)\nLunch: The Flying Saucer Cafe, Augusta, Cost $19 x 2 = $38\nDinner: - (Assuming they will have dinner back in Fort Lauderdale), Cost $0\nAccommodation: - (Returning to Fort Lauderdale), Cost $0\n\nTotal cost for Day 7: $92 (Transportation) + $82 (Breakfast) + $38 (Lunch) = $212\n\nThe total cost of this trip is the sum of the costs from Day 1 to Day 7. It is $1613.90 + $278 + $481 + $264 + $1059 + $316 + $212 = $4223.90 which is less than the required budget of $8000.", "gpt-4-1106-preview_direct_sole-planning_parsed_results": [{"day": 1, "current_city": "from Fort Lauderdale to Atlanta", "transportation": "Flight Number: F3491270, from Fort Lauderdale to Atlanta, Departure Time: 06:30, Arrival Time: 08:09", "breakfast": "-", "attraction": "Georgia Aquarium, Atlanta;", "lunch": "Asian Bistro, Atlanta", "dinner": "Chef Style, Atlanta", "accommodation": "Bright, Modern, Clean, Spacious, Brooklyn Home, Atlanta"}, {"day": 2, "current_city": "Atlanta", "transportation": "-", "breakfast": "Saffron, Atlanta", "attraction": "World of Coca-Cola, Atlanta; High Museum of Art, Atlanta;", "lunch": "Daawat-e-Kashmir, Atlanta", "dinner": "Pizza Central, Atlanta", "accommodation": "Bright, Modern, Clean, Spacious, Brooklyn Home, Atlanta"}, {"day": 3, "current_city": "from Atlanta to Decatur", "transportation": "Taxi, from Atlanta to Decatur, Duration: 18 mins, Cost: 10", "breakfast": "Adda, Atlanta", "attraction": "DeKalb History Center Museum, Decatur; Glenlake Park, Decatur;", "lunch": "Joey's Pizza, Decatur", "dinner": "Carnatic Cafe, Decatur", "accommodation": "Cozy Private Room, Decatur"}, {"day": 4, "current_city": "Decatur", "transportation": "-", "breakfast": "Madhuban Restaurant - Welcome Hotel Rama International, Decatur", "attraction": "Clyde Shepherd Nature Preserve, Decatur; Waffle House Museum, Decatur;", "lunch": "Dawat-E-Chaman, Decatur", "dinner": "Hwealthcafe, Decatur", "accommodation": "Cozy Private Room, Decatur"}, {"day": 5, "current_city": "from Decatur to Augusta", "transportation": "Self-driving, from Decatur to Augusta, Duration: 2 hours 17 mins, Cost: 11", "breakfast": "-", "attraction": "Augusta Riverwalk, Augusta; Morris Museum of Art, Augusta;", "lunch": "B Merrell's, Augusta", "dinner": "The Charcoal Chimney, Augusta", "accommodation": "Planta Baja Studio, Augusta"}, {"day": 6, "current_city": "Augusta", "transportation": "-", "breakfast": "Fish Tales Lakeside Grille, Augusta", "attraction": "Phinizy Swamp Nature Park, Augusta; Augusta Canal National Heritage Area, Augusta;", "lunch": "Nikhil Food Point, Augusta", "dinner": "Karari Kurry, Augusta", "accommodation": "Planta Baja Studio, Augusta"}, {"day": 7, "current_city": "from Augusta to Fort Lauderdale", "transportation": "Self-driving, from Augusta to Fort Lauderdale, Duration: 8 hours 41 mins, Cost: 46", "breakfast": "-", "attraction": "-", "lunch": "-", "dinner": "-", "accommodation": "-"}]}]