[{"gpt-4-1106-preview_direct_sole-planning_results": "Travel Plan:\n\nDay 1:\nCurrent City: from Appleton to Charlotte\nTransportation: Flight Number: F3796721, from Appleton to Charlotte, Departure Time: 06:58, Arrival Time: 10:25, Cost: $314 per person\nBreakfast: - (Assuming breakfast on the plane or before departure), Cost: $0\nAttraction: Levine Museum of the New South, Charlotte, Cost: $0 (assuming free admission or covered by a city pass)\nLunch: Olive Tree Cafe, Charlotte, Cost: $23 per person\nDinner: Kylin Skybar, Charlotte, Cost: $44 per person\nAccommodation: Elegant Studio Apt in Prospect Heights, Charlotte, Cost: $640 per night (allows up to 5 people, visitors allowed)\n\nTotal cost for Day 1: \nTransportation: $314 * 7 = $2198\nLunch: $23 * 7 = $161\nDinner: $44 * 7 = $308\nAccommodation: $640 (for 5 people, need an additional room for 2 more people)\nAdditional Accommodation: Cute Greenpoint room, Cost: $335 per night (allows visitors)\nTotal Accommodation: $640 + $335 = $975\n\nTotal cost for Day 1: $2198 + $161 + $308 + $975 = $3642\n\nDay 2:\nCurrent City: Charlotte\nTransportation: -, Cost: $0\nBreakfast: Central Perk 7, Charlotte, Cost: $87 per person\nAttraction: Discovery Place Science, Charlotte, Cost: $0 (assuming free admission or covered by a city pass)\nLunch: China Garden, Charlotte, Cost: $14 per person\nDinner: Pind Balluchi, Charlotte, Cost: $42 per person\nAccommodation: Elegant Studio Apt in Prospect Heights, Charlotte, Cost: $640 per night\n\nTotal cost for Day 2: \nBreakfast: $87 * 7 = $609\nLunch: $14 * 7 = $98\nDinner: $42 * 7 = $294\nAccommodation: $640 (for 5 people, same additional room needed)\nAdditional Accommodation: Cute Greenpoint room, Cost: $335 per night\nTotal Accommodation: $640 + $335 = $975\n\nTotal cost for Day 2: $609 + $98 + $294 + $975 = $1976\n\nDay 3:\nCurrent City: from Charlotte to Appleton\nTransportation: Flight Number: F3788979, from Charlotte to Appleton, Departure Time: 22:52, Arrival Time: 00:07, Cost: $212 per person\nBreakfast: Nagaland's Kitchen, Charlotte, Cost: $73 per person\nAttraction: The Mint Museum, Charlotte, Cost: $0 (assuming free admission or covered by a city pass)\nLunch: Subway, Charlotte, Cost: $60 per person\nDinner: - (Assuming dinner on the plane or after arrival), Cost: $0\nAccommodation: - (Returning home), Cost: $0\n\nTotal cost for Day 3: \nTransportation: $212 * 7 = $1484\nBreakfast: $73 * 7 = $511\nLunch: $60 * 7 = $420\n\nTotal cost for Day 3: $1484 + $511 + $420 = $2415\n\nThe total cost of this trip is the sum of the cost from day 1, day 2, and day 3. It is $3642 + $1976 + $2415 = $8033 which is less than the required budget of $9500.", "gpt-4-1106-preview_direct_sole-planning_parsed_results": [{"day": 1, "current_city": "from Appleton to Charlotte", "transportation": "Flight Number: F3796721, from Appleton to Charlotte, Departure Time: 06:58, Arrival Time: 10:25", "breakfast": "-", "attraction": "Levine Museum of the New South, Charlotte;", "lunch": "Olive Tree Cafe, Charlotte", "dinner": "Nagaland's Kitchen, Charlotte", "accommodation": "Elegant Studio Apt in Prospect Heights, Charlotte"}, {"day": 2, "current_city": "Charlotte", "transportation": "-", "breakfast": "Central Perk 7, Charlotte", "attraction": "Discovery Place Science, Charlotte;The Mint Museum, Charlotte;", "lunch": "Cafe Maple Street, Charlotte", "dinner": "Kylin Skybar, Charlotte", "accommodation": "Elegant Studio Apt in Prospect Heights, Charlotte"}, {"day": 3, "current_city": "from Charlotte to Appleton", "transportation": "Flight Number: F3788979, from Charlotte to Appleton, Departure Time: 22:52, Arrival Time: 00:07", "breakfast": "Subway, Charlotte", "attraction": "NASCAR Hall of Fame, Charlotte;", "lunch": "Pind Balluchi, Charlotte", "dinner": "-", "accommodation": "-"}]}]