[{"gpt-4-1106-preview_direct_sole-planning_results": "Travel Plan:\n\nDay 1: March 19th, 2022\nCurrent City: from Houston to Wichita\nTransportation: Flight Number: F3811146, from Houston to Wichita, Departure Time: 14:17, Arrival Time: 16:13, Cost: $168 x 3 = $504\nBreakfast: - (Assuming breakfast is not required as the flight is post-lunch)\nAttraction: Exploration Place, Wichita, Cost: $0 (Assuming free entry or covered by a pass)\nLunch: - (Assuming lunch is not required due to the flight time)\nDinner: Jahanpanah, Wichita, Average Cost: $18 x 3 = $54\nAccommodation: Secret Garden Apartment in Bed Stuy, Brooklyn, Wichita, Cost: $214 x 2 nights (minimum stay) = $428\n\nTotal cost for Day 1: $504 (Transportation) + $54 (Dinner) + $428 (Accommodation) = $986\n\nDay 2: March 20th, 2022\nCurrent City: Wichita\nTransportation: -, Cost: $0\nBreakfast: Rumi's Kitchen, Wichita, Average Cost: $34 x 3 = $102\nAttraction: The Keeper of the Plains, Wichita, Cost: $0 (Assuming free entry or covered by a pass)\nLunch: The Flying Saucer Cafe, Wichita, Average Cost: $41 x 3 = $123\nDinner: Koramangala Social, Wichita, Average Cost: $38 x 3 = $114\nAccommodation: Already covered under Day 1.\n\nTotal cost for Day 2: $102 (Breakfast) + $123 (Lunch) + $114 (Dinner) = $339\n\nDay 3: March 21st, 2022\nCurrent City: from Wichita to Houston\nTransportation: Flight Number: F3827300, from Wichita to Houston, Departure Time: 12:10, Arrival Time: 14:38, Cost: $152 x 3 = $456\nBreakfast: Cafe Cornucopia, Wichita, Average Cost: $76 x 3 = $228\nAttraction: Sedgwick County Zoo, Wichita, Cost: $0 (Assuming free entry or covered by a pass)\nLunch: - (Assuming lunch is not required due to the flight time)\nDinner: - (Assuming dinner is not required as they have arrived back home)\nAccommodation: -\n\nTotal cost for Day 3: $228 (Breakfast) + $456 (Transportation) = $684\n\nThe total cost of this trip is the sum of the costs from Day 1, Day 2, and Day 3. It is $986 + $339 + $684 = $2009, which is less than the required budget of $2700.\n\nPlease note that attraction costs are assumed to be free or covered by a pass, as no specific pricing information was provided. Smoking requirements have been considered in the accommodation choice, as the Secret Garden Apartment allows smoking. If any of the attractions have an entry fee, this will need to be adjusted within the budget.", "gpt-4-1106-preview_direct_sole-planning_parsed_results": [{"day": 1, "current_city": "from Houston to Wichita", "transportation": "Flight Number: F3923935, from Houston to Wichita, Departure Time: 09:32, Arrival Time: 11:24", "breakfast": "-", "attraction": "Exploration Place, Wichita", "lunch": "Jahanpanah, Wichita", "dinner": "The B.A.W.A, Wichita", "accommodation": "Secret Garden Apartment in Bed Stuy, Wichita"}, {"day": 2, "current_city": "Wichita", "transportation": "-", "breakfast": "Cafe Cornucopia, Wichita", "attraction": "Old Cowtown Museum, Wichita;The Keeper of the Plains, Wichita", "lunch": "Koramangala Social, Wichita", "dinner": "Rumi's Kitchen, Wichita", "accommodation": "Secret Garden Apartment in Bed Stuy, Wichita"}, {"day": 3, "current_city": "from Wichita to Houston", "transportation": "Flight Number: F3827300, from Wichita to Houston, Departure Time: 12:10, Arrival Time: 14:38", "breakfast": "-", "attraction": "-", "lunch": "-", "dinner": "-", "accommodation": "-"}]}]