[{"gpt-4-1106-preview_direct_sole-planning_results": "Travel Plan:\n\nDay 1: March 21, 2022\nCurrent City: from Houston to Nashville\nTransportation: Flight Number: F3827724, from Houston to Nashville, Departure Time: 18:35, Arrival Time: 20:33, Cost: $147 x 2 = $294\nDinner: Bangkok 1, Nashville, Average Cost: $44 x 2 = $88\nAccommodation: Huge 2 Bedroom, Great Location, Express Metro, Nashville, Cost: $745 (meets the smoking requirement and is a private room)\n\nTotal cost for Day 1: $294 (Transportation) + $88 (Dinner) + $745 (Accommodation) = $1127\n\nDay 2: March 22, 2022\nCurrent City: Nashville\nBreakfast: Bablu Fast Food, Nashville, Average Cost: $13 x 2 = $26\nAttraction: Country Music Hall of Fame and Museum, Nashville, Cost: Free (assuming no entry fee is listed)\nLunch: Full Dabba, Nashville, Average Cost: $77 x 2 = $154\nAttraction: Nashville Zoo at Grassmere, Nashville, Cost: Free (assuming no entry fee is listed)\nDinner: Twigly, Nashville, Average Cost: $14 x 2 = $28\nAccommodation: Huge 2 Bedroom, Great Location, Express Metro, Nashville, Cost: $745\n\nTotal cost for Day 2: $26 (Breakfast) + $154 (Lunch) + $28 (Dinner) + $745 (Accommodation) = $953\n\nDay 3: March 23, 2022\nCurrent City: from Nashville to Knoxville\nTransportation: Taxi from Nashville to Knoxville, Cost: $290 x 2 = $580\nBreakfast: Veg Hut, Nashville, Average Cost: $35 x 2 = $70\nLunch: The Toddy Shop, Knoxville, Average Cost: $92 x 2 = $184\nAttraction: World's Fair Park, Knoxville, Cost: Free (assuming no entry fee is listed)\nDinner: Les 3 Brasseurs, Knoxville, Average Cost: $24 x 2 = $48\nAccommodation: Cozy Private Room in Chinatown/ Lower East Side, Knoxville, Cost: $132 (meets the smoking requirement and is a private room)\n\nTotal cost for Day 3: $580 (Transportation) + $70 (Breakfast) + $184 (Lunch) + $48 (Dinner) + $132 (Accommodation) = $1014\n\nDay 4: March 24, 2022\nCurrent City: Knoxville\nBreakfast: Cafe Arabelle, Knoxville, Average Cost: $29 x 2 = $58\nAttraction: Knoxville Museum of Art, Knoxville, Cost: Free (assuming no entry fee is listed)\nLunch: Sky On 57, Knoxville, Average Cost: $150 x 2 = $300\nAttraction: Sunsphere, Knoxville, Cost: Free (assuming no entry fee is listed)\nDinner: Cafe El Chico, Knoxville, Average Cost: $67 x 2 = $134\nAccommodation: Cozy Private Room in Chinatown/ Lower East Side, Knoxville, Cost: $132\n\nTotal cost for Day 4: $58 (Breakfast) + $300 (Lunch) + $134 (Dinner) + $132 (Accommodation) = $624\n\nDay 5: March 25, 2022\nCurrent City: from Knoxville to Chattanooga\nTransportation: Taxi from Knoxville to Chattanooga, Cost: $180 x 2 = $360\nBreakfast: TcozY, Knoxville, Average Cost: $85 x 2 = $170\nLunch: Rama Vaishnav Bhojnalaya, Chattanooga, Average Cost: $46 x 2 = $92\nAttraction: The Chattanooga Zoo at Warner Park, Chattanooga, Cost: Free (assuming no entry fee is listed)\nDinner: L'amandier, Chattanooga, Average Cost: $28 x 2 = $56\nAccommodation: Affordable Private Spacious Room in Brooklyn, Chattanooga, Cost: $790 (meets the smoking requirement and is a private room)\n\nTotal cost for Day 5: $360 (Transportation) + $170 (Breakfast) + $92 (Lunch) + $56 (Dinner) + $790 (Accommodation) = $1468\n\nDay 6: March 26, 2022\nCurrent City: Chattanooga\nBreakfast: Anupam Sweet, Chattanooga, Average Cost: $82 x 2 = $164\nAttraction: Rock City Gardens, Chattanooga, Cost: Free (assuming no entry fee is listed)\nLunch: Nirula's, Chattanooga, Average Cost: $64 x 2 = $128\nAttraction: Tennessee Aquarium, Chattanooga, Cost: Free (assuming no entry fee is listed)\nDinner: Anupam Sweets & Restaurant, Chattanooga, Average Cost: $62 x 2 = $124\nAccommodation: Affordable Private Spacious Room in Brooklyn, Chattanooga, Cost: $790\n\nTotal cost for Day 6: $164 (Breakfast) + $128 (Lunch) + $124 (Dinner) + $790 (Accommodation) = $1206\n\nDay 7: March 27, 2022\nCurrent City: from Chattanooga to Houston\nTransportation: Taxi from Chattanooga to Houston, Cost: $1309 x 2 = $2618\nBreakfast: Bisque Bakery, Chattanooga, Average Cost: $90 x 2 = $180\nLunch: Nooba, Chattanooga, Average Cost: $93 x 2 = $186\n\nTotal cost for Day 7: $2618 (Transportation) + $180 (Breakfast) + $186 (Lunch) = $2984\n\nThe total cost of this trip is the sum of the costs from Day 1 to Day 7. It is $1127 + $953 + $1014 + $624 + $1468 + $1206 + $2984 = $9376\n\nUnfortunately, the total cost of $9376 exceeds the budget of $8200. To adjust the plan within the budget, we may need to consider cheaper accommodation options, less expensive meals, or alternative transportation methods.", "gpt-4-1106-preview_direct_sole-planning_parsed_results": [{"day": 1, "current_city": "from Houston to Nashville", "transportation": "Flight Number: F3827247, from Houston to Nashville, Departure Time: 14:22, Arrival Time: 16:10", "breakfast": "-", "attraction": "-", "lunch": "-", "dinner": "Bangkok 1, Nashville", "accommodation": "Brooklyn Heights gem, Nashville"}, {"day": 2, "current_city": "Nashville", "transportation": "-", "breakfast": "Bablu Fast Food, Nashville", "attraction": "Country Music Hall of Fame and Museum, Nashville;Nashville Zoo at Grassmere, Nashville;", "lunch": "Full Dabba, Nashville", "dinner": "Twigly, Nashville", "accommodation": "Brooklyn Heights gem, Nashville"}, {"day": 3, "current_city": "from Nashville to Knoxville", "transportation": "Taxi from Nashville to Knoxville, duration: 2 hours 42 mins", "breakfast": "Veg Hut, Nashville", "attraction": "Belle Meade Historic Site & Winery, Nashville", "lunch": "The Toddy Shop, Nashville", "dinner": "Cafe Arabelle, Knoxville", "accommodation": "Cozy Private Room in Chinatown/ Lower East Side, Knoxville"}, {"day": 4, "current_city": "Knoxville", "transportation": "-", "breakfast": "Les 3 Brasseurs, Knoxville", "attraction": "World's Fair Park, Knoxville;Knoxville Museum of Art, Knoxville;", "lunch": "Sky On 57, Knoxville", "dinner": "Cafe El Chico, Knoxville", "accommodation": "Cozy Private Room in Chinatown/ Lower East Side, Knoxville"}, {"day": 5, "current_city": "from Knoxville to Chattanooga", "transportation": "Taxi from Knoxville to Chattanooga, duration: 1 hour 41 mins", "breakfast": "TcozY, Knoxville", "attraction": "Sunsphere, Knoxville", "lunch": "Rama Vaishnav Bhojnalaya, Knoxville", "dinner": "P.F. Chang's, Chattanooga", "accommodation": "Sunny One Bedroom, Chattanooga"}, {"day": 6, "current_city": "Chattanooga", "transportation": "-", "breakfast": "L'amandier, Chattanooga", "attraction": "The Chattanooga Zoo at Warner Park, Chattanooga;Rock City Gardens, Chattanooga;", "lunch": "Anupam Sweet, Chattanooga", "dinner": "Nirula's, Chattanooga", "accommodation": "Sunny One Bedroom, Chattanooga"}, {"day": 7, "current_city": "from Chattanooga to Houston", "transportation": "Taxi from Chattanooga to Houston, duration: 11 hours 47 mins", "breakfast": "Anupam Sweets & Restaurant, Chattanooga", "attraction": "Tennessee Aquarium, Chattanooga", "lunch": "Bisque Bakery, Chattanooga", "dinner": "-", "accommodation": "-"}]}]