[{"gpt-4-1106-preview_direct_sole-planning_results": "Travel Plan:\n\nDay 1: March 16, 2022\nCurrent City: from Salt Lake City to Billings\nTransportation: Flight Number: F3829434, from Salt Lake City to Billings, Departure Time: 09:43, Arrival Time: 10:59, Cost: $92 x 2 = $184\nLunch: Holy Smoke, Billings, Average Cost: $38 x 2 = $76\nAttraction: Yellowstone Art Museum, Billings, Cost: Unknown (assuming $20 per person) = $40\nDinner: L'Angoor, Billings, Average Cost: $19 x 2 = $38\nAccommodation: Great Room! Great Price! Can wait to see you!, Billings, Cost: $1152 (2 nights minimum, allows parties)\n\nTotal cost for Day 1: $184 + $76 + $40 + $38 + $1152 = $1490\n\nDay 2: March 17, 2022\nCurrent City: Billings\nTransportation: -, Cost: $0\nBreakfast: Govardhan, Billings, Average Cost: $59 x 2 = $118\nAttraction: ZooMontana, Billings, Cost: Unknown (assuming $20 per person) = $40\nLunch: Tsui Wong, Billings, Average Cost: $40 x 2 = $80\nDinner: Elation, Billings, Average Cost: $87 x 2 = $174\nAccommodation: Great Room! Great Price! Can wait to see you!, Billings, Cost: Included in Day 1\n\nTotal cost for Day 2: $118 + $40 + $80 + $174 = $412\n\nDay 3: March 18, 2022\nCurrent City: from Billings to Great Falls\nTransportation: Taxi from Billings to Great Falls, Cost: $352 x 2 = $704\nBreakfast: Hong Kong Express, Billings, Average Cost: $43 x 2 = $86\nAttraction: -, Cost: $0 (Travel day)\nLunch: -, Cost: $0 (Travel day)\nDinner: Hula Grill, Great Falls, Average Cost: $76 x 2 = $152\nAccommodation: Comfy & Sunny Studio Rental, Great Falls, Cost: $413 (2 nights minimum, allows parties)\n\nTotal cost for Day 3: $704 + $86 + $152 + $413 = $1355\n\nDay 4: March 19, 2022\nCurrent City: Great Falls\nTransportation: -, Cost: $0\nBreakfast: SpiceKlub, Great Falls, Average Cost: $76 x 2 = $152\nAttraction: The Lewis and Clark Interpretive Center, Great Falls, Cost: Unknown (assuming $15 per person) = $30\nLunch: Barbeque Nation, Great Falls, Average Cost: $46 x 2 = $92\nDinner: Fork with Stick, Great Falls, Average Cost: $98 x 2 = $196\nAccommodation: Comfy & Sunny Studio Rental, Great Falls, Cost: Included in Day 3\n\nTotal cost for Day 4: $152 + $30 + $92 + $196 = $470\n\nDay 5: March 20, 2022\nCurrent City: from Great Falls to Bozeman\nTransportation: Taxi from Great Falls to Bozeman, Cost: $299 x 2 = $598\nBreakfast: Silver, Great Falls, Average Cost: $83 x 2 = $166\nAttraction: -, Cost: $0 (Travel day)\nLunch: -, Cost: $0 (Travel day)\nDinner: Zaroob, Bozeman, Average Cost: $67 x 2 = $134\nAccommodation: SPACIOUS STUDIO APT 3 IN PROSPECT LEFFERTS GARDENS, Bozeman, Cost: $1060 (5 nights minimum, allows parties)\n\nTotal cost for Day 5: $598 + $166 + $134 + $1060 = $1958\n\nDay 6: March 21, 2022\nCurrent City: Bozeman\nTransportation: -, Cost: $0\nBreakfast: Saravana Bhavan, Bozeman, Average Cost: $38 x 2 = $76\nAttraction: Museum of the Rockies, Bozeman, Cost: Unknown (assuming $20 per person) = $40\nLunch: Indo Chinese, Bozeman, Average Cost: $66 x 2 = $132\nDinner: McGuire's Irish Pub & Brewery, Bozeman, Average Cost: $72 x 2 = $144\nAccommodation: SPACIOUS STUDIO APT 3 IN PROSPECT LEFFERTS GARDENS, Bozeman, Cost: Included in Day 5\n\nTotal cost for Day 6: $76 + $40 + $132 + $144 = $392\n\nDay 7: March 22, 2022\nCurrent City: from Bozeman to Salt Lake City\nTransportation: Flight Number: F3513324, from Bozeman to Salt Lake City, Departure Time: 13:08, Arrival Time: 14:24, Cost: $121 x 2 = $242\nBreakfast: Oh Buoy, Bozeman, Average Cost: $79 x 2 = $158\nAttraction: -, Cost: $0 (Travel day)\nLunch: -, Cost: $0 (Travel day)\nDinner: -, Cost: $0 (Travel day)\nAccommodation: -, Cost: $0 (Travel day)\n\nTotal cost for Day 7: $242 + $158 = $400\n\nThe total cost of this trip is the sum of the costs from day 1 to day 7. It is $1490 + $412 + $1355 + $470 + $1958 + $392 + $400 = $6477, which is less than the required budget of $7200.\n\nPlease note that some attraction costs are assumed as they were not provided. Adjustments may be necessary if actual prices are different. Additionally, the accommodation choices were selected based on the requirement for places where parties are permitted, and the preference to not self-drive.", "gpt-4-1106-preview_direct_sole-planning_parsed_results": [{"day": 1, "current_city": "from Salt Lake City to Billings", "transportation": "Flight Number: F3829434, from Salt Lake City to Billings, Departure Time: 09:43, Arrival Time: 10:59", "breakfast": "-", "attraction": "Western Heritage Center, Billings;", "lunch": "Holy Smoke, Billings", "dinner": "Hong Kong Express, Billings", "accommodation": "Great Room! Great Price!, Billings"}, {"day": 2, "current_city": "Billings", "transportation": "-", "breakfast": "L'Angoor, Billings", "attraction": "Yellowstone Art Museum, Billings;", "lunch": "Govardhan, Billings", "dinner": "Tsui Wong, Billings", "accommodation": "Great Room! Great Price!, Billings"}, {"day": 3, "current_city": "from Billings to Great Falls", "transportation": "Taxi, from Billings to Great Falls, Duration: 3 hours 35 mins, Cost: 352", "breakfast": "-", "attraction": "C. M. Russell Museum, Great Falls;", "lunch": "Hula Grill, Great Falls", "dinner": "SpiceKlub, Great Falls", "accommodation": "Comfy & Sunny Studio Rental, Great Falls"}, {"day": 4, "current_city": "Great Falls", "transportation": "-", "breakfast": "Flying Pie Pizzaria, Great Falls", "attraction": "The Lewis and Clark Interpretive Center, Great Falls;", "lunch": "Barbeque Nation, Great Falls", "dinner": "Fork with Stick, Great Falls", "accommodation": "Comfy & Sunny Studio Rental, Great Falls"}, {"day": 5, "current_city": "from Great Falls to Bozeman", "transportation": "Taxi, from Great Falls to Bozeman, Duration: 2 hours 55 mins, Cost: 299", "breakfast": "-", "attraction": "Museum of the Rockies, Bozeman;", "lunch": "McGuire's Irish Pub & Brewery, Bozeman", "dinner": "Indo Chinese, Bozeman", "accommodation": "SPACIOUS STUDIO APT 3 IN PROSPECT LEFFERTS GARDENS, Bozeman"}, {"day": 6, "current_city": "Bozeman", "transportation": "-", "breakfast": "Jiquitaia, Bozeman", "attraction": "Gallatin History Museum, Bozeman;", "lunch": "Saravana Bhavan, Bozeman", "dinner": "Zaroob, Bozeman", "accommodation": "SPACIOUS STUDIO APT 3 IN PROSPECT LEFFERTS GARDENS, Bozeman"}, {"day": 7, "current_city": "from Bozeman to Salt Lake City", "transportation": "Flight Number: F3513324, from Bozeman to Salt Lake City, Departure Time: 13:08, Arrival Time: 14:24", "breakfast": "-", "attraction": "-", "lunch": "-", "dinner": "-", "accommodation": "-"}]}]