[{"gpt-4-1106-preview_direct_sole-planning_results": "Travel Plan:\n\nDay 1: March 21, 2022\nCurrent City: from Billings to Flagstaff\nTransportation: Self-driving from Billings to Flagstaff, duration: 16 hours 29 mins, distance: 1,719 km, cost: $85\nBreakfast: - (Assuming breakfast is had before departure)\nAttraction: - (Traveling for the day)\nLunch: - (On the road)\nDinner: - (On the road)\nAccommodation: Large Bedroom in 2 Bed Apartment Brighton Beach, Flagstaff, price: $959, room type: Private room, house_rules: No children under 10, minimum nights: 1, maximum occupancy: 2, review rate number: 3.0\n\nTotal cost for Day 1: $85 (transportation) + $959 (accommodation) = $1,044\n\nDay 2: March 22, 2022\nCurrent City: Flagstaff\nTransportation: -, Cost: $0\nBreakfast: Sushi Thai Restaurant, Flagstaff, Average Cost: $49\nAttraction: Riordan Mansion State Historic Park, Flagstaff, Cost: $0 (assuming no entrance fee)\nLunch: Rhubarb Le Restaurant, Flagstaff, Average Cost: $157\nDinner: Communiti, Flagstaff, Average Cost: $16\nAccommodation: Large Bedroom in 2 Bed Apartment Brighton Beach, Flagstaff, price: $959\n\nTotal cost for Day 2: $49 (breakfast) + $157 (lunch) + $16 (dinner) + $959 (accommodation) = $1,181\n\nDay 3: March 23, 2022\nCurrent City: from Flagstaff to Yuma\nTransportation: Self-driving from Flagstaff to Yuma, duration: 4 hours 46 mins, distance: 504 km, cost: $25\nBreakfast: Bamboo Boat, Flagstaff, Average Cost: $77\nAttraction: Lowell Observatory, Flagstaff, Cost: $0 (assuming no entrance fee)\nLunch: - (On the road)\nDinner: Granite City Food & Brewery, Yuma, Average Cost: $63\nAccommodation: carriage house apartment, Yuma, price: $468, room type: Entire home/apt, house_rules: No visitors & No parties, minimum nights: 1, maximum occupancy: 4, review rate number: 5.0\n\nTotal cost for Day 3: $25 (transportation) + $77 (breakfast) + $63 (dinner) + $468 (accommodation) = $633\n\nDay 4: March 24, 2022\nCurrent City: Yuma\nTransportation: -, Cost: $0\nBreakfast: Hollerbach's Willow Tree Caf\u00e9, Yuma, Average Cost: $73\nAttraction: Colorado River State Historic Park, Yuma, Cost: $0 (assuming no entrance fee)\nLunch: Farzi Cafe, Yuma, Average Cost: $32\nDinner: Writer's Cafe, Yuma, Average Cost: $14\nAccommodation: carriage house apartment, Yuma, price: $468\n\nTotal cost for Day 4: $73 (breakfast) + $32 (lunch) + $14 (dinner) + $468 (accommodation) = $587\n\nDay 5: March 25, 2022\nCurrent City: from Yuma to Phoenix\nTransportation: Flight Number: F4044241, from Yuma to Phoenix, Price: $61, DepTime: 08:53, ArrTime: 09:44\nBreakfast: - (Assuming breakfast is had before departure)\nAttraction: Yuma Territorial Prison State Historic Park, Yuma, Cost: $0 (assuming no entrance fee)\nLunch: Black Pepper Restaurant, Yuma, Average Cost: $92\nDinner: Pizza Hut, Phoenix, Average Cost: $30\nAccommodation: Lower East Side Oasis (private room), Phoenix, price: $487, room type: Private room, house_rules: No children under 10 & No visitors, minimum nights: 2, maximum occupancy: 2, review rate number: 2.0\n\nTotal cost for Day 5: $61 (transportation) + $92 (lunch) + $30 (dinner) + $487 (accommodation) = $670\n\nDay 6: March 26, 2022\nCurrent City: Phoenix\nTransportation: -, Cost: $0\nBreakfast: Doughlicious, Phoenix, Average Cost: $41\nAttraction: Phoenix Zoo, Phoenix, Cost: $0 (assuming no entrance fee)\nLunch: Mama Loca, Phoenix, Average Cost: $27\nDinner: Mocambo, Phoenix, Average Cost: $76\nAccommodation: Lower East Side Oasis (private room), Phoenix, price: $487\n\nTotal cost for Day 6: $41 (breakfast) + $27 (lunch) + $76 (dinner) + $487 (accommodation) = $631\n\nDay 7: March 27, 2022\nCurrent City: from Phoenix to Billings\nTransportation: Flight Number: F3581060, from Phoenix to Billings, Price: $307, DepTime: 16:16, ArrTime: 19:31\nBreakfast: Village Restaurant, Phoenix, Average Cost: $35\nAttraction: Heard Museum, Phoenix, Cost: $0 (assuming no entrance fee)\nLunch: Jungle The Restaurant, Phoenix, Average Cost: $27\nDinner: - (Assuming dinner is had after arrival in Billings)\nAccommodation: - (Returning home)\n\nTotal cost for Day 7: $307 (transportation) + $35 (breakfast) + $27 (lunch) = $369\n\nThe total cost of this trip is the sum of the costs from day 1 to day 7. It is $1,044 + $1,181 + $633 + $587 + $670 + $631 + $369 = $5,215 which is less than the required budget of $11,700.\n\nPlease note that attraction costs are assumed to be free, which may not be the case, and should be verified. Additionally, meals on the road and any other incidental expenses have not been included and should be considered within the budget. The accommodations selected allow visitors unless otherwise stated in the house rules.", "gpt-4-1106-preview_direct_sole-planning_parsed_results": [{"day": 1, "current_city": "from Billings to Flagstaff", "transportation": "Self-driving, from Billings to Flagstaff, duration: 16 hours 29 mins, distance: 1719 km, Cost: 85", "breakfast": "-", "attraction": "-", "lunch": "-", "dinner": "-", "accommodation": "Large Bedroom in 2 Bed Apartment Brighton Beach, Flagstaff"}, {"day": 2, "current_city": "Flagstaff", "transportation": "-", "breakfast": "Sushi Thai Restaurant, Flagstaff", "attraction": "Riordan Mansion State Historic Park, Flagstaff;", "lunch": "Rhubarb Le Restaurant, Flagstaff", "dinner": "Communiti, Flagstaff", "accommodation": "Large Bedroom in 2 Bed Apartment Brighton Beach, Flagstaff"}, {"day": 3, "current_city": "from Flagstaff to Yuma", "transportation": "Self-driving, from Flagstaff to Yuma, duration: 4 hours 46 mins, distance: 504 km, Cost: 25", "breakfast": "Bamboo Boat, Flagstaff", "attraction": "Lowell Observatory, Flagstaff;", "lunch": "Bar Code - Leisure Inn, Flagstaff", "dinner": "-", "accommodation": "carriage house apartment, Yuma"}, {"day": 4, "current_city": "Yuma", "transportation": "-", "breakfast": "Granite City Food & Brewery, Yuma", "attraction": "Colorado River State Historic Park, Yuma;", "lunch": "Hollerbach's Willow Tree Caf\u00e9, Yuma", "dinner": "Farzi Cafe, Yuma", "accommodation": "carriage house apartment, Yuma"}, {"day": 5, "current_city": "from Yuma to Phoenix", "transportation": "Flight Number: F4044241, from Yuma to Phoenix, Departure Time: 08:53, Arrival Time: 09:44, Cost: 61", "breakfast": "-", "attraction": "Yuma Territorial Prison State Historic Park, Yuma;", "lunch": "Black Pepper Restaurant, Yuma", "dinner": "-", "accommodation": "Lower East Side Oasis (private room), Phoenix"}, {"day": 6, "current_city": "Phoenix", "transportation": "-", "breakfast": "Pizza Hut, Phoenix", "attraction": "Phoenix Zoo, Phoenix;", "lunch": "Doughlicious, Phoenix", "dinner": "Mama Loca, Phoenix", "accommodation": "Lower East Side Oasis (private room), Phoenix"}, {"day": 7, "current_city": "from Phoenix to Billings", "transportation": "Flight Number: F3581060, from Phoenix to Billings, Departure Time: 16:16, Arrival Time: 19:31, Cost: 307", "breakfast": "Village Restaurant, Phoenix", "attraction": "Heard Museum, Phoenix;", "lunch": "Jungle The Restaurant, Phoenix", "dinner": "-", "accommodation": "-"}]}]