[{"gpt-4-1106-preview_direct_sole-planning_results": "Travel Plan:\n\nDay 1: March 23, 2022\nCurrent City: from Denver to Seattle\nTransportation: Flight Number: F3519512, from Denver to Seattle, Departure Time: 06:27, Arrival Time: 08:32, Cost: $250\nBreakfast: Ting's Red Lantern, Seattle, Cost: $24\nAttraction: Seattle Aquarium, Seattle, Cost: $30 (estimated)\nLunch: Ceviche Tapas Bar & Restaurant, Seattle, Cost: $86\nDinner: Mother Ringlet, Seattle, Cost: $63\nAccommodation: Large quiet private studio in East Harlem, Seattle, Cost: $181\n\nTotal cost for Day 1: $250 (flight) + $24 (breakfast) + $30 (attraction) + $86 (lunch) + $63 (dinner) + $181 (accommodation) = $634\n\nDay 2: March 24, 2022\nCurrent City: Seattle\nTransportation: -, Cost: $0\nBreakfast: Caf\u6106 Burger BC, Seattle, Cost: $43\nAttraction: The Seattle Great Wheel; Chihuly Garden and Glass, Seattle, Cost: $60 (estimated)\nLunch: The Godinho's, Seattle, Cost: $96\nDinner: Teddy Choco Studio, Seattle, Cost: $70\nAccommodation: Large quiet private studio in East Harlem, Seattle, Cost: $181\n\nTotal cost for Day 2: $0 (transportation) + $43 (breakfast) + $60 (attraction) + $96 (lunch) + $70 (dinner) + $181 (accommodation) = $450\n\nDay 3: March 25, 2022\nCurrent City: from Seattle to Yakima\nTransportation: Flight Number: F3864441, from Seattle to Yakima, Departure Time: 12:54, Arrival Time: 13:32, Cost: $47\nBreakfast: Goli Vada Pav No. 1, Seattle, Cost: $31\nAttraction: Olympic Sculpture Park, Seattle, Cost: $20 (estimated)\nLunch: Delhi Darbar Dhaba, Seattle, Cost: $69\nDinner: Sambo Kojin, Yakima, Cost: $57\nAccommodation: Large 4 BR West Village townhouse/roof garden, Yakima, Cost: $157\n\nTotal cost for Day 3: $47 (flight) + $31 (breakfast) + $20 (attraction) + $69 (lunch) + $57 (dinner) + $157 (accommodation) = $381\n\nDay 4: March 26, 2022\nCurrent City: Yakima\nTransportation: -, Cost: $0\nBreakfast: Manzu\u7934, Yakima, Cost: $25\nAttraction: Yakima Valley Museum; Yakima Area Arboretum, Yakima, Cost: $40 (estimated)\nLunch: Roy's, Yakima, Cost: $45\nDinner: Flying Tandoor, Yakima, Cost: $99\nAccommodation: Large 4 BR West Village townhouse/roof garden, Yakima, Cost: $157\n\nTotal cost for Day 4: $0 (transportation) + $25 (breakfast) + $40 (attraction) + $45 (lunch) + $99 (dinner) + $157 (accommodation) = $366\n\nDay 5: March 27, 2022\nCurrent City: from Yakima to Denver\nTransportation: Self-driving, from Yakima to Denver, duration: 17 hours 4 mins, distance: 1,872 km, Cost: $93\nBreakfast: Britto's Bar & Restaurant, Yakima, Cost: $39\nAttraction: Yakima Sportsman State Park, Yakima, Cost: $15 (estimated)\nLunch: 60 ML - Country Inn & Suites by Carlson, Yakima, Cost: $90\nDinner: -, Cost: $0 (Assuming dinner will be in Denver after the trip)\nAccommodation: -, Cost: $0 (Assuming the traveler will reach home)\n\nTotal cost for Day 5: $93 (transportation) + $39 (breakfast) + $15 (attraction) + $90 (lunch) = $237\n\nThe total cost of this trip is the sum of the costs from Day 1, Day 2, Day 3, Day 4, and Day 5. It is $634 + $450 + $381 + $366 + $237 = $2068, which is less than the required budget of $4200.", "gpt-4-1106-preview_direct_sole-planning_parsed_results": [{"day": 1, "current_city": "from Denver to Seattle", "transportation": "Flight Number: F3519512, from Denver to Seattle, Departure Time: 06:27, Arrival Time: 08:32", "breakfast": "-", "attraction": "Pike Place Market, Seattle;", "lunch": "Ting's Red Lantern, Seattle", "dinner": "Ceviche Tapas Bar & Restaurant, Seattle", "accommodation": "Shared Apartment by Times Square Manhattan, Seattle"}, {"day": 2, "current_city": "Seattle", "transportation": "-", "breakfast": "Caf\u00e9 Burger BC, Seattle", "attraction": "Space Needle, Seattle;Chihuly Garden and Glass, Seattle;", "lunch": "The Godinho's, Seattle", "dinner": "Mother Ringlet, Seattle", "accommodation": "Shared Apartment by Times Square Manhattan, Seattle"}, {"day": 3, "current_city": "from Seattle to Yakima", "transportation": "Flight Number: F3864441, from Seattle to Yakima, Departure Time: 12:54, Arrival Time: 13:32", "breakfast": "Teddy Choco Studio, Seattle", "attraction": "Yakima Valley Museum, Yakima;", "lunch": "Sambo Kojin, Yakima", "dinner": "Roy's, Yakima", "accommodation": "Large 4 BR West Village townhouse/roof garden, Yakima"}, {"day": 4, "current_city": "Yakima", "transportation": "-", "breakfast": "Manz\u00fa, Yakima", "attraction": "Yakima Area Arboretum, Yakima;Yakima Sportsman State Park, Yakima;", "lunch": "Britto's Bar & Restaurant, Yakima", "dinner": "60 ML - Country Inn & Suites by Carlson, Yakima", "accommodation": "Large 4 BR West Village townhouse/roof garden, Yakima"}, {"day": 5, "current_city": "from Yakima to Denver", "transportation": "Self-driving, from Yakima to Denver, Duration: 17 hours 4 mins, Distance: 1872 km, Cost: 93", "breakfast": "-", "attraction": "-", "lunch": "-", "dinner": "-", "accommodation": "-"}]}]