[{"gpt-4-1106-preview_direct_sole-planning_results": "Travel Plan:\n\nDay 1: March 4th, 2022\nCurrent City: from Las Vegas to Twin Falls\nTransportation: Self-driving from Las Vegas to Twin Falls, Duration: 7 hours 32 mins, Distance: 796 km, Cost: $39 x 2 people = $78\nBreakfast: - (Assuming travelers will have breakfast before departure)\nAttraction: Shoshone Falls Park, Twin Falls, Cost: $0 (Assuming no entrance fee)\nLunch: Thai Paradise, Twin Falls, Average Cost: $87 x 2 people = $174\nDinner: Subway, Twin Falls, Average Cost: $77 x 2 people = $154\nAccommodation: Charming studio, great location!!!, Twin Falls, Price: $994 x 2 nights (minimum stay) = $1988\n\nTotal cost for Day 1: $78 (Transportation) + $174 (Lunch) + $154 (Dinner) + $994 (Accommodation) = $1400\n\nDay 2: March 5th, 2022\nCurrent City: Twin Falls\nTransportation: -, Cost: $0\nBreakfast: Kaushik Bakery, Twin Falls, Average Cost: $29 x 2 people = $58\nAttraction: Centennial Waterfront Park, Twin Falls, Cost: $0 (Assuming no entrance fee)\nLunch: Food Fever, Twin Falls, Average Cost: $83 x 2 people = $166\nDinner: Asia Kitchen, Twin Falls, Average Cost: $67 x 2 people = $134\nAccommodation: Charming studio, great location!!!, Twin Falls (Already paid for Day 1)\n\nTotal cost for Day 2: $58 (Breakfast) + $166 (Lunch) + $134 (Dinner) = $358\n\nDay 3: March 6th, 2022\nCurrent City: from Twin Falls to Pocatello\nTransportation: Self-driving from Twin Falls to Pocatello, Duration: 1 hour 46 mins, Distance: 183 km, Cost: $9 x 2 people = $18\nBreakfast: Mittal Fast Food, Twin Falls, Average Cost: $83 x 2 people = $166\nAttraction: Idaho Museum of Natural History, Pocatello, Cost: $0 (Assuming no entrance fee)\nLunch: Deorio's, Pocatello, Average Cost: $59 x 2 people = $118\nDinner: Harvest Moon, Pocatello, Average Cost: $90 x 2 people = $180\nAccommodation: Entire Modern Studio Apartment/Prime Location, Pocatello, Price: $1109 x 2 nights (minimum stay) = $2218\n\nTotal cost for Day 3: $18 (Transportation) + $166 (Breakfast) + $118 (Lunch) + $180 (Dinner) + $1109 (Accommodation) = $1591\n\nDay 4: March 7th, 2022\nCurrent City: Pocatello\nTransportation: -, Cost: $0\nBreakfast: Ghar Ki Handi, Pocatello, Average Cost: $13 x 2 people = $26\nAttraction: Zoo Idaho, Pocatello, Cost: $0 (Assuming no entrance fee)\nLunch: Oriental Kitchen Express, Pocatello, Average Cost: $36 x 2 people = $72\nDinner: Purnell's, Pocatello, Average Cost: $76 x 2 people = $152\nAccommodation: Entire Modern Studio Apartment/Prime Location, Pocatello (Already paid for Day 3)\n\nTotal cost for Day 4: $26 (Breakfast) + $72 (Lunch) + $152 (Dinner) = $250\n\nDay 5: March 8th, 2022\nCurrent City: from Pocatello to Boise\nTransportation: Self-driving from Pocatello to Boise, Duration: 3 hours 23 mins, Distance: 377 km, Cost: $18 x 2 people = $36\nBreakfast: Gopala Hari, Boise, Average Cost: $28 x 2 people = $56\nAttraction: Idaho State Museum, Boise, Cost: $0 (Assuming no entrance fee)\nLunch: TGI Friday's, Boise, Average Cost: $33 x 2 people = $66\nDinner: California Pizza Kitchen, Boise, Average Cost: $15 x 2 people = $30\nAccommodation: Modern & Cozy 2 BR Private Apartment in Brooklyn, Boise, Price: $843 x 2 nights (minimum stay) = $1686\n\nTotal cost for Day 5: $36 (Transportation) + $56 (Breakfast) + $66 (Lunch) + $30 (Dinner) + $843 (Accommodation) = $1031\n\nDay 6: March 9th, 2022\nCurrent City: Boise\nTransportation: -, Cost: $0\nBreakfast: Dunkin' Donuts, Boise, Average Cost: $65 x 2 people = $130\nAttraction: Zoo Boise, Boise, Cost: $0 (Assuming no entrance fee)\nLunch: The Brewhouse, Boise, Average Cost: $59 x 2 people = $118\nDinner: The Tandoor, Boise, Average Cost: $73 x 2 people = $146\nAccommodation: Modern & Cozy 2 BR Private Apartment in Brooklyn, Boise (Already paid for Day 5)\n\nTotal cost for Day 6: $130 (Breakfast) + $118 (Lunch) + $146 (Dinner) = $394\n\nDay 7: March 10th, 2022\nCurrent City: from Boise to Las Vegas\nTransportation: Self-driving from Boise to Las Vegas, Duration: 9 hours 30 mins, Distance: 1,004 km, Cost: $50 x 2 people = $100\nBreakfast: Gauranga Sweets, Boise, Average Cost: $53 x 2 people = $106\nAttraction: - (Assuming travelers will spend the day traveling back to Las Vegas)\nLunch: - (Assuming travelers will have lunch on the road)\nDinner: - (Assuming travelers will have dinner upon arrival in Las Vegas)\nAccommodation: - (Assuming travelers will not stay overnight as they have reached their destination)\n\nTotal cost for Day 7: $100 (Transportation) + $106 (Breakfast) = $206\n\nThe total cost of this trip is the sum of the costs from Day 1 to Day 7. It is $1400 + $358 + $1591 + $250 + $1031 + $394 + $206 = $5230\n\nUnfortunately, the total cost of $5230 exceeds the budget of $5100 by $130. To stay within budget, adjustments would need to be made, such as choosing less expensive meals or accommodations.", "gpt-4-1106-preview_direct_sole-planning_parsed_results": [{"day": 1, "current_city": "from Las Vegas to Twin Falls", "transportation": "Self-driving, from Las Vegas to Twin Falls, Duration: 7 hours 32 mins, Distance: 796 km, Cost: 39", "breakfast": "-", "attraction": "Snake River Canyon Rim Trail, Twin Falls", "lunch": "Thai Paradise, Twin Falls", "dinner": "Subway, Twin Falls", "accommodation": "Charming studio, great location!!!, Twin Falls"}, {"day": 2, "current_city": "Twin Falls", "transportation": "-", "breakfast": "Kaushik Bakery, Twin Falls", "attraction": "Shoshone Falls Park, Twin Falls", "lunch": "Food Fever, Twin Falls", "dinner": "Asia Kitchen, Twin Falls", "accommodation": "Charming studio, great location!!!, Twin Falls"}, {"day": 3, "current_city": "from Twin Falls to Pocatello", "transportation": "Self-driving, from Twin Falls to Pocatello, Duration: 1 hour 46 mins, Distance: 183 km, Cost: 9", "breakfast": "Mittal Fast Food, Twin Falls", "attraction": "Idaho Museum of Natural History, Pocatello", "lunch": "Deorio's, Pocatello", "dinner": "650 - The Global Kitchen, Pocatello", "accommodation": "Chill in Alphabet City, Pocatello"}, {"day": 4, "current_city": "Pocatello", "transportation": "-", "breakfast": "Ghar Ki Handi, Pocatello", "attraction": "Zoo Idaho, Pocatello", "lunch": "Oriental Kitchen Express, Pocatello", "dinner": "Wrapchick, Pocatello", "accommodation": "Chill in Alphabet City, Pocatello"}, {"day": 5, "current_city": "from Pocatello to Boise", "transportation": "Self-driving, from Pocatello to Boise, Duration: 3 hours 23 mins, Distance: 377 km, Cost: 18", "breakfast": "The Baking Treats N More, Pocatello", "attraction": "Zoo Boise, Boise", "lunch": "TGI Friday's, Boise", "dinner": "California Pizza Kitchen, Boise", "accommodation": "Lovely Hell's Kitchen Studio..., Boise"}, {"day": 6, "current_city": "Boise", "transportation": "-", "breakfast": "Gopala Hari, Boise", "attraction": "Idaho State Museum, Boise", "lunch": "The Brewhouse, Boise", "dinner": "Underdoggs Sports Bar & Grill, Boise", "accommodation": "Lovely Hell's Kitchen Studio..., Boise"}, {"day": 7, "current_city": "from Boise to Las Vegas", "transportation": "Self-driving, from Boise to Las Vegas, Duration: 9 hours 30 mins, Distance: 1,004 km, Cost: 50", "breakfast": "Dhaba By Claridges, Boise", "attraction": "-", "lunch": "-", "dinner": "-", "accommodation": "-"}]}]