[{"gpt-4-1106-preview_direct_sole-planning_results": "Travel Plan:\n\nDay 1: March 13, 2022\nCurrent City: from Newark to Madison\nTransportation: Flight Number: F4073170, from Newark to Madison, Departure Time: 18:26, Arrival Time: 19:56, Cost: $355 x 2 = $710\nDinner: Unique Food Hut, Madison, Average Cost: $38 x 2 = $76\nAccommodation: Perfectly Located UpperWest Futon, Madison, Cost: $164 x 2 nights = $328 (Shared room, minimum 2 nights stay)\n\nTotal cost for Day 1: $710 (Flight) + $76 (Dinner) + $164 (Accommodation) = $950\n\nDay 2: March 14, 2022\nCurrent City: Madison\nBreakfast: De Cafepedia, Madison, Average Cost: $33 x 2 = $66\nAttraction: Wisconsin State Capitol, Madison, Cost: Free\nLunch: Barbeque Nation, Madison, Average Cost: $38 x 2 = $76\nAttraction: Chazen Museum of Art, Madison, Cost: Free\nDinner: The Vault Cafe, Madison, Average Cost: $30 x 2 = $60\nAccommodation: Perfectly Located UpperWest Futon, Madison (Already paid for Day 1)\n\nTotal cost for Day 2: $66 (Breakfast) + $76 (Lunch) + $60 (Dinner) = $202\n\nDay 3: March 15, 2022\nCurrent City: from Madison to Mosinee\nTransportation: Self-driving, from Madison to Mosinee, Cost: $10 x 2 = $20\nBreakfast: Moet's Sizzlers, Madison, Average Cost: $10 x 2 = $20\nLunch: Cafe Sante, Mosinee, Average Cost: $49 x 2 = $98\nDinner: House of China Restaurant II, Mosinee, Average Cost: $96 x 2 = $192\nAccommodation: Where Dreams are made of NYC, Mosinee, Cost: $212 x 2 nights = $424 (Shared room, minimum 1 night stay)\n\nTotal cost for Day 3: $20 (Transportation) + $20 (Breakfast) + $98 (Lunch) + $192 (Dinner) + $212 (Accommodation) = $542\n\nDay 4: March 16, 2022\nCurrent City: Mosinee\nBreakfast: MyLoveBiryani.Com, Mosinee, Average Cost: $17 x 2 = $34\nAttraction: Rib Mountain State Park, Mosinee, Cost: Free\nLunch: Olive Kitchen, Mosinee, Average Cost: $38 x 2 = $76\nAttraction: Leigh Yawkey Woodson Art Museum, Mosinee, Cost: Free\nDinner: Desi Swag, Mosinee, Average Cost: $63 x 2 = $126\nAccommodation: Where Dreams are made of NYC, Mosinee (Already paid for Day 3)\n\nTotal cost for Day 4: $34 (Breakfast) + $76 (Lunch) + $126 (Dinner) = $236\n\nDay 5: March 17, 2022\nCurrent City: from Mosinee to Newark\nTransportation: Self-driving, from Mosinee to Newark, Cost: $84 x 2 = $168\nBreakfast: Senorita's, Mosinee, Average Cost: $94 x 2 = $188\nLunch: On the road (budget for fast food), Average Cost: $20 x 2 = $40\n\nTotal cost for Day 5: $168 (Transportation) + $188 (Breakfast) + $40 (Lunch) = $396\n\nThe total cost of this trip is the sum of the costs from Day 1, Day 2, Day 3, Day 4, and Day 5. It is $950 + $202 + $542 + $236 + $396 = $2,326, which is less than the required budget of $2,700.", "gpt-4-1106-preview_direct_sole-planning_parsed_results": [{"day": 1, "current_city": "from Newark to Madison", "transportation": "Flight Number: F4073170, from Newark to Madison, Departure Time: 18:26, Arrival Time: 19:56", "breakfast": "-", "attraction": "-", "lunch": "-", "dinner": "99 North Restaurant, Madison", "accommodation": "Perfectly Located UpperWest Futon, Madison"}, {"day": 2, "current_city": "Madison", "transportation": "-", "breakfast": "Barbeque Nation, Madison", "attraction": "Madison Children's Museum, Madison;Wisconsin State Capitol, Madison;", "lunch": "The Vault Cafe, Madison", "dinner": "Food Scouts, Madison", "accommodation": "Perfectly Located UpperWest Futon, Madison"}, {"day": 3, "current_city": "from Madison to Mosinee", "transportation": "Taxi, from Madison to Mosinee, duration: 2 hours 3 mins, Cost: 209", "breakfast": "Unique Food Hut, Madison", "attraction": "Big Eau Pleine County Park, Mosinee;Rib Mountain State Park, Mosinee;", "lunch": "Cafe Sante, Mosinee", "dinner": "House of China Restaurant II, Mosinee", "accommodation": "Where Dreams are made of NYC, Mosinee"}, {"day": 4, "current_city": "Mosinee", "transportation": "-", "breakfast": "Bake N Shake, Mosinee", "attraction": "Walter Zych Park, Mosinee;Leigh Yawkey Woodson Art Museum, Mosinee;", "lunch": "MyLoveBiryani.Com, Mosinee", "dinner": "Desi Swag, Mosinee", "accommodation": "Where Dreams are made of NYC, Mosinee"}, {"day": 5, "current_city": "from Mosinee to Newark", "transportation": "Self-driving, from Mosinee to Newark, duration: 15 hours 32 mins, Cost: 84", "breakfast": "Grit, Mosinee", "attraction": "Granite Peak Ski Area, Mosinee", "lunch": "-", "dinner": "-", "accommodation": "-"}]}]