[{"gpt-4-1106-preview_direct_sole-planning_results": "Travel Plan:\n\nDay 1: March 25th, 2022\nCurrent City: from Elmira to Detroit\nTransportation: Flight Number: F3808916, from Elmira to Detroit, Departure Time: 05:53, Arrival Time: 07:03, Cost: $145 x 2 = $290\nBreakfast: - (Assuming breakfast is had before the flight), Cost: $0\nAttraction: Detroit Institute of Arts, Detroit, Cost: $0 (Assuming free entry or covered by a city pass)\nLunch: A Dong Restaurant, Detroit, Average Cost: $40 x 2 = $80 (Mexican cuisine)\nDinner: Vapour Pub & Brewery, Detroit, Average Cost: $80 x 2 = $160 (French cuisine)\nAccommodation: Cozy 1 bedroom in the heart of Fort Greene, Detroit, Cost: $751 (Entire home/apt, pet-friendly)\n\nTotal cost for Day 1: $290 (Transportation) + $0 (Breakfast) + $0 (Attraction) + $80 (Lunch) + $160 (Dinner) + $751 (Accommodation) = $1,281\n\nDay 2: March 26th, 2022\nCurrent City: Detroit\nTransportation: -, Cost: $0\nBreakfast: Cafe And More, Detroit, Average Cost: $41 x 2 = $82 (American cuisine)\nAttraction: Detroit Historical Museum, Detroit, Cost: $0 (Assuming free entry or covered by a city pass)\nLunch: The Dosa King, Detroit, Average Cost: $69 x 2 = $138 (Mediterranean cuisine)\nDinner: Chye Seng Huat Hardware, Detroit, Average Cost: $94 x 2 = $188 (Mexican cuisine)\nAccommodation: Cozy 1 bedroom in the heart of Fort Greene, Detroit, Cost: $751 (Entire home/apt, pet-friendly)\n\nTotal cost for Day 2: $0 (Transportation) + $82 (Breakfast) + $0 (Attraction) + $138 (Lunch) + $188 (Dinner) + $751 (Accommodation) = $1,159\n\nDay 3: March 27th, 2022\nCurrent City: Detroit\nTransportation: Flight Number: F3807496, from Detroit to Elmira, Departure Time: 21:03, Arrival Time: 22:09, Cost: $122 x 2 = $244\nBreakfast: Mandap - Hotel Express Towers, Detroit, Average Cost: $37 x 2 = $74 (American cuisine)\nAttraction: Belle Isle Aquarium, Detroit, Cost: $0 (Assuming free entry or covered by a city pass)\nLunch: Turquoise Turkish Ice-cream, Detroit, Average Cost: $79 x 2 = $158 (Mediterranean cuisine)\nDinner: - (Assuming dinner is had after the flight or not covered due to budget constraints), Cost: $0\nAccommodation: - (Returning to Elmira), Cost: $0\n\nTotal cost for Day 3: $244 (Transportation) + $74 (Breakfast) + $0 (Attraction) + $158 (Lunch) + $0 (Dinner) + $0 (Accommodation) = $476\n\nThe total cost of this trip is the sum of the costs from Day 1, Day 2, and Day 3. It is $1,281 + $1,159 + $476 = $2,916\n\nUnfortunately, the total cost exceeds the budget of $2,200. To adjust the plan to fit the budget, we may need to consider different accommodation options or adjust meal plans. However, based on the provided data, there are no cheaper pet-friendly entire room accommodations available. Therefore, we would need to either increase the budget or reconsider the pet-friendly requirement for accommodations.", "gpt-4-1106-preview_direct_sole-planning_parsed_results": [{"day": 1, "current_city": "from Elmira to Detroit", "transportation": "Flight Number: F3808916, from Elmira to Detroit, Departure Time: 05:53, Arrival Time: 07:03", "breakfast": "-", "attraction": "Detroit Institute of Arts, Detroit;", "lunch": "Chye Seng Huat Hardware, Detroit", "dinner": "Vapour Pub & Brewery, Detroit", "accommodation": "Cozy 1 bedroom in the heart of Fort Greene, Detroit"}, {"day": 2, "current_city": "Detroit", "transportation": "-", "breakfast": "Cafe And More, Detroit", "attraction": "Detroit Historical Museum, Detroit;Belle Isle Aquarium, Detroit;", "lunch": "A Dong Restaurant, Detroit", "dinner": "Turquoise Turkish Ice-cream, Detroit", "accommodation": "Cozy 1 bedroom in the heart of Fort Greene, Detroit"}, {"day": 3, "current_city": "from Detroit to Elmira", "transportation": "Flight Number: F3807496, from Detroit to Elmira, Departure Time: 21:03, Arrival Time: 22:09", "breakfast": "Southern Bliss Bakery, Detroit", "attraction": "Motown Museum, Detroit;", "lunch": "The Dosa King, Detroit", "dinner": "-", "accommodation": "-"}]}]