[{"gpt-4-1106-preview_direct_sole-planning_results": "Travel Plan:\n\nDay 1: March 13, 2022\nCurrent City: from Los Angeles to Colorado Springs\nTransportation: Flight Number: F3822873, from Los Angeles to Colorado Springs, Departure Time: 18:45, Arrival Time: 22:03, Cost: $411\nDinner: - (Assuming dinner on the flight or after arrival, not included in the budget)\nAccommodation: Large sunny park slope apartment, Colorado Springs, Cost: $82\n\nTotal cost for Day 1: $411 (Flight) + $82 (Accommodation) = $493\n\nDay 2: March 14, 2022\nCurrent City: Colorado Springs\nBreakfast: Raglan Road Irish Pub and Restaurant, Colorado Springs, Cost: $97\nAttraction: Garden of the Gods, Colorado Springs, Cost: $0 (Assuming no entrance fee)\nLunch: Derby, Colorado Springs, Cost: $67\nAttraction: The Broadmoor Seven Falls, Colorado Springs, Cost: $0 (Assuming no entrance fee)\nDinner: Club Tokyo - Best Western Skycity Hotel, Colorado Springs, Cost: $64\nAccommodation: Large sunny park slope apartment, Colorado Springs, Cost: $82\n\nTotal cost for Day 2: $97 (Breakfast) + $67 (Lunch) + $64 (Dinner) + $82 (Accommodation) = $310\n\nDay 3: March 15, 2022\nCurrent City: from Colorado Springs to Grand Junction\nTransportation: Self-driving, from Colorado Springs to Grand Junction, Cost: $25\nBreakfast: Deepak Rasoi, Colorado Springs, Cost: $60\nAttraction: Cheyenne Mountain Zoo, Colorado Springs, Cost: $0 (Assuming no entrance fee)\nLunch: GoGourmet, Colorado Springs, Cost: $66\nDinner: Austin's BBQ and Oyster Bar, Grand Junction, Cost: $15\nAccommodation: Lovely 1 BD on the Upper West Side, Grand Junction, Cost: $854\n\nTotal cost for Day 3: $25 (Transportation) + $60 (Breakfast) + $66 (Lunch) + $15 (Dinner) + $854 (Accommodation) = $1020\n\nDay 4: March 16, 2022\nCurrent City: Grand Junction\nBreakfast: Thakur Bakers, Grand Junction, Cost: $100\nAttraction: Museum of the West, Museums of Western Colorado, Grand Junction, Cost: $0 (Assuming no entrance fee)\nLunch: Shanghai Bar & Lounge - The Bristol Hotel, Grand Junction, Cost: $31\nAttraction: Western Colorado Botanical Gardens, Grand Junction, Cost: $0 (Assuming no entrance fee)\nDinner: Pind Balluchi, Grand Junction, Cost: $17\nAccommodation: Lovely 1 BD on the Upper West Side, Grand Junction, Cost: $854\n\nTotal cost for Day 4: $100 (Breakfast) + $31 (Lunch) + $17 (Dinner) + $854 (Accommodation) = $1002\n\nDay 5: March 17, 2022\nCurrent City: from Grand Junction to Los Angeles\nTransportation: Self-driving, from Grand Junction to Los Angeles, Cost: $62\nBreakfast: Cocoa Tree, Grand Junction, Cost: $68\nLunch: Punjab Da Pind, Grand Junction, Cost: $52\nDinner: - (Assuming dinner on the road or after arrival, not included in the budget)\nAccommodation: - (Returning to origin city)\n\nTotal cost for Day 5: $62 (Transportation) + $68 (Breakfast) + $52 (Lunch) = $182\n\nThe total cost of this trip is the sum of the costs from Day 1 to Day 5: $493 + $310 + $1020 + $1002 + $182 = $3007\n\nThis total of $3007 is within the required budget of $4700. Please note that attraction costs are assumed to be free based on the provided information, and meals are not repeated. Accommodations are chosen based on the minimum nights required and within the budget.", "gpt-4-1106-preview_direct_sole-planning_parsed_results": [{"day": 1, "current_city": "from Los Angeles to Colorado Springs", "transportation": "Flight Number: F3822873, from Los Angeles to Colorado Springs, Departure Time: 18:45, Arrival Time: 22:03", "breakfast": "-", "attraction": "-", "lunch": "-", "dinner": "Raglan Road Irish Pub and Restaurant, Colorado Springs", "accommodation": "Large sunny park slope apartment, Colorado Springs"}, {"day": 2, "current_city": "Colorado Springs", "transportation": "-", "breakfast": "Club Tokyo - Best Western Skycity Hotel, Colorado Springs", "attraction": "The Broadmoor Seven Falls, Colorado Springs;Garden of the Gods, Colorado Springs;", "lunch": "Deepak Rasoi, Colorado Springs", "dinner": "GoGourmet, Colorado Springs", "accommodation": "Large sunny park slope apartment, Colorado Springs"}, {"day": 3, "current_city": "from Colorado Springs to Grand Junction", "transportation": "Self-driving, from Colorado Springs to Grand Junction, duration: 4 hours 48 mins", "breakfast": "New Spice World, Colorado Springs", "attraction": "Cheyenne Mountain Zoo, Colorado Springs", "lunch": "Mukhtalif Biryanis, Colorado Springs", "dinner": "Austin's BBQ and Oyster Bar, Grand Junction", "accommodation": "Lovely 1 BD on the Upper West Side, Grand Junction"}, {"day": 4, "current_city": "Grand Junction", "transportation": "-", "breakfast": "Shanghai Bar & Lounge - The Bristol Hotel, Grand Junction", "attraction": "Museum of the West, Museums of Western Colorado, Grand Junction;Western Colorado Botanical Gardens, Grand Junction;", "lunch": "2 Dog, Grand Junction", "dinner": "Punjab Da Pind, Grand Junction", "accommodation": "Lovely 1 BD on the Upper West Side, Grand Junction"}, {"day": 5, "current_city": "from Grand Junction to Los Angeles", "transportation": "Self-driving, from Grand Junction to Los Angeles, duration: 11 hours 19 mins", "breakfast": "Thakur Bakers, Grand Junction", "attraction": "Canyon View Park, Grand Junction", "lunch": "Pind Balluchi, Grand Junction", "dinner": "-", "accommodation": "-"}]}]