[{"gpt-4-1106-preview_direct_sole-planning_results": "Travel Plan:\n\nDay 1: March 5th\nCurrent City: from Colorado Springs to Moline\nTransportation: Self-driving from Colorado Springs to Moline, duration: 12 hours 49 mins, distance: 1,467 km, cost: $73\nBreakfast: - (Assuming breakfast in Colorado Springs before departure), Cost: $0\nAttraction: John Deere Pavilion, Moline, Cost: $0 (Assuming free entry)\nLunch: Royal Hotel, Moline, Average Cost: $74\nDinner: Lovecrumbs Bakery, Moline, Average Cost: $24\nAccommodation: Sunny duplex near Central Park, Moline, Cost: $541 (1 night)\n\nTotal cost: $73 (Transportation) + $74 (Lunch) + $24 (Dinner) + $541 (Accommodation) = $712\n\nDay 2: March 6th\nCurrent City: Moline\nTransportation: -, Cost: $0\nBreakfast: Mummy's Kitchen, Moline, Average Cost: $54\nAttraction: Celebration River Cruises, Moline, Cost: $0 (Assuming free entry)\nLunch: ZASTY, Moline, Average Cost: $82\nDinner: Cafe Coffee Day, Moline, Average Cost: $89\nAccommodation: Sunny duplex near Central Park, Moline, Cost: $541 (2nd night)\n\nTotal cost: $54 (Breakfast) + $82 (Lunch) + $89 (Dinner) + $541 (Accommodation) = $766\n\nDay 3: March 7th\nCurrent City: from Moline to Rockford\nTransportation: Self-driving from Moline to Rockford, duration: 2 hours 1 min, distance: 194 km, cost: $9\nBreakfast: Hucka, Moline, Average Cost: $29\nAttraction: Anderson Japanese Gardens, Rockford, Cost: $0 (Assuming free entry)\nLunch: Flying Mango, Rockford, Average Cost: $20\nDinner: Coco Bambu, Rockford, Average Cost: $72\nAccommodation: Spacious 3BDR Prime Location!, Rockford, Cost: $1030 (1 night)\n\nTotal cost: $9 (Transportation) + $29 (Breakfast) + $20 (Lunch) + $72 (Dinner) + $1030 (Accommodation) = $1160\n\nDay 4: March 8th\nCurrent City: Rockford\nTransportation: -, Cost: $0\nBreakfast: Moets Arabica, Rockford, Average Cost: $43\nAttraction: Discovery Center Museum, Rockford, Cost: $0 (Assuming free entry)\nLunch: Cafe Southall, Rockford, Average Cost: $56\nDinner: Eggspectation - Jaypee Vasant Continental, Rockford, Average Cost: $77\nAccommodation: Spacious 3BDR Prime Location!, Rockford, Cost: $1030 (2nd night)\n\nTotal cost: $43 (Breakfast) + $56 (Lunch) + $77 (Dinner) + $1030 (Accommodation) = $1206\n\nDay 5: March 9th\nCurrent City: from Rockford to Colorado Springs\nTransportation: Self-driving from Rockford to Colorado Springs, duration: 14 hours 38 mins, distance: 1,653 km, cost: $82\nBreakfast: Nutri Punch, Rockford, Average Cost: $34\nAttraction: - (Assuming travel day with no attractions), Cost: $0\nLunch: - (Assuming on the road), Cost: $0\nDinner: - (Assuming arrival in Colorado Springs after dinner), Cost: $0\nAccommodation: - (Assuming return home), Cost: $0\n\nTotal cost: $82 (Transportation) + $34 (Breakfast) = $116\n\nThe total cost of this trip is the sum of the costs from day 1, day 2, day 3, day 4, and day 5. It is $712 + $766 + $1160 + $1206 + $116 = $3960\n\nUnfortunately, the total cost of $3960 exceeds the budget of $1900. Adjustments need to be made to the plan to fit the budget. This could include choosing more affordable accommodations, dining options, and potentially removing paid attractions.", "gpt-4-1106-preview_direct_sole-planning_parsed_results": [{"day": 1, "current_city": "from Colorado Springs to Moline", "transportation": "Self-driving, from Colorado Springs to Moline, Duration: 12 hours 49 mins, Distance: 1467 km, Cost: 73", "breakfast": "-", "attraction": "-", "lunch": "-", "dinner": "Royal Hotel, Moline", "accommodation": "Sunny duplex near Central Park, Moline"}, {"day": 2, "current_city": "Moline", "transportation": "-", "breakfast": "Lovecrumbs Bakery, Moline", "attraction": "John Deere Pavilion, Moline;Celebration River Cruises, Moline;", "lunch": "Zoe, Moline", "dinner": "ZASTY, Moline", "accommodation": "Sunny duplex near Central Park, Moline"}, {"day": 3, "current_city": "from Moline to Rockford", "transportation": "Self-driving, from Moline to Rockford, Duration: 2 hours 1 min, Distance: 194 km, Cost: 9", "breakfast": "Mummy's Kitchen, Moline", "attraction": "Anderson Japanese Gardens, Rockford;Burpee Museum of Natural History, Rockford;", "lunch": "Flying Mango, Rockford", "dinner": "Coco Bambu, Rockford", "accommodation": "Spacious 3BDR Prime Location!, Rockford"}, {"day": 4, "current_city": "Rockford", "transportation": "-", "breakfast": "Eggspectation - Jaypee Vasant Continental, Rockford", "attraction": "Discovery Center Museum, Rockford;Sinnissippi Park, Rockford;", "lunch": "Cafe Southall, Rockford", "dinner": "Aroma Rest O Bar, Rockford", "accommodation": "Spacious 3BDR Prime Location!, Rockford"}, {"day": 5, "current_city": "from Rockford to Colorado Springs", "transportation": "Self-driving, from Rockford to Colorado Springs, Duration: 14 hours 38 mins, Distance: 1653 km, Cost: 82", "breakfast": "Nutri Punch, Rockford", "attraction": "-", "lunch": "-", "dinner": "-", "accommodation": "-"}]}]