[{"gpt-4-1106-preview_direct_sole-planning_results": "Travel Plan:\n\nDay 1: March 23, 2022\nCurrent City: from Washington to Buffalo\nTransportation: Flight Number: F3633555, from Washington to Buffalo, Departure Time: 14:56, Arrival Time: 16:00, Cost: $97 per person, Total Cost: $679\nDinner: Shokitini, Buffalo, Average Cost: $41 per person, Total Cost: $287\nAccommodation: Williamsburg Gem: Sleep up to 5, Buffalo, Cost: $486 per night (as it's the only entire home/apt option that can accommodate at least 5 people and is available for less than the group size of 7, the group may need to book additional accommodation or adjust preferences)\n\nTotal cost for Day 1: $679 (flight) + $287 (dinner) + $486 (accommodation) = $1452\n\nDay 2: March 24, 2022\nCurrent City: Buffalo\nBreakfast: Punjab Grill, Buffalo, Average Cost: $25 per person, Total Cost: $175\nAttraction: The Buffalo Zoo, Buffalo, Cost: Estimated $15 per person, Total Cost: $105\nLunch: Tibby's New Orleans Kitchen, Buffalo, Average Cost: $48 per person, Total Cost: $336\nAttraction: Buffalo Naval Park, Buffalo, Cost: Estimated $15 per person, Total Cost: $105\nDinner: Pinch Of Spice, Buffalo, Average Cost: $84 per person, Total Cost: $588\nAccommodation: Williamsburg Gem: Sleep up to 5, Buffalo, Cost: $486 per night\n\nTotal cost for Day 2: $175 (breakfast) + $105 (attraction) + $336 (lunch) + $105 (attraction) + $588 (dinner) + $486 (accommodation) = $1795\n\nDay 3: March 25, 2022\nCurrent City: from Buffalo to New York\nTransportation: Flight Number: F3640947, from Buffalo to New York, Departure Time: 14:04, Arrival Time: 15:22, Cost: $90 per person, Total Cost: $630\nDinner: Seasons 52 Fresh Grill, New York, Average Cost: $30 per person, Total Cost: $210\nAccommodation: A Contemporary Homelike Stay in the Best of BK, New York, Cost: $228 per night\n\nTotal cost for Day 3: $630 (flight) + $210 (dinner) + $228 (accommodation) = $1068\n\nDay 4: March 26, 2022\nCurrent City: New York\nBreakfast: Gurgaon Hights, New York, Average Cost: $46 per person, Total Cost: $322\nAttraction: Statue of Liberty, New York, Cost: Estimated $25 per person, Total Cost: $175\nLunch: G Dot, New York, Average Cost: $75 per person, Total Cost: $525\nAttraction: Empire State Building, New York, Cost: Estimated $40 per person, Total Cost: $280\nDinner: Rambhog, New York, Average Cost: $95 per person, Total Cost: $665\nAccommodation: A Contemporary Homelike Stay in the Best of BK, New York, Cost: $228 per night\n\nTotal cost for Day 4: $322 (breakfast) + $175 (attraction) + $525 (lunch) + $280 (attraction) + $665 (dinner) + $228 (accommodation) = $2195\n\nDay 5: March 27, 2022\nCurrent City: from New York to Washington\nTransportation: Flight Number: F3661892, from New York to Washington, Departure Time: 11:31, Arrival Time: 12:45, Cost: $64 per person, Total Cost: $448\nLunch: Lord of the Drinks Forum, New York, Average Cost: $71 per person, Total Cost: $497\n\nTotal cost for Day 5: $448 (flight) + $497 (lunch) = $945\n\nThe total cost of this trip is the sum of the costs from Day 1 to Day 5. It is $1452 + $1795 + $1068 + $2195 + $945 = $7455, which is less than the allocated budget of $9100.\n\nPlease note that the costs for attractions are estimated as the provided reference information does not include specific prices for attractions. Additionally, the accommodation on Day 1 may need to be adjusted as the only available entire home/apt option does not accommodate the entire group of 7. The group may need to book additional accommodation or adjust their preferences.", "gpt-4-1106-preview_direct_sole-planning_parsed_results": [{"day": 1, "current_city": "from Washington to Buffalo", "transportation": "Flight Number: F3633555, from Washington to Buffalo, Departure Time: 14:56, Arrival Time: 16:00", "breakfast": "-", "attraction": "The Buffalo Zoo, Buffalo;", "lunch": "Shokitini, Buffalo", "dinner": "Tibby's New Orleans Kitchen, Buffalo", "accommodation": "Cozy Studio in Heart of Ft Greene, Buffalo"}, {"day": 2, "current_city": "Buffalo", "transportation": "-", "breakfast": "Punjab Grill, Buffalo", "attraction": "Buffalo and Erie County Botanical Gardens, Buffalo; Buffalo Naval Park, Buffalo;", "lunch": "Pinch Of Spice, Buffalo", "dinner": "The Zuree Urban Kitchen, Buffalo", "accommodation": "Cozy Studio in Heart of Ft Greene, Buffalo"}, {"day": 3, "current_city": "from Buffalo to New York", "transportation": "Flight Number: F3640947, from Buffalo to New York, Departure Time: 14:04, Arrival Time: 15:22", "breakfast": "-", "attraction": "Top of The Rock, New York; The High Line, New York;", "lunch": "Seasons 52 Fresh Grill, New York", "dinner": "Lord of the Drinks Forum, New York", "accommodation": "A Contemporary Homelike Stay in the Best of BK, New York"}, {"day": 4, "current_city": "New York", "transportation": "-", "breakfast": "Gurgaon Hights, New York", "attraction": "Empire State Building, New York; Central Park, New York;", "lunch": "G Dot, New York", "dinner": "Goosebumps, New York", "accommodation": "A Contemporary Homelike Stay in the Best of BK, New York"}, {"day": 5, "current_city": "from New York to Washington", "transportation": "Flight Number: F3661892, from New York to Washington, Departure Time: 11:31, Arrival Time: 12:45", "breakfast": "-", "attraction": "-", "lunch": "-", "dinner": "-", "accommodation": "-"}]}]