[{"gpt-4-1106-preview_direct_sole-planning_results": "Travel Plan:\n\nDay 1: March 20, 2022\nCurrent City: from Knoxville to Orlando\nTransportation: Flight Number: F3566154, from Knoxville to Orlando, Departure Time: 09:17, Arrival Time: 11:08, Cost: $235 x 2 = $470\nLunch: Turquoise Villa, Orlando, Average Cost: $55 x 2 = $110\nAttraction: The Wheel at ICON Park, Orlando, Cost: (Assuming $25 per person) $25 x 2 = $50\nDinner: Wai Yu Mun Ching, Orlando, Average Cost: $51 x 2 = $102\nAccommodation: Sixth Ave Chelsea, Studio Serviced Apartment, Orlando, Cost: $70 x 2 nights = $140\n\nTotal cost for Day 1: $470 + $110 + $50 + $102 + $140 = $872\n\nDay 2: March 21, 2022\nCurrent City: Orlando\nTransportation: -, Cost: $0\nBreakfast: Fuji Japanese Steakhouse, Orlando, Average Cost: $75 x 2 = $150\nAttraction: Universal Orlando Resort, Orlando, Cost: (Assuming $110 per person) $110 x 2 = $220\nLunch: Indochi Cafe & Restaurant, Orlando, Average Cost: $72 x 2 = $144\nDinner: Shivani Catering Services, Orlando, Average Cost: $75 x 2 = $150\nAccommodation: Sixth Ave Chelsea, Studio Serviced Apartment, Orlando, Cost: (Already accounted for on Day 1)\n\nTotal cost for Day 2: $150 + $220 + $144 + $150 = $664\n\nDay 3: March 22, 2022\nCurrent City: from Orlando to Miami\nTransportation: Flight Number: F3670400, from Orlando to Miami, Departure Time: 17:47, Arrival Time: 18:51, Cost: $58 x 2 = $116\nBreakfast: Chaayos, Orlando, Average Cost: $73 x 2 = $146\nAttraction: SeaWorld Orlando, Orlando, Cost: (Assuming $100 per person) $100 x 2 = $200\nLunch: Pure Bliss, Orlando, Average Cost: $84 x 2 = $168\nDinner: Shorts Burger and Shine, Miami, Average Cost: $81 x 2 = $162\nAccommodation: Cozy Two-bedroom Apt in a Cute House in Brooklyn!, Miami, Cost: $99 x 2 nights = $198\n\nTotal cost for Day 3: $116 + $146 + $200 + $168 + $162 + $198 = $990\n\nDay 4: March 23, 2022\nCurrent City: Miami\nTransportation: -, Cost: $0\nBreakfast: Papouli's Mediterranean Cafe & Market, Miami, Average Cost: $26 x 2 = $52\nAttraction: Jungle Island, Miami, Cost: (Assuming $35 per person) $35 x 2 = $70\nLunch: Tako Cheena by Pom Pom, Miami, Average Cost: $60 x 2 = $120\nDinner: AB's Absolute Barbecues, Miami, Average Cost: $55 x 2 = $110\nAccommodation: Cozy Two-bedroom Apt in a Cute House in Brooklyn!, Miami, Cost: (Already accounted for on Day 3)\n\nTotal cost for Day 4: $52 + $70 + $120 + $110 = $352\n\nDay 5: March 24, 2022\nCurrent City: from Miami to Knoxville\nTransportation: Flight Number: F3601007, from Miami to Knoxville, Departure Time: 21:30, Arrival Time: 23:58, Cost: $217 x 2 = $434\nBreakfast: Anjlika, Miami, Average Cost: $56 x 2 = $112\nAttraction: Miami Seaquarium, Miami, Cost: (Assuming $50 per person) $50 x 2 = $100\nLunch: Spice It - Hotel IBIS, Miami, Average Cost: $38 x 2 = $76\nDinner: - (Assuming flight meal), Cost: $0\nAccommodation: - (Returning home), Cost: $0\n\nTotal cost for Day 5: $434 + $112 + $100 + $76 = $722\n\nThe total cost of this trip is the sum of the cost from day 1, day 2, day 3, day 4, and day 5. It is $872 + $664 + $990 + $352 + $722 = $3,600 which is less than the required budget of $3,900.\n\nPlease note that attraction costs are assumed based on common pricing and may vary. The accommodation costs are based on the minimum nights required as per the reference information. The plan includes diverse meals focusing on local Chinese and Mediterranean cuisines as requested.", "gpt-4-1106-preview_direct_sole-planning_parsed_results": [{"day": 1, "current_city": "from Knoxville to Orlando", "transportation": "Flight Number: F3566154, from Knoxville to Orlando, Departure Time: 09:17, Arrival Time: 11:08", "breakfast": "-", "attraction": "SeaWorld Orlando, Orlando;", "lunch": "Indochi Cafe & Restaurant, Orlando", "dinner": "Shivani Catering Services, Orlando", "accommodation": "BKLYN Brownstone- Glam Getaway!, Orlando"}, {"day": 2, "current_city": "Orlando", "transportation": "-", "breakfast": "Fuji Japanese Steakhouse, Orlando", "attraction": "The Wheel at ICON Park, Orlando;Universal Orlando Resort, Orlando;", "lunch": "Wai Yu Mun Ching, Orlando", "dinner": "Indochi Cafe & Restaurant, Orlando", "accommodation": "BKLYN Brownstone- Glam Getaway!, Orlando"}, {"day": 3, "current_city": "from Orlando to Miami", "transportation": "Flight Number: F3670400, from Orlando to Miami, Departure Time: 17:47, Arrival Time: 18:51", "breakfast": "-", "attraction": "-", "lunch": "-", "dinner": "Shorts Burger and Shine, Miami", "accommodation": "Charming 1BD Astoria Penthouse, Miami"}, {"day": 4, "current_city": "Miami", "transportation": "-", "breakfast": "Papouli's Mediterranean Cafe & Market, Miami", "attraction": "Jungle Island, Miami;P\u00e9rez Art Museum Miami, Miami;", "lunch": "Tako Cheena by Pom Pom, Miami", "dinner": "Spices & Sauces, Miami", "accommodation": "Charming 1BD Astoria Penthouse, Miami"}, {"day": 5, "current_city": "from Miami to Knoxville", "transportation": "Flight Number: F3601007, from Miami to Knoxville, Departure Time: 21:30, Arrival Time: 23:58", "breakfast": "Anjlika, Miami", "attraction": "Bayfront Park, Miami;", "lunch": "Spice It - Hotel IBIS, Miami", "dinner": "-", "accommodation": "-"}]}]