[{"gpt-4-1106-preview_direct_sole-planning_results": "Travel Plan:\n\nDay 1: March 25, 2022\nCurrent City: from Salt Lake City to San Diego\nTransportation: Flight Number: F3499966, from Salt Lake City to San Diego, Departure Time: 08:02, Arrival Time: 08:55, Cost: $300 x 2 = $600\nBreakfast: - (Assuming breakfast is had before the flight or during the flight), Cost: $0\nAttraction: Cabrillo National Monument, San Diego, Cost: $0 (Assuming no entrance fee)\nLunch: Open Yard, San Diego, Average Cost: $33 x 2 = $66\nAttraction: La Jolla Shores Park, San Diego, Cost: $0 (Assuming no entrance fee)\nDinner: The Lost Mughal, San Diego, Average Cost: $74 x 2 = $148\nAccommodation: Spacious Room in Large 2 Bedroom Prewar Apartment, San Diego, Cost: $585 (Private room, allows smoking)\n\nTotal cost for Day 1: $600 (Flight) + $66 (Lunch) + $148 (Dinner) + $585 (Accommodation) = $1399\n\nDay 2: March 26, 2022\nCurrent City: San Diego\nTransportation: -, Cost: $0\nBreakfast: Jetha Lal Ka Dhabha, San Diego, Average Cost: $22 x 2 = $44\nAttraction: SeaWorld San Diego, San Diego, Cost: $0 (Assuming no entrance fee)\nLunch: Burger King, San Diego, Average Cost: $20 x 2 = $40\nAttraction: Old Town San Diego, San Diego, Cost: $0 (Assuming no entrance fee)\nDinner: Momos Hut & Chinese Food, San Diego, Average Cost: $94 x 2 = $188\nAccommodation: Spacious Room in Large 2 Bedroom Prewar Apartment, San Diego, Cost: $585 (Private room, allows smoking)\n\nTotal cost for Day 2: $44 (Breakfast) + $40 (Lunch) + $188 (Dinner) + $585 (Accommodation) = $857\n\nDay 3: March 27, 2022\nCurrent City: from San Diego to San Luis Obispo\nTransportation: Flight Number: F3820181, from San Diego to San Luis Obispo, Departure Time: 09:59, Arrival Time: 11:02, Cost: $76 x 2 = $152\nBreakfast: - (Assuming breakfast is had before the flight), Cost: $0\nAttraction: San Luis Obispo Children's Museum, San Luis Obispo, Cost: $0 (Assuming no entrance fee)\nLunch: Sushi Leblon, San Luis Obispo, Average Cost: $38 x 2 = $76\nAttraction: Mission Plaza, San Luis Obispo, Cost: $0 (Assuming no entrance fee)\nDinner: El Jalisciense Mexican Restaurant, San Luis Obispo, Average Cost: $34 x 2 = $68\nAccommodation: Upper West Side 1 bedroom, San Luis Obispo, Cost: $859 (Private room, allows smoking)\n\nTotal cost for Day 3: $152 (Flight) + $76 (Lunch) + $68 (Dinner) + $859 (Accommodation) = $1155\n\nDay 4: March 28, 2022\nCurrent City: San Luis Obispo\nTransportation: -, Cost: $0\nBreakfast: Da Pizza Zone, San Luis Obispo, Average Cost: $15 x 2 = $30\nAttraction: San Luis Obispo Railroad Museum, San Luis Obispo, Cost: $0 (Assuming no entrance fee)\nLunch: Crust N Cakes, San Luis Obispo, Average Cost: $64 x 2 = $128\nAttraction: The Dorn Pyramid, San Luis Obispo, Cost: $0 (Assuming no entrance fee)\nDinner: Modern Sweets, San Luis Obispo, Average Cost: $12 x 2 = $24\nAccommodation: Upper West Side 1 bedroom, San Luis Obispo, Cost: $859 (Private room, allows smoking)\n\nTotal cost for Day 4: $30 (Breakfast) + $128 (Lunch) + $24 (Dinner) + $859 (Accommodation) = $1041\n\nDay 5: March 29, 2022\nCurrent City: from San Luis Obispo to Los Angeles\nTransportation: Flight Number: F3854130, from San Luis Obispo to Los Angeles, Departure Time: 05:53, Arrival Time: 06:55, Cost: $53 x 2 = $106\nBreakfast: - (Assuming breakfast is had before the flight), Cost: $0\nAttraction: Santa Monica Pier, Los Angeles, Cost: $0 (Assuming no entrance fee)\nLunch: Heat - Edsa Shangri-La, Los Angeles, Average Cost: $148 x 2 = $296\nAttraction: Hollywood Walk of Fame, Los Angeles, Cost: $0 (Assuming no entrance fee)\nDinner: Punjabi Zaika, Los Angeles, Average Cost: $46 x 2 = $92\nAccommodation: Midtown East 2 Bed/2 Bath Elevator Building Apt, Los Angeles, Cost: $540 (Private room, allows smoking)\n\nTotal cost for Day 5: $106 (Flight) + $296 (Lunch) + $92 (Dinner) + $540 (Accommodation) = $1034\n\nDay 6: March 30, 2022\nCurrent City: Los Angeles\nTransportation: -, Cost: $0\nBreakfast: The Hangout by 1861, Los Angeles, Average Cost: $64 x 2 = $128\nAttraction: Griffith Observatory, Los Angeles, Cost: $0 (Assuming no entrance fee)\nLunch: Chicken Minar, Los Angeles, Average Cost: $25 x 2 = $50\nAttraction: The Getty, Los Angeles, Cost: $0 (Assuming no entrance fee)\nDinner: Choco Kraft, Los Angeles, Average Cost: $20 x 2 = $40\nAccommodation: Midtown East 2 Bed/2 Bath Elevator Building Apt, Los Angeles, Cost: $540 (Private room, allows smoking)\n\nTotal cost for Day 6: $128 (Breakfast) + $50 (Lunch) + $40 (Dinner) + $540 (Accommodation) = $758\n\nDay 7: March 31, 2022\nCurrent City: from Los Angeles to Salt Lake City\nTransportation: Flight Number: F3817140, from Los Angeles to Salt Lake City, Departure Time: 15:09, Arrival Time: 18:22, Cost: $150 x 2 = $300\nBreakfast: Punjabi Tandoori Tikka, Los Angeles, Average Cost: $47 x 2 = $94\nAttraction: Universal Studios Hollywood, Los Angeles, Cost: $0 (Assuming no entrance fee)\nLunch: Cafe Coffee Day, Los Angeles, Average Cost: $71 x 2 = $142\nAttraction: - (Assuming time will be spent preparing for the flight), Cost: $0\nDinner: - (Assuming dinner will be had after arriving in Salt Lake City or during the flight), Cost: $0\nAccommodation: - (Returning to home city), Cost: $0\n\nTotal cost for Day 7: $94 (Breakfast) + $142 (Lunch) + $300 (Flight) = $536\n\nThe total cost of this trip is the sum of the cost from day 1 to day 7. It is $1399 + $857 + $1155 + $1041 + $1034 + $758 + $536 = $6770\n\nUnfortunately, the total cost of $6770 exceeds the budget of $4600. To adjust the plan to fit the budget, we would need to make some changes, such as selecting more affordable accommodations, dining options, or adjusting the transportation method. However, as per the query, we are not considering self-driving and we require private rooms where smoking is permitted, which limits our options for cost-cutting.", "gpt-4-1106-preview_direct_sole-planning_parsed_results": [{"day": 1, "current_city": "from Salt Lake City to San Diego", "transportation": "Flight Number: F3499966, from Salt Lake City to San Diego, Departure Time: 08:02, Arrival Time: 08:55", "breakfast": "-", "attraction": "Cabrillo National Monument, San Diego;", "lunch": "Open Yard, San Diego", "dinner": "Jetha Lal Ka Dhabha, San Diego", "accommodation": "Spacious Room in Large 2 Bedroom Prewar Apartment, San Diego"}, {"day": 2, "current_city": "San Diego", "transportation": "-", "breakfast": "The Lost Mughal, San Diego", "attraction": "La Jolla Shores Park, San Diego; California Tower, San Diego;", "lunch": "Burger King, San Diego", "dinner": "Bikaner Sweets, San Diego", "accommodation": "Spacious Room in Large 2 Bedroom Prewar Apartment, San Diego"}, {"day": 3, "current_city": "from San Diego to San Luis Obispo", "transportation": "Flight Number: F3820181, from San Diego to San Luis Obispo, Departure Time: 09:59, Arrival Time: 11:02", "breakfast": "-", "attraction": "San Luis Obispo Children's Museum, San Luis Obispo;", "lunch": "Ooma, San Luis Obispo", "dinner": "Sushi Leblon, San Luis Obispo", "accommodation": "Upper West Side 1 bedroom, San Luis Obispo"}, {"day": 4, "current_city": "San Luis Obispo", "transportation": "-", "breakfast": "El Jalisciense Mexican Restaurant, San Luis Obispo", "attraction": "Mission Plaza, San Luis Obispo; San Luis Obispo Railroad Museum, San Luis Obispo;", "lunch": "Najmat Lahore Restaurant, San Luis Obispo", "dinner": "Da Pizza Zone, San Luis Obispo", "accommodation": "Upper West Side 1 bedroom, San Luis Obispo"}, {"day": 5, "current_city": "from San Luis Obispo to Los Angeles", "transportation": "Flight Number: F3854130, from San Luis Obispo to Los Angeles, Departure Time: 05:53, Arrival Time: 06:55", "breakfast": "-", "attraction": "Santa Monica Pier, Los Angeles; Hollywood Walk of Fame, Los Angeles;", "lunch": "Heat - Edsa Shangri-La, Los Angeles", "dinner": "Palmshore, Los Angeles", "accommodation": "Sunny apartment with easy connections to anywhere, Los Angeles"}, {"day": 6, "current_city": "Los Angeles", "transportation": "-", "breakfast": "Punjabi Zaika, Los Angeles", "attraction": "Hollywood Sign, Los Angeles; The Getty, Los Angeles;", "lunch": "The Hangout by 1861, Los Angeles", "dinner": "Chicken Minar, Los Angeles", "accommodation": "Sunny apartment with easy connections to anywhere, Los Angeles"}, {"day": 7, "current_city": "from Los Angeles to Salt Lake City", "transportation": "Flight Number: F3528613, from Los Angeles to Salt Lake City, Departure Time: 11:14, Arrival Time: 13:55", "breakfast": "Choco Kraft, Los Angeles", "attraction": "-", "lunch": "-", "dinner": "-", "accommodation": "-"}]}]