[{"gpt-4-1106-preview_direct_sole-planning_results": "Travel Plan:\n\nDay 1: March 8, 2022\nCurrent City: from Minneapolis to Belleville\nTransportation: Self-driving from Minneapolis to Belleville, duration: 8 hours 48 mins, distance: 927 km, cost: $46 x 2 participants = $92\nBreakfast: - (Assuming travelers will have breakfast before departure), Cost $0\nAttraction: Labor & Industrial Museum, Belleville, Cost $0 (Assuming no entrance fee)\nLunch: Fuji Japanese Steak House, Belleville, Average Cost $70 x 2 participants = $140\nDinner: Romi da Dhaba, Belleville, Average Cost $24 x 2 participants = $48\nAccommodation: studio for your own, Belleville, price $773, minimum nights 3, child-friendly (No visitors rule), Cost $773\n\nTotal cost for Day 1: $92 + $140 + $48 + $773 = $1053\n\nDay 2: March 9, 2022\nCurrent City: Belleville\nTransportation: -, Cost $0\nBreakfast: Cafe Amaretto, Belleville, Average Cost $35 x 2 participants = $70\nAttraction: National Shrine of Our Lady of the Snows, Belleville, Cost $0 (Assuming no entrance fee)\nLunch: Summer Pavilion, Belleville, Average Cost $150 x 2 participants = $300\nDinner: Asian Haus, Belleville, Average Cost $87 x 2 participants = $174\nAccommodation: studio for your own, Belleville, Cost $773 (from Day 1)\n\nTotal cost for Day 2: $70 + $300 + $174 + $773 = $1317\n\nDay 3: March 10, 2022\nCurrent City: Belleville\nTransportation: -, Cost $0\nBreakfast: Baking Bad, Belleville, Average Cost $99 x 2 participants = $198\nAttraction: Belleville Square, Belleville, Cost $0 (Assuming no entrance fee)\nLunch: Shanghai Cafe, Belleville, Average Cost $96 x 2 participants = $192\nDinner: Kylin Experience, Belleville, Average Cost $11 x 2 participants = $22\nAccommodation: studio for your own, Belleville, Cost $773 (from Day 1)\n\nTotal cost for Day 3: $198 + $192 + $22 + $773 = $1185\n\nDay 4: March 11, 2022\nCurrent City: from Belleville to Chicago\nTransportation: Self-driving from Belleville to Chicago, duration: 4 hours 36 mins, distance: 474 km, cost: $23 x 2 participants = $46\nBreakfast: - (Assuming breakfast at accommodation), Cost $0\nAttraction: Navy Pier, Chicago, Cost $0 (Assuming no entrance fee)\nLunch: Pantry d'or, Chicago, Average Cost $53 x 2 participants = $106\nDinner: Bro's Kitchenette, Chicago, Average Cost $38 x 2 participants = $76\nAccommodation: Beautiful 1 BR by Prospect Park, Chicago, price $328, minimum nights 5, child-friendly (No visitors & No children under 10 rule), Cost $328\n\nTotal cost for Day 4: $46 + $106 + $76 + $328 = $556\n\nDay 5: March 12, 2022\nCurrent City: Chicago\nTransportation: -, Cost $0\nBreakfast: Starbucks, Chicago, Average Cost $46 x 2 participants = $92\nAttraction: Millennium Park, Chicago, Cost $0 (Assuming no entrance fee)\nLunch: Mini's Royal Cafe, Chicago, Average Cost $72 x 2 participants = $144\nDinner: Pizza Hut, Chicago, Average Cost $99 x 2 participants = $198\nAccommodation: Beautiful 1 BR by Prospect Park, Chicago, Cost $328 (from Day 4)\n\nTotal cost for Day 5: $92 + $144 + $198 + $328 = $762\n\nDay 6: March 13, 2022\nCurrent City: from Chicago to Rockford\nTransportation: Self-driving from Chicago to Rockford, duration: 1 hour 32 mins, distance: 143 km, cost: $7 x 2 participants = $14\nBreakfast: - (Assuming breakfast at accommodation), Cost $0\nAttraction: Anderson Japanese Gardens, Rockford, Cost $0 (Assuming no entrance fee)\nLunch: Coco Bambu, Rockford, Average Cost $72 x 2 participants = $144\nDinner: Flying Mango, Rockford, Average Cost $20 x 2 participants = $40\nAccommodation: Park Side Zen Home - Terrace & next to CentralPark, Rockford, price $250, minimum nights 3, child-friendly (No children under 10 rule), Cost $250\n\nTotal cost for Day 6: $14 + $144 + $40 + $250 = $448\n\nDay 7: March 14, 2022\nCurrent City: from Rockford to Minneapolis\nTransportation: Self-driving from Rockford to Minneapolis, duration: 5 hours 3 mins, distance: 540 km, cost: $27 x 2 participants = $54\nBreakfast: - (Assuming breakfast at accommodation), Cost $0\nAttraction: Burpee Museum of Natural History, Rockford, Cost $0 (Assuming no entrance fee)\nLunch: Gajalee Sea Food, Rockford, Average Cost $49 x 2 participants = $98\nDinner: - (Assuming travelers will have dinner after arrival in Minneapolis), Cost $0\nAccommodation: -, Cost $0\n\nTotal cost for Day 7: $54 + $98 = $152\n\nThe total cost of this trip is the sum of the costs from Day 1 to Day 7: $1053 + $1317 + $1185 + $556 + $762 + $448 + $152 = $5473\n\nThe total cost of $5473 is within the required budget of $8100.", "gpt-4-1106-preview_direct_sole-planning_parsed_results": [{"day": 1, "current_city": "from Minneapolis to Belleville", "transportation": "Self-driving, from Minneapolis to Belleville, Duration: 8 hours 48 mins, Distance: 927 km, Cost: 46", "breakfast": "-", "attraction": "Labor & Industrial Museum, Belleville;", "lunch": "Fuji Japanese Steak House, Belleville", "dinner": "Cafe Amaretto, Belleville", "accommodation": "studio for your own, Belleville"}, {"day": 2, "current_city": "Belleville", "transportation": "-", "breakfast": "Summer Pavilion, Belleville", "attraction": "St. Clair County Historical Society, Belleville;Old Brewery District Mural, Belleville;", "lunch": "Kylin Experience, Belleville", "dinner": "Asian Haus, Belleville", "accommodation": "studio for your own, Belleville"}, {"day": 3, "current_city": "from Belleville to Chicago", "transportation": "Self-driving, from Belleville to Chicago, Duration: 4 hours 36 mins, Distance: 474 km, Cost: 23", "breakfast": "-", "attraction": "Navy Pier, Chicago;", "lunch": "Pantry d'or, Chicago", "dinner": "Bro's Kitchenette, Chicago", "accommodation": "Beautiful 1 BR by Prospect Park, Chicago"}, {"day": 4, "current_city": "Chicago", "transportation": "-", "breakfast": "Mini's Royal Cafe, Chicago", "attraction": "Skydeck Chicago, Chicago;Millennium Park, Chicago;", "lunch": "Pizza Hut, Chicago", "dinner": "Gyan Vaishnav, Chicago", "accommodation": "Beautiful 1 BR by Prospect Park, Chicago"}, {"day": 5, "current_city": "from Chicago to Rockford", "transportation": "Self-driving, from Chicago to Rockford, Duration: 1 hour 32 mins, Distance: 143 km, Cost: 7", "breakfast": "-", "attraction": "Burpee Museum of Natural History, Rockford;", "lunch": "Coco Bambu, Rockford", "dinner": "Flying Mango, Rockford", "accommodation": "Park Side Zen Home - Terrace & next to CentralPark, Rockford"}, {"day": 6, "current_city": "Rockford", "transportation": "-", "breakfast": "Gajalee Sea Food, Rockford", "attraction": "Anderson Japanese Gardens, Rockford;Discovery Center Museum, Rockford;", "lunch": "Moets Arabica, Rockford", "dinner": "Cafe Coffee Day, Rockford", "accommodation": "Park Side Zen Home - Terrace & next to CentralPark, Rockford"}, {"day": 7, "current_city": "from Rockford to Minneapolis", "transportation": "Self-driving, from Rockford to Minneapolis, Duration: 5 hours 3 mins, Distance: 540 km, Cost: 27", "breakfast": "-", "attraction": "-", "lunch": "-", "dinner": "-", "accommodation": "-"}]}]