[{"gpt-4-1106-preview_direct_sole-planning_results": "Travel Plan:\n\nDay 1: March 25th\nCurrent City: from Jacksonville to Detroit\nTransportation: Flight Number: F3553781, from Jacksonville to Detroit, Departure Time: 12:10, Arrival Time: 14:15, Cost: $178\nLunch: Southern Bliss Bakery, Detroit, Cost: $28\nAttraction: Detroit Institute of Arts, Detroit, Cost: $0 (assuming free entry or included in a city pass)\nDinner: A Dong Restaurant, Detroit, Cost: $40\nAccommodation: Comfy King Bed Feet from Subway, Detroit, Cost: $568 (3-night minimum stay)\n\nTotal cost for Day 1: $178 (flight) + $28 (lunch) + $0 (attraction) + $40 (dinner) + $568 (accommodation) = $814\n\nDay 2: March 26th\nCurrent City: Detroit\nTransportation: -, Cost: $0\nBreakfast: BMG - All Day Dining, Detroit, Cost: $15\nAttraction: Detroit Historical Museum, Detroit, Cost: $0 (assuming free entry or included in a city pass)\nLunch: Cafe And More, Detroit, Cost: $41\nAttraction: Motown Museum, Detroit, Cost: $0 (assuming free entry or included in a city pass)\nDinner: Chye Seng Huat Hardware, Detroit, Cost: $94\nAccommodation: Comfy King Bed Feet from Subway, Detroit, Cost: $568\n\nTotal cost for Day 2: $15 (breakfast) + $0 (attractions) + $41 (lunch) + $94 (dinner) + $568 (accommodation) = $718\n\nDay 3: March 27th\nCurrent City: Detroit\nTransportation: -, Cost: $0\nBreakfast: Mitalis Kitchen, Detroit, Cost: $28\nAttraction: Belle Isle Aquarium, Detroit, Cost: $0 (assuming free entry or included in a city pass)\nLunch: The Dosa King, Detroit, Cost: $69\nAttraction: Michigan Science Center, Detroit, Cost: $0 (assuming free entry or included in a city pass)\nDinner: Vapour Pub & Brewery, Detroit, Cost: $80\nAccommodation: Comfy King Bed Feet from Subway, Detroit, Cost: $568\n\nTotal cost for Day 3: $28 (breakfast) + $0 (attractions) + $69 (lunch) + $80 (dinner) + $568 (accommodation) = $745\n\nDay 4: March 28th\nCurrent City: from Detroit to Lansing\nTransportation: Flight Number: F3656087, from Detroit to Lansing, Departure Time: 10:10, Arrival Time: 10:46, Cost: $27\nBreakfast: Southern Bliss Bakery, Detroit, Cost: $28 (before departure)\nAttraction: Impression 5 Science Center, Lansing, Cost: $0 (assuming free entry or included in a city pass)\nLunch: Manuel's Bread Cafe, Lansing, Cost: $28\nAttraction: Potter Park Zoo, Lansing, Cost: $0 (assuming free entry or included in a city pass)\nDinner: Front Street Brewery, Lansing, Cost: $25\nAccommodation: 2 bedroom apartment in harlem, Lansing, Cost: $943 (1-night stay)\n\nTotal cost for Day 4: $27 (flight) + $28 (breakfast) + $0 (attractions) + $28 (lunch) + $25 (dinner) + $943 (accommodation) = $1051\n\nDay 5: March 29th\nCurrent City: from Lansing to Jacksonville\nTransportation: Self-driving, from Lansing to Jacksonville, duration: 15 hours 55 mins, distance: 1,704 km, Cost: $85\nBreakfast: Huey's On The River, Lansing, Cost: $75\nAttraction: Michigan History Center, Lansing, Cost: $0 (assuming free entry or included in a city pass)\nLunch: Golden China, Lansing, Cost: $66\nDinner: - (Assuming dinner will be back in Jacksonville or on the road, not included in the cost)\n\nTotal cost for Day 5: $85 (transportation) + $75 (breakfast) + $0 (attraction) + $66 (lunch) = $226\n\nThe total cost of this trip is the sum of the costs from Day 1 to Day 5: $814 + $718 + $745 + $1051 + $226 = $3554\n\nThis total cost of $3554 is within the budget of $4600. Please note that attraction costs are assumed to be free or included in a city pass, and the accommodation in Detroit has a 3-night minimum stay, which has been factored into the plan.", "gpt-4-1106-preview_direct_sole-planning_parsed_results": [{"day": 1, "current_city": "from Jacksonville to Detroit", "transportation": "Flight Number: F3553781, from Jacksonville to Detroit, Departure Time: 12:10, Arrival Time: 14:15", "breakfast": "-", "attraction": "Detroit Institute of Arts, Detroit", "lunch": "Southern Bliss Bakery, Detroit", "dinner": "A Dong Restaurant, Detroit", "accommodation": "Cozy 1 bedroom in the heart of Fort Greene, Detroit"}, {"day": 2, "current_city": "Detroit", "transportation": "-", "breakfast": "BMG - All Day Dining, Detroit", "attraction": "Detroit Historical Museum, Detroit;Campus Martius Park, Detroit;", "lunch": "Cafe And More, Detroit", "dinner": "Chye Seng Huat Hardware, Detroit", "accommodation": "Cozy 1 bedroom in the heart of Fort Greene, Detroit"}, {"day": 3, "current_city": "from Detroit to Lansing", "transportation": "Flight Number: F3656087, from Detroit to Lansing, Departure Time: 10:10, Arrival Time: 10:46", "breakfast": "-", "attraction": "Impression 5 Science Center, Lansing;Potter Park Zoo, Lansing;", "lunch": "Manuel's Bread Cafe, Lansing", "dinner": "Front Street Brewery, Lansing", "accommodation": "Brand New Amazing 1 Bedroom Best Location, Lansing"}, {"day": 4, "current_city": "Lansing", "transportation": "-", "breakfast": "Nini's Kitchen, Lansing", "attraction": "Michigan History Center, Lansing;Hawk Island Park, Lansing;", "lunch": "Huey's On The River, Lansing", "dinner": "Golden China, Lansing", "accommodation": "Brand New Amazing 1 Bedroom Best Location, Lansing"}, {"day": 5, "current_city": "from Lansing to Jacksonville", "transportation": "Self-driving, from Lansing to Jacksonville, duration: 15 hours 55 mins, distance: 1704 km, Cost: 85", "breakfast": "-", "attraction": "-", "lunch": "-", "dinner": "-", "accommodation": "-"}]}]