[{"gpt-4-1106-preview_direct_sole-planning_results": "Travel Plan:\n\nDay 1: March 5th, 2022\nCurrent City: from West Palm Beach to White Plains\nTransportation: Flight Number: F3756085, from West Palm Beach to White Plains, Departure Time: 05:58, Arrival Time: 08:48, Cost: $515 x 2 = $1030\nBreakfast: - (Assuming breakfast will be on the flight or before departure), Cost: $0\nAttraction: LEGOLAND Discovery Center Westchester, White Plains, Cost: $0 (Assuming free entry or covered by a city pass)\nLunch: El Cazador, White Plains, Average Cost: $90 x 2 = $180\nDinner: Kinoshita, White Plains, Average Cost: $42 x 2 = $84\nAccommodation: Large Opulent Studio Apartment Near Prospect Park, White Plains, Cost: $465 x 1 night = $465\n\nTotal cost for Day 1: $1030 (Transportation) + $0 (Breakfast) + $0 (Attraction) + $180 (Lunch) + $84 (Dinner) + $465 (Accommodation) = $1759\n\nDay 2: March 6th, 2022\nCurrent City: White Plains\nTransportation: -, Cost: $0\nBreakfast: Six Pack Kitchen, White Plains, Average Cost: $58 x 2 = $116\nAttraction: Kensico Dam Plaza, White Plains, Cost: $0 (Assuming free entry or covered by a city pass)\nLunch: El Kiosco Mexican Restaurant, White Plains, Average Cost: $65 x 2 = $130\nDinner: Pan Asian - Sheraton New Delhi Hotel, White Plains, Average Cost: $72 x 2 = $144\nAccommodation: Large Opulent Studio Apartment Near Prospect Park, White Plains, Cost: $465 x 1 night = $465\n\nTotal cost for Day 2: $0 (Transportation) + $116 (Breakfast) + $0 (Attraction) + $130 (Lunch) + $144 (Dinner) + $465 (Accommodation) = $855\n\nDay 3: March 7th, 2022\nCurrent City: from White Plains to West Palm Beach\nTransportation: Flight Number: F3755565, from White Plains to West Palm Beach, Departure Time: 09:45, Arrival Time: 13:10, Cost: $331 x 2 = $662\nBreakfast: - (Assuming breakfast at the accommodation or before the flight), Cost: $0\nAttraction: - (No time for attractions due to travel), Cost: $0\nLunch: - (Assuming lunch on the flight or after arrival), Cost: $0\nDinner: - (Assuming dinner after arrival in West Palm Beach), Cost: $0\nAccommodation: -, Cost: $0\n\nTotal cost for Day 3: $662 (Transportation) + $0 (Breakfast) + $0 (Attraction) + $0 (Lunch) + $0 (Dinner) + $0 (Accommodation) = $662\n\nThe total cost of this trip is the sum of the costs from Day 1, Day 2, and Day 3. It is $1759 + $855 + $662 = $3276\n\nHowever, the total cost exceeds the budget of $2600. To adjust the plan within the budget, we need to make some changes:\n\n- Choose the cheapest flight option for Day 1: Flight Number: F3765519, Cost: $281 x 2 = $562\n- Adjust accommodation to a more affordable option if available or reduce the number of nights if the minimum stay allows.\n\nRevised Day 1 Transportation Cost: $562\nRevised Total Cost: $562 (Day 1 Transportation) + $855 (Day 2) + $662 (Day 3) = $2079\n\nNow the total cost of the trip is within the budget of $2600. Please note that attraction costs are assumed to be free or covered by a city pass, and meals not mentioned are assumed to be included in the flight or accommodation. Adjustments to the plan may be necessary if these assumptions do not hold true.", "gpt-4-1106-preview_direct_sole-planning_parsed_results": [{"day": 1, "current_city": "from West Palm Beach to White Plains", "transportation": "Flight Number: F3756085, from West Palm Beach to White Plains, Departure Time: 05:58, Arrival Time: 08:48", "breakfast": "-", "attraction": "Kensico Dam Plaza, White Plains;", "lunch": "El Cazador, White Plains", "dinner": "Kinoshita, White Plains", "accommodation": "Large Opulent Studio Apartment Near Prospect Park, White Plains"}, {"day": 2, "current_city": "White Plains", "transportation": "-", "breakfast": "Six Pack Kitchen, White Plains", "attraction": "Neuberger Museum of Art, White Plains;", "lunch": "El Kiosco Mexican Restaurant, White Plains", "dinner": "Pan Asian - Sheraton New Delhi Hotel, White Plains", "accommodation": "Large Opulent Studio Apartment Near Prospect Park, White Plains"}, {"day": 3, "current_city": "from White Plains to West Palm Beach", "transportation": "Flight Number: F3759006, from White Plains to West Palm Beach, Departure Time: 15:51, Arrival Time: 18:41", "breakfast": "Saffron Mantra, White Plains", "attraction": "LEGOLAND Discovery Center Westchester, White Plains;", "lunch": "Mughals Rasoi, White Plains", "dinner": "-", "accommodation": "-"}]}]