[{"gpt-4-1106-preview_direct_sole-planning_results": "Travel Plan:\n\nDay 1: March 15, 2022\nCurrent City: from Washington to Norfolk\nTransportation: Flight Number: F3785353, from Washington to Norfolk, Departure Time: 08:30, Arrival Time: 09:18, Cost: $63\nBreakfast: - (Assuming breakfast is had before departure or during the flight), Cost: $0\nAttraction: Norfolk Botanical Garden, Norfolk, Cost: $0 (Assuming free entry or covered by a city pass)\nLunch: Sonya Bakery Cafe, Norfolk, Average Cost: $32\nDinner: Henry Campbell's Steakhouse, Norfolk, Average Cost: $83\nAccommodation: Airports Sleep Inn, Norfolk, Cost: $697 (3 nights minimum stay)\n\nTotal cost for Day 1: $63 (Flight) + $32 (Lunch) + $83 (Dinner) + $697 (Accommodation) = $875\n\nDay 2: March 16, 2022\nCurrent City: Norfolk\nTransportation: -, Cost: $0\nBreakfast: Game n Grillz, Norfolk, Average Cost: $59\nAttraction: Nauticus, Norfolk, Cost: $0 (Assuming free entry or covered by a city pass)\nLunch: Amber, Norfolk, Average Cost: $36\nDinner: Jonathan's Kitchen - Holiday Inn Express & Suites, Norfolk, Average Cost: $44\nAccommodation: Airports Sleep Inn, Norfolk (already paid for)\n\nTotal cost for Day 2: $59 (Breakfast) + $36 (Lunch) + $44 (Dinner) = $139\n\nDay 3: March 17, 2022\nCurrent City: from Norfolk to Lynchburg\nTransportation: Self-driving, from Norfolk to Lynchburg, Cost: $15\nBreakfast: Lokenath Sweets, Norfolk, Average Cost: $15\nAttraction: Amazement Square, Lynchburg, Cost: $0 (Assuming free entry or covered by a city pass)\nLunch: Uptown Vietnam cuisine, Lynchburg, Average Cost: $63\nDinner: The BrewMaster, Lynchburg, Average Cost: $87\nAccommodation: Design Hideaway in a Classic Brooklyn Townhouse, Lynchburg, Cost: $216 (4 nights minimum stay)\n\nTotal cost for Day 3: $15 (Transportation) + $15 (Breakfast) + $63 (Lunch) + $87 (Dinner) + $216 (Accommodation) = $396\n\nDay 4: March 18, 2022\nCurrent City: Lynchburg\nTransportation: -, Cost: $0\nBreakfast: Khyen Chyen, Lynchburg, Average Cost: $30\nAttraction: Point of Honor, Lynchburg, Cost: $0 (Assuming free entry or covered by a city pass)\nLunch: Mochamania, Lynchburg, Average Cost: $87\nDinner: Pirates Of Grill, Lynchburg, Average Cost: $71\nAccommodation: Design Hideaway in a Classic Brooklyn Townhouse, Lynchburg (already paid for)\n\nTotal cost for Day 4: $30 (Breakfast) + $87 (Lunch) + $71 (Dinner) = $188\n\nDay 5: March 19, 2022\nCurrent City: from Lynchburg to Washington\nTransportation: Self-driving, from Lynchburg to Washington, Cost: $14\nBreakfast: Bean Here, Lynchburg, Average Cost: $74\nAttraction: - (Assuming travel time back to Washington), Cost: $0\nLunch: - (Assuming on the road or after arrival), Cost: $0\nDinner: - (Assuming after arrival back in Washington), Cost: $0\nAccommodation: - (End of trip, returning home)\n\nTotal cost for Day 5: $14 (Transportation) + $74 (Breakfast) = $88\n\nThe total cost of this trip is the sum of the costs from Day 1 to Day 5: $875 + $139 + $396 + $188 + $88 = $1686\n\nThis total of $1686 is within the budget of $2,200 for the trip. Please note that attraction costs are assumed to be free or covered by a city pass, and some meals or activities may be adjusted based on actual availability and preferences.", "gpt-4-1106-preview_direct_sole-planning_parsed_results": [{"day": 1, "current_city": "from Washington to Norfolk", "transportation": "Flight Number: F3785353, from Washington to Norfolk, Departure Time: 08:30, Arrival Time: 09:18", "breakfast": "-", "attraction": "Norfolk Botanical Garden, Norfolk;", "lunch": "Henry Campbell's Steakhouse, Norfolk", "dinner": "Sunshine Family Restaurant, Norfolk", "accommodation": "Airports Sleep Inn, Norfolk"}, {"day": 2, "current_city": "Norfolk", "transportation": "-", "breakfast": "Sonya Bakery Cafe, Norfolk", "attraction": "Nauticus, Norfolk;Hampton Roads Naval Museum, Norfolk;", "lunch": "Game n Grillz, Norfolk", "dinner": "Jonathan's Kitchen - Holiday Inn Express & Suites, Norfolk", "accommodation": "Airports Sleep Inn, Norfolk"}, {"day": 3, "current_city": "from Norfolk to Lynchburg", "transportation": "Self-driving, from Norfolk to Lynchburg, duration: 3 hours 27 mins, distance: 306 km, Cost: 15", "breakfast": "-", "attraction": "Amazement Square, Lynchburg;", "lunch": "Uptown Vietnam cuisine, Lynchburg", "dinner": "The BrewMaster, Lynchburg", "accommodation": "Design Hideaway in a Classic Brooklyn Townhouse, Lynchburg"}, {"day": 4, "current_city": "Lynchburg", "transportation": "-", "breakfast": "Khyen Chyen, Lynchburg", "attraction": "Point of Honor, Lynchburg;The Anne Spencer House & Garden Museum, Lynchburg;", "lunch": "Mochamania, Lynchburg", "dinner": "Pirates Of Grill, Lynchburg", "accommodation": "Design Hideaway in a Classic Brooklyn Townhouse, Lynchburg"}, {"day": 5, "current_city": "from Lynchburg to Washington", "transportation": "Self-driving, from Lynchburg to Washington, duration: 3 hours 19 mins, distance: 291 km, Cost: 14", "breakfast": "-", "attraction": "-", "lunch": "-", "dinner": "-", "accommodation": "-"}]}]