[{"gpt-4-1106-preview_direct_sole-planning_results": "Travel Plan:\n\nDay 1: March 21, 2022\nCurrent City: from Milwaukee to Alpena\nTransportation: Self-driving from Milwaukee to Alpena, duration: 7 hours 37 mins, distance: 749 km, cost: $37 x 2 travelers = $74\nBreakfast: - (Assuming travelers will have breakfast before departure)\nLunch: - (Assuming travelers will have lunch on the way)\nDinner: A & A Pagliai's Pizza, Alpena, Average Cost: $72 x 2 travelers = $144\nAccommodation: SINGLE ROOM AVAILABLE IN JAMAICA NEAR JFK & LGA, Alpena, price: $88, minimum nights: 1, allows parties: No (No accommodation allowing parties found, selected the one with private room)\nTotal cost for Day 1: $74 (Transportation) + $144 (Dinner) + $88 (Accommodation) = $306\n\nDay 2: March 22, 2022\nCurrent City: Alpena\nTransportation: -, Cost: $0\nBreakfast: @Mango, Alpena, Average Cost: $38 x 2 travelers = $76\nAttraction: Great Lakes Maritime Heritage Center, Alpena, Cost: Free\nLunch: Shudh Restaurant, Alpena, Average Cost: $56 x 2 travelers = $112\nDinner: Maplai, Alpena, Average Cost: $63 x 2 travelers = $126\nAccommodation: SINGLE ROOM AVAILABLE IN JAMAICA NEAR JFK & LGA, Alpena, price: $88\nTotal cost for Day 2: $76 (Breakfast) + $112 (Lunch) + $126 (Dinner) + $88 (Accommodation) = $402\n\nDay 3: March 23, 2022\nCurrent City: from Alpena to Kalamazoo\nTransportation: Self-driving from Alpena to Kalamazoo, duration: 4 hours 33 mins, distance: 464 km, cost: $23 x 2 travelers = $46\nBreakfast: Zaffran - The Bristol Hotel, Alpena, Average Cost: $33 x 2 travelers = $66\nLunch: - (Assuming travelers will have lunch on the way)\nDinner: Django, Kalamazoo, Average Cost: $65 x 2 travelers = $130\nAccommodation: Apartment in Ridgewood/Bushwick Neighborhood, Kalamazoo, price: $152, minimum nights: 2, allows parties: No (No accommodation allowing parties found, selected the one with private room)\nTotal cost for Day 3: $46 (Transportation) + $66 (Breakfast) + $130 (Dinner) + $152 (Accommodation) = $394\n\nDay 4: March 24, 2022\nCurrent City: Kalamazoo\nTransportation: -, Cost: $0\nBreakfast: Giulios Greek & Italian Restaurant, Kalamazoo, Average Cost: $76 x 2 travelers = $152\nAttraction: Kalamazoo Valley Museum, Kalamazoo, Cost: Free\nLunch: Cha cTea, Kalamazoo, Average Cost: $77 x 2 travelers = $154\nDinner: Taco Bell, Kalamazoo, Average Cost: $54 x 2 travelers = $108\nAccommodation: Apartment in Ridgewood/Bushwick Neighborhood, Kalamazoo, price: $152\nTotal cost for Day 4: $152 (Breakfast) + $154 (Lunch) + $108 (Dinner) + $152 (Accommodation) = $566\n\nDay 5: March 25, 2022\nCurrent City: from Kalamazoo to Milwaukee\nTransportation: Self-driving from Kalamazoo to Milwaukee, duration: 3 hours 45 mins, distance: 382 km, cost: $19 x 2 travelers = $38\nBreakfast: Oxy Lounge, Kalamazoo, Average Cost: $65 x 2 travelers = $130\nLunch: - (Assuming travelers will have lunch on the way)\nDinner: - (Assuming travelers will have dinner upon arrival back home)\nAccommodation: - (Travelers will return home)\nTotal cost for Day 5: $38 (Transportation) + $130 (Breakfast) = $168\n\nThe total cost of this trip is the sum of the costs from day 1, day 2, day 3, day 4, and day 5. It is $306 + $402 + $394 + $566 + $168 = $1836\n\nUnfortunately, the total cost of $1836 exceeds the budget of $1700. To stay within budget, adjustments would need to be made, such as selecting more affordable restaurants or reducing the number of attractions visited.", "gpt-4-1106-preview_direct_sole-planning_parsed_results": [{"day": 1, "current_city": "from Milwaukee to Alpena", "transportation": "Self-driving, from Milwaukee to Alpena, Duration: 7 hours 37 mins, Distance: 749 km, Cost: 37", "breakfast": "-", "attraction": "-", "lunch": "-", "dinner": "-", "accommodation": "Ultimate 50th Floor Downtown Penthouse - 4000SqFt, Alpena"}, {"day": 2, "current_city": "Alpena", "transportation": "-", "breakfast": "A & A Pagliai's Pizza, Alpena", "attraction": "Great Lakes Maritime Heritage Center, Alpena", "lunch": "@Mango, Alpena", "dinner": "Shudh Restaurant, Alpena", "accommodation": "Ultimate 50th Floor Downtown Penthouse - 4000SqFt, Alpena"}, {"day": 3, "current_city": "from Alpena to Kalamazoo", "transportation": "Self-driving, from Alpena to Kalamazoo, Duration: 4 hours 33 mins, Distance: 464 km, Cost: 23", "breakfast": "-", "attraction": "Besser Museum for Northeast Michigan, Alpena", "lunch": "-", "dinner": "-", "accommodation": "East 63rd street, Studio Serviced Apartment, Kalamazoo"}, {"day": 4, "current_city": "Kalamazoo", "transportation": "-", "breakfast": "Django, Kalamazoo", "attraction": "Kalamazoo Valley Museum, Kalamazoo", "lunch": "Giulios Greek & Italian Restaurant, Kalamazoo", "dinner": "Cha cTea, Kalamazoo", "accommodation": "East 63rd street, Studio Serviced Apartment, Kalamazoo"}, {"day": 5, "current_city": "from Kalamazoo to Milwaukee", "transportation": "Self-driving, from Kalamazoo to Milwaukee, Duration: 3 hours 45 mins, Distance: 382 km, Cost: 19", "breakfast": "-", "attraction": "Kalamazoo Institute of Arts, Kalamazoo", "lunch": "-", "dinner": "-", "accommodation": "-"}]}]