[{"gpt-4-1106-preview_direct_sole-planning_results": "Travel Plan:\n\nDay 1: March 18, 2022\nCurrent City: from Charlotte to Marquette\nTransportation: Self-driving from Charlotte to Marquette, Duration: 13 hours 1 min, Distance: 1,371 km, Cost: $68 x 2 = $136\nBreakfast: - (Assuming travelers will have breakfast before departure), Cost: $0\nLunch: - (Assuming travelers will pack lunch for the road), Cost: $0\nDinner: The Chop House, Marquette, Average Cost: $81 x 2 = $162\nAccommodation: Huge Private Room Near Prospect Park, Marquette, Price: $73, Room Type: Private room, Minimum Nights: 7, Child-Friendly: Yes (No smoking & No visitors), Cost: $73 x 2 = $146 (since it's a per night cost and we need to book for 2 nights to meet the minimum stay requirement)\nTotal cost for Day 1: $136 (Transportation) + $162 (Dinner) + $146 (Accommodation) = $444\n\nDay 2: March 19, 2022\nCurrent City: Marquette\nTransportation: -, Cost: $0\nBreakfast: Taste of Balingup, Marquette, Average Cost: $35 x 2 = $70\nAttraction: Presque Isle Park, Marquette, Cost: $0 (Assuming no entry fee)\nLunch: Dovetail, Marquette, Average Cost: $95 x 2 = $190\nDinner: Ifthar, Marquette, Average Cost: $67 x 2 = $134\nAccommodation: Huge Private Room Near Prospect Park, Marquette (Continued from Day 1), Cost: $0 (Already accounted for in Day 1)\nTotal cost for Day 2: $70 (Breakfast) + $190 (Lunch) + $134 (Dinner) = $394\n\nDay 3: March 20, 2022\nCurrent City: from Marquette to Milwaukee\nTransportation: Self-driving from Marquette to Milwaukee, Duration: 6 mins, Distance: 2.0 km, Cost: $0 (Assuming this is a mistake in the reference data and the actual travel is longer, but we'll use the provided cost)\nBreakfast: Annapurna Sweet House, Marquette, Average Cost: $36 x 2 = $72\nLunch: - (Assuming travelers will pack lunch for the road), Cost: $0\nDinner: Cool Basil, Milwaukee, Average Cost: $40 x 2 = $80\nAccommodation: Spacious 1 Bedroom in Midwood, BK!, Milwaukee, Price: $1125, Room Type: Private room, Minimum Nights: 1, Child-Friendly: Yes (No children under 10), Cost: $1125\nTotal cost for Day 3: $72 (Breakfast) + $80 (Dinner) + $1125 (Accommodation) = $1277\n\nDay 4: March 21, 2022\nCurrent City: Milwaukee\nTransportation: -, Cost: $0\nBreakfast: Berco's, Milwaukee, Average Cost: $91 x 2 = $182\nAttraction: Milwaukee Art Museum, Milwaukee, Cost: $0 (Assuming no entry fee)\nLunch: Frontier, Milwaukee, Average Cost: $13 x 2 = $26\nDinner: Shankar Sweets, Milwaukee, Average Cost: $66 x 2 = $132\nAccommodation: Spacious 1 Bedroom in Midwood, BK!, Milwaukee (Continued from Day 3), Cost: $0 (Already accounted for in Day 3)\nTotal cost for Day 4: $182 (Breakfast) + $26 (Lunch) + $132 (Dinner) = $340\n\nDay 5: March 22, 2022\nCurrent City: from Milwaukee to Charlotte\nTransportation: Self-driving from Milwaukee to Charlotte, Duration: 12 hours 58 mins, Distance: 1,369 km, Cost: $68 x 2 = $136\nBreakfast: Subway, Milwaukee, Average Cost: $48 x 2 = $96\nLunch: - (Assuming travelers will pack lunch for the road), Cost: $0\nDinner: - (Assuming travelers will have dinner upon arrival in Charlotte), Cost: $0\nAccommodation: - (Returning to Charlotte), Cost: $0\nTotal cost for Day 5: $136 (Transportation) + $96 (Breakfast) = $232\n\nThe total cost of this trip is the sum of the costs from Day 1, Day 2, Day 3, Day 4, and Day 5. It is $444 + $394 + $1277 + $340 + $232 = $2687\n\nUnfortunately, the total cost of $2687 exceeds the budget of $2500. To adjust the plan to fit the budget, we may need to choose more affordable restaurants or find cheaper accommodation options. Please advise on which aspects of the trip you would prefer to adjust.", "gpt-4-1106-preview_direct_sole-planning_parsed_results": [{"day": 1, "current_city": "from Charlotte to Marquette", "transportation": "Self-driving from Charlotte to Marquette, Duration: 13 hours 1 min, Distance: 1371 km, Cost: 68", "breakfast": "-", "attraction": "-", "lunch": "-", "dinner": "The Chop House, Marquette", "accommodation": "Huge Private Room Near Prospect Park, Marquette"}, {"day": 2, "current_city": "Marquette", "transportation": "-", "breakfast": "Taste of Balingup, Marquette", "attraction": "Presque Isle Park, Marquette;Upper Peninsula Children's Museum, Marquette;", "lunch": "Ifthar, Marquette", "dinner": "Annapurna Sweet House, Marquette", "accommodation": "Huge Private Room Near Prospect Park, Marquette"}, {"day": 3, "current_city": "from Marquette to Milwaukee", "transportation": "Taxi from Marquette to Milwaukee, Duration: 6 mins, Distance: 2.0 km, Cost: 2", "breakfast": "Dovetail, Marquette", "attraction": "Marquette Harbor Lighthouse, Marquette;De Vos Art Museum, Marquette;", "lunch": "Papa Mexicano, Marquette", "dinner": "-", "accommodation": "Delightful & Roomy 1 Bdrm Apt, Milwaukee"}, {"day": 4, "current_city": "Milwaukee", "transportation": "-", "breakfast": "Cool Basil, Milwaukee", "attraction": "Milwaukee Art Museum, Milwaukee;Milwaukee Public Museum, Milwaukee;", "lunch": "Berco's, Milwaukee", "dinner": "Frontier, Milwaukee", "accommodation": "Delightful & Roomy 1 Bdrm Apt, Milwaukee"}, {"day": 5, "current_city": "from Milwaukee to Charlotte", "transportation": "Self-driving from Milwaukee to Charlotte, Duration: 12 hours 58 mins, Distance: 1369 km, Cost: 68", "breakfast": "-", "attraction": "-", "lunch": "-", "dinner": "-", "accommodation": "-"}]}]