[{"gpt-4-1106-preview_direct_sole-planning_results": "Travel Plan:\n\nDay 1: March 8th, 2022\nCurrent City: from Rockford to Gainesville\nTransportation: Self-driving from Rockford to Gainesville, duration: 16 hours 30 mins, distance: 1,822 km, cost: $91 x 8 = $728\nBreakfast: - (Assuming travelers will have breakfast before departure), Cost $0\nAttraction: - (Traveling), Cost $0\nLunch: - (On the road), Cost $0\nDinner: - (On the road), Cost $0\nAccommodation: Spacious yet Cozy Room in Manhattan, Gainesville, price: $566, room type: Entire home/apt, minimum nights: 3, maximum occupancy: 2, cost for 4 rooms (8 people): $566 x 4 = $2264\n\nTotal cost for Day 1: $728 (Transportation) + $2264 (Accommodation) = $2992\n\nDay 2: March 9th, 2022\nCurrent City: Gainesville\nTransportation: -, Cost $0\nBreakfast: The Machine Shed Restaurant, Gainesville, Average Cost $62, Cost for 8 people: $62 x 8 = $496\nAttraction: Florida Museum of Natural History-Exhibits, Gainesville, Cost $0 (assuming free admission)\nLunch: Carnival By Tresind, Gainesville, Average Cost $67, Cost for 8 people: $67 x 8 = $536\nDinner: Parker's, Gainesville, Average Cost $74, Cost for 8 people: $74 x 8 = $592\nAccommodation: Spacious yet Cozy Room in Manhattan, Gainesville, cost for 4 rooms: $2264\n\nTotal cost for Day 2: $496 (Breakfast) + $536 (Lunch) + $592 (Dinner) + $2264 (Accommodation) = $3888\n\nDay 3: March 10th, 2022\nCurrent City: from Gainesville to Daytona Beach\nTransportation: Self-driving from Gainesville to Daytona Beach, duration: 2 hours 2 mins, distance: 158 km, cost: $7 x 8 = $56\nBreakfast: Aggarwal Sweet Corner, Gainesville, Average Cost $70, Cost for 8 people: $70 x 8 = $560\nAttraction: Devil's Millhopper Geological State Park, Gainesville, Cost $0 (assuming free admission)\nLunch: The Food Garage, Gainesville, Average Cost $97, Cost for 8 people: $97 x 8 = $776\nDinner: CHA, Gainesville, Average Cost $84, Cost for 8 people: $84 x 8 = $672\nAccommodation: Homey 1BR in Fun, Central West Village w/ Doorman by Blueground, Daytona Beach, price: $262, room type: Entire home/apt, minimum nights: 30, maximum occupancy: 2, cost for 4 rooms (8 people): $262 x 4 = $1048\n\nTotal cost for Day 3: $56 (Transportation) + $560 (Breakfast) + $776 (Lunch) + $672 (Dinner) + $1048 (Accommodation) = $3112\n\nDay 4: March 11th, 2022\nCurrent City: Daytona Beach\nTransportation: -, Cost $0\nBreakfast: Outback Steakhouse, Daytona Beach, Average Cost $58, Cost for 8 people: $58 x 8 = $464\nAttraction: Daytona Boardwalk Amusements, Daytona Beach, Cost $0 (assuming free admission)\nLunch: Bespoke Harvest, Daytona Beach, Average Cost $56, Cost for 8 people: $56 x 8 = $448\nDinner: Beach Box Cafe, Daytona Beach, Average Cost $96, Cost for 8 people: $96 x 8 = $768\nAccommodation: Homey 1BR in Fun, Central West Village w/ Doorman by Blueground, Daytona Beach, cost for 4 rooms: $1048\n\nTotal cost for Day 4: $464 (Breakfast) + $448 (Lunch) + $768 (Dinner) + $1048 (Accommodation) = $2728\n\nDay 5: March 12th, 2022\nCurrent City: from Daytona Beach to Jacksonville\nTransportation: Self-driving from Daytona Beach to Jacksonville, duration: 1 hour 28 mins, distance: 143 km, cost: $7 x 8 = $56\nBreakfast: Rocks on the River, Daytona Beach, Average Cost $35, Cost for 8 people: $35 x 8 = $280\nAttraction: Daytona Lagoon, Daytona Beach, Cost $0 (assuming free admission)\nLunch: Mom & Dad's Italian Restaurant, Daytona Beach, Average Cost $17, Cost for 8 people: $17 x 8 = $136\nDinner: Khaaja Chowk, Daytona Beach, Average Cost $61, Cost for 8 people: $61 x 8 = $488\nAccommodation: NYC Sanctuary, Skyline Views & Rooftop, Jacksonville, price: $954, room type: Entire home/apt, minimum nights: 3, maximum occupancy: 6, cost for 2 rooms (8 people): $954 x 2 = $1908\n\nTotal cost for Day 5: $56 (Transportation) + $280 (Breakfast) + $136 (Lunch) + $488 (Dinner) + $1908 (Accommodation) = $2868\n\nDay 6: March 13th, 2022\nCurrent City: Jacksonville\nTransportation: -, Cost $0\nBreakfast: Villa Gargano, Jacksonville, Average Cost $51, Cost for 8 people: $51 x 8 = $408\nAttraction: Jacksonville Zoo and Gardens, Jacksonville, Cost $0 (assuming free admission)\nLunch: Pirates' House Restaurant, Jacksonville, Average Cost $59, Cost for 8 people: $59 x 8 = $472\nDinner: Goose Feathers Cafe and Bakery, Jacksonville, Average Cost $57, Cost for 8 people: $57 x 8 = $456\nAccommodation: NYC Sanctuary, Skyline Views & Rooftop, Jacksonville, cost for 2 rooms: $1908\n\nTotal cost for Day 6: $408 (Breakfast) + $472 (Lunch) + $456 (Dinner) + $1908 (Accommodation) = $3244\n\nDay 7: March 14th, 2022\nCurrent City: from Jacksonville to Rockford\nTransportation: Self-driving from Jacksonville to Rockford, duration: 16 hours 42 mins, distance: 1,852 km, cost: $92 x 8 = $736\nBreakfast: Ashoka Restaurant, Jacksonville, Average Cost $11, Cost for 8 people: $11 x 8 = $88\nAttraction: - (Traveling), Cost $0\nLunch: - (On the road), Cost $0\nDinner: - (On the road), Cost $0\nAccommodation: - (Returning home), Cost $0\n\nTotal cost for Day 7: $736 (Transportation) + $88 (Breakfast) = $824\n\nThe total cost of this trip is the sum of the costs from Day 1 to Day 7: $2992 + $3888 + $3112 + $2728 + $2868 + $3244 + $824 = $19656\n\nUnfortunately, the total cost of $19656 exceeds the budget of $17000. To adjust the plan within the budget, we may need to consider more affordable accommodation options, reduce meal costs, or adjust the number of attractions visited.", "gpt-4-1106-preview_direct_sole-planning_parsed_results": [{"day": 1, "current_city": "from Rockford to Gainesville", "transportation": "Self-driving, from Rockford to Gainesville, Duration: 16 hours 30 mins, Distance: 1822 km, Cost: 91", "breakfast": "-", "attraction": "Florida Museum of Natural History-Exhibits, Gainesville", "lunch": "The Machine Shed Restaurant, Gainesville", "dinner": "Carnival By Tresind, Gainesville", "accommodation": "Suite Nest /free street parking+wifi, Gainesville"}, {"day": 2, "current_city": "Gainesville", "transportation": "-", "breakfast": "Parker's, Gainesville", "attraction": "Devil's Millhopper Geological State Park, Gainesville", "lunch": "Aggarwal Sweet Corner, Gainesville", "dinner": "The Food Garage, Gainesville", "accommodation": "Suite Nest /free street parking+wifi, Gainesville"}, {"day": 3, "current_city": "from Gainesville to Daytona Beach", "transportation": "Self-driving, from Gainesville to Daytona Beach, Duration: 2 hours 2 mins, Distance: 158 km, Cost: 7", "breakfast": "CHA, Gainesville", "attraction": "Daytona Boardwalk Amusements, Daytona Beach", "lunch": "Outback Steakhouse, Daytona Beach", "dinner": "Bespoke Harvest, Daytona Beach", "accommodation": "Homey 1BR in Fun, Central West Village w/ Doorman by Blueground, Daytona Beach"}, {"day": 4, "current_city": "Daytona Beach", "transportation": "-", "breakfast": "Beach Box Cafe, Daytona Beach", "attraction": "Daytona Lagoon, Daytona Beach", "lunch": "Rocks on the River, Daytona Beach", "dinner": "Mom & Dad's Italian Restaurant, Daytona Beach", "accommodation": "Homey 1BR in Fun, Central West Village w/ Doorman by Blueground, Daytona Beach"}, {"day": 5, "current_city": "from Daytona Beach to Jacksonville", "transportation": "Self-driving, from Daytona Beach to Jacksonville, Duration: 1 hour 28 mins, Distance: 143 km, Cost: 7", "breakfast": "Khaaja Chowk, Daytona Beach", "attraction": "Jacksonville Zoo and Gardens, Jacksonville", "lunch": "Villa Gargano, Jacksonville", "dinner": "Pirates' House Restaurant, Jacksonville", "accommodation": "NYC Sanctuary, Skyline Views & Rooftop, Jacksonville"}, {"day": 6, "current_city": "Jacksonville", "transportation": "-", "breakfast": "Goose Feathers Cafe and Bakery, Jacksonville", "attraction": "Southbank Riverwalk, Jacksonville", "lunch": "Ashoka Restaurant, Jacksonville", "dinner": "Sanjha Chulha, Jacksonville", "accommodation": "NYC Sanctuary, Skyline Views & Rooftop, Jacksonville"}, {"day": 7, "current_city": "from Jacksonville to Rockford", "transportation": "Self-driving, from Jacksonville to Rockford, Duration: 16 hours 42 mins, Distance: 1852 km, Cost: 92", "breakfast": "Touch of Spice, Jacksonville", "attraction": "-", "lunch": "-", "dinner": "-", "accommodation": "-"}]}]