[{"gpt-4-1106-preview_direct_sole-planning_results": "Travel Plan:\n\nDay 1: March 13, 2022\nCurrent City: from Dallas to Huntsville\nTransportation: Flight Number: F3601769, from Dallas to Huntsville, Departure Time: 17:14, Arrival Time: 18:57, Cost: $129 per person, Total Cost: $516\nBreakfast: - (Assuming travelers will have breakfast before departure), Cost: $0\nAttraction: U.S. Space & Rocket Center, Huntsville, Cost: $20 per person, Total Cost: $80\nLunch: Downtown Grill, Huntsville, Average Cost: $74 for 4 people\nDinner: El Vaquero Mexican Restaurant, Huntsville, Average Cost: $82 for 4 people\nAccommodation: Brooklyn Charmer, Close to Everything NYC!, Huntsville, Cost: $568 per night (Entire home/apt suitable for 4 people)\n\nTotal cost for Day 1: Transportation ($516) + Attraction ($80) + Lunch ($74) + Dinner ($82) + Accommodation ($568) = $1320\n\nDay 2: March 14, 2022\nCurrent City: Huntsville\nTransportation: -, Cost: $0\nBreakfast: Breakfast Hut, Huntsville, Average Cost: $81 for 4 people\nAttraction: Huntsville Botanical Garden, Huntsville, Cost: $14 per person, Total Cost: $56\nLunch: Moksh The Restro Lounge, Huntsville, Average Cost: $77 for 4 people\nDinner: Desee Dakshin Coastal Cafe, Huntsville, Average Cost: $96 for 4 people\nAccommodation: Brooklyn Charmer, Close to Everything NYC!, Huntsville, Cost: $568 per night (Entire home/apt suitable for 4 people)\n\nTotal cost for Day 2: Breakfast ($81) + Attraction ($56) + Lunch ($77) + Dinner ($96) + Accommodation ($568) = $878\n\nDay 3: March 15, 2022\nCurrent City: from Huntsville to Dallas\nTransportation: Flight Number: F3593796, from Huntsville to Dallas, Departure Time: 05:24, Arrival Time: 07:19, Cost: $147 per person, Total Cost: $588\nBreakfast: - (Assuming travelers will have breakfast after arrival in Dallas), Cost: $0\nAttraction: - (Assuming travelers will not visit attractions due to early departure), Cost: $0\nLunch: - (Assuming travelers will have lunch after arrival in Dallas), Cost: $0\nDinner: - (Assuming travelers will have dinner at their own discretion after arrival in Dallas), Cost: $0\nAccommodation: - (Assuming travelers will not require accommodation as they will have arrived in Dallas), Cost: $0\n\nTotal cost for Day 3: Transportation ($588)\n\nThe total cost of this trip is the sum of the costs from Day 1, Day 2, and Day 3. It is $1320 + $878 + $588 = $2786\n\nHowever, the total cost exceeds the budget of $2700. To adjust the plan within the budget, we can opt for a cheaper flight on Day 1:\n\nAdjusted Transportation for Day 1: Flight Number: F3593917, from Dallas to Huntsville, Departure Time: 20:39, Arrival Time: 22:13, Cost: $130 per person, Total Cost: $520\n\nAdjusted Total cost for Day 1: Transportation ($520) + Attraction ($80) + Lunch ($74) + Dinner ($82) + Accommodation ($568) = $1324\n\nAdjusted Total cost for the trip: $1324 + $878 + $588 = $2790\n\nSince the adjusted total still exceeds the budget, we need to make further adjustments. We can choose a cheaper accommodation option:\n\nAdjusted Accommodation for Day 1 and Day 2: Sonder | 116 John | Simple 1BR + Gym, Huntsville, Cost: $290 per night (Entire home/apt suitable for 4 people)\n\nAdjusted Total cost for Day 1: Transportation ($520) + Attraction ($80) + Lunch ($74) + Dinner ($82) + Accommodation ($290) = $1046\n\nAdjusted Total cost for Day 2: Breakfast ($81) + Attraction ($56) + Lunch ($77) + Dinner ($96) + Accommodation ($290) = $600\n\nAdjusted Total cost for the trip: $1046 + $600 + $588 = $2234\n\nThe adjusted total cost of $2234 is now within the budget of $2700.", "gpt-4-1106-preview_direct_sole-planning_parsed_results": [{"day": 1, "current_city": "from Dallas to Huntsville", "transportation": "Flight Number: F3602997, from Dallas to Huntsville, Departure Time: 10:38, Arrival Time: 12:40", "breakfast": "-", "attraction": "U.S. Space & Rocket Center, Huntsville", "lunch": "Downtown Grill, Huntsville", "dinner": "El Vaquero Mexican Restaurant, Huntsville", "accommodation": "Brooklyn Charmer, Close to Everything NYC!, Huntsville"}, {"day": 2, "current_city": "Huntsville", "transportation": "-", "breakfast": "Breakfast Hut, Huntsville", "attraction": "Huntsville Botanical Garden, Huntsville;Huntsville Museum of Art, Huntsville", "lunch": "Cherry Comet, Huntsville", "dinner": "Moksh The Restro Lounge, Huntsville", "accommodation": "Brooklyn Charmer, Close to Everything NYC!, Huntsville"}, {"day": 3, "current_city": "from Huntsville to Dallas", "transportation": "Flight Number: F3603024, from Huntsville to Dallas, Departure Time: 12:35, Arrival Time: 14:28", "breakfast": "Breakfast Hut, Huntsville", "attraction": "-", "lunch": "-", "dinner": "-", "accommodation": "-"}]}]