[{"gpt-4-1106-preview_direct_sole-planning_results": "Travel Plan:\n\nDay 1: March 2, 2022\nCurrent City: from Philadelphia to Richmond\nTransportation: Flight Number: F3734535, from Philadelphia to Richmond, Departure Time: 09:40, Arrival Time: 10:51, Cost: 47\nBreakfast: - , Cost: 0\nAttraction: Virginia Museum of Fine Arts, Richmond, Cost: 0 (assuming free admission)\nLunch: Guang Zhou Chinese Restaurant, Richmond, Cost: 84\nDinner: Sandpiper Restaurant & Lounge, Richmond, Cost: 20\nAccommodation: Cool Summer Vibes UWS Pent House w/ rooftop, Richmond, Cost: 498 (3 nights minimum stay)\n\nTotal cost for Day 1: 47 (Transportation) + 0 (Breakfast) + 0 (Attraction) + 84 (Lunch) + 20 (Dinner) + 498 (Accommodation) = 649\n\nDay 2: March 3, 2022\nCurrent City: Richmond\nTransportation: -, Cost: 0\nBreakfast: Perfect Bake, Richmond, Cost: 33\nAttraction: Maymont, Richmond, Cost: 0 (assuming free admission)\nLunch: Paradise, Richmond, Cost: 80\nDinner: Welcome, Richmond, Cost: 86\nAccommodation: Cool Summer Vibes UWS Pent House w/ rooftop, Richmond, Cost: 0 (already paid)\n\nTotal cost for Day 2: 0 (Transportation) + 33 (Breakfast) + 0 (Attraction) + 80 (Lunch) + 86 (Dinner) + 0 (Accommodation) = 199\n\nDay 3: March 4, 2022\nCurrent City: from Richmond to Jamestown\nTransportation: Self-driving, Cost: 4\nBreakfast: Eat All Nite, Richmond, Cost: 55\nAttraction: Historic Jamestowne, Jamestown, Cost: 0 (assuming free admission)\nLunch: Cafe Soul Garden, Jamestown, Cost: 99\nDinner: Chauhan Hotel, Jamestown, Cost: 13\nAccommodation: COZY APT CLOSE TO LGA & JFK AND TRANSPORTATION, Jamestown, Cost: 652 (2 nights minimum stay)\n\nTotal cost for Day 3: 4 (Transportation) + 55 (Breakfast) + 0 (Attraction) + 99 (Lunch) + 13 (Dinner) + 652 (Accommodation) = 823\n\nDay 4: March 5, 2022\nCurrent City: Jamestown\nTransportation: -, Cost: 0\nBreakfast: Beyond Breads, Jamestown, Cost: 95\nAttraction: Jamestown Settlement, Jamestown, Cost: 0 (assuming free admission)\nLunch: BarShala, Jamestown, Cost: 13\nDinner: Mughlai Flavours, Jamestown, Cost: 12\nAccommodation: COZY APT CLOSE TO LGA & JFK AND TRANSPORTATION, Jamestown, Cost: 0 (already paid)\n\nTotal cost for Day 4: 0 (Transportation) + 95 (Breakfast) + 0 (Attraction) + 13 (Lunch) + 12 (Dinner) + 0 (Accommodation) = 120\n\nDay 5: March 6, 2022\nCurrent City: from Jamestown to Charlottesville\nTransportation: Self-driving, Cost: 10\nBreakfast: The Food Junction, Jamestown, Cost: 78\nAttraction: Monticello, Charlottesville, Cost: 0 (assuming free admission)\nLunch: Mama's Fish House, Charlottesville, Cost: 63\nDinner: Restaurant Andre, Charlottesville, Cost: 250\nAccommodation: Gorgeous natural light in Chelsea photo studio, Charlottesville, Cost: 1094 (1 night stay)\n\nTotal cost for Day 5: 10 (Transportation) + 78 (Breakfast) + 0 (Attraction) + 63 (Lunch) + 250 (Dinner) + 1094 (Accommodation) = 1495\n\nDay 6: March 7, 2022\nCurrent City: Charlottesville\nTransportation: -, Cost: 0\nBreakfast: Takamaka, Charlottesville, Cost: 72\nAttraction: Virginia Discovery Museum, Charlottesville, Cost: 0 (assuming free admission)\nLunch: Sandys Cocktails & Kitchen, Charlottesville, Cost: 82\nDinner: Dawat-e-Ishq, Charlottesville, Cost: 26\nAccommodation: Williamsburg Hidden Gem, Charlottesville, Cost: 391 (1 night stay)\n\nTotal cost for Day 6: 0 (Transportation) + 72 (Breakfast) + 0 (Attraction) + 82 (Lunch) + 26 (Dinner) + 391 (Accommodation) = 571\n\nDay 7: March 8, 2022\nCurrent City: from Charlottesville to Philadelphia\nTransportation: Self-driving, Cost: 20\nBreakfast: Firefly, Charlottesville, Cost: 30\nAttraction: The Fralin Museum of Art at the University of Virginia, Charlottesville, Cost: 0 (assuming free admission)\nLunch: The Tongue Twister, Charlottesville, Cost: 81\nDinner: -, Cost: 0\nAccommodation: -, Cost: 0\n\nTotal cost for Day 7: 20 (Transportation) + 30 (Breakfast) + 0 (Attraction) + 81 (Lunch) + 0 (Dinner) + 0 (Accommodation) = 131\n\nThe total cost of this trip is the sum of the costs from day 1 to day 7. It is 649 + 199 + 823 + 120 + 1495 + 571 + 131 = 3988\n\nUnfortunately, the total cost of $3988 exceeds the available budget of $2900. Adjustments would need to be made to the plan to reduce costs, such as selecting more affordable accommodations, dining options, or eliminating paid attractions.", "gpt-4-1106-preview_direct_sole-planning_parsed_results": [{"day": 1, "current_city": "from Philadelphia to Richmond", "transportation": "Flight Number: F3728221, from Philadelphia to Richmond, Departure Time: 16:14, Arrival Time: 17:11", "breakfast": "-", "attraction": "-", "lunch": "-", "dinner": "Guang Zhou Chinese Restaurant, Richmond", "accommodation": "Cool Summer Vibes UWS Pent House w/ rooftop, Richmond"}, {"day": 2, "current_city": "Richmond", "transportation": "-", "breakfast": "Sandpiper Restaurant & Lounge, Richmond", "attraction": "Virginia Museum of Fine Arts, Richmond;Maymont, Richmond;", "lunch": "Paradise, Richmond", "dinner": "Welcome, Richmond", "accommodation": "Cool Summer Vibes UWS Pent House w/ rooftop, Richmond"}, {"day": 3, "current_city": "from Richmond to Jamestown", "transportation": "Self-driving, from Richmond to Jamestown, duration: 1 hour 1 min, distance: 92.4 km, Cost: 4", "breakfast": "Perfect Bake, Richmond", "attraction": "Historic Jamestowne, Jamestown;Jamestown Settlement, Jamestown;", "lunch": "Cafe Soul Garden, Jamestown", "dinner": "Chauhan Hotel, Jamestown", "accommodation": "COZY APT CLOSE TO LGA & JFK AND TRANSPORTATION, Jamestown"}, {"day": 4, "current_city": "Jamestown", "transportation": "-", "breakfast": "BarShala, Jamestown", "attraction": "Archaearium Archaeology Museum, Jamestown;Jamestown Glasshouse, Jamestown;", "lunch": "Mughlai Flavours, Jamestown", "dinner": "Janaab, Jamestown", "accommodation": "COZY APT CLOSE TO LGA & JFK AND TRANSPORTATION, Jamestown"}, {"day": 5, "current_city": "from Jamestown to Charlottesville", "transportation": "Self-driving, from Jamestown to Charlottesville, duration: 2 hours 2 mins, distance: 206 km, Cost: 10", "breakfast": "The Food Junction, Jamestown", "attraction": "Monticello, Charlottesville;Virginia Discovery Museum, Charlottesville;", "lunch": "Mama's Fish House, Charlottesville", "dinner": "Restaurant Andre, Charlottesville", "accommodation": "Gorgeous natural light in Chelsea photo studio, Charlottesville"}, {"day": 6, "current_city": "Charlottesville", "transportation": "-", "breakfast": "Domino's Pizza, Charlottesville", "attraction": "The Fralin Museum of Art at the University of Virginia, Charlottesville;Ix Art Park, Charlottesville;", "lunch": "Takamaka, Charlottesville", "dinner": "Sandys Cocktails & Kitchen, Charlottesville", "accommodation": "Gorgeous natural light in Chelsea photo studio, Charlottesville"}, {"day": 7, "current_city": "from Charlottesville to Philadelphia", "transportation": "Self-driving, from Charlottesville to Philadelphia, duration: 4 hours 24 mins, distance: 411 km, Cost: 20", "breakfast": "Dawat-e-Ishq, Charlottesville", "attraction": "The Rotunda, Charlottesville;", "lunch": "Firefly, Charlottesville", "dinner": "-", "accommodation": "-"}]}]