[{"gpt-4-1106-preview_direct_sole-planning_results": "Travel Plan:\n\nDay 1: March 13, 2022\nCurrent City: from Palm Springs to Houston\nTransportation: Flight Number: F3839339, from Palm Springs to Houston, Departure Time: 06:07, Arrival Time: 10:59, Cost: $282\nBreakfast: - (Assuming breakfast is had before the flight), Cost: $0\nAttraction: Downtown Aquarium, Houston, Cost: $0 (Assuming free entry or covered by a city pass)\nLunch: Jalapenos, Houston, Average Cost: $57\nDinner: Super Bakery, Houston, Average Cost: $30\nAccommodation: Sunny and Airy near Manhattan, Houston, Cost: $499\n\nTotal cost for Day 1: $282 (Flight) + $0 (Breakfast) + $0 (Attraction) + $57 (Lunch) + $30 (Dinner) + $499 (Accommodation) = $868\n\nDay 2: March 14, 2022\nCurrent City: Houston\nTransportation: -, Cost: $0\nBreakfast: Sheetla Dhaba, Houston, Average Cost: $35\nAttraction: Space Center Houston, Cost: $0 (Assuming free entry or covered by a city pass)\nLunch: Royal Mart, Houston, Average Cost: $40\nDinner: Matchbox, Houston, Average Cost: $33\nAccommodation: Sunny and Airy near Manhattan, Houston, Cost: $499\n\nTotal cost for Day 2: $0 (Transportation) + $35 (Breakfast) + $0 (Attraction) + $40 (Lunch) + $33 (Dinner) + $499 (Accommodation) = $607\n\nDay 3: March 15, 2022\nCurrent City: from Houston to Austin\nTransportation: Flight Number: F3838099, from Houston to Austin, Departure Time: 09:47, Arrival Time: 10:52, Cost: $43\nBreakfast: Earthen Spices, Houston, Average Cost: $28\nAttraction: Texas Capitol, Austin, Cost: $0 (Assuming free entry or covered by a city pass)\nLunch: Wildflour Cafe + Bakery, Austin, Average Cost: $55\nDinner: Quiosque Chopp Brahma, Austin, Average Cost: $69\nAccommodation: Cozy room in south Harlem - 10 mins to Columbia, Austin, Cost: $564\n\nTotal cost for Day 3: $43 (Flight) + $28 (Breakfast) + $0 (Attraction) + $55 (Lunch) + $69 (Dinner) + $564 (Accommodation) = $759\n\nDay 4: March 16, 2022\nCurrent City: Austin\nTransportation: -, Cost: $0\nBreakfast: The Kasbah, Austin, Average Cost: $88\nAttraction: Zilker Metropolitan Park, Cost: $0 (Assuming free entry or covered by a city pass)\nLunch: Mehfil-e-Handi, Austin, Average Cost: $96\nDinner: Chili's, Austin, Average Cost: $48\nAccommodation: Cozy room in south Harlem - 10 mins to Columbia, Austin, Cost: $564\n\nTotal cost for Day 4: $0 (Transportation) + $88 (Breakfast) + $0 (Attraction) + $96 (Lunch) + $48 (Dinner) + $564 (Accommodation) = $796\n\nDay 5: March 17, 2022\nCurrent City: from Austin to Dallas\nTransportation: Flight Number: F3601654, from Austin to Dallas, Departure Time: 11:43, Arrival Time: 12:36, Cost: $44\nBreakfast: Tandoori Nights, Austin, Average Cost: $26\nAttraction: The Dallas World Aquarium, Dallas, Cost: $0 (Assuming free entry or covered by a city pass)\nLunch: Coconuts Fish Cafe, Dallas, Average Cost: $38\nDinner: 1918 Bistro & Grill, Dallas, Average Cost: $90\nAccommodation: 1BR, elevator, kitchen, doorman!, Dallas, Cost: $475\n\nTotal cost for Day 5: $44 (Flight) + $26 (Breakfast) + $0 (Attraction) + $38 (Lunch) + $90 (Dinner) + $475 (Accommodation) = $673\n\nDay 6: March 18, 2022\nCurrent City: Dallas\nTransportation: -, Cost: $0\nBreakfast: Yanki Sizzlers, Dallas, Average Cost: $96\nAttraction: The Sixth Floor Museum at Dealey Plaza, Dallas, Cost: $0 (Assuming free entry or covered by a city pass)\nLunch: Aravali Owls, Dallas, Average Cost: $53\nDinner: Kebab Xpress, Dallas, Average Cost: $93\nAccommodation: 1BR, elevator, kitchen, doorman!, Dallas, Cost: $475\n\nTotal cost for Day 6: $0 (Transportation) + $96 (Breakfast) + $0 (Attraction) + $53 (Lunch) + $93 (Dinner) + $475 (Accommodation) = $717\n\nDay 7: March 19, 2022\nCurrent City: from Dallas to Palm Springs\nTransportation: Flight Number: F3673984, from Dallas to Palm Springs, Departure Time: 08:41, Arrival Time: 10:04, Cost: $432\nBreakfast: Haldiram's, Dallas, Average Cost: $94\nAttraction: - (Assuming no time for attractions due to travel), Cost: $0\nLunch: - (Assuming lunch on the flight or not required), Cost: $0\nDinner: - (Assuming dinner at home after arrival), Cost: $0\nAccommodation: - (Assuming returning home), Cost: $0\n\nTotal cost for Day 7: $432 (Flight) + $94 (Breakfast) + $0 (Attraction) + $0 (Lunch) + $0 (Dinner) + $0 (Accommodation) = $526\n\nThe total cost of this trip is the sum of the costs from day 1 to day 7. It is $868 + $607 + $759 + $796 + $673 + $717 + $526 = $4,946 which is less than the required budget of $8,100.\n\nPlease note that attraction costs are assumed to be free or covered by a city pass, and some meals may be on the flight or not required due to travel times. Adjustments can be made to include specific attraction costs or additional meals if necessary and within the budget.", "gpt-4-1106-preview_direct_sole-planning_parsed_results": [{"day": 1, "current_city": "from Palm Springs to Houston", "transportation": "Flight Number: F3839339, from Palm Springs to Houston, Departure Time: 06:07, Arrival Time: 10:59", "breakfast": "-", "attraction": "Downtown Aquarium, Houston;", "lunch": "Jalapenos, Houston", "dinner": "Super Bakery, Houston", "accommodation": "Sunny and Airy near Manhattan, Houston"}, {"day": 2, "current_city": "Houston", "transportation": "-", "breakfast": "Sheetla Dhaba, Houston", "attraction": "Space Center Houston, Houston;", "lunch": "Royal Mart, Houston", "dinner": "Matchbox, Houston", "accommodation": "Sunny and Airy near Manhattan, Houston"}, {"day": 3, "current_city": "from Houston to Austin", "transportation": "Flight Number: F4001665, from Houston to Austin, Departure Time: 10:45, Arrival Time: 11:29", "breakfast": "Earthen Spices, Houston", "attraction": "Texas Capitol, Austin;", "lunch": "Wildflour Cafe + Bakery, Austin", "dinner": "The Kasbah, Austin", "accommodation": "Cozy room in south Harlem - 10 mins to Columbia, Austin"}, {"day": 4, "current_city": "Austin", "transportation": "-", "breakfast": "Mehfil-e-Handi, Austin", "attraction": "Zilker Metropolitan Park, Austin;", "lunch": "Chili's, Austin", "dinner": "Tandoori Nights, Austin", "accommodation": "Cozy room in south Harlem - 10 mins to Columbia, Austin"}, {"day": 5, "current_city": "from Austin to Dallas", "transportation": "Flight Number: F4007286, from Austin to Dallas, Departure Time: 06:06, Arrival Time: 06:55", "breakfast": "Cup-a-licious, Austin", "attraction": "The Dallas World Aquarium, Dallas;", "lunch": "Coconuts Fish Cafe, Dallas", "dinner": "1918 Bistro & Grill, Dallas", "accommodation": "1BR, elevator, kitchen, doorman!, Dallas"}, {"day": 6, "current_city": "Dallas", "transportation": "-", "breakfast": "Yanki Sizzlers, Dallas", "attraction": "The Sixth Floor Museum at Dealey Plaza, Dallas;", "lunch": "Aravali Owls, Dallas", "dinner": "Kebab Xpress, Dallas", "accommodation": "1BR, elevator, kitchen, doorman!, Dallas"}, {"day": 7, "current_city": "from Dallas to Palm Springs", "transportation": "Flight Number: F3675114, from Dallas to Palm Springs, Departure Time: 18:55, Arrival Time: 20:19", "breakfast": "Haldiram's, Dallas", "attraction": "Reunion Tower, Dallas;", "lunch": "Delhicacy, Dallas", "dinner": "-", "accommodation": "-"}]}]