[{"gpt-4-1106-preview_direct_sole-planning_results": "Travel Plan:\n\nDay 1: March 4th, 2022\nCurrent City: from Denver to Appleton\nTransportation: Flight Number: F3822209, from Denver to Appleton, Departure Time: 17:30, Arrival Time: 20:44, Cost: $286\nDinner: Mikata Japanese Steakhouse, Appleton, Cost: $72\nAccommodation: Cozy room + bright apartment + rooftop lounge, Appleton, Cost: $666\n\nTotal cost for Day 1: $286 (Flight) + $72 (Dinner) + $666 (Accommodation) = $1024\n\nDay 2: March 5th, 2022\nCurrent City: Appleton\nBreakfast: Destination Live, Appleton, Cost: $30\nAttraction: The History Museum at the Castle, Appleton, Cost: $0 (assuming no entrance fee is listed)\nLunch: Parantha Gurus, Appleton, Cost: $49\nDinner: Swati Snacks, Appleton, Cost: $84\nAccommodation: Cozy room + bright apartment + rooftop lounge, Appleton, Cost: $666\n\nTotal cost for Day 2: $30 (Breakfast) + $0 (Attraction) + $49 (Lunch) + $84 (Dinner) + $666 (Accommodation) = $829\n\nDay 3: March 6th, 2022\nCurrent City: from Appleton to Denver\nTransportation: Flight Number: F3828308, from Appleton to Denver, Departure Time: 08:23, Arrival Time: 10:37, Cost: $295\nBreakfast: Mathew's Cafe, Appleton, Cost: $13\nAttraction: Hearthstone Historic House Museum, Appleton, Cost: $0 (assuming no entrance fee is listed)\nLunch: The Millionaire Express, Appleton, Cost: $56\n\nTotal cost for Day 3: $295 (Flight) + $13 (Breakfast) + $0 (Attraction) + $56 (Lunch) = $364\n\nThe total cost of this trip is the sum of the costs from Day 1, Day 2, and Day 3. It is $1024 + $829 + $364 = $2217\n\nHowever, this exceeds the budget of $1800. To adjust the plan to fit the budget, we need to find cheaper accommodation options. Let's change the accommodation for both nights to a more affordable option:\n\nRevised Accommodation: Stylish, convenient, renovated- 2 min to subway -, Appleton, Cost: $64 per night\n\nRevised Total cost for Day 1: $286 (Flight) + $72 (Dinner) + $64 (Accommodation) = $422\nRevised Total cost for Day 2: $30 (Breakfast) + $0 (Attraction) + $49 (Lunch) + $84 (Dinner) + $64 (Accommodation) = $227\nRevised Total cost for Day 3 remains the same at $364\n\nRevised total cost of the trip: $422 + $227 + $364 = $1013\n\nThe revised total cost of $1013 is now well within the budget of $1800.", "gpt-4-1106-preview_direct_sole-planning_parsed_results": [{"day": 1, "current_city": "from Denver to Appleton", "transportation": "Flight Number: F3822209, from Denver to Appleton, Departure Time: 17:30, Arrival Time: 20:44", "breakfast": "-", "attraction": "-", "lunch": "-", "dinner": "Mikata Japanese Steakhouse, Appleton", "accommodation": "Cozy room + bright apartment + rooftop lounge, Appleton"}, {"day": 2, "current_city": "Appleton", "transportation": "-", "breakfast": "Destination Live, Appleton", "attraction": "The History Museum at the Castle, Appleton;Hearthstone Historic House Museum, Appleton;", "lunch": "Swati Snacks, Appleton", "dinner": "Brick 29, Appleton", "accommodation": "Cozy room + bright apartment + rooftop lounge, Appleton"}, {"day": 3, "current_city": "from Appleton to Denver", "transportation": "Flight Number: F3828308, from Appleton to Denver, Departure Time: 08:23, Arrival Time: 10:37", "breakfast": "-", "attraction": "-", "lunch": "-", "dinner": "-", "accommodation": "-"}]}]