[{"gpt-4-1106-preview_direct_sole-planning_results": "Travel Plan:\n\nDay 1: March 27, 2022\nCurrent City: from Austin to Detroit\nTransportation: Flight Number: F3518857, from Austin to Detroit, Departure Time: 05:36, Arrival Time: 09:33, Cost: $419 per person, Total Cost: $1257\nBreakfast: Southern Bliss Bakery, Detroit, Cost: $28 per person, Total Cost: $84\nAttraction: Detroit Institute of Arts, Detroit, Cost: Free (assuming no ticket cost provided)\nLunch: A Dong Restaurant, Detroit, Cost: $40 per person, Total Cost: $120\nDinner: Chye Seng Huat Hardware, Detroit, Cost: $94 per person, Total Cost: $282\nAccommodation: Comfy King Bed Feet from Subway, Detroit, Cost: $568 per night (Private room, minimum 3 nights), Total Cost: $1704 for 3 nights\n\nTotal cost for Day 1: $3447\n\nDay 2: March 28, 2022\nCurrent City: Detroit\nTransportation: -, Cost: $0\nBreakfast: BMG - All Day Dining, Detroit, Cost: $15 per person, Total Cost: $45\nAttraction: Detroit Historical Museum, Detroit, Cost: Free (assuming no ticket cost provided)\nLunch: Cafe And More, Detroit, Cost: $41 per person, Total Cost: $123\nDinner: Mitalis Kitchen, Detroit, Cost: $28 per person, Total Cost: $84\nAccommodation: (Already paid for Day 1)\n\nTotal cost for Day 2: $252\n\nDay 3: March 29, 2022\nCurrent City: from Detroit to Alpena\nTransportation: Flight Number: F3852119, from Detroit to Alpena, Departure Time: 14:15, Arrival Time: 15:20, Cost: $78 per person, Total Cost: $234\nBreakfast: The Dosa King, Detroit, Cost: $69 per person, Total Cost: $207\nAttraction: Belle Isle Aquarium, Detroit, Cost: Free (assuming no ticket cost provided)\nLunch: Vapour Pub & Brewery, Detroit, Cost: $80 per person, Total Cost: $240\nDinner: Sagar Ratna, Alpena, Cost: $55 per person, Total Cost: $165\nAccommodation: Ultimate 50th Floor Downtown Penthouse - 4000SqFt, Alpena, Cost: $1043 per night (Entire home/apt, minimum 2 nights), Total Cost: $2086 for 2 nights\n\nTotal cost for Day 3: $2932\n\nDay 4: March 30, 2022\nCurrent City: Alpena\nTransportation: -, Cost: $0\nBreakfast: A & A Pagliai's Pizza, Alpena, Cost: $72 per person, Total Cost: $216\nAttraction: Great Lakes Maritime Heritage Center, Alpena, Cost: Free (assuming no ticket cost provided)\nLunch: @Mango, Alpena, Cost: $38 per person, Total Cost: $114\nDinner: Shudh Restaurant, Alpena, Cost: $56 per person, Total Cost: $168\nAccommodation: (Already paid for Day 3)\n\nTotal cost for Day 4: $498\n\nDay 5: March 31, 2022\nCurrent City: from Alpena to Austin\nTransportation: Self-driving, from Alpena to Austin, duration: 22 hours 42 mins, distance: 2,467 km, Cost: $123 per person, Total Cost: $369\nBreakfast: Maplai, Alpena, Cost: $63 per person, Total Cost: $189\nAttraction: Besser Museum for Northeast Michigan, Alpena, Cost: Free (assuming no ticket cost provided)\nLunch: Zaffran - The Bristol Hotel, Alpena, Cost: $33 per person, Total Cost: $99\nDinner: - (Assuming they will have dinner upon arrival in Austin or on the way), Cost: $0\nAccommodation: - (End of trip)\n\nTotal cost for Day 5: $657\n\nThe total cost of this trip is the sum of the costs from day 1, day 2, day 3, day 4, and day 5. It is $3447 + $252 + $2932 + $498 + $657 = $7786\n\nHowever, this total exceeds the budget of $5,900. To adjust the plan to fit the budget, we would need to make some changes, such as choosing more affordable accommodations, dining options, or transportation methods. Since the provided data does not include all necessary costs or cheaper alternatives, the plan cannot be adjusted accurately without additional information.", "gpt-4-1106-preview_direct_sole-planning_parsed_results": [{"day": 1, "current_city": "from Austin to Detroit", "transportation": "Flight Number: F3518857, from Austin to Detroit, Departure Time: 05:36, Arrival Time: 09:33", "breakfast": "-", "attraction": "Detroit Institute of Arts, Detroit", "lunch": "A Dong Restaurant, Detroit", "dinner": "BMG - All Day Dining, Detroit", "accommodation": "Cozy 1 bedroom in the heart of Fort Greene, Detroit"}, {"day": 2, "current_city": "Detroit", "transportation": "-", "breakfast": "Southern Bliss Bakery, Detroit", "attraction": "Detroit Historical Museum, Detroit;Motown Museum, Detroit;", "lunch": "Cafe And More, Detroit", "dinner": "Zabardast Indian Kitchen, Detroit", "accommodation": "Cozy 1 bedroom in the heart of Fort Greene, Detroit"}, {"day": 3, "current_city": "from Detroit to Alpena", "transportation": "Flight Number: F3852119, from Detroit to Alpena, Departure Time: 14:15, Arrival Time: 15:20", "breakfast": "Frequent Bakes, Detroit", "attraction": "Great Lakes Maritime Heritage Center, Alpena", "lunch": "@Mango, Alpena", "dinner": "Maplai, Alpena", "accommodation": "CHEERFUL RM IN BROOKLYN! EASY ACCESS TO TRAIN! R3, Alpena"}, {"day": 4, "current_city": "Alpena", "transportation": "-", "breakfast": "A & A Pagliai's Pizza, Alpena", "attraction": "Besser Museum for Northeast Michigan, Alpena;Thunder Bay National Marine Sanctuary, Alpena;", "lunch": "Shudh Restaurant, Alpena", "dinner": "Young Wild Free Cafe, Alpena", "accommodation": "CHEERFUL RM IN BROOKLYN! EASY ACCESS TO TRAIN! R3, Alpena"}, {"day": 5, "current_city": "from Alpena to Austin", "transportation": "Self-driving, from Alpena to Austin, Duration: 22 hours 42 mins, Distance: 2467 km, Cost: 123", "breakfast": "Jain Chawal Wale, Alpena", "attraction": "-", "lunch": "-", "dinner": "-", "accommodation": "-"}]}]