[{"gpt-4-1106-preview_direct_sole-planning_results": "Travel Plan:\n\nDay 1: March 22, 2022\nCurrent City: from Minneapolis to Abilene\nTransportation: Self-driving from Minneapolis to Abilene, duration: 15 hours 28 mins, distance: 1,732 km, cost: $86\nBreakfast: - (Assuming breakfast is had before departure), Cost $0\nAttraction: The Grace Museum, Abilene, Cost: - (Assuming arrival is too late for an attraction visit), Cost $0\nLunch: - (Assuming lunch is on the road), Cost $0\nDinner: Thai Garden, Abilene, Average Cost: $13 (Cost for two: $26)\nAccommodation: Apartment minutes from manhattan, Abilene, price: $295, room type: Entire home/apt, minimum nights: 2, suitable for children under 10\n\nTotal cost for Day 1: Transportation + Dinner + Accommodation = $86 + $26 + $295 = $407\n\nDay 2: March 23, 2022\nCurrent City: Abilene\nTransportation: -, Cost $0\nBreakfast: Thai Garden, Abilene, Average Cost: $13 (Cost for two: $26)\nAttraction: Frontier Texas!, Abilene, Cost: - (Assuming one attraction per day), Cost $0\nLunch: Crispy Crust, Abilene, Average Cost: $54 (Cost for two: $108)\nDinner: Finger Licious, Abilene, Average Cost: $35 (Cost for two: $70)\nAccommodation: Apartment minutes from manhattan, Abilene, price: $295\n\nTotal cost for Day 2: Breakfast + Lunch + Dinner + Accommodation = $26 + $108 + $70 + $295 = $499\n\nDay 3: March 24, 2022\nCurrent City: from Abilene to Amarillo\nTransportation: Self-driving from Abilene to Amarillo, duration: 4 hours 10 mins, distance: 446 km, cost: $22\nBreakfast: Mx Corn, Abilene, Average Cost: $62 (Cost for two: $124)\nAttraction: Cadillac Ranch, Amarillo, Cost: - (Free attraction), Cost $0\nLunch: The Cinnamon Kitchen, Amarillo, Average Cost: $69 (Cost for two: $138)\nDinner: Komachi, Amarillo, Average Cost: $71 (Cost for two: $142)\nAccommodation: Harlem Humble Abode - 1 bedroom - Cute and Quaint, Amarillo, price: $409, room type: Entire home/apt, minimum nights: 5, suitable for children under 10\n\nTotal cost for Day 3: Transportation + Breakfast + Lunch + Dinner + Accommodation = $22 + $124 + $138 + $142 + $409 = $835\n\nDay 4: March 25, 2022\nCurrent City: Amarillo\nTransportation: -, Cost $0\nBreakfast: Kanha North & South Indian Veg., Amarillo, Average Cost: $34 (Cost for two: $68)\nAttraction: Amarillo Botanical Gardens, Amarillo, Cost: - (Assuming one attraction per day), Cost $0\nLunch: Sigree Global Grill, Amarillo, Average Cost: $35 (Cost for two: $70)\nDinner: Anand Restaurant, Amarillo, Average Cost: $53 (Cost for two: $106)\nAccommodation: Harlem Humble Abode - 1 bedroom - Cute and Quaint, Amarillo, price: $409\n\nTotal cost for Day 4: Breakfast + Lunch + Dinner + Accommodation = $68 + $70 + $106 + $409 = $653\n\nDay 5: March 26, 2022\nCurrent City: from Amarillo to Lubbock\nTransportation: Self-driving from Amarillo to Lubbock, duration: 1 hour 47 mins, distance: 197 km, cost: $9\nBreakfast: Wood Box Cafe, Amarillo, Average Cost: $11 (Cost for two: $22)\nAttraction: Buddy Holly Center, Lubbock, Cost: - (Assuming one attraction per day), Cost $0\nLunch: Paris 6 Classique, Lubbock, Average Cost: $91 (Cost for two: $182)\nDinner: 3 Squares Diner, Lubbock, Average Cost: $73 (Cost for two: $146)\nAccommodation: Private bedroom in UWS Apartment, Lubbock, price: $709, room type: Private room, minimum nights: 2, suitable for children under 10\n\nTotal cost for Day 5: Transportation + Breakfast + Lunch + Dinner + Accommodation = $9 + $22 + $182 + $146 + $709 = $1068\n\nDay 6: March 27, 2022\nCurrent City: Lubbock\nTransportation: -, Cost $0\nBreakfast: Cantinho da Gula, Lubbock, Average Cost: $78 (Cost for two: $156)\nAttraction: National Ranching Heritage Center, Lubbock, Cost: - (Assuming one attraction per day), Cost $0\nLunch: Grand Barbeque Buffet Restaurant, Lubbock, Average Cost: $20 (Cost for two: $40)\nDinner: Mosaic - Country Inn & Suites By Carlson, Lubbock, Average Cost: $29 (Cost for two: $58)\nAccommodation: Private bedroom in UWS Apartment, Lubbock, price: $709\n\nTotal cost for Day 6: Breakfast + Lunch + Dinner + Accommodation = $156 + $40 + $58 + $709 = $963\n\nDay 7: March 28, 2022\nCurrent City: from Lubbock to Minneapolis\nTransportation: Self-driving from Lubbock to Minneapolis, duration: 16 hours 17 mins, distance: 1,818 km, cost: $90\nBreakfast: Assam Tea Corner, Lubbock, Average Cost: $52 (Cost for two: $104)\nAttraction: - (Assuming departure is too early for an attraction visit), Cost $0\nLunch: - (Assuming lunch is on the road), Cost $0\nDinner: - (Assuming dinner is after arrival back home), Cost $0\nAccommodation: - (Assuming arrival back home), Cost $0\n\nTotal cost for Day 7: Transportation + Breakfast = $90 + $104 = $194\n\nThe total cost of this trip is the sum of the costs from Day 1 to Day 7: $407 + $499 + $835 + $653 + $1068 + $963 + $194 = $4619\n\nThis total cost of $4619 is well within the required budget of $11,900. Please note that attraction costs are not included as specific prices were not provided, and some meals and attractions were assumed to be skipped due to travel times. Adjustments can be made to include more attractions or upscale dining if desired, as the budget allows for additional expenses.", "gpt-4-1106-preview_direct_sole-planning_parsed_results": [{"day": 1, "current_city": "from Minneapolis to Abilene", "transportation": "Self-driving, from Minneapolis to Abilene, Duration: 15 hours 28 mins, Distance: 1732 km, Cost: 86", "breakfast": "-", "attraction": "The Grace Museum, Abilene", "lunch": "Thai Garden, Abilene", "dinner": "Crispy Crust, Abilene", "accommodation": "Apartment minutes from manhattan, Abilene"}, {"day": 2, "current_city": "Abilene", "transportation": "-", "breakfast": "Thai Garden, Abilene", "attraction": "Frontier Texas!, Abilene", "lunch": "Finger Licious, Abilene", "dinner": "Mx Corn, Abilene", "accommodation": "Apartment minutes from manhattan, Abilene"}, {"day": 3, "current_city": "from Abilene to Amarillo", "transportation": "Self-driving, from Abilene to Amarillo, Duration: 4 hours 10 mins, Distance: 446 km, Cost: 22", "breakfast": "LPK Waterfront, Abilene", "attraction": "Cadillac Ranch, Amarillo", "lunch": "The Cinnamon Kitchen, Amarillo", "dinner": "Komachi, Amarillo", "accommodation": "Harlem Humble Abode - 1 bedroom - Cute and Quaint, Amarillo"}, {"day": 4, "current_city": "Amarillo", "transportation": "-", "breakfast": "Kanha North & South Indian Veg., Amarillo", "attraction": "Amarillo Botanical Gardens, Amarillo", "lunch": "Sigree Global Grill, Amarillo", "dinner": "Anand Restaurant, Amarillo", "accommodation": "Harlem Humble Abode - 1 bedroom - Cute and Quaint, Amarillo"}, {"day": 5, "current_city": "from Amarillo to Lubbock", "transportation": "Self-driving, from Amarillo to Lubbock, Duration: 1 hour 47 mins, Distance: 197 km, Cost: 9", "breakfast": "Wood Box Cafe, Amarillo", "attraction": "Buddy Holly Center, Lubbock", "lunch": "Cantinho da Gula, Lubbock", "dinner": "Paris 6 Classique, Lubbock", "accommodation": "Private bedroom in UWS Apartment, Lubbock"}, {"day": 6, "current_city": "Lubbock", "transportation": "-", "breakfast": "3 Squares Diner, Lubbock", "attraction": "National Ranching Heritage Center, Lubbock", "lunch": "Grand Barbeque Buffet Restaurant, Lubbock", "dinner": "Mosaic - Country Inn & Suites By Carlson, Lubbock", "accommodation": "Private bedroom in UWS Apartment, Lubbock"}, {"day": 7, "current_city": "from Lubbock to Minneapolis", "transportation": "Self-driving, from Lubbock to Minneapolis, Duration: 16 hours 17 mins, Distance: 1818 km, Cost: 90", "breakfast": "Assam Tea Corner, Lubbock", "attraction": "-", "lunch": "-", "dinner": "-", "accommodation": "-"}]}]