[{"gpt-4-1106-preview_direct_sole-planning_results": "Travel Plan:\n\nDay 1: March 24, 2022\nCurrent City: from Providence to Orlando\nTransportation: Flight Number: F4011165, from Providence to Orlando, Departure Time: 18:30, Arrival Time: 21:49, Cost: $226\nDinner: Turquoise Villa, Orlando, Cost: $55\nAccommodation: Sixth Ave Chelsea, Studio Serviced Apartment, Orlando, Cost: $70\n\nTotal cost for Day 1: $226 (Flight) + $55 (Dinner) + $70 (Accommodation) = $351\n\nDay 2: March 25, 2022\nCurrent City: Orlando\nBreakfast: Fuji Japanese Steakhouse, Orlando, Cost: $75\nAttraction: The Wheel at ICON Park, Orlando, Cost: $0 (assuming free entry or included in accommodation)\nLunch: Veg O Non, Orlando, Cost: $45\nDinner: Wai Yu Mun Ching, Orlando, Cost: $51\nAccommodation: Sixth Ave Chelsea, Studio Serviced Apartment, Orlando, Cost: $70 (same as Day 1, assuming a 2-night stay)\n\nTotal cost for Day 2: $75 (Breakfast) + $0 (Attraction) + $45 (Lunch) + $51 (Dinner) + $70 (Accommodation) = $241\n\nDay 3: March 26, 2022\nCurrent City: from Orlando to Providence\nTransportation: Flight Number: F4032376, from Orlando to Providence, Departure Time: 19:22, Arrival Time: 21:58, Cost: $280\nBreakfast: Nirula's Ice Cream, Orlando, Cost: $46\nAttraction: Orlando Science Center, Orlando, Cost: $0 (assuming free entry or included in accommodation)\nLunch: Milan Food, Orlando, Cost: $25\nDinner: - (Assuming they will eat after arriving back in Providence)\n\nTotal cost for Day 3: $280 (Flight) + $46 (Breakfast) + $0 (Attraction) + $25 (Lunch) = $351\n\nThe total cost of this trip is the sum of the costs from Day 1, Day 2, and Day 3. It is $351 (Day 1) + $241 (Day 2) + $351 (Day 3) = $943\n\nThis travel plan is within the required budget of $1,800.", "gpt-4-1106-preview_direct_sole-planning_parsed_results": [{"day": 1, "current_city": "from Providence to Orlando", "transportation": "Flight Number: F4011165, from Providence to Orlando, Departure Time: 18:30, Arrival Time: 21:49", "breakfast": "-", "attraction": "-", "lunch": "-", "dinner": "Fuji Japanese Steakhouse, Orlando", "accommodation": "Sixth Ave Chelsea, Studio Serviced Apartment, Orlando"}, {"day": 2, "current_city": "Orlando", "transportation": "-", "breakfast": "Turquoise Villa, Orlando", "attraction": "SeaWorld Orlando, Orlando", "lunch": "The Tandoori Times, Orlando", "dinner": "Crust N Cakes, Orlando", "accommodation": "Sixth Ave Chelsea, Studio Serviced Apartment, Orlando"}, {"day": 3, "current_city": "from Orlando to Providence", "transportation": "Flight Number: F4032377, from Orlando to Providence, Departure Time: 06:51, Arrival Time: 09:21", "breakfast": "-", "attraction": "-", "lunch": "-", "dinner": "-", "accommodation": "-"}]}]