[{"gpt-4-1106-preview_direct_sole-planning_results": "Travel Plan:\n\nDay 1: March 13, 2022\nCurrent City: from Pittsburgh to Rochester\nTransportation: Self-driving, duration: 4 hours 11 mins, distance: 457 km, cost: $22\nBreakfast: - , Cost $0\nAttraction: The Strong National Museum of Play, Rochester, Cost: TBD\nLunch: Atlas World Grill, Rochester, Average Cost: $54 (for two, assuming $27 per person)\nDinner: Sree Annapoorna, Rochester, Average Cost: $52 (for two, assuming $26 per person)\nAccommodation: Artsy Bushwick NY 2 Beds with laundry & balcony, Rochester, Cost: $1128 (allows visitors, minimum 2 nights stay)\n\nTotal cost for Day 1: $22 (transportation) + $54 (lunch) + $52 (dinner) + $1128 (accommodation) = $1256\n\nDay 2: March 14, 2022\nCurrent City: Rochester\nTransportation: -, Cost $0\nBreakfast: Mister Mughal, Rochester, Average Cost: $19 (for two, assuming $9.5 per person)\nAttraction: George Eastman Museum, Rochester, Cost: TBD\nLunch: Hotel Ravisha Continental, Rochester, Average Cost: $43 (for two, assuming $21.5 per person)\nDinner: Circus, Rochester, Average Cost: $81 (for two, assuming $40.5 per person)\nAccommodation: Artsy Bushwick NY 2 Beds with laundry & balcony, Rochester, Cost: $1128\n\nTotal cost for Day 2: $19 (breakfast) + $43 (lunch) + $81 (dinner) + $1128 (accommodation) = $1271\n\nDay 3: March 15, 2022\nCurrent City: from Rochester to Niagara Falls\nTransportation: Self-driving, duration: 1 hour 25 mins, distance: 139 km, cost: $6\nBreakfast: - , Cost $0\nAttraction: Journey Behind the Falls, Niagara Falls, Cost: TBD\nLunch: Izakaya Kikufuji, Niagara Falls, Average Cost: $66 (for two, assuming $33 per person)\nDinner: Tony Roma's, Niagara Falls, Average Cost: $47 (for two, assuming $23.5 per person)\nAccommodation: Sunny Bedroom In The Heart of Bushwick, Niagara Falls, Cost: $893 (allows visitors, minimum 3 nights stay)\n\nTotal cost for Day 3: $6 (transportation) + $66 (lunch) + $47 (dinner) + $893 (accommodation) = $1012\n\nDay 4: March 16, 2022\nCurrent City: Niagara Falls\nTransportation: -, Cost $0\nBreakfast: Scratch, Niagara Falls, Average Cost: $19 (for two, assuming $9.5 per person)\nAttraction: Niagara SkyWheel, Niagara Falls, Cost: TBD\nLunch: Raju Dhaba, Niagara Falls, Average Cost: $67 (for two, assuming $33.5 per person)\nDinner: Sri Meenakshi South Indian Food, Niagara Falls, Average Cost: $77 (for two, assuming $38.5 per person)\nAccommodation: Sunny Bedroom In The Heart of Bushwick, Niagara Falls, Cost: $893\n\nTotal cost for Day 4: $19 (breakfast) + $67 (lunch) + $77 (dinner) + $893 (accommodation) = $1056\n\nDay 5: March 17, 2022\nCurrent City: from Niagara Falls to New York\nTransportation: Self-driving, duration: 6 hours 29 mins, distance: 657 km, cost: $32\nBreakfast: - , Cost $0\nAttraction: Top of The Rock, New York, Cost: TBD\nLunch: Seasons 52 Fresh Grill, New York, Average Cost: $30 (for two, assuming $15 per person)\nDinner: Rambhog, New York, Average Cost: $95 (for two, assuming $47.5 per person)\nAccommodation: Versatile private room in Harlem/Hamilton Heights!, New York, Cost: $398 (allows visitors, minimum 4 nights stay)\n\nTotal cost for Day 5: $32 (transportation) + $30 (lunch) + $95 (dinner) + $398 (accommodation) = $555\n\nDay 6: March 18, 2022\nCurrent City: New York\nTransportation: -, Cost $0\nBreakfast: Green Chick Chop, New York, Average Cost: $26 (for two, assuming $13 per person)\nAttraction: Empire State Building, New York, Cost: TBD\nLunch: Lord of the Drinks Forum, New York, Average Cost: $71 (for two, assuming $35.5 per person)\nDinner: Goosebumps, New York, Average Cost: $94 (for two, assuming $47 per person)\nAccommodation: Versatile private room in Harlem/Hamilton Heights!, New York, Cost: $398\n\nTotal cost for Day 6: $26 (breakfast) + $71 (lunch) + $94 (dinner) + $398 (accommodation) = $589\n\nDay 7: March 19, 2022\nCurrent City: from New York to Pittsburgh\nTransportation: Self-driving, duration: 5 hours 57 mins, distance: 594 km, cost: $29\nBreakfast: Gurgaon Hights, New York, Average Cost: $46 (for two, assuming $23 per person)\nAttraction: - , Cost $0\nLunch: - , Cost $0\nDinner: - , Cost $0\nAccommodation: - , Cost $0\n\nTotal cost for Day 7: $29 (transportation) + $46 (breakfast) = $75\n\nThe total cost of this trip is the sum of the costs from day 1 to day 7. It is $1256 + $1271 + $1012 + $1056 + $555 + $589 + $75 = $5814\n\nNote: The total cost exceeds the budget of $5300. To stay within budget, consider adjusting meal costs, choosing less expensive attractions, or finding more affordable accommodations. Attractions costs are not provided, so they need to be factored in as well. Please provide the costs for attractions to complete the budgeting.", "gpt-4-1106-preview_direct_sole-planning_parsed_results": [{"day": 1, "current_city": "from Pittsburgh to Rochester", "transportation": "Taxi, from Pittsburgh to Rochester, Duration: 4 hours 11 mins, Distance: 457 km, Cost: 457", "breakfast": "-", "attraction": "The Strong National Museum of Play, Rochester;", "lunch": "Atlas World Grill, Rochester", "dinner": "Sree Annapoorna, Rochester", "accommodation": "Super Cute Studio in Heart of Greenpoint, Rochester"}, {"day": 2, "current_city": "Rochester", "transportation": "-", "breakfast": "Mister Mughal, Rochester", "attraction": "George Eastman Museum, Rochester;RMSC (Rochester Museum & Science Center), Rochester;", "lunch": "The Fisherman's Wharf, Rochester", "dinner": "Circus, Rochester", "accommodation": "Super Cute Studio in Heart of Greenpoint, Rochester"}, {"day": 3, "current_city": "from Rochester to Niagara Falls", "transportation": "Taxi, from Rochester to Niagara Falls, Duration: 1 hour 25 mins, Distance: 139 km, Cost: 139", "breakfast": "-", "attraction": "Journey Behind the Falls, Niagara Falls;Niagara SkyWheel, Niagara Falls;", "lunch": "Tony Roma's, Niagara Falls", "dinner": "Izakaya Kikufuji, Niagara Falls", "accommodation": "Sunny Bedroom In The Heart of Bushwick, Niagara Falls"}, {"day": 4, "current_city": "Niagara Falls", "transportation": "-", "breakfast": "Scratch, Niagara Falls", "attraction": "Cave of the Winds, Niagara Falls;White Water Walk, Niagara Falls;", "lunch": "Raju Dhaba, Niagara Falls", "dinner": "Sri Meenakshi South Indian Food, Niagara Falls", "accommodation": "Sunny Bedroom In The Heart of Bushwick, Niagara Falls"}, {"day": 5, "current_city": "from Niagara Falls to New York", "transportation": "Self-driving, from Niagara Falls to New York, Duration: 6 hours 29 mins, Distance: 657 km, Cost: 32", "breakfast": "-", "attraction": "Top of The Rock, New York;One World Observatory, New York;", "lunch": "Seasons 52 Fresh Grill, New York", "dinner": "Lord of the Drinks Forum, New York", "accommodation": "Versatile private room in Harlem/Hamilton Heights!, New York"}, {"day": 6, "current_city": "New York", "transportation": "-", "breakfast": "Gurgaon Hights, New York", "attraction": "Empire State Building, New York;The High Line, New York;", "lunch": "Goosebumps, New York", "dinner": "QD's Restaurant, New York", "accommodation": "Versatile private room in Harlem/Hamilton Heights!, New York"}, {"day": 7, "current_city": "from New York to Pittsburgh", "transportation": "Self-driving, from New York to Pittsburgh, Duration: 5 hours 57 mins, Distance: 594 km, Cost: 29", "breakfast": "-", "attraction": "-", "lunch": "-", "dinner": "-", "accommodation": "-"}]}]