[{"gpt-4-1106-preview_direct_sole-planning_results": "Travel Plan:\n\nDay 1: March 3, 2022\nCurrent City: from Key West to Houston\nTransportation: Flight Number: F4041792, from Key West to Houston, Departure Time: 16:55, Arrival Time: 19:01, Cost: $218\nDinner: Jalapenos, Houston, Average Cost: $57, Cuisines: Desserts, Tea, Cafe, Chinese, Seafood\nAccommodation: Sunny and Airy near Manhattan, Houston, Price: $499, Entire home/apt, House Rules: No pets, Minimum Nights: 2\n\nTotal cost for Day 1: Transportation + Dinner + Accommodation = $218 + (2 * $57) + $499 = $831\n\nDay 2: March 4, 2022\nCurrent City: Houston\nBreakfast: Super Bakery, Houston, Average Cost: $30, Cuisines: Seafood, Fast Food\nAttraction: Space Center Houston, Houston, Cost: Free (assuming no entry fee provided)\nLunch: Royal Mart, Houston, Average Cost: $40, Cuisines: Tea, Bakery, Cafe, Mediterranean, Seafood\nDinner: Matchbox, Houston, Average Cost: $33, Cuisines: Tea, Italian, Bakery, Fast Food, Seafood\nAccommodation: Sunny and Airy near Manhattan, Houston, Price: $499, Entire home/apt, House Rules: No pets, Minimum Nights: 2\n\nTotal cost for Day 2: Breakfast + Lunch + Dinner + Accommodation = (2 * $30) + (2 * $40) + (2 * $33) + $499 = $705\n\nDay 3: March 5, 2022\nCurrent City: from Houston to San Antonio\nTransportation: Flight Number: F3842670, from Houston to San Antonio, Departure Time: 12:15, Arrival Time: 13:31, Cost: $58\nBreakfast: Cyber Adda 24, Houston, Average Cost: $73, Cuisines: Chinese, Pizza, Bakery\nAttraction: San Antonio River Walk, San Antonio, Cost: Free (assuming no entry fee provided)\nLunch: Cafe Le Rue @ The Landings, San Antonio, Average Cost: $19, Cuisines: French, Mexican, Cafe, Seafood\nDinner: Martin's BBQ, San Antonio, Average Cost: $71, Cuisines: Tea, BBQ, Fast Food, Indian, Seafood\nAccommodation: Spacious, bright room, prime Williamsburg location, San Antonio, Price: $900, Private room, House Rules: No pets, Minimum Nights: 3\n\nTotal cost for Day 3: Transportation + Breakfast + Lunch + Dinner + Accommodation = $58 + (2 * $73) + (2 * $19) + (2 * $71) + $900 = $1284\n\nDay 4: March 6, 2022\nCurrent City: San Antonio\nBreakfast: Barbeque Nation, San Antonio, Average Cost: $16, Cuisines: Tea, Cafe, Fast Food, Chinese, American\nAttraction: The Alamo, San Antonio, Cost: Free (assuming no entry fee provided)\nLunch: Cream Stone, San Antonio, Average Cost: $53, Cuisines: Cafe, BBQ, Mediterranean, Desserts\nDinner: Pita Pit, San Antonio, Average Cost: $36, Cuisines: Pizza, French, Bakery, Cafe, Mediterranean\nAccommodation: Spacious, bright room, prime Williamsburg location, San Antonio, Price: $900, Private room, House Rules: No pets, Minimum Nights: 3\n\nTotal cost for Day 4: Breakfast + Lunch + Dinner + Accommodation = (2 * $16) + (2 * $53) + (2 * $36) + $900 = $1110\n\nDay 5: March 7, 2022\nCurrent City: from San Antonio to Dallas\nTransportation: Flight Number: F3672469, from San Antonio to Dallas, Departure Time: 09:22, Arrival Time: 10:23, Cost: $77\nBreakfast: My Kind Of Cafe, San Antonio, Average Cost: $94, Cuisines: Tea, Seafood, Bakery, Fast Food\nAttraction: The Dallas World Aquarium, Dallas, Cost: Free (assuming no entry fee provided)\nLunch: Coconuts Fish Cafe, Dallas, Average Cost: $38, Cuisines: Cafe, BBQ, Mediterranean, Fast Food\nDinner: 1918 Bistro & Grill, Dallas, Average Cost: $90, Cuisines: Tea, Pizza, BBQ, Seafood\nAccommodation: Luxury Williamsburg duplex, private roof terrace, Dallas, Price: $241, Entire home/apt, House Rules: No visitors, Minimum Nights: 4\n\nTotal cost for Day 5: Transportation + Breakfast + Lunch + Dinner + Accommodation = $77 + (2 * $94) + (2 * $38) + (2 * $90) + $241 = $762\n\nDay 6: March 8, 2022\nCurrent City: Dallas\nBreakfast: Yanki Sizzlers, Dallas, Average Cost: $96, Cuisines: Cafe, French, Tea, Mediterranean\nAttraction: Reunion Tower, Dallas, Cost: Free (assuming no entry fee provided)\nLunch: Aravali Owls, Dallas, Average Cost: $53, Cuisines: Pizza, Italian, Bakery, Fast Food, Cafe\nDinner: Kebab Xpress, Dallas, Average Cost: $93, Cuisines: Tea, Bakery, Pizza, Mediterranean\nAccommodation: Luxury Williamsburg duplex, private roof terrace, Dallas, Price: $241, Entire home/apt, House Rules: No visitors, Minimum Nights: 4\n\nTotal cost for Day 6: Breakfast + Lunch + Dinner + Accommodation = (2 * $96) + (2 * $53) + (2 * $93) + $241 = $725\n\nDay 7: March 9, 2022\nCurrent City: from Dallas to Key West\nTransportation: Flight Number: F3666117, from Dallas to Key West, Departure Time: 17:01, Arrival Time: 20:41, Cost: $222\nBreakfast: Haldiram's, Dallas, Average Cost: $94, Cuisines: Tea, Pizza\nLunch: Delhicacy, Dallas, Average Cost: $67, Cuisines: Desserts, Mexican, Bakery, Chinese, Seafood\nDinner: - (Assuming dinner in Key West is not required as the flight arrives late)\nAccommodation: - (Assuming accommodation in Key West is not required as this is the return date)\n\nTotal cost for Day 7: Transportation + Breakfast + Lunch = $222 + (2 * $94) + (2 * $67) = $544\n\nThe total cost of this trip is the sum of the costs from Day 1 to Day 7. It is $831 + $705 + $1284 + $1110 + $762 + $725 + $544 = $5961, which is less than the required budget of $7200.", "gpt-4-1106-preview_direct_sole-planning_parsed_results": [{"day": 1, "current_city": "from Key West to Houston", "transportation": "Flight Number: F4041792, from Key West to Houston, Departure Time: 16:55, Arrival Time: 19:01", "breakfast": "-", "attraction": "-", "lunch": "-", "dinner": "Jalapenos, Houston", "accommodation": "Sunny and Airy near Manhattan, Houston"}, {"day": 2, "current_city": "Houston", "transportation": "-", "breakfast": "Super Bakery, Houston", "attraction": "Space Center Houston, Houston", "lunch": "The BrewMaster - The Mix Fine Dine, Houston", "dinner": "Vinayaka Mylari, Houston", "accommodation": "Sunny and Airy near Manhattan, Houston"}, {"day": 3, "current_city": "from Houston to San Antonio", "transportation": "Flight Number: F3971648, from Houston to San Antonio, Departure Time: 08:47, Arrival Time: 09:36", "breakfast": "-", "attraction": "San Antonio River Walk, San Antonio", "lunch": "Cafe Le Rue @ The Landings, San Antonio", "dinner": "Pita Pit, San Antonio", "accommodation": "Spacious, bright room, prime Williamsburg location, San Antonio"}, {"day": 4, "current_city": "San Antonio", "transportation": "-", "breakfast": "Minerva's Food & Cocktails, San Antonio", "attraction": "The Alamo, San Antonio", "lunch": "Cream Stone, San Antonio", "dinner": "Cafe Le Rue @ The Landings, San Antonio", "accommodation": "Spacious, bright room, prime Williamsburg location, San Antonio"}, {"day": 5, "current_city": "from San Antonio to Dallas", "transportation": "Flight Number: F3999432, from San Antonio to Dallas, Departure Time: 10:01, Arrival Time: 10:54", "breakfast": "-", "attraction": "The Dallas World Aquarium, Dallas", "lunch": "Coconuts Fish Cafe, Dallas", "dinner": "Yanki Sizzlers, Dallas", "accommodation": "Luxury Williamsburg duplex, private roof terrace, Dallas"}, {"day": 6, "current_city": "Dallas", "transportation": "-", "breakfast": "Cafe Gatherings, Dallas", "attraction": "Reunion Tower, Dallas", "lunch": "Aravali Owls, Dallas", "dinner": "Delhicacy, Dallas", "accommodation": "Luxury Williamsburg duplex, private roof terrace, Dallas"}, {"day": 7, "current_city": "from Dallas to Key West", "transportation": "Flight Number: F3666117, from Dallas to Key West, Departure Time: 17:01, Arrival Time: 20:41", "breakfast": "Drifters Cafe, Dallas", "attraction": "Klyde Warren Park, Dallas", "lunch": "Uma Foodies' Hut, Dallas", "dinner": "-", "accommodation": "-"}]}]