[{"gpt-4-1106-preview_direct_sole-planning_results": "Travel Plan:\n\nDay 1: March 7, 2022\nCurrent City: from Reno to Abilene\nTransportation: Self-driving, duration: 22 hours 27 mins, distance: 2,412 km, cost: $120\nAccommodation: Apartment minutes from manhattan, Abilene, price: $295, room type: Entire home/apt, house rules: No pets & No visitors, minimum nights: 2, maximum occupancy: 2, review rate number: 2\nTotal cost: Transportation + Accommodation = $120 + $295 = $415\n\nDay 2: March 8, 2022\nCurrent City: Abilene\nBreakfast: Thai Garden, Abilene, Average Cost: $13\nAttraction: The Grace Museum, Abilene, Cost: Free (assuming no entrance fee is listed)\nLunch: Crispy Crust, Abilene, Average Cost: $54\nDinner: Mediumwelldone, Abilene, Average Cost: $91\nAccommodation: Same as Day 1\nTotal cost: Breakfast + Lunch + Dinner = $13 + $54 + $91 = $158\n\nDay 3: March 9, 2022\nCurrent City: from Abilene to Amarillo\nTransportation: Self-driving, duration: 4 hours 10 mins, distance: 446 km, cost: $22\nBreakfast: Subway, Abilene, Average Cost: $57\nAttraction: Frontier Texas!, Abilene, Cost: Free (assuming no entrance fee is listed)\nLunch: Finger Licious, Abilene, Average Cost: $35\nDinner: The Grand Trunk Road, Amarillo, Average Cost: $80\nAccommodation: Harlem Humble Abode - 1 bedroom - Cute and Quaint, Amarillo, price: $409, room type: Entire home/apt, house rules: No pets, minimum nights: 5, maximum occupancy: 3, review rate number: 5\nTotal cost: Transportation + Breakfast + Lunch + Dinner + Accommodation = $22 + $57 + $35 + $80 + $409 = $603\n\nDay 4: March 10, 2022\nCurrent City: Amarillo\nBreakfast: The Cinnamon Kitchen, Amarillo, Average Cost: $69\nAttraction: Cadillac Ranch, Amarillo, Cost: Free (assuming no entrance fee is listed)\nLunch: Komachi, Amarillo, Average Cost: $71\nDinner: Sigree Global Grill, Amarillo, Average Cost: $35\nAccommodation: Same as Day 3\nTotal cost: Breakfast + Lunch + Dinner = $69 + $71 + $35 = $175\n\nDay 5: March 11, 2022\nCurrent City: from Amarillo to Lubbock\nTransportation: Self-driving, duration: 1 hour 47 mins, distance: 197 km, cost: $9\nBreakfast: Wood Box Cafe, Amarillo, Average Cost: $11\nAttraction: Amarillo Botanical Gardens, Amarillo, Cost: Free (assuming no entrance fee is listed)\nLunch: Anand Restaurant, Amarillo, Average Cost: $53\nDinner: Paris 6 Classique, Lubbock, Average Cost: $91\nAccommodation: Private bedroom in UWS Apartment, Lubbock, price: $709, room type: Private room, house rules: No visitors & No pets, minimum nights: 2, maximum occupancy: 2, review rate number: 5\nTotal cost: Transportation + Breakfast + Lunch + Dinner + Accommodation = $9 + $11 + $53 + $91 + $709 = $873\n\nDay 6: March 12, 2022\nCurrent City: Lubbock\nBreakfast: Assam Tea Corner, Lubbock, Average Cost: $52\nAttraction: Buddy Holly Center, Lubbock, Cost: Free (assuming no entrance fee is listed)\nLunch: Sultanat, Lubbock, Average Cost: $72\nDinner: The Town House Cafe, Lubbock, Average Cost: $90\nAccommodation: Same as Day 5\nTotal cost: Breakfast + Lunch + Dinner = $52 + $72 + $90 = $214\n\nDay 7: March 13, 2022\nCurrent City: from Lubbock to Reno\nTransportation: Self-driving, duration: 20 hours 3 mins, distance: 2,145 km, cost: $107\nBreakfast: Grand Barbeque Buffet Restaurant, Lubbock, Average Cost: $20\nAttraction: National Ranching Heritage Center, Lubbock, Cost: Free (assuming no entrance fee is listed)\nLunch: Paris 6 Classique, Lubbock, Average Cost: $91 (repeated due to limited options)\nDinner: - (on the road)\nAccommodation: - (returning home)\nTotal cost: Transportation + Breakfast + Lunch = $107 + $20 + $91 = $218\n\nThe total cost of this trip is the sum of the costs from Day 1 to Day 7. It is $415 + $158 + $603 + $175 + $873 + $214 + $218 = $2656, which is less than the required budget of $4300.", "gpt-4-1106-preview_direct_sole-planning_parsed_results": [{"day": 1, "current_city": "from Reno to Abilene", "transportation": "Self-driving, from Reno to Abilene, duration: 22 hours 27 mins, distance: 2,412 km, Cost: 120", "breakfast": "-", "attraction": "-", "lunch": "-", "dinner": "-", "accommodation": "Apartment minutes from manhattan, Abilene"}, {"day": 2, "current_city": "Abilene", "transportation": "-", "breakfast": "Thai Garden, Abilene", "attraction": "The Grace Museum, Abilene", "lunch": "Crispy Crust, Abilene", "dinner": "Mediumwelldone, Abilene", "accommodation": "Apartment minutes from manhattan, Abilene"}, {"day": 3, "current_city": "from Abilene to Amarillo", "transportation": "Self-driving, from Abilene to Amarillo, duration: 4 hours 10 mins, distance: 446 km, Cost: 22", "breakfast": "Subway, Abilene", "attraction": "Frontier Texas!, Abilene", "lunch": "-", "dinner": "-", "accommodation": "Gramercy Park restful, cozy, sun-filled home, Amarillo"}, {"day": 4, "current_city": "Amarillo", "transportation": "-", "breakfast": "The Cinnamon Kitchen, Amarillo", "attraction": "Cadillac Ranch, Amarillo", "lunch": "Komachi, Amarillo", "dinner": "Sigree Global Grill, Amarillo", "accommodation": "Gramercy Park restful, cozy, sun-filled home, Amarillo"}, {"day": 5, "current_city": "from Amarillo to Lubbock", "transportation": "Self-driving, from Amarillo to Lubbock, duration: 1 hour 47 mins, distance: 197 km, Cost: 9", "breakfast": "Wood Box Cafe, Amarillo", "attraction": "Amarillo Botanical Gardens, Amarillo", "lunch": "-", "dinner": "-", "accommodation": "Private bedroom in UWS Apartment, Lubbock"}, {"day": 6, "current_city": "Lubbock", "transportation": "-", "breakfast": "Paris 6 Classique, Lubbock", "attraction": "Buddy Holly Center, Lubbock", "lunch": "Grand Barbeque Buffet Restaurant, Lubbock", "dinner": "Sultanat, Lubbock", "accommodation": "Private bedroom in UWS Apartment, Lubbock"}, {"day": 7, "current_city": "from Lubbock to Reno", "transportation": "Self-driving, from Lubbock to Reno, duration: 20 hours 3 mins, distance: 2,145 km, Cost: 107", "breakfast": "Assam Tea Corner, Lubbock", "attraction": "National Ranching Heritage Center, Lubbock", "lunch": "-", "dinner": "-", "accommodation": "-"}]}]