[{"gpt-4-1106-preview_direct_sole-planning_results": "Travel Plan:\n\nDay 1: March 16, 2022\nCurrent City: from San Jose to Portland\nTransportation: Self-driving, from San Jose to Portland, duration: 10 hours 14 mins, distance: 1,073 km, cost: $53\nBreakfast: - (Assuming breakfast in San Jose before departure)\nAttraction: Washington Park, Portland\nLunch: Nacho Mamas Burritos, Portland, Cost: $54, Cuisines: \"Chinese, Pizza, Seafood, Italian\"\nDinner: Cactus Flower Cafe Navarre, Portland, Cost: $48, Cuisines: \"Cafe, Italian, BBQ, Fast Food, Chinese\"\nAccommodation: The Palace of Perhaps (Bushwick / Ridgewood), Portland, Cost: $761, Maximum Occupancy: 1, House Rules: No children under 10 & No smoking & No pets, Minimum Nights: 2\n\nNumber of People = 2\nTotal Cost = 2 * $53 + 2 * $54 + 2 * $48 + $761 = $1021\nAccommodation Minimum Nights: 1/2\n\nDay 2: March 17, 2022\nCurrent City: Portland\nTransportation: -\nBreakfast: Barbeque Nation, Portland, Cost: $79, Cuisines: \"Mediterranean, Desserts, Fast Food\"\nAttraction: Lan Su Chinese Garden, Portland\nLunch: Mighty Mughlai, Portland, Cost: $12, Cuisines: \"Tea, Pizza, Mexican, Cafe, Mediterranean, Seafood\"\nDinner: Zizo, Portland, Cost: $87, Cuisines: \"Pizza, French, BBQ, Cafe, Mediterranean\"\nAccommodation: The Palace of Perhaps (Bushwick / Ridgewood), Portland, Cost: $761, Maximum Occupancy: 1, House Rules: No children under 10 & No smoking & No pets, Minimum Nights: 2\n\nNumber of People = 2\nTotal Cost = 2 * $79 + 2 * $12 + 2 * $87 + $761 = $1117\nAccommodation Minimum Nights: 2/2\n\nDay 3: March 18, 2022\nCurrent City: from Portland to San Jose\nTransportation: Self-driving, from Portland to San Jose, duration: 10 hours 20 mins, distance: 1,074 km, cost: $53\nBreakfast: The Coffee Bean & Tea Leaf, Portland, Cost: $24, Cuisines: \"Tea, Cafe, Desserts\"\nAttraction: Oregon Zoo, Portland\nLunch: Bella Italia, Portland, Cost: $47, Cuisines: \"Desserts, Mexican, Indian, BBQ\"\nDinner: - (Assuming dinner in San Jose after arrival)\nAccommodation: -\n\nNumber of People = 2\nTotal Cost = 2 * $53 + 2 * $24 + 2 * $47 = $198\n\nTotal cost across all days = $1021 + $1117 + $198 = $2336\n\nNote: The total cost exceeds the specified budget of $1,000. To adhere to the budget, we need to make adjustments. Here's the revised plan with budget considerations:\n\nRevised Travel Plan:\n\nDay 1: March 16, 2022\n- Same as above, but choose the cheapest accommodation that allows pets.\nAccommodation: Big and Relaxing studio; great location, Portland, Cost: $206, Maximum Occupancy: 3, House Rules: No smoking & No children under 10, Minimum Nights: 2\n\nRevised Total Cost for Day 1 = 2 * $53 + 2 * $54 + 2 * $48 + $206 = $466\n\nDay 2: March 17, 2022\n- Same as above, but remove the most expensive meal.\nBreakfast: Salad Days, Portland, Cost: $41, Cuisines: \"Tea, Cafe, Indian\"\n\nRevised Total Cost for Day 2 = 2 * $41 + 2 * $12 + $206 = $312\n\nDay 3: March 18, 2022\n- Same as above.\n\nRevised Total Cost for Day 3 = $198\n\nRevised Total cost across all days = $466 + $312 + $198 = $976\n\nCuisines: The revised plan includes Mediterranean, French, Mexican, and Indian food as requested.\n\nPlease note that the revised plan is a suggestion to meet the budget constraint, and some preferences may not be fully accommodated.", "gpt-4-1106-preview_direct_sole-planning_parsed_results": [{"day": 1, "current_city": "from San Jose to Portland", "transportation": "Self-driving, from San Jose to Portland, duration: 10 hours 14 mins, distance: 1,073 km", "breakfast": "-", "attraction": "Washington Park, Portland", "lunch": "Nacho Mamas Burritos, Portland", "dinner": "Cactus Flower Cafe Navarre, Portland", "accommodation": "Big and Relaxing studio; great location, Portland"}, {"day": 2, "current_city": "Portland", "transportation": "-", "breakfast": "Salad Days, Portland", "attraction": "Lan Su Chinese Garden, Portland", "lunch": "Mighty Mughlai, Portland", "dinner": "Zizo, Portland", "accommodation": "Big and Relaxing studio; great location, Portland"}, {"day": 3, "current_city": "from Portland to San Jose", "transportation": "Self-driving, from Portland to San Jose, duration: 10 hours 20 mins, distance: 1,074 km", "breakfast": "The Coffee Bean & Tea Leaf, Portland", "attraction": "Oregon Zoo, Portland", "lunch": "Bella Italia, Portland", "dinner": "-", "accommodation": "-"}]}]