[{"gpt-4-1106-preview_direct_sole-planning_results": "Travel Plan:\n\nDay 1: March 23, 2022\nCurrent City: from Newark to Cleveland\nTransportation: Flight Number: F3894139, from Newark to Cleveland, Departure Time: 07:28, Arrival Time: 08:53, Cost: $181 per person\nBreakfast: - (Assuming breakfast is not required as the flight is early in the morning)\nAttraction: Rock & Roll Hall of Fame, Cleveland\nLunch: Bikanerwala, Cleveland, Cost: $10, Cuisines: \"Tea, Bakery, BBQ, Fast Food\"\nAttraction: Cleveland Museum of Art, Cleveland\nDinner: Makhan Fish and Chicken Corner, Cleveland, Cost: $25, Cuisines: \"Pizza, French, Fast Food, Chinese, Seafood\"\nAccommodation: Richmond Hill 3 Bedroom apartment in Private home!, Cleveland, Cost: $565, Maximum Occupancy: 4, House Rules: No visitors\n\nNumber of People = 2\nTotal Cost = 2 * $181 + 2 * $10 + 2 * $25 + $565 = $997\n\nDay 2: March 24, 2022\nCurrent City: Cleveland\nTransportation: -\nBreakfast: Green Leaf, Cleveland, Cost: $73, Cuisines: \"Desserts, Tea, Cafe, BBQ, Chinese\"\nAttraction: Cleveland Metroparks Zoo, Cleveland\nLunch: Big Chicken, Cleveland, Cost: $27, Cuisines: \"Cafe, Pizza, Bakery, Italian\"\nAttraction: Great Lakes Science Center, Cleveland\nDinner: Master Bakers, Cleveland, Cost: $80, Cuisines: \"Tea, Pizza, Italian, BBQ, Seafood\"\nAccommodation: Richmond Hill 3 Bedroom apartment in Private home!, Cleveland, Cost: $565, Maximum Occupancy: 4, House Rules: No visitors\n\nNumber of People = 2\nTotal Cost = 2 * $73 + 2 * $27 + 2 * $80 + $565 = $925\n\nDay 3: March 25, 2022\nCurrent City: from Cleveland to Columbus\nTransportation: Taxi from Cleveland to Columbus, Cost: $228\nBreakfast: -\nAttraction: Center of Science and Industry (COSI), Columbus\nLunch: Desire Foods, Columbus, Cost: $23, Cuisines: \"Desserts, Tea, French, Mexican, Bakery\"\nAttraction: Columbus Museum of Art, Columbus\nDinner: Love Is Cakes, Columbus, Cost: $42, Cuisines: \"Desserts, Pizza, Mexican, BBQ, Chinese, Seafood\"\nAccommodation: The Art Of Living - Loft apartment, Columbus, Cost: $861, Maximum Occupancy: 6, House Rules: No smoking & No visitors\n\nNumber of People = 2\nTotal Cost = $228 + 2 * $23 + 2 * $42 + $861 = $1219\n\nDay 4: March 26, 2022\nCurrent City: Columbus\nTransportation: -\nBreakfast: KC Bakers, Columbus, Cost: $31, Cuisines: \"Desserts, Tea, Pizza, Italian, Bakery\"\nAttraction: Franklin Park Conservatory and Botanical Gardens, Columbus\nLunch: The Irish House, Columbus, Cost: $65, Cuisines: \"Desserts, Tea, Pizza, Mexican, Fast Food, Mediterranean\"\nAttraction: Columbus Zoo and Aquarium, Columbus\nDinner: Chulha Punjabi Da, Columbus, Cost: $55, Cuisines: \"Desserts, Tea, Pizza, Bakery, Chinese\"\nAccommodation: The Art Of Living - Loft apartment, Columbus, Cost: $861, Maximum Occupancy: 6, House Rules: No smoking & No visitors\n\nNumber of People = 2\nTotal Cost = 2 * $31 + 2 * $65 + 2 * $55 + $861 = $1159\n\nDay 5: March 27, 2022\nCurrent City: from Columbus to Newark\nTransportation: Flight Number: F4076769, from Columbus to Newark, Departure Time: 07:09, Arrival Time: 09:01, Cost: $145 per person\nBreakfast: -\nAttraction: - (Assuming no time for attractions due to early flight)\nLunch: - (Assuming lunch is not required as the travelers will have arrived at their destination)\nDinner: - (Assuming dinner is not required as the travelers will have arrived at their destination)\nAccommodation: -\n\nNumber of People = 2\nTotal Cost = 2 * $145 = $290\n\nTotal cost across all days = $997 + $925 + $1219 + $1159 + $290 = $4590\n\nUnfortunately, the total cost exceeds the specified budget of $4,400. To adjust the plan within the budget, we can consider the following options:\n- Opt for a less expensive accommodation in Cleveland or Columbus.\n- Choose more budget-friendly restaurants for some of the meals.\n- Re-evaluate the attractions to see if any have free admission or discounts available.\n\nPlease note that the travel plan does not include personal expenses, such as souvenirs or additional snacks, and assumes that the cost of breakfast on travel days is not required due to early departures. Additionally, the cost of lunch and dinner on the last day is not included as the travelers will have arrived at their destination.", "gpt-4-1106-preview_direct_sole-planning_parsed_results": [{"day": 1, "current_city": "from Newark to Cleveland", "transportation": "Flight Number: F3894139, from Newark to Cleveland, Departure Time: 07:28, Arrival Time: 08:53", "breakfast": "-", "attraction": "Rock & Roll Hall of Fame, Cleveland;Cleveland Museum of Art, Cleveland;", "lunch": "Bikanerwala, Cleveland", "dinner": "Makhan Fish and Chicken Corner, Cleveland", "accommodation": "Richmond Hill 3 Bedroom apartment in Private home!, Cleveland"}, {"day": 2, "current_city": "Cleveland", "transportation": "-", "breakfast": "Green Leaf, Cleveland", "attraction": "Cleveland Metroparks Zoo, Cleveland;Great Lakes Science Center, Cleveland;", "lunch": "Big Chicken, Cleveland", "dinner": "Master Bakers, Cleveland", "accommodation": "Richmond Hill 3 Bedroom apartment in Private home!, Cleveland"}, {"day": 3, "current_city": "from Cleveland to Columbus", "transportation": "Taxi from Cleveland to Columbus", "breakfast": "-", "attraction": "Center of Science and Industry (COSI), Columbus;Columbus Museum of Art, Columbus;", "lunch": "Desire Foods, Columbus", "dinner": "Love Is Cakes, Columbus", "accommodation": "The Art Of Living - Loft apartment, Columbus"}, {"day": 4, "current_city": "Columbus", "transportation": "-", "breakfast": "KC Bakers, Columbus", "attraction": "Franklin Park Conservatory and Botanical Gardens, Columbus;Columbus Zoo and Aquarium, Columbus;", "lunch": "The Irish House, Columbus", "dinner": "Chulha Punjabi Da, Columbus", "accommodation": "The Art Of Living - Loft apartment, Columbus"}, {"day": 5, "current_city": "from Columbus to Newark", "transportation": "Flight Number: F4076769, from Columbus to Newark, Departure Time: 07:09, Arrival Time: 09:01", "breakfast": "-", "attraction": "-", "lunch": "-", "dinner": "-", "accommodation": "-"}]}]