[{"gpt-4-1106-preview_direct_sole-planning_results": "Travel Plan:\n\nDay 1: March 27th, 2022\nCurrent City: from Denver to Palm Springs\nTransportation: Flight Number: F3880999, from Denver to Palm Springs, Departure Time: 11:16, Arrival Time: 12:28\nBreakfast: - (Assuming breakfast is had before the flight)\nAttraction: Palm Springs Art Museum, Palm Springs\nLunch: Bar Gernika Basque Pub & Eatery, Palm Springs\nDinner: Houndstooth Grill & Tavern, Palm Springs\nAccommodation: Brooklyn Gem, Palm Springs\n\nDay 2: March 28th, 2022\nCurrent City: Palm Springs\nTransportation: -\nBreakfast: Kahill's Steak-Fish Chophouse, Palm Springs\nAttraction: Moorten Botanical Garden, Palm Springs; Palm Springs Aerial Tramway, Palm Springs\nLunch: Sugar & Spice - Le Marche, Palm Springs\nDinner: Jaan, Palm Springs\nAccommodation: Brooklyn Gem, Palm Springs\n\nDay 3: March 29th, 2022\nCurrent City: from Palm Springs to Denver\nTransportation: Flight Number: F3870469, from Palm Springs to Denver, Departure Time: 16:00, Arrival Time: 19:12\nBreakfast: Pizza Man, Palm Springs\nAttraction: Indian Canyons, Palm Springs\nLunch: Palaaram, Palm Springs\nDinner: - (Assuming dinner is had after arrival in Denver or on the flight)\nAccommodation: -\n\nPlease note that the accommodation \"Brooklyn Gem\" has been chosen for its proximity to attractions and restaurants, and it meets the minimum nights stay requirement. The restaurants and attractions were selected based on their presence in Palm Springs and to ensure a diverse experience. The flights were chosen to fit within the travel dates and budget constraints.", "gpt-4-1106-preview_direct_sole-planning_parsed_results": [{"day": 1, "current_city": "from Denver to Palm Springs", "transportation": "Flight Number: F3880999, from Denver to Palm Springs, Departure Time: 11:16, Arrival Time: 12:28", "breakfast": "-", "attraction": "Palm Springs Art Museum, Palm Springs;", "lunch": "Bar Gernika Basque Pub & Eatery, Palm Springs", "dinner": "Houndstooth Grill & Tavern, Palm Springs", "accommodation": "Brooklyn Gem, Palm Springs"}, {"day": 2, "current_city": "Palm Springs", "transportation": "-", "breakfast": "Kahill's Steak-Fish Chophouse, Palm Springs", "attraction": "Moorten Botanical Garden, Palm Springs; Palm Springs Aerial Tramway, Palm Springs;", "lunch": "Sugar & Spice - Le Marche, Palm Springs", "dinner": "Jaan, Palm Springs", "accommodation": "Brooklyn Gem, Palm Springs"}, {"day": 3, "current_city": "from Palm Springs to Denver", "transportation": "Flight Number: F3870469, from Palm Springs to Denver, Departure Time: 16:00, Arrival Time: 19:12", "breakfast": "Pizza Man, Palm Springs", "attraction": "Indian Canyons, Palm Springs;", "lunch": "Palaaram, Palm Springs", "dinner": "-", "accommodation": "-"}]}]