[{"gpt-4-1106-preview_direct_sole-planning_results": "Travel Plan:\n\nDay 1: March 23, 2022\nCurrent City: from Denver to Seattle\nTransportation: Flight Number: F3519512, from Denver to Seattle, Departure Time: 06:27, Arrival Time: 08:32\nBreakfast: -\nAttraction: Pike Place Market, Seattle.\nLunch: Ting's Red Lantern, Seattle\nDinner: Ceviche Tapas Bar & Restaurant, Seattle\nAccommodation: Shared Apartment by Times Square Manhattan, Seattle\n\nDay 2: March 24, 2022\nCurrent City: Seattle\nTransportation: -\nBreakfast: Caf\u6106 Burger BC, Seattle\nAttraction: Space Needle, Seattle; Chihuly Garden and Glass, Seattle.\nLunch: The Godinho's, Seattle\nDinner: Mother Ringlet, Seattle\nAccommodation: Shared Apartment by Times Square Manhattan, Seattle\n\nDay 3: March 25, 2022\nCurrent City: from Seattle to Yakima\nTransportation: Flight Number: F3864441, from Seattle to Yakima, Departure Time: 12:54, Arrival Time: 13:32\nBreakfast: Teddy Choco Studio, Seattle\nAttraction: Yakima Valley Museum, Yakima.\nLunch: Sambo Kojin, Yakima\nDinner: Roy's, Yakima\nAccommodation: Large 4 BR West Village townhouse/roof garden, Yakima\n\nDay 4: March 26, 2022\nCurrent City: Yakima\nTransportation: -\nBreakfast: Manzu\u7934, Yakima\nAttraction: Yakima Area Arboretum, Yakima; Yakima Sportsman State Park, Yakima.\nLunch: Britto's Bar & Restaurant, Yakima\nDinner: 60 ML - Country Inn & Suites by Carlson, Yakima\nAccommodation: Large 4 BR West Village townhouse/roof garden, Yakima\n\nDay 5: March 27, 2022\nCurrent City: from Yakima to Denver\nTransportation: Self-driving, from Yakima to Denver, duration: 17 hours 4 mins, distance: 1,872 km, cost: 93\nBreakfast: -\nAttraction: -\nLunch: -\nDinner: -\nAccommodation: -\n\nNote: The accommodation in Seattle, \"Shared Apartment by Times Square Manhattan,\" is named as if it is in New York, but based on the provided CSV content, it is listed under Seattle accommodations. This is likely an error in the dataset, but for the purpose of this travel plan, it is assumed to be located in Seattle.", "gpt-4-1106-preview_direct_sole-planning_parsed_results": [{"day": 1, "current_city": "from Denver to Seattle", "transportation": "Flight Number: F3519512, from Denver to Seattle, Departure Time: 06:27, Arrival Time: 08:32", "breakfast": "-", "attraction": "Pike Place Market, Seattle;", "lunch": "Ting's Red Lantern, Seattle", "dinner": "Ceviche Tapas Bar & Restaurant, Seattle", "accommodation": "Shared Apartment by Times Square Manhattan, Seattle"}, {"day": 2, "current_city": "Seattle", "transportation": "-", "breakfast": "Caf\u00e9 Burger BC, Seattle", "attraction": "Space Needle, Seattle;Chihuly Garden and Glass, Seattle;", "lunch": "The Godinho's, Seattle", "dinner": "Mother Ringlet, Seattle", "accommodation": "Shared Apartment by Times Square Manhattan, Seattle"}, {"day": 3, "current_city": "from Seattle to Yakima", "transportation": "Flight Number: F3864441, from Seattle to Yakima, Departure Time: 12:54, Arrival Time: 13:32", "breakfast": "Teddy Choco Studio, Seattle", "attraction": "Yakima Valley Museum, Yakima;", "lunch": "Sambo Kojin, Yakima", "dinner": "Roy's, Yakima", "accommodation": "Large 4 BR West Village townhouse/roof garden, Yakima"}, {"day": 4, "current_city": "Yakima", "transportation": "-", "breakfast": "Manz\u00fa, Yakima", "attraction": "Yakima Area Arboretum, Yakima;Yakima Sportsman State Park, Yakima;", "lunch": "Britto's Bar & Restaurant, Yakima", "dinner": "60 ML - Country Inn & Suites by Carlson, Yakima", "accommodation": "Large 4 BR West Village townhouse/roof garden, Yakima"}, {"day": 5, "current_city": "from Yakima to Denver", "transportation": "Self-driving, from Yakima to Denver, Duration: 17 hours 4 mins, Distance: 1872 km, Cost: 93", "breakfast": "-", "attraction": "-", "lunch": "-", "dinner": "-", "accommodation": "-"}]}]