[{"gpt-4-1106-preview_direct_sole-planning_results": "Travel Plan:\n\nDay 1: March 19, 2022\nCurrent City: from New York to Charleston\nTransportation: Flight Number: F4066693, from New York to Charleston, Departure Time: 17:48, Arrival Time: 19:56, Cost: $137 * 2 = $274\nBreakfast: - \nAttraction: South Carolina Aquarium, Charleston, Cost: Free (Assuming no entry fee provided)\nLunch: -\nDinner: D\u00f6ner Grill, Charleston, Cost: $67 * 2 = $134, Cuisines: \"French, Pizza, Seafood, Italian\"\nAccommodation: Smart Home in the Heart of Harlem, Charleston, Cost: $499 * 1 = $499, Maximum Occupancy: 3, House Rules: No pets, Minimum Nights: 2\n\nNumber of People = 2\nTotal Cost = $274 (Flight) + $134 (Dinner) + $499 (Accommodation) = $907\nAccommodation Minimum Nights: 1/2\n\nDay 2: March 20, 2022\nCurrent City: Charleston\nTransportation: -\nBreakfast: The Culinary Pitaara, Charleston, Cost: $23 * 2 = $46, Cuisines: \"Tea, Italian, Bakery, BBQ, Cafe\"\nAttraction: The Charleston Museum, Charleston, Cost: Free (Assuming no entry fee provided)\nLunch: That's Y Food, Charleston, Cost: $57 * 2 = $114, Cuisines: \"Mexican, Bakery, Desserts, Fast Food\"\nDinner: Roka, Charleston, Cost: $84 * 2 = $168, Cuisines: \"Desserts, Tea, Mexican, Fast Food, Cafe, Mediterranean\"\nAccommodation: Smart Home in the Heart of Harlem, Charleston, Cost: $499 * 1 = $499, Maximum Occupancy: 3, House Rules: No pets, Minimum Nights: 2\n\nNumber of People = 2\nTotal Cost = $46 (Breakfast) + $114 (Lunch) + $168 (Dinner) + $499 (Accommodation) = $827\nAccommodation Minimum Nights: 2/2\n\nDay 3: March 21, 2022\nCurrent City: from Charleston to New York\nTransportation: Flight Number: F3761876, from Charleston to New York, Departure Time: 18:22, Arrival Time: 20:18, Cost: $139 * 2 = $278\nBreakfast: The Culinary Pitaara, Charleston, Cost: $23 * 2 = $46, Cuisines: \"Tea, Italian, Bakery, BBQ, Cafe\"\nAttraction: Pineapple Fountain, Charleston, Cost: Free (Assuming no entry fee provided)\nLunch: The Grill Kitchen, Charleston, Cost: $88 * 2 = $176, Cuisines: \"Tea, Chinese, BBQ, Cafe\"\nDinner: -\nAccommodation: -\n\nNumber of People = 2\nTotal Cost = $46 (Breakfast) + $176 (Lunch) + $278 (Flight) = $500\n\nTotal cost across all days = $907 (Day 1) + $827 (Day 2) + $500 (Day 3) = $2234\n\nUnfortunately, the total cost exceeds the budget of $1,600. To adjust the plan within the budget, we need to choose cheaper transportation or accommodation options. However, the provided data does not include cheaper options that meet the requirements (allow smoking, not shared rooms). Therefore, we cannot create a travel plan within the given budget based on the provided data.", "gpt-4-1106-preview_direct_sole-planning_parsed_results": [{"day": 1, "current_city": "from New York to Charleston", "transportation": "Flight Number: F4066693, from New York to Charleston, Departure Time: 17:48, Arrival Time: 19:56", "breakfast": "-", "attraction": "South Carolina Aquarium, Charleston;", "lunch": "-", "dinner": "D\u00f6ner Grill, Charleston", "accommodation": "Smart Home in the Heart of Harlem, Charleston"}, {"day": 2, "current_city": "Charleston", "transportation": "-", "breakfast": "The Culinary Pitaara, Charleston", "attraction": "The Charleston Museum, Charleston;", "lunch": "That's Y Food, Charleston", "dinner": "Roka, Charleston", "accommodation": "Smart Home in the Heart of Harlem, Charleston"}, {"day": 3, "current_city": "from Charleston to New York", "transportation": "Flight Number: F3761876, from Charleston to New York, Departure Time: 18:22, Arrival Time: 20:18", "breakfast": "The Culinary Pitaara, Charleston", "attraction": "Pineapple Fountain, Charleston;", "lunch": "The Grill Kitchen, Charleston", "dinner": "-", "accommodation": "-"}]}]