[{"gpt-4-1106-preview_direct_sole-planning_results": "Travel Plan:\n\nDay 1: March 1st\nCurrent City: from Detroit to La Crosse\nTransportation: Taxi, from Detroit to La Crosse, duration: 8 hours 23 mins, distance: 915 km, Cost: $915 * 2 / 4 = $458\nBreakfast: -\nAttraction: Riverside Park, La Crosse, Cost: $0 (assuming no entry fee)\nLunch: Hot Stuff, La Crosse, Average Cost: $11, Cuisines: \"Chinese, Pizza, BBQ\", Cost: $11 * 2 = $22\nDinner: Moti Mahal Delux, La Crosse, Average Cost: $42, Cuisines: \"Desserts, Tea, Pizza, Bakery, Indian, Mediterranean\", Cost: $42 * 2 = $84\nAccommodation: Great location-Newly updated-great new features, La Crosse, Cost: $255, Maximum Occupancy: 2, House Rules: No pets, Minimum Nights: 3, Cost: $255 * 2 / 2 = $255\n\nNumber of People = 2\nTotal Cost = $458 + $22 + $84 + $255 = $819\nAccommodation Minimum Nights: 1/3\n\nDay 2: March 2nd\nCurrent City: La Crosse\nTransportation: -\nBreakfast: Goldy's Breakfast Bistro, La Crosse, Average Cost: $94, Cuisines: \"Desserts, Tea, Cafe, American, Seafood\", Cost: $94 * 2 = $188\nAttraction: Grandad Bluff Park, La Crosse, Cost: $0 (assuming no entry fee)\nLunch: Hot Palayok, La Crosse, Average Cost: $52, Cuisines: \"Fast Food, BBQ, Mediterranean, Seafood\", Cost: $52 * 2 = $104\nDinner: Shri Shyam Ji Ke Mashhoor Chhole Bhature, La Crosse, Average Cost: $30, Cuisines: \"Desserts, Tea, Cafe, French, Fast Food, Chinese\", Cost: $30 * 2 = $60\nAccommodation: Great location-Newly updated-great new features, La Crosse, Cost: $255 * 2 / 2 = $255\n\nNumber of People = 2\nTotal Cost = $188 + $104 + $60 + $255 = $607\nAccommodation Minimum Nights: 2/3\n\nDay 3: March 3rd\nCurrent City: La Crosse\nTransportation: -\nBreakfast: Subway, La Crosse, Average Cost: $23, Cuisines: \"Pizza, Desserts, Italian\", Cost: $23 * 2 = $46\nAttraction: La Crosse Segway Tours, La Crosse, Cost: $0 (assuming no entry fee)\nLunch: Bengal Snacks, La Crosse, Average Cost: $35, Cuisines: \"Bakery, American, Desserts\", Cost: $35 * 2 = $70\nDinner: Delhi Food Adda, La Crosse, Average Cost: $12, Cuisines: \"Desserts, Pizza, Cafe, Indian, Seafood\", Cost: $12 * 2 = $24\nAccommodation: Great location-Newly updated-great new features, La Crosse, Cost: $255 * 2 / 2 = $255\n\nNumber of People = 2\nTotal Cost = $46 + $70 + $24 + $255 = $395\nAccommodation Minimum Nights: 3/3\n\nDay 4: March 4th\nCurrent City: from La Crosse to Appleton\nTransportation: Taxi, from La Crosse to Appleton, duration: 3 hours 2 mins, distance: 273 km, Cost: $273 * 2 / 4 = $137\nBreakfast: -\nAttraction: Hearthstone Historic House Museum, Appleton, Cost: $0 (assuming no entry fee)\nLunch: Mikata Japanese Steakhouse, Appleton, Average Cost: $72, Cuisines: \"Cafe, Pizza, Bakery, Italian\", Cost: $72 * 2 = $144\nDinner: Colony, Appleton, Average Cost: $110, Cuisines: \"Pizza, BBQ, Fast Food, Chinese, Mediterranean, Seafood\", Cost: $110 * 2 = $220\nAccommodation: Large Rooms with Bar and PullOut Prime Greenpoint, Appleton, Cost: $174, Maximum Occupancy: 2, House Rules: No visitors & No smoking & No pets, Minimum Nights: 4, Cost: $174 * 2 / 2 = $174\n\nNumber of People = 2\nTotal Cost = $137 + $144 + $220 + $174 = $675\nAccommodation Minimum Nights: 1/4\n\nDay 5: March 5th\nCurrent City: from Appleton to Detroit\nTransportation: Flight Number: F3642011, from Appleton to Detroit, Price: $68, Departure Time: 11:47, Arrival Time: 13:51, Cost: $68 * 2 = $136\nBreakfast: -\nAttraction: -\nLunch: -\nDinner: -\nAccommodation: -\n\nNumber of People = 2\nTotal Cost = $136\n\nTotal cost across all days = $819 + $607 + $395 + $675 + $136 = $2632\nCuisines: The prompt specifies no cuisines, so all cuisines constraints are satisfied.\n\nNote: The accommodations chosen allow for parties as there are no house rules against it, and they are entire rooms. The transportation modes used are taxi and flight as per the query's request to avoid self-driving. Attractions are assumed to be free of charge, which may not be the case in reality. The budget is within the $3,200 limit.", "gpt-4-1106-preview_direct_sole-planning_parsed_results": [{"day": 1, "current_city": "from Detroit to La Crosse", "transportation": "Taxi, from Detroit to La Crosse, duration: 8 hours 23 mins, distance: 915 km", "breakfast": "-", "attraction": "Riverside Park, La Crosse;", "lunch": "Hot Stuff, La Crosse", "dinner": "Moti Mahal Delux, La Crosse", "accommodation": "Great location-Newly updated-great new features, La Crosse"}, {"day": 2, "current_city": "La Crosse", "transportation": "-", "breakfast": "Goldy's Breakfast Bistro, La Crosse", "attraction": "Grandad Bluff Park, La Crosse;", "lunch": "Hot Palayok, La Crosse", "dinner": "Shri Shyam Ji Ke Mashhoor Chhole Bhature, La Crosse", "accommodation": "Great location-Newly updated-great new features, La Crosse"}, {"day": 3, "current_city": "La Crosse", "transportation": "-", "breakfast": "Subway, La Crosse", "attraction": "La Crosse Segway Tours, La Crosse;", "lunch": "Bengal Snacks, La Crosse", "dinner": "Delhi Food Adda, La Crosse", "accommodation": "Great location-Newly updated-great new features, La Crosse"}, {"day": 4, "current_city": "from La Crosse to Appleton", "transportation": "Taxi, from La Crosse to Appleton, duration: 3 hours 2 mins, distance: 273 km", "breakfast": "-", "attraction": "Hearthstone Historic House Museum, Appleton;", "lunch": "Mikata Japanese Steakhouse, Appleton", "dinner": "Colony, Appleton", "accommodation": "Large Rooms with Bar and PullOut Prime Greenpoint, Appleton"}, {"day": 5, "current_city": "from Appleton to Detroit", "transportation": "Flight Number: F3642011, from Appleton to Detroit, Departure Time: 11:47, Arrival Time: 13:51", "breakfast": "-", "attraction": "-", "lunch": "-", "dinner": "-", "accommodation": "-"}]}]