[{"gpt-4-1106-preview_direct_sole-planning_results": "Travel Plan:\n\nDay 1: March 2, 2022\nCurrent City: from Bakersfield to El Paso\nTransportation: Self-driving, from Bakersfield to El Paso, Duration: 13 hours 25 mins, Distance: 1,468 km, Cost: $73 x 2 (ceil(1/5)) = $146\nBreakfast: -\nAttraction: El Paso Zoo and Botanical Gardens, El Paso, Cost: Free\nLunch: Los Beto's, El Paso, Cost: $34 x 1 = $34, Cuisines: \"Tea, Chinese, Cafe, Desserts\"\nDinner: Shi Cafe, El Paso, Cost: $22 x 1 = $22, Cuisines: \"Desserts, Bakery, Fast Food, Chinese, Seafood\"\nAccommodation: Chic Designer Home Guest Studio, El Paso, Cost: $61 x 1 (ceil(1/3)) = $61, Maximum Occupancy: 3, House Rules: No visitors & No parties, Minimum Nights: 2\n\nNumber of People = 1\nTotal Cost = $146 + $34 + $22 + $61 = $263\nAccommodation Minimum Nights: 1/2\n\nDay 2: March 3, 2022\nCurrent City: El Paso\nTransportation: -\nBreakfast: The Garden Cafe - The Fern, El Paso, Cost: $72 x 1 = $72, Cuisines: \"Desserts, Pizza, Italian, BBQ, Cafe\"\nAttraction: Franklin Mountains State Park, El Paso, Cost: Free\nLunch: Panther Restaurant, El Paso, Cost: $48 x 1 = $48, Cuisines: \"Chinese, BBQ, Desserts\"\nDinner: The League Restaurant, El Paso, Cost: $55 x 1 = $55, Cuisines: \"Bakery, BBQ\"\nAccommodation: Chic Designer Home Guest Studio, El Paso, Cost: $61 x 1 (ceil(1/3)) = $61, Maximum Occupancy: 3, House Rules: No visitors & No parties, Minimum Nights: 2\n\nNumber of People = 1\nTotal Cost = $72 + $48 + $55 + $61 = $236\nAccommodation Minimum Nights: 2/2\n\nDay 3: March 4, 2022\nCurrent City: from El Paso to Amarillo\nTransportation: Self-driving, from El Paso to Amarillo, Duration: 6 hours 43 mins, Distance: 704 km, Cost: $35 x 1 = $35\nBreakfast: Coffee Shop - Centaur Hotel, El Paso, Cost: $73 x 1 = $73, Cuisines: \"Tea, Cafe, American, Italian\"\nAttraction: Cadillac Ranch, Amarillo, Cost: Free\nLunch: Kanha North & South Indian Veg., Amarillo, Cost: $34 x 1 = $34, Cuisines: \"Tea, Cafe, BBQ, Fast Food\"\nDinner: The Cinnamon Kitchen, Amarillo, Cost: $69 x 1 = $69, Cuisines: \"Desserts, Tea, Pizza, Chinese, Seafood\"\nAccommodation: Harlem Humble Abode - 1 bedroom - Cute and Quaint, Amarillo, Cost: $409 x 1 (ceil(1/3)) = $409, Maximum Occupancy: 3, House Rules: No pets, Minimum Nights: 5\n\nNumber of People = 1\nTotal Cost = $35 + $73 + $34 + $69 + $409 = $620\nAccommodation Minimum Nights: 1/5\n\nDay 4: March 5, 2022\nCurrent City: Amarillo\nTransportation: -\nBreakfast: Wood Box Cafe, Amarillo, Cost: $11 x 1 = $11, Cuisines: \"Desserts, French, Fast Food, Cafe, American\"\nAttraction: Amarillo Botanical Gardens, Amarillo, Cost: Free\nLunch: Anand Restaurant, Amarillo, Cost: $53 x 1 = $53, Cuisines: \"Fast Food, Seafood, Desserts, Italian\"\nDinner: Foresto Lawn & Restaurant, Amarillo, Cost: $80 x 1 = $80, Cuisines: \"Pizza, Bakery, Mediterranean, Desserts\"\nAccommodation: Harlem Humble Abode - 1 bedroom - Cute and Quaint, Amarillo, Cost: $409 x 1 (ceil(1/3)) = $409, Maximum Occupancy: 3, House Rules: No pets, Minimum Nights: 5\n\nNumber of People = 1\nTotal Cost = $11 + $53 + $80 + $409 = $553\nAccommodation Minimum Nights: 2/5\n\nDay 5: March 6, 2022\nCurrent City: from Amarillo to Dallas\nTransportation: Flight Number: F3609463, from Amarillo to Dallas, Departure Time: 04:58, Arrival Time: 06:29, Cost: $62 x 1 = $62\nBreakfast: Cafe Coffee Day, Amarillo, Cost: $15 x 1 = $15, Cuisines: \"Tea, Bakery, American\"\nAttraction: The Dallas World Aquarium, Dallas, Cost: Free\nLunch: Coconuts Fish Cafe, Dallas, Cost: $38 x 1 = $38, Cuisines: \"Cafe, BBQ, Mediterranean, Fast Food\"\nDinner: Drifters Cafe, Dallas, Cost: $21 x 1 = $21, Cuisines: \"Tea, French, Mexican, Cafe, Seafood\"\nAccommodation: Luxury Williamsburg duplex, private roof terrace, Dallas, Cost: $241 x 1 (ceil(1/3)) = $241, Maximum Occupancy: 3, House Rules: No visitors, Minimum Nights: 4\n\nNumber of People = 1\nTotal Cost = $62 + $15 + $38 + $21 + $241 = $377\nAccommodation Minimum Nights: 1/4\n\nDay 6: March 7, 2022\nCurrent City: Dallas\nTransportation: -\nBreakfast: Cafe Gatherings, Dallas, Cost: $17 x 1 = $17, Cuisines: \"Bakery, Indian, Desserts\"\nAttraction: Reunion Tower, Dallas, Cost: Free\nLunch: Uma Foodies' Hut, Dallas, Cost: $49 x 1 = $49, Cuisines: \"French, Bakery, Seafood\"\nDinner: Firefly India, Dallas, Cost: $87 x 1 = $87, Cuisines: \"Cafe, Bakery, American, Italian\"\nAccommodation: Luxury Williamsburg duplex, private roof terrace, Dallas, Cost: $241 x 1 (ceil(1/3)) = $241, Maximum Occupancy: 3, House Rules: No visitors, Minimum Nights: 4\n\nNumber of People = 1\nTotal Cost = $17 + $49 + $87 + $241 = $394\nAccommodation Minimum Nights: 2/4\n\nDay 7: March 8, 2022\nCurrent City: from Dallas to Bakersfield\nTransportation: Flight Number: F4046499, from Dallas to Bakersfield, Departure Time: 12:41, Arrival Time: 14:10, Cost: $432 x 1 = $432\nBreakfast: MONKS, Dallas, Cost: $24 x 1 = $24, Cuisines: \"Tea, Pizza, Cafe, Mediterranean, Seafood\"\nAttraction: -\nLunch: -\nDinner: -\nAccommodation: -\n\nNumber of People = 1\nTotal Cost = $432 + $24 = $456\n\nTotal cost across all days = $263 + $236 + $620 + $553 + $377 + $394 + $456 = $2899\n\nCuisines: The prompt specifies no cuisines, so all cuisines constraints are satisfied.\n\nRemaining Budget: $6100 - $2899 = $3201\n\nPlease note that the costs for attractions are assumed to be free based on the provided information, and the accommodation costs are calculated per night based on the maximum occupancy and the number of nights required. The transportation costs are calculated based on the cheapest available option that fits the travel dates and the number of people traveling.", "gpt-4-1106-preview_direct_sole-planning_parsed_results": [{"day": 1, "current_city": "from Bakersfield to El Paso", "transportation": "Self-driving, from Bakersfield to El Paso, Duration: 13 hours 25 mins, Distance: 1,468 km", "breakfast": "-", "attraction": "El Paso Zoo and Botanical Gardens, El Paso", "lunch": "Los Beto's, El Paso", "dinner": "Shi Cafe, El Paso", "accommodation": "Chic Designer Home Guest Studio, El Paso"}, {"day": 2, "current_city": "El Paso", "transportation": "-", "breakfast": "The Garden Cafe - The Fern, El Paso", "attraction": "Franklin Mountains State Park, El Paso", "lunch": "Panther Restaurant, El Paso", "dinner": "The League Restaurant, El Paso", "accommodation": "Chic Designer Home Guest Studio, El Paso"}, {"day": 3, "current_city": "from El Paso to Amarillo", "transportation": "Self-driving, from El Paso to Amarillo, Duration: 6 hours 43 mins, Distance: 704 km", "breakfast": "Coffee Shop - Centaur Hotel, El Paso", "attraction": "Cadillac Ranch, Amarillo", "lunch": "Kanha North & South Indian Veg., Amarillo", "dinner": "The Cinnamon Kitchen, Amarillo", "accommodation": "Harlem Humble Abode - 1 bedroom - Cute and Quaint, Amarillo"}, {"day": 4, "current_city": "Amarillo", "transportation": "-", "breakfast": "Wood Box Cafe, Amarillo", "attraction": "Amarillo Botanical Gardens, Amarillo", "lunch": "Anand Restaurant, Amarillo", "dinner": "Foresto Lawn & Restaurant, Amarillo", "accommodation": "Harlem Humble Abode - 1 bedroom - Cute and Quaint, Amarillo"}, {"day": 5, "current_city": "from Amarillo to Dallas", "transportation": "Flight Number: F3609463, from Amarillo to Dallas, Departure Time: 04:58, Arrival Time: 06:29", "breakfast": "Cafe Coffee Day, Amarillo", "attraction": "The Dallas World Aquarium, Dallas", "lunch": "Coconuts Fish Cafe, Dallas", "dinner": "Drifters Cafe, Dallas", "accommodation": "Luxury Williamsburg duplex, private roof terrace, Dallas"}, {"day": 6, "current_city": "Dallas", "transportation": "-", "breakfast": "Cafe Gatherings, Dallas", "attraction": "Reunion Tower, Dallas", "lunch": "Uma Foodies' Hut, Dallas", "dinner": "Firefly India, Dallas", "accommodation": "Luxury Williamsburg duplex, private roof terrace, Dallas"}, {"day": 7, "current_city": "from Dallas to Bakersfield", "transportation": "Flight Number: F4046499, from Dallas to Bakersfield, Departure Time: 12:41, Arrival Time: 14:10", "breakfast": "MONKS, Dallas", "attraction": "-", "lunch": "-", "dinner": "-", "accommodation": "-"}]}]