[{"gpt-4-1106-preview_direct_sole-planning_results": "Travel Plan:\n\nDay 1: March 27, 2022\nCurrent City: from Durango to Amarillo\nTransportation: Self-driving, from Durango to Amarillo, Duration: 7 hours 36 mins, Distance: 802 km, Cost: $40\nBreakfast: - (Assuming breakfast in Durango before departure)\nAttraction: Cadillac Ranch, Amarillo\nLunch: The Cinnamon Kitchen, Amarillo (Chinese, Seafood)\nDinner: Punjabi Chaap Corner, Amarillo (Indian, Fast Food)\nAccommodation: Gramercy Park restful, cozy, sun-filled home, Amarillo (Price: $968, Minimum Nights: 2)\n\nDay 2: March 28, 2022\nCurrent City: Amarillo\nTransportation: -\nBreakfast: Wood Box Cafe, Amarillo (American, Cafe)\nAttraction: Amarillo Botanical Gardens, Amarillo; Amarillo Zoo, Amarillo\nLunch: Sigree Global Grill, Amarillo (Chinese, BBQ)\nDinner: Anand Restaurant, Amarillo (Seafood, Italian with Indian influence)\nAccommodation: Gramercy Park restful, cozy, sun-filled home, Amarillo\n\nDay 3: March 29, 2022\nCurrent City: from Amarillo to San Angelo\nTransportation: Self-driving, from Amarillo to San Angelo, Duration: 4 hours 35 mins, Distance: 492 km, Cost: $24\nBreakfast: - (Assuming breakfast at the accommodation in Amarillo)\nAttraction: San Angelo Museum of Fine Arts, San Angelo; Fort Concho National Historic Landmark, San Angelo\nLunch: DePalma's Italian Cafe - Downtown, San Angelo (Chinese influence)\nDinner: 6 Ballygunge Place, San Angelo (Indian, Cafe)\nAccommodation: INCREDIBLE TOWNHOUSE 4 STORIES 5 BEDROOMS 3 BATH, San Angelo (Price: $338, Minimum Nights: 2)\n\nDay 4: March 30, 2022\nCurrent City: San Angelo\nTransportation: -\nBreakfast: District 6, San Angelo (American, Cafe)\nAttraction: San Angelo State Park, San Angelo; International Waterlily Collection, San Angelo\nLunch: Chinese Food, San Angelo (Fast Food, Bakery with Chinese influence)\nDinner: Needs Gourmet, San Angelo (Italian with Indian influence)\nAccommodation: INCREDIBLE TOWNHOUSE 4 STORIES 5 BEDROOMS 3 BATH, San Angelo\n\nDay 5: March 31, 2022\nCurrent City: from San Angelo to Durango\nTransportation: Self-driving, from San Angelo to Durango, Duration: 10 hours 57 mins, Distance: 1,155 km, Cost: $57\nBreakfast: - (Assuming breakfast at the accommodation in San Angelo)\nAttraction: - (Travel day, no attractions planned)\nLunch: - (On the road)\nDinner: - (Assuming dinner in Durango after arrival)\nAccommodation: -\n\nTotal Estimated Costs:\nAccommodation: $968 x 2 nights (Amarillo) + $338 x 2 nights (San Angelo) = $2,612\nTransportation: $40 (Durango to Amarillo) + $24 (Amarillo to San Angelo) + $57 (San Angelo to Durango) = $121\nTotal: $2,612 (Accommodation) + $121 (Transportation) = $2,733\n\nNote: The total estimated cost exceeds the budget of $2,300. To stay within budget, consider adjusting the accommodation to more affordable options or reducing other expenses.", "gpt-4-1106-preview_direct_sole-planning_parsed_results": [{"day": 1, "current_city": "from Durango to Amarillo", "transportation": "Self-driving, from Durango to Amarillo, Duration: 7 hours 36 mins, Distance: 802 km, Cost: 40", "breakfast": "-", "attraction": "Cadillac Ranch, Amarillo;", "lunch": "The Cinnamon Kitchen, Amarillo", "dinner": "Punjabi Chaap Corner, Amarillo", "accommodation": "Gramercy Park restful, cozy, sun-filled home, Amarillo"}, {"day": 2, "current_city": "Amarillo", "transportation": "-", "breakfast": "Wood Box Cafe, Amarillo", "attraction": "Amarillo Botanical Gardens, Amarillo;Amarillo Zoo, Amarillo;", "lunch": "Sigree Global Grill, Amarillo", "dinner": "Anand Restaurant, Amarillo", "accommodation": "Gramercy Park restful, cozy, sun-filled home, Amarillo"}, {"day": 3, "current_city": "from Amarillo to San Angelo", "transportation": "Self-driving, from Amarillo to San Angelo, Duration: 4 hours 35 mins, Distance: 492 km, Cost: 24", "breakfast": "-", "attraction": "San Angelo Museum of Fine Arts, San Angelo;Fort Concho National Historic Landmark, San Angelo;", "lunch": "DePalma's Italian Cafe - Downtown, San Angelo", "dinner": "6 Ballygunge Place, San Angelo", "accommodation": "INCREDIBLE TOWNHOUSE 4 STORIES 5 BEDROOMS 3 BATH, San Angelo"}, {"day": 4, "current_city": "San Angelo", "transportation": "-", "breakfast": "District 6, San Angelo", "attraction": "San Angelo State Park, San Angelo;International Waterlily Collection, San Angelo;", "lunch": "Chinese Food, San Angelo", "dinner": "Needs Gourmet, San Angelo", "accommodation": "INCREDIBLE TOWNHOUSE 4 STORIES 5 BEDROOMS 3 BATH, San Angelo"}, {"day": 5, "current_city": "from San Angelo to Durango", "transportation": "Self-driving, from San Angelo to Durango, Duration: 10 hours 57 mins, Distance: 1155 km, Cost: 57", "breakfast": "-", "attraction": "-", "lunch": "-", "dinner": "-", "accommodation": "-"}]}]