[{"gpt-4-1106-preview_direct_sole-planning_results": "Travel Plan:\n\nDay 1: March 8th\nCurrent City: from Fort Lauderdale to New Orleans\nTransportation: Self-driving, Duration: 11 hours 54 mins, Distance: 1,356 km, Cost: $67\nBreakfast: -\nAttraction: -\nLunch: -\nDinner: -\nAccommodation: Cozy Renovated 2 Bedroom Apartment Heart of Brklyn, New Orleans (Entire home/apt, No visitors & No parties, Minimum nights: 30, Cost: $890 per night)\n\nDay 2: March 9th\nCurrent City: New Orleans\nTransportation: -\nBreakfast: Jimmy's Pancake House, New Orleans\nAttraction: New Orleans City Park, New Orleans\nLunch: The Fish House, New Orleans\nDinner: Town Table Restaurant, New Orleans\nAccommodation: Cozy Renovated 2 Bedroom Apartment Heart of Brklyn, New Orleans\n\nDay 3: March 10th\nCurrent City: from New Orleans to Baton Rouge\nTransportation: Self-driving, Duration: 1 hour 17 mins, Distance: 131 km, Cost: $6\nBreakfast: Momo-Cha, New Orleans\nAttraction: Louisiana's Old State Capitol, Baton Rouge\nLunch: Taste of India, Baton Rouge\nDinner: Bluebird Diner, Baton Rouge\nAccommodation: Spacious 1 Bedroom in Historic Brownstone, Baton Rouge (Entire home/apt, No smoking, Minimum nights: 7, Cost: $670 per night)\n\nDay 4: March 11th\nCurrent City: Baton Rouge\nTransportation: -\nBreakfast: Jimmy Jack's Rib Shack, Baton Rouge\nAttraction: USS KIDD Veterans Museum, Baton Rouge\nLunch: Tursi's Latin King, Baton Rouge\nDinner: Zen Japanese Steakhouse and Sushi Bar, Baton Rouge\nAccommodation: Spacious 1 Bedroom in Historic Brownstone, Baton Rouge\n\nDay 5: March 12th\nCurrent City: from Baton Rouge to Shreveport\nTransportation: Self-driving, Duration: 3 hours 42 mins, Distance: 397 km, Cost: $19\nBreakfast: Fifth Street Bagelry, Baton Rouge\nAttraction: Sci-Port Discovery Center, Shreveport\nLunch: The Coffee Club, Shreveport\nDinner: Hungrill, Shreveport\nAccommodation: Gorgeous 2 bedroom apt in Ditmas Park\\n1300 ft.\u00b2, Shreveport (Entire home/apt, No parties, Minimum nights: 2, Cost: $713 per night)\n\nDay 6: March 13th\nCurrent City: Shreveport\nTransportation: -\nBreakfast: Longstreet Cafe, Shreveport\nAttraction: Shreveport Aquarium, Shreveport\nLunch: Giani, Shreveport\nDinner: Punjabi Culture, Shreveport\nAccommodation: Gorgeous 2 bedroom apt in Ditmas Park\\n1300 ft.\u00b2, Shreveport\n\nDay 7: March 14th\nCurrent City: from Shreveport to Fort Lauderdale\nTransportation: Self-driving, Duration: 16 hours 3 mins, Distance: 1,772 km, Cost: $88\nBreakfast: -\nAttraction: -\nLunch: -\nDinner: -\nAccommodation: -\n\nTotal Estimated Cost: Transportation ($67 + $6 + $19 + $88) + Accommodation ($890 + $890 + $670 + $670 + $713 + $713) = $180 + $4546 = $4726\n\nNote: The total estimated cost exceeds the budget of $4,400. Adjustments to the accommodation or dining options may be necessary to stay within budget.", "gpt-4-1106-preview_direct_sole-planning_parsed_results": [{"day": 1, "current_city": "from Fort Lauderdale to New Orleans", "transportation": "Self-driving, Duration: 11 hours 54 mins, Distance: 1356 km, Cost: 67", "breakfast": "-", "attraction": "-", "lunch": "-", "dinner": "-", "accommodation": "Cozy Renovated 2 Bedroom Apartment Heart of Brklyn, New Orleans"}, {"day": 2, "current_city": "New Orleans", "transportation": "-", "breakfast": "Jimmy's Pancake House, New Orleans", "attraction": "New Orleans City Park, New Orleans;", "lunch": "The Fish House, New Orleans", "dinner": "Town Table Restaurant, New Orleans", "accommodation": "Cozy Renovated 2 Bedroom Apartment Heart of Brklyn, New Orleans"}, {"day": 3, "current_city": "from New Orleans to Baton Rouge", "transportation": "Self-driving, Duration: 1 hour 17 mins, Distance: 131 km, Cost: 6", "breakfast": "Momo-Cha, New Orleans", "attraction": "Louisiana's Old State Capitol, Baton Rouge;", "lunch": "Taste of India, Baton Rouge", "dinner": "Bluebird Diner, Baton Rouge", "accommodation": "Spacious 1 Bedroom in Historic Brownstone, Baton Rouge"}, {"day": 4, "current_city": "Baton Rouge", "transportation": "-", "breakfast": "Jimmy Jack's Rib Shack, Baton Rouge", "attraction": "USS KIDD Veterans Museum, Baton Rouge;", "lunch": "Tursi's Latin King, Baton Rouge", "dinner": "Zen Japanese Steakhouse and Sushi Bar, Baton Rouge", "accommodation": "Spacious 1 Bedroom in Historic Brownstone, Baton Rouge"}, {"day": 5, "current_city": "from Baton Rouge to Shreveport", "transportation": "Self-driving, Duration: 3 hours 42 mins, Distance: 397 km, Cost: 19", "breakfast": "Fifth Street Bagelry, Baton Rouge", "attraction": "Sci-Port Discovery Center, Shreveport;", "lunch": "The Coffee Club, Shreveport", "dinner": "Hungrill, Shreveport", "accommodation": "Gorgeous 2 bedroom apt in Ditmas Park, Shreveport"}, {"day": 6, "current_city": "Shreveport", "transportation": "-", "breakfast": "Longstreet Cafe, Shreveport", "attraction": "Shreveport Aquarium, Shreveport;", "lunch": "Giani, Shreveport", "dinner": "Punjabi Culture, Shreveport", "accommodation": "Gorgeous 2 bedroom apt in Ditmas Park, Shreveport"}, {"day": 7, "current_city": "from Shreveport to Fort Lauderdale", "transportation": "Self-driving, Duration: 16 hours 3 mins, Distance: 1772 km, Cost: 88", "breakfast": "-", "attraction": "-", "lunch": "-", "dinner": "-", "accommodation": "-"}]}]