[{"gpt-4-1106-preview_direct_sole-planning_results": "Travel Plan:\n\nDay 1: Missoula to Abilene\nCurrent City: from Missoula to Abilene\nTransportation: Self-driving, from Missoula to Abilene, Duration: 23 hours 1 min, Distance: 2,562 km, Cost: 128\nBreakfast: -\nAttraction: -\nLunch: -\nDinner: -\nAccommodation: Joyce and Donovan's, Room for One, Abilene, Cost: 83, Room Type: Private room, House Rules: No parties, Minimum Nights: 1, Maximum Occupancy: 2\n\nNumber of People = 5\nTotal Cost = 5 * 128 + 5 * 83 = 1055\n\nDay 2: Abilene\nCurrent City: Abilene\nTransportation: -\nBreakfast: Thai Garden, Abilene, Cost: 13, Cuisines: \"Cafe, American, Desserts\"\nAttraction: The Grace Museum, Abilene\nLunch: LPK Waterfront, Abilene, Cost: 61, Cuisines: \"Pizza, Italian, BBQ, Fast Food, Seafood\"\nDinner: Mediumwelldone, Abilene, Cost: 91, Cuisines: \"Tea, French, BBQ, Cafe, Seafood\"\nAccommodation: Joyce and Donovan's, Room for One, Abilene, Cost: 83, Room Type: Private room, House Rules: No parties, Minimum Nights: 1, Maximum Occupancy: 2\n\nNumber of People = 5\nTotal Cost = 5 * 13 + 5 * 61 + 5 * 91 + 5 * 83 = 1240\n\nDay 3: Abilene to Amarillo\nCurrent City: from Abilene to Amarillo\nTransportation: Self-driving, from Abilene to Amarillo, Duration: 4 hours 10 mins, Distance: 446 km, Cost: 22\nBreakfast: Crispy Crust, Abilene, Cost: 54, Cuisines: \"Desserts, Bakery, Cafe, American, Seafood\"\nAttraction: Frontier Texas!, Abilene\nLunch: Chateau Garlic, Abilene, Cost: 42, Cuisines: \"Pizza, Bakery, Desserts, Fast Food\"\nDinner: -\nAccommodation: Gramercy Park restful, cozy, sun-filled home, Amarillo, Cost: 968, Room Type: Entire home/apt, House Rules: No parties, Minimum Nights: 1, Maximum Occupancy: 8\n\nNumber of People = 5\nTotal Cost = 5 * 22 + 5 * 54 + 5 * 42 + 968 = 1868\n\nDay 4: Amarillo\nCurrent City: Amarillo\nTransportation: -\nBreakfast: The Cinnamon Kitchen, Amarillo, Cost: 69, Cuisines: \"Desserts, Tea, Pizza, Chinese, Seafood\"\nAttraction: Cadillac Ranch, Amarillo; Amarillo Botanical Gardens, Amarillo\nLunch: Sigree Global Grill, Amarillo, Cost: 35, Cuisines: \"Chinese, BBQ, Cafe, Desserts\"\nDinner: Komachi, Amarillo, Cost: 71, Cuisines: \"Desserts, Tea, Fast Food, Chinese, Mediterranean\"\nAccommodation: Gramercy Park restful, cozy, sun-filled home, Amarillo, Cost: 968, Room Type: Entire home/apt, House Rules: No parties, Minimum Nights: 1, Maximum Occupancy: 8\n\nNumber of People = 5\nTotal Cost = 5 * 69 + 5 * 35 + 5 * 71 + 968 = 1868\n\nDay 5: Amarillo to Missoula\nCurrent City: from Amarillo to Missoula\nTransportation: Self-driving, from Amarillo to Missoula, Duration: 18 hours 58 mins, Distance: 2,102 km, Cost: 105\nBreakfast: Wood Box Cafe, Amarillo, Cost: 11, Cuisines: \"Desserts, French, Fast Food, Cafe, American\"\nAttraction: Amarillo Zoo, Amarillo\nLunch: Anand Restaurant, Amarillo, Cost: 53, Cuisines: \"Fast Food, Seafood, Desserts, Italian\"\nDinner: -\nAccommodation: -\n\nNumber of People = 5\nTotal Cost = 5 * 105 + 5 * 11 + 5 * 53 = 845\n\nTotal cost across all days = 1055 + 1240 + 1868 + 1868 + 845 = 6876\n\nCuisines: Italian and French cuisines were included in the meals as specified in the query.\n\nPlease note that the travel plan assumes that the group will be self-driving and that the accommodation costs are for one night, even though the group may stay multiple nights. The costs are calculated per day for simplicity. The attractions listed do not include entry fees as they were not provided in the reference information.", "gpt-4-1106-preview_direct_sole-planning_parsed_results": [{"day": 1, "current_city": "from Missoula to Abilene", "transportation": "Self-driving, from Missoula to Abilene, Duration: 23 hours 1 min, Distance: 2,562 km", "breakfast": "-", "attraction": "-", "lunch": "-", "dinner": "-", "accommodation": "Joyce and Donovan's, Room for One, Abilene"}, {"day": 2, "current_city": "Abilene", "transportation": "-", "breakfast": "Thai Garden, Abilene", "attraction": "The Grace Museum, Abilene", "lunch": "LPK Waterfront, Abilene", "dinner": "Mediumwelldone, Abilene", "accommodation": "Joyce and Donovan's, Room for One, Abilene"}, {"day": 3, "current_city": "from Abilene to Amarillo", "transportation": "Self-driving, from Abilene to Amarillo, Duration: 4 hours 10 mins, Distance: 446 km", "breakfast": "Crispy Crust, Abilene", "attraction": "Frontier Texas!, Abilene", "lunch": "Chateau Garlic, Abilene", "dinner": "-", "accommodation": "Gramercy Park restful, cozy, sun-filled home, Amarillo"}, {"day": 4, "current_city": "Amarillo", "transportation": "-", "breakfast": "The Cinnamon Kitchen, Amarillo", "attraction": "Cadillac Ranch, Amarillo;Amarillo Botanical Gardens, Amarillo", "lunch": "Sigree Global Grill, Amarillo", "dinner": "Komachi, Amarillo", "accommodation": "Gramercy Park restful, cozy, sun-filled home, Amarillo"}, {"day": 5, "current_city": "from Amarillo to Missoula", "transportation": "Self-driving, from Amarillo to Missoula, Duration: 18 hours 58 mins, Distance: 2,102 km", "breakfast": "Wood Box Cafe, Amarillo", "attraction": "Amarillo Zoo, Amarillo", "lunch": "Anand Restaurant, Amarillo", "dinner": "-", "accommodation": "-"}]}]