[{"gpt-4-1106-preview_direct_sole-planning_results": "Travel Plan:\n\nDay 1: March 2, 2022\nCurrent City: from Buffalo to Atlanta\nTransportation: Flight Number: F3514187, from Buffalo to Atlanta, Departure Time: 06:51, Arrival Time: 08:40\nBreakfast: -\nAttraction: Georgia Aquarium, Atlanta\nLunch: Saffron, Atlanta\nDinner: Baba Au Rhum, Atlanta\nAccommodation: Spacious private room close St. Barnabas Hospital, Atlanta\n\nDay 2: March 3, 2022\nCurrent City: Atlanta\nTransportation: -\nBreakfast: Adda, Atlanta\nAttraction: Atlanta Botanical Garden, Atlanta; World of Coca-Cola, Atlanta\nLunch: Daawat-e-Kashmir, Atlanta\nDinner: Asian Bistro, Atlanta\nAccommodation: Spacious private room close St. Barnabas Hospital, Atlanta\n\nDay 3: March 4, 2022\nCurrent City: from Atlanta to Buffalo\nTransportation: Flight Number: F3502694, from Atlanta to Buffalo, Departure Time: 15:47, Arrival Time: 17:42\nBreakfast: Ahata, Atlanta\nAttraction: Martin Luther King, Jr. National Historical Park, Atlanta\nLunch: Chef Style, Atlanta\nDinner: -\nAccommodation: -\n\nPlease note that the attractions, restaurants, and accommodation were chosen based on the provided reference information and within the budget constraints. The flight times and accommodation were selected to ensure a comfortable and efficient travel experience.", "gpt-4-1106-preview_direct_sole-planning_parsed_results": [{"day": 1, "current_city": "from Buffalo to Atlanta", "transportation": "Flight Number: F3514187, from Buffalo to Atlanta, Departure Time: 06:51, Arrival Time: 08:40", "breakfast": "-", "attraction": "Georgia Aquarium, Atlanta", "lunch": "Saffron, Atlanta", "dinner": "Baba Au Rhum, Atlanta", "accommodation": "Spacious private room close St. Barnabas Hospital, Atlanta"}, {"day": 2, "current_city": "Atlanta", "transportation": "-", "breakfast": "Adda, Atlanta", "attraction": "Atlanta Botanical Garden, Atlanta; World of Coca-Cola, Atlanta", "lunch": "Daawat-e-Kashmir, Atlanta", "dinner": "Asian Bistro, Atlanta", "accommodation": "Spacious private room close St. Barnabas Hospital, Atlanta"}, {"day": 3, "current_city": "from Atlanta to Buffalo", "transportation": "Flight Number: F3502694, from Atlanta to Buffalo, Departure Time: 15:47, Arrival Time: 17:42", "breakfast": "Ahata, Atlanta", "attraction": "Martin Luther King, Jr. National Historical Park, Atlanta", "lunch": "Chef Style, Atlanta", "dinner": "-", "accommodation": "-"}]}]