[{"gpt-4-1106-preview_direct_sole-planning_results": "Travel Plan:\n\nDay 1: March 22, 2022\nCurrent City: from Devils Lake to Alamosa\nTransportation: Self-driving, from Devils Lake to Alamosa, Duration: 17 hours 26 mins, Distance: 1,811 km, Cost: $90\nBreakfast: -\nLunch: -\nDinner: -\nAccommodation: Comfortable studio suite in midtown Manhattan, Alamosa, Price: $67, Room Type: Entire home/apt, Minimum Nights: 30, Maximum Occupancy: 2, Review Rate: 3.0\n\nDay 2: March 23, 2022\nCurrent City: Alamosa\nTransportation: -\nBreakfast: Atlanta Highway Seafood Market, Alamosa, Average Cost: $68\nAttraction: San Luis Valley Museum, Alamosa\nLunch: Riverwalk Cafe, Alamosa, Average Cost: $97\nAttraction: Rio Grande Farm Park, Alamosa\nDinner: Viva Hyderabad, Alamosa, Average Cost: $90\nAccommodation: Comfortable studio suite in midtown Manhattan, Alamosa\n\nDay 3: March 24, 2022\nCurrent City: from Alamosa to Grand Junction\nTransportation: Self-driving, from Alamosa to Grand Junction, Duration: 4 hours 29 mins, Distance: 396 km, Cost: $19\nBreakfast: Coffee to Cocktail Bar - Hyatt Place, Alamosa, Average Cost: $35\nAttraction: Cole Park, Alamosa\nLunch: Burger Singh, Alamosa, Average Cost: $95\nDinner: -\nAccommodation: NYC Apartment near Central Park!, Grand Junction, Price: $1,118, Room Type: Entire home/apt, Minimum Nights: 3, Maximum Occupancy: 5, Review Rate: 5.0\n\nDay 4: March 25, 2022\nCurrent City: Grand Junction\nTransportation: -\nBreakfast: Austin's BBQ and Oyster Bar, Grand Junction, Average Cost: $15\nAttraction: Museum of the West, Museums of Western Colorado, Grand Junction\nLunch: 2 Dog, Grand Junction, Average Cost: $29\nAttraction: Eureka! McConnell Science Museum, Grand Junction\nDinner: Thakur Bakers, Grand Junction, Average Cost: $100\nAccommodation: NYC Apartment near Central Park!, Grand Junction\n\nDay 5: March 26, 2022\nCurrent City: from Grand Junction to Gunnison\nTransportation: Self-driving, from Grand Junction to Gunnison, Duration: 2 hours 27 mins, Distance: 200 km, Cost: $10\nBreakfast: Shanghai Bar & Lounge - The Bristol Hotel, Grand Junction, Average Cost: $31\nAttraction: Western Colorado Botanical Gardens, Grand Junction\nLunch: Pind Balluchi, Grand Junction, Average Cost: $17\nDinner: -\nAccommodation: Full-size loft bed in East Village, Gunnison, Price: $104, Room Type: Private room, Minimum Nights: 1, Maximum Occupancy: 1, Review Rate: 4.0\n\nDay 6: March 27, 2022\nCurrent City: Gunnison\nTransportation: -\nBreakfast: Happy Joe's Pizza & Ice Cream, Gunnison, Average Cost: $74\nAttraction: I.O.O.F. Park, Gunnison\nLunch: SALT, Gunnison, Average Cost: $44\nAttraction: Gunnison Pioneer Museum, Gunnison\nDinner: Mocha, Gunnison, Average Cost: $30\nAccommodation: Full-size loft bed in East Village, Gunnison\n\nDay 7: March 28, 2022\nCurrent City: from Gunnison to Devils Lake\nTransportation: Self-driving, from Gunnison to Devils Lake, Duration: 17 hours 30 mins, Distance: 1,881 km, Cost: $94\nBreakfast: Paradise Inn, Gunnison, Average Cost: $99\nAttraction: Gunnison Valley Observatory, Gunnison\nLunch: Tughlaq, Gunnison, Average Cost: $18\nDinner: -\nAccommodation: -\n\nPlease note that the accommodation in Alamosa has a minimum stay of 30 nights, which is not suitable for this itinerary. However, due to the lack of other options provided in the reference information, it has been included. Adjustments may be necessary to find suitable accommodation that meets the minimum night requirements. Additionally, the budget may be exceeded due to the high cost of accommodations in Grand Junction and Gunnison. Adjustments to the plan or budget may be required.", "gpt-4-1106-preview_direct_sole-planning_parsed_results": [{"day": 1, "current_city": "from Devils Lake to Alamosa", "transportation": "Self-driving, from Devils Lake to Alamosa, Duration: 17 hours 26 mins, Distance: 1811 km, Cost: 90", "breakfast": "-", "attraction": "-", "lunch": "-", "dinner": "-", "accommodation": "Comfortable studio suite in midtown Manhattan, Alamosa"}, {"day": 2, "current_city": "Alamosa", "transportation": "-", "breakfast": "Atlanta Highway Seafood Market, Alamosa", "attraction": "San Luis Valley Museum, Alamosa;Rio Grande Farm Park, Alamosa;", "lunch": "Riverwalk Cafe, Alamosa", "dinner": "Viva Hyderabad, Alamosa", "accommodation": "Comfortable studio suite in midtown Manhattan, Alamosa"}, {"day": 3, "current_city": "from Alamosa to Grand Junction", "transportation": "Self-driving, from Alamosa to Grand Junction, Duration: 4 hours 29 mins, Distance: 396 km, Cost: 19", "breakfast": "Coffee to Cocktail Bar - Hyatt Place, Alamosa", "attraction": "Cole Park, Alamosa", "lunch": "Burger Singh, Alamosa", "dinner": "-", "accommodation": "NYC Apartment near Central Park!, Grand Junction"}, {"day": 4, "current_city": "Grand Junction", "transportation": "-", "breakfast": "Austin's BBQ and Oyster Bar, Grand Junction", "attraction": "Museum of the West, Museums of Western Colorado, Grand Junction;Eureka! McConnell Science Museum, Grand Junction;", "lunch": "2 Dog, Grand Junction", "dinner": "Thakur Bakers, Grand Junction", "accommodation": "NYC Apartment near Central Park!, Grand Junction"}, {"day": 5, "current_city": "from Grand Junction to Gunnison", "transportation": "Self-driving, from Grand Junction to Gunnison, Duration: 2 hours 27 mins, Distance: 200 km, Cost: 10", "breakfast": "Shanghai Bar & Lounge - The Bristol Hotel, Grand Junction", "attraction": "Western Colorado Botanical Gardens, Grand Junction", "lunch": "Pind Balluchi, Grand Junction", "dinner": "-", "accommodation": "Full-size loft bed in East Village, Gunnison"}, {"day": 6, "current_city": "Gunnison", "transportation": "-", "breakfast": "Happy Joe's Pizza & Ice Cream, Gunnison", "attraction": "I.O.O.F. Park, Gunnison;Gunnison Pioneer Museum, Gunnison;", "lunch": "SALT, Gunnison", "dinner": "Mocha, Gunnison", "accommodation": "Full-size loft bed in East Village, Gunnison"}, {"day": 7, "current_city": "from Gunnison to Devils Lake", "transportation": "Self-driving, from Gunnison to Devils Lake, Duration: 17 hours 30 mins, Distance: 1881 km, Cost: 94", "breakfast": "Paradise Inn, Gunnison", "attraction": "Gunnison Valley Observatory, Gunnison", "lunch": "Tughlaq, Gunnison", "dinner": "-", "accommodation": "-"}]}]