[{"gpt-4-1106-preview_direct_sole-planning_results": "Travel Plan:\n\nDay 1: March 27, 2022\nCurrent City: from Austin to Detroit\nTransportation: Flight Number: F3518857, from Austin to Detroit, Departure Time: 05:36, Arrival Time: 09:33\nBreakfast: -\nAttraction: Detroit Institute of Arts, Detroit\nLunch: A Dong Restaurant, Detroit\nDinner: BMG - All Day Dining, Detroit\nAccommodation: Cozy 1 bedroom in the heart of Fort Greene, Detroit (Private room, minimum 3 nights)\n\nDay 2: March 28, 2022\nCurrent City: Detroit\nTransportation: -\nBreakfast: Southern Bliss Bakery, Detroit\nAttraction: Detroit Historical Museum, Detroit; Motown Museum, Detroit\nLunch: Cafe And More, Detroit\nDinner: Zabardast Indian Kitchen, Detroit\nAccommodation: Cozy 1 bedroom in the heart of Fort Greene, Detroit (Private room)\n\nDay 3: March 29, 2022\nCurrent City: from Detroit to Alpena\nTransportation: Flight Number: F3852119, from Detroit to Alpena, Departure Time: 14:15, Arrival Time: 15:20\nBreakfast: Frequent Bakes, Detroit\nAttraction: Great Lakes Maritime Heritage Center, Alpena\nLunch: @Mango, Alpena\nDinner: Maplai, Alpena\nAccommodation: CHEERFUL RM IN BROOKLYN! EASY ACCESS TO TRAIN! R3, Alpena (Private room, minimum 15 nights)\n\nDay 4: March 30, 2022\nCurrent City: Alpena\nTransportation: -\nBreakfast: A & A Pagliai's Pizza, Alpena\nAttraction: Besser Museum for Northeast Michigan, Alpena; Thunder Bay National Marine Sanctuary, Alpena\nLunch: Shudh Restaurant, Alpena\nDinner: Young Wild Free Cafe, Alpena\nAccommodation: CHEERFUL RM IN BROOKLYN! EASY ACCESS TO TRAIN! R3, Alpena (Private room)\n\nDay 5: March 31, 2022\nCurrent City: from Alpena to Austin\nTransportation: Self-driving, from Alpena to Austin, duration: 22 hours 42 mins, distance: 2,467 km, cost: 123\nBreakfast: Jain Chawal Wale, Alpena\nAttraction: -\nLunch: -\nDinner: -\nAccommodation: -\n\nPlease note that the accommodation in Alpena has a minimum stay of 15 nights, which exceeds the duration of the trip. However, since the query specifies the need for private rooms and given the budget constraints, this accommodation was selected. Adjustments may be needed based on actual availability and booking policies.", "gpt-4-1106-preview_direct_sole-planning_parsed_results": [{"day": 1, "current_city": "from Austin to Detroit", "transportation": "Flight Number: F3518857, from Austin to Detroit, Departure Time: 05:36, Arrival Time: 09:33", "breakfast": "-", "attraction": "Detroit Institute of Arts, Detroit", "lunch": "A Dong Restaurant, Detroit", "dinner": "BMG - All Day Dining, Detroit", "accommodation": "Cozy 1 bedroom in the heart of Fort Greene, Detroit"}, {"day": 2, "current_city": "Detroit", "transportation": "-", "breakfast": "Southern Bliss Bakery, Detroit", "attraction": "Detroit Historical Museum, Detroit;Motown Museum, Detroit;", "lunch": "Cafe And More, Detroit", "dinner": "Zabardast Indian Kitchen, Detroit", "accommodation": "Cozy 1 bedroom in the heart of Fort Greene, Detroit"}, {"day": 3, "current_city": "from Detroit to Alpena", "transportation": "Flight Number: F3852119, from Detroit to Alpena, Departure Time: 14:15, Arrival Time: 15:20", "breakfast": "Frequent Bakes, Detroit", "attraction": "Great Lakes Maritime Heritage Center, Alpena", "lunch": "@Mango, Alpena", "dinner": "Maplai, Alpena", "accommodation": "CHEERFUL RM IN BROOKLYN! EASY ACCESS TO TRAIN! R3, Alpena"}, {"day": 4, "current_city": "Alpena", "transportation": "-", "breakfast": "A & A Pagliai's Pizza, Alpena", "attraction": "Besser Museum for Northeast Michigan, Alpena;Thunder Bay National Marine Sanctuary, Alpena;", "lunch": "Shudh Restaurant, Alpena", "dinner": "Young Wild Free Cafe, Alpena", "accommodation": "CHEERFUL RM IN BROOKLYN! EASY ACCESS TO TRAIN! R3, Alpena"}, {"day": 5, "current_city": "from Alpena to Austin", "transportation": "Self-driving, from Alpena to Austin, Duration: 22 hours 42 mins, Distance: 2467 km, Cost: 123", "breakfast": "Jain Chawal Wale, Alpena", "attraction": "-", "lunch": "-", "dinner": "-", "accommodation": "-"}]}]