[{"gpt-4-1106-preview_direct_sole-planning_results": "Travel Plan:\n\nDay 1: March 2, 2022\nCurrent City: from Latrobe to Myrtle Beach\nTransportation: Flight Number: F3615674, from Latrobe to Myrtle Beach, Departure Time: 17:59, Arrival Time: 19:12, Cost: $116\nDinner: Exotic India, Myrtle Beach, Average Cost: $81\nAccommodation: Cozy Brooklyn Room - Next to Pratt Institute, Myrtle Beach, Cost: $418, Minimum Nights: 5\n\nTotal cost for Day 1: $116 (Flight) + $81 (Dinner) + $418 (Accommodation) = $615\n\nDay 2: March 3, 2022\nCurrent City: Myrtle Beach\nBreakfast: First Eat, Myrtle Beach, Average Cost: $21\nAttraction: SkyWheel Myrtle Beach, Myrtle Beach, Cost: Unknown (Assuming $30 as a common attraction price)\nLunch: La Pino'z Pizza, Myrtle Beach, Average Cost: $14\nAttraction: Ripley's Aquarium of Myrtle Beach, Myrtle Beach, Cost: Unknown (Assuming $30 as a common attraction price)\nDinner: Nagai, Myrtle Beach, Average Cost: $19\nAccommodation: Cozy Brooklyn Room - Next to Pratt Institute, Myrtle Beach, Cost: $418\n\nTotal cost for Day 2: $21 (Breakfast) + $30 (Attraction) + $14 (Lunch) + $30 (Attraction) + $19 (Dinner) + $418 (Accommodation) = $532\n\nDay 3: March 4, 2022\nCurrent City: Myrtle Beach to Greenville\nTransportation: Self-driving, from Myrtle Beach to Greenville, Cost: $20\nBreakfast: First Eat, Myrtle Beach, Average Cost: $21\nLunch: Bhoj Restaurant, Greenville, Average Cost: $71\nDinner: Al Bake, Greenville, Average Cost: $90\nAccommodation: HUGE bedroom available in artsy Bushwick, Greenville, Cost: $696, Minimum Nights: 1\n\nTotal cost for Day 3: $20 (Transportation) + $21 (Breakfast) + $71 (Lunch) + $90 (Dinner) + $696 (Accommodation) = $898\n\nDay 4: March 5, 2022\nCurrent City: Greenville\nBreakfast: Indigo Delicatessen, Greenville, Average Cost: $15\nAttraction: Falls Park on the Reedy, Greenville, Cost: Unknown (Assuming $0 as it's a public park)\nLunch: Italiano, Greenville, Average Cost: $95\nAttraction: Greenville Zoo, Greenville, Cost: Unknown (Assuming $20 as a common attraction price)\nDinner: Sapra Pastry Treat, Greenville, Average Cost: $65\nAccommodation: HUGE bedroom available in artsy Bushwick, Greenville, Cost: $696\n\nTotal cost for Day 4: $15 (Breakfast) + $0 (Attraction) + $95 (Lunch) + $20 (Attraction) + $65 (Dinner) + $696 (Accommodation) = $891\n\nDay 5: March 6, 2022\nCurrent City: from Greenville to Latrobe\nTransportation: Self-driving, from Greenville to Latrobe, Cost: $42\nBreakfast: Indigo Delicatessen, Greenville, Average Cost: $15\nLunch: BTW, Greenville, Average Cost: $41\nDinner: - (Assuming no dinner as the traveler will be driving)\n\nTotal cost for Day 5: $42 (Transportation) + $15 (Breakfast) + $41 (Lunch) = $98\n\nThe total cost of this trip is the sum of the costs from Day 1 to Day 5: $615 + $532 + $898 + $891 + $98 = $3134\n\nThe total cost of $3134 is within the budget of $4200. Please note that some attraction costs are assumed due to missing data, and actual prices may vary.", "gpt-4-1106-preview_direct_sole-planning_parsed_results": [{"day": 1, "current_city": "from Latrobe to Myrtle Beach", "transportation": "Flight Number: F3615674, from Latrobe to Myrtle Beach, Departure Time: 17:59, Arrival Time: 19:12", "breakfast": "-", "attraction": "-", "lunch": "-", "dinner": "Exotic India, Myrtle Beach", "accommodation": "Cozy Brooklyn Room - Next to Pratt Institute, Myrtle Beach"}, {"day": 2, "current_city": "Myrtle Beach", "transportation": "-", "breakfast": "First Eat, Myrtle Beach", "attraction": "SkyWheel Myrtle Beach, Myrtle Beach;Ripley's Aquarium of Myrtle Beach, Myrtle Beach;", "lunch": "La Pino'z Pizza, Myrtle Beach", "dinner": "Nagai, Myrtle Beach", "accommodation": "Cozy Brooklyn Room - Next to Pratt Institute, Myrtle Beach"}, {"day": 3, "current_city": "from Myrtle Beach to Greenville", "transportation": "Self-driving, from Myrtle Beach to Greenville", "breakfast": "First Eat, Myrtle Beach", "attraction": "-", "lunch": "Bhoj Restaurant, Greenville", "dinner": "Al Bake, Greenville", "accommodation": "HUGE bedroom available in artsy Bushwick, Greenville"}, {"day": 4, "current_city": "Greenville", "transportation": "-", "breakfast": "Indigo Delicatessen, Greenville", "attraction": "Falls Park on the Reedy, Greenville;Greenville Zoo, Greenville;", "lunch": "Italiano, Greenville", "dinner": "Sapra Pastry Treat, Greenville", "accommodation": "HUGE bedroom available in artsy Bushwick, Greenville"}, {"day": 5, "current_city": "from Greenville to Latrobe", "transportation": "Self-driving, from Greenville to Latrobe", "breakfast": "Indigo Delicatessen, Greenville", "attraction": "-", "lunch": "BTW, Greenville", "dinner": "-", "accommodation": "-"}]}]