[{"gpt-4-1106-preview_direct_sole-planning_results": "Travel Plan:\n\nDay 1:\nCurrent City: from Atlanta to Knoxville\nTransportation: Flight Number: F3556207, from Atlanta to Knoxville, Departure Time: 10:57, Arrival Time: 11:42\nBreakfast: -\nAttraction: World's Fair Park, Knoxville\nLunch: Cafe Arabelle, Knoxville\nDinner: Les 3 Brasseurs, Knoxville\nAccommodation: Light-filled Room in Renovated Apt, Knoxville\n\nDay 2:\nCurrent City: Knoxville\nTransportation: -\nBreakfast: Cafe Coffee Day, Knoxville\nAttraction: Knoxville Museum of Art, Knoxville; Zoo Knoxville, Knoxville.\nLunch: Mamagoto, Knoxville\nDinner: Ali Baba & 41 Dishes, Knoxville\nAccommodation: Light-filled Room in Renovated Apt, Knoxville\n\nDay 3:\nCurrent City: from Knoxville to Atlanta\nTransportation: Flight Number: F3518895, from Knoxville to Atlanta, Departure Time: 18:47, Arrival Time: 19:44\nBreakfast: The Indian Kaffe Express, Knoxville\nAttraction: Sunsphere, Knoxville.\nLunch: Cafe El Chico, Knoxville\nDinner: -\nAccommodation: -\n\nPlease note that the selected accommodation, \"Light-filled Room in Renovated Apt,\" allows children under 10 and requires a minimum of 2 nights stay, which fits within the 3-day travel plan. The chosen restaurants and attractions are diverse and have not been repeated. The flights are within the specified dates and the budget has been considered, although the exact costs are not provided in the query. The budget should cover the flights, accommodation, meals, and attraction entries, assuming they do not exceed the typical range for such expenses.", "gpt-4-1106-preview_direct_sole-planning_parsed_results": [{"day": 1, "current_city": "from Atlanta to Knoxville", "transportation": "Flight Number: F3556207, from Atlanta to Knoxville, Departure Time: 10:57, Arrival Time: 11:42", "breakfast": "-", "attraction": "World's Fair Park, Knoxville", "lunch": "Cafe Arabelle, Knoxville", "dinner": "Les 3 Brasseurs, Knoxville", "accommodation": "Light-filled Room in Renovated Apt, Knoxville"}, {"day": 2, "current_city": "Knoxville", "transportation": "-", "breakfast": "Cafe Coffee Day, Knoxville", "attraction": "Knoxville Museum of Art, Knoxville;Zoo Knoxville, Knoxville", "lunch": "Mamagoto, Knoxville", "dinner": "Ali Baba & 41 Dishes, Knoxville", "accommodation": "Light-filled Room in Renovated Apt, Knoxville"}, {"day": 3, "current_city": "from Knoxville to Atlanta", "transportation": "Flight Number: F3518895, from Knoxville to Atlanta, Departure Time: 18:47, Arrival Time: 19:44", "breakfast": "The Indian Kaffe Express, Knoxville", "attraction": "Sunsphere, Knoxville", "lunch": "Cafe El Chico, Knoxville", "dinner": "-", "accommodation": "-"}]}]