[{"gpt-4-1106-preview_direct_sole-planning_results": "Travel Plan:\n\nDay 1: March 6th, 2022\nCurrent City: from Houston to Pensacola\nTransportation: Flight Number: F3855861, from Houston to Pensacola, Departure Time: 11:54, Arrival Time: 13:21, Cost: $100 per person\nBreakfast: - (Assuming breakfast is had before departure or during the flight)\nAttraction: Historic Pensacola Village, Pensacola\nLunch: Frog Hollow Tavern, Pensacola, Cost: $20, Cuisines: \"American, BBQ, Fast Food, Cafe, Indian\"\nDinner: Kwality Restaurant, Pensacola, Cost: $29, Cuisines: \"Desserts, Tea, French, Fast Food, Chinese\"\nAccommodation: Luxury East Village Penthouse With Private Deck, Pensacola, Cost: $697, Maximum Occupancy: 6, House Rules: No visitors\n\nNumber of People = 2\nTotal Cost = 2 * 100 (flight) + 2 * 20 (lunch) + 2 * 29 (dinner) + 697 (accommodation) = $895\n\nDay 2: March 7th, 2022\nCurrent City: Pensacola\nTransportation: Taxi around the city, Estimated Cost: $100 (for the day)\nBreakfast: Berry Patch Restaurant, Pensacola, Cost: $13, Cuisines: \"Bakery, BBQ, Desserts, Seafood\"\nAttraction: Pensacola Museum of Art, Pensacola; Pensacola Lighthouse & Maritime Museum, Pensacola\nLunch: Nizam's Kathi Kabab, Pensacola, Cost: $32, Cuisines: \"Desserts, BBQ, Fast Food, American, Mediterranean\"\nDinner: Blue Point Grill, Pensacola, Cost: $75, Cuisines: \"French, Indian, Cafe, Desserts\"\nAccommodation: Luxury East Village Penthouse With Private Deck, Pensacola, Cost: $697, Maximum Occupancy: 6, House Rules: No visitors\n\nNumber of People = 2\nTotal Cost = 2 * 13 (breakfast) + 2 * 32 (lunch) + 2 * 75 (dinner) + 100 (taxi) + 697 (accommodation) = $1037\n\nDay 3: March 8th, 2022\nCurrent City: from Pensacola to Houston\nTransportation: Flight Number: F3890675, from Pensacola to Houston, Departure Time: 06:59, Arrival Time: 08:33, Cost: $128 per person\nBreakfast: - (Assuming breakfast is had before departure or during the flight)\nAttraction: -\nLunch: - (Assuming lunch is after arrival in Houston)\nDinner: - (Assuming dinner is in Houston after the trip)\nAccommodation: -\n\nNumber of People = 2\nTotal Cost = 2 * 128 (flight) = $256\n\nTotal cost across all days = $895 + $1037 + $256 = $2188\n\nUnfortunately, the total cost exceeds the specified budget of $1,400. To adjust the plan within the budget, we can consider the following changes:\n\n- Choose a less expensive accommodation option.\n- Limit taxi use and instead use public transportation or walk to nearby attractions and restaurants.\n- Opt for restaurants with lower average costs for meals.\n\nPlease note that the provided accommodation options all have a \"No visitors\" house rule, which conflicts with the requirement for visitor-friendly accommodations. Adjustments to the plan will be necessary to meet all constraints, including budget and accommodation preferences.", "gpt-4-1106-preview_direct_sole-planning_parsed_results": [{"day": 1, "current_city": "from Houston to Pensacola", "transportation": "Flight Number: F3855861, from Houston to Pensacola, Departure Time: 11:54, Arrival Time: 13:21", "breakfast": "-", "attraction": "Historic Pensacola Village, Pensacola;", "lunch": "Frog Hollow Tavern, Pensacola", "dinner": "Kwality Restaurant, Pensacola", "accommodation": "Luxury East Village Penthouse With Private Deck, Pensacola"}, {"day": 2, "current_city": "Pensacola", "transportation": "-", "breakfast": "Berry Patch Restaurant, Pensacola", "attraction": "Pensacola Museum of Art, Pensacola;Pensacola Lighthouse & Maritime Museum, Pensacola;", "lunch": "Nizam's Kathi Kabab, Pensacola", "dinner": "Blue Point Grill, Pensacola", "accommodation": "Luxury East Village Penthouse With Private Deck, Pensacola"}, {"day": 3, "current_city": "from Pensacola to Houston", "transportation": "Flight Number: F3890675, from Pensacola to Houston, Departure Time: 06:59, Arrival Time: 08:33", "breakfast": "-", "attraction": "-", "lunch": "-", "dinner": "-", "accommodation": "-"}]}]