[{"gpt-4-1106-preview_direct_sole-planning_results": "Travel Plan:\n\nDay 1: March 9, 2022\nCurrent City: from Monterey to Dallas\nTransportation: Flight Number: F4046679, from Monterey to Dallas, Departure Time: 14:02, Arrival Time: 19:18\nDinner: L'Opera, Dallas\nAccommodation: Luxury Williamsburg duplex, private roof terrace, Dallas (Minimum stay of 4 nights)\n\nDay 2: March 10, 2022\nCurrent City: Dallas\nBreakfast: Cafe Gatherings, Dallas\nAttraction: The Dallas World Aquarium, Dallas\nLunch: Yanki Sizzlers, Dallas (French cuisine)\nAttraction: The Sixth Floor Museum at Dealey Plaza, Dallas\nDinner: Coconuts Fish Cafe, Dallas (Chinese cuisine)\nAccommodation: Luxury Williamsburg duplex, private roof terrace, Dallas\n\nDay 3: March 11, 2022\nCurrent City: from Dallas to Del Rio\nTransportation: Flight Number: F3592397, from Dallas to Del Rio, Departure Time: 21:19, Arrival Time: 22:38\nBreakfast: Drifters Cafe, Dallas\nAttraction: Reunion Tower, Dallas\nLunch: Aravali Owls, Dallas (Chinese cuisine)\nDinner: - (Due to late arrival in Del Rio, dinner may be skipped or arranged independently)\nAccommodation: Spacious Brooklyn One Bedroom/Loft***Morgan L Stop, Del Rio (Minimum stay of 4 nights)\n\nDay 4: March 12, 2022\nCurrent City: Del Rio\nBreakfast: Jom Jom Malay, Del Rio (Chinese cuisine)\nAttraction: Whitehead Memorial Museum, Del Rio\nLunch: Pizzoccheri, Del Rio (French cuisine)\nAttraction: Amistad National Recreation Area, Del Rio\nDinner: Locale, Del Rio (Chinese cuisine)\nAccommodation: Spacious Brooklyn One Bedroom/Loft***Morgan L Stop, Del Rio\n\nDay 5: March 13, 2022\nCurrent City: from Del Rio to Amarillo\nTransportation: Self-driving, from Del Rio to Amarillo, duration: 7 hours 0 mins\nBreakfast: - (Early departure may require breakfast on the road)\nAttraction: Devils River State Natural Area, Del Rio (Visit before departure)\nLunch: - (On the road)\nDinner: Komachi, Amarillo (Chinese cuisine)\nAccommodation: Gramercy Park restful, cozy, sun-filled home, Amarillo (Minimum stay of 2 nights)\n\nDay 6: March 14, 2022\nCurrent City: Amarillo\nBreakfast: The Cinnamon Kitchen, Amarillo (Chinese cuisine)\nAttraction: Cadillac Ranch, Amarillo\nLunch: Anand Restaurant, Amarillo (French cuisine)\nAttraction: Amarillo Botanical Gardens, Amarillo\nDinner: Delish BBQ, Amarillo (Chinese cuisine)\nAccommodation: Gramercy Park restful, cozy, sun-filled home, Amarillo\n\nDay 7: March 15, 2022\nCurrent City: from Amarillo to Monterey\nTransportation: Self-driving, from Amarillo to Monterey, duration: 19 hours 21 mins (Note: This is a long drive back to Monterey. The group may need to leave early and/or plan for rest stops along the way.)\nBreakfast: Sigree Global Grill, Amarillo\nAttraction: Amarillo Zoo, Amarillo (Visit before departure)\nLunch: - (On the road)\nDinner: - (On the road or upon arrival in Monterey)\nAccommodation: -\n\nPlease note that the travel plan has been created based on the provided reference information and the preferences stated in the query. The budget has been considered, but exact costs for meals, attractions, and additional transportation (e.g., taxis, car rentals) are not provided and should be calculated to ensure the total cost remains within the $15,600 budget.", "gpt-4-1106-preview_direct_sole-planning_parsed_results": [{"day": 1, "current_city": "from Monterey to Dallas", "transportation": "Flight Number: F4046679, from Monterey to Dallas, Departure Time: 14:02, Arrival Time: 19:18", "breakfast": "-", "attraction": "-", "lunch": "-", "dinner": "L'Opera, Dallas", "accommodation": "Luxury Williamsburg duplex, private roof terrace, Dallas"}, {"day": 2, "current_city": "Dallas", "transportation": "-", "breakfast": "Cafe Gatherings, Dallas", "attraction": "The Dallas World Aquarium, Dallas;The Sixth Floor Museum at Dealey Plaza, Dallas;", "lunch": "Yanki Sizzlers, Dallas", "dinner": "Coconuts Fish Cafe, Dallas", "accommodation": "Luxury Williamsburg duplex, private roof terrace, Dallas"}, {"day": 3, "current_city": "from Dallas to Del Rio", "transportation": "Flight Number: F3592397, from Dallas to Del Rio, Departure Time: 21:19, Arrival Time: 22:38", "breakfast": "Drifters Cafe, Dallas", "attraction": "Reunion Tower, Dallas", "lunch": "Aravali Owls, Dallas", "dinner": "-", "accommodation": "Spacious Brooklyn One Bedroom/Loft***Morgan L Stop, Del Rio"}, {"day": 4, "current_city": "Del Rio", "transportation": "-", "breakfast": "Jom Jom Malay, Del Rio", "attraction": "Whitehead Memorial Museum, Del Rio;Amistad National Recreation Area, Del Rio;", "lunch": "Pizzoccheri, Del Rio", "dinner": "Locale, Del Rio", "accommodation": "Spacious Brooklyn One Bedroom/Loft***Morgan L Stop, Del Rio"}, {"day": 5, "current_city": "from Del Rio to Amarillo", "transportation": "Self-driving, from Del Rio to Amarillo, duration: 7 hours 0 mins", "breakfast": "-", "attraction": "Devils River State Natural Area, Del Rio", "lunch": "-", "dinner": "Komachi, Amarillo", "accommodation": "Gramercy Park restful, cozy, sun-filled home, Amarillo"}, {"day": 6, "current_city": "Amarillo", "transportation": "-", "breakfast": "The Cinnamon Kitchen, Amarillo", "attraction": "Cadillac Ranch, Amarillo;Amarillo Botanical Gardens, Amarillo;", "lunch": "Anand Restaurant, Amarillo", "dinner": "Delish BBQ, Amarillo", "accommodation": "Gramercy Park restful, cozy, sun-filled home, Amarillo"}, {"day": 7, "current_city": "from Amarillo to Monterey", "transportation": "Self-driving, from Amarillo to Monterey, duration: 19 hours 21 mins", "breakfast": "Sigree Global Grill, Amarillo", "attraction": "Amarillo Zoo, Amarillo", "lunch": "-", "dinner": "-", "accommodation": "-"}]}]