[{"gpt-4-1106-preview_direct_sole-planning_results": "Travel Plan:\n\nDay 1: March 16, 2022\nCurrent City: from Syracuse to Augusta\nTransportation: Self-driving, from Syracuse to Augusta, Duration: 13 hours 17 mins, Distance: 1,431 km, Cost: $71 * ceil(2/5) = $71\nBreakfast: - (Assuming travelers will have breakfast before departure)\nAttraction: Phinizy Swamp Nature Park, Augusta, Cost: $0 (Assuming free entry)\nLunch: - (Assuming travelers will have lunch en route)\nDinner: B Merrell's, Augusta, Cost: $74 * 2 = $148, Cuisines: \"Tea, Pizza, Desserts, Fast Food\" (American cuisine included)\nAccommodation: Planta Baja Studio, Augusta, Cost: $637 * ceil(2/4) = $637, Maximum Occupancy: 4, House Rules: No smoking, Minimum Nights: 1\n\nNumber of People = 2\nTotal Cost for Day 1 = $71 + $148 + $637 = $856\nAccommodation Minimum Nights: 1/1\n\nDay 2: March 17, 2022\nCurrent City: Augusta\nTransportation: -\nBreakfast: B Merrell's, Augusta, Cost: $74 * 2 = $148, Cuisines: \"Tea, Pizza, Desserts, Fast Food\" (American cuisine included)\nAttraction: Augusta Museum of History, Augusta, Cost: $0 (Assuming free entry)\nLunch: The Golden Dragon, Augusta, Cost: $82 * 2 = $164, Cuisines: \"Desserts, Pizza, Fast Food, Indian, Mediterranean, Seafood\" (Mediterranean cuisine included)\nDinner: B Merrell's, Augusta, Cost: $74 * 2 = $148, Cuisines: \"Tea, Pizza, Desserts, Fast Food\" (American cuisine included)\nAccommodation: Planta Baja Studio, Augusta, Cost: $637 * ceil(2/4) = $637, Maximum Occupancy: 4, House Rules: No smoking, Minimum Nights: 1\n\nNumber of People = 2\nTotal Cost for Day 2 = $148 + $164 + $148 + $637 = $1097\nAccommodation Minimum Nights: 1/1\n\nDay 3: March 18, 2022\nCurrent City: from Augusta to Decatur\nTransportation: Self-driving, from Augusta to Decatur, Duration: 2 hours 19 mins, Distance: 229 km, Cost: $11 * ceil(2/5) = $11\nBreakfast: B Merrell's, Augusta, Cost: $74 * 2 = $148, Cuisines: \"Tea, Pizza, Desserts, Fast Food\" (American cuisine included)\nAttraction: DeKalb History Center Museum, Decatur, Cost: $0 (Assuming free entry)\nLunch: Cafe Coffee Day, Decatur, Cost: $46 * 2 = $92, Cuisines: \"Tea, Cafe, BBQ, Mediterranean\" (Mediterranean cuisine included)\nDinner: Madhuban Restaurant - Welcome Hotel Rama International, Decatur, Cost: $47 * 2 = $94, Cuisines: \"Pizza, Bakery, Seafood\" (American cuisine included)\nAccommodation: Cozy Private Room, Decatur, Cost: $69 * ceil(2/2) = $69, Maximum Occupancy: 2, House Rules: No children under 10 & No parties & No visitors, Minimum Nights: 2\n\nNumber of People = 2\nTotal Cost for Day 3 = $11 + $148 + $92 + $94 + $69 = $414\nAccommodation Minimum Nights: 1/2\n\nDay 4: March 19, 2022\nCurrent City: Decatur\nTransportation: -\nBreakfast: Cafe Coffee Day, Decatur, Cost: $46 * 2 = $92, Cuisines: \"Tea, Cafe, BBQ, Mediterranean\" (Mediterranean cuisine included)\nAttraction: Glenlake Park, Decatur, Cost: $0 (Assuming free entry)\nLunch: Madhuban Restaurant - Welcome Hotel Rama International, Decatur, Cost: $47 * 2 = $94, Cuisines: \"Pizza, Bakery, Seafood\" (American cuisine included)\nDinner: Cafe Coffee Day, Decatur, Cost: $46 * 2 = $92, Cuisines: \"Tea, Cafe, BBQ, Mediterranean\" (Mediterranean cuisine included)\nAccommodation: Cozy Private Room, Decatur, Cost: $69 * ceil(2/2) = $69, Maximum Occupancy: 2, House Rules: No children under 10 & No parties & No visitors, Minimum Nights: 2\n\nNumber of People = 2\nTotal Cost for Day 4 = $92 + $94 + $92 + $69 = $347\nAccommodation Minimum Nights: 2/2\n\nDay 5: March 20, 2022\nCurrent City: from Decatur to Syracuse\nTransportation: Self-driving, from Decatur to Syracuse, Duration: 14 hours 26 mins, Distance: 1,542 km, Cost: $77 * ceil(2/5) = $77\nBreakfast: Cafe Coffee Day, Decatur, Cost: $46 * 2 = $92, Cuisines: \"Tea, Cafe, BBQ, Mediterranean\" (Mediterranean cuisine included)\nAttraction: - (Assuming travelers will be on the road)\nLunch: - (Assuming travelers will have lunch en route)\nDinner: - (Assuming travelers will have dinner upon arrival in Syracuse)\nAccommodation: -\n\nNumber of People = 2\nTotal Cost for Day 5 = $77 + $92 = $169\n\nTotal cost across all days = $856 + $1097 + $414 + $347 + $169 = $2883\n\nUnfortunately, the total cost exceeds the budget of $2,000. To stay within budget, we may need to adjust the accommodations, dining, or attractions. Please let me know if you would like me to rework the plan to fit the budget.", "gpt-4-1106-preview_direct_sole-planning_parsed_results": [{"day": 1, "current_city": "from Syracuse to Augusta", "transportation": "Self-driving, from Syracuse to Augusta, Duration: 13 hours 17 mins, Distance: 1,431 km", "breakfast": "-", "attraction": "Phinizy Swamp Nature Park, Augusta;", "lunch": "-", "dinner": "B Merrell's, Augusta", "accommodation": "Planta Baja Studio, Augusta"}, {"day": 2, "current_city": "Augusta", "transportation": "-", "breakfast": "B Merrell's, Augusta", "attraction": "Augusta Museum of History, Augusta;", "lunch": "The Golden Dragon, Augusta", "dinner": "B Merrell's, Augusta", "accommodation": "Planta Baja Studio, Augusta"}, {"day": 3, "current_city": "from Augusta to Decatur", "transportation": "Self-driving, from Augusta to Decatur, Duration: 2 hours 19 mins, Distance: 229 km", "breakfast": "B Merrell's, Augusta", "attraction": "DeKalb History Center Museum, Decatur;", "lunch": "Cafe Coffee Day, Decatur", "dinner": "Madhuban Restaurant - Welcome Hotel Rama International, Decatur", "accommodation": "Cozy Private Room, Decatur"}, {"day": 4, "current_city": "Decatur", "transportation": "-", "breakfast": "Cafe Coffee Day, Decatur", "attraction": "Glenlake Park, Decatur;", "lunch": "Madhuban Restaurant - Welcome Hotel Rama International, Decatur", "dinner": "Cafe Coffee Day, Decatur", "accommodation": "Cozy Private Room, Decatur"}, {"day": 5, "current_city": "from Decatur to Syracuse", "transportation": "Self-driving, from Decatur to Syracuse, Duration: 14 hours 26 mins, Distance: 1,542 km", "breakfast": "Cafe Coffee Day, Decatur", "attraction": "-", "lunch": "-", "dinner": "-", "accommodation": "-"}]}]