[{"gpt-4-1106-preview_direct_sole-planning_results": "Travel Plan:\n\nDay 1: March 6, 2022\nCurrent City: from Charlotte to Newark\nTransportation: Flight Number: F3664839, from Charlotte to Newark, Departure Time: 11:20, Arrival Time: 13:07, Cost: 144\nBreakfast: - (Assuming breakfast in Charlotte before departure)\nAttraction: The Newark Museum of Art, Newark\nLunch: Artistry, Newark, Cost: 79, Cuisines: \"Cafe, Pizza, Desserts, Seafood\"\nDinner: Angeethi Restaurant, Newark, Cost: 12, Cuisines: \"French, BBQ, Fast Food\"\nAccommodation: Large Two Story Loft in the Heart of West Village, Newark, Cost: 1127, Maximum Occupancy: 5, House Rules: No pets & No children under 10\n\nNumber of People = 1 (Assuming single traveler based on room occupancy)\nTotal Cost = 144 + 79 + 12 + 1127 = 1362\n\nDay 2: March 7, 2022\nCurrent City: Newark\nTransportation: -\nBreakfast: Mirage Restro Bar, Newark, Cost: 51, Cuisines: \"Bakery, American, Desserts, Fast Food\"\nAttraction: Military Park, Newark\nLunch: Escape Terrace Bar Kitchen, Newark, Cost: 100, Cuisines: \"Tea, Cafe, Bakery, Chinese, Seafood\"\nDinner: Jaguar, Newark, Cost: 38, Cuisines: \"French, Bakery, Seafood\"\nAccommodation: Large Two Story Loft in the Heart of West Village, Newark, Cost: 1127, Maximum Occupancy: 5, House Rules: No pets & No children under 10\n\nTotal Cost = 51 + 100 + 38 + 1127 = 1316\nAccommodation Minimum Nights: 2/3\n\nDay 3: March 8, 2022\nCurrent City: from Newark to Trenton\nTransportation: Self-driving, from Newark to Trenton, duration: 1 hour 5 mins, distance: 93.8 km, cost: 4\nBreakfast: Drifters Cafe, Newark, Cost: 24, Cuisines: \"Tea, BBQ\"\nAttraction: Old Barracks Museum, Trenton\nLunch: Mario's Italian Restaurant, Trenton, Cost: 13, Cuisines: \"Desserts, Tea, Mexican, Bakery, Cafe, Indian\"\nDinner: Global Grill, Trenton, Cost: 20, Cuisines: \"Desserts, Pizza, BBQ, Chinese, Mediterranean\"\nAccommodation: Whole Floor, 2 BR Apt. in Iconic Greenwich Village, Trenton, Cost: 239, Maximum Occupancy: 3, House Rules: No visitors & No smoking\n\nTotal Cost = 4 + 24 + 13 + 20 + 239 = 300\nAccommodation Minimum Nights: 1/2\n\nDay 4: March 9, 2022\nCurrent City: Trenton\nTransportation: -\nBreakfast: Tuscan Oven, Trenton, Cost: 74, Cuisines: \"Desserts, Tea, Italian, Fast Food, Cafe\"\nAttraction: New Jersey State Museum, Trenton\nLunch: The Lady & Sons, Trenton, Cost: 38, Cuisines: \"Tea, Pizza, Bakery, Cafe, American\"\nDinner: The Cheesecake Factory, Trenton, Cost: 36, Cuisines: \"Desserts, Fast Food\"\nAccommodation: Whole Floor, 2 BR Apt. in Iconic Greenwich Village, Trenton, Cost: 239, Maximum Occupancy: 3, House Rules: No visitors & No smoking\n\nTotal Cost = 74 + 38 + 36 + 239 = 387\nAccommodation Minimum Nights: 2/2\n\nDay 5: March 10, 2022\nCurrent City: from Trenton to Charlotte\nTransportation: Flight Number: F3561600, from Trenton to Charlotte, Departure Time: 17:23, Arrival Time: 19:23, Cost: 201\nBreakfast: Fusilli Reasons, Trenton, Cost: 28, Cuisines: \"Tea, Bakery, Desserts, Seafood\"\nAttraction: Trenton Battle Monument, Trenton\nLunch: Dosa X'press, Trenton, Cost: 55, Cuisines: \"Tea, Bakery, BBQ\"\nDinner: - (Assuming dinner in Charlotte after arrival)\nAccommodation: -\n\nTotal Cost = 201 + 28 + 55 = 284\n\nTotal cost across all days = 1362 + 1316 + 300 + 387 + 284 = 3649\n\nCuisines: The prompt specifies no cuisines, so all cuisines constraints are satisfied.\n\nPlease note that the number of people was assumed to be 1 based on the maximum occupancy of the accommodations. If the number of travelers is different, the costs for accommodations and transportation will need to be adjusted accordingly. Additionally, the costs for meals are for one person and would also need to be adjusted for additional travelers. The total cost is within the specified budget of $4,200.", "gpt-4-1106-preview_direct_sole-planning_parsed_results": [{"day": 1, "current_city": "from Charlotte to Newark", "transportation": "Flight Number: F3664839, from Charlotte to Newark, Departure Time: 11:20, Arrival Time: 13:07", "breakfast": "-", "attraction": "The Newark Museum of Art, Newark;", "lunch": "Artistry, Newark", "dinner": "Angeethi Restaurant, Newark", "accommodation": "Large Two Story Loft in the Heart of West Village, Newark"}, {"day": 2, "current_city": "Newark", "transportation": "-", "breakfast": "Mirage Restro Bar, Newark", "attraction": "Military Park, Newark;", "lunch": "Escape Terrace Bar Kitchen, Newark", "dinner": "Jaguar, Newark", "accommodation": "Large Two Story Loft in the Heart of West Village, Newark"}, {"day": 3, "current_city": "from Newark to Trenton", "transportation": "Self-driving, from Newark to Trenton, duration: 1 hour 5 mins, distance: 93.8 km", "breakfast": "Drifters Cafe, Newark", "attraction": "Old Barracks Museum, Trenton;", "lunch": "Mario's Italian Restaurant, Trenton", "dinner": "Global Grill, Trenton", "accommodation": "Whole Floor, 2 BR Apt. in Iconic Greenwich Village, Trenton"}, {"day": 4, "current_city": "Trenton", "transportation": "-", "breakfast": "Tuscan Oven, Trenton", "attraction": "New Jersey State Museum, Trenton;", "lunch": "The Lady & Sons, Trenton", "dinner": "The Cheesecake Factory, Trenton", "accommodation": "Whole Floor, 2 BR Apt. in Iconic Greenwich Village, Trenton"}, {"day": 5, "current_city": "from Trenton to Charlotte", "transportation": "Flight Number: F3561600, from Trenton to Charlotte, Departure Time: 17:23, Arrival Time: 19:23", "breakfast": "Fusilli Reasons, Trenton", "attraction": "Trenton Battle Monument, Trenton;", "lunch": "Dosa X'press, Trenton", "dinner": "-", "accommodation": "-"}]}]