[{"gpt-4-1106-preview_direct_sole-planning_results": "Travel Plan:\n\nDay 1:\nCurrent City: from West Palm Beach to Atlanta\nTransportation: Flight Number: F3496900, from West Palm Beach to Atlanta, Departure Time: 08:06, Arrival Time: 09:40, Cost: 132\nBreakfast: -\nAttraction: Georgia Aquarium, Atlanta, Cost: -\nLunch: Ahata, Atlanta, Cost: 17, Cuisines: \"Tea, Indian, Desserts\"\nDinner: Taste of Vishal, Atlanta, Cost: 13, Cuisines: \"Desserts, Tea, American, Bakery, Indian, Seafood\"\nAccommodation: Spacious private room close St. Barnabas Hospital, Atlanta, Cost: 144, Maximum Occupancy: 1, House Rules: No smoking, Minimum Nights: 2\n\nNumber of People = 1\nTotal Cost = 132 + 17 + 13 + 144 = 306\nAccommodation Minimum Nights: 1/2\n\nDay 2:\nCurrent City: Atlanta\nTransportation: -\nBreakfast: Beliram Degchiwala, Atlanta, Cost: 14, Cuisines: \"Cafe, Pizza\"\nAttraction: Martin Luther King, Jr. National Historical Park, Atlanta, Cost: -\nLunch: Adda, Atlanta, Cost: 22, Cuisines: \"Tea, Mexican, Bakery\"\nDinner: Saffron, Atlanta, Cost: 39, Cuisines: \"Tea, Cafe, Fast Food, Seafood\"\nAccommodation: Spacious private room close St. Barnabas Hospital, Atlanta, Cost: 144, Maximum Occupancy: 1, House Rules: No smoking, Minimum Nights: 2\n\nNumber of people = 1\nTotal cost = 14 + 22 + 39 + 144 = 219\nAccommodation Minimum Nights: 2/2\n\nDay 3:\nCurrent City: from Atlanta to West Palm Beach\nTransportation: Flight Number: F3535986, from Atlanta to West Palm Beach, Departure Time: 22:40, Arrival Time: 00:18, Cost: 109\nBreakfast: The Krib, Atlanta, Cost: 45, Cuisines: \"Seafood, BBQ, Italian\"\nAttraction: Piedmont Park, Atlanta, Cost: -\nLunch: Chef Style, Atlanta, Cost: 59, Cuisines: \"Pizza, American, Desserts, Seafood\"\nDinner: -\nAccommodation: -\n\nNumber of people = 1\nTotal cost = 45 + 59 + 109 = 213\n\nTotal cost across all days = 306 + 219 + 213 = 738\n\nCuisines: The prompt specifies no preferred cuisines, so all cuisines constraints are satisfied.", "gpt-4-1106-preview_direct_sole-planning_parsed_results": [{"day": 1, "current_city": "from West Palm Beach to Atlanta", "transportation": "Flight Number: F3496900, from West Palm Beach to Atlanta, Departure Time: 08:06, Arrival Time: 09:40", "breakfast": "-", "attraction": "Georgia Aquarium, Atlanta;", "lunch": "Ahata, Atlanta", "dinner": "Taste of Vishal, Atlanta", "accommodation": "Spacious private room close St. Barnabas Hospital, Atlanta"}, {"day": 2, "current_city": "Atlanta", "transportation": "-", "breakfast": "Beliram Degchiwala, Atlanta", "attraction": "Martin Luther King, Jr. National Historical Park, Atlanta;", "lunch": "Adda, Atlanta", "dinner": "Saffron, Atlanta", "accommodation": "Spacious private room close St. Barnabas Hospital, Atlanta"}, {"day": 3, "current_city": "from Atlanta to West Palm Beach", "transportation": "Flight Number: F3535986, from Atlanta to West Palm Beach, Departure Time: 22:40, Arrival Time: 00:18", "breakfast": "The Krib, Atlanta", "attraction": "Piedmont Park, Atlanta;", "lunch": "Chef Style, Atlanta", "dinner": "-", "accommodation": "-"}]}]