[{"gpt-4-1106-preview_direct_sole-planning_results": "Travel Plan:\n\nDay 1: March 4, 2022\nCurrent City: from Myrtle Beach to Detroit\nTransportation: Flight Number: F3623834, from Myrtle Beach to Detroit, Departure Time: 06:56, Arrival Time: 09:01, Cost: 258\nBreakfast: - (Assuming breakfast in Myrtle Beach before departure)\nAttraction: Detroit Institute of Arts, Detroit\nLunch: Southern Bliss Bakery, Detroit, Cost: 28, Cuisines: \"Tea, BBQ, Desserts, Seafood\"\nDinner: A Dong Restaurant, Detroit, Cost: 40, Cuisines: \"Tea, Cafe, Pizza\"\nAccommodation: Cozy 1 bedroom in the heart of Fort Greene, Detroit, Cost: 751, Maximum Occupancy: 6, House Rules: No pets & No parties\n\nNumber of People = 2\nTotal Cost = 2 * 258 + 2 * 28 + 2 * 40 + 751 = 1403\n\nDay 2: March 5, 2022\nCurrent City: Detroit\nTransportation: -\nBreakfast: Cafe And More, Detroit, Cost: 41, Cuisines: \"Tea, Bakery, Italian\"\nAttraction: The Henry Ford Museum of American Innovation, Detroit\nLunch: BMG - All Day Dining, Detroit, Cost: 15, Cuisines: \"Desserts, Bakery, BBQ, Indian, Seafood\"\nDinner: Bistro Flamme Bois, Detroit, Cost: 100, Cuisines: \"Chinese, Bakery, BBQ\"\nAccommodation: Cozy 1 bedroom in the heart of Fort Greene, Detroit, Cost: 751, Maximum Occupancy: 6, House Rules: No pets & No parties\n\nNumber of People = 2\nTotal Cost = 2 * 41 + 2 * 15 + 2 * 100 + 751 = 1013\n\nDay 3: March 6, 2022\nCurrent City: from Detroit to Lansing\nTransportation: Flight Number: F3829207, from Detroit to Lansing, Departure Time: 08:34, Arrival Time: 09:14, Cost: 29\nBreakfast: - (Assuming breakfast in Detroit before departure)\nAttraction: Michigan History Center, Lansing\nLunch: Manuel's Bread Cafe, Lansing, Cost: 28, Cuisines: \"French, Pizza, Seafood\"\nDinner: Huey's On The River, Lansing, Cost: 75, Cuisines: \"Tea, French, Bakery, Fast Food, Cafe\"\nAccommodation: Brand New Amazing 1 Bedroom Best Location, Lansing, Cost: 1168, Maximum Occupancy: 8, House Rules: No visitors & No children under 10 & No smoking\n\nNumber of People = 2\nTotal Cost = 2 * 29 + 2 * 28 + 2 * 75 + 1168 = 1403\n\nDay 4: March 7, 2022\nCurrent City: Lansing\nTransportation: -\nBreakfast: Nini's Kitchen, Lansing, Cost: 30, Cuisines: \"Cafe, Mexican, Desserts\"\nAttraction: Potter Park Zoo, Lansing\nLunch: Front Street Brewery, Lansing, Cost: 25, Cuisines: \"BBQ, Mediterranean, Desserts, Italian\"\nDinner: Tony's Italian Restaurant & Pizza, Lansing, Cost: 83, Cuisines: \"Tea, Pizza, Indian, BBQ, American\"\nAccommodation: Brand New Amazing 1 Bedroom Best Location, Lansing, Cost: 1168, Maximum Occupancy: 8, House Rules: No visitors & No children under 10 & No smoking\n\nNumber of People = 2\nTotal Cost = 2 * 30 + 2 * 25 + 2 * 83 + 1168 = 1439\n\nDay 5: March 8, 2022\nCurrent City: from Lansing to Kalamazoo\nTransportation: Self-driving, from Lansing to Kalamazoo, duration: 1 hour 17 mins, distance: 122 km, cost: 6\nBreakfast: - (Assuming breakfast in Lansing before departure)\nAttraction: Kalamazoo Valley Museum, Kalamazoo\nLunch: Django, Kalamazoo, Cost: 65, Cuisines: \"Mediterranean, Desserts, Fast Food\"\nDinner: Giulios Greek & Italian Restaurant, Kalamazoo, Cost: 76, Cuisines: \"Fast Food, French, Desserts, Seafood\"\nAccommodation: East 63rd street, Studio Serviced Apartment, Kalamazoo, Cost: 417, Maximum Occupancy: 4, House Rules: No parties & No visitors & No pets\n\nNumber of People = 2\nTotal Cost = 2 * 6 + 2 * 65 + 2 * 76 + 417 = 705\n\nDay 6: March 9, 2022\nCurrent City: Kalamazoo\nTransportation: -\nBreakfast: Cha cTea, Kalamazoo, Cost: 77, Cuisines: \"Cafe, Pizza, Mediterranean\"\nAttraction: Kalamazoo Institute of Arts, Kalamazoo\nLunch: Taco Bell, Kalamazoo, Cost: 54, Cuisines: \"Chinese, Bakery, Pizza, Seafood\"\nDinner: Oxy Lounge, Kalamazoo, Cost: 65, Cuisines: \"Tea, Bakery, BBQ\"\nAccommodation: East 63rd street, Studio Serviced Apartment, Kalamazoo, Cost: 417, Maximum Occupancy: 4, House Rules: No parties & No visitors & No pets\n\nNumber of People = 2\nTotal Cost = 2 * 77 + 2 * 54 + 2 * 65 + 417 = 809\n\nDay 7: March 10, 2022\nCurrent City: from Kalamazoo to Myrtle Beach\nTransportation: Self-driving, from Kalamazoo to Myrtle Beach, duration: 13 hours 50 mins, distance: 1,400 km, cost: 70\nBreakfast: - (Assuming breakfast in Kalamazoo before departure)\nAttraction: - (Travel day, no specific attractions)\nLunch: - (On the road)\nDinner: - (Assuming dinner in Myrtle Beach after arrival)\nAccommodation: - (End of trip)\n\nNumber of People = 2\nTotal Cost = 2 * 70 = 140\n\nTotal cost across all days = 1403 + 1013 + 1403 + 1439 + 705 + 809 + 140 = 6912\n\nCuisines: The prompt specifies French and American cuisines, and the selected restaurants include these cuisines.\n\nRemaining Budget: $8,300 - $6,912 = $1,388\n\nNote: The costs for breakfast on travel days are not included, assuming travelers will eat before departure. The same applies to dinner on the last day, assuming travelers will eat after arrival in Myrtle Beach. Attractions are chosen based on proximity and relevance but do not include entry fees as these are not provided. Accommodations are chosen based on the availability of private rooms/apartments and adherence to the lack of specific house rules. The travel plan adheres to the budget and includes a mix of French and American cuisines as requested.", "gpt-4-1106-preview_direct_sole-planning_parsed_results": [{"day": 1, "current_city": "from Myrtle Beach to Detroit", "transportation": "Flight Number: F3623834, from Myrtle Beach to Detroit, Departure Time: 06:56, Arrival Time: 09:01", "breakfast": "-", "attraction": "Detroit Institute of Arts, Detroit", "lunch": "Southern Bliss Bakery, Detroit", "dinner": "A Dong Restaurant, Detroit", "accommodation": "Cozy 1 bedroom in the heart of Fort Greene, Detroit"}, {"day": 2, "current_city": "Detroit", "transportation": "-", "breakfast": "Cafe And More, Detroit", "attraction": "The Henry Ford Museum of American Innovation, Detroit", "lunch": "BMG - All Day Dining, Detroit", "dinner": "Bistro Flamme Bois, Detroit", "accommodation": "Cozy 1 bedroom in the heart of Fort Greene, Detroit"}, {"day": 3, "current_city": "from Detroit to Lansing", "transportation": "Flight Number: F3829207, from Detroit to Lansing, Departure Time: 08:34, Arrival Time: 09:14", "breakfast": "-", "attraction": "Michigan History Center, Lansing", "lunch": "Manuel's Bread Cafe, Lansing", "dinner": "Huey's On The River, Lansing", "accommodation": "Brand New Amazing 1 Bedroom Best Location, Lansing"}, {"day": 4, "current_city": "Lansing", "transportation": "-", "breakfast": "Nini's Kitchen, Lansing", "attraction": "Potter Park Zoo, Lansing", "lunch": "Front Street Brewery, Lansing", "dinner": "Tony's Italian Restaurant & Pizza, Lansing", "accommodation": "Brand New Amazing 1 Bedroom Best Location, Lansing"}, {"day": 5, "current_city": "from Lansing to Kalamazoo", "transportation": "Self-driving, from Lansing to Kalamazoo, duration: 1 hour 17 mins, distance: 122 km", "breakfast": "-", "attraction": "Kalamazoo Valley Museum, Kalamazoo", "lunch": "Django, Kalamazoo", "dinner": "Giulios Greek & Italian Restaurant, Kalamazoo", "accommodation": "East 63rd street, Studio Serviced Apartment, Kalamazoo"}, {"day": 6, "current_city": "Kalamazoo", "transportation": "-", "breakfast": "Cha cTea, Kalamazoo", "attraction": "Kalamazoo Institute of Arts, Kalamazoo", "lunch": "Taco Bell, Kalamazoo", "dinner": "Oxy Lounge, Kalamazoo", "accommodation": "East 63rd street, Studio Serviced Apartment, Kalamazoo"}, {"day": 7, "current_city": "from Kalamazoo to Myrtle Beach", "transportation": "Self-driving, from Kalamazoo to Myrtle Beach, duration: 13 hours 50 mins, distance: 1,400 km", "breakfast": "-", "attraction": "-", "lunch": "-", "dinner": "-", "accommodation": "-"}]}]