[{"gpt-4-1106-preview_direct_sole-planning_results": "Travel Plan:\n\nDay 1: March 6, 2022\nCurrent City: from Punta Gorda to Pellston\nTransportation: Self-driving, duration: 21 hours 40 mins, distance: 2,457 km, cost: $122\nBreakfast: -\nAttraction: -\nLunch: -\nDinner: -\nAccommodation: Beautiful apartment ~25min from Times Square, Pellston (price: $571, minimum nights: 5)\n\nDay 2: March 7, 2022\nCurrent City: Pellston\nTransportation: -\nBreakfast: Johnnie Mars, Pellston (American cuisine)\nAttraction: Pellston Pioneer Park, Pellston\nLunch: Aroos Damascus, Pellston (French cuisine)\nDinner: Sagar Gaire Fast Food, Pellston (American cuisine)\nAccommodation: Beautiful apartment ~25min from Times Square, Pellston\n\nDay 3: March 8, 2022\nCurrent City: from Pellston to Traverse City\nTransportation: Self-driving, duration: 1 hour 49 mins, distance: 137 km, cost: $6\nBreakfast: The Great Kabab Factory - Park Plaza, Pellston\nAttraction: Clinch Park, Traverse City\nLunch: Daily Eats, Traverse City (American cuisine)\nDinner: Arigato Sushi, Traverse City (French cuisine)\nAccommodation: Heart of Soho! Cute studio with clean finishes!, Traverse City (price: $969, minimum nights: 4)\n\nDay 4: March 9, 2022\nCurrent City: Traverse City\nTransportation: -\nBreakfast: India on my Plate - Fortune Select Excalibur, Traverse City\nAttraction: Great Lakes Children's Museum, Traverse City\nLunch: French Toast, Traverse City (French cuisine)\nDinner: Whipped, Traverse City (American cuisine)\nAccommodation: Heart of Soho! Cute studio with clean finishes!, Traverse City\n\nDay 5: March 10, 2022\nCurrent City: from Traverse City to Alpena\nTransportation: Self-driving, duration: 2 hours 29 mins, distance: 204 km, cost: $10\nBreakfast: Desserts 83, Traverse City\nAttraction: Great Lakes Maritime Heritage Center, Alpena\nLunch: @Mango, Alpena (American cuisine)\nDinner: Maplai, Alpena (French cuisine)\nAccommodation: Ultimate 50th Floor Downtown Penthouse - 4000SqFt, Alpena (price: $1043, minimum nights: 2)\n\nDay 6: March 11, 2022\nCurrent City: Alpena\nTransportation: -\nBreakfast: A & A Pagliai's Pizza, Alpena\nAttraction: Besser Museum for Northeast Michigan, Alpena\nLunch: Shudh Restaurant, Alpena (American cuisine)\nDinner: Zaffran - The Bristol Hotel, Alpena (French cuisine)\nAccommodation: Ultimate 50th Floor Downtown Penthouse - 4000SqFt, Alpena\n\nDay 7: March 12, 2022\nCurrent City: from Alpena to Punta Gorda\nTransportation: Self-driving, duration: 21 hours 39 mins, distance: 2,401 km, cost: $120\nBreakfast: Kylin Express, Alpena\nAttraction: -\nLunch: -\nDinner: -\nAccommodation: -\n\nTotal Estimated Costs:\nAccommodations: $571 (Pellston) + $969 (Traverse City) + $1043 (Alpena) = $2583\nTransportation: $122 (Punta Gorda to Pellston) + $6 (Pellston to Traverse City) + $10 (Traverse City to Alpena) + $120 (Alpena to Punta Gorda) = $258\nTotal: $2583 (Accommodations) + $258 (Transportation) = $2841\n\nRemaining Budget for Meals and Attractions: $4400 - $2841 = $1559\n\nNote: Meal costs are not included in the total estimated costs as prices are not provided in the reference information. The remaining budget should cover meals and any additional attractions or personal expenses.", "gpt-4-1106-preview_direct_sole-planning_parsed_results": [{"day": 1, "current_city": "from Punta Gorda to Pellston", "transportation": "Self-driving, Duration: 21 hours 40 mins, Distance: 2457 km, Cost: 122", "breakfast": "-", "attraction": "-", "lunch": "-", "dinner": "-", "accommodation": "Beautiful apartment ~25min from Times Square, Pellston"}, {"day": 2, "current_city": "Pellston", "transportation": "-", "breakfast": "Johnnie Mars, Pellston", "attraction": "Pellston Pioneer Park, Pellston", "lunch": "Aroos Damascus, Pellston", "dinner": "Sagar Gaire Fast Food, Pellston", "accommodation": "Beautiful apartment ~25min from Times Square, Pellston"}, {"day": 3, "current_city": "from Pellston to Traverse City", "transportation": "Self-driving, Duration: 1 hour 49 mins, Distance: 137 km, Cost: 6", "breakfast": "The Great Kabab Factory - Park Plaza, Pellston", "attraction": "Clinch Park, Traverse City", "lunch": "Daily Eats, Traverse City", "dinner": "Arigato Sushi, Traverse City", "accommodation": "Heart of Soho! Cute studio with clean finishes!, Traverse City"}, {"day": 4, "current_city": "Traverse City", "transportation": "-", "breakfast": "India on my Plate - Fortune Select Excalibur, Traverse City", "attraction": "Great Lakes Children's Museum, Traverse City", "lunch": "French Toast, Traverse City", "dinner": "Whipped, Traverse City", "accommodation": "Heart of Soho! Cute studio with clean finishes!, Traverse City"}, {"day": 5, "current_city": "from Traverse City to Alpena", "transportation": "Self-driving, Duration: 2 hours 29 mins, Distance: 204 km, Cost: 10", "breakfast": "Desserts 83, Traverse City", "attraction": "Great Lakes Maritime Heritage Center, Alpena", "lunch": "@Mango, Alpena", "dinner": "Maplai, Alpena", "accommodation": "Ultimate 50th Floor Downtown Penthouse - 4000SqFt, Alpena"}, {"day": 6, "current_city": "Alpena", "transportation": "-", "breakfast": "A & A Pagliai's Pizza, Alpena", "attraction": "Besser Museum for Northeast Michigan, Alpena", "lunch": "Shudh Restaurant, Alpena", "dinner": "Zaffran - The Bristol Hotel, Alpena", "accommodation": "Ultimate 50th Floor Downtown Penthouse - 4000SqFt, Alpena"}, {"day": 7, "current_city": "from Alpena to Punta Gorda", "transportation": "Self-driving, Duration: 21 hours 39 mins, Distance: 2401 km, Cost: 120", "breakfast": "Kylin Express, Alpena", "attraction": "-", "lunch": "-", "dinner": "-", "accommodation": "-"}]}]