[{"gpt-4-1106-preview_direct_sole-planning_results": "Travel Plan:\n\nDay 1: March 7th\nCurrent City: from Kona to San Diego\nTransportation: Flight Number: F3739867, from Kona to San Diego, Departure Time: 16:33, Arrival Time: 00:04, Cost: $778\nAccommodation: Spacious Room in Large 2 Bedroom Prewar Apartment, San Diego, Cost: $585, Maximum Occupancy: 2, House Rules: No parties & No visitors, Minimum Nights: 1\n\nNumber of People = 1\nTotal Cost = $778 (Flight) + $585 (Accommodation) = $1363\nAccommodation Minimum Nights: 1/1\n\nDay 2: March 8th\nCurrent City: San Diego\nAttraction: Cabrillo National Monument, San Diego, Cost: Free\nLunch: Open Yard, San Diego, Cost: $33, Cuisines: Chinese, Pizza, Cafe, Desserts\nDinner: Jetha Lal Ka Dhabha, San Diego, Cost: $22, Cuisines: Tea, Cafe, Indian, Italian\nAccommodation: Spacious Room in Large 2 Bedroom Prewar Apartment, San Diego, Cost: $585, Maximum Occupancy: 2, House Rules: No parties & No visitors, Minimum Nights: 1\n\nNumber of People = 1\nTotal Cost = $33 (Lunch) + $22 (Dinner) + $585 (Accommodation) = $640\nAccommodation Minimum Nights: 1/1\n\nDay 3: March 9th\nCurrent City: from San Diego to Redding\nTransportation: Self-driving, from San Diego to Redding, duration: 10 hours 10 mins, distance: 1,070 km, Cost: $53\nAccommodation: **Cozy Space - Private Access**, Redding, Cost: $954, Maximum Occupancy: 1, House Rules: No smoking & No children under 10, Minimum Nights: 2\n\nNumber of People = 1\nTotal Cost = $53 (Transportation) + $954 (Accommodation) = $1007\nAccommodation Minimum Nights: 1/2\n\nDay 4: March 10th\nCurrent City: Redding\nAttraction: Turtle Bay Exploration Park, Redding, Cost: Free\nLunch: New Yorker Deli & Pizzeria, Redding, Cost: $78, Cuisines: Pizza, Bakery, Desserts, Seafood\nDinner: Perfect Bake, Redding, Cost: $69, Cuisines: Tea, Pizza, Fast Food\nAccommodation: **Cozy Space - Private Access**, Redding, Cost: $954, Maximum Occupancy: 1, House Rules: No smoking & No children under 10, Minimum Nights: 2\n\nNumber of People = 1\nTotal Cost = $78 (Lunch) + $69 (Dinner) + $954 (Accommodation) = $1101\nAccommodation Minimum Nights: 2/2\n\nDay 5: March 11th\nCurrent City: from Redding to San Jose\nTransportation: Self-driving, from Redding to San Jose, duration: 3 hours 49 mins, distance: 402 km, Cost: $20\nAccommodation: A4Long Island City Big Room Great Location, San Jose, Cost: $808, Maximum Occupancy: 2, House Rules: No visitors & No pets, Minimum Nights: 1\n\nNumber of People = 1\nTotal Cost = $20 (Transportation) + $808 (Accommodation) = $828\nAccommodation Minimum Nights: 1/1\n\nDay 6: March 12th\nCurrent City: San Jose\nAttraction: Winchester Mystery House, San Jose, Cost: Free\nLunch: Wildfire - Crowne Plaza, San Jose, Cost: $30, Cuisines: Desserts, Cafe, Fast Food, Chinese, Indian, Seafood\nDinner: Gola Sizzlers, San Jose, Cost: $87, Cuisines: Pizza, Mexican, BBQ, Fast Food, American\nAccommodation: A4Long Island City Big Room Great Location, San Jose, Cost: $808, Maximum Occupancy: 2, House Rules: No visitors & No pets, Minimum Nights: 1\n\nNumber of People = 1\nTotal Cost = $30 (Lunch) + $87 (Dinner) + $808 (Accommodation) = $925\nAccommodation Minimum Nights: 1/1\n\nDay 7: March 13th\nCurrent City: from San Jose to Kona\nTransportation: Flight Number: F3976224, from San Jose to Kona, Departure Time: 09:32, Arrival Time: 11:36, Cost: $909\nAccommodation: -\n\nNumber of People = 1\nTotal Cost = $909 (Flight)\n\nTotal cost across all days = $1363 + $640 + $1007 + $1101 + $828 + $925 + $909 = $6773\n\nUnfortunately, the total cost exceeds the budget of $5,800. Adjustments would need to be made to the plan to fit within the budget. This could include choosing cheaper accommodations, dining options, or revising the transportation method.", "gpt-4-1106-preview_direct_sole-planning_parsed_results": [{"day": 1, "current_city": "from Kona to San Diego", "transportation": "Flight Number: F3739867, from Kona to San Diego, Departure Time: 16:33, Arrival Time: 00:04", "breakfast": "-", "attraction": "-", "lunch": "-", "dinner": "-", "accommodation": "Spacious Room in Large 2 Bedroom Prewar Apartment, San Diego"}, {"day": 2, "current_city": "San Diego", "transportation": "-", "breakfast": "-", "attraction": "Cabrillo National Monument, San Diego;", "lunch": "Open Yard, San Diego", "dinner": "Jetha Lal Ka Dhabha, San Diego", "accommodation": "Spacious Room in Large 2 Bedroom Prewar Apartment, San Diego"}, {"day": 3, "current_city": "from San Diego to Redding", "transportation": "Self-driving, from San Diego to Redding, duration: 10 hours 10 mins, distance: 1,070 km", "breakfast": "-", "attraction": "-", "lunch": "-", "dinner": "-", "accommodation": "**Cozy Space - Private Access**, Redding"}, {"day": 4, "current_city": "Redding", "transportation": "-", "breakfast": "-", "attraction": "Turtle Bay Exploration Park, Redding;", "lunch": "New Yorker Deli & Pizzeria, Redding", "dinner": "Perfect Bake, Redding", "accommodation": "**Cozy Space - Private Access**, Redding"}, {"day": 5, "current_city": "from Redding to San Jose", "transportation": "Self-driving, from Redding to San Jose, duration: 3 hours 49 mins, distance: 402 km", "breakfast": "-", "attraction": "-", "lunch": "-", "dinner": "-", "accommodation": "A4Long Island City Big Room Great Location, San Jose"}, {"day": 6, "current_city": "San Jose", "transportation": "-", "breakfast": "-", "attraction": "Winchester Mystery House, San Jose;", "lunch": "Wildfire - Crowne Plaza, San Jose", "dinner": "Gola Sizzlers, San Jose", "accommodation": "A4Long Island City Big Room Great Location, San Jose"}, {"day": 7, "current_city": "from San Jose to Kona", "transportation": "Flight Number: F3976224, from San Jose to Kona, Departure Time: 09:32, Arrival Time: 11:36", "breakfast": "-", "attraction": "-", "lunch": "-", "dinner": "-", "accommodation": "-"}]}]