[{"gpt-4-1106-preview_direct_sole-planning_results": "Travel Plan:\n\nDay 1: March 13, 2022\nCurrent City: from Newark to Madison\nTransportation: Flight Number: F4073170, from Newark to Madison, Departure Time: 18:26, Arrival Time: 19:56, Cost: 355\nAccommodation: Room in two bedroom apartment, Madison, Cost: 159, Room Type: Shared room, House Rules: No smoking & No pets, Minimum Nights: 1, Maximum Occupancy: 2\n\nNumber of People = 2\nTotal Cost = 2 * 355 (flight) + 159 (accommodation) = 869\nAccommodation Minimum Nights: 1/1\n\nDay 2: March 14, 2022\nCurrent City: Madison\nAttraction: Wisconsin State Capitol, Madison\nLunch: Barbeque Nation, Madison, Cost: 38, Cuisines: \"Tea, Pizza, French, Bakery, Cafe\"\nDinner: 99 North Restaurant, Madison, Cost: 62, Cuisines: \"Fast Food, Mexican, Indian, Pizza\"\nAccommodation: Room in two bedroom apartment, Madison, Cost: 159, Room Type: Shared room, House Rules: No smoking & No pets, Minimum Nights: 1, Maximum Occupancy: 2\n\nNumber of People = 2\nTotal Cost = 2 * 38 (lunch) + 2 * 62 (dinner) + 159 (accommodation) = 359\nAccommodation Minimum Nights: 1/1\n\nDay 3: March 15, 2022\nCurrent City: from Madison to Mosinee\nTransportation: Taxi from Madison to Mosinee, duration: 2 hours 3 mins, distance: 209 km, Cost: 209\nAttraction: Rib Mountain State Park, Mosinee\nLunch: Cafe Sante, Mosinee, Cost: 49, Cuisines: \"Pizza, BBQ, Cafe, American, Mediterranean, Seafood\"\nDinner: House of China Restaurant II, Mosinee, Cost: 96, Cuisines: \"Tea, Pizza, French, Cafe, Seafood\"\nAccommodation: Where Dreams are made of NYC, Mosinee, Cost: 212, Room Type: Shared room, House Rules: No smoking & No children under 10, Minimum Nights: 1, Maximum Occupancy: 1\n\nNumber of People = 2\nTotal Cost = 209 (taxi) + 2 * 49 (lunch) + 2 * 96 (dinner) + 2 * 212 (accommodation) = 913\nAccommodation Minimum Nights: 1/1\n\nDay 4: March 16, 2022\nCurrent City: Mosinee\nAttraction: Leigh Yawkey Woodson Art Museum, Mosinee\nLunch: Delifrance - The France Cafe Bakery, Mosinee, Cost: 44, Cuisines: \"Cafe, French, BBQ, Bakery, Fast Food, Chinese\"\nDinner: Naturals Ice Cream, Mosinee, Cost: 79, Cuisines: \"Italian, Bakery, BBQ, Cafe, Indian\"\nAccommodation: Where Dreams are made of NYC, Mosinee, Cost: 212, Room Type: Shared room, House Rules: No smoking & No children under 10, Minimum Nights: 1, Maximum Occupancy: 1\n\nNumber of People = 2\nTotal Cost = 2 * 44 (lunch) + 2 * 79 (dinner) + 2 * 212 (accommodation) = 670\nAccommodation Minimum Nights: 1/1\n\nDay 5: March 17, 2022\nCurrent City: from Mosinee to Newark\nTransportation: Self-driving from Mosinee to Newark, duration: 15 hours 32 mins, distance: 1,695 km, Cost: 84\nBreakfast: MyLoveBiryani.Com, Mosinee, Cost: 17, Cuisines: \"Tea, Bakery, Desserts\"\n\nNumber of People = 2\nTotal Cost = 2 * 84 (self-driving) + 2 * 17 (breakfast) = 202\n\nTotal cost across all days = 869 + 359 + 913 + 670 + 202 = 3013\n\nUnfortunately, the total cost exceeds the specified budget of $2,700. Adjustments need to be made to the plan to fit within the budget. One possible adjustment is to change the transportation method from Madison to Mosinee to self-driving instead of a taxi, which would reduce the cost significantly.\n\nAdjusted Day 3 Transportation:\nTransportation: Self-driving from Madison to Mosinee, duration: 2 hours 3 mins, distance: 209 km, Cost: 10\n\nAdjusted Total Cost for Day 3 = 10 (self-driving) + 2 * 49 (lunch) + 2 * 96 (dinner) + 2 * 212 (accommodation) = 714\n\nAdjusted Total cost across all days = 869 + 359 + 714 + 670 + 202 = 2814\n\nThe adjusted plan is still slightly over budget. Further adjustments, such as choosing less expensive meal options or finding a more affordable accommodation, would be necessary to meet the budget constraint.", "gpt-4-1106-preview_direct_sole-planning_parsed_results": [{"day": 1, "current_city": "from Newark to Madison", "transportation": "Flight Number: F4073170, from Newark to Madison, Departure Time: 18:26, Arrival Time: 19:56", "breakfast": "-", "attraction": "-", "lunch": "-", "dinner": "-", "accommodation": "Room in two bedroom apartment, Madison"}, {"day": 2, "current_city": "Madison", "transportation": "-", "breakfast": "-", "attraction": "Wisconsin State Capitol, Madison", "lunch": "Barbeque Nation, Madison", "dinner": "99 North Restaurant, Madison", "accommodation": "Room in two bedroom apartment, Madison"}, {"day": 3, "current_city": "from Madison to Mosinee", "transportation": "Self-driving from Madison to Mosinee, duration: 2 hours 3 mins, distance: 209 km", "breakfast": "-", "attraction": "Rib Mountain State Park, Mosinee", "lunch": "Cafe Sante, Mosinee", "dinner": "House of China Restaurant II, Mosinee", "accommodation": "Where Dreams are made of NYC, Mosinee"}, {"day": 4, "current_city": "Mosinee", "transportation": "-", "breakfast": "-", "attraction": "Leigh Yawkey Woodson Art Museum, Mosinee", "lunch": "Delifrance - The France Cafe Bakery, Mosinee", "dinner": "Naturals Ice Cream, Mosinee", "accommodation": "Where Dreams are made of NYC, Mosinee"}, {"day": 5, "current_city": "from Mosinee to Newark", "transportation": "Self-driving from Mosinee to Newark, duration: 15 hours 32 mins, distance: 1,695 km", "breakfast": "MyLoveBiryani.Com, Mosinee", "attraction": "-", "lunch": "-", "dinner": "-", "accommodation": "-"}]}]