[{"gpt-4-1106-preview_direct_sole-planning_results": "Travel Plan:\n\nDay 1: March 18, 2022\nCurrent City: from Newark to Miami\nTransportation: Flight Number: F3621615, from Newark to Miami, Departure Time: 06:15, Arrival Time: 09:05\nBreakfast: -\nAttraction: Jungle Island, Miami\nLunch: Clocked, Miami\nDinner: Shorts Burger and Shine, Miami\nAccommodation: \"HELLO BROOKLYN\" PARK SIDE VIEW NEWLY RENO APT., Miami (Entire home/apt, allows parties)\n\nDay 2: March 19, 2022\nCurrent City: Miami\nTransportation: -\nBreakfast: Papouli's Mediterranean Cafe & Market, Miami\nAttraction: P\u00e9rez Art Museum Miami, Miami\nLunch: Tako Cheena by Pom Pom, Miami\nDinner: AB's Absolute Barbecues, Miami\nAccommodation: \"HELLO BROOKLYN\" PARK SIDE VIEW NEWLY RENO APT., Miami (Entire home/apt, allows parties)\n\nDay 3: March 20, 2022\nCurrent City: from Miami to Punta Gorda\nTransportation: Taxi, from Miami to Punta Gorda, Departure Time: -, Arrival Time: -, Duration: 2 hours 41 mins, Cost: $291\nBreakfast: Anjlika, Miami\nAttraction: Laishley Park, Punta Gorda\nLunch: D.O.C Ristorante, Punta Gorda\nDinner: Cookie Shoppe, Punta Gorda\nAccommodation: Cozy Two-bedroom Apt in a Cute House in Brooklyn!, Punta Gorda (Entire home/apt, allows parties)\n\nDay 4: March 21, 2022\nCurrent City: Punta Gorda\nTransportation: -\nBreakfast: Pho Bac, Punta Gorda\nAttraction: Ponce De Leon Park, Punta Gorda\nLunch: China Cafe, Punta Gorda\nDinner: G Thal, Punta Gorda\nAccommodation: Cozy Two-bedroom Apt in a Cute House in Brooklyn!, Punta Gorda (Entire home/apt, allows parties)\n\nDay 5: March 22, 2022\nCurrent City: from Punta Gorda to Jacksonville\nTransportation: Taxi, from Punta Gorda to Jacksonville, Departure Time: -, Arrival Time: -, Duration: 4 hours 26 mins, Cost: $474\nBreakfast: Gelato Vinto, Punta Gorda\nAttraction: Jacksonville Zoo and Gardens, Jacksonville\nLunch: Villa Gargano, Jacksonville\nDinner: Pirates' House Restaurant, Jacksonville\nAccommodation: NYC Sanctuary, Skyline Views & Rooftop, Jacksonville (Entire home/apt, allows parties)\n\nDay 6: March 23, 2022\nCurrent City: Jacksonville\nTransportation: -\nBreakfast: Goose Feathers Cafe and Bakery, Jacksonville\nAttraction: Southbank Riverwalk, Jacksonville\nLunch: Ashoka Restaurant, Jacksonville\nDinner: Sanjha Chulha, Jacksonville\nAccommodation: NYC Sanctuary, Skyline Views & Rooftop, Jacksonville (Entire home/apt, allows parties)\n\nDay 7: March 24, 2022\nCurrent City: from Jacksonville to Newark\nTransportation: Flight Number: F4075995, from Jacksonville to Newark, Departure Time: 08:22, Arrival Time: 10:15\nBreakfast: Touch of Spice, Jacksonville\nAttraction: -\nLunch: -\nDinner: -\nAccommodation: -\n\nPlease note that the accommodation choices are based on the requirement for entire rooms that allow parties. The transportation options are selected based on the group not self-driving and the available options within the budget. Meals and attractions are chosen to provide a diverse experience in each city. The total cost of transportation, accommodation, and estimated meal costs should be within the budget of $10,400.", "gpt-4-1106-preview_direct_sole-planning_parsed_results": [{"day": 1, "current_city": "from Newark to Miami", "transportation": "Flight Number: F3621615, from Newark to Miami, Departure Time: 06:15, Arrival Time: 09:05", "breakfast": "-", "attraction": "Jungle Island, Miami;", "lunch": "Clocked, Miami", "dinner": "Shorts Burger and Shine, Miami", "accommodation": "\"HELLO BROOKLYN\" PARK SIDE VIEW NEWLY RENO APT., Miami"}, {"day": 2, "current_city": "Miami", "transportation": "-", "breakfast": "Papouli's Mediterranean Cafe & Market, Miami", "attraction": "P\u00e9rez Art Museum Miami, Miami;", "lunch": "Tako Cheena by Pom Pom, Miami", "dinner": "AB's Absolute Barbecues, Miami", "accommodation": "\"HELLO BROOKLYN\" PARK SIDE VIEW NEWLY RENO APT., Miami"}, {"day": 3, "current_city": "from Miami to Punta Gorda", "transportation": "Taxi, from Miami to Punta Gorda, Departure Time: -, Arrival Time: -, Duration: 2 hours 41 mins, Cost: 291", "breakfast": "Anjlika, Miami", "attraction": "Laishley Park, Punta Gorda;", "lunch": "D.O.C Ristorante, Punta Gorda", "dinner": "Cookie Shoppe, Punta Gorda", "accommodation": "Cozy Two-bedroom Apt in a Cute House in Brooklyn!, Punta Gorda"}, {"day": 4, "current_city": "Punta Gorda", "transportation": "-", "breakfast": "Pho Bac, Punta Gorda", "attraction": "Ponce De Leon Park, Punta Gorda;", "lunch": "China Cafe, Punta Gorda", "dinner": "G Thal, Punta Gorda", "accommodation": "Cozy Two-bedroom Apt in a Cute House in Brooklyn!, Punta Gorda"}, {"day": 5, "current_city": "from Punta Gorda to Jacksonville", "transportation": "Taxi, from Punta Gorda to Jacksonville, Departure Time: -, Arrival Time: -, Duration: 4 hours 26 mins, Cost: 474", "breakfast": "Gelato Vinto, Punta Gorda", "attraction": "Jacksonville Zoo and Gardens, Jacksonville;", "lunch": "Villa Gargano, Jacksonville", "dinner": "Pirates' House Restaurant, Jacksonville", "accommodation": "NYC Sanctuary, Skyline Views & Rooftop, Jacksonville"}, {"day": 6, "current_city": "Jacksonville", "transportation": "-", "breakfast": "Goose Feathers Cafe and Bakery, Jacksonville", "attraction": "Southbank Riverwalk, Jacksonville;", "lunch": "Ashoka Restaurant, Jacksonville", "dinner": "Sanjha Chulha, Jacksonville", "accommodation": "NYC Sanctuary, Skyline Views & Rooftop, Jacksonville"}, {"day": 7, "current_city": "from Jacksonville to Newark", "transportation": "Flight Number: F4075995, from Jacksonville to Newark, Departure Time: 08:22, Arrival Time: 10:15", "breakfast": "Touch of Spice, Jacksonville", "attraction": "-", "lunch": "-", "dinner": "-", "accommodation": "-"}]}]