[{"gpt-4-1106-preview_direct_sole-planning_results": "Travel Plan:\n\nDay 1: March 14, 2022\nCurrent City: from Manhattan to Texarkana\nTransportation: Self-driving, from Manhattan to Texarkana, Duration: 20 hours 36 mins, Distance: 2,218 km, Cost: 110\nBreakfast: -\nAttraction: -\nLunch: -\nDinner: -\nAccommodation: sunny airy bohemian rm, private bath! hip 'shwick, Texarkana, Cost: 592, Room Type: Private room, House Rules: No smoking, Minimum Nights: 2, Maximum Occupancy: 2\n\nNumber of People = 3\nTotal Cost = 3 * 110 + 3 * 592 / 2 = 330 + 888 = 1218\nAccommodation Minimum Nights: 1/2\n\nDay 2: March 15, 2022\nCurrent City: Texarkana\nTransportation: -\nBreakfast: Big City Bread Cafe, Texarkana, Cost: 61, Cuisines: \"Cafe, Pizza, Bakery, BBQ\"\nAttraction: Museum of Regional History, Texarkana\nLunch: Poets Cafe, Texarkana, Cost: 88, Cuisines: \"Chinese, Bakery, Indian, Desserts\"\nDinner: Columbia Restaurant, Texarkana, Cost: 91, Cuisines: \"Desserts, Tea, Pizza, Indian, Seafood\"\nAccommodation: sunny airy bohemian rm, private bath! hip 'shwick, Texarkana, Cost: 592, Room Type: Private room, House Rules: No smoking, Minimum Nights: 2, Maximum Occupancy: 2\n\nNumber of People = 3\nTotal Cost = 3 * 61 + 3 * 88 + 3 * 91 + 3 * 592 / 2 = 183 + 264 + 273 + 888 = 1608\nAccommodation Minimum Nights: 2/2\n\nDay 3: March 16, 2022\nCurrent City: from Texarkana to Dallas\nTransportation: Flight Number: F3603637, from Texarkana to Dallas, Departure Time: 18:17, Arrival Time: 19:14, Cost: 56\nBreakfast: Club Mojo, Texarkana, Cost: 49, Cuisines: \"Desserts, Italian, BBQ, Cafe, American\"\nAttraction: Spring Lake Park, Texarkana\nLunch: Bansiwala Rasoi, Texarkana, Cost: 71, Cuisines: \"Tea, French, BBQ\"\nDinner: -\nAccommodation: Chic Union Square One Bedroom, Dallas, Cost: 1096, Room Type: Entire home/apt, House Rules: No visitors, Minimum Nights: 3, Maximum Occupancy: 5\n\nNumber of People = 3\nTotal Cost = 3 * 56 + 3 * 49 + 3 * 71 + 3 * 1096 / 5 = 168 + 147 + 213 + 657.6 = 1185.6\nAccommodation Minimum Nights: 1/3\n\nDay 4: March 17, 2022\nCurrent City: Dallas\nTransportation: -\nBreakfast: Coconuts Fish Cafe, Dallas, Cost: 38, Cuisines: \"Cafe, BBQ, Mediterranean, Fast Food\"\nAttraction: The Dallas World Aquarium, Dallas; The Sixth Floor Museum at Dealey Plaza, Dallas\nLunch: 1918 Bistro & Grill, Dallas, Cost: 90, Cuisines: \"Tea, Pizza, BBQ, Seafood\"\nDinner: Yanki Sizzlers, Dallas, Cost: 96, Cuisines: \"Cafe, French, Tea, Mediterranean\"\nAccommodation: Chic Union Square One Bedroom, Dallas, Cost: 1096, Room Type: Entire home/apt, House Rules: No visitors, Minimum Nights: 3, Maximum Occupancy: 5\n\nNumber of People = 3\nTotal Cost = 3 * 38 + 3 * 90 + 3 * 96 + 3 * 1096 / 5 = 114 + 270 + 288 + 657.6 = 1329.6\nAccommodation Minimum Nights: 2/3\n\nDay 5: March 18, 2022\nCurrent City: from Dallas to Manhattan\nTransportation: Flight Number: F3608417, from Dallas to Manhattan, Departure Time: 17:04, Arrival Time: 18:35, Cost: 121\nBreakfast: Aravali Owls, Dallas, Cost: 53, Cuisines: \"Pizza, Italian, Bakery, Fast Food, Cafe\"\nAttraction: Reunion Tower, Dallas\nLunch: Kebab Xpress, Dallas, Cost: 93, Cuisines: \"Tea, Bakery, Pizza, Mediterranean\"\nDinner: -\nAccommodation: -\n\nNumber of People = 3\nTotal Cost = 3 * 121 + 3 * 53 + 3 * 93 = 363 + 159 + 279 = 801\n\nTotal cost across all days = 1218 + 1608 + 1185.6 + 1329.6 + 801 = 6142.2\n\nCuisines: The prompt specifies no cuisines, so all cuisines constraints are satisfied.\n\nNote: The total cost exceeds the specified budget of $3,900. Adjustments to the plan, such as changing accommodation or transportation options, may be necessary to meet the budget constraint.", "gpt-4-1106-preview_direct_sole-planning_parsed_results": [{"day": 1, "current_city": "from Manhattan to Texarkana", "transportation": "Self-driving, from Manhattan to Texarkana, Duration: 20 hours 36 mins, Distance: 2,218 km", "breakfast": "-", "attraction": "-", "lunch": "-", "dinner": "-", "accommodation": "sunny airy bohemian rm, private bath! hip 'shwick, Texarkana"}, {"day": 2, "current_city": "Texarkana", "transportation": "-", "breakfast": "Big City Bread Cafe, Texarkana", "attraction": "Museum of Regional History, Texarkana;", "lunch": "Poets Cafe, Texarkana", "dinner": "Columbia Restaurant, Texarkana", "accommodation": "sunny airy bohemian rm, private bath! hip 'shwick, Texarkana"}, {"day": 3, "current_city": "from Texarkana to Dallas", "transportation": "Flight Number: F3603637, from Texarkana to Dallas, Departure Time: 18:17, Arrival Time: 19:14", "breakfast": "Club Mojo, Texarkana", "attraction": "Spring Lake Park, Texarkana;", "lunch": "Bansiwala Rasoi, Texarkana", "dinner": "-", "accommodation": "Chic Union Square One Bedroom, Dallas"}, {"day": 4, "current_city": "Dallas", "transportation": "-", "breakfast": "Coconuts Fish Cafe, Dallas", "attraction": "The Dallas World Aquarium, Dallas;The Sixth Floor Museum at Dealey Plaza, Dallas;", "lunch": "1918 Bistro & Grill, Dallas", "dinner": "Yanki Sizzlers, Dallas", "accommodation": "Chic Union Square One Bedroom, Dallas"}, {"day": 5, "current_city": "from Dallas to Manhattan", "transportation": "Flight Number: F3608417, from Dallas to Manhattan, Departure Time: 17:04, Arrival Time: 18:35", "breakfast": "Aravali Owls, Dallas", "attraction": "Reunion Tower, Dallas;", "lunch": "Kebab Xpress, Dallas", "dinner": "-", "accommodation": "-"}]}]