[{"gpt-4-1106-preview_direct_sole-planning_results": "Day 1: March 22, 2022\nCurrent City: from Sun Valley to San Diego\nTransportation: Self-driving, from Sun Valley to San Diego, Duration: 14 hours 9 mins, Distance: 1,461 km, Cost: $73\nBreakfast: -\nAttraction: -\nLunch: -\nDinner: Open Yard, San Diego\nAccommodation: Spacious Room in Large 2 Bedroom Prewar Apartment, San Diego\n\nDay 2: March 23, 2022\nCurrent City: San Diego\nTransportation: -\nBreakfast: Jetha Lal Ka Dhabha, San Diego\nAttraction: Cabrillo National Monument, San Diego; Balboa Park, San Diego\nLunch: The Lost Mughal, San Diego\nDinner: Burger King, San Diego\nAccommodation: Spacious Room in Large 2 Bedroom Prewar Apartment, San Diego\n\nDay 3: March 24, 2022\nCurrent City: from San Diego to Redding\nTransportation: Self-driving, from San Diego to Redding, Duration: 10 hours 10 mins, Distance: 1,070 km, Cost: $53\nBreakfast: -\nAttraction: -\nLunch: -\nDinner: New Yorker Deli & Pizzeria, Redding\nAccommodation: **Cozy Space - Private Access**, Redding\n\nDay 4: March 25, 2022\nCurrent City: Redding\nTransportation: -\nBreakfast: Perfect Bake, Redding\nAttraction: Turtle Bay Exploration Park, Redding; Sundial Bridge, Redding\nLunch: Evergreen Tandoori Night, Redding\nDinner: Mosaic - Country Inn & Suites, Redding\nAccommodation: **Cozy Space - Private Access**, Redding\n\nDay 5: March 26, 2022\nCurrent City: from Redding to Sun Valley\nTransportation: Self-driving, from Redding to Sun Valley, Duration: 11 hours 13 mins, Distance: 1,087 km, Cost: $54\nBreakfast: -\nAttraction: -\nLunch: -\nDinner: -\nAccommodation: -\n\nTotal Estimated Cost: $73 (Day 1 driving) + $53 (Day 3 driving) + $54 (Day 5 driving) + Accommodation and Meals (variable, based on choices from the provided options)\n\nPlease note that the accommodation costs, meal costs, and any additional fees such as park entrances or activities are not included in the total estimated cost as they were not provided in the reference information. Ensure that the total cost of these additional expenses does not exceed the remaining budget of $2,420 ($2,600 budget - $180 transportation costs).", "gpt-4-1106-preview_direct_sole-planning_parsed_results": [{"day": 1, "current_city": "from Sun Valley to San Diego", "transportation": "Self-driving, from Sun Valley to San Diego, Duration: 14 hours 9 mins, Distance: 1,461 km, Cost: 73", "breakfast": "-", "attraction": "-", "lunch": "-", "dinner": "Open Yard, San Diego", "accommodation": "Spacious Room in Large 2 Bedroom Prewar Apartment, San Diego"}, {"day": 2, "current_city": "San Diego", "transportation": "-", "breakfast": "Jetha Lal Ka Dhabha, San Diego", "attraction": "Cabrillo National Monument, San Diego;Balboa Park, San Diego;", "lunch": "The Lost Mughal, San Diego", "dinner": "Burger King, San Diego", "accommodation": "Spacious Room in Large 2 Bedroom Prewar Apartment, San Diego"}, {"day": 3, "current_city": "from San Diego to Redding", "transportation": "Self-driving, from San Diego to Redding, Duration: 10 hours 10 mins, Distance: 1,070 km, Cost: 53", "breakfast": "-", "attraction": "-", "lunch": "-", "dinner": "New Yorker Deli & Pizzeria, Redding", "accommodation": "Cozy Space - Private Access, Redding"}, {"day": 4, "current_city": "Redding", "transportation": "-", "breakfast": "Perfect Bake, Redding", "attraction": "Turtle Bay Exploration Park, Redding;Sundial Bridge, Redding;", "lunch": "Evergreen Tandoori Night, Redding", "dinner": "Mosaic - Country Inn & Suites, Redding", "accommodation": "Cozy Space - Private Access, Redding"}, {"day": 5, "current_city": "from Redding to Sun Valley", "transportation": "Self-driving, from Redding to Sun Valley, Duration: 11 hours 13 mins, Distance: 1,087 km, Cost: 54", "breakfast": "-", "attraction": "-", "lunch": "-", "dinner": "-", "accommodation": "-"}]}]