[{"gpt-4-1106-preview_direct_sole-planning_results": "Travel Plan:\n\nDay 1:\nCurrent City: from St. Louis to Las Vegas\nTransportation: Flight Number: F3963080, from St. Louis to Las Vegas, Departure Time: 14:46, Arrival Time: 16:09\nBreakfast: -\nAttraction: The Mob Museum, Las Vegas\nLunch: Chili's Grill & Bar, Las Vegas\nDinner: Ethos Vegan Kitchen, Las Vegas\nAccommodation: Cozy modern stay, Las Vegas\n\nDay 2:\nCurrent City: Las Vegas\nTransportation: -\nBreakfast: Big Brewsky, Las Vegas\nAttraction: Eiffel Tower Viewing Deck, Las Vegas; Fremont Street Experience, Las Vegas\nLunch: Portneuf Valley Brewing, Las Vegas\nDinner: Barbeque Nation, Las Vegas\nAccommodation: Cozy modern stay, Las Vegas\n\nDay 3:\nCurrent City: from Las Vegas to St. Louis\nTransportation: Flight Number: F3570705, from Las Vegas to St. Louis, Departure Time: 00:43, Arrival Time: 05:50\nBreakfast: Subway, Las Vegas\nAttraction: -\nLunch: -\nDinner: -\nAccommodation: -\n\nNote: The chosen flight options and accommodations are within the specified budget of $1,300. Attractions, meals, and accommodations have been selected based on the provided reference information and to ensure a diverse and enjoyable travel experience.", "gpt-4-1106-preview_direct_sole-planning_parsed_results": [{"day": 1, "current_city": "from St. Louis to Las Vegas", "transportation": "Flight Number: F3963080, from St. Louis to Las Vegas, Departure Time: 14:46, Arrival Time: 16:09", "breakfast": "-", "attraction": "The Mob Museum, Las Vegas;", "lunch": "Chili's Grill & Bar, Las Vegas", "dinner": "Ethos Vegan Kitchen, Las Vegas", "accommodation": "Cozy modern stay, Las Vegas"}, {"day": 2, "current_city": "Las Vegas", "transportation": "-", "breakfast": "Big Brewsky, Las Vegas", "attraction": "Eiffel Tower Viewing Deck, Las Vegas; Fremont Street Experience, Las Vegas;", "lunch": "Portneuf Valley Brewing, Las Vegas", "dinner": "Barbeque Nation, Las Vegas", "accommodation": "Cozy modern stay, Las Vegas"}, {"day": 3, "current_city": "from Las Vegas to St. Louis", "transportation": "Flight Number: F3570705, from Las Vegas to St. Louis, Departure Time: 00:43, Arrival Time: 05:50", "breakfast": "Subway, Las Vegas", "attraction": "-", "lunch": "-", "dinner": "-", "accommodation": "-"}]}]