[{"gpt-4-1106-preview_direct_sole-planning_results": "Travel Plan:\n\nDay 1: March 6, 2022\nCurrent City: from Charlotte to Pittsburgh\nTransportation: Flight Number: F4050756, from Charlotte to Pittsburgh, Departure Time: 07:15, Arrival Time: 08:34\nBreakfast: -\nAttraction: The Andy Warhol Museum, Pittsburgh\nLunch: Maharaja Bhog, Pittsburgh\nDinner: Indus Flavour, Pittsburgh\nAccommodation: Sunny 1 BR Brooklyn Loft Apartment, Pittsburgh\n\nDay 2: March 7, 2022\nCurrent City: Pittsburgh\nTransportation: -\nBreakfast: Beijing Cafe, Pittsburgh\nAttraction: Pittsburgh Zoo & Aquarium, Pittsburgh; Carnegie Museum of Art, Pittsburgh\nLunch: Via Delhi, Pittsburgh\nDinner: Burger Factory, Pittsburgh\nAccommodation: Sunny 1 BR Brooklyn Loft Apartment, Pittsburgh\n\nDay 3: March 8, 2022\nCurrent City: Pittsburgh\nTransportation: -\nBreakfast: Aryan Family's Delight, Pittsburgh\nAttraction: Phipps Conservatory and Botanical Gardens, Pittsburgh; Carnegie Science Center, Pittsburgh\nLunch: Embassy, Pittsburgh\nDinner: The Urban Foundry, Pittsburgh\nAccommodation: Sunny 1 BR Brooklyn Loft Apartment, Pittsburgh\n\nDay 4: March 9, 2022\nCurrent City: from Pittsburgh to Erie\nTransportation: Self-driving, from Pittsburgh to Erie, duration: 1 hour 55 mins, distance: 206 km, cost: 10\nBreakfast: -\nAttraction: Erie Maritime Museum, Erie; Presque Isle State Park, Erie\nLunch: Granite City Food & Brewery, Erie\nDinner: Kona Brewing Company, Erie\nAccommodation: Sunny, Open, East Harlem 1 bedroom, Erie\n\nDay 5: March 10, 2022\nCurrent City: Erie\nTransportation: -\nBreakfast: Chapter 1 Cafe, Erie\nAttraction: expERIEnce Children's Museum, Erie; Erie Zoo, Erie\nLunch: Kalsang AMA Cafe, Erie\nDinner: Deez Biryani & Kebabs, Erie\nAccommodation: Sunny, Open, East Harlem 1 bedroom, Erie\n\nDay 6: March 11, 2022\nCurrent City: from Erie to Philadelphia\nTransportation: Self-driving, from Erie to Philadelphia, duration: 6 hours 22 mins, distance: 678 km, cost: 33\nBreakfast: -\nAttraction: The Franklin Institute, Philadelphia; Independence National Historical Park, Philadelphia\nLunch: Red Ginger Sushi, Grill & Bar, Philadelphia\nDinner: Marukame Udon, Philadelphia\nAccommodation: Industrial Loft Living in NYC, Philadelphia\n\nDay 7: March 12, 2022\nCurrent City: from Philadelphia to Charlotte\nTransportation: Flight Number: F3686016, from Philadelphia to Charlotte, Departure Time: 14:01, Arrival Time: 15:53\nBreakfast: Hong Kong Cafe, Philadelphia\nAttraction: Philadelphia's Magic Gardens, Philadelphia; Philadelphia Museum of Art, Philadelphia\nLunch: The Moon Under Water, Philadelphia\nDinner: -\nAccommodation: -\n\nPlease note that the travel plan adheres to the budget, includes diverse meals and attractions, and ensures that the traveler does not visit the same city or attraction twice. The accommodations chosen have a minimum number of nights that fit within the travel dates. The final day includes a return to the origin city, Charlotte.", "gpt-4-1106-preview_direct_sole-planning_parsed_results": [{"day": 1, "current_city": "from Charlotte to Pittsburgh", "transportation": "Flight Number: F4050756, from Charlotte to Pittsburgh, Departure Time: 07:15, Arrival Time: 08:34", "breakfast": "-", "attraction": "The Andy Warhol Museum, Pittsburgh;", "lunch": "Maharaja Bhog, Pittsburgh", "dinner": "Indus Flavour, Pittsburgh", "accommodation": "Sunny 1 BR Brooklyn Loft Apartment, Pittsburgh"}, {"day": 2, "current_city": "Pittsburgh", "transportation": "-", "breakfast": "Beijing Cafe, Pittsburgh", "attraction": "Pittsburgh Zoo & Aquarium, Pittsburgh; Carnegie Museum of Art, Pittsburgh;", "lunch": "Via Delhi, Pittsburgh", "dinner": "Burger Factory, Pittsburgh", "accommodation": "Sunny 1 BR Brooklyn Loft Apartment, Pittsburgh"}, {"day": 3, "current_city": "Pittsburgh", "transportation": "-", "breakfast": "Aryan Family's Delight, Pittsburgh", "attraction": "Phipps Conservatory and Botanical Gardens, Pittsburgh; Carnegie Science Center, Pittsburgh;", "lunch": "Embassy, Pittsburgh", "dinner": "The Urban Foundry, Pittsburgh", "accommodation": "Sunny 1 BR Brooklyn Loft Apartment, Pittsburgh"}, {"day": 4, "current_city": "from Pittsburgh to Erie", "transportation": "Self-driving, from Pittsburgh to Erie, duration: 1 hour 55 mins, distance: 206 km, Cost: 10", "breakfast": "-", "attraction": "Erie Maritime Museum, Erie; Presque Isle State Park, Erie;", "lunch": "Granite City Food & Brewery, Erie", "dinner": "Kona Brewing Company, Erie", "accommodation": "Sunny, Open, East Harlem 1 bedroom, Erie"}, {"day": 5, "current_city": "Erie", "transportation": "-", "breakfast": "Chapter 1 Cafe, Erie", "attraction": "expERIEnce Children's Museum, Erie; Erie Zoo, Erie;", "lunch": "Kalsang AMA Cafe, Erie", "dinner": "Deez Biryani & Kebabs, Erie", "accommodation": "Sunny, Open, East Harlem 1 bedroom, Erie"}, {"day": 6, "current_city": "from Erie to Philadelphia", "transportation": "Self-driving, from Erie to Philadelphia, duration: 6 hours 22 mins, distance: 678 km, Cost: 33", "breakfast": "-", "attraction": "The Franklin Institute, Philadelphia; Independence National Historical Park, Philadelphia;", "lunch": "Red Ginger Sushi, Grill & Bar, Philadelphia", "dinner": "Marukame Udon, Philadelphia", "accommodation": "Industrial Loft Living in NYC, Philadelphia"}, {"day": 7, "current_city": "from Philadelphia to Charlotte", "transportation": "Flight Number: F3686016, from Philadelphia to Charlotte, Departure Time: 14:01, Arrival Time: 15:53", "breakfast": "Hong Kong Cafe, Philadelphia", "attraction": "Philadelphia's Magic Gardens, Philadelphia; Philadelphia Museum of Art, Philadelphia;", "lunch": "The Moon Under Water, Philadelphia", "dinner": "-", "accommodation": "-"}]}]