[{"gpt-4-1106-preview_direct_sole-planning_results": "Travel Plan:\n\nDay 1: March 13, 2022\nCurrent City: from Bloomington to Orlando\nTransportation: Flight Number: F3563219, from Bloomington to Orlando, Departure Time: 15:35, Arrival Time: 19:17, Cost: $302 * 4 = $1208\nAccommodation: Sixth Ave Chelsea, Studio Serviced Apartment, Orlando, Cost: $70 * 2 (ceil(4/3)) = $140, Maximum Occupancy: 3, House Rules: No visitors & No pets, Minimum Nights: 30\n- Note: Since the accommodation must be pet-friendly and none of the options in Orlando are pet-friendly, we will not book any accommodation in Orlando.\n\nDay 2: March 14, 2022\nCurrent City: Orlando\nAttraction: SeaWorld Orlando, Cost: $0 (no price provided)\nLunch: Fuji Japanese Steakhouse, Orlando, Cost: $75 * 4 = $300, Cuisines: Tea, Bakery, Desserts\nAttraction: The Wheel at ICON Park, Cost: $0 (no price provided)\nDinner: Turquoise Villa, Orlando, Cost: $55 * 4 = $220, Cuisines: French, Bakery, BBQ, Fast Food\nAccommodation: Sixth Ave Chelsea, Studio Serviced Apartment, Orlando, Cost: $140 (from Day 1)\n\nDay 3: March 15, 2022\nCurrent City: from Orlando to Miami\nTransportation: Flight Number: F3686728, from Orlando to Miami, Departure Time: 19:17, Arrival Time: 20:28, Cost: $41 * 4 = $164\nAccommodation: Cozy Two-bedroom Apt in a Cute House in Brooklyn!, Miami, Cost: $99 * 2 (ceil(4/1)) = $198, Maximum Occupancy: 1, House Rules: No children under 10, Minimum Nights: 4\n- Note: Since the accommodation must be pet-friendly and none of the options in Miami are pet-friendly, we will not book any accommodation in Miami.\n\nDay 4: March 16, 2022\nCurrent City: Miami\nAttraction: Jungle Island, Cost: $0 (no price provided)\nLunch: Clocked, Miami, Cost: $49 * 4 = $196, Cuisines: Tea, Italian, Mexican, BBQ, Cafe\nAttraction: P\u00e9rez Art Museum Miami, Cost: $0 (no price provided)\nDinner: Shorts Burger and Shine, Miami, Cost: $81 * 4 = $324, Cuisines: Chinese, Cafe, Seafood\nAccommodation: Cozy Two-bedroom Apt in a Cute House in Brooklyn!, Miami, Cost: $198 (from Day 3)\n\nDay 5: March 17, 2022\nCurrent City: from Miami to Bloomington\nTransportation: Self-driving, from Miami to Bloomington, duration: 17 hours 1 min, distance: 1,897 km, Cost: $94 * ceil(4/5) = $94\n\nNumber of People = 4\nTotal Cost = $1208 (Day 1 transport) + $140 (Day 1 accomm) + $300 (Day 2 lunch) + $220 (Day 2 dinner) + $140 (Day 2 accomm) + $164 (Day 3 transport) + $198 (Day 3 accomm) + $196 (Day 4 lunch) + $324 (Day 4 dinner) + $198 (Day 4 accomm) + $94 (Day 5 transport) = $3082\n\nTotal cost across all days = $3082\nRemaining Budget = $15900 - $3082 = $12818\n\nCuisines: The prompt specifies no cuisines, so all cuisines constraints are satisfied.\nAccommodations: Since no pet-friendly accommodations are available in the provided data, we have not booked any accommodations in Orlando and Miami.\n\nNote: The attractions listed do not have prices provided, so they are assumed to be free for the purpose of this plan. If there are entrance fees, they would need to be considered within the budget. Additionally, since no pet-friendly accommodations are available in the provided data, we have not booked any accommodations in Orlando and Miami. If pet-friendly accommodations are a must, alternative arrangements would need to be made outside of the provided data.", "gpt-4-1106-preview_direct_sole-planning_parsed_results": [{"day": 1, "current_city": "from Bloomington to Orlando", "transportation": "Flight Number: F3563219, from Bloomington to Orlando, Departure Time: 15:35, Arrival Time: 19:17", "breakfast": "-", "attraction": "-", "lunch": "-", "dinner": "-", "accommodation": "-"}, {"day": 2, "current_city": "Orlando", "transportation": "-", "breakfast": "-", "attraction": "SeaWorld Orlando, Orlando;The Wheel at ICON Park, Orlando;", "lunch": "Fuji Japanese Steakhouse, Orlando", "dinner": "Turquoise Villa, Orlando", "accommodation": "Sixth Ave Chelsea, Studio Serviced Apartment, Orlando"}, {"day": 3, "current_city": "from Orlando to Miami", "transportation": "Flight Number: F3686728, from Orlando to Miami, Departure Time: 19:17, Arrival Time: 20:28", "breakfast": "-", "attraction": "-", "lunch": "-", "dinner": "-", "accommodation": "-"}, {"day": 4, "current_city": "Miami", "transportation": "-", "breakfast": "-", "attraction": "Jungle Island, Miami;P\u00e9rez Art Museum Miami, Miami;", "lunch": "Clocked, Miami", "dinner": "Shorts Burger and Shine, Miami", "accommodation": "Cozy Two-bedroom Apt in a Cute House in Brooklyn!, Miami"}, {"day": 5, "current_city": "from Miami to Bloomington", "transportation": "Self-driving, from Miami to Bloomington, duration: 17 hours 1 min, distance: 1,897 km", "breakfast": "-", "attraction": "-", "lunch": "-", "dinner": "-", "accommodation": "-"}]}]