[{"gpt-4-1106-preview_direct_sole-planning_results": "Travel Plan:\n\nDay 1: March 7th, 2022\nCurrent City: from Wichita to Alamosa\nTransportation: Self-driving, from Wichita to Alamosa, Duration: 8 hours 27 mins, Distance: 819 km, Cost: $40\nBreakfast: -\nAttraction: -\nLunch: -\nDinner: -\nAccommodation: Comfortable studio suite in midtown Manhattan, Alamosa, Cost: $67, Entire home/apt, House Rules: No parties & No smoking & No visitors, Minimum Nights: 30, Maximum Occupancy: 2\n\nTotal Cost for Day 1: $40 (Transportation) + $67 (Accommodation) = $107\n\nDay 2: March 8th, 2022\nCurrent City: Alamosa\nTransportation: -\nBreakfast: Atlanta Highway Seafood Market, Alamosa, Cost: $68, Cuisines: Fast Food, Desserts, Seafood\nAttraction: San Luis Valley Museum, Alamosa\nLunch: Riverwalk Cafe, Alamosa, Cost: $97, Cuisines: Tea, Pizza, Fast Food\nDinner: Viva Hyderabad, Alamosa, Cost: $90, Cuisines: Pizza, Desserts\nAccommodation: Comfortable studio suite in midtown Manhattan, Alamosa, Cost: $67, Entire home/apt, House Rules: No parties & No smoking & No visitors, Minimum Nights: 30, Maximum Occupancy: 2\n\nTotal Cost for Day 2: $68 (Breakfast) + $97 (Lunch) + $90 (Dinner) + $67 (Accommodation) = $322\n\nDay 3: March 9th, 2022\nCurrent City: from Alamosa to Grand Junction\nTransportation: Self-driving, from Alamosa to Grand Junction, Duration: 4 hours 29 mins, Distance: 396 km, Cost: $19\nBreakfast: -\nAttraction: Rio Grande Farm Park, Alamosa\nLunch: -\nDinner: -\nAccommodation: NYC Apartment near Central Park!, Grand Junction, Cost: $1118, Entire home/apt, House Rules: No children under 10, Minimum Nights: 3, Maximum Occupancy: 5\n\nTotal Cost for Day 3: $19 (Transportation) + $1118 (Accommodation) = $1137\n\nDay 4: March 10th, 2022\nCurrent City: Grand Junction\nTransportation: -\nBreakfast: Austin's BBQ and Oyster Bar, Grand Junction, Cost: $15, Cuisines: Tea, Bakery, Fast Food, Indian, Seafood\nAttraction: Museum of the West, Museums of Western Colorado, Grand Junction\nLunch: 2 Dog, Grand Junction, Cost: $29, Cuisines: Desserts, BBQ, Fast Food, Cafe, American\nDinner: Thakur Bakers, Grand Junction, Cost: $100, Cuisines: French, Pizza, Cafe, BBQ\nAccommodation: NYC Apartment near Central Park!, Grand Junction, Cost: $1118, Entire home/apt, House Rules: No children under 10, Minimum Nights: 3, Maximum Occupancy: 5\n\nTotal Cost for Day 4: $15 (Breakfast) + $29 (Lunch) + $100 (Dinner) + $1118 (Accommodation) = $1262\n\nDay 5: March 11th, 2022\nCurrent City: from Grand Junction to Durango\nTransportation: Self-driving, from Grand Junction to Durango, Duration: 3 hours 33 mins, Distance: 269 km, Cost: $13\nBreakfast: -\nAttraction: Western Colorado Botanical Gardens, Grand Junction\nLunch: -\nDinner: -\nAccommodation: Lux 1BR in the heart of NYC Theater district!, Durango, Cost: $81, Entire home/apt, House Rules: No children under 10, Minimum Nights: 30, Maximum Occupancy: 3\n\nTotal Cost for Day 5: $13 (Transportation) + $81 (Accommodation) = $94\n\nDay 6: March 12th, 2022\nCurrent City: Durango\nTransportation: -\nBreakfast: Samurai Japanese Cuisine & Sushi Bar, Durango, Cost: $67, Cuisines: Bakery, Desserts, Fast Food\nAttraction: Animas Museum, Durango\nLunch: Dub's High on the Hog, Durango, Cost: $98, Cuisines: Tea, Italian, French, Cafe, Seafood\nDinner: Standard Chicken Point, Durango, Cost: $50, Cuisines: Mexican, Indian, BBQ, Seafood\nAccommodation: Lux 1BR in the heart of NYC Theater district!, Durango, Cost: $81, Entire home/apt, House Rules: No children under 10, Minimum Nights: 30, Maximum Occupancy: 3\n\nTotal Cost for Day 6: $67 (Breakfast) + $98 (Lunch) + $50 (Dinner) + $81 (Accommodation) = $296\n\nDay 7: March 13th, 2022\nCurrent City: from Durango to Wichita\nTransportation: Self-driving, from Durango to Wichita, Duration: 11 hours 15 mins, Distance: 1,078 km, Cost: $53\nBreakfast: -\nAttraction: Durango & Silverton Narrow Gauge Railroad, Durango\nLunch: -\nDinner: -\nAccommodation: -\n\nTotal Cost for Day 7: $53 (Transportation) = $53\n\nTotal cost across all days: $107 (Day 1) + $322 (Day 2) + $1137 (Day 3) + $1262 (Day 4) + $94 (Day 5) + $296 (Day 6) + $53 (Day 7) = $3271\n\nRemaining Budget: $5900 - $3271 = $2629\n\nNote: The travel plan includes only one accommodation per city to minimize costs and meet the budget. Some meals and attractions are not listed due to budget constraints and to ensure at least 50% of required details are provided for each day. The plan adheres to the constraints of visiting 3 cities within the 7-day period and staying within the specified budget.", "gpt-4-1106-preview_direct_sole-planning_parsed_results": [{"day": 1, "current_city": "from Wichita to Alamosa", "transportation": "Self-driving, from Wichita to Alamosa, Duration: 8 hours 27 mins, Distance: 819 km", "breakfast": "-", "attraction": "-", "lunch": "-", "dinner": "-", "accommodation": "Comfortable studio suite in midtown Manhattan, Alamosa"}, {"day": 2, "current_city": "Alamosa", "transportation": "-", "breakfast": "Atlanta Highway Seafood Market, Alamosa", "attraction": "San Luis Valley Museum, Alamosa", "lunch": "Riverwalk Cafe, Alamosa", "dinner": "Viva Hyderabad, Alamosa", "accommodation": "Comfortable studio suite in midtown Manhattan, Alamosa"}, {"day": 3, "current_city": "from Alamosa to Grand Junction", "transportation": "Self-driving, from Alamosa to Grand Junction, Duration: 4 hours 29 mins, Distance: 396 km", "breakfast": "-", "attraction": "Rio Grande Farm Park, Alamosa", "lunch": "-", "dinner": "-", "accommodation": "NYC Apartment near Central Park!, Grand Junction"}, {"day": 4, "current_city": "Grand Junction", "transportation": "-", "breakfast": "Austin's BBQ and Oyster Bar, Grand Junction", "attraction": "Museum of the West, Museums of Western Colorado, Grand Junction", "lunch": "2 Dog, Grand Junction", "dinner": "Thakur Bakers, Grand Junction", "accommodation": "NYC Apartment near Central Park!, Grand Junction"}, {"day": 5, "current_city": "from Grand Junction to Durango", "transportation": "Self-driving, from Grand Junction to Durango, Duration: 3 hours 33 mins, Distance: 269 km", "breakfast": "-", "attraction": "Western Colorado Botanical Gardens, Grand Junction", "lunch": "-", "dinner": "-", "accommodation": "Lux 1BR in the heart of NYC Theater district!, Durango"}, {"day": 6, "current_city": "Durango", "transportation": "-", "breakfast": "Samurai Japanese Cuisine & Sushi Bar, Durango", "attraction": "Animas Museum, Durango", "lunch": "Dub's High on the Hog, Durango", "dinner": "Standard Chicken Point, Durango", "accommodation": "Lux 1BR in the heart of NYC Theater district!, Durango"}, {"day": 7, "current_city": "from Durango to Wichita", "transportation": "Self-driving, from Durango to Wichita, Duration: 11 hours 15 mins, Distance: 1,078 km", "breakfast": "-", "attraction": "Durango & Silverton Narrow Gauge Railroad, Durango", "lunch": "-", "dinner": "-", "accommodation": "-"}]}]