[{"gpt-4-1106-preview_direct_sole-planning_results": "Travel Plan:\n\nDay 1: March 12, 2022\nCurrent City: from Salt Lake City to Burbank\nTransportation: Flight Number: F3846241, from Salt Lake City to Burbank, Departure Time: 08:08, Arrival Time: 09:03\nBreakfast: - (Assuming breakfast is had before the flight or will be on the flight)\nAttraction: Warner Bros. Studio Tour Hollywood, Burbank\nLunch: Mellow Mushroom, Burbank\nDinner: Dawat-e-Nawab - Radisson Blu, Burbank\nAccommodation: Pleasant 1 bedroom apartment in Harlem Brownstone, Burbank (Entire home/apt, accommodates up to 5 people, so 2 rooms will be booked to accommodate 7 people)\n\nDay 2: March 13, 2022\nCurrent City: Burbank\nTransportation: -\nBreakfast: Tandoor Restaurant, Burbank\nAttraction: Universal Studios Hollywood, Burbank\nLunch: Hard Rock Cafe, Burbank\nDinner: Zolocrust - Hotel Clarks Amer, Burbank\nAccommodation: Pleasant 1 bedroom apartment in Harlem Brownstone, Burbank (Continued stay, 2 rooms)\n\nDay 3: March 14, 2022\nCurrent City: from Burbank to Salt Lake City\nTransportation: Flight Number: F3848172, from Burbank to Salt Lake City, Departure Time: 07:17, Arrival Time: 10:05\nBreakfast: - (Assuming breakfast is had before the flight or will be on the flight)\nAttraction: - (No time for attractions due to early flight)\nLunch: - (Assuming lunch will be had upon arrival back in Salt Lake City)\nDinner: - (Assuming travelers are back home)\nAccommodation: -\n\nPlease note that the accommodation chosen is based on the requirement for entire rooms and the group size. Two units of the \"Pleasant 1 bedroom apartment in Harlem Brownstone\" have been booked to accommodate all 7 travelers, as each unit can accommodate up to 5 people. The flight options were chosen based on the earliest departure on March 12 and the earliest return on March 14 to maximize time spent in Burbank. The restaurants and attractions were selected to provide a diverse experience and are based on the provided reference information.", "gpt-4-1106-preview_direct_sole-planning_parsed_results": [{"day": 1, "current_city": "from Salt Lake City to Burbank", "transportation": "Flight Number: F3846241, from Salt Lake City to Burbank, Departure Time: 08:08, Arrival Time: 09:03", "breakfast": "-", "attraction": "Warner Bros. Studio Tour Hollywood, Burbank;", "lunch": "Mellow Mushroom, Burbank", "dinner": "Dawat-e-Nawab - Radisson Blu, Burbank", "accommodation": "Pleasant 1 bedroom apartment in Harlem Brownstone, Burbank"}, {"day": 2, "current_city": "Burbank", "transportation": "-", "breakfast": "Tandoor Restaurant, Burbank", "attraction": "Universal Studios Hollywood, Burbank;", "lunch": "Hard Rock Cafe, Burbank", "dinner": "Zolocrust - Hotel Clarks Amer, Burbank", "accommodation": "Pleasant 1 bedroom apartment in Harlem Brownstone, Burbank"}, {"day": 3, "current_city": "from Burbank to Salt Lake City", "transportation": "Flight Number: F3848172, from Burbank to Salt Lake City, Departure Time: 07:17, Arrival Time: 10:05", "breakfast": "-", "attraction": "-", "lunch": "-", "dinner": "-", "accommodation": "-"}]}]