[{"gpt-4-1106-preview_direct_sole-planning_results": "Travel Plan:\n\nDay 1: March 22, 2022\nCurrent City: from Provo to San Diego\nTransportation: Self-driving from Provo to San Diego, duration: 10 hours 13 mins, distance: 1,137 km, cost: $280 (5 people x $56)\nBreakfast: - (Assuming travelers will have breakfast before departure), Cost $0\nAttraction: Cabrillo National Monument, San Diego, Cost $0 (No cost provided, assuming free entry)\nLunch: Open Yard, San Diego, Average Cost $33, Cost $165 (5 people x $33)\nDinner: The Lost Mughal, San Diego, Average Cost $74, Cost $370 (5 people x $74)\nAccommodation: Spacious Room in Large 2 Bedroom Prewar Apartment, San Diego, price $585, minimum nights 1, Cost $585\n\nTotal cost for Day 1: $280 + $0 + $0 + $165 + $370 + $585 = $1400\n\nDay 2: March 23, 2022\nCurrent City: San Diego\nTransportation: -, Cost $0\nBreakfast: Jetha Lal Ka Dhabha, San Diego, Average Cost $22, Cost $110 (5 people x $22)\nAttraction: SeaWorld San Diego, San Diego, Cost $0 (No cost provided, assuming free entry)\nLunch: Burger King, San Diego, Average Cost $20, Cost $100 (5 people x $20)\nDinner: Momos Hut & Chinese Food, San Diego, Average Cost $94, Cost $470 (5 people x $94)\nAccommodation: Luxury 4BR Home, Spacious & Central to Trains, San Diego, price $392, minimum nights 3, Cost $392\n\nTotal cost for Day 2: $0 + $110 + $0 + $100 + $470 + $392 = $1072\n\nDay 3: March 24, 2022\nCurrent City: from San Diego to Santa Ana\nTransportation: Self-driving from San Diego to Santa Ana, duration: 1 hour 26 mins, distance: 144 km, cost: $35 (5 people x $7)\nBreakfast: Gopala, San Diego, Average Cost $98, Cost $490 (5 people x $98)\nAttraction: Bowers Museum, Santa Ana, Cost $0 (No cost provided, assuming free entry)\nLunch: The Bee's Knees, Santa Ana, Average Cost $12, Cost $60 (5 people x $12)\nDinner: Caf\u6106 Tu Tu Tango, Santa Ana, Average Cost $88, Cost $440 (5 people x $88)\nAccommodation: Sun-filled Artist Home 1BR in convenient L.I.C!, Santa Ana, price $1065, minimum nights 2, Cost $1065\n\nTotal cost for Day 3: $35 + $490 + $0 + $60 + $440 + $1065 = $2090\n\nDay 4: March 25, 2022\nCurrent City: Santa Ana\nTransportation: -, Cost $0\nBreakfast: Eram Rooftop, Santa Ana, Average Cost $77, Cost $385 (5 people x $77)\nAttraction: Santa Ana Zoo, Santa Ana, Cost $0 (No cost provided, assuming free entry)\nLunch: Shahi Chicken Corner, Santa Ana, Average Cost $55, Cost $275 (5 people x $55)\nDinner: Bottles and Barrels, Santa Ana, Average Cost $81, Cost $405 (5 people x $81)\nAccommodation: (Same as Day 3, already accounted for)\n\nTotal cost for Day 4: $0 + $385 + $0 + $275 + $405 = $1065\n\nDay 5: March 26, 2022\nCurrent City: from Santa Ana to Bakersfield\nTransportation: Self-driving from Santa Ana to Bakersfield, duration: 2 hours 31 mins, distance: 231 km, cost: $55 (5 people x $11)\nBreakfast: Flying Cakes, Santa Ana, Average Cost $57, Cost $285 (5 people x $57)\nAttraction: Kern County Museum, Bakersfield, Cost $0 (No cost provided, assuming free entry)\nLunch: Kihei Caffe, Bakersfield, Average Cost $47, Cost $235 (5 people x $47)\nDinner: Tybee Island Social Club, Bakersfield, Average Cost $83, Cost $415 (5 people x $83)\nAccommodation: Bright & spacious Room in Harlem, Bakersfield, price $815, minimum nights 1, Cost $815\n\nTotal cost for Day 5: $55 + $285 + $0 + $235 + $415 + $815 = $1805\n\nDay 6: March 27, 2022\nCurrent City: Bakersfield\nTransportation: -, Cost $0\nBreakfast: DePalma's Italian Cafe - East Side, Bakersfield, Average Cost $12, Cost $60 (5 people x $12)\nAttraction: California Living Museum, Bakersfield, Cost $0 (No cost provided, assuming free entry)\nLunch: Pita Pit, Bakersfield, Average Cost $23, Cost $115 (5 people x $23)\nDinner: Domino's Pizza, Bakersfield, Average Cost $19, Cost $95 (5 people x $19)\nAccommodation: (Same as Day 5, already accounted for)\n\nTotal cost for Day 6: $0 + $60 + $0 + $115 + $95 = $270\n\nDay 7: March 28, 2022\nCurrent City: from Bakersfield to Provo\nTransportation: Self-driving from Bakersfield to Provo, duration: 9 hours 34 mins, distance: 1,063 km, cost: $265 (5 people x $53)\nBreakfast: Frick's Tap, Bakersfield, Average Cost $19, Cost $95 (5 people x $19)\nAttraction: - (Assuming travelers will be driving back and not visiting attractions), Cost $0\nLunch: - (Assuming travelers will have lunch on the road), Cost $0\nDinner: - (Assuming travelers will have dinner upon arrival in Provo), Cost $0\nAccommodation: - (Assuming travelers will arrive home), Cost $0\n\nTotal cost for Day 7: $265 + $95 + $0 + $0 + $0 = $360\n\nThe total cost of this trip is the sum of the cost from day 1 to day 7. It is $1400 + $1072 + $2090 + $1065 + $1805 + $270 + $360 = $8062 which is less than the required budget of $14,900.\n\nPlease note that the costs for attractions are assumed to be free as no entry fees were provided. Additionally, the accommodation costs are based on the assumption that the accommodations allow parties, as no specific information on house rules regarding parties was provided in the reference data. If any of the accommodations do not allow parties, adjustments to the plan will be necessary.", "gpt-4-1106-preview_direct_sole-planning_parsed_results": [{"day": 1, "current_city": "from Provo to San Diego", "transportation": "Self-driving from Provo to San Diego, duration: 10 hours 13 mins, distance: 1,137 km", "breakfast": "-", "attraction": "Cabrillo National Monument, San Diego;", "lunch": "Open Yard, San Diego", "dinner": "The Lost Mughal, San Diego", "accommodation": "Spacious Room in Large 2 Bedroom Prewar Apartment, San Diego"}, {"day": 2, "current_city": "San Diego", "transportation": "-", "breakfast": "Jetha Lal Ka Dhabha, San Diego", "attraction": "SeaWorld San Diego, San Diego;", "lunch": "Burger King, San Diego", "dinner": "Momos Hut & Chinese Food, San Diego", "accommodation": "Luxury 4BR Home, Spacious & Central to Trains, San Diego"}, {"day": 3, "current_city": "from San Diego to Santa Ana", "transportation": "Self-driving from San Diego to Santa Ana, duration: 1 hour 26 mins, distance: 144 km", "breakfast": "Gopala, San Diego", "attraction": "Bowers Museum, Santa Ana;", "lunch": "The Bee's Knees, Santa Ana", "dinner": "Caf\u00e9 Tu Tu Tango, Santa Ana", "accommodation": "Sun-filled Artist Home 1BR in convenient L.I.C!, Santa Ana"}, {"day": 4, "current_city": "Santa Ana", "transportation": "-", "breakfast": "Eram Rooftop, Santa Ana", "attraction": "Santa Ana Zoo, Santa Ana;", "lunch": "Shahi Chicken Corner, Santa Ana", "dinner": "Bottles and Barrels, Santa Ana", "accommodation": "Sun-filled Artist Home 1BR in convenient L.I.C!, Santa Ana"}, {"day": 5, "current_city": "from Santa Ana to Bakersfield", "transportation": "Self-driving from Santa Ana to Bakersfield, duration: 2 hours 31 mins, distance: 231 km", "breakfast": "Flying Cakes, Santa Ana", "attraction": "Kern County Museum, Bakersfield;", "lunch": "Kihei Caffe, Bakersfield", "dinner": "Tybee Island Social Club, Bakersfield", "accommodation": "Bright & spacious Room in Harlem, Bakersfield"}, {"day": 6, "current_city": "Bakersfield", "transportation": "-", "breakfast": "DePalma's Italian Cafe - East Side, Bakersfield", "attraction": "California Living Museum, Bakersfield;", "lunch": "Pita Pit, Bakersfield", "dinner": "Domino's Pizza, Bakersfield", "accommodation": "Bright & spacious Room in Harlem, Bakersfield"}, {"day": 7, "current_city": "from Bakersfield to Provo", "transportation": "Self-driving from Bakersfield to Provo, duration: 9 hours 34 mins, distance: 1,063 km", "breakfast": "Frick's Tap, Bakersfield", "attraction": "-", "lunch": "-", "dinner": "-", "accommodation": "-"}]}]