[{"gpt-4-1106-preview_direct_sole-planning_results": "Travel Plan:\n\nDay 1: March 7, 2022\nCurrent City: from Reno to Abilene\nTransportation: Self-driving, from Reno to Abilene, duration: 22 hours 27 mins, distance: 2,412 km, cost: $120\nBreakfast: -\nAttraction: -\nLunch: -\nDinner: -\nAccommodation: Apartment minutes from manhattan, Abilene (Entire home/apt, No pets & No visitors, $295)\n\nDay 2: March 8, 2022\nCurrent City: Abilene\nTransportation: -\nBreakfast: Thai Garden, Abilene (Cafe, American, Desserts)\nAttraction: The Grace Museum, Abilene\nLunch: Crispy Crust, Abilene (Desserts, Bakery, Cafe, American, Seafood)\nDinner: Mediumwelldone, Abilene (Tea, French, BBQ, Cafe, Seafood)\nAccommodation: Apartment minutes from manhattan, Abilene\n\nDay 3: March 9, 2022\nCurrent City: from Abilene to Amarillo\nTransportation: Self-driving, from Abilene to Amarillo, duration: 4 hours 10 mins, distance: 446 km, cost: $22\nBreakfast: Subway, Abilene (Fast Food, Tea, Bakery, Italian)\nAttraction: Frontier Texas!, Abilene\nLunch: -\nDinner: -\nAccommodation: Gramercy Park restful, cozy, sun-filled home, Amarillo (Entire home/apt, No parties, $968)\n\nDay 4: March 10, 2022\nCurrent City: Amarillo\nTransportation: -\nBreakfast: The Cinnamon Kitchen, Amarillo (Desserts, Tea, Pizza, Chinese, Seafood)\nAttraction: Cadillac Ranch, Amarillo\nLunch: Komachi, Amarillo (Desserts, Tea, Fast Food, Chinese, Mediterranean)\nDinner: Sigree Global Grill, Amarillo (Chinese, BBQ, Cafe, Desserts)\nAccommodation: Gramercy Park restful, cozy, sun-filled home, Amarillo\n\nDay 5: March 11, 2022\nCurrent City: from Amarillo to Lubbock\nTransportation: Self-driving, from Amarillo to Lubbock, duration: 1 hour 47 mins, distance: 197 km, cost: $9\nBreakfast: Wood Box Cafe, Amarillo (Desserts, French, Fast Food, Cafe, American)\nAttraction: Amarillo Botanical Gardens, Amarillo\nLunch: -\nDinner: -\nAccommodation: Private bedroom in UWS Apartment, Lubbock (Private room, No visitors & No pets, $709)\n\nDay 6: March 12, 2022\nCurrent City: Lubbock\nTransportation: -\nBreakfast: Paris 6 Classique, Lubbock (Desserts, Cafe, Pizza, Mexican, BBQ, Chinese)\nAttraction: Buddy Holly Center, Lubbock\nLunch: Grand Barbeque Buffet Restaurant, Lubbock (Tea, French, Fast Food, Cafe, Seafood)\nDinner: Sultanat, Lubbock (Chinese, Bakery, BBQ, Cafe)\nAccommodation: Private bedroom in UWS Apartment, Lubbock\n\nDay 7: March 13, 2022\nCurrent City: from Lubbock to Reno\nTransportation: Self-driving, from Lubbock to Reno, duration: 20 hours 3 mins, distance: 2,145 km, cost: $107\nBreakfast: Assam Tea Corner, Lubbock (Desserts, BBQ, Fast Food, American, Seafood)\nAttraction: National Ranching Heritage Center, Lubbock\nLunch: -\nDinner: -\nAccommodation: -\n\nTotal Estimated Cost: $120 (Reno to Abilene) + $295 (Accommodation) + $22 (Abilene to Amarillo) + $968 (Accommodation) + $9 (Amarillo to Lubbock) + $709 (Accommodation) + $107 (Lubbock to Reno) = $2230\n\nPlease note that meal costs, attraction entry fees, and additional transportation within cities are not included in the total estimated cost. The budget allows for these additional expenses. The accommodations chosen adhere to the requirement of no visitors and are entire rooms or private rooms. The restaurants selected offer a variety of cuisines including Chinese, French, American, and Mediterranean.", "gpt-4-1106-preview_direct_sole-planning_parsed_results": [{"day": 1, "current_city": "from Reno to Abilene", "transportation": "Self-driving, from Reno to Abilene, duration: 22 hours 27 mins, distance: 2,412 km, Cost: 120", "breakfast": "-", "attraction": "-", "lunch": "-", "dinner": "-", "accommodation": "Apartment minutes from manhattan, Abilene"}, {"day": 2, "current_city": "Abilene", "transportation": "-", "breakfast": "Thai Garden, Abilene", "attraction": "The Grace Museum, Abilene", "lunch": "Crispy Crust, Abilene", "dinner": "Mediumwelldone, Abilene", "accommodation": "Apartment minutes from manhattan, Abilene"}, {"day": 3, "current_city": "from Abilene to Amarillo", "transportation": "Self-driving, from Abilene to Amarillo, duration: 4 hours 10 mins, distance: 446 km, Cost: 22", "breakfast": "Subway, Abilene", "attraction": "Frontier Texas!, Abilene", "lunch": "-", "dinner": "-", "accommodation": "Gramercy Park restful, cozy, sun-filled home, Amarillo"}, {"day": 4, "current_city": "Amarillo", "transportation": "-", "breakfast": "The Cinnamon Kitchen, Amarillo", "attraction": "Cadillac Ranch, Amarillo", "lunch": "Komachi, Amarillo", "dinner": "Sigree Global Grill, Amarillo", "accommodation": "Gramercy Park restful, cozy, sun-filled home, Amarillo"}, {"day": 5, "current_city": "from Amarillo to Lubbock", "transportation": "Self-driving, from Amarillo to Lubbock, duration: 1 hour 47 mins, distance: 197 km, Cost: 9", "breakfast": "Wood Box Cafe, Amarillo", "attraction": "Amarillo Botanical Gardens, Amarillo", "lunch": "-", "dinner": "-", "accommodation": "Private bedroom in UWS Apartment, Lubbock"}, {"day": 6, "current_city": "Lubbock", "transportation": "-", "breakfast": "Paris 6 Classique, Lubbock", "attraction": "Buddy Holly Center, Lubbock", "lunch": "Grand Barbeque Buffet Restaurant, Lubbock", "dinner": "Sultanat, Lubbock", "accommodation": "Private bedroom in UWS Apartment, Lubbock"}, {"day": 7, "current_city": "from Lubbock to Reno", "transportation": "Self-driving, from Lubbock to Reno, duration: 20 hours 3 mins, distance: 2,145 km, Cost: 107", "breakfast": "Assam Tea Corner, Lubbock", "attraction": "National Ranching Heritage Center, Lubbock", "lunch": "-", "dinner": "-", "accommodation": "-"}]}]