[{"gpt-4-1106-preview_direct_sole-planning_results": "Travel Plan:\n\nDay 1: March 5th, 2022\nCurrent City: from West Palm Beach to White Plains\nTransportation: Flight Number: F3756085, from West Palm Beach to White Plains, Departure Time: 05:58, Arrival Time: 08:48, Cost: $515 per person\nBreakfast: Not applicable (Assuming breakfast before the flight)\nAttraction: Saxon Woods Park, White Plains\nLunch: El Kiosco Mexican Restaurant, White Plains, Cost: $65, Cuisines: \"Tea, Pizza\"\nDinner: Kinoshita, White Plains, Cost: $42, Cuisines: \"Tea, Pizza, Fast Food, American, Seafood\"\nAccommodation: Large Opulent Studio Apartment Near Prospect Park, White Plains, Cost: $465, Maximum Occupancy: 3, House Rules: No children under 10, Minimum Nights: 4\n\nNumber of People = 2\nTotal Cost = 2 * $515 (Flight) + 2 * $65 (Lunch) + 2 * $42 (Dinner) + $465 (Accommodation) = $1709\nAccommodation Minimum Nights: 1/4\n\nDay 2: March 6th, 2022\nCurrent City: White Plains\nTransportation: Taxi within White Plains (Assuming an average cost of $50 for the day)\nBreakfast: Six Pack Kitchen, White Plains, Cost: $58, Cuisines: \"Chinese, Mexican, Desserts, Seafood\"\nAttraction: Neuberger Museum of Art, White Plains\nLunch: Aravalli Owls, White Plains, Cost: $26, Cuisines: \"Pizza, Mediterranean, BBQ\"\nDinner: El Cazador, White Plains, Cost: $90, Cuisines: \"Mexican, Pizza, BBQ\"\nAccommodation: Large Opulent Studio Apartment Near Prospect Park, White Plains, Cost: $465, Maximum Occupancy: 3, House Rules: No children under 10, Minimum Nights: 4\n\nNumber of People = 2\nTotal Cost = 2 * $50 (Taxi) + 2 * $58 (Breakfast) + 2 * $26 (Lunch) + 2 * $90 (Dinner) + $465 (Accommodation) = $912\nAccommodation Minimum Nights: 2/4\n\nDay 3: March 7th, 2022\nCurrent City: from White Plains to West Palm Beach\nTransportation: Flight Number: F3759006, from White Plains to West Palm Beach, Departure Time: 15:51, Arrival Time: 18:41, Cost: $321 per person\nBreakfast: Mughals Rasoi, White Plains, Cost: $92, Cuisines: \"Tea, Pizza, Fast Food, Cafe, Mediterranean\"\nAttraction: Kensico Dam Plaza, White Plains\nLunch: Sagar Ratna, White Plains, Cost: $60, Cuisines: \"Cafe, BBQ, Mediterranean, Seafood\"\nDinner: Not applicable (Assuming dinner after arrival at West Palm Beach)\nAccommodation: Not applicable (Returning home)\n\nNumber of People = 2\nTotal Cost = 2 * $321 (Flight) + 2 * $92 (Breakfast) + 2 * $60 (Lunch) = $946\nAccommodation Minimum Nights: Not applicable\n\nTotal cost across all days = $1709 (Day 1) + $912 (Day 2) + $946 (Day 3) = $3567\n\nUnfortunately, the total cost exceeds the specified budget of $2,600. To adjust the plan within the budget, we can consider the following changes:\n\n- Choose a less expensive flight option if available.\n- Opt for more budget-friendly restaurants.\n- Find a more affordable accommodation option.\n\nPlease note that the provided information does not include cheaper alternatives for flights, accommodations, or restaurants. To create a plan within the budget, we would need additional options to choose from.", "gpt-4-1106-preview_direct_sole-planning_parsed_results": [{"day": 1, "current_city": "from West Palm Beach to White Plains", "transportation": "Flight Number: F3756085, from West Palm Beach to White Plains, Departure Time: 05:58, Arrival Time: 08:48", "breakfast": "-", "attraction": "Saxon Woods Park, White Plains;", "lunch": "El Kiosco Mexican Restaurant, White Plains", "dinner": "Kinoshita, White Plains", "accommodation": "Large Opulent Studio Apartment Near Prospect Park, White Plains"}, {"day": 2, "current_city": "White Plains", "transportation": "-", "breakfast": "Six Pack Kitchen, White Plains", "attraction": "Neuberger Museum of Art, White Plains;", "lunch": "Aravalli Owls, White Plains", "dinner": "El Cazador, White Plains", "accommodation": "Large Opulent Studio Apartment Near Prospect Park, White Plains"}, {"day": 3, "current_city": "from White Plains to West Palm Beach", "transportation": "Flight Number: F3759006, from White Plains to West Palm Beach, Departure Time: 15:51, Arrival Time: 18:41", "breakfast": "Mughals Rasoi, White Plains", "attraction": "Kensico Dam Plaza, White Plains;", "lunch": "Sagar Ratna, White Plains", "dinner": "-", "accommodation": "-"}]}]