[{"gpt-4-1106-preview_direct_sole-planning_results": "Travel Plan:\n\nDay 1:\nCurrent City: from St. Louis to Washington\nTransportation: Flight Number: F3934368, from St. Louis to Washington, Departure Time: 12:42, Arrival Time: 15:38, Cost: $162\nBreakfast: - (Assuming the traveler will have breakfast before departure or on the flight)\nAttraction: The Seattle Great Wheel, Washington, Cost: $0 (Assuming free entry or covered by a city pass)\nLunch: Moradabadi Biryani, Washington, Cost: $12, Cuisines: \"Cafe, Mexican, Fast Food\"\nDinner: Hearken Caf\u00e9, Washington, Cost: $30, Cuisines: \"Cafe, Desserts, Italian\"\nAccommodation: Stunning 2Bed/2BA + 300sqft deck by the river!, Washington, Cost: $209, Maximum Occupancy: 3, House Rules: No visitors, Minimum Nights: 1\n\nNumber of People = 1\nTotal Cost = $162 (Flight) + $12 (Lunch) + $30 (Dinner) + $209 (Accommodation) = $413\nAccommodation Minimum Nights: 1/1\n\nDay 2:\nCurrent City: Washington\nTransportation: -\nBreakfast: Cafe Coffee Day, Washington, Cost: $53, Cuisines: \"Tea, Mexican, Fast Food, Cafe, American, Seafood\"\nAttraction: Space Needle, Washington, Cost: $0 (Assuming free entry or covered by a city pass)\nLunch: Los Aztecas, Washington, Cost: $46, Cuisines: \"Cafe, Bakery, BBQ, Fast Food\"\nDinner: Manna Java World Cafe, Washington, Cost: $59, Cuisines: \"Cafe, Seafood\"\nAccommodation: Stunning 2Bed/2BA + 300sqft deck by the river!, Washington, Cost: $209, Maximum Occupancy: 3, House Rules: No visitors, Minimum Nights: 1\n\nNumber of People = 1\nTotal Cost = $53 (Breakfast) + $46 (Lunch) + $59 (Dinner) + $209 (Accommodation) = $367\nAccommodation Minimum Nights: 1/1\n\nDay 3:\nCurrent City: from Washington to St. Louis\nTransportation: Flight Number: F3788616, from Washington to St. Louis, Departure Time: 16:09, Arrival Time: 17:42, Cost: $146\nBreakfast: Chidya Ghar - Roseate House, Washington, Cost: $70, Cuisines: \"Tea, Bakery, BBQ, Seafood\"\nAttraction: Discovery Park, Washington, Cost: $0 (Assuming free entry or covered by a city pass)\nLunch: Bikaner Sweet House, Washington, Cost: $61, Cuisines: \"BBQ, Desserts\"\nDinner: - (Assuming the traveler will have dinner after arrival in St. Louis or on the flight)\nAccommodation: -\n\nNumber of People = 1\nTotal Cost = $146 (Flight) + $70 (Breakfast) + $61 (Lunch) = $277\n\nTotal cost across all days = $413 (Day 1) + $367 (Day 2) + $277 (Day 3) = $1057\n\nCuisines: The prompt specifies no preferred cuisines, so all cuisines constraints are satisfied.\n\nNote: The attractions listed have no prices associated with them in the provided data, so I have assumed they are free or covered by a city pass. If there are entry fees, they would need to be factored into the budget. Additionally, the accommodation chosen has a minimum stay of 1 night, which aligns with the stay on each day. The house rules are also adhered to, as there is no mention of visitors. The budget is maintained within the $1,500 limit.", "gpt-4-1106-preview_direct_sole-planning_parsed_results": [{"day": 1, "current_city": "from St. Louis to Washington", "transportation": "Flight Number: F3934368, from St. Louis to Washington, Departure Time: 12:42, Arrival Time: 15:38", "breakfast": "-", "attraction": "The Seattle Great Wheel, Washington;", "lunch": "Moradabadi Biryani, Washington", "dinner": "Hearken Caf\u00e9, Washington", "accommodation": "Stunning 2Bed/2BA + 300sqft deck by the river!, Washington"}, {"day": 2, "current_city": "Washington", "transportation": "-", "breakfast": "Cafe Coffee Day, Washington", "attraction": "Space Needle, Washington;", "lunch": "Los Aztecas, Washington", "dinner": "Manna Java World Cafe, Washington", "accommodation": "Stunning 2Bed/2BA + 300sqft deck by the river!, Washington"}, {"day": 3, "current_city": "from Washington to St. Louis", "transportation": "Flight Number: F3788616, from Washington to St. Louis, Departure Time: 16:09, Arrival Time: 17:42", "breakfast": "Chidya Ghar - Roseate House, Washington", "attraction": "Discovery Park, Washington;", "lunch": "Bikaner Sweet House, Washington", "dinner": "-", "accommodation": "-"}]}]