[{"gpt-4-1106-preview_direct_sole-planning_results": "Travel Plan:\n\nDay 1: March 4th, 2022\nCurrent City: from Denver to Appleton\nTransportation: Flight Number: F3822209, from Denver to Appleton, Departure Time: 17:30, Arrival Time: 20:44, Cost: $286\nAccommodation: Cozy room + bright apartment + rooftop lounge, Appleton, Cost: $666, Room Type: Private room, House Rules: No smoking, Minimum Nights: 1, Maximum Occupancy: 1\n\nNumber of People = 1\nTotal Cost = $286 (Flight) + $666 (Accommodation) = $952\nAccommodation Minimum Nights: 1/1\n\nDay 2: March 5th, 2022\nCurrent City: Appleton\nBreakfast: Mikata Japanese Steakhouse, Appleton, Cost: $72, Cuisines: \"Cafe, Pizza, Bakery, Italian\"\nAttraction: The History Museum at the Castle, Appleton\nLunch: Swati Snacks, Appleton, Cost: $84, Cuisines: \"Desserts, Bakery, BBQ, Fast Food, American\"\nDinner: Brick 29, Appleton, Cost: $97, Cuisines: \"Desserts, Tea, BBQ, Cafe, American, Mediterranean\"\nAccommodation: Cozy room + bright apartment + rooftop lounge, Appleton, Cost: $666, Room Type: Private room, House Rules: No smoking, Minimum Nights: 1, Maximum Occupancy: 1\n\nNumber of People = 1\nTotal Cost = $72 (Breakfast) + $84 (Lunch) + $97 (Dinner) + $666 (Accommodation) = $919\nAccommodation Minimum Nights: 1/1\n\nDay 3: March 6th, 2022\nCurrent City: from Appleton to Denver\nTransportation: Flight Number: F3828308, from Appleton to Denver, Departure Time: 08:23, Arrival Time: 10:37, Cost: $295\nAccommodation: -\n\nNumber of People = 1\nTotal Cost = $295 (Flight) = $295\n\nTotal cost across all days = $952 (Day 1) + $919 (Day 2) + $295 (Day 3) = $2166\n\nUnfortunately, the total cost exceeds the specified budget of $1,800. To adjust the plan within the budget, we can consider changing the accommodation to a more affordable option:\n\nRevised Accommodation for Day 1 and Day 2:\nAccommodation: Stylish, convenient, renovated- 2 min to subway -, Appleton, Cost: $64, Room Type: Entire home/apt, House Rules: No smoking & No pets & No children under 10, Minimum Nights: 1, Maximum Occupancy: 2\n\nRevised Total Cost for Day 1 and Day 2 Accommodation: $64 * 2 nights = $128\n\nRevised Total cost across all days = $286 (Flight to Appleton) + $128 (Accommodation for 2 nights) + $72 (Breakfast) + $84 (Lunch) + $97 (Dinner) + $295 (Flight to Denver) = $962\n\nThe revised total cost of $962 is now within the budget of $1,800.", "gpt-4-1106-preview_direct_sole-planning_parsed_results": [{"day": 1, "current_city": "from Denver to Appleton", "transportation": "Flight Number: F3822209, from Denver to Appleton, Departure Time: 17:30, Arrival Time: 20:44", "breakfast": "-", "attraction": "-", "lunch": "-", "dinner": "-", "accommodation": "Cozy room + bright apartment + rooftop lounge, Appleton"}, {"day": 2, "current_city": "Appleton", "transportation": "-", "breakfast": "Mikata Japanese Steakhouse, Appleton", "attraction": "The History Museum at the Castle, Appleton", "lunch": "Swati Snacks, Appleton", "dinner": "Brick 29, Appleton", "accommodation": "Cozy room + bright apartment + rooftop lounge, Appleton"}, {"day": 3, "current_city": "from Appleton to Denver", "transportation": "Flight Number: F3828308, from Appleton to Denver, Departure Time: 08:23, Arrival Time: 10:37", "breakfast": "-", "attraction": "-", "lunch": "-", "dinner": "-", "accommodation": "-"}]}]