[{"gpt-4-1106-preview_direct_sole-planning_results": "Travel Plan:\n\nDay 1:\nCurrent City: from Chicago to Albuquerque\nTransportation: Flight Number: F4005732, from Chicago to Albuquerque, Departure Time: 08:23, Arrival Time: 10:14\nBreakfast: - (Assuming breakfast is had before the flight or on board)\nAttraction: New Mexico Museum of Natural History and Science, Albuquerque\nLunch: Cantina Famiglia Mancini, Albuquerque\nDinner: Thatcher's Barbeque and Grill, Albuquerque\nAccommodation: Harlem apartment, Albuquerque\n\nDay 2:\nCurrent City: Albuquerque\nTransportation: -\nBreakfast: Punjab Grill, Albuquerque\nAttraction: Albuquerque Museum, Albuquerque; Explora Science Center and Children's Museum of Albuquerque, Albuquerque\nLunch: Genghis Grill, Albuquerque\nDinner: Barbeque Nation, Albuquerque\nAccommodation: Harlem apartment, Albuquerque\n\nDay 3:\nCurrent City: from Albuquerque to Chicago\nTransportation: Flight Number: F3603308, from Albuquerque to Chicago, Departure Time: 05:41, Arrival Time: 09:35\nBreakfast: - (Assuming breakfast is had before the flight or on board)\nAttraction: - (No time for attractions due to early flight)\nLunch: - (Assuming lunch is had after arrival in Chicago or on the way)\nDinner: - (Travelers are back in Chicago and the travel plan concludes)\nAccommodation: -\n\nPlease note that the accommodation chosen is \"Harlem apartment\" which is a private room as requested, and the minimum nights stay is 1 night, fitting the requirement. The flight options were chosen based on the lowest cost while fitting within the travel dates and budget constraints. Meals and attractions were selected based on diversity and the assumption that travelers would want to experience a range of offerings in Albuquerque. The budget has been respected, with the total estimated cost for flights, accommodation, and meals staying within the $1,600 limit.", "gpt-4-1106-preview_direct_sole-planning_parsed_results": [{"days": 1, "current_city": "from Chicago to Albuquerque", "transportation": "Flight Number: F4005732, from Chicago to Albuquerque, Departure Time: 08:23, Arrival Time: 10:14", "breakfast": "-", "attraction": "New Mexico Museum of Natural History and Science, Albuquerque;", "lunch": "Cantina Famiglia Mancini, Albuquerque", "dinner": "Thatcher's Barbeque and Grill, Albuquerque", "accommodation": "Harlem apartment, Albuquerque"}, {"days": 2, "current_city": "Albuquerque", "transportation": "-", "breakfast": "Punjab Grill, Albuquerque", "attraction": "Albuquerque Museum, Albuquerque;Explora Science Center and Children's Museum of Albuquerque, Albuquerque;", "lunch": "Genghis Grill, Albuquerque", "dinner": "Barbeque Nation, Albuquerque", "accommodation": "Harlem apartment, Albuquerque"}, {"days": 3, "current_city": "from Albuquerque to Chicago", "transportation": "Flight Number: F3603308, from Albuquerque to Chicago, Departure Time: 05:41, Arrival Time: 09:35", "breakfast": "-", "attraction": "-", "lunch": "-", "dinner": "-", "accommodation": "-"}]}]