[{"gpt-4-1106-preview_direct_sole-planning_results": "Travel Plan:\n\nDay 1: March 17, 2022\nCurrent City: Baton Rouge to Texarkana\nTransportation: Taxi, from Baton Rouge to Texarkana, duration: 4 hours 46 mins, distance: 519 km, cost: $519\nBreakfast: Not applicable (Assuming departure after breakfast)\nAttraction: Museum of Regional History, Texarkana\nLunch: Big City Bread Cafe, Texarkana, Cost: $61, Cuisines: \"Cafe, Pizza, Bakery, BBQ\"\nDinner: Columbia Restaurant, Texarkana, Cost: $91, Cuisines: \"Desserts, Tea, Pizza, Indian, Seafood\"\nAccommodation: Large 2.5 BR Apt In Park Slope, Texarkana, Cost: $269, Entire home/apt, House Rules: No smoking & No visitors, Minimum Nights: 1, Maximum Occupancy: 3\n\nNumber of People = 6\nTotal Cost = 6 * 519 + 6 * 61 + 6 * 91 + 2 * 269 = $4230\nAccommodation Minimum Nights: 1/1\n\nDay 2: March 18, 2022\nCurrent City: Texarkana\nTransportation: -\nBreakfast: Poets Cafe, Texarkana, Cost: $88, Cuisines: \"Chinese, Bakery, Indian, Desserts\"\nAttraction: Spring Lake Park, Texarkana\nLunch: Club Mojo, Texarkana, Cost: $49, Cuisines: \"Desserts, Italian, BBQ, Cafe, American\"\nDinner: The Beer Cafe - BIGGIE, Texarkana, Cost: $13, Cuisines: \"Cafe, Pizza, Mediterranean, Fast Food\"\nAccommodation: Large 2.5 BR Apt In Park Slope, Texarkana, Cost: $269, Entire home/apt, House Rules: No smoking & No visitors, Minimum Nights: 1, Maximum Occupancy: 3\n\nNumber of People = 6\nTotal Cost = 6 * 88 + 6 * 49 + 6 * 13 + 2 * 269 = $1476\nAccommodation Minimum Nights: 1/1\n\nDay 3: March 19, 2022\nCurrent City: Texarkana to Abilene\nTransportation: Taxi, from Texarkana to Abilene, duration: 5 hours 20 mins, distance: 579 km, cost: $579\nBreakfast: Not applicable (Assuming departure after breakfast)\nAttraction: The Grace Museum, Abilene\nLunch: Thai Garden, Abilene, Cost: $13, Cuisines: \"Cafe, American, Desserts\"\nDinner: LPK Waterfront, Abilene, Cost: $61, Cuisines: \"Pizza, Italian, BBQ, Fast Food, Seafood\"\nAccommodation: Apartment minutes from manhattan, Abilene, Cost: $295, Entire home/apt, House Rules: No pets & No visitors, Minimum Nights: 2, Maximum Occupancy: 2\n\nNumber of People = 6\nTotal Cost = 6 * 579 + 6 * 13 + 6 * 61 + 3 * 295 = $5016\nAccommodation Minimum Nights: 1/2\n\nDay 4: March 20, 2022\nCurrent City: Abilene\nTransportation: -\nBreakfast: Crispy Crust, Abilene, Cost: $54, Cuisines: \"Desserts, Bakery, Cafe, American, Seafood\"\nAttraction: Frontier Texas!, Abilene\nLunch: Cakes Degree, Abilene, Cost: $18, Cuisines: \"Cafe, Mexican, BBQ, Desserts\"\nDinner: Mediumwelldone, Abilene, Cost: $91, Cuisines: \"Tea, French, BBQ, Cafe, Seafood\"\nAccommodation: Apartment minutes from manhattan, Abilene, Cost: $295, Entire home/apt, House Rules: No pets & No visitors, Minimum Nights: 2, Maximum Occupancy: 2\n\nNumber of People = 6\nTotal Cost = 6 * 54 + 6 * 18 + 6 * 91 + 3 * 295 = $2070\nAccommodation Minimum Nights: 2/2\n\nDay 5: March 21, 2022\nCurrent City: Abilene to Amarillo\nTransportation: Taxi, from Abilene to Amarillo, duration: 4 hours 10 mins, distance: 446 km, cost: $446\nBreakfast: Not applicable (Assuming departure after breakfast)\nAttraction: Cadillac Ranch, Amarillo\nLunch: The Cinnamon Kitchen, Amarillo, Cost: $69, Cuisines: \"Desserts, Tea, Pizza, Chinese, Seafood\"\nDinner: Sigree Global Grill, Amarillo, Cost: $35, Cuisines: \"Chinese, BBQ, Cafe, Desserts\"\nAccommodation: Gramercy Park restful, cozy, sun-filled home, Amarillo, Cost: $968, Entire home/apt, House Rules: No parties, Minimum Nights: 2, Maximum Occupancy: 8\n\nNumber of People = 6\nTotal Cost = 6 * 446 + 6 * 69 + 6 * 35 + 968 = $5122\nAccommodation Minimum Nights: 1/2\n\nDay 6: March 22, 2022\nCurrent City: Amarillo\nTransportation: -\nBreakfast: Komachi, Amarillo, Cost: $71, Cuisines: \"Desserts, Tea, Fast Food, Chinese, Mediterranean\"\nAttraction: Amarillo Botanical Gardens, Amarillo\nLunch: Anand Restaurant, Amarillo, Cost: $53, Cuisines: \"Fast Food, Seafood, Desserts, Italian\"\nDinner: Punjabi Chaap Corner, Amarillo, Cost: $62, Cuisines: \"Desserts, Pizza, Italian, Bakery, Fast Food\"\nAccommodation: Gramercy Park restful, cozy, sun-filled home, Amarillo, Cost: $968, Entire home/apt, House Rules: No parties, Minimum Nights: 2, Maximum Occupancy: 8\n\nNumber of People = 6\nTotal Cost = 6 * 71 + 6 * 53 + 6 * 62 + 968 = $2568\nAccommodation Minimum Nights: 2/2\n\nDay 7: March 23, 2022\nCurrent City: Amarillo to Baton Rouge\nTransportation: Taxi, from Amarillo to Baton Rouge, duration: 11 hours 42 mins, distance: 1,270 km, cost: $1270\nBreakfast: Wood Box Cafe, Amarillo, Cost: $11, Cuisines: \"Desserts, French, Fast Food, Cafe, American\"\nAttraction: Not applicable (Assuming travel for most of the day)\nLunch: Not applicable (Assuming travel during lunchtime)\nDinner: Not applicable (Assuming arrival after dinner)\nAccommodation: -\n\nNumber of People = 6\nTotal Cost = 6 * 1270 + 6 * 11 = $7716\n\nTotal cost across all days = $4230 + $1476 + $5016 + $2070 + $5122 + $2568 + $7716 = $28198\n\nUnfortunately, the total cost of $28,198 exceeds the specified budget of $14,600. To adhere to the budget, we would need to reconsider the transportation method, possibly opting for self-driving, or adjust the accommodation and dining options to more budget-friendly choices. Additionally, we may need to reduce the number of attractions or meals out to stay within the budget constraints.", "gpt-4-1106-preview_direct_sole-planning_parsed_results": [{"day": 1, "current_city": "from Baton Rouge to Texarkana", "transportation": "Taxi, from Baton Rouge to Texarkana, duration: 4 hours 46 mins, distance: 519 km", "breakfast": "-", "attraction": "Museum of Regional History, Texarkana;", "lunch": "Big City Bread Cafe, Texarkana", "dinner": "Columbia Restaurant, Texarkana", "accommodation": "Large 2.5 BR Apt In Park Slope, Texarkana"}, {"day": 2, "current_city": "Texarkana", "transportation": "-", "breakfast": "Poets Cafe, Texarkana", "attraction": "Spring Lake Park, Texarkana;", "lunch": "Club Mojo, Texarkana", "dinner": "The Beer Cafe - BIGGIE, Texarkana", "accommodation": "Large 2.5 BR Apt In Park Slope, Texarkana"}, {"day": 3, "current_city": "from Texarkana to Abilene", "transportation": "Taxi, from Texarkana to Abilene, duration: 5 hours 20 mins, distance: 579 km", "breakfast": "-", "attraction": "The Grace Museum, Abilene;", "lunch": "Thai Garden, Abilene", "dinner": "LPK Waterfront, Abilene", "accommodation": "Apartment minutes from manhattan, Abilene"}, {"day": 4, "current_city": "Abilene", "transportation": "-", "breakfast": "Crispy Crust, Abilene", "attraction": "Frontier Texas!, Abilene;", "lunch": "Cakes Degree, Abilene", "dinner": "Mediumwelldone, Abilene", "accommodation": "Apartment minutes from manhattan, Abilene"}, {"day": 5, "current_city": "from Abilene to Amarillo", "transportation": "Taxi, from Abilene to Amarillo, duration: 4 hours 10 mins, distance: 446 km", "breakfast": "-", "attraction": "Cadillac Ranch, Amarillo;", "lunch": "The Cinnamon Kitchen, Amarillo", "dinner": "Sigree Global Grill, Amarillo", "accommodation": "Gramercy Park restful, cozy, sun-filled home, Amarillo"}, {"day": 6, "current_city": "Amarillo", "transportation": "-", "breakfast": "Komachi, Amarillo", "attraction": "Amarillo Botanical Gardens, Amarillo;", "lunch": "Anand Restaurant, Amarillo", "dinner": "Punjabi Chaap Corner, Amarillo", "accommodation": "Gramercy Park restful, cozy, sun-filled home, Amarillo"}, {"day": 7, "current_city": "from Amarillo to Baton Rouge", "transportation": "Taxi, from Amarillo to Baton Rouge, duration: 11 hours 42 mins, distance: 1,270 km", "breakfast": "Wood Box Cafe, Amarillo", "attraction": "-", "lunch": "-", "dinner": "-", "accommodation": "-"}]}]