[{"gpt-4-1106-preview_direct_sole-planning_results": "Travel Plan:\n\nDay 1: March 22, 2022\nCurrent City: Jacksonville to Martha's Vineyard\nTransportation: Self-driving from Jacksonville to Martha's Vineyard, Duration: 18 hours 51 mins, Distance: 1,927 km, Cost: $96\nAccommodation: Doorman Gym 2 Beds Luxury Building!, Martha's Vineyard, Cost: $1041, Room Type: Private room, House Rules: No parties & No visitors, Minimum Nights: 1, Maximum Occupancy: 2\n\nDay 2: March 23, 2022\nCurrent City: Martha's Vineyard\nBreakfast: Yellow Dog Eats, Martha's Vineyard, Cost: $34, Cuisines: Cafe, Indian, Desserts, Seafood\nAttraction: Martha's Vineyard Museum, Martha's Vineyard\nLunch: Bern's Steak House, Martha's Vineyard, Cost: $35, Cuisines: Desserts, Mexican, Bakery, BBQ, Indian, Seafood\nDinner: Friends Forever, Martha's Vineyard, Cost: $55, Cuisines: Fast Food, BBQ, Seafood\nAccommodation: Doorman Gym 2 Beds Luxury Building!, Martha's Vineyard, Cost: $1041, Room Type: Private room, House Rules: No parties & No visitors, Minimum Nights: 1, Maximum Occupancy: 2\n\nDay 3: March 24, 2022\nCurrent City: Martha's Vineyard to Hyannis\nTransportation: Self-driving from Martha's Vineyard to Hyannis, Duration: 2 hours 7 mins, Distance: 49.5 km, Cost: $2\nAccommodation: Architect's Bedroom in Large Brooklyn Apartment, Hyannis, Cost: $112, Room Type: Private room, House Rules: No pets, Minimum Nights: 1, Maximum Occupancy: 1\n\nDay 4: March 25, 2022\nCurrent City: Hyannis\nBreakfast: Bridge Road Brewers, Hyannis, Cost: $33, Cuisines: Pizza, BBQ, Italian\nAttraction: John F. Kennedy Hyannis Museum, Hyannis\nLunch: Soho Hibachi, Hyannis, Cost: $12, Cuisines: Tea, Seafood, Pizza, Fast Food\nDinner: The Cheesecake Factory, Hyannis, Cost: $96, Cuisines: Desserts, Tea, Pizza, Mexican, Seafood\nAccommodation: Architect's Bedroom in Large Brooklyn Apartment, Hyannis, Cost: $112, Room Type: Private room, House Rules: No pets, Minimum Nights: 1, Maximum Occupancy: 1\n\nDay 5: March 26, 2022\nCurrent City: Hyannis to Nantucket\nTransportation: Self-driving from Hyannis to Nantucket, Duration: 2 hours 17 mins, Distance: 47.0 km, Cost: $2\nAccommodation: Bohemian Studio Loft in Brooklyn, Nantucket, Cost: $817, Room Type: Entire home/apt, House Rules: No visitors, Minimum Nights: 1, Maximum Occupancy: 2\n\nDay 6: March 27, 2022\nCurrent City: Nantucket\nBreakfast: Rhinehart's Oyster Bar, Nantucket, Cost: $44, Cuisines: Tea, Pizza, Mediterranean, Seafood\nAttraction: Whaling Museum, Nantucket\nLunch: Sakura, Nantucket, Cost: $87, Cuisines: Cafe, Indian, Desserts, Italian\nDinner: Chokho Jeeman Marwari Jain Bhojanalya, Nantucket, Cost: $15, Cuisines: Pizza, BBQ, Desserts, Fast Food\nAccommodation: Bohemian Studio Loft in Brooklyn, Nantucket, Cost: $817, Room Type: Entire home/apt, House Rules: No visitors, Minimum Nights: 1, Maximum Occupancy: 2\n\nDay 7: March 28, 2022\nCurrent City: Nantucket to Jacksonville\nTransportation: Self-driving from Nantucket to Jacksonville, Duration: 20 hours 9 mins, Distance: 1,967 km, Cost: $98\n\nTotal Cost Calculation:\nTransportation: $96 (Day 1) + $2 (Day 3) + $2 (Day 5) + $98 (Day 7) = $198\nAccommodation: $1041 (Day 1) + $1041 (Day 2) + $112 (Day 3) + $112 (Day 4) + $817 (Day 5) + $817 (Day 6) = $3940\nMeals: $34 (Day 2 Breakfast) + $35 (Day 2 Lunch) + $55 (Day 2 Dinner) + $33 (Day 4 Breakfast) + $12 (Day 4 Lunch) + $96 (Day 4 Dinner) + $44 (Day 6 Breakfast) + $87 (Day 6 Lunch) + $15 (Day 6 Dinner) = $411\nAttractions: Assuming free entry to museums and attractions.\n\nTotal Cost: $198 (Transportation) + $3940 (Accommodation) + $411 (Meals) = $4549\n\nRemaining Budget: $6600 - $4549 = $2051\n\nNote: The travel plan includes self-driving as the mode of transportation between cities, as there are no available flights on the specified dates. The accommodation choices are based on the provided data and are selected to avoid shared rooms and adhere to house rules. The restaurants and attractions are chosen from the provided lists, ensuring no repetition and adherence to the city itinerary. The costs are calculated for a solo traveler and are within the specified budget.", "gpt-4-1106-preview_direct_sole-planning_parsed_results": [{"day": 1, "current_city": "from Jacksonville to Martha's Vineyard", "transportation": "Self-driving from Jacksonville to Martha's Vineyard, Duration: 18 hours 51 mins, Distance: 1,927 km", "breakfast": "-", "attraction": "-", "lunch": "-", "dinner": "-", "accommodation": "Doorman Gym 2 Beds Luxury Building!, Martha's Vineyard"}, {"day": 2, "current_city": "Martha's Vineyard", "transportation": "-", "breakfast": "Yellow Dog Eats, Martha's Vineyard", "attraction": "Martha's Vineyard Museum, Martha's Vineyard", "lunch": "Bern's Steak House, Martha's Vineyard", "dinner": "Friends Forever, Martha's Vineyard", "accommodation": "Doorman Gym 2 Beds Luxury Building!, Martha's Vineyard"}, {"day": 3, "current_city": "from Martha's Vineyard to Hyannis", "transportation": "Self-driving from Martha's Vineyard to Hyannis, Duration: 2 hours 7 mins, Distance: 49.5 km", "breakfast": "-", "attraction": "-", "lunch": "-", "dinner": "-", "accommodation": "Architect's Bedroom in Large Brooklyn Apartment, Hyannis"}, {"day": 4, "current_city": "Hyannis", "transportation": "-", "breakfast": "Bridge Road Brewers, Hyannis", "attraction": "John F. Kennedy Hyannis Museum, Hyannis", "lunch": "Soho Hibachi, Hyannis", "dinner": "The Cheesecake Factory, Hyannis", "accommodation": "Architect's Bedroom in Large Brooklyn Apartment, Hyannis"}, {"day": 5, "current_city": "from Hyannis to Nantucket", "transportation": "Self-driving from Hyannis to Nantucket, Duration: 2 hours 17 mins, Distance: 47.0 km", "breakfast": "-", "attraction": "-", "lunch": "-", "dinner": "-", "accommodation": "Bohemian Studio Loft in Brooklyn, Nantucket"}, {"day": 6, "current_city": "Nantucket", "transportation": "-", "breakfast": "Rhinehart's Oyster Bar, Nantucket", "attraction": "Whaling Museum, Nantucket", "lunch": "Sakura, Nantucket", "dinner": "Chokho Jeeman Marwari Jain Bhojanalya, Nantucket", "accommodation": "Bohemian Studio Loft in Brooklyn, Nantucket"}, {"day": 7, "current_city": "from Nantucket to Jacksonville", "transportation": "Self-driving from Nantucket to Jacksonville, Duration: 20 hours 9 mins, Distance: 1,967 km", "breakfast": "-", "attraction": "-", "lunch": "-", "dinner": "-", "accommodation": "-"}]}]