[{"gpt-4-1106-preview_direct_sole-planning_results": "Travel Plan:\n\nDay 1: March 16, 2022\nCurrent City: from Baton Rouge to Abilene\nTransportation: Self-driving, from Baton Rouge to Abilene, Duration: 8 hours 50 mins, Distance: 976 km, Cost: $48\nBreakfast: - (Assuming breakfast is had before departure)\nAttraction: The Grace Museum, Abilene\nLunch: Thai Garden, Abilene, Cost: $13, Cuisines: \"Cafe, American, Desserts\"\nDinner: Crispy Crust, Abilene, Cost: $54, Cuisines: \"Desserts, Bakery, Cafe, American, Seafood\"\nAccommodation: Apartment minutes from manhattan, Abilene, Cost: $295, Entire home/apt, House Rules: No pets & No visitors, Minimum Nights: 2, Pet-friendly: No\n\nNumber of People = 2\nTotal Cost = 2 * $48 (Transportation) + 2 * $13 (Lunch) + 2 * $54 (Dinner) + $295 (Accommodation) = $525\n\nDay 2: March 17, 2022\nCurrent City: Abilene\nTransportation: -\nBreakfast: Cakes Degree, Abilene, Cost: $18, Cuisines: \"Cafe, Mexican, BBQ, Desserts\"\nAttraction: Frontier Texas!, Abilene\nLunch: Finger Licious, Abilene, Cost: $35, Cuisines: \"Fast Food, Cafe, BBQ, Seafood\"\nDinner: LPK Waterfront, Abilene, Cost: $61, Cuisines: \"Pizza, Italian, BBQ, Fast Food, Seafood\"\nAccommodation: Apartment minutes from manhattan, Abilene, Cost: $295, Entire home/apt, House Rules: No pets & No visitors, Minimum Nights: 2, Pet-friendly: No\n\nNumber of People = 2\nTotal Cost = 2 * $18 (Breakfast) + 2 * $35 (Lunch) + 2 * $61 (Dinner) + $295 (Accommodation) = $523\n\nDay 3: March 18, 2022\nCurrent City: from Abilene to Amarillo\nTransportation: Self-driving, from Abilene to Amarillo, Duration: 4 hours 10 mins, Distance: 446 km, Cost: $22\nBreakfast: -\nAttraction: Cadillac Ranch, Amarillo\nLunch: The Cinnamon Kitchen, Amarillo, Cost: $69, Cuisines: \"Desserts, Tea, Pizza, Chinese, Seafood\"\nDinner: Komachi, Amarillo, Cost: $71, Cuisines: \"Desserts, Tea, Fast Food, Chinese, Mediterranean\"\nAccommodation: Harlem Humble Abode - 1 bedroom - Cute and Quaint, Amarillo, Cost: $409, Entire home/apt, House Rules: No pets, Minimum Nights: 5, Pet-friendly: No\n\nNumber of People = 2\nTotal Cost = 2 * $22 (Transportation) + 2 * $69 (Lunch) + 2 * $71 (Dinner) + $409 (Accommodation) = $733\n\nDay 4: March 19, 2022\nCurrent City: Amarillo\nTransportation: -\nBreakfast: Wood Box Cafe, Amarillo, Cost: $11, Cuisines: \"Desserts, French, Fast Food, Cafe, American\"\nAttraction: Amarillo Botanical Gardens, Amarillo\nLunch: Sigree Global Grill, Amarillo, Cost: $35, Cuisines: \"Chinese, BBQ, Cafe, Desserts\"\nDinner: Anand Restaurant, Amarillo, Cost: $53, Cuisines: \"Fast Food, Seafood, Desserts, Italian\"\nAccommodation: Harlem Humble Abode - 1 bedroom - Cute and Quaint, Amarillo, Cost: $409, Entire home/apt, House Rules: No pets, Minimum Nights: 5, Pet-friendly: No\n\nNumber of People = 2\nTotal Cost = 2 * $11 (Breakfast) + 2 * $35 (Lunch) + 2 * $53 (Dinner) + $409 (Accommodation) = $607\n\nDay 5: March 20, 2022\nCurrent City: from Amarillo to Baton Rouge\nTransportation: Self-driving, from Amarillo to Baton Rouge, Duration: 11 hours 42 mins, Distance: 1,270 km, Cost: $63\nBreakfast: -\nAttraction: -\nLunch: -\nDinner: -\nAccommodation: -\n\nNumber of People = 2\nTotal Cost = 2 * $63 (Transportation) = $126\n\nTotal cost across all days = $525 + $523 + $733 + $607 + $126 = $2514\n\nCuisines: The prompt specifies no cuisines, so all cuisines constraints are satisfied.\n\nNote: The accommodations selected do not allow pets, which is a requirement of the query. Unfortunately, the provided data does not include pet-friendly accommodations. Therefore, the traveler will need to find alternative pet-friendly accommodations within the budget. The total cost is within the budget of $2,900, leaving some room for this adjustment.", "gpt-4-1106-preview_direct_sole-planning_parsed_results": [{"day": 1, "current_city": "from Baton Rouge to Abilene", "transportation": "Self-driving, from Baton Rouge to Abilene, Duration: 8 hours 50 mins, Distance: 976 km", "breakfast": "-", "attraction": "The Grace Museum, Abilene;", "lunch": "Thai Garden, Abilene", "dinner": "Crispy Crust, Abilene", "accommodation": "Apartment minutes from manhattan, Abilene"}, {"day": 2, "current_city": "Abilene", "transportation": "-", "breakfast": "Cakes Degree, Abilene", "attraction": "Frontier Texas!, Abilene;", "lunch": "Finger Licious, Abilene", "dinner": "LPK Waterfront, Abilene", "accommodation": "Apartment minutes from manhattan, Abilene"}, {"day": 3, "current_city": "from Abilene to Amarillo", "transportation": "Self-driving, from Abilene to Amarillo, Duration: 4 hours 10 mins, Distance: 446 km", "breakfast": "-", "attraction": "Cadillac Ranch, Amarillo;", "lunch": "The Cinnamon Kitchen, Amarillo", "dinner": "Komachi, Amarillo", "accommodation": "Harlem Humble Abode - 1 bedroom - Cute and Quaint, Amarillo"}, {"day": 4, "current_city": "Amarillo", "transportation": "-", "breakfast": "Wood Box Cafe, Amarillo", "attraction": "Amarillo Botanical Gardens, Amarillo;", "lunch": "Sigree Global Grill, Amarillo", "dinner": "Anand Restaurant, Amarillo", "accommodation": "Harlem Humble Abode - 1 bedroom - Cute and Quaint, Amarillo"}, {"day": 5, "current_city": "from Amarillo to Baton Rouge", "transportation": "Self-driving, from Amarillo to Baton Rouge, Duration: 11 hours 42 mins, Distance: 1,270 km", "breakfast": "-", "attraction": "-", "lunch": "-", "dinner": "-", "accommodation": "-"}]}]