[{"gpt-4-1106-preview_direct_sole-planning_results": "Travel Plan:\n\nDay 1: March 3, 2022\nCurrent City: from Spokane to San Francisco\nTransportation: Flight Number: F3853330, from Spokane to San Francisco, Departure Time: 07:10, Arrival Time: 09:38, Cost: $227\nBreakfast: -\nAttraction: Golden Gate Bridge, San Francisco, Cost: $0 (assuming no entrance fee)\nLunch: Coffee & Chai Co., San Francisco, Cost: $10, Cuisines: \"Tea, Mexican, BBQ, Cafe, Seafood\"\nDinner: Tokyo Sushi, San Francisco, Cost: $18, Cuisines: \"Cafe, Pizza, BBQ\"\nAccommodation: Room in Down town Brooklyn Parkslop, San Francisco, Cost: $79, Maximum Occupancy: 2, House Rules: No Visitors, Minimum Nights: 1\n\nNumber of People = 1\nTotal Cost = $227 (flight) + $10 (lunch) + $18 (dinner) + $79 (accommodation) = $334\nAccommodation Minimum Nights: 1/1\n\nDay 2: March 4, 2022\nCurrent City: San Francisco\nTransportation: -\nBreakfast: Bonne Bouche, San Francisco, Cost: $21, Cuisines: \"Tea, Chinese, American, Cafe\"\nAttraction: Exploratorium, San Francisco, Cost: $0 (assuming no entrance fee)\nLunch: Sudarshan, San Francisco, Cost: $53, Cuisines: \"Fast Food, Bakery, Mediterranean, Italian\"\nDinner: Empress, San Francisco, Cost: $24, Cuisines: \"Pizza, BBQ, Mediterranean, Fast Food\"\nAccommodation: Room in Down town Brooklyn Parkslop, San Francisco, Cost: $79, Maximum Occupancy: 2, House Rules: No Visitors, Minimum Nights: 1\n\nNumber of People = 1\nTotal Cost = $21 (breakfast) + $53 (lunch) + $24 (dinner) + $79 (accommodation) = $177\nAccommodation Minimum Nights: 1/1\n\nDay 3: March 5, 2022\nCurrent City: from San Francisco to Spokane\nTransportation: Flight Number: F3840215, from San Francisco to Spokane, Departure Time: 16:21, Arrival Time: 18:29, Cost: $343\nBreakfast: Gupta's Rasoi, San Francisco, Cost: $13, Cuisines: \"Cafe, Bakery, BBQ, Mediterranean\"\nAttraction: San Francisco Museum of Modern Art, San Francisco, Cost: $0 (assuming no entrance fee)\nLunch: Anupam Eating Point, San Francisco, Cost: $10, Cuisines: \"Desserts, Pizza, Mexican, BBQ, Fast Food\"\nDinner: -\nAccommodation: -\n\nNumber of People = 1\nTotal Cost = $343 (flight) + $13 (breakfast) + $10 (lunch) = $366\n\nTotal cost across all days = $334 (Day 1) + $177 (Day 2) + $366 (Day 3) = $877\n\nRemaining Budget: $1,200 - $877 = $323\n\nCuisines: The prompt specifies no preferred cuisines, so all cuisine constraints are satisfied.", "gpt-4-1106-preview_direct_sole-planning_parsed_results": [{"day": 1, "current_city": "from Spokane to San Francisco", "transportation": "Flight Number: F3853330, from Spokane to San Francisco, Departure Time: 07:10, Arrival Time: 09:38", "breakfast": "-", "attraction": "Golden Gate Bridge, San Francisco;", "lunch": "Coffee & Chai Co., San Francisco", "dinner": "Tokyo Sushi, San Francisco", "accommodation": "Room in Down town Brooklyn Parkslop, San Francisco"}, {"day": 2, "current_city": "San Francisco", "transportation": "-", "breakfast": "Bonne Bouche, San Francisco", "attraction": "Exploratorium, San Francisco;", "lunch": "Sudarshan, San Francisco", "dinner": "Empress, San Francisco", "accommodation": "Room in Down town Brooklyn Parkslop, San Francisco"}, {"day": 3, "current_city": "from San Francisco to Spokane", "transportation": "Flight Number: F3840215, from San Francisco to Spokane, Departure Time: 16:21, Arrival Time: 18:29", "breakfast": "Gupta's Rasoi, San Francisco", "attraction": "San Francisco Museum of Modern Art, San Francisco;", "lunch": "Anupam Eating Point, San Francisco", "dinner": "-", "accommodation": "-"}]}]