[{"gpt-4-1106-preview_direct_sole-planning_results": "Travel Plan:\n\nDay 1: March 4th, 2022\nCurrent City: from Ontario to Honolulu\nTransportation: Flight Number: F3584294, from Ontario to Honolulu, Departure Time: 10:11, Arrival Time: 14:46, Cost: 888\nBreakfast: - (Assuming breakfast is before the flight or on the flight)\nAttraction: Waikiki Aquarium, Honolulu, Cost: 0 (Assuming free entry or covered by a city pass)\nLunch: Mama's Chinese Kitchen, Honolulu, Cost: 13, Cuisines: \"Tea, Pizza, Desserts, Italian\"\nDinner: Bait El Khetyar, Honolulu, Cost: 28, Cuisines: \"Cafe, Seafood\"\nAccommodation: Harlem 1 BR, Private Master Bath, Honolulu, Cost: 396, Maximum Occupancy: 1, House Rules: No Pets, Minimum Nights: 2\n\nNumber of People = 1\nTotal Cost = 888 + 13 + 28 + 396 = 1325\nAccommodation Minimum Nights: 1/2\n\nDay 2: March 5th, 2022\nCurrent City: Honolulu\nTransportation: -\nBreakfast: Evergreen Sweet House, Honolulu, Cost: 18, Cuisines: \"BBQ, Desserts, Fast Food\"\nAttraction: Iolani Palace, Honolulu, Cost: 0 (Assuming free entry or covered by a city pass)\nLunch: Angelena Restaurant, Honolulu, Cost: 38, Cuisines: \"Cafe, Mexican, Bakery, Desserts\"\nDinner: Viva Hyderabad, Honolulu, Cost: 29, Cuisines: \"Bakery, BBQ\"\nAccommodation: Harlem 1 BR, Private Master Bath, Honolulu, Cost: 396, Maximum Occupancy: 1, House Rules: No Pets, Minimum Nights: 2\n\nNumber of People = 1\nTotal Cost = 18 + 38 + 29 + 396 = 481\nAccommodation Minimum Nights: 2/2\n\nDay 3: March 6th, 2022\nCurrent City: from Honolulu to Ontario\nTransportation: Flight Number: F3584327, from Honolulu to Ontario, Departure Time: 14:35, Arrival Time: 22:02, Cost: 1075\nBreakfast: Take Away, Honolulu, Cost: 21, Cuisines: \"Seafood, Bakery, Mediterranean, Fast Food\"\nAttraction: Duke Paoa Kahanamoku Statue, Honolulu, Cost: 0 (Assuming free entry or covered by a city pass)\nLunch: Shere Hind Chicken Corner, Honolulu, Cost: 38, Cuisines: \"Desserts, Pizza, French, BBQ, Seafood\"\nDinner: - (Assuming dinner is after arrival back in Ontario or on the flight)\nAccommodation: -\n\nNumber of People = 1\nTotal Cost = 1075 + 21 + 38 = 1134\n\nTotal cost across all days = 1325 + 481 + 1134 = 2940\nRemaining Budget = 3200 - 2940 = 260\n\nCuisines: The prompt specifies no preferred cuisines, so all cuisine constraints are satisfied.\n\nNote: Attractions are assumed to be free or covered by a city pass as no price information is provided. If there are entry fees, they would need to be factored into the budget. The accommodation chosen requires a minimum of 2 nights, which aligns with the stay in Honolulu. The cheapest options for meals and accommodation that meet the query requirements have been selected.", "gpt-4-1106-preview_direct_sole-planning_parsed_results": [{"day": 1, "current_city": "from Ontario to Honolulu", "transportation": "Flight Number: F3584294, from Ontario to Honolulu, Departure Time: 10:11, Arrival Time: 14:46", "breakfast": "-", "attraction": "Waikiki Aquarium, Honolulu;", "lunch": "Mama's Chinese Kitchen, Honolulu", "dinner": "Bait El Khetyar, Honolulu", "accommodation": "Harlem 1 BR, Private Master Bath, Honolulu"}, {"day": 2, "current_city": "Honolulu", "transportation": "-", "breakfast": "Evergreen Sweet House, Honolulu", "attraction": "Iolani Palace, Honolulu;", "lunch": "Angelena Restaurant, Honolulu", "dinner": "Viva Hyderabad, Honolulu", "accommodation": "Harlem 1 BR, Private Master Bath, Honolulu"}, {"day": 3, "current_city": "from Honolulu to Ontario", "transportation": "Flight Number: F3584327, from Honolulu to Ontario, Departure Time: 14:35, Arrival Time: 22:02", "breakfast": "Take Away, Honolulu", "attraction": "Duke Paoa Kahanamoku Statue, Honolulu;", "lunch": "Shere Hind Chicken Corner, Honolulu", "dinner": "-", "accommodation": "-"}]}]