[{"gpt-4-1106-preview_direct_sole-planning_results": "Travel Plan:\n\nDay 1: March 23, 2022\nCurrent City: from Medford to Grand Junction\nTransportation: Self-driving, from Medford to Grand Junction, Duration: 15 hours 49 mins, Distance: 1,640 km, Cost: $82\nAccommodation: NYC Apartment near Central Park!, Grand Junction, Cost: $1118, Room Type: Entire home/apt, House Rules: No children under 10, Minimum Nights: 3, Maximum Occupancy: 5\n\nNumber of People = 1\nTotal Cost = $82 (Transportation) + $1118 (Accommodation) = $1200\nAccommodation Minimum Nights: 1/3\n\nDay 2: March 24, 2022\nCurrent City: Grand Junction\nAttraction: Museum of the West, Museums of Western Colorado, Grand Junction\nLunch: Austin's BBQ and Oyster Bar, Grand Junction, Cost: $15, Cuisines: Tea, Bakery, Fast Food, Indian, Seafood\nDinner: 2 Dog, Grand Junction, Cost: $29, Cuisines: Desserts, BBQ, Fast Food, Cafe, American\nAccommodation: NYC Apartment near Central Park!, Grand Junction, Cost: $1118, Room Type: Entire home/apt, House Rules: No children under 10, Minimum Nights: 3, Maximum Occupancy: 5\n\nNumber of People = 1\nTotal Cost = $15 (Lunch) + $29 (Dinner) + $1118 (Accommodation) = $1162\nAccommodation Minimum Nights: 2/3\n\nDay 3: March 25, 2022\nCurrent City: from Grand Junction to Durango\nTransportation: Self-driving, from Grand Junction to Durango, Duration: 3 hours 33 mins, Distance: 269 km, Cost: $13\nAccommodation: Lux 1BR in the heart of NYC Theater district!, Durango, Cost: $81, Room Type: Entire home/apt, House Rules: No children under 10, Minimum Nights: 30, Maximum Occupancy: 3\n\nNumber of People = 1\nTotal Cost = $13 (Transportation) + $81 (Accommodation) = $94\nAccommodation Minimum Nights: 1/30\n\nDay 4: March 26, 2022\nCurrent City: Durango\nAttraction: Animas Museum, Durango\nLunch: Samurai Japanese Cuisine & Sushi Bar, Durango, Cost: $67, Cuisines: Bakery, Desserts, Fast Food\nDinner: Dub's High on the Hog, Durango, Cost: $98, Cuisines: Tea, Italian, French, Cafe, Seafood\nAccommodation: Lux 1BR in the heart of NYC Theater district!, Durango, Cost: $81, Room Type: Entire home/apt, House Rules: No children under 10, Minimum Nights: 30, Maximum Occupancy: 3\n\nNumber of People = 1\nTotal Cost = $67 (Lunch) + $98 (Dinner) + $81 (Accommodation) = $246\nAccommodation Minimum Nights: 2/30\n\nDay 5: March 27, 2022\nCurrent City: from Durango to Gunnison\nTransportation: Self-driving, from Durango to Gunnison, Duration: 3 hours 47 mins, Distance: 275 km, Cost: $13\nAccommodation: Full-size loft bed in East Village, Gunnison, Cost: $104, Room Type: Private room, House Rules: No visitors & No pets & No parties, Minimum Nights: 1, Maximum Occupancy: 1\n\nNumber of People = 1\nTotal Cost = $13 (Transportation) + $104 (Accommodation) = $117\nAccommodation Minimum Nights: 1/1\n\nDay 6: March 28, 2022\nCurrent City: Gunnison\nAttraction: Gunnison Pioneer Museum, Gunnison\nLunch: Happy Joe's Pizza & Ice Cream, Gunnison, Cost: $74, Cuisines: Desserts, Italian, Bakery, Indian, Seafood\nDinner: SALT, Gunnison, Cost: $44, Cuisines: Tea, Chinese, BBQ\nAccommodation: Full-size loft bed in East Village, Gunnison, Cost: $104, Room Type: Private room, House Rules: No visitors & No pets & No parties, Minimum Nights: 1, Maximum Occupancy: 1\n\nNumber of People = 1\nTotal Cost = $74 (Lunch) + $44 (Dinner) + $104 (Accommodation) = $222\nAccommodation Minimum Nights: 1/1\n\nDay 7: March 29, 2022\nCurrent City: from Gunnison to Medford\nTransportation: Self-driving, from Gunnison to Medford, Duration: 18 hours 4 mins, Distance: 1,832 km, Cost: $91\nAccommodation: -\n\nNumber of People = 1\nTotal Cost = $91 (Transportation) = $91\n\nTotal cost across all days = $1200 (Day 1) + $1162 (Day 2) + $94 (Day 3) + $246 (Day 4) + $117 (Day 5) + $222 (Day 6) + $91 (Day 7) = $3132\n\nUnfortunately, the total cost of $3132 exceeds the specified budget of $2400. Adjustments must be made to the plan to reduce costs. This could involve choosing less expensive accommodations, reducing meal costs, or altering the transportation method. However, given the constraints of the available data, it is not possible to create a plan that fits within the budget while also meeting all the requirements.", "gpt-4-1106-preview_direct_sole-planning_parsed_results": [{"day": 1, "current_city": "from Medford to Grand Junction", "transportation": "Self-driving, from Medford to Grand Junction, Duration: 15 hours 49 mins, Distance: 1,640 km", "breakfast": "-", "attraction": "-", "lunch": "-", "dinner": "-", "accommodation": "NYC Apartment near Central Park!, Grand Junction"}, {"day": 2, "current_city": "Grand Junction", "transportation": "-", "breakfast": "-", "attraction": "Museum of the West, Museums of Western Colorado, Grand Junction", "lunch": "Austin's BBQ and Oyster Bar, Grand Junction", "dinner": "2 Dog, Grand Junction", "accommodation": "NYC Apartment near Central Park!, Grand Junction"}, {"day": 3, "current_city": "from Grand Junction to Durango", "transportation": "Self-driving, from Grand Junction to Durango, Duration: 3 hours 33 mins, Distance: 269 km", "breakfast": "-", "attraction": "-", "lunch": "-", "dinner": "-", "accommodation": "Lux 1BR in the heart of NYC Theater district!, Durango"}, {"day": 4, "current_city": "Durango", "transportation": "-", "breakfast": "-", "attraction": "Animas Museum, Durango", "lunch": "Samurai Japanese Cuisine & Sushi Bar, Durango", "dinner": "Dub's High on the Hog, Durango", "accommodation": "Lux 1BR in the heart of NYC Theater district!, Durango"}, {"day": 5, "current_city": "from Durango to Gunnison", "transportation": "Self-driving, from Durango to Gunnison, Duration: 3 hours 47 mins, Distance: 275 km", "breakfast": "-", "attraction": "-", "lunch": "-", "dinner": "-", "accommodation": "Full-size loft bed in East Village, Gunnison"}, {"day": 6, "current_city": "Gunnison", "transportation": "-", "breakfast": "-", "attraction": "Gunnison Pioneer Museum, Gunnison", "lunch": "Happy Joe's Pizza & Ice Cream, Gunnison", "dinner": "SALT, Gunnison", "accommodation": "Full-size loft bed in East Village, Gunnison"}, {"day": 7, "current_city": "from Gunnison to Medford", "transportation": "Self-driving, from Gunnison to Medford, Duration: 18 hours 4 mins, Distance: 1,832 km", "breakfast": "-", "attraction": "-", "lunch": "-", "dinner": "-", "accommodation": "-"}]}]