[{"gpt-4-1106-preview_direct_sole-planning_results": "Travel Plan:\n\nDay 1: March 25, 2022\nCurrent City: Albuquerque to Houston\nTransportation: Flight Number: F3884406, from Albuquerque to Houston, Departure Time: 07:41, Arrival Time: 10:35, Cost: $153\nAttraction: Downtown Aquarium, Houston, Cost: $0 (assuming no entry fee is listed)\nLunch: Jalapenos, Houston, Cost: $57, Cuisines: \"Desserts, Tea, Cafe, Chinese, Seafood\"\nDinner: Sheetla Dhaba, Houston, Cost: $35, Cuisines: \"Desserts, Pizza, Bakery, American, Mediterranean\"\nAccommodation: Sunny and Airy near Manhattan, Houston, Cost: $499, Room Type: Entire home/apt, House Rules: No pets, Minimum Nights: 2, Maximum Occupancy: 4\n\nTotal Cost for Day 1: $153 (flight) + $57 (lunch) + $35 (dinner) + $499 (accommodation) = $744\n\nDay 2: March 26, 2022\nCurrent City: Houston\nBreakfast: Super Bakery, Houston, Cost: $30, Cuisines: \"Seafood, Fast Food\"\nAttraction: Space Center Houston, Houston, Cost: $0 (assuming no entry fee is listed)\nLunch: Royal Mart, Houston, Cost: $40, Cuisines: \"Tea, Bakery, Cafe, Mediterranean, Seafood\"\nDinner: Matchbox, Houston, Cost: $33, Cuisines: \"Tea, Italian, Bakery, Fast Food, Seafood\"\nAccommodation: Sunny and Airy near Manhattan, Houston, Cost: $499, Room Type: Entire home/apt, House Rules: No pets, Minimum Nights: 2, Maximum Occupancy: 4\n\nTotal Cost for Day 2: $30 (breakfast) + $40 (lunch) + $33 (dinner) + $499 (accommodation) = $602\n\nDay 3: March 27, 2022\nCurrent City: Houston to Dallas\nTransportation: Flight Number: F3723636, from Houston to Dallas, Departure Time: 19:20, Arrival Time: 20:14, Cost: $62\nBreakfast: Earthen Spices, Houston, Cost: $28, Cuisines: \"Tea, Mexican, Bakery, BBQ, Fast Food\"\nAttraction: Houston Museum of Natural Science, Houston, Cost: $0 (assuming no entry fee is listed)\nLunch: Chawla's\u5b8a, Houston, Cost: $26, Cuisines: \"Chinese, Desserts, Bakery, Cafe, Mediterranean\"\nDinner: Cyber Adda 24, Houston, Cost: $73, Cuisines: \"Chinese, Pizza, Bakery\"\nAccommodation: 1BR, elevator, kitchen, doorman!, Dallas, Cost: $475, Room Type: Entire home/apt, House Rules: No parties, Minimum Nights: 1, Maximum Occupancy: 3\n\nTotal Cost for Day 3: $28 (breakfast) + $26 (lunch) + $73 (dinner) + $62 (flight) + $475 (accommodation) = $664\n\nDay 4: March 28, 2022\nCurrent City: Dallas\nBreakfast: Coconuts Fish Cafe, Dallas, Cost: $38, Cuisines: \"Cafe, BBQ, Mediterranean, Fast Food\"\nAttraction: The Dallas World Aquarium, Dallas, Cost: $0 (assuming no entry fee is listed)\nLunch: 1918 Bistro & Grill, Dallas, Cost: $90, Cuisines: \"Tea, Pizza, BBQ, Seafood\"\nDinner: Yanki Sizzlers, Dallas, Cost: $96, Cuisines: \"Cafe, French, Tea, Mediterranean\"\nAccommodation: 1BR, elevator, kitchen, doorman!, Dallas, Cost: $475, Room Type: Entire home/apt, House Rules: No parties, Minimum Nights: 1, Maximum Occupancy: 3\n\nTotal Cost for Day 4: $38 (breakfast) + $90 (lunch) + $96 (dinner) + $475 (accommodation) = $699\n\nDay 5: March 29, 2022\nCurrent City: Dallas to Albuquerque\nTransportation: Flight Number: F3960534, from Dallas to Albuquerque, Departure Time: 18:54, Arrival Time: 19:35, Cost: $120\nBreakfast: Delhicacy, Dallas, Cost: $67, Cuisines: \"Desserts, Mexican, Bakery, Chinese, Seafood\"\nAttraction: Reunion Tower, Dallas, Cost: $0 (assuming no entry fee is listed)\nLunch: L'Opera, Dallas, Cost: $77, Cuisines: \"French, Bakery, BBQ, Fast Food, Seafood\"\nDinner: Cafe Gatherings, Dallas, Cost: $17, Cuisines: \"Bakery, Indian, Desserts\"\nAccommodation: - (Traveler will arrive home on this day)\n\nTotal Cost for Day 5: $67 (breakfast) + $77 (lunch) + $17 (dinner) + $120 (flight) = $281\n\nTotal cost across all days: $744 (Day 1) + $602 (Day 2) + $664 (Day 3) + $699 (Day 4) + $281 (Day 5) = $2990\n\nUnfortunately, the total cost exceeds the budget of $2,100. To adjust the plan within the budget, we need to make some changes:\n\n- Opt for cheaper accommodation options.\n- Choose less expensive restaurants for meals.\n- Consider alternative transportation methods if cheaper (e.g., self-driving or taxi instead of flights).\n\nPlease note that the actual entry fees for attractions are not listed and are assumed to be $0, which may not be accurate. Additionally, the costs for some meals and accommodations may vary based on availability and booking time. The traveler should also consider additional costs such as local transportation, tips, and personal expenses.", "gpt-4-1106-preview_direct_sole-planning_parsed_results": [{"day": 1, "current_city": "from Albuquerque to Houston", "transportation": "Flight Number: F3884406, from Albuquerque to Houston, Departure Time: 07:41, Arrival Time: 10:35", "breakfast": "-", "attraction": "Downtown Aquarium, Houston;", "lunch": "Jalapenos, Houston", "dinner": "Sheetla Dhaba, Houston", "accommodation": "Sunny and Airy near Manhattan, Houston"}, {"day": 2, "current_city": "Houston", "transportation": "-", "breakfast": "Super Bakery, Houston", "attraction": "Space Center Houston, Houston;", "lunch": "Royal Mart, Houston", "dinner": "Matchbox, Houston", "accommodation": "Sunny and Airy near Manhattan, Houston"}, {"day": 3, "current_city": "from Houston to Dallas", "transportation": "Flight Number: F3723636, from Houston to Dallas, Departure Time: 19:20, Arrival Time: 20:14", "breakfast": "Earthen Spices, Houston", "attraction": "Houston Museum of Natural Science, Houston;", "lunch": "Chawla's\u5b8a, Houston", "dinner": "Cyber Adda 24, Houston", "accommodation": "1BR, elevator, kitchen, doorman!, Dallas"}, {"day": 4, "current_city": "Dallas", "transportation": "-", "breakfast": "Coconuts Fish Cafe, Dallas", "attraction": "The Dallas World Aquarium, Dallas;", "lunch": "1918 Bistro & Grill, Dallas", "dinner": "Yanki Sizzlers, Dallas", "accommodation": "1BR, elevator, kitchen, doorman!, Dallas"}, {"day": 5, "current_city": "from Dallas to Albuquerque", "transportation": "Flight Number: F3960534, from Dallas to Albuquerque, Departure Time: 18:54, Arrival Time: 19:35", "breakfast": "Delhicacy, Dallas", "attraction": "Reunion Tower, Dallas;", "lunch": "L'Opera, Dallas", "dinner": "Cafe Gatherings, Dallas", "accommodation": "-"}]}]