[{"gpt-4-1106-preview_direct_sole-planning_results": "Travel Plan:\n\nDay 1: March 20, 2022\nCurrent City: from Eau Claire to Rockford\nTransportation: Self-driving, from Eau Claire to Rockford, Duration: 3 hours 42 mins, Distance: 392 km, Cost: $19\nBreakfast: -\nAttraction: Anderson Japanese Gardens, Rockford\nLunch: Flying Mango, Rockford (American, BBQ, Seafood)\nDinner: Coco Bambu, Rockford (Tea, French, Bakery, BBQ, Cafe)\nAccommodation: Spacious 3BDR Prime Location!, Rockford (Allows visitors, Minimum nights: 2, Cost: $1030 per night)\n\nDay 2: March 21, 2022\nCurrent City: Rockford\nTransportation: -\nBreakfast: Eggspectation - Jaypee Vasant Continental, Rockford (Tea, Mediterranean, Seafood)\nAttraction: Discovery Center Museum, Rockford\nLunch: Moets Arabica, Rockford (Tea, Bakery, Indian, Fast Food)\nDinner: Aroma Rest O Bar, Rockford (Bakery, Fast Food, Chinese, American, Seafood)\nAccommodation: Spacious 3BDR Prime Location!, Rockford\n\nDay 3: March 22, 2022\nCurrent City: from Rockford to Peoria\nTransportation: Self-driving, from Rockford to Peoria, Duration: 2 hours 17 mins, Distance: 219 km, Cost: $10\nBreakfast: -\nAttraction: Peoria Riverfront Museum, Peoria\nLunch: Wasabi Sushi and Thai, Peoria (Tea, Italian, BBQ, Fast Food, Seafood)\nDinner: Slice of Spice, Peoria (Tea, Fast Food)\nAccommodation: Bushwick Music Mansion, Peoria (Allows visitors, Minimum nights: 1, Cost: $217 per night)\n\nDay 4: March 23, 2022\nCurrent City: Peoria\nTransportation: -\nBreakfast: The Street- Curries & Grills, Peoria (Cafe, Pizza, Seafood, Fast Food)\nAttraction: Caterpillar Visitors Center, Peoria\nLunch: Aggarwal's Bikaner Mishthan Bhandar, Peoria (Tea, Cafe, Indian, BBQ)\nDinner: Barbeque Nation, Peoria (Desserts, Tea, Pizza, Italian, Indian, Seafood)\nAccommodation: Bushwick Music Mansion, Peoria\n\nDay 5: March 24, 2022\nCurrent City: from Peoria to Chicago\nTransportation: Self-driving, from Peoria to Chicago, Duration: 2 hours 34 mins, Distance: 269 km, Cost: $13\nBreakfast: -\nAttraction: Millennium Park, Chicago\nLunch: Pantry d'or, Chicago (Tea, BBQ, Fast Food, Cafe, Indian)\nDinner: The Black Pearl, Chicago (Cafe, Bakery)\nAccommodation: NYC Firehouse-Greenpoint BRKLYN, Chicago (Allows visitors, Minimum nights: 3, Cost: $109 per night)\n\nDay 6: March 25, 2022\nCurrent City: Chicago\nTransportation: -\nBreakfast: Starbucks, Chicago (Tea, Bakery, BBQ, Cafe, Indian)\nAttraction: Skydeck Chicago; Willis Tower, Chicago\nLunch: Bro's Kitchenette, Chicago (Mexican, Desserts, Seafood)\nDinner: Mini's Royal Cafe, Chicago (Tea, Cafe, Bakery)\nAccommodation: NYC Firehouse-Greenpoint BRKLYN, Chicago\n\nDay 7: March 26, 2022\nCurrent City: from Chicago to Eau Claire\nTransportation: Self-driving, from Chicago to Eau Claire, Duration: 4 hours 44 mins, Distance: 511 km, Cost: $25\nBreakfast: -\nAttraction: -\nLunch: -\nDinner: -\nAccommodation: -\n\nTotal Estimated Cost:\nTransportation: $19 (Eau Claire to Rockford) + $10 (Rockford to Peoria) + $13 (Peoria to Chicago) + $25 (Chicago to Eau Claire) = $67\nAccommodation: $1030 (2 nights in Rockford) + $217 (2 nights in Peoria) + $109 (2 nights in Chicago) = $2732\nTotal: $67 (Transportation) + $2732 (Accommodation) = $2799\n\nRemaining Budget: $10,600 - $2799 = $7801 for meals, attractions, and any additional expenses.", "gpt-4-1106-preview_direct_sole-planning_parsed_results": [{"day": 1, "current_city": "from Eau Claire to Rockford", "transportation": "Self-driving, from Eau Claire to Rockford, Duration: 3 hours 42 mins, Distance: 392 km, Cost: 19", "breakfast": "-", "attraction": "Anderson Japanese Gardens, Rockford;", "lunch": "Flying Mango, Rockford", "dinner": "Coco Bambu, Rockford", "accommodation": "Spacious 3BDR Prime Location!, Rockford"}, {"day": 2, "current_city": "Rockford", "transportation": "-", "breakfast": "Eggspectation - Jaypee Vasant Continental, Rockford", "attraction": "Discovery Center Museum, Rockford;", "lunch": "Moets Arabica, Rockford", "dinner": "Aroma Rest O Bar, Rockford", "accommodation": "Spacious 3BDR Prime Location!, Rockford"}, {"day": 3, "current_city": "from Rockford to Peoria", "transportation": "Self-driving, from Rockford to Peoria, Duration: 2 hours 17 mins, Distance: 219 km, Cost: 10", "breakfast": "-", "attraction": "Peoria Riverfront Museum, Peoria;", "lunch": "Wasabi Sushi and Thai, Peoria", "dinner": "Slice of Spice, Peoria", "accommodation": "Bushwick Music Mansion, Peoria"}, {"day": 4, "current_city": "Peoria", "transportation": "-", "breakfast": "The Street- Curries & Grills, Peoria", "attraction": "Caterpillar Visitors Center, Peoria;", "lunch": "Aggarwal's Bikaner Mishthan Bhandar, Peoria", "dinner": "Barbeque Nation, Peoria", "accommodation": "Bushwick Music Mansion, Peoria"}, {"day": 5, "current_city": "from Peoria to Chicago", "transportation": "Self-driving, from Peoria to Chicago, Duration: 2 hours 34 mins, Distance: 269 km, Cost: 13", "breakfast": "-", "attraction": "Millennium Park, Chicago;", "lunch": "Pantry d'or, Chicago", "dinner": "The Black Pearl, Chicago", "accommodation": "NYC Firehouse-Greenpoint BRKLYN, Chicago"}, {"day": 6, "current_city": "Chicago", "transportation": "-", "breakfast": "Starbucks, Chicago", "attraction": "Skydeck Chicago; Willis Tower, Chicago;", "lunch": "Bro's Kitchenette, Chicago", "dinner": "Mini's Royal Cafe, Chicago", "accommodation": "NYC Firehouse-Greenpoint BRKLYN, Chicago"}, {"day": 7, "current_city": "from Chicago to Eau Claire", "transportation": "Self-driving, from Chicago to Eau Claire, Duration: 4 hours 44 mins, Distance: 511 km, Cost: 25", "breakfast": "-", "attraction": "-", "lunch": "-", "dinner": "-", "accommodation": "-"}]}]