[{"gpt-4-1106-preview_direct_sole-planning_results": "Travel Plan:\n\nDay 1: March 15th, 2022\nCurrent City: from Cleveland to Baltimore\nTransportation: Flight Number: F4001024, from Cleveland to Baltimore, Departure Time: 06:30, Arrival Time: 07:33, Cost: $85 per person, Total Cost: $170\nBreakfast: - (Assuming breakfast is had before the flight or will be had upon arrival in Baltimore), Cost: $0\nAttraction: National Aquarium, Baltimore, Cost: $39.95 per person, Total Cost: $79.90\nLunch: Los Pablos, Baltimore, Average Cost: $47 per person, Total Cost: $94\nDinner: Mr. Dunderbak's Biergarten and Marketplatz, Baltimore, Average Cost: $74 per person, Total Cost: $148\nAccommodation: Beautiful Double Room - Heart of Clinton Hill, BK, Baltimore, Cost: $658 per night (Private room)\n\nTotal cost for Day 1: Transportation + Attraction + Lunch + Dinner + Accommodation = $170 + $79.90 + $94 + $148 + $658 = $1149.90\n\nDay 2: March 16th, 2022\nCurrent City: Baltimore\nTransportation: -, Cost: $0\nBreakfast: The Thai Bowl, Baltimore, Average Cost: $66 per person, Total Cost: $132\nAttraction: Fort McHenry National Monument and Historic Shrine, Baltimore, Cost: Free\nLunch: Salt, Baltimore, Average Cost: $56 per person, Total Cost: $112\nDinner: Tresind - Nassima Royal Hotel, Baltimore, Average Cost: $67 per person, Total Cost: $134\nAccommodation: Beautiful Double Room - Heart of Clinton Hill, BK, Baltimore, Cost: $658 per night (Private room)\n\nTotal cost for Day 2: Breakfast + Lunch + Dinner + Accommodation = $132 + $112 + $134 + $658 = $1036\n\nDay 3: March 17th, 2022\nCurrent City: from Baltimore to Cleveland\nTransportation: Flight Number: F4007632, from Baltimore to Cleveland, Departure Time: 23:21, Arrival Time: 00:24, Cost: $101 per person, Total Cost: $202\nBreakfast: Three Dots & A Dash, Baltimore, Average Cost: $47 per person, Total Cost: $94\nAttraction: The Walters Art Museum, Baltimore, Cost: Free\nLunch: Farzi Cafe, Baltimore, Average Cost: $96 per person, Total Cost: $192\nDinner: - (Assuming dinner will be had after arrival in Cleveland or not required due to late flight), Cost: $0\nAccommodation: - (No accommodation needed as the return flight is on the same day)\n\nTotal cost for Day 3: Transportation + Breakfast + Lunch = $202 + $94 + $192 = $488\n\nThe total cost of this trip is the sum of the cost from day 1, day 2, and day 3. It is $1149.90 + $1036 + $488 = $2673.90\n\nHowever, this total exceeds the budget of $1,700. To adjust the plan to fit the budget, we need to make some changes:\n\n- Choose a less expensive accommodation option.\n- Opt for more budget-friendly meal options.\n- Limit the number of paid attractions.\n\nRevised Travel Plan:\n\nDay 1: Same as above, but with a different accommodation:\nAccommodation: Cozy Bedroom in best area of FiDi, Baltimore, Cost: $290 per night (Private room)\nNew total cost for Day 1: $170 + $79.90 + $94 + $148 + $290 = $781.90\n\nDay 2: Same as above, but with the same accommodation as Day 1:\nAccommodation: Cozy Bedroom in best area of FiDi, Baltimore, Cost: $290 per night (Private room)\nNew total cost for Day 2: $132 + $112 + $134 + $290 = $668\n\nDay 3: Same as above, no changes needed.\nTotal cost for Day 3: $488\n\nThe new total cost of this trip is $781.90 + $668 + $488 = $1937.90\n\nThis revised plan still exceeds the budget. Further adjustments are needed:\n\n- Opt for self-driving instead of flights.\n- Choose the least expensive meal options.\n\nFinal Revised Travel Plan:\n\nDay 1:\nTransportation: Self-driving, from Cleveland to Baltimore, Cost: $30\nAccommodation: Cozy Bedroom in best area of FiDi, Baltimore, Cost: $290\nNew total cost for Day 1: $30 + $79.90 + $94 + $148 + $290 = $641.90\n\nDay 2:\nSame as above, but with the same accommodation as Day 1.\nNew total cost for Day 2: $132 + $112 + $134 + $290 = $668\n\nDay 3:\nTransportation: Self-driving, from Baltimore to Cleveland, Cost: $30\nTotal cost for Day 3: $30 + $94 + $192 = $316\n\nThe final total cost of this trip is $641.90 + $668 + $316 = $1625.90\n\nThis final revised plan fits within the budget of $1,700.", "gpt-4-1106-preview_direct_sole-planning_parsed_results": [{"day": 1, "current_city": "from Cleveland to Baltimore", "transportation": "Flight Number: F4001024, from Cleveland to Baltimore, Departure Time: 06:30, Arrival Time: 07:33", "breakfast": "-", "attraction": "National Aquarium, Baltimore", "lunch": "Los Pablos, Baltimore", "dinner": "Mr. Dunderbak's Biergarten and Marketplatz, Baltimore", "accommodation": "Cozy Bedroom in best area of FiDi, Baltimore"}, {"day": 2, "current_city": "Baltimore", "transportation": "-", "breakfast": "The Thai Bowl, Baltimore", "attraction": "Fort McHenry National Monument and Historic Shrine, Baltimore", "lunch": "Salt, Baltimore", "dinner": "Tresind - Nassima Royal Hotel, Baltimore", "accommodation": "Cozy Bedroom in best area of FiDi, Baltimore"}, {"day": 3, "current_city": "from Baltimore to Cleveland", "transportation": "Self-driving, from Baltimore to Cleveland", "breakfast": "Three Dots & A Dash, Baltimore", "attraction": "The Walters Art Museum, Baltimore", "lunch": "Farzi Cafe, Baltimore", "dinner": "-", "accommodation": "-"}]}]