[{"gpt-4-1106-preview_direct_sole-planning_results": "Travel Plan:\n\nDay 1: March 15, 2022\nCurrent City: from St. Louis to Orlando\nTransportation: Flight Number: F3564111, from St. Louis to Orlando, Departure Time: 21:02, Arrival Time: 01:45, Cost: $198\nBreakfast: -\nAttraction: SeaWorld Orlando, Orlando, Cost: $0 (Assuming no entry fee is provided)\nLunch: Hotel New Tamil Nadu, Orlando, Cost: $13, Cuisines: \"Desserts, Italian, Fast Food, Mediterranean, Seafood\"\nDinner: Domino's Pizza, Orlando, Cost: $12, Cuisines: \"Tea, Pizza, French, BBQ, Bakery\"\nAccommodation: Sixth Ave Chelsea, Studio Serviced Apartment, Orlando, Cost: $70, Maximum Occupancy: 3, House Rules: No visitors & No pets, Minimum Nights: 30\n\nNumber of People = 1\nTotal Cost = $198 (Flight) + $13 (Lunch) + $12 (Dinner) + $70 (Accommodation) = $293\nAccommodation Minimum Nights: 1/30\n\nDay 2: March 16, 2022\nCurrent City: Orlando\nTransportation: -\nBreakfast: Fuji Japanese Steakhouse, Orlando, Cost: $75, Cuisines: \"Tea, Bakery, Desserts\"\nAttraction: The Wheel at ICON Park, Orlando, Cost: $0 (Assuming no entry fee is provided)\nLunch: Turquoise Villa, Orlando, Cost: $55, Cuisines: \"French, Bakery, BBQ, Fast Food\"\nDinner: The Tandoori Times, Orlando, Cost: $84, Cuisines: \"Tea, Cafe, BBQ, Italian\"\nAccommodation: Sixth Ave Chelsea, Studio Serviced Apartment, Orlando, Cost: $70, Maximum Occupancy: 3, House Rules: No visitors & No pets, Minimum Nights: 30\n\nNumber of People = 1\nTotal Cost = $75 (Breakfast) + $55 (Lunch) + $84 (Dinner) + $70 (Accommodation) = $284\nAccommodation Minimum Nights: 2/30\n\nDay 3: March 17, 2022\nCurrent City: from Orlando to Fort Myers\nTransportation: Flight Number: F3564762, from Orlando to Fort Myers, Departure Time: 12:45, Arrival Time: 13:35, Cost: $63\nBreakfast: Crust N Cakes, Orlando, Cost: $61, Cuisines: \"Tea, Cafe, Indian, BBQ\"\nAttraction: Edison & Ford Winter Estates, Fort Myers, Cost: $0 (Assuming no entry fee is provided)\nLunch: The Refinery, Fort Myers, Cost: $22, Cuisines: \"Bakery, Indian, Seafood\"\nDinner: Al Mukhtar Bakery, Fort Myers, Cost: $54, Cuisines: \"BBQ, Tea, American, Desserts\"\nAccommodation: Great room in Greenwich Village!, Fort Myers, Cost: $133, Maximum Occupancy: 1, House Rules: No visitors, Minimum Nights: 1\n\nNumber of People = 1\nTotal Cost = $63 (Flight) + $61 (Breakfast) + $22 (Lunch) + $54 (Dinner) + $133 (Accommodation) = $333\nAccommodation Minimum Nights: 1/1\n\nDay 4: March 18, 2022\nCurrent City: Fort Myers\nTransportation: -\nBreakfast: Haunted, Fort Myers, Cost: $50, Cuisines: \"Desserts, French, Fast Food, Cafe, Seafood\"\nAttraction: Six Mile Cypress Slough Preserve, Fort Myers, Cost: $0 (Assuming no entry fee is provided)\nLunch: Eggers Madhouse, Fort Myers, Cost: $76, Cuisines: \"BBQ, Mediterranean, Seafood\"\nDinner: Maachh Bhaat, Fort Myers, Cost: $66, Cuisines: \"Desserts, Pizza, Fast Food, Mediterranean, Seafood\"\nAccommodation: Great room in Greenwich Village!, Fort Myers, Cost: $133, Maximum Occupancy: 1, House Rules: No visitors, Minimum Nights: 1\n\nNumber of People = 1\nTotal Cost = $50 (Breakfast) + $76 (Lunch) + $66 (Dinner) + $133 (Accommodation) = $325\nAccommodation Minimum Nights: 2/1\n\nDay 5: March 19, 2022\nCurrent City: from Fort Myers to St. Louis\nTransportation: Flight Number: F3951040, from Fort Myers to St. Louis, Departure Time: 06:03, Arrival Time: 07:38, Cost: $236\nBreakfast: The Refinery, Fort Myers, Cost: $22, Cuisines: \"Bakery, Indian, Seafood\"\nAttraction: -\nLunch: -\nDinner: -\nAccommodation: -\n\nNumber of People = 1\nTotal Cost = $236 (Flight) + $22 (Breakfast) = $258\n\nTotal cost across all days = $293 (Day 1) + $284 (Day 2) + $333 (Day 3) + $325 (Day 4) + $258 (Day 5) = $1493\n\nRemaining Budget = $2900 - $1493 = $1407\n\nCuisines: The prompt specifies no cuisines, so all cuisines constraints are satisfied.\n\nNote: The costs for attractions are assumed to be $0 as no entry fee information is provided. The accommodation costs are calculated per night, and the minimum nights requirement is noted. The cheapest options that meet the query requirements are chosen. The remaining budget is calculated by subtracting the total cost from the initial budget.", "gpt-4-1106-preview_direct_sole-planning_parsed_results": [{"day": 1, "current_city": "from St. Louis to Orlando", "transportation": "Flight Number: F3564111, from St. Louis to Orlando, Departure Time: 21:02, Arrival Time: 01:45", "breakfast": "-", "attraction": "SeaWorld Orlando, Orlando;", "lunch": "Hotel New Tamil Nadu, Orlando", "dinner": "Domino's Pizza, Orlando", "accommodation": "Sixth Ave Chelsea, Studio Serviced Apartment, Orlando"}, {"day": 2, "current_city": "Orlando", "transportation": "-", "breakfast": "Fuji Japanese Steakhouse, Orlando", "attraction": "The Wheel at ICON Park, Orlando;", "lunch": "Turquoise Villa, Orlando", "dinner": "The Tandoori Times, Orlando", "accommodation": "Sixth Ave Chelsea, Studio Serviced Apartment, Orlando"}, {"day": 3, "current_city": "from Orlando to Fort Myers", "transportation": "Flight Number: F3564762, from Orlando to Fort Myers, Departure Time: 12:45, Arrival Time: 13:35", "breakfast": "Crust N Cakes, Orlando", "attraction": "Edison & Ford Winter Estates, Fort Myers;", "lunch": "The Refinery, Fort Myers", "dinner": "Al Mukhtar Bakery, Fort Myers", "accommodation": "Great room in Greenwich Village!, Fort Myers"}, {"day": 4, "current_city": "Fort Myers", "transportation": "-", "breakfast": "Haunted, Fort Myers", "attraction": "Six Mile Cypress Slough Preserve, Fort Myers;", "lunch": "Eggers Madhouse, Fort Myers", "dinner": "Maachh Bhaat, Fort Myers", "accommodation": "Great room in Greenwich Village!, Fort Myers"}, {"day": 5, "current_city": "from Fort Myers to St. Louis", "transportation": "Flight Number: F3951040, from Fort Myers to St. Louis, Departure Time: 06:03, Arrival Time: 07:38", "breakfast": "The Refinery, Fort Myers", "attraction": "-", "lunch": "-", "dinner": "-", "accommodation": "-"}]}]