[{"gpt-4-1106-preview_direct_sole-planning_results": "Travel Plan:\n\nDay 1: March 25, 2022\nCurrent City: from Chicago to Boise\nTransportation: Flight Number: F3857813, from Chicago to Boise, Departure Time: 09:48, Arrival Time: 12:51\nLunch: Gopala Hari, Boise (Italian cuisine preference)\nAttraction: Zoo Boise, Boise\nDinner: California Pizza Kitchen, Boise (Italian cuisine preference)\nAccommodation: Modern & Cozy 2 BR Private Apartment in Brooklyn, Boise (fits the group size and budget)\n\nDay 2: March 26, 2022\nCurrent City: Boise\nTransportation: -\nBreakfast: Domino's Pizza, Boise (Italian cuisine preference)\nAttraction: Idaho State Museum, Boise; Boise Art Museum, Boise\nLunch: The Brewhouse, Boise (Italian cuisine preference)\nDinner: Underdoggs Sports Bar & Grill, Boise (Italian cuisine preference)\nAccommodation: Modern & Cozy 2 BR Private Apartment in Brooklyn, Boise\n\nDay 3: March 27, 2022\nCurrent City: from Boise to Pocatello\nTransportation: Self-driving, from Boise to Pocatello, duration: 3 hours 25 mins, distance: 378 km, cost: 18\nBreakfast: Gopala Hari, Boise (Italian cuisine preference)\nAttraction: Idaho Museum of Natural History, Pocatello\nLunch: Deorio's, Pocatello (Italian cuisine preference)\nDinner: 650 - The Global Kitchen, Pocatello (Italian cuisine preference)\nAccommodation: Entire Modern Studio Apartment/Prime Location, Pocatello\n\nDay 4: March 28, 2022\nCurrent City: Pocatello\nTransportation: -\nBreakfast: Deorio's, Pocatello (Italian cuisine preference)\nAttraction: Museum of Clean, Pocatello; Zoo Idaho, Pocatello\nLunch: Bocca Di Lupo, Pocatello (Italian cuisine preference)\nDinner: Bone Daddies, Pocatello (Italian cuisine preference)\nAccommodation: Entire Modern Studio Apartment/Prime Location, Pocatello\n\nDay 5: March 29, 2022\nCurrent City: from Pocatello to Idaho Falls\nTransportation: Self-driving, from Pocatello to Idaho Falls, duration: 51 mins, distance: 83.6 km, cost: 4\nBreakfast: Harvest Moon, Pocatello\nAttraction: Museum of Idaho, Idaho Falls; The Art Museum Of Eastern Idaho, Idaho Falls\nLunch: Taste of China, Idaho Falls (Chinese cuisine preference)\nDinner: Karim's, Idaho Falls (Italian cuisine preference)\nAccommodation: Sunny & Spacious 2 bdrm apt, Idaho Falls\n\nDay 6: March 30, 2022\nCurrent City: Idaho Falls\nTransportation: -\nBreakfast: Shiv Restaurant, Idaho Falls\nAttraction: Idaho Falls Zoo at Tautphaus Park, Idaho Falls; Idaho Falls River Walk - Greenbelt Trail, Idaho Falls\nLunch: Chinese X'Press, Idaho Falls (Chinese cuisine preference)\nDinner: Dhuaan, Idaho Falls (Italian cuisine preference)\nAccommodation: Sunny & Spacious 2 bdrm apt, Idaho Falls\n\nDay 7: March 31, 2022\nCurrent City: from Idaho Falls to Chicago\nTransportation: Self-driving, from Idaho Falls to Chicago, duration: 21 hours 43 mins, distance: 2,369 km, cost: 118\nBreakfast: Karim's, Idaho Falls (Italian cuisine preference)\nAttraction: - (Travel day back to Chicago)\nLunch: - (On the road)\nDinner: - (On the road)\nAccommodation: -\n\nPlease note that the transportation costs for self-driving are estimated based on the information provided and may vary depending on the vehicle used and current fuel prices. The accommodation choices are based on the group size and the preference for entire home/apt options. Dining options have been selected to match the group's interest in Italian and Chinese cuisines. The attractions chosen are unique to each city and do not repeat. The budget has been considered, and the plan is designed to stay within the $22,200 limit.", "gpt-4-1106-preview_direct_sole-planning_parsed_results": [{"day": 1, "current_city": "from Chicago to Boise", "transportation": "Flight Number: F3857813, from Chicago to Boise, Departure Time: 09:48, Arrival Time: 12:51", "breakfast": "-", "attraction": "Zoo Boise, Boise", "lunch": "Gopala Hari, Boise", "dinner": "California Pizza Kitchen, Boise", "accommodation": "Modern & Cozy 2 BR Private Apartment in Brooklyn, Boise"}, {"day": 2, "current_city": "Boise", "transportation": "-", "breakfast": "Domino's Pizza, Boise", "attraction": "Idaho State Museum, Boise; Boise Art Museum, Boise", "lunch": "The Brewhouse, Boise", "dinner": "Underdoggs Sports Bar & Grill, Boise", "accommodation": "Modern & Cozy 2 BR Private Apartment in Brooklyn, Boise"}, {"day": 3, "current_city": "from Boise to Pocatello", "transportation": "Self-driving, from Boise to Pocatello, Duration: 3 hours 25 mins, Distance: 378 km, Cost: 18", "breakfast": "Gopala Hari, Boise", "attraction": "Idaho Museum of Natural History, Pocatello", "lunch": "Deorio's, Pocatello", "dinner": "650 - The Global Kitchen, Pocatello", "accommodation": "Entire Modern Studio Apartment/Prime Location, Pocatello"}, {"day": 4, "current_city": "Pocatello", "transportation": "-", "breakfast": "Deorio's, Pocatello", "attraction": "Museum of Clean, Pocatello; Zoo Idaho, Pocatello", "lunch": "Bocca Di Lupo, Pocatello", "dinner": "Bone Daddies, Pocatello", "accommodation": "Entire Modern Studio Apartment/Prime Location, Pocatello"}, {"day": 5, "current_city": "from Pocatello to Idaho Falls", "transportation": "Self-driving, from Pocatello to Idaho Falls, Duration: 51 mins, Distance: 83.6 km, Cost: 4", "breakfast": "Harvest Moon, Pocatello", "attraction": "Museum of Idaho, Idaho Falls; The Art Museum Of Eastern Idaho, Idaho Falls", "lunch": "Taste of China, Idaho Falls", "dinner": "Karim's, Idaho Falls", "accommodation": "Sunny & Spacious 2 bdrm apt, Idaho Falls"}, {"day": 6, "current_city": "Idaho Falls", "transportation": "-", "breakfast": "Shiv Restaurant, Idaho Falls", "attraction": "Idaho Falls Zoo at Tautphaus Park, Idaho Falls; Idaho Falls River Walk - Greenbelt Trail, Idaho Falls", "lunch": "Chinese X'Press, Idaho Falls", "dinner": "Dhuaan, Idaho Falls", "accommodation": "Sunny & Spacious 2 bdrm apt, Idaho Falls"}, {"day": 7, "current_city": "from Idaho Falls to Chicago", "transportation": "Self-driving, from Idaho Falls to Chicago, Duration: 21 hours 43 mins, Distance: 2369 km, Cost: 118", "breakfast": "Karim's, Idaho Falls", "attraction": "-", "lunch": "-", "dinner": "-", "accommodation": "-"}]}]