[{"gpt-4-1106-preview_direct_sole-planning_results": "Travel Plan:\n\nDay 1: March 3, 2022\nCurrent City: Key West to Houston\nTransportation: Flight Number: F4041792, from Key West to Houston, Departure Time: 16:55, Arrival Time: 19:01, Cost: $218 per person\nBreakfast: - (Assuming departure from Key West after breakfast)\nAttraction: -\nLunch: - (Assuming lunch before departure)\nDinner: Jalapenos, Houston, Cost: $57, Cuisines: \"Desserts, Tea, Cafe, Chinese, Seafood\"\nAccommodation: Sunny and Airy near Manhattan, Houston, Cost: $499, Entire home/apt, House Rules: No pets\n\nNumber of People = 2\nTotal Cost = 2 * $218 + 2 * $57 + $499 = $1049\n\nDay 2: March 4, 2022\nCurrent City: Houston\nTransportation: -\nBreakfast: Sheetla Dhaba, Houston, Cost: $35, Cuisines: \"Desserts, Pizza, Bakery, American, Mediterranean\"\nAttraction: Space Center Houston, Houston\nLunch: Pebble Street, Houston, Cost: $73, Cuisines: \"Tea, American, Mediterranean, BBQ\"\nDinner: The BrewMaster - The Mix Fine Dine, Houston, Cost: $52, Cuisines: \"French, Indian, Cafe, Seafood\"\nAccommodation: Sunny and Airy near Manhattan, Houston, Cost: $499, Entire home/apt, House Rules: No pets\n\nNumber of People = 2\nTotal Cost = 2 * $35 + 2 * $73 + 2 * $52 + $499 = $819\n\nDay 3: March 5, 2022\nCurrent City: Houston to San Antonio\nTransportation: Flight Number: F3902584, from Houston to San Antonio, Departure Time: 20:34, Arrival Time: 21:29, Cost: $45 per person\nBreakfast: Cyber Adda 24, Houston, Cost: $73, Cuisines: \"Chinese, Pizza, Bakery\"\nAttraction: Houston Museum of Natural Science, Houston\nLunch: Al Arabian Express, Houston, Cost: $74, Cuisines: \"BBQ, Desserts, Seafood\"\nDinner: Cafe Le Rue @ The Landings, San Antonio, Cost: $19, Cuisines: \"French, Mexican, Cafe, Seafood\"\nAccommodation: Spacious, bright room, prime Williamsburg location, San Antonio, Cost: $900, Entire home/apt, House Rules: No pets\n\nNumber of People = 2\nTotal Cost = 2 * $45 + 2 * $73 + 2 * $74 + 2 * $19 + $900 = $1252\n\nDay 4: March 6, 2022\nCurrent City: San Antonio\nTransportation: -\nBreakfast: Sona Bakers, San Antonio, Cost: $20, Cuisines: \"Mexican, Bakery, Seafood\"\nAttraction: The Alamo, San Antonio\nLunch: Martin's BBQ, San Antonio, Cost: $71, Cuisines: \"Tea, BBQ, Fast Food, Indian, Seafood\"\nDinner: Minerva's Food & Cocktails, San Antonio, Cost: $99, Cuisines: \"Cafe, Bakery, BBQ, Seafood\"\nAccommodation: Spacious, bright room, prime Williamsburg location, San Antonio, Cost: $900, Entire home/apt, House Rules: No pets\n\nNumber of People = 2\nTotal Cost = 2 * $20 + 2 * $71 + 2 * $99 + $900 = $1280\n\nDay 5: March 7, 2022\nCurrent City: San Antonio to Dallas\nTransportation: Flight Number: F3999432, from San Antonio to Dallas, Departure Time: 10:01, Arrival Time: 10:54, Cost: $75 per person\nBreakfast: Paramjeet Machi Wala, San Antonio, Cost: $31, Cuisines: \"Bakery, Indian, Fast Food\"\nAttraction: San Antonio River Walk, San Antonio\nLunch: DEL - Roseate House, San Antonio, Cost: $63, Cuisines: \"Fast Food, French, Mexican, Seafood\"\nDinner: Coconuts Fish Cafe, Dallas, Cost: $38, Cuisines: \"Cafe, BBQ, Mediterranean, Fast Food\"\nAccommodation: Luxury Williamsburg duplex, private roof terrace, Dallas, Cost: $241, Entire home/apt, House Rules: No visitors\n\nNumber of People = 2\nTotal Cost = 2 * $75 + 2 * $31 + 2 * $63 + 2 * $38 + $241 = $655\n\nDay 6: March 8, 2022\nCurrent City: Dallas\nTransportation: -\nBreakfast: Aravali Owls, Dallas, Cost: $53, Cuisines: \"Pizza, Italian, Bakery, Fast Food, Cafe\"\nAttraction: The Dallas World Aquarium, Dallas\nLunch: 1918 Bistro & Grill, Dallas, Cost: $90, Cuisines: \"Tea, Pizza, BBQ, Seafood\"\nDinner: Yanki Sizzlers, Dallas, Cost: $96, Cuisines: \"Cafe, French, Tea, Mediterranean\"\nAccommodation: Luxury Williamsburg duplex, private roof terrace, Dallas, Cost: $241, Entire home/apt, House Rules: No visitors\n\nNumber of People = 2\nTotal Cost = 2 * $53 + 2 * $90 + 2 * $96 + $241 = $719\n\nDay 7: March 9, 2022\nCurrent City: Dallas to Key West\nTransportation: Flight Number: F3666117, from Dallas to Key West, Departure Time: 17:01, Arrival Time: 20:41, Cost: $222 per person\nBreakfast: Kebab Xpress, Dallas, Cost: $93, Cuisines: \"Tea, Bakery, Pizza, Mediterranean\"\nAttraction: Reunion Tower, Dallas\nLunch: Drifters Cafe, Dallas, Cost: $21, Cuisines: \"Tea, French, Mexican, Cafe, Seafood\"\nDinner: - (Assuming dinner upon arrival in Key West)\nAccommodation: - (Assuming return to home in Key West)\n\nNumber of People = 2\nTotal Cost = 2 * $222 + 2 * $93 + 2 * $21 = $698\n\nTotal cost across all days = $1049 + $819 + $1252 + $1280 + $655 + $719 + $698 = $6472\n\nCuisines: Mexican, Italian, Chinese, and American cuisines have been included in the dining options.\n\nNote: The accommodations selected allow parties and provide entire rooms/apartments as per the requirement. The total cost is within the specified budget of $7,200. Attractions have been included where possible, and no restaurant or attraction is repeated. Transportation modes are consistent with the city sequence and within the travel dates.", "gpt-4-1106-preview_direct_sole-planning_parsed_results": [{"day": 1, "current_city": "from Key West to Houston", "transportation": "Flight Number: F4041792, from Key West to Houston, Departure Time: 16:55, Arrival Time: 19:01", "breakfast": "-", "attraction": "-", "lunch": "-", "dinner": "Jalapenos, Houston", "accommodation": "Sunny and Airy near Manhattan, Houston"}, {"day": 2, "current_city": "Houston", "transportation": "-", "breakfast": "Sheetla Dhaba, Houston", "attraction": "Space Center Houston, Houston", "lunch": "Pebble Street, Houston", "dinner": "The BrewMaster - The Mix Fine Dine, Houston", "accommodation": "Sunny and Airy near Manhattan, Houston"}, {"day": 3, "current_city": "from Houston to San Antonio", "transportation": "Flight Number: F3902584, from Houston to San Antonio, Departure Time: 20:34, Arrival Time: 21:29", "breakfast": "Cyber Adda 24, Houston", "attraction": "Houston Museum of Natural Science, Houston", "lunch": "Al Arabian Express, Houston", "dinner": "Cafe Le Rue @ The Landings, San Antonio", "accommodation": "Spacious, bright room, prime Williamsburg location, San Antonio"}, {"day": 4, "current_city": "San Antonio", "transportation": "-", "breakfast": "Sona Bakers, San Antonio", "attraction": "The Alamo, San Antonio", "lunch": "Martin's BBQ, San Antonio", "dinner": "Minerva's Food & Cocktails, San Antonio", "accommodation": "Spacious, bright room, prime Williamsburg location, San Antonio"}, {"day": 5, "current_city": "from San Antonio to Dallas", "transportation": "Flight Number: F3999432, from San Antonio to Dallas, Departure Time: 10:01, Arrival Time: 10:54", "breakfast": "Paramjeet Machi Wala, San Antonio", "attraction": "San Antonio River Walk, San Antonio", "lunch": "DEL - Roseate House, San Antonio", "dinner": "Coconuts Fish Cafe, Dallas", "accommodation": "Luxury Williamsburg duplex, private roof terrace, Dallas"}, {"day": 6, "current_city": "Dallas", "transportation": "-", "breakfast": "Aravali Owls, Dallas", "attraction": "The Dallas World Aquarium, Dallas", "lunch": "1918 Bistro & Grill, Dallas", "dinner": "Yanki Sizzlers, Dallas", "accommodation": "Luxury Williamsburg duplex, private roof terrace, Dallas"}, {"day": 7, "current_city": "from Dallas to Key West", "transportation": "Flight Number: F3666117, from Dallas to Key West, Departure Time: 17:01, Arrival Time: 20:41", "breakfast": "Kebab Xpress, Dallas", "attraction": "Reunion Tower, Dallas", "lunch": "Drifters Cafe, Dallas", "dinner": "-", "accommodation": "-"}]}]