[{"gpt-4-1106-preview_direct_sole-planning_results": "Travel Plan:\n\nDay 1: March 24th, 2022\nCurrent City: from Atlanta to Chicago\nTransportation: Flight Number: F3492831, from Atlanta to Chicago, Departure Time: 20:59, Arrival Time: 21:47, Cost: $175 per person\nBreakfast: - (Assuming travelers will have breakfast before the trip starts)\nAttraction: - (Assuming arrival time does not allow for an attraction visit)\nLunch: - (Assuming travelers will have lunch before the trip starts)\nDinner: The Black Pearl, Chicago, Cost: $63 per person, Cuisines: \"Cafe, Bakery\"\nAccommodation: Newly Renovated Greenpoint Abode, Chicago, Cost: $981 per night, Entire home/apt, House Rules: No parties & No children under 10 & No smoking, Minimum Nights: 2, Maximum Occupancy: 7\n\nNumber of People = 2\nTotal Cost = 2 * $175 (flight) + 2 * $63 (dinner) + $981 (accommodation) = $1457\nAccommodation Minimum Nights: 1/2\n\nDay 2: March 25th, 2022\nCurrent City: Chicago\nTransportation: -\nBreakfast: Pantry d'or, Chicago, Cost: $53 per person, Cuisines: \"Tea, BBQ, Fast Food, Cafe, Indian\"\nAttraction: Millennium Park, Chicago\nLunch: Bro's Kitchenette, Chicago, Cost: $38 per person, Cuisines: \"Mexican, Desserts, Seafood\"\nDinner: Pizza Hut, Chicago, Cost: $99 per person, Cuisines: \"Pizza, French, Bakery, BBQ, Fast Food, American\"\nAccommodation: Newly Renovated Greenpoint Abode, Chicago, Cost: $981 per night, Entire home/apt, House Rules: No parties & No children under 10 & No smoking, Minimum Nights: 2, Maximum Occupancy: 7\n\nNumber of People = 2\nTotal Cost = 2 * $53 (breakfast) + 2 * $38 (lunch) + 2 * $99 (dinner) + $981 (accommodation) = $1351\nAccommodation Minimum Nights: 2/2\n\nDay 3: March 26th, 2022\nCurrent City: from Chicago to Atlanta\nTransportation: Flight Number: F3505549, from Chicago to Atlanta, Departure Time: 09:28, Arrival Time: 12:58, Cost: $155 per person\nBreakfast: - (Assuming breakfast at accommodation or airport)\nAttraction: - (Assuming early departure does not allow for an attraction visit)\nLunch: - (Assuming travelers will have lunch after arrival in Atlanta)\nDinner: - (Assuming travelers will have dinner after arrival in Atlanta)\nAccommodation: -\n\nNumber of People = 2\nTotal Cost = 2 * $155 (flight) = $310\n\nTotal cost across all days = $1457 (Day 1) + $1351 (Day 2) + $310 (Day 3) = $3118\n\nUnfortunately, the total cost exceeds the revised budget of $1,900. To adjust the plan within the budget, we can consider the following changes:\n\n1. Choose a less expensive accommodation option.\n2. Opt for more budget-friendly meal options.\n3. Consider alternative transportation methods if available within the budget.\n\nPlease note that the provided accommodation cost is for one night, and the minimum stay is two nights, which may not align with the budget constraints. Additionally, the costs for meals and attractions have not been included for all days, and the budget may not allow for these activities. Further adjustments will be needed to create a feasible plan within the specified budget.", "gpt-4-1106-preview_direct_sole-planning_parsed_results": [{"day": 1, "current_city": "from Atlanta to Chicago", "transportation": "Flight Number: F3492831, from Atlanta to Chicago, Departure Time: 20:59, Arrival Time: 21:47", "breakfast": "-", "attraction": "-", "lunch": "-", "dinner": "The Black Pearl, Chicago", "accommodation": "Newly Renovated Greenpoint Abode, Chicago"}, {"day": 2, "current_city": "Chicago", "transportation": "-", "breakfast": "Pantry d'or, Chicago", "attraction": "Millennium Park, Chicago", "lunch": "Bro's Kitchenette, Chicago", "dinner": "Pizza Hut, Chicago", "accommodation": "Newly Renovated Greenpoint Abode, Chicago"}, {"day": 3, "current_city": "from Chicago to Atlanta", "transportation": "Flight Number: F3505549, from Chicago to Atlanta, Departure Time: 09:28, Arrival Time: 12:58", "breakfast": "-", "attraction": "-", "lunch": "-", "dinner": "-", "accommodation": "-"}]}]