[{"gpt-4-1106-preview_direct_sole-planning_results": "Travel Plan:\n\nDay 1: March 17, 2022\nCurrent City: from Seattle to Orlando\nTransportation: Flight Number: F3508009, from Seattle to Orlando, Departure Time: 08:07, Arrival Time: 16:29, Cost: 706\nBreakfast: - (Assuming breakfast in Seattle or on the flight)\nAttraction: The Florida Aquarium, Tampa, Cost: 0 (Assuming tickets are pre-booked or covered by a city pass)\nLunch: Kobe Hibachi & Sushi, Tampa, Cost: 63, Cuisines: \"Desserts, French, BBQ, Bakery, Seafood\"\nDinner: The Tin Cow, Tampa, Cost: 67, Cuisines: \"BBQ, Desserts, Seafood\"\nAccommodation: Near all shopping & transportation, Tampa, Cost: 854, Entire home/apt, House Rules: No pets & No children under 10, Minimum Nights: 2\n\nNumber of People = 4\nTotal Cost = 4 * 706 + 4 * 63 + 4 * 67 + 854 = 4546\n\nDay 2: March 18, 2022\nCurrent City: Orlando\nTransportation: -\nBreakfast: Gallery Caf\u6106 - Hyatt Place, Tampa, Cost: 42, Cuisines: \"Tea, French, BBQ, Desserts\"\nAttraction: Busch Gardens Tampa Bay, Tampa\nLunch: Peg Leg Pete's, Tampa, Cost: 91, Cuisines: \"French, Bakery, Cafe\"\nDinner: Butterburrs, Tampa, Cost: 28, Cuisines: \"Pizza, Seafood\"\nAccommodation: Near all shopping & transportation, Tampa, Cost: 854, Entire home/apt, House Rules: No pets & No children under 10, Minimum Nights: 2\n\nNumber of People = 4\nTotal Cost = 4 * 42 + 4 * 91 + 4 * 28 + 854 = 1970\n\nDay 3: March 19, 2022\nCurrent City: Orlando\nTransportation: -\nBreakfast: The Zaffran, Tampa, Cost: 35, Cuisines: \"Tea, Bakery, Fast Food, American, Seafood\"\nAttraction: Adventure Island, Tampa\nLunch: Uptown Fresh Beer Cafe, Tampa, Cost: 61, Cuisines: \"Pizza, Mexican, BBQ, Cafe, Seafood\"\nDinner: Aahar, Tampa, Cost: 52, Cuisines: \"Tea, Pizza, Desserts, Fast Food\"\nAccommodation: Bright duplex apartment, Tampa, Cost: 164, Entire home/apt, House Rules: No children under 10, Minimum Nights: 2\n\nNumber of People = 4\nTotal Cost = 4 * 35 + 4 * 61 + 4 * 52 + 164 = 1220\n\nDay 4: March 20, 2022\nCurrent City: from Orlando to Panama City\nTransportation: Taxi, from Orlando to Panama City, duration: 5 hours 24 mins, distance: 574 km, cost: 574\nBreakfast: -\nAttraction: ZooWorld Zoological Park, Panama City\nLunch: The Chaiwalas, Panama City, Cost: 39, Cuisines: \"Tea, French, Bakery, Fast Food, Seafood\"\nDinner: The Old School Brew House, Panama City, Cost: 78, Cuisines: \"Cafe, Pizza, Indian, BBQ\"\nAccommodation: Plant-filled colorful Bushwick bedroom!, Panama City, Cost: 638, Private room, House Rules: No smoking & No parties, Minimum Nights: 5\n\nNumber of People = 4\nTotal Cost = 4 * 574 + 4 * 39 + 4 * 78 + 638 = 4230\n\nDay 5: March 21, 2022\nCurrent City: from Panama City to Tampa\nTransportation: Taxi, from Panama City to Tampa, duration: 5 hours 37 mins, distance: 603 km, cost: 603\nBreakfast: -\nAttraction: Tampa Bay History Center, Tampa\nLunch: Lalit Kathi Rolls Momos, Tampa, Cost: 23, Cuisines: \"Tea, Pizza, Fast Food\"\nDinner: Gallery Caf\u6106 - Hyatt Place, Tampa, Cost: 42, Cuisines: \"Tea, French, BBQ, Desserts\"\nAccommodation: Spacious 1+ bedroom apt in NYC, Tampa, Cost: 547, Entire home/apt, House Rules: No smoking & No parties & No children under 10, Minimum Nights: 1\n\nNumber of People = 4\nTotal Cost = 4 * 603 + 4 * 23 + 4 * 42 + 547 = 3829\n\nDay 6: March 22, 2022\nCurrent City: Tampa\nTransportation: -\nBreakfast: The Zaffran, Tampa, Cost: 35, Cuisines: \"Tea, Bakery, Fast Food, American, Seafood\"\nAttraction: The Florida Aquarium, Tampa\nLunch: Kobe Hibachi & Sushi, Tampa, Cost: 63, Cuisines: \"Desserts, French, BBQ, Bakery, Seafood\"\nDinner: The Tin Cow, Tampa, Cost: 67, Cuisines: \"BBQ, Desserts, Seafood\"\nAccommodation: Spacious 1+ bedroom apt in NYC, Tampa, Cost: 547, Entire home/apt, House Rules: No smoking & No parties & No children under 10, Minimum Nights: 1\n\nNumber of People = 4\nTotal Cost = 4 * 35 + 4 * 63 + 4 * 67 + 547 = 1970\n\nDay 7: March 23, 2022\nCurrent City: from Tampa to Seattle\nTransportation: Flight Number: F3749393, from Tampa to Seattle, Departure Time: 07:53, Arrival Time: 10:56, Cost: 1049\nBreakfast: -\nAttraction: -\nLunch: -\nDinner: -\nAccommodation: -\n\nNumber of People = 4\nTotal Cost = 4 * 1049 = 4196\n\nTotal cost across all days = 4546 + 1970 + 1220 + 4230 + 3829 + 1970 + 4196 = 21961\n\nNote: The total cost exceeds the specified budget of $14,700. To adjust the plan within the budget, consider choosing less expensive flights, accommodations, or reducing the number of attractions and dining out. Additionally, the accommodations chosen do not explicitly allow parties, which is a requirement in the query. Adjustments to the plan are needed to meet all constraints.", "gpt-4-1106-preview_direct_sole-planning_parsed_results": [{"day": 1, "current_city": "from Seattle to Orlando", "transportation": "Flight Number: F3508009, from Seattle to Orlando, Departure Time: 08:07, Arrival Time: 16:29", "breakfast": "-", "attraction": "The Florida Aquarium, Tampa", "lunch": "Kobe Hibachi & Sushi, Tampa", "dinner": "The Tin Cow, Tampa", "accommodation": "Near all shopping & transportation, Tampa"}, {"day": 2, "current_city": "Orlando", "transportation": "-", "breakfast": "Gallery Caf\u00e9 - Hyatt Place, Tampa", "attraction": "Busch Gardens Tampa Bay, Tampa", "lunch": "Peg Leg Pete's, Tampa", "dinner": "Butterburrs, Tampa", "accommodation": "Near all shopping & transportation, Tampa"}, {"day": 3, "current_city": "Orlando", "transportation": "-", "breakfast": "The Zaffran, Tampa", "attraction": "Adventure Island, Tampa", "lunch": "Uptown Fresh Beer Cafe, Tampa", "dinner": "Aahar, Tampa", "accommodation": "Bright duplex apartment, Tampa"}, {"day": 4, "current_city": "from Orlando to Panama City", "transportation": "Taxi, from Orlando to Panama City, duration: 5 hours 24 mins, distance: 574 km", "breakfast": "-", "attraction": "ZooWorld Zoological Park, Panama City", "lunch": "The Chaiwalas, Panama City", "dinner": "The Old School Brew House, Panama City", "accommodation": "Plant-filled colorful Bushwick bedroom!, Panama City"}, {"day": 5, "current_city": "from Panama City to Tampa", "transportation": "Taxi, from Panama City to Tampa, duration: 5 hours 37 mins, distance: 603 km", "breakfast": "-", "attraction": "Tampa Bay History Center, Tampa", "lunch": "Lalit Kathi Rolls Momos, Tampa", "dinner": "Gallery Caf\u00e9 - Hyatt Place, Tampa", "accommodation": "Spacious 1+ bedroom apt in NYC, Tampa"}, {"day": 6, "current_city": "Tampa", "transportation": "-", "breakfast": "The Zaffran, Tampa", "attraction": "The Florida Aquarium, Tampa", "lunch": "Kobe Hibachi & Sushi, Tampa", "dinner": "The Tin Cow, Tampa", "accommodation": "Spacious 1+ bedroom apt in NYC, Tampa"}, {"day": 7, "current_city": "from Tampa to Seattle", "transportation": "Flight Number: F3749393, from Tampa to Seattle, Departure Time: 07:53, Arrival Time: 10:56", "breakfast": "-", "attraction": "-", "lunch": "-", "dinner": "-", "accommodation": "-"}]}]