[{"gpt-4-1106-preview_direct_sole-planning_results": "Travel Plan:\n\nDay 1: March 24, 2022\nCurrent City: from Savannah to Houston\nTransportation: Flight Number: F4011368, from Savannah to Houston, Departure Time: 17:38, Arrival Time: 19:12, Cost: 202 * 7 = 1414\nBreakfast: -\nLunch: -\nDinner: Jalapenos, Houston, Cost: 57 * 7 = 399, Cuisines: \"Desserts, Tea, Cafe, Chinese, Seafood\"\nAccommodation: Sunny and Airy near Manhattan, Houston, Cost: 499 * 2 = 998, Maximum Occupancy: 4, House Rules: No pets, Minimum Nights: 2\n\nNumber of People = 7\nTotal Cost for Day 1 = 1414 + 399 + 998 = 2811\nAccommodation Minimum Nights: 1/2\n\nDay 2: March 25, 2022\nCurrent City: Houston\nTransportation: -\nBreakfast: Sheetla Dhaba, Houston, Cost: 35 * 7 = 245, Cuisines: \"Desserts, Pizza, Bakery, American, Mediterranean\"\nAttraction: Downtown Aquarium, Houston, Cost: -\nLunch: Royal Mart, Houston, Cost: 40 * 7 = 280, Cuisines: \"Tea, Bakery, Cafe, Mediterranean, Seafood\"\nAttraction: Space Center Houston, Cost: -\nDinner: Matchbox, Houston, Cost: 33 * 7 = 231, Cuisines: \"Tea, Italian, Bakery, Fast Food, Seafood\"\nAccommodation: Sunny and Airy near Manhattan, Houston, Cost: 499 * 2 = 998, Maximum Occupancy: 4, House Rules: No pets, Minimum Nights: 2\n\nNumber of People = 7\nTotal Cost for Day 2 = 245 + 280 + 231 + 998 = 1754\nAccommodation Minimum Nights: 2/2\n\nDay 3: March 26, 2022\nCurrent City: from Houston to Longview\nTransportation: Self-driving, from Houston to Longview, Cost: 17 * (7/5 ceiling) = 17 * 2 = 34\nBreakfast: Earthen Spices, Houston, Cost: 28 * 7 = 196, Cuisines: \"Tea, Mexican, Bakery, BBQ, Fast Food\"\nAttraction: Water Wall, Houston, Cost: -\nLunch: Cyber Adda 24, Houston, Cost: 73 * 7 = 511, Cuisines: \"Chinese, Pizza, Bakery\"\nAttraction: Houston Museum of Natural Science, Cost: -\nDinner: Vinayaka Mylari, Longview, Cost: 14 * 7 = 98, Cuisines: \"Fast Food, French, Cafe, Italian\"\nAccommodation: Your home away from home, private cozy room, Longview, Cost: 188 * 4 = 752, Maximum Occupancy: 2, House Rules: No children under 10 & No parties, Minimum Nights: 1\n\nNumber of People = 7\nTotal Cost for Day 3 = 34 + 196 + 511 + 98 + 752 = 1591\nAccommodation Minimum Nights: 1/1\n\nDay 4: March 27, 2022\nCurrent City: Longview\nTransportation: -\nBreakfast: Barbeque Nation, Longview, Cost: 26 * 7 = 182, Cuisines: \"Cafe, Bakery\"\nAttraction: Longview World of Wonders, Longview, Cost: -\nLunch: Apni Rasoi, Longview, Cost: 25 * 7 = 175, Cuisines: \"Desserts, Tea, Pizza, Italian, Seafood\"\nAttraction: Gregg County Historical Museum, Longview, Cost: -\nDinner: Monster's Cafe, Longview, Cost: 94 * 7 = 658, Cuisines: \"Tea, Bakery, Fast Food, Cafe, American, Mediterranean\"\nAccommodation: Cozy, bright Bohemian pad in NYC's Epic Village, Longview, Cost: 478 * 2 = 956, Maximum Occupancy: 4, House Rules: No parties, Minimum Nights: 5\n\nNumber of People = 7\nTotal Cost for Day 4 = 182 + 175 + 658 + 956 = 1971\nAccommodation Minimum Nights: 1/5\n\nDay 5: March 28, 2022\nCurrent City: from Longview to Dallas\nTransportation: Flight Number: F3602892, from Longview to Dallas, Departure Time: 06:20, Arrival Time: 07:14, Cost: 50 * 7 = 350\nBreakfast: Apna Restaurant, Longview, Cost: 17 * 7 = 119, Cuisines: \"American, BBQ, Fast Food\"\nAttraction: Lear Park, Longview, Cost: -\nLunch: Not Just Paranthas, Longview, Cost: 54 * 7 = 378, Cuisines: \"Desserts, Bakery, BBQ, Seafood\"\nAttraction: Dallas Museum of Art, Dallas, Cost: -\nDinner: Coconuts Fish Cafe, Dallas, Cost: 38 * 7 = 266, Cuisines: \"Cafe, BBQ, Mediterranean, Fast Food\"\nAccommodation: 1BR, elevator, kitchen, doorman!, Dallas, Cost: 475 * 2 = 950, Maximum Occupancy: 3, House Rules: No parties, Minimum Nights: 1\n\nNumber of People = 7\nTotal Cost for Day 5 = 350 + 119 + 378 + 266 + 950 = 2063\nAccommodation Minimum Nights: 1/1\n\nDay 6: March 29, 2022\nCurrent City: Dallas\nTransportation: -\nBreakfast: Cafe Gatherings, Dallas, Cost: 17 * 7 = 119, Cuisines: \"Bakery, Indian, Desserts\"\nAttraction: The Sixth Floor Museum at Dealey Plaza, Dallas, Cost: -\nLunch: Drifters Cafe, Dallas, Cost: 21 * 7 = 147, Cuisines: \"Tea, French, Mexican, Cafe, Seafood\"\nAttraction: Reunion Tower, Dallas, Cost: -\nDinner: Uma Foodies' Hut, Dallas, Cost: 49 * 7 = 343, Cuisines: \"French, Bakery, Seafood\"\nAccommodation: Luxury Williamsburg duplex, private roof terrace, Dallas, Cost: 241 * 2 = 482, Maximum Occupancy: 3, House Rules: No visitors, Minimum Nights: 4\n\nNumber of People = 7\nTotal Cost for Day 6 = 119 + 147 + 343 + 482 = 1091\nAccommodation Minimum Nights: 1/4\n\nDay 7: March 30, 2022\nCurrent City: from Dallas to Savannah\nTransportation: Flight Number: F3675920, from Dallas to Savannah, Departure Time: 13:39, Arrival Time: 17:02, Cost: 287 * 7 = 2009\nBreakfast: Puri Bakers, Dallas, Cost: 33 * 7 = 231, Cuisines: \"Pizza, Mexican, Bakery, Fast Food, Cafe, Indian\"\nAttraction: Klyde Warren Park, Dallas, Cost: -\nLunch: Metro Fast Food, Dallas, Cost: 45 * 7 = 315, Cuisines: \"Tea, Pizza, Mexican, Bakery, BBQ, American\"\nDinner: -\nAccommodation: -\n\nNumber of People = 7\nTotal Cost for Day 7 = 2009 + 231 + 315 = 2555\n\nTotal cost across all days = 2811 + 1754 + 1591 + 1971 + 2063 + 1091 + 2555 = 13836\n\nUnfortunately, the total cost of the proposed travel plan ($13,836) exceeds the budget of $3,200. Adjustments to the plan would be necessary to stay within budget. This could include selecting cheaper accommodations, reducing the number of attractions visited, or choosing more budget-friendly meal options.", "gpt-4-1106-preview_direct_sole-planning_parsed_results": [{"day": 1, "current_city": "from Savannah to Houston", "transportation": "Flight Number: F4011368, from Savannah to Houston, Departure Time: 17:38, Arrival Time: 19:12", "breakfast": "-", "attraction": "-", "lunch": "-", "dinner": "Jalapenos, Houston", "accommodation": "Sunny and Airy near Manhattan, Houston"}, {"day": 2, "current_city": "Houston", "transportation": "-", "breakfast": "Sheetla Dhaba, Houston", "attraction": "Downtown Aquarium, Houston;Space Center Houston, Houston;", "lunch": "Royal Mart, Houston", "dinner": "Matchbox, Houston", "accommodation": "Sunny and Airy near Manhattan, Houston"}, {"day": 3, "current_city": "from Houston to Longview", "transportation": "Self-driving, from Houston to Longview", "breakfast": "Earthen Spices, Houston", "attraction": "Water Wall, Houston;Houston Museum of Natural Science, Houston;", "lunch": "Cyber Adda 24, Houston", "dinner": "Vinayaka Mylari, Longview", "accommodation": "Your home away from home, private cozy room, Longview"}, {"day": 4, "current_city": "Longview", "transportation": "-", "breakfast": "Barbeque Nation, Longview", "attraction": "Longview World of Wonders, Longview;Gregg County Historical Museum, Longview;", "lunch": "Apni Rasoi, Longview", "dinner": "Monster's Cafe, Longview", "accommodation": "Cozy, bright Bohemian pad in NYC's Epic Village, Longview"}, {"day": 5, "current_city": "from Longview to Dallas", "transportation": "Flight Number: F3602892, from Longview to Dallas, Departure Time: 06:20, Arrival Time: 07:14", "breakfast": "Apna Restaurant, Longview", "attraction": "Lear Park, Longview;Dallas Museum of Art, Dallas;", "lunch": "Not Just Paranthas, Longview", "dinner": "Coconuts Fish Cafe, Dallas", "accommodation": "1BR, elevator, kitchen, doorman!, Dallas"}, {"day": 6, "current_city": "Dallas", "transportation": "-", "breakfast": "Cafe Gatherings, Dallas", "attraction": "The Sixth Floor Museum at Dealey Plaza, Dallas;Reunion Tower, Dallas;", "lunch": "Drifters Cafe, Dallas", "dinner": "Uma Foodies' Hut, Dallas", "accommodation": "Luxury Williamsburg duplex, private roof terrace, Dallas"}, {"day": 7, "current_city": "from Dallas to Savannah", "transportation": "Flight Number: F3675920, from Dallas to Savannah, Departure Time: 13:39, Arrival Time: 17:02", "breakfast": "Puri Bakers, Dallas", "attraction": "Klyde Warren Park, Dallas", "lunch": "Metro Fast Food, Dallas", "dinner": "-", "accommodation": "-"}]}]