[{"gpt-4-1106-preview_direct_sole-planning_results": "Travel Plan:\n\nDay 1: March 14, 2022\nCurrent City: from Eugene to Los Angeles\nTransportation: Flight Number: F3818922, from Eugene to Los Angeles, Departure Time: 16:33, Arrival Time: 18:47, Cost: $450 (225 * 2 people)\nBreakfast: - (Assuming travelers will have breakfast before departure)\nAttraction: Santa Monica Pier, Los Angeles, Cost: $0 (Assuming no entry fee)\nLunch: Onokabe, Los Angeles, Cost: $26 (13 * 2 people), Cuisines: \"Mexican, Bakery, Desserts, Fast Food\"\nDinner: Palmshore, Los Angeles, Cost: $50 (25 * 2 people), Cuisines: \"Desserts, Bakery, Fast Food, American, Seafood\"\nAccommodation: Lovely studio, Los Angeles, Cost: $234 (117 * 2 people), Maximum Occupancy: 3, House Rules: No Visitors, Minimum Nights: 1\n\nNumber of People = 2\nTotal Cost for Day 1 = 450 + 26 + 50 + 234 = $760\nAccommodation Minimum Nights: 1/1\n\nDay 2: March 15, 2022\nCurrent City: Los Angeles\nTransportation: -\nBreakfast: Choco Kraft, Los Angeles, Cost: $40 (20 * 2 people), Cuisines: \"French, BBQ, Fast Food, Cafe, Mediterranean\"\nAttraction: Griffith Observatory, Los Angeles, Cost: $0 (Assuming no entry fee)\nLunch: Chicken Minar, Los Angeles, Cost: $50 (25 * 2 people), Cuisines: \"Bakery, Fast Food\"\nDinner: Punjabi Zaika, Los Angeles, Cost: $92 (46 * 2 people), Cuisines: \"Pizza, Bakery, BBQ, Cafe, Indian\"\nAccommodation: Lovely studio, Los Angeles, Cost: $234 (117 * 2 people), Maximum Occupancy: 3, House Rules: No Visitors, Minimum Nights: 1\n\nNumber of People = 2\nTotal Cost for Day 2 = 40 + 50 + 92 + 234 = $416\nAccommodation Minimum Nights: 1/1\n\nDay 3: March 16, 2022\nCurrent City: from Los Angeles to Eugene\nTransportation: Flight Number: F3819973, from Los Angeles to Eugene, Departure Time: 13:35, Arrival Time: 16:03, Cost: $332 (166 * 2 people)\nBreakfast: Barista, Los Angeles, Cost: $58 (29 * 2 people), Cuisines: \"Tea, Cafe, Mexican\"\nAttraction: The Getty, Los Angeles, Cost: $0 (Assuming no entry fee)\nLunch: Rajdhani Restaurant, Los Angeles, Cost: $60 (30 * 2 people), Cuisines: \"Desserts, Tea, French, Bakery, Fast Food, Chinese\"\nDinner: - (Assuming travelers will have dinner after arrival in Eugene)\nAccommodation: -\n\nNumber of People = 2\nTotal Cost for Day 3 = 332 + 58 + 60 = $450\n\nTotal cost across all days = 760 + 416 + 450 = $1,626\n\nCuisines: The prompt specifies no preferred cuisines, so all cuisines constraints are satisfied.\n\nRemaining Budget: $1,700 - $1,626 = $74\n\nNote: The attractions chosen do not have an entry fee listed, and it is assumed that they are free to visit. If there is an entry fee, it would need to be considered within the budget. The accommodations chosen are entire rooms, as per the query requirement. The plan includes diverse meals and attractions and adheres to the budget constraints.", "gpt-4-1106-preview_direct_sole-planning_parsed_results": [{"day": 1, "current_city": "from Eugene to Los Angeles", "transportation": "Flight Number: F3818922, from Eugene to Los Angeles, Departure Time: 16:33, Arrival Time: 18:47", "breakfast": "-", "attraction": "Santa Monica Pier, Los Angeles;", "lunch": "Onokabe, Los Angeles", "dinner": "Palmshore, Los Angeles", "accommodation": "Lovely studio, Los Angeles"}, {"day": 2, "current_city": "Los Angeles", "transportation": "-", "breakfast": "Choco Kraft, Los Angeles", "attraction": "Griffith Observatory, Los Angeles;", "lunch": "Chicken Minar, Los Angeles", "dinner": "Punjabi Zaika, Los Angeles", "accommodation": "Lovely studio, Los Angeles"}, {"day": 3, "current_city": "from Los Angeles to Eugene", "transportation": "Flight Number: F3819973, from Los Angeles to Eugene, Departure Time: 13:35, Arrival Time: 16:03", "breakfast": "Barista, Los Angeles", "attraction": "The Getty, Los Angeles;", "lunch": "Rajdhani Restaurant, Los Angeles", "dinner": "-", "accommodation": "-"}]}]