[{"gpt-4-1106-preview_direct_sole-planning_results": "Travel Plan:\n\nDay 1: Chicago to Wilmington\nCurrent City: from Chicago to Wilmington\nTransportation: Self-driving, from Chicago to Wilmington, Duration: 14 hours 11 mins, Distance: 1,505 km, Cost: 75\nBreakfast: - (Assuming travelers will have breakfast before departure)\nAttraction: - (Traveling)\nLunch: - (On the road)\nDinner: - (On the road)\nAccommodation: Prime East Village location w/backyard garden!, Wilmington, Cost: 978, Room Type: Entire home/apt, House Rules: No pets & No smoking, Maximum Occupancy: 7\n\nNumber of People = 2\nTotal Cost = 2 * 75 (Transportation) + 978 (Accommodation) = 1128\nAccommodation Minimum Nights: 1/4\n\nDay 2: Wilmington\nCurrent City: Wilmington\nTransportation: -\nBreakfast: Azteca, Wilmington, Cost: 56, Cuisines: \"Cafe, Indian, BBQ\"\nAttraction: Bellamy Mansion Museum, Wilmington\nLunch: Bandit Burrito, Wilmington, Cost: 26, Cuisines: \"Desserts, French, Bakery, Fast Food, Seafood\"\nDinner: Moonie's Texas Barbecue, Wilmington, Cost: 38, Cuisines: \"Chinese, Bakery, Fast Food\"\nAccommodation: Prime East Village location w/backyard garden!, Wilmington, Cost: 978, Room Type: Entire home/apt, House Rules: No pets & No smoking, Maximum Occupancy: 7\n\nNumber of People = 2\nTotal Cost = 2 * 56 (Breakfast) + 2 * 26 (Lunch) + 2 * 38 (Dinner) + 978 (Accommodation) = 1218\nAccommodation Minimum Nights: 2/4\n\nDay 3: Wilmington to Charlotte\nCurrent City: from Wilmington to Charlotte\nTransportation: Self-driving, from Wilmington to Charlotte, Duration: 3 hours 24 mins, Distance: 324 km, Cost: 16\nBreakfast: Dunkin' Donuts, Wilmington, Cost: 25, Cuisines: \"Desserts, Tea, Pizza, Italian, French\"\nAttraction: Wilmington Riverwalk, Wilmington\nLunch: Taco Bus, Wilmington, Cost: 59, Cuisines: \"Tea, Cafe, BBQ\"\nDinner: Olive Tree Cafe, Charlotte, Cost: 23, Cuisines: \"Tea, Chinese, Desserts\"\nAccommodation: Cute Greenpoint room, Charlotte, Cost: 335, Room Type: Private room, House Rules: No children under 10 & No pets, Maximum Occupancy: 1\n\nNumber of People = 2\nTotal Cost = 2 * 16 (Transportation) + 2 * 25 (Breakfast) + 2 * 59 (Lunch) + 2 * 23 (Dinner) + 335 (Accommodation) = 556\nAccommodation Minimum Nights: 1/3\n\nDay 4: Charlotte\nCurrent City: Charlotte\nTransportation: -\nBreakfast: Central Perk 7, Charlotte, Cost: 87, Cuisines: \"Pizza, Bakery, BBQ, Fast Food\"\nAttraction: Freedom Park, Charlotte; Levine Museum of the New South, Charlotte\nLunch: Cafe Maple Street, Charlotte, Cost: 91, Cuisines: \"Fast Food, Tea, Italian\"\nDinner: Kylin Skybar, Charlotte, Cost: 44, Cuisines: \"Tea, Cafe, Pizza, Italian\"\nAccommodation: Cute Greenpoint room, Charlotte, Cost: 335, Room Type: Private room, House Rules: No children under 10 & No pets, Maximum Occupancy: 1\n\nNumber of People = 2\nTotal Cost = 2 * 87 (Breakfast) + 2 * 91 (Lunch) + 2 * 44 (Dinner) + 335 (Accommodation) = 779\nAccommodation Minimum Nights: 2/3\n\nDay 5: Charlotte to Chicago\nCurrent City: from Charlotte to Chicago\nTransportation: Self-driving, from Charlotte to Chicago, Duration: 11 hours 39 mins, Distance: 1,215 km, Cost: 60\nBreakfast: Subway, Charlotte, Cost: 60, Cuisines: \"Tea, Cafe, Mexican, Chinese, Seafood\"\nAttraction: - (Traveling)\nLunch: - (On the road)\nDinner: - (On the road)\nAccommodation: -\n\nNumber of People = 2\nTotal Cost = 2 * 60 (Transportation) + 2 * 60 (Breakfast) = 240\n\nTotal cost across all days = 1128 + 1218 + 556 + 779 + 240 = 3921\n\nNote: The total cost exceeds the budget of $3,600. To stay within budget, consider adjusting meal choices or finding more affordable accommodation. Additionally, the accommodation chosen does not allow pets, which is a requirement. Please find pet-friendly accommodation options to meet the query constraints.", "gpt-4-1106-preview_direct_sole-planning_parsed_results": [{"day": 1, "current_city": "from Chicago to Wilmington", "transportation": "Self-driving, from Chicago to Wilmington, Duration: 14 hours 11 mins, Distance: 1,505 km", "breakfast": "-", "attraction": "-", "lunch": "-", "dinner": "-", "accommodation": "Prime East Village location w/backyard garden!, Wilmington"}, {"day": 2, "current_city": "Wilmington", "transportation": "-", "breakfast": "Azteca, Wilmington", "attraction": "Bellamy Mansion Museum, Wilmington;", "lunch": "Bandit Burrito, Wilmington", "dinner": "Moonie's Texas Barbecue, Wilmington", "accommodation": "Prime East Village location w/backyard garden!, Wilmington"}, {"day": 3, "current_city": "from Wilmington to Charlotte", "transportation": "Self-driving, from Wilmington to Charlotte, Duration: 3 hours 24 mins, Distance: 324 km", "breakfast": "Dunkin' Donuts, Wilmington", "attraction": "Wilmington Riverwalk, Wilmington;", "lunch": "Taco Bus, Wilmington", "dinner": "Olive Tree Cafe, Charlotte", "accommodation": "Cute Greenpoint room, Charlotte"}, {"day": 4, "current_city": "Charlotte", "transportation": "-", "breakfast": "Central Perk 7, Charlotte", "attraction": "Freedom Park, Charlotte;Levine Museum of the New South, Charlotte;", "lunch": "Cafe Maple Street, Charlotte", "dinner": "Kylin Skybar, Charlotte", "accommodation": "Cute Greenpoint room, Charlotte"}, {"day": 5, "current_city": "from Charlotte to Chicago", "transportation": "Self-driving, from Charlotte to Chicago, Duration: 11 hours 39 mins, Distance: 1,215 km", "breakfast": "Subway, Charlotte", "attraction": "-", "lunch": "-", "dinner": "-", "accommodation": "-"}]}]