[{"gpt-4-1106-preview_direct_sole-planning_results": "Travel Plan:\n\nDay 1: March 12, 2022\nCurrent City: from New Orleans to Miami\nTransportation: Flight Number: F3660109, from New Orleans to Miami, Departure Time: 08:24, Arrival Time: 11:43\nBreakfast: - (Assuming breakfast in New Orleans before departure)\nAttraction: Jungle Island, Miami\nLunch: Papouli's Mediterranean Cafe & Market, Miami\nDinner: AB's Absolute Barbecues, Miami\nAccommodation: \"HELLO BROOKLYN\" PARK SIDE VIEW NEWLY RENO APT., Miami (Entire home/apt)\n\nDay 2: March 13, 2022\nCurrent City: Miami\nTransportation: -\nBreakfast: Clocked, Miami\nAttraction: P\u00e9rez Art Museum Miami, Miami; Wynwood Walls, Miami\nLunch: Tako Cheena by Pom Pom, Miami\nDinner: Anjlika, Miami\nAccommodation: \"HELLO BROOKLYN\" PARK SIDE VIEW NEWLY RENO APT., Miami (Entire home/apt)\n\nDay 3: March 14, 2022\nCurrent City: from Miami to Tampa\nTransportation: Flight Number: F3670101, from Miami to Tampa, Departure Time: 09:44, Arrival Time: 10:38\nBreakfast: - (Assuming breakfast in Miami before departure)\nAttraction: The Florida Aquarium, Tampa; Busch Gardens Tampa Bay, Tampa\nLunch: Kobe Hibachi & Sushi, Tampa\nDinner: Peg Leg Pete's, Tampa\nAccommodation: Perfect Two Bed Railroad Style Apartment, Tampa (Entire home/apt)\n\nDay 4: March 15, 2022\nCurrent City: Tampa\nTransportation: -\nBreakfast: Lalit Kathi Rolls Momos, Tampa\nAttraction: Adventure Island, Tampa; Henry B. Plant Museum, Tampa\nLunch: Uptown Fresh Beer Cafe, Tampa\nDinner: Gallery Caf\u6106 - Hyatt Place, Tampa\nAccommodation: Perfect Two Bed Railroad Style Apartment, Tampa (Entire home/apt)\n\nDay 5: March 16, 2022\nCurrent City: from Tampa to New Orleans\nTransportation: Flight Number: F4007107, from Tampa to New Orleans, Departure Time: 06:58, Arrival Time: 07:30\nBreakfast: - (Assuming breakfast in Tampa before departure)\nAttraction: - (No time for attractions due to early flight)\nLunch: - (Assuming lunch upon arrival in New Orleans)\nDinner: - (Assuming dinner in New Orleans after arrival)\nAccommodation: -\n\nTotal Estimated Costs:\nFlights: $188 (New Orleans to Miami) + $56 (Miami to Tampa) + $124 (Tampa to New Orleans) = $368\nAccommodations: $789 x 2 nights (Miami) + $1093 x 2 nights (Tampa) = $3764\nRemaining Budget for Meals and Attractions: $4200 - $368 (Flights) - $3764 (Accommodations) = $68\n\nNote: The remaining budget is very limited for meals and attractions. The plan assumes that the cost of meals and attractions will be covered within this remaining budget, which may not be realistic. Additional budget considerations may be necessary.", "gpt-4-1106-preview_direct_sole-planning_parsed_results": [{"day": 1, "current_city": "from New Orleans to Miami", "transportation": "Flight Number: F3660109, from New Orleans to Miami, Departure Time: 08:24, Arrival Time: 11:43", "breakfast": "-", "attraction": "Jungle Island, Miami;", "lunch": "Papouli's Mediterranean Cafe & Market, Miami", "dinner": "AB's Absolute Barbecues, Miami", "accommodation": "\"HELLO BROOKLYN\" PARK SIDE VIEW NEWLY RENO APT., Miami"}, {"day": 2, "current_city": "Miami", "transportation": "-", "breakfast": "Clocked, Miami", "attraction": "P\u00e9rez Art Museum Miami, Miami; Wynwood Walls, Miami;", "lunch": "Tako Cheena by Pom Pom, Miami", "dinner": "Anjlika, Miami", "accommodation": "\"HELLO BROOKLYN\" PARK SIDE VIEW NEWLY RENO APT., Miami"}, {"day": 3, "current_city": "from Miami to Tampa", "transportation": "Flight Number: F3670101, from Miami to Tampa, Departure Time: 09:44, Arrival Time: 10:38", "breakfast": "-", "attraction": "The Florida Aquarium, Tampa; Busch Gardens Tampa Bay, Tampa;", "lunch": "Kobe Hibachi & Sushi, Tampa", "dinner": "Peg Leg Pete's, Tampa", "accommodation": "Perfect Two Bed Railroad Style Apartment, Tampa"}, {"day": 4, "current_city": "Tampa", "transportation": "-", "breakfast": "Lalit Kathi Rolls Momos, Tampa", "attraction": "Adventure Island, Tampa; Henry B. Plant Museum, Tampa;", "lunch": "Uptown Fresh Beer Cafe, Tampa", "dinner": "Gallery Caf\u6106 - Hyatt Place, Tampa", "accommodation": "Perfect Two Bed Railroad Style Apartment, Tampa"}, {"day": 5, "current_city": "from Tampa to New Orleans", "transportation": "Flight Number: F4007107, from Tampa to New Orleans, Departure Time: 06:58, Arrival Time: 07:30", "breakfast": "-", "attraction": "-", "lunch": "-", "dinner": "-", "accommodation": "-"}]}]