[{"gpt-4-1106-preview_direct_sole-planning_results": "Travel Plan:\n\nDay 1: March 7, 2022\nCurrent City: from Dallas to Grand Island\nTransportation: Flight Number: F3597258, from Dallas to Grand Island, Departure Time: 12:52, Arrival Time: 14:25\nLunch: Locos Grill & Pub, Grand Island\nAttraction: Stuhr Museum, Grand Island\nDinner: Thai Pepper, Grand Island\nAccommodation: Two Bedrooms in Bright Brooklyn Home, Grand Island\n\nDay 2: March 8, 2022\nCurrent City: Grand Island\nTransportation: -\nBreakfast: Chicken Bytes, Grand Island\nAttraction: Hear Grand Island, Grand Island\nLunch: Madurai Meenakshi Bhawan, Grand Island\nDinner: FatPlates, Grand Island\nAccommodation: Two Bedrooms in Bright Brooklyn Home, Grand Island\n\nDay 3: March 9, 2022\nCurrent City: from Grand Island to North Platte\nTransportation: Self-driving, from Grand Island to North Platte, duration: 2 hours 14 mins, distance: 235 km, cost: 11\nBreakfast: Chaayos, Grand Island\nAttraction: Buffalo Bill Ranch State Historical Park Museum, North Platte\nLunch: Whitebull Hotel, North Platte\nDinner: Violet Hour, North Platte\nAccommodation: Comfortable, eclectic and private apartment, North Platte\n\nDay 4: March 10, 2022\nCurrent City: North Platte\nTransportation: -\nBreakfast: Surprise O Meal, North Platte\nAttraction: Golden Spike Tower, North Platte; Cody Park Railroad Museum, North Platte\nLunch: Maa Bhagwati Tiffins, North Platte\nDinner: AB's - Absolute Barbecues, North Platte\nAccommodation: Comfortable, eclectic and private apartment, North Platte\n\nDay 5: March 11, 2022\nCurrent City: from North Platte to Omaha\nTransportation: Self-driving, from North Platte to Omaha, duration: 4 hours 3 mins, distance: 451 km, cost: 22\nBreakfast: Smelling Salts, North Platte\nAttraction: Omaha's Henry Doorly Zoo and Aquarium, Omaha\nLunch: Last Resort Grill, Omaha\nDinner: Gazebo, Omaha\nAccommodation: NYC HUB GuestRoom: Train @ 900ft; midtown 30min!, Omaha\n\nDay 6: March 12, 2022\nCurrent City: Omaha\nTransportation: -\nBreakfast: Hong Kong Chinese Restaurant, Omaha\nAttraction: The Durham Museum, Omaha; Omaha Children's Museum, Omaha\nLunch: Crafted Blends, Omaha\nDinner: CakeBee, Omaha\nAccommodation: NYC HUB GuestRoom: Train @ 900ft; midtown 30min!, Omaha\n\nDay 7: March 13, 2022\nCurrent City: from Omaha to Dallas\nTransportation: Flight Number: F3603815, from Omaha to Dallas, Departure Time: 09:35, Arrival Time: 11:28\nBreakfast: Aapki Rasoi, Omaha\nAttraction: Lauritzen Gardens/Kenefick Park, Omaha (if time permits before flight)\nLunch: - (likely in-flight or upon arrival in Dallas)\nDinner: -\nAccommodation: -\n\nPlease note that the accommodation choices are based on the minimum nights required and the maximum occupancy available. The restaurants and attractions were selected to avoid repetition and to provide a diverse experience. The transportation options were chosen based on the availability and budget constraints.", "gpt-4-1106-preview_direct_sole-planning_parsed_results": [{"day": 1, "current_city": "from Dallas to Grand Island", "transportation": "Flight Number: F3597258, from Dallas to Grand Island, Departure Time: 12:52, Arrival Time: 14:25", "breakfast": "-", "attraction": "Stuhr Museum, Grand Island;", "lunch": "Locos Grill & Pub, Grand Island", "dinner": "Thai Pepper, Grand Island", "accommodation": "Two Bedrooms in Bright Brooklyn Home, Grand Island"}, {"day": 2, "current_city": "Grand Island", "transportation": "-", "breakfast": "Chicken Bytes, Grand Island", "attraction": "Hear Grand Island, Grand Island;", "lunch": "Madurai Meenakshi Bhawan, Grand Island", "dinner": "FatPlates, Grand Island", "accommodation": "Two Bedrooms in Bright Brooklyn Home, Grand Island"}, {"day": 3, "current_city": "from Grand Island to North Platte", "transportation": "Self-driving, from Grand Island to North Platte, duration: 2 hours 14 mins, distance: 235 km, Cost: 11", "breakfast": "Chaayos, Grand Island", "attraction": "Buffalo Bill Ranch State Historical Park Museum, North Platte;", "lunch": "Whitebull Hotel, North Platte", "dinner": "Violet Hour, North Platte", "accommodation": "Comfortable, eclectic and private apartment, North Platte"}, {"day": 4, "current_city": "North Platte", "transportation": "-", "breakfast": "Surprise O Meal, North Platte", "attraction": "Golden Spike Tower, North Platte; Cody Park Railroad Museum, North Platte;", "lunch": "Maa Bhagwati Tiffins, North Platte", "dinner": "AB's - Absolute Barbecues, North Platte", "accommodation": "Comfortable, eclectic and private apartment, North Platte"}, {"day": 5, "current_city": "from North Platte to Omaha", "transportation": "Self-driving, from North Platte to Omaha, duration: 4 hours 3 mins, distance: 451 km, Cost: 22", "breakfast": "Smelling Salts, North Platte", "attraction": "Omaha's Henry Doorly Zoo and Aquarium, Omaha;", "lunch": "Last Resort Grill, Omaha", "dinner": "Gazebo, Omaha", "accommodation": "NYC HUB GuestRoom: Train @ 900ft; midtown 30min!, Omaha"}, {"day": 6, "current_city": "Omaha", "transportation": "-", "breakfast": "Hong Kong Chinese Restaurant, Omaha", "attraction": "The Durham Museum, Omaha; Omaha Children's Museum, Omaha;", "lunch": "Crafted Blends, Omaha", "dinner": "CakeBee, Omaha", "accommodation": "NYC HUB GuestRoom: Train @ 900ft; midtown 30min!, Omaha"}, {"day": 7, "current_city": "from Omaha to Dallas", "transportation": "Flight Number: F3603815, from Omaha to Dallas, Departure Time: 09:35, Arrival Time: 11:28", "breakfast": "Aapki Rasoi, Omaha", "attraction": "Lauritzen Gardens/Kenefick Park, Omaha;", "lunch": "-", "dinner": "-", "accommodation": "-"}]}]