[{"gpt-4-1106-preview_direct_sole-planning_results": "Travel Plan:\n\nDay 1: March 10th\nCurrent City: from Las Vegas to Santa Maria\nTransportation: Self-driving, from Las Vegas to Santa Maria, duration: 6 hours 17 mins, distance: 634 km, cost: $31\nBreakfast: - (Assuming breakfast is had before departure)\nAttraction: Santa Maria Valley Discovery Museum, Santa Maria\nLunch: Pirates of Grill, Santa Maria (American, Mediterranean, Seafood)\nDinner: RiverDine Restaurant & Bar, Santa Maria (Chinese, BBQ, Seafood)\nAccommodation: Cozy room in Brooklyn, Santa Maria (Private room, No parties & No children under 10, $906 per night, minimum 8 nights, maximum occupancy 1 - Booking for 4 people would require 2 rooms)\n\nDay 2: March 11th\nCurrent City: Santa Maria\nTransportation: -\nBreakfast: Indian By Nature, Santa Maria (Tea, Pizza, Bakery, BBQ, Mediterranean)\nAttraction: Santa Maria Museum of Flight, Santa Maria; Presqu'ile Winery, Santa Maria\nLunch: The Drunk House, Santa Maria (Desserts, Tea, Bakery, Fast Food, American, Mediterranean)\nDinner: London Street Kitchen, Santa Maria (Chinese, Cafe, Seafood)\nAccommodation: Cozy room in Brooklyn, Santa Maria (Private room, No parties & No children under 10, $906 per night, minimum 8 nights, maximum occupancy 1 - Booking for 4 people would require 2 rooms)\n\nDay 3: March 12th\nCurrent City: from Santa Maria to Las Vegas\nTransportation: Self-driving, from Santa Maria to Las Vegas, duration: 6 hours 19 mins, distance: 636 km, cost: $31\nBreakfast: Nariyal Cafe, Santa Maria (Tea, Bakery, BBQ, Fast Food)\nAttraction: Los Flores Ranch Park, Santa Maria\nLunch: Calendar Khana Laao, Santa Maria (Desserts, Tea, Fast Food, Cafe, Indian)\nDinner: - (Assuming dinner is had after arrival in Las Vegas)\nAccommodation: -\n\nPlease note that the accommodation chosen exceeds the minimum nights required, but since the query specifies a 3-day trip, it is assumed that the group will only stay for the duration of the trip. The cost of accommodation may need to be negotiated with the property owner or an alternative accommodation found that allows for a shorter stay. The budget may also need to be adjusted accordingly.", "gpt-4-1106-preview_direct_sole-planning_parsed_results": [{"day": 1, "current_city": "from Las Vegas to Santa Maria", "transportation": "Self-driving, from Las Vegas to Santa Maria, Duration: 6 hours 17 mins, Distance: 634 km, Cost: 31", "breakfast": "-", "attraction": "Santa Maria Valley Discovery Museum, Santa Maria;", "lunch": "Pirates of Grill, Santa Maria", "dinner": "RiverDine Restaurant & Bar, Santa Maria", "accommodation": "Cozy room in Brooklyn, Santa Maria"}, {"day": 2, "current_city": "Santa Maria", "transportation": "-", "breakfast": "Indian By Nature, Santa Maria", "attraction": "Santa Maria Museum of Flight, Santa Maria;Presqu'ile Winery, Santa Maria;", "lunch": "The Drunk House, Santa Maria", "dinner": "London Street Kitchen, Santa Maria", "accommodation": "Cozy room in Brooklyn, Santa Maria"}, {"day": 3, "current_city": "from Santa Maria to Las Vegas", "transportation": "Self-driving, from Santa Maria to Las Vegas, Duration: 6 hours 19 mins, Distance: 636 km, Cost: 31", "breakfast": "Nariyal Cafe, Santa Maria", "attraction": "Los Flores Ranch Park, Santa Maria", "lunch": "Calendar Khana Laao, Santa Maria", "dinner": "-", "accommodation": "-"}]}]