[{"gpt-4-1106-preview_direct_sole-planning_results": "Travel Plan:\n\nDay 1: March 15, 2022\nCurrent City: from Minneapolis to St. Louis\nTransportation: Flight Number: F3491757, from Minneapolis to St. Louis, Departure Time: 21:30, Arrival Time: 22:50, Cost: $95\nBreakfast: - (Assuming travelers will have breakfast before the trip or during the flight)\nAttraction: - (No time for attractions due to evening arrival)\nLunch: - (Assuming travelers will have lunch before the trip or during the flight)\nDinner: El Super Burrito, St. Louis, Cost: $43, Cuisines: \"Tea, Cafe, Mediterranean, Fast Food\"\nAccommodation: Peaceful room in Bushwick, St. Louis, Cost: $79, Maximum Occupancy: 1, House Rules: No Parties, Minimum Nights: 1\n\nNumber of People = 1 (Assuming a single traveler based on accommodation)\nTotal Cost = $95 (flight) + $43 (dinner) + $79 (accommodation) = $217\n\nDay 2: March 16, 2022\nCurrent City: St. Louis\nTransportation: - (Exploring the city)\nBreakfast: The Latitude - Radisson Blu, St. Louis, Cost: $18, Cuisines: \"Pizza, French, BBQ, American, Seafood\"\nAttraction: Saint Louis Zoo, St. Louis; City Museum, St. Louis\nLunch: Burger King, St. Louis, Cost: $21, Cuisines: \"Tea, BBQ, Chinese, American, Seafood\"\nDinner: Moti Mahal Delux, St. Louis, Cost: $73, Cuisines: \"Bakery, BBQ\"\nAccommodation: Peaceful room in Bushwick, St. Louis, Cost: $79, Maximum Occupancy: 1, House Rules: No Parties, Minimum Nights: 1\n\nTotal Cost = $18 (breakfast) + $21 (lunch) + $73 (dinner) + $79 (accommodation) = $191\n\nDay 3: March 17, 2022\nCurrent City: from St. Louis to Minneapolis\nTransportation: Flight Number: F3830375, from St. Louis to Minneapolis, Departure Time: 19:09, Arrival Time: 20:34, Cost: $108\nBreakfast: Starbucks, St. Louis, Cost: $92, Cuisines: \"Desserts, Pizza, Cafe, Mediterranean, Seafood\"\nAttraction: Forest Park, St. Louis\nLunch: Keventers, St. Louis, Cost: $23, Cuisines: \"Tea, Bakery, Fast Food, Chinese, Indian\"\nDinner: - (Assuming travelers will have dinner after arrival in Minneapolis or during the flight)\nAccommodation: - (Assuming travelers will not stay overnight as they are returning to Minneapolis)\n\nTotal Cost = $92 (breakfast) + $23 (lunch) + $108 (flight) = $223\n\nTotal cost across all days = $217 (Day 1) + $191 (Day 2) + $223 (Day 3) = $631\n\nCuisines: The prompt specifies no cuisines, so all cuisine constraints are satisfied.\n\nPlease note that the number of people is assumed to be 1 based on the accommodation chosen. If the number of travelers is different, the plan would need to be adjusted accordingly. Additionally, the attractions listed do not have an associated cost, as the provided information does not include this detail. If there are entrance fees, they would need to be factored into the budget.", "gpt-4-1106-preview_direct_sole-planning_parsed_results": [{"day": 1, "current_city": "from Minneapolis to St. Louis", "transportation": "Flight Number: F3491757, from Minneapolis to St. Louis, Departure Time: 21:30, Arrival Time: 22:50", "breakfast": "-", "attraction": "-", "lunch": "-", "dinner": "El Super Burrito, St. Louis", "accommodation": "Peaceful room in Bushwick, St. Louis"}, {"day": 2, "current_city": "St. Louis", "transportation": "-", "breakfast": "The Latitude - Radisson Blu, St. Louis", "attraction": "Saint Louis Zoo, St. Louis;City Museum, St. Louis;", "lunch": "Burger King, St. Louis", "dinner": "Moti Mahal Delux, St. Louis", "accommodation": "Peaceful room in Bushwick, St. Louis"}, {"day": 3, "current_city": "from St. Louis to Minneapolis", "transportation": "Flight Number: F3830375, from St. Louis to Minneapolis, Departure Time: 19:09, Arrival Time: 20:34", "breakfast": "Starbucks, St. Louis", "attraction": "Forest Park, St. Louis", "lunch": "Keventers, St. Louis", "dinner": "-", "accommodation": "-"}]}]