[{"gpt-4-1106-preview_direct_sole-planning_results": "Travel Plan:\n\nDay 1:\nCurrent City: from Grand Junction to Phoenix\nTransportation: Self-driving, from Grand Junction to Phoenix, duration: 9 hours 11 mins, distance: 934 km, cost: $46\nBreakfast: -\nAttraction: Phoenix Zoo, Phoenix\nLunch: Pizza Hut, Phoenix\nDinner: Doughlicious, Phoenix\nAccommodation: 1 BR in Carroll Gardens Townhouse, Phoenix (Private room, allows visitors, minimum 2 nights stay)\n\nDay 2:\nCurrent City: Phoenix\nTransportation: -\nBreakfast: Village Restaurant, Phoenix\nAttraction: Heard Museum, Phoenix; Desert Botanical Garden, Phoenix\nLunch: Mama Loca, Phoenix\nDinner: Mocambo, Phoenix\nAccommodation: 1 BR in Carroll Gardens Townhouse, Phoenix (Private room, allows visitors)\n\nDay 3:\nCurrent City: from Phoenix to Tucson\nTransportation: Self-driving, from Phoenix to Tucson, duration: 1 hour 44 mins, distance: 181 km, cost: $9\nBreakfast: Jungle The Restaurant, Phoenix\nAttraction: Pima Air & Space Museum, Tucson\nLunch: Villa Tevere, Tucson\nDinner: Consort Restaurant, Tucson\nAccommodation: Room for rent shared bathroom, Tucson (Private room, allows visitors, minimum 1 night stay)\n\nDay 4:\nCurrent City: Tucson\nTransportation: -\nBreakfast: Magic Spice Wok, Tucson\nAttraction: Reid Park Zoo, Tucson; The Mini Time Machine Museum of Miniatures, Tucson\nLunch: Pizza Street, Tucson\nDinner: La Plage, Tucson\nAccommodation: Room for rent shared bathroom, Tucson (Private room, allows visitors)\n\nDay 5:\nCurrent City: from Tucson to Grand Junction\nTransportation: Self-driving, from Tucson to Grand Junction, duration: 10 hours 36 mins, distance: 1,113 km, cost: $55\nBreakfast: iKitchen, Tucson\nAttraction: Tucson Botanical Gardens, Tucson\nLunch: Chai Point, Tucson\nDinner: -\nAccommodation: -\n\nTotal Estimated Cost:\n- Accommodation: $397 (1 BR in Carroll Gardens Townhouse, 2 nights) + $557 (Room for rent shared bathroom, 2 nights) = $954\n- Transportation: $46 (to Phoenix) + $9 (to Tucson) + $55 (return to Grand Junction) = $110\n- Meals and Attractions: Assuming an average of $50 per person per meal and $20 per attraction per person, the estimated cost for meals and attractions for two people over 5 days would be approximately $1,000.\n\nTotal Estimated Cost = $954 (Accommodation) + $110 (Transportation) + $1,000 (Meals and Attractions) = $2,064\n\nNote: The estimated cost for meals and attractions is approximate and may vary. The actual cost could be lower or higher depending on the specific choices made during the trip. The travel plan is within the budget of $2,100, but please ensure to have a buffer for any unexpected expenses.", "gpt-4-1106-preview_direct_sole-planning_parsed_results": [{"day": 1, "current_city": "from Grand Junction to Phoenix", "transportation": "Self-driving, from Grand Junction to Phoenix, duration: 9 hours 11 mins, distance: 934 km, Cost: 46", "breakfast": "-", "attraction": "Phoenix Zoo, Phoenix;", "lunch": "Pizza Hut, Phoenix", "dinner": "Doughlicious, Phoenix", "accommodation": "1 BR in Carroll Gardens Townhouse, Phoenix"}, {"day": 2, "current_city": "Phoenix", "transportation": "-", "breakfast": "Village Restaurant, Phoenix", "attraction": "Heard Museum, Phoenix; Desert Botanical Garden, Phoenix;", "lunch": "Mama Loca, Phoenix", "dinner": "Mocambo, Phoenix", "accommodation": "1 BR in Carroll Gardens Townhouse, Phoenix"}, {"day": 3, "current_city": "from Phoenix to Tucson", "transportation": "Self-driving, from Phoenix to Tucson, duration: 1 hour 44 mins, distance: 181 km, Cost: 9", "breakfast": "Jungle The Restaurant, Phoenix", "attraction": "Pima Air & Space Museum, Tucson;", "lunch": "Villa Tevere, Tucson", "dinner": "Consort Restaurant, Tucson", "accommodation": "Room for rent shared bathroom, Tucson"}, {"day": 4, "current_city": "Tucson", "transportation": "-", "breakfast": "Magic Spice Wok, Tucson", "attraction": "Reid Park Zoo, Tucson; The Mini Time Machine Museum of Miniatures, Tucson;", "lunch": "Pizza Street, Tucson", "dinner": "La Plage, Tucson", "accommodation": "Room for rent shared bathroom, Tucson"}, {"day": 5, "current_city": "from Tucson to Grand Junction", "transportation": "Self-driving, from Tucson to Grand Junction, duration: 10 hours 36 mins, distance: 1113 km, Cost: 55", "breakfast": "iKitchen, Tucson", "attraction": "Tucson Botanical Gardens, Tucson;", "lunch": "Chai Point, Tucson", "dinner": "-", "accommodation": "-"}]}]