[{"gpt-4-1106-preview_direct_sole-planning_results": "Travel Plan:\n\nDay 1: March 25, 2022\nCurrent City: from Billings to Dallas\nTransportation: Flight Number: F3606099, from Billings to Dallas, Departure Time: 13:42, Arrival Time: 17:08, Cost: $455\nBreakfast: -\nAttraction: The Sixth Floor Museum at Dealey Plaza, Dallas, Cost: $0 (Assuming free entry as no price is provided)\nLunch: -\nDinner: Cafe Gatherings, Dallas, Cost: $17, Cuisines: \"Bakery, Indian, Desserts\"\nAccommodation: *Fresh Budget Room, Dallas, Cost: $262, Maximum Occupancy: 1, House Rules: No visitors & No smoking, Minimum Nights: 2\n\nNumber of People = 1\nTotal Cost = $455 (Flight) + $17 (Dinner) + $262 (Accommodation) = $734\nAccommodation Minimum Nights: 1/2\n\nDay 2: March 26, 2022\nCurrent City: Dallas\nTransportation: -\nBreakfast: Cafe Gatherings, Dallas, Cost: $17, Cuisines: \"Bakery, Indian, Desserts\"\nAttraction: Reunion Tower, Dallas, Cost: $0 (Assuming free entry as no price is provided)\nLunch: Coconuts Fish Cafe, Dallas, Cost: $38, Cuisines: \"Cafe, BBQ, Mediterranean, Fast Food\"\nDinner: Cafe Gatherings, Dallas, Cost: $17, Cuisines: \"Bakery, Indian, Desserts\"\nAccommodation: *Fresh Budget Room, Dallas, Cost: $262, Maximum Occupancy: 1, House Rules: No visitors & No smoking, Minimum Nights: 2\n\nNumber of People = 1\nTotal Cost = $17 (Breakfast) + $38 (Lunch) + $17 (Dinner) + $262 (Accommodation) = $334\nAccommodation Minimum Nights: 2/2\n\nDay 3: March 27, 2022\nCurrent City: from Dallas to Longview\nTransportation: Flight Number: F3602862, from Dallas to Longview, Departure Time: 22:34, Arrival Time: 23:19, Cost: $39\nBreakfast: Cafe Gatherings, Dallas, Cost: $17, Cuisines: \"Bakery, Indian, Desserts\"\nAttraction: Dallas Museum of Art, Dallas, Cost: $0 (Assuming free entry as no price is provided)\nLunch: Coconuts Fish Cafe, Dallas, Cost: $38, Cuisines: \"Cafe, BBQ, Mediterranean, Fast Food\"\nDinner: Cafe Gatherings, Dallas, Cost: $17, Cuisines: \"Bakery, Indian, Desserts\"\nAccommodation: Luxury STUDIO * PVT Entrance * WOW, Longview, Cost: $406, Maximum Occupancy: 3, House Rules: No visitors, Minimum Nights: 1\n\nNumber of People = 1\nTotal Cost = $39 (Flight) + $17 (Breakfast) + $38 (Lunch) + $17 (Dinner) + $406 (Accommodation) = $517\nAccommodation Minimum Nights: 1/1\n\nDay 4: March 28, 2022\nCurrent City: Longview\nTransportation: -\nBreakfast: Barbeque Nation, Longview, Cost: $26, Cuisines: \"Cafe, Bakery\"\nAttraction: Longview World of Wonders, Longview, Cost: $0 (Assuming free entry as no price is provided)\nLunch: Apna Restaurant, Longview, Cost: $17, Cuisines: \"American, BBQ, Fast Food\"\nDinner: Barbeque Nation, Longview, Cost: $26, Cuisines: \"Cafe, Bakery\"\nAccommodation: Luxury STUDIO * PVT Entrance * WOW, Longview, Cost: $406, Maximum Occupancy: 3, House Rules: No visitors, Minimum Nights: 1\n\nNumber of People = 1\nTotal Cost = $26 (Breakfast) + $17 (Lunch) + $26 (Dinner) + $406 (Accommodation) = $475\nAccommodation Minimum Nights: 1/1\n\nDay 5: March 29, 2022\nCurrent City: from Longview to Texarkana\nTransportation: Self-driving, from Longview to Texarkana, Cost: $7\nBreakfast: Barbeque Nation, Longview, Cost: $26, Cuisines: \"Cafe, Bakery\"\nAttraction: Longview Museum of Fine Arts, Longview, Cost: $0 (Assuming free entry as no price is provided)\nLunch: Apna Restaurant, Longview, Cost: $17, Cuisines: \"American, BBQ, Fast Food\"\nDinner: Big City Bread Cafe, Texarkana, Cost: $61, Cuisines: \"Cafe, Pizza, Bakery, BBQ\"\nAccommodation: sunny airy bohemian rm, private bath! hip 'shwick, Texarkana, Cost: $592, Maximum Occupancy: 2, House Rules: No smoking, Minimum Nights: 2\n\nNumber of People = 1\nTotal Cost = $7 (Transportation) + $26 (Breakfast) + $17 (Lunch) + $61 (Dinner) + $592 (Accommodation) = $703\nAccommodation Minimum Nights: 1/2\n\nDay 6: March 30, 2022\nCurrent City: Texarkana\nTransportation: -\nBreakfast: Big City Bread Cafe, Texarkana, Cost: $61, Cuisines: \"Cafe, Pizza, Bakery, BBQ\"\nAttraction: Museum of Regional History, Texarkana, Cost: $0 (Assuming free entry as no price is provided)\nLunch: Columbia Restaurant, Texarkana, Cost: $91, Cuisines: \"Desserts, Tea, Pizza, Indian, Seafood\"\nDinner: Big City Bread Cafe, Texarkana, Cost: $61, Cuisines: \"Cafe, Pizza, Bakery, BBQ\"\nAccommodation: sunny airy bohemian rm, private bath! hip 'shwick, Texarkana, Cost: $592, Maximum Occupancy: 2, House Rules: No smoking, Minimum Nights: 2\n\nNumber of People = 1\nTotal Cost = $61 (Breakfast) + $91 (Lunch) + $61 (Dinner) + $592 (Accommodation) = $805\nAccommodation Minimum Nights: 2/2\n\nDay 7: March 31, 2022\nCurrent City: from Texarkana to Billings\nTransportation: Self-driving, from Texarkana to Billings, Cost: $121\nBreakfast: Big City Bread Cafe, Texarkana, Cost: $61, Cuisines: \"Cafe, Pizza, Bakery, BBQ\"\nAttraction: -\nLunch: Columbia Restaurant, Texarkana, Cost: $91, Cuisines: \"Desserts, Tea, Pizza, Indian, Seafood\"\nDinner: -\nAccommodation: -\n\nNumber of People = 1\nTotal Cost = $121 (Transportation) + $61 (Breakfast) + $91 (Lunch) = $273\n\nTotal cost across all days = $734 (Day 1) + $334 (Day 2) + $517 (Day 3) + $475 (Day 4) + $703 (Day 5) + $805 (Day 6) + $273 (Day 7) = $3841\n\nRemaining Budget = $8500 - $3841 = $4659\n\nCuisines: The prompt specifies no cuisines, so all cuisines constraints are satisfied.\n\nNote: The attractions were assumed to be free as no price was provided. If there are entry fees, they would need to be factored into the budget. The accommodation was chosen based on the minimum nights and the cheapest available option that met the house rules. The transportation was chosen based on the cheapest available option.", "gpt-4-1106-preview_direct_sole-planning_parsed_results": [{"day": 1, "current_city": "from Billings to Dallas", "transportation": "Flight Number: F3606099, from Billings to Dallas, Departure Time: 13:42, Arrival Time: 17:08", "breakfast": "-", "attraction": "The Sixth Floor Museum at Dealey Plaza, Dallas;", "lunch": "-", "dinner": "Cafe Gatherings, Dallas", "accommodation": "*Fresh Budget Room, Dallas"}, {"day": 2, "current_city": "Dallas", "transportation": "-", "breakfast": "Cafe Gatherings, Dallas", "attraction": "Reunion Tower, Dallas;", "lunch": "Coconuts Fish Cafe, Dallas", "dinner": "Cafe Gatherings, Dallas", "accommodation": "*Fresh Budget Room, Dallas"}, {"day": 3, "current_city": "from Dallas to Longview", "transportation": "Flight Number: F3602862, from Dallas to Longview, Departure Time: 22:34, Arrival Time: 23:19", "breakfast": "Cafe Gatherings, Dallas", "attraction": "Dallas Museum of Art, Dallas;", "lunch": "Coconuts Fish Cafe, Dallas", "dinner": "Cafe Gatherings, Dallas", "accommodation": "Luxury STUDIO * PVT Entrance * WOW, Longview"}, {"day": 4, "current_city": "Longview", "transportation": "-", "breakfast": "Barbeque Nation, Longview", "attraction": "Longview World of Wonders, Longview;", "lunch": "Apna Restaurant, Longview", "dinner": "Barbeque Nation, Longview", "accommodation": "Luxury STUDIO * PVT Entrance * WOW, Longview"}, {"day": 5, "current_city": "from Longview to Texarkana", "transportation": "Self-driving, from Longview to Texarkana", "breakfast": "Barbeque Nation, Longview", "attraction": "Longview Museum of Fine Arts, Longview;", "lunch": "Apna Restaurant, Longview", "dinner": "Big City Bread Cafe, Texarkana", "accommodation": "sunny airy bohemian rm, private bath! hip 'shwick, Texarkana"}, {"day": 6, "current_city": "Texarkana", "transportation": "-", "breakfast": "Big City Bread Cafe, Texarkana", "attraction": "Museum of Regional History, Texarkana;", "lunch": "Columbia Restaurant, Texarkana", "dinner": "Big City Bread Cafe, Texarkana", "accommodation": "sunny airy bohemian rm, private bath! hip 'shwick, Texarkana"}, {"day": 7, "current_city": "from Texarkana to Billings", "transportation": "Self-driving, from Texarkana to Billings", "breakfast": "Big City Bread Cafe, Texarkana", "attraction": "-", "lunch": "Columbia Restaurant, Texarkana", "dinner": "-", "accommodation": "-"}]}]