[{"gpt-4-1106-preview_direct_sole-planning_results": "Travel Plan:\n\nDay 1: March 24, 2022\nCurrent City: from Milwaukee to New York\nTransportation: Flight Number: F3643145, from Milwaukee to New York, Departure Time: 18:36, Arrival Time: 21:58, Cost: 226\nBreakfast: - (Assuming the travelers will have breakfast before the trip starts)\nAttraction: - (No time for attractions due to evening flight)\nLunch: - (Assuming the travelers will have lunch before the trip starts)\nDinner: Seasons 52 Fresh Grill, New York, Cost: 30, Cuisines: \"Seafood, Indian, Desserts, Italian\"\nAccommodation: Versatile private room in Harlem/Hamilton Heights!, New York, Cost: 398, Maximum Occupancy: 1, House Rules: No pets & No visitors & No parties\n\nNumber of People = 2\nTotal Cost = 2 * 226 (flight) + 2 * 30 (dinner) + 2 * 398 (accommodation) = 1052\nAccommodation Minimum Nights: 1/4\n\nDay 2: March 25, 2022\nCurrent City: New York\nTransportation: -\nBreakfast: Lord of the Drinks Forum, New York, Cost: 71, Cuisines: \"Cafe, Bakery, BBQ, Chinese, Indian\"\nAttraction: Central Park, New York; The High Line, New York.\nLunch: Gurgaon Hights, New York, Cost: 46, Cuisines: \"Cafe, American, Indian, Fast Food\"\nDinner: Rambhog, New York, Cost: 95, Cuisines: \"Tea, Seafood, Mexican, Fast Food\"\nAccommodation: Versatile private room in Harlem/Hamilton Heights!, New York, Cost: 398, Maximum Occupancy: 1, House Rules: No pets & No visitors & No parties\n\nNumber of people = 2\nTotal cost = 2 * 71 (breakfast) + 2 * 46 (lunch) + 2 * 95 (dinner) + 2 * 398 (accommodation) = 1402\nAccommodation Minimum Nights: 2/4\n\nDay 3: March 26, 2022\nCurrent City: from New York to Milwaukee\nTransportation: Flight Number: F3644990, from New York to Milwaukee, Departure Time: 15:20, Arrival Time: 16:27, Cost: 218\nBreakfast: Green Chick Chop, New York, Cost: 26, Cuisines: \"Tea, French, Cafe, Seafood\"\nAttraction: Statue of Liberty, New York\nLunch: Goosebumps, New York, Cost: 94, Cuisines: \"Chinese, Pizza, Bakery\"\nDinner: - (Assuming the travelers will have dinner after arriving back in Milwaukee)\nAccommodation: -\n\nNumber of people = 2\nTotal cost = 2 * 218 (flight) + 2 * 26 (breakfast) + 2 * 94 (lunch) = 676\n\nTotal cost across all days = 1052 + 1402 + 676 = 3130\n\nSince the total cost exceeds the budget of $1,900, adjustments need to be made. We can opt for self-driving instead of flights to reduce costs.\n\nAdjusted Day 1:\nTransportation: Self-driving, from Milwaukee to New York, duration: 13 hours 29 mins, distance: 1,417 km, cost: 70\nTotal Cost for Day 1 = 2 * 70 (self-driving) + 2 * 30 (dinner) + 2 * 398 (accommodation) = 996\n\nAdjusted Day 3:\nTransportation: Self-driving, from New York to Milwaukee, duration: 13 hours 28 mins, distance: 1,417 km, cost: 70\nTotal Cost for Day 3 = 2 * 70 (self-driving) + 2 * 26 (breakfast) + 2 * 94 (lunch) = 380\n\nAdjusted Total cost across all days = 996 + 1402 + 380 = 2778\n\nThe cost is still over budget. We need to find cheaper accommodation or reduce meal costs. Since the accommodation is the most expensive part, we can choose a cheaper option.\n\nAdjusted Accommodation:\nAccommodation: A Contemporary Homelike Stay in the Best of BK, New York, Cost: 228, Maximum Occupancy: 2, House Rules: No pets & No visitors & No children under 10\n\nAdjusted Total Cost for Day 1 = 2 * 70 (self-driving) + 2 * 30 (dinner) + 228 (accommodation) = 428\nAdjusted Total Cost for Day 2 = 2 * 71 (breakfast) + 2 * 46 (lunch) + 2 * 95 (dinner) + 228 (accommodation) = 652\nAdjusted Total Cost for Day 3 = 2 * 70 (self-driving) + 2 * 26 (breakfast) + 2 * 94 (lunch) = 380\n\nAdjusted Total cost across all days = 428 + 652 + 380 = 1460\n\nNow the total cost is within the budget of $1,900. Please note that the cost of attractions and any additional expenses have not been included and should be considered within the remaining budget.", "gpt-4-1106-preview_direct_sole-planning_parsed_results": [{"day": 1, "current_city": "from Milwaukee to New York", "transportation": "Flight Number: F3643145, from Milwaukee to New York, Departure Time: 18:36, Arrival Time: 21:58", "breakfast": "-", "attraction": "-", "lunch": "-", "dinner": "Seasons 52 Fresh Grill, New York", "accommodation": "Versatile private room in Harlem/Hamilton Heights!, New York"}, {"day": 2, "current_city": "New York", "transportation": "-", "breakfast": "Lord of the Drinks Forum, New York", "attraction": "Central Park, New York;The High Line, New York;", "lunch": "Gurgaon Hights, New York", "dinner": "Rambhog, New York", "accommodation": "Versatile private room in Harlem/Hamilton Heights!, New York"}, {"day": 3, "current_city": "from New York to Milwaukee", "transportation": "Flight Number: F3644990, from New York to Milwaukee, Departure Time: 15:20, Arrival Time: 16:27", "breakfast": "Green Chick Chop, New York", "attraction": "Statue of Liberty, New York", "lunch": "Goosebumps, New York", "dinner": "-", "accommodation": "-"}, {"day": 1, "current_city": "from Milwaukee to New York", "transportation": "Self-driving, from Milwaukee to New York, duration: 13 hours 29 mins, distance: 1,417 km", "breakfast": "-", "attraction": "-", "lunch": "-", "dinner": "Seasons 52 Fresh Grill, New York", "accommodation": "A Contemporary Homelike Stay in the Best of BK, New York"}, {"day": 2, "current_city": "New York", "transportation": "-", "breakfast": "Lord of the Drinks Forum, New York", "attraction": "Central Park, New York;The High Line, New York;", "lunch": "Gurgaon Hights, New York", "dinner": "Rambhog, New York", "accommodation": "A Contemporary Homelike Stay in the Best of BK, New York"}, {"day": 3, "current_city": "from New York to Milwaukee", "transportation": "Self-driving, from New York to Milwaukee, duration: 13 hours 28 mins, distance: 1,417 km", "breakfast": "Green Chick Chop, New York", "attraction": "Statue of Liberty, New York", "lunch": "Goosebumps, New York", "dinner": "-", "accommodation": "-"}]}]