[{"gpt-4-1106-preview_direct_sole-planning_results": "Travel Plan:\n\nDay 1: March 18, 2022\nCurrent City: from Charlotte to Marquette\nTransportation: Self-driving, from Charlotte to Marquette, Duration: 13 hours 1 min, Distance: 1,371 km, Cost: $68 * ceil(2/5) = $68\nBreakfast: -\nAttraction: -\nLunch: -\nDinner: -\nAccommodation: Huge Private Room Near Prospect Park, Marquette, Cost: $73 * ceil(2/2) = $73, Maximum Occupancy: 2, House Rules: No smoking & No visitors, Minimum Nights: 7\n\nNumber of People = 2\nTotal Cost = $68 + $73 = $141\nAccommodation Minimum Nights: 1/7\n\nDay 2: March 19, 2022\nCurrent City: Marquette\nTransportation: -\nBreakfast: The Chop House, Marquette, Cost: $81 * 2 = $162, Cuisines: \"Desserts, Tea, Pizza, Mexican, Bakery, Indian\"\nAttraction: Presque Isle Park, Marquette\nLunch: Taste of Balingup, Marquette, Cost: $35 * 2 = $70, Cuisines: \"BBQ, Desserts\"\nDinner: Papa Mexicano, Marquette, Cost: $17 * 2 = $34, Cuisines: \"Italian, Bakery, BBQ, Fast Food, Seafood\"\nAccommodation: Huge Private Room Near Prospect Park, Marquette, Cost: $73 * ceil(2/2) = $73, Maximum Occupancy: 2, House Rules: No smoking & No visitors, Minimum Nights: 7\n\nNumber of People = 2\nTotal Cost = $162 + $70 + $34 + $73 = $339\nAccommodation Minimum Nights: 2/7\n\nDay 3: March 20, 2022\nCurrent City: from Marquette to Milwaukee\nTransportation: Self-driving, from Marquette to Milwaukee, Duration: 6 mins, Distance: 2.0 km, Cost: $0 * ceil(2/5) = $0\nBreakfast: The Chop House, Marquette, Cost: $81 * 2 = $162, Cuisines: \"Desserts, Tea, Pizza, Mexican, Bakery, Indian\"\nAttraction: Marquette Harbor Lighthouse, Marquette\nLunch: Dovetail, Marquette, Cost: $95 * 2 = $190, Cuisines: \"Fast Food, Indian, BBQ, Italian\"\nDinner: Eat N Treat, Marquette, Cost: $15 * 2 = $30, Cuisines: \"Tea, Seafood\"\nAccommodation: Affordable bedroom in the East Village!, Milwaukee, Cost: $184 * ceil(2/2) = $184, Maximum Occupancy: 2, House Rules: No parties, Minimum Nights: 2\n\nNumber of People = 2\nTotal Cost = $162 + $190 + $30 + $184 = $566\nAccommodation Minimum Nights: 1/2\n\nDay 4: March 21, 2022\nCurrent City: Milwaukee\nTransportation: -\nBreakfast: Cool Basil, Milwaukee, Cost: $40 * 2 = $80, Cuisines: \"Chinese, Pizza, French, Fast Food, Cafe\"\nAttraction: Milwaukee Art Museum, Milwaukee; Milwaukee Public Museum, Milwaukee\nLunch: Berco's, Milwaukee, Cost: $91 * 2 = $182, Cuisines: \"Desserts, Pizza, Italian, Cafe, Seafood\"\nDinner: Frontier, Milwaukee, Cost: $13 * 2 = $26, Cuisines: \"Fast Food, Seafood, Tea, Italian\"\nAccommodation: Affordable bedroom in the East Village!, Milwaukee, Cost: $184 * ceil(2/2) = $184, Maximum Occupancy: 2, House Rules: No parties, Minimum Nights: 2\n\nNumber of People = 2\nTotal Cost = $80 + $182 + $26 + $184 = $472\nAccommodation Minimum Nights: 2/2\n\nDay 5: March 22, 2022\nCurrent City: from Milwaukee to Charlotte\nTransportation: Self-driving, from Milwaukee to Charlotte, Duration: 12 hours 58 mins, Distance: 1,369 km, Cost: $68 * ceil(2/5) = $68\nBreakfast: Cool Basil, Milwaukee, Cost: $40 * 2 = $80, Cuisines: \"Chinese, Pizza, French, Fast Food, Cafe\"\nAttraction: North Point Lighthouse, Milwaukee\nLunch: The Chinese Kitchen, Milwaukee, Cost: $23 * 2 = $46, Cuisines: \"Fast Food, Bakery, Mediterranean, Italian\"\nDinner: -\nAccommodation: -\n\nNumber of People = 2\nTotal Cost = $68 + $80 + $46 = $194\n\nTotal cost across all days = $141 + $339 + $566 + $472 + $194 = $1712\nCuisines: The prompt specifies no specific cuisines, so all cuisines constraints are satisfied.\nHouse Rules: All accommodations chosen are child-friendly and provide private rooms, adhering to the house rules specified in the query.", "gpt-4-1106-preview_direct_sole-planning_parsed_results": [{"day": 1, "current_city": "from Charlotte to Marquette", "transportation": "Self-driving, from Charlotte to Marquette, Duration: 13 hours 1 min, Distance: 1,371 km", "breakfast": "-", "attraction": "-", "lunch": "-", "dinner": "-", "accommodation": "Huge Private Room Near Prospect Park, Marquette"}, {"day": 2, "current_city": "Marquette", "transportation": "-", "breakfast": "The Chop House, Marquette", "attraction": "Presque Isle Park, Marquette", "lunch": "Taste of Balingup, Marquette", "dinner": "Papa Mexicano, Marquette", "accommodation": "Huge Private Room Near Prospect Park, Marquette"}, {"day": 3, "current_city": "from Marquette to Milwaukee", "transportation": "Self-driving, from Marquette to Milwaukee, Duration: 6 mins, Distance: 2.0 km", "breakfast": "The Chop House, Marquette", "attraction": "Marquette Harbor Lighthouse, Marquette", "lunch": "Dovetail, Marquette", "dinner": "Eat N Treat, Marquette", "accommodation": "Affordable bedroom in the East Village!, Milwaukee"}, {"day": 4, "current_city": "Milwaukee", "transportation": "-", "breakfast": "Cool Basil, Milwaukee", "attraction": "Milwaukee Art Museum, Milwaukee; Milwaukee Public Museum, Milwaukee", "lunch": "Berco's, Milwaukee", "dinner": "Frontier, Milwaukee", "accommodation": "Affordable bedroom in the East Village!, Milwaukee"}, {"day": 5, "current_city": "from Milwaukee to Charlotte", "transportation": "Self-driving, from Milwaukee to Charlotte, Duration: 12 hours 58 mins, Distance: 1,369 km", "breakfast": "Cool Basil, Milwaukee", "attraction": "North Point Lighthouse, Milwaukee", "lunch": "The Chinese Kitchen, Milwaukee", "dinner": "-", "accommodation": "-"}]}]