[{"gpt-4-1106-preview_direct_sole-planning_results": "Travel Plan:\n\nDay 1: March 19, 2022\nCurrent City: from Islip to State College\nTransportation: Self-driving, from Islip to State College, Duration: 4 hours 52 mins, Distance: 464 km, Cost: $23\nBreakfast: -\nAttraction: Discovery Space of Central Pennsylvania, State College\nLunch: Kawa Sushi, State College\nDinner: Los Agaves, State College\nAccommodation: Beautiful, Newly Furnished, Luxury, Grand Central, State College (Entire home/apt that allows children under 10)\n\nDay 2: March 20, 2022\nCurrent City: State College\nTransportation: -\nBreakfast: Amici Cafe, State College\nAttraction: The Arboretum at Penn State, State College\nLunch: Fusion Food Corner, State College\nDinner: The Chocolate Heaven, State College\nAccommodation: Beautiful, Newly Furnished, Luxury, Grand Central, State College\n\nDay 3: March 21, 2022\nCurrent City: from State College to Johnstown\nTransportation: Self-driving, from State College to Johnstown, Duration: 1 hour 29 mins, Distance: 137 km, Cost: $6\nBreakfast: -\nAttraction: Johnstown Flood Museum, Johnstown\nLunch: The National, Johnstown\nDinner: Palmshore, Johnstown\nAccommodation: Tranquility in a Sunny Duplex w/Private Bathroom, Johnstown (Entire home/apt that allows children under 10)\n\nDay 4: March 22, 2022\nCurrent City: Johnstown\nTransportation: -\nBreakfast: Souza Lobo, Johnstown\nAttraction: Heritage Discovery Center, Johnstown\nLunch: Chicken Inn Family Meat Shop, Johnstown\nDinner: Dastarkhwan, Johnstown\nAccommodation: Tranquility in a Sunny Duplex w/Private Bathroom, Johnstown\n\nDay 5: March 23, 2022\nCurrent City: from Johnstown to Islip\nTransportation: Self-driving, from Johnstown to Islip, Duration: 5 hours 57 mins, Distance: 590 km, Cost: $29\nBreakfast: -\nAttraction: -\nLunch: -\nDinner: -\nAccommodation: -\n\nTotal Estimated Costs:\nTransportation: $23 (Islip to State College) + $6 (State College to Johnstown) + $29 (Johnstown to Islip) = $58\nAccommodations: $210 x 2 nights (State College) + $158 x 2 nights (Johnstown) = $736\nMeals and Attractions: Variable, to be managed within the remaining budget of $1,906 ($2,700 - $58 - $736)\n\nNote: The costs for meals and attractions are not specified in the provided information, so they will need to be managed within the remaining budget. Additionally, the accommodation costs are based on the nightly rates provided, and the transportation costs are based on self-driving as per the preference to avoid flights.", "gpt-4-1106-preview_direct_sole-planning_parsed_results": [{"day": 1, "current_city": "from Islip to State College", "transportation": "Self-driving, from Islip to State College, Duration: 4 hours 52 mins, Distance: 464 km, Cost: 23", "breakfast": "-", "attraction": "Discovery Space of Central Pennsylvania, State College;", "lunch": "Kawa Sushi, State College", "dinner": "Los Agaves, State College", "accommodation": "Beautiful, Newly Furnished, Luxury, Grand Central, State College"}, {"day": 2, "current_city": "State College", "transportation": "-", "breakfast": "Amici Cafe, State College", "attraction": "The Arboretum at Penn State, State College;", "lunch": "Fusion Food Corner, State College", "dinner": "The Chocolate Heaven, State College", "accommodation": "Beautiful, Newly Furnished, Luxury, Grand Central, State College"}, {"day": 3, "current_city": "from State College to Johnstown", "transportation": "Self-driving, from State College to Johnstown, Duration: 1 hour 29 mins, Distance: 137 km, Cost: 6", "breakfast": "-", "attraction": "Johnstown Flood Museum, Johnstown;", "lunch": "The National, Johnstown", "dinner": "Palmshore, Johnstown", "accommodation": "Tranquility in a Sunny Duplex w/Private Bathroom, Johnstown"}, {"day": 4, "current_city": "Johnstown", "transportation": "-", "breakfast": "Souza Lobo, Johnstown", "attraction": "Heritage Discovery Center, Johnstown;", "lunch": "Chicken Inn Family Meat Shop, Johnstown", "dinner": "Dastarkhwan, Johnstown", "accommodation": "Tranquility in a Sunny Duplex w/Private Bathroom, Johnstown"}, {"day": 5, "current_city": "from Johnstown to Islip", "transportation": "Self-driving, from Johnstown to Islip, Duration: 5 hours 57 mins, Distance: 590 km, Cost: 29", "breakfast": "-", "attraction": "-", "lunch": "-", "dinner": "-", "accommodation": "-"}]}]