[{"gpt-4-1106-preview_direct_sole-planning_results": "Travel Plan:\n\nDay 1: March 14, 2022\nCurrent City: Little Rock to Houston\nTransportation: Flight Number: F3926621, from Little Rock to Houston, Departure Time: 06:55, Arrival Time: 08:39, Cost: $95\nBreakfast: Not applicable (assumed to have breakfast before departure or during the flight)\nAttraction: Space Center Houston, Houston, Cost: $30 (estimated)\nLunch: Jalapenos, Houston, Cost: $57, Cuisines: \"Desserts, Tea, Cafe, Chinese, Seafood\"\nDinner: Sheetla Dhaba, Houston, Cost: $35, Cuisines: \"Desserts, Pizza, Bakery, American, Mediterranean\"\nAccommodation: Sunny and Airy near Manhattan, Houston, Cost: $499, Room Type: Entire home/apt, House Rules: No pets, Minimum Nights: 2, Maximum Occupancy: 4\n\nTotal Cost for Day 1: $95 (flight) + $30 (attraction) + $57 (lunch) + $35 (dinner) + $499 (accommodation) = $716\n\nDay 2: March 15, 2022\nCurrent City: Houston\nTransportation: -\nBreakfast: Super Bakery, Houston, Cost: $30, Cuisines: \"Seafood, Fast Food\"\nAttraction: Houston Museum of Natural Science, Houston, Cost: $25 (estimated)\nLunch: Royal Mart, Houston, Cost: $40, Cuisines: \"Tea, Bakery, Cafe, Mediterranean, Seafood\"\nDinner: Matchbox, Houston, Cost: $33, Cuisines: \"Tea, Italian, Bakery, Fast Food, Seafood\"\nAccommodation: Sunny and Airy near Manhattan, Houston, Cost: $499, Room Type: Entire home/apt, House Rules: No pets, Minimum Nights: 2, Maximum Occupancy: 4\n\nTotal Cost for Day 2: $30 (breakfast) + $25 (attraction) + $40 (lunch) + $33 (dinner) + $499 (accommodation) = $627\n\nDay 3: March 16, 2022\nCurrent City: Houston to Dallas\nTransportation: Flight Number: F3723238, from Houston to Dallas, Departure Time: 10:40, Arrival Time: 11:44, Cost: $74\nBreakfast: Earthen Spices, Houston, Cost: $28, Cuisines: \"Tea, Mexican, Bakery, BBQ, Fast Food\"\nAttraction: The Dallas World Aquarium, Dallas, Cost: $40 (estimated)\nLunch: Coconuts Fish Cafe, Dallas, Cost: $38, Cuisines: \"Cafe, BBQ, Mediterranean, Fast Food\"\nDinner: 1918 Bistro & Grill, Dallas, Cost: $90, Cuisines: \"Tea, Pizza, BBQ, Seafood\"\nAccommodation: Luxury Williamsburg duplex, private roof terrace, Dallas, Cost: $241, Room Type: Entire home/apt, House Rules: No visitors, Minimum Nights: 4, Maximum Occupancy: 3\n\nTotal Cost for Day 3: $74 (flight) + $28 (breakfast) + $40 (attraction) + $38 (lunch) + $90 (dinner) + $241 (accommodation) = $511\n\nDay 4: March 17, 2022\nCurrent City: Dallas\nTransportation: -\nBreakfast: Yanki Sizzlers, Dallas, Cost: $96, Cuisines: \"Cafe, French, Tea, Mediterranean\"\nAttraction: The Sixth Floor Museum at Dealey Plaza, Dallas, Cost: $18 (estimated)\nLunch: Aravali Owls, Dallas, Cost: $53, Cuisines: \"Pizza, Italian, Bakery, Fast Food, Cafe\"\nDinner: Kebab Xpress, Dallas, Cost: $93, Cuisines: \"Tea, Bakery, Pizza, Mediterranean\"\nAccommodation: Luxury Williamsburg duplex, private roof terrace, Dallas, Cost: $241, Room Type: Entire home/apt, House Rules: No visitors, Minimum Nights: 4, Maximum Occupancy: 3\n\nTotal Cost for Day 4: $96 (breakfast) + $18 (attraction) + $53 (lunch) + $93 (dinner) + $241 (accommodation) = $501\n\nDay 5: March 18, 2022\nCurrent City: Dallas to Little Rock\nTransportation: Flight Number: F3592818, from Dallas to Little Rock, Departure Time: 10:34, Arrival Time: 11:50, Cost: $86\nBreakfast: Haldiram's, Dallas, Cost: $94, Cuisines: \"Tea, Pizza\"\nAttraction: Not applicable (assumed to be traveling back to Little Rock)\nLunch: Not applicable (assumed to be after arrival in Little Rock)\nDinner: Not applicable (assumed to be after arrival in Little Rock)\nAccommodation: Not applicable (assumed to be back home in Little Rock)\n\nTotal Cost for Day 5: $86 (flight) + $94 (breakfast) = $180\n\nTotal cost across all days: $716 (Day 1) + $627 (Day 2) + $511 (Day 3) + $501 (Day 4) + $180 (Day 5) = $2535\n\nRemaining Budget: $3900 - $2535 = $1365\n\nNote: The costs for attractions are estimated as they were not provided in the reference information. The accommodation in Dallas is booked for 4 nights to meet the minimum stay requirement, even though the stay is only for 2 nights. The remaining budget can be used for additional activities, transportation within the cities, or saved.", "gpt-4-1106-preview_direct_sole-planning_parsed_results": [{"day": 1, "current_city": "from Little Rock to Houston", "transportation": "Flight Number: F3926621, from Little Rock to Houston, Departure Time: 06:55, Arrival Time: 08:39", "breakfast": "-", "attraction": "Space Center Houston, Houston", "lunch": "Jalapenos, Houston", "dinner": "Sheetla Dhaba, Houston", "accommodation": "Sunny and Airy near Manhattan, Houston"}, {"day": 2, "current_city": "Houston", "transportation": "-", "breakfast": "Super Bakery, Houston", "attraction": "Houston Museum of Natural Science, Houston", "lunch": "Royal Mart, Houston", "dinner": "Matchbox, Houston", "accommodation": "Sunny and Airy near Manhattan, Houston"}, {"day": 3, "current_city": "from Houston to Dallas", "transportation": "Flight Number: F3723238, from Houston to Dallas, Departure Time: 10:40, Arrival Time: 11:44", "breakfast": "Earthen Spices, Houston", "attraction": "The Dallas World Aquarium, Dallas", "lunch": "Coconuts Fish Cafe, Dallas", "dinner": "1918 Bistro & Grill, Dallas", "accommodation": "Luxury Williamsburg duplex, private roof terrace, Dallas"}, {"day": 4, "current_city": "Dallas", "transportation": "-", "breakfast": "Yanki Sizzlers, Dallas", "attraction": "The Sixth Floor Museum at Dealey Plaza, Dallas", "lunch": "Aravali Owls, Dallas", "dinner": "Kebab Xpress, Dallas", "accommodation": "Luxury Williamsburg duplex, private roof terrace, Dallas"}, {"day": 5, "current_city": "from Dallas to Little Rock", "transportation": "Flight Number: F3592818, from Dallas to Little Rock, Departure Time: 10:34, Arrival Time: 11:50", "breakfast": "Haldiram's, Dallas", "attraction": "-", "lunch": "-", "dinner": "-", "accommodation": "-"}]}]