[{"gpt-4-1106-preview_direct_sole-planning_results": "Travel Plan:\n\nDay 1:\nCurrent City: from Fort Wayne to Charlotte\nTransportation: Self-driving, from Fort Wayne to Charlotte, Duration: 9 hours 15 mins, Distance: 938 km, Cost: 46\nBreakfast: - (Assuming breakfast is had before departure)\nAttraction: - (Traveling, no time for attractions)\nLunch: - (On the road, travelers can stop as they wish)\nDinner: Olive Tree Cafe, Charlotte, Cost: 23, Cuisines: \"Tea, Chinese, Desserts\"\nAccommodation: Elegant Studio Apt in Prospect Heights, Charlotte, Cost: 640, Room Type: Entire home/apt, House Rules: No parties, Minimum Nights: 2, Maximum Occupancy: 5\n\nNumber of People = 3\nTotal Cost = 3 * 46 + 3 * 23 + 640 = 341\nAccommodation Minimum Nights: 1/2\n\nDay 2:\nCurrent City: Charlotte\nTransportation: -\nBreakfast: Nagaland's Kitchen, Charlotte, Cost: 73, Cuisines: \"Pizza, American, Desserts\"\nAttraction: The Mint Museum, Charlotte; Freedom Park, Charlotte.\nLunch: Cafe Maple Street, Charlotte, Cost: 91, \"Fast Food, Tea, Italian\"\nDinner: Kylin Skybar, Charlotte, Cost: 44, Cuisines: \"Tea, Cafe, Pizza, Italian\"\nAccommodation: Elegant Studio Apt in Prospect Heights, Charlotte, Cost: 640, Room Type: Entire home/apt, House Rules: No parties, Minimum Nights: 2, Maximum Occupancy: 5\n\nNumber of people = 3\nTotal cost = 3 * 73 + 3 * 91 + 3 * 44 + 640 = 1254\nAccommodation Minimum Nights: 2/2\n\nDay 3:\nCurrent City: from Charlotte to Fort Wayne\nTransportation: Self-driving, from Charlotte to Fort Wayne, Duration: 9 hours 18 mins, Distance: 939 km, Cost: 46\nBreakfast: Central Perk 7, Charlotte, Cost: 87, Cuisines: \"Pizza, Bakery, BBQ, Fast Food\"\nAttraction: - (Traveling, no time for attractions)\nLunch: - (On the road, travelers can stop as they wish)\nDinner: - (Assuming dinner is had after arrival)\nAccommodation: -\n\nNumber of people = 3\nTotal cost = 3 * 46 + 3 * 87 = 399\n\nTotal cost across all days = 341 + 1254 + 399 = 1994\n\nNote: The total cost slightly exceeds the budget of $1,900 by $94. To stay within budget, the group can opt for a less expensive breakfast on Day 3 or find additional savings in meals or attractions on Day 2.\n\nCuisines: The prompt specifies no cuisines, so all cuisines constraints are satisfied.\n\nAccommodations: All accommodations allow pets and provide entire rooms, adhering to the specified constraints.\n\nTransportation: No flights are included in the itinerary, as per the request.", "gpt-4-1106-preview_direct_sole-planning_parsed_results": [{"day": 1, "current_city": "from Fort Wayne to Charlotte", "transportation": "Self-driving, from Fort Wayne to Charlotte, Duration: 9 hours 15 mins, Distance: 938 km", "breakfast": "-", "attraction": "-", "lunch": "-", "dinner": "Olive Tree Cafe, Charlotte", "accommodation": "Elegant Studio Apt in Prospect Heights, Charlotte"}, {"day": 2, "current_city": "Charlotte", "transportation": "-", "breakfast": "Nagaland's Kitchen, Charlotte", "attraction": "The Mint Museum, Charlotte;Freedom Park, Charlotte;", "lunch": "Cafe Maple Street, Charlotte", "dinner": "Kylin Skybar, Charlotte", "accommodation": "Elegant Studio Apt in Prospect Heights, Charlotte"}, {"day": 3, "current_city": "from Charlotte to Fort Wayne", "transportation": "Self-driving, from Charlotte to Fort Wayne, Duration: 9 hours 18 mins, Distance: 939 km", "breakfast": "Central Perk 7, Charlotte", "attraction": "-", "lunch": "-", "dinner": "-", "accommodation": "-"}]}]