[{"gpt-4-1106-preview_direct_sole-planning_results": "Travel Plan:\n\nDay 1: March 24, 2022\nCurrent City: from Fort Lauderdale to Atlanta\nTransportation: Flight Number: F3510231, from Fort Lauderdale to Atlanta, Departure Time: 05:24, Arrival Time: 06:56, Cost: 125 * 2 = 250\nBreakfast: -\nAttraction: Georgia Aquarium, Atlanta, Cost: -\nLunch: Saffron, Atlanta, Cost: 39 * 2 = 78, Cuisines: \"Tea, Cafe, Fast Food, Seafood\"\nDinner: Chef Style, Atlanta, Cost: 59 * 2 = 118, Cuisines: \"Pizza, American, Desserts, Seafood\"\nAccommodation: Bright, Modern, Clean, Spacious, Brooklyn Home, Atlanta, Cost: 1034 * 2 / 4 = 517, Maximum Occupancy: 4, House Rules: No children under 10, Minimum Nights: 3\n\nNumber of People = 2\nTotal Cost = 250 + 78 + 118 + 517 = 963\nAccommodation Minimum Nights: 1/3\n\nDay 2: March 25, 2022\nCurrent City: Atlanta\nTransportation: -\nBreakfast: Saffron, Atlanta, Cost: 39 * 2 = 78, Cuisines: \"Tea, Cafe, Fast Food, Seafood\"\nAttraction: World of Coca-Cola, Atlanta, Cost: -\nLunch: Asian Bistro, Atlanta, Cost: 27 * 2 = 54, Cuisines: \"Tea, Bakery, Seafood\"\nDinner: Daawat-e-Kashmir, Atlanta, Cost: 19 * 2 = 38, Cuisines: \"Cafe, Pizza, American, Seafood\"\nAccommodation: Bright, Modern, Clean, Spacious, Brooklyn Home, Atlanta, Cost: 1034 * 2 / 4 = 517, Maximum Occupancy: 4, House Rules: No children under 10, Minimum Nights: 3\n\nNumber of People = 2\nTotal Cost = 78 + 54 + 38 + 517 = 687\nAccommodation Minimum Nights: 2/3\n\nDay 3: March 26, 2022\nCurrent City: from Atlanta to Decatur\nTransportation: Taxi, from Atlanta to Decatur, Cost: 10 * 2 = 20\nBreakfast: Saffron, Atlanta, Cost: 39 * 2 = 78, Cuisines: \"Tea, Cafe, Fast Food, Seafood\"\nAttraction: DeKalb History Center Museum, Decatur, Cost: -\nLunch: Madhuban Restaurant - Welcome Hotel Rama International, Decatur, Cost: 47 * 2 = 94, Cuisines: \"Pizza, Bakery, Seafood\"\nDinner: Cafe Coffee Day, Decatur, Cost: 46 * 2 = 92, Cuisines: \"Tea, Cafe, BBQ, Mediterranean\"\nAccommodation: Cozy Private Room, Decatur, Cost: 69 * 2 / 2 = 69, Maximum Occupancy: 2, House Rules: No children under 10, Minimum Nights: 2\n\nNumber of People = 2\nTotal Cost = 20 + 78 + 94 + 92 + 69 = 353\nAccommodation Minimum Nights: 1/2\n\nDay 4: March 27, 2022\nCurrent City: Decatur\nTransportation: -\nBreakfast: Madhuban Restaurant - Welcome Hotel Rama International, Decatur, Cost: 47 * 2 = 94, Cuisines: \"Pizza, Bakery, Seafood\"\nAttraction: Clyde Shepherd Nature Preserve, Decatur, Cost: -\nLunch: Joey's Pizza, Decatur, Cost: 69 * 2 = 138, Cuisines: \"Tea, Pizza, Bakery, Chinese, Seafood\"\nDinner: Carnatic Cafe, Decatur, Cost: 66 * 2 = 132, Cuisines: \"Cafe, Indian, Desserts\"\nAccommodation: Cozy Private Room, Decatur, Cost: 69 * 2 / 2 = 69, Maximum Occupancy: 2, House Rules: No children under 10, Minimum Nights: 2\n\nNumber of People = 2\nTotal Cost = 94 + 138 + 132 + 69 = 433\nAccommodation Minimum Nights: 2/2\n\nDay 5: March 28, 2022\nCurrent City: from Decatur to Augusta\nTransportation: Self-driving, from Decatur to Augusta, Cost: 11 * 2 = 22\nBreakfast: Madhuban Restaurant - Welcome Hotel Rama International, Decatur, Cost: 47 * 2 = 94, Cuisines: \"Pizza, Bakery, Seafood\"\nAttraction: Augusta Riverwalk, Augusta, Cost: -\nLunch: B Merrell's, Augusta, Cost: 74 * 2 = 148, Cuisines: \"Tea, Pizza, Desserts, Fast Food\"\nDinner: The Charcoal Chimney, Augusta, Cost: 86 * 2 = 172, Cuisines: \"Tea, Fast Food, BBQ, Italian\"\nAccommodation: Planta Baja Studio, Augusta, Cost: 637 * 2 / 4 = 319, Maximum Occupancy: 4, House Rules: No smoking, Minimum Nights: 1\n\nNumber of People = 2\nTotal Cost = 22 + 94 + 148 + 172 + 319 = 755\nAccommodation Minimum Nights: 1/1\n\nDay 6: March 29, 2022\nCurrent City: Augusta\nTransportation: -\nBreakfast: B Merrell's, Augusta, Cost: 74 * 2 = 148, Cuisines: \"Tea, Pizza, Desserts, Fast Food\"\nAttraction: Morris Museum of Art, Augusta, Cost: -\nLunch: Fish Tales Lakeside Grille, Augusta, Cost: 37 * 2 = 74, Cuisines: \"Tea, Cafe, Bakery, Desserts\"\nDinner: Nikhil Food Point, Augusta, Cost: 87 * 2 = 174, Cuisines: \"Tea, Mexican, Fast Food, American, Seafood\"\nAccommodation: Planta Baja Studio, Augusta, Cost: 637 * 2 / 4 = 319, Maximum Occupancy: 4, House Rules: No smoking, Minimum Nights: 1\n\nNumber of People = 2\nTotal Cost = 148 + 74 + 174 + 319 = 715\nAccommodation Minimum Nights: 1/1\n\nDay 7: March 30, 2022\nCurrent City: from Augusta to Fort Lauderdale\nTransportation: Self-driving, from Augusta to Fort Lauderdale, Cost: 46 * 2 = 92\nBreakfast: B Merrell's, Augusta, Cost: 74 * 2 = 148, Cuisines: \"Tea, Pizza, Desserts, Fast Food\"\nAttraction: -\nLunch: -\nDinner: -\nAccommodation: -\n\nNumber of People = 2\nTotal Cost = 92 + 148 = 240\n\nTotal cost across all days = 963 + 687 + 353 + 433 + 755 + 715 + 240 = 4141\n\nCuisines: The prompt specifies Indian, American, Chinese, and Mediterranean cuisines, and all cuisine constraints are satisfied with the selected restaurants.\n\nRemaining Budget: $8000 - $4141 = $3859\n\nPlease note that attraction costs are not included as they were not provided in the reference information. The accommodation costs are calculated based on the maximum occupancy and the number of nights stayed. The transportation costs are calculated based on the cheapest available option that fits the number of people and the travel dates.", "gpt-4-1106-preview_direct_sole-planning_parsed_results": [{"day": 1, "current_city": "from Fort Lauderdale to Atlanta", "transportation": "Flight Number: F3510231, from Fort Lauderdale to Atlanta, Departure Time: 05:24, Arrival Time: 06:56", "breakfast": "-", "attraction": "Georgia Aquarium, Atlanta;", "lunch": "Saffron, Atlanta", "dinner": "Chef Style, Atlanta", "accommodation": "Bright, Modern, Clean, Spacious, Brooklyn Home, Atlanta"}, {"day": 2, "current_city": "Atlanta", "transportation": "-", "breakfast": "Saffron, Atlanta", "attraction": "World of Coca-Cola, Atlanta;", "lunch": "Asian Bistro, Atlanta", "dinner": "Daawat-e-Kashmir, Atlanta", "accommodation": "Bright, Modern, Clean, Spacious, Brooklyn Home, Atlanta"}, {"day": 3, "current_city": "from Atlanta to Decatur", "transportation": "Taxi, from Atlanta to Decatur", "breakfast": "Saffron, Atlanta", "attraction": "DeKalb History Center Museum, Decatur;", "lunch": "Madhuban Restaurant - Welcome Hotel Rama International, Decatur", "dinner": "Cafe Coffee Day, Decatur", "accommodation": "Cozy Private Room, Decatur"}, {"day": 4, "current_city": "Decatur", "transportation": "-", "breakfast": "Madhuban Restaurant - Welcome Hotel Rama International, Decatur", "attraction": "Clyde Shepherd Nature Preserve, Decatur;", "lunch": "Joey's Pizza, Decatur", "dinner": "Carnatic Cafe, Decatur", "accommodation": "Cozy Private Room, Decatur"}, {"day": 5, "current_city": "from Decatur to Augusta", "transportation": "Self-driving, from Decatur to Augusta", "breakfast": "Madhuban Restaurant - Welcome Hotel Rama International, Decatur", "attraction": "Augusta Riverwalk, Augusta;", "lunch": "B Merrell's, Augusta", "dinner": "The Charcoal Chimney, Augusta", "accommodation": "Planta Baja Studio, Augusta"}, {"day": 6, "current_city": "Augusta", "transportation": "-", "breakfast": "B Merrell's, Augusta", "attraction": "Morris Museum of Art, Augusta;", "lunch": "Fish Tales Lakeside Grille, Augusta", "dinner": "Nikhil Food Point, Augusta", "accommodation": "Planta Baja Studio, Augusta"}, {"day": 7, "current_city": "from Augusta to Fort Lauderdale", "transportation": "Self-driving, from Augusta to Fort Lauderdale", "breakfast": "B Merrell's, Augusta", "attraction": "-", "lunch": "-", "dinner": "-", "accommodation": "-"}]}]