[{"gpt-4-1106-preview_direct_sole-planning_results": "Travel Plan:\n\nDay 1: March 28, 2022\nCurrent City: from Akron to Tampa\nTransportation: Flight Number: F3620346, from Akron to Tampa, Departure Time: 19:40, Arrival Time: 21:47, Cost: $434\nDinner: Kobe Hibachi & Sushi, Tampa, Cost: $63\nAccommodation: Bright duplex apartment, Tampa, Cost: $164\n\nTotal cost for Day 1: Transportation + Dinner + Accommodation = $434 + $63 + $164 = $661\n\nDay 2: March 29, 2022\nCurrent City: Tampa\nTransportation: -, Cost: $0\nBreakfast: Gallery Caf\u6106 - Hyatt Place, Tampa, Cost: $42\nAttraction: Tampa Bay History Center, Tampa, Cost: $0 (assuming free entry or covered by a city pass)\nLunch: Gulati, Tampa, Cost: $12\nAttraction: Tampa Museum of Art, Tampa, Cost: $0 (assuming free entry or covered by a city pass)\nDinner: Club India Cafe & Restaurant, Tampa, Cost: $98\nAccommodation: Bright duplex apartment, Tampa, Cost: $164 (2nd night)\n\nTotal cost for Day 2: Transportation + Breakfast + Lunch + Dinner + Accommodation = $0 + $42 + $12 + $98 + $164 = $316\n\nDay 3: March 30, 2022\nCurrent City: from Tampa to Akron\nTransportation: Flight Number: F3620300, from Tampa to Akron, Departure Time: 17:00, Arrival Time: 19:18, Cost: $438\nBreakfast: Butterburrs, Tampa, Cost: $28\nAttraction: Henry B. Plant Museum, Tampa, Cost: $0 (assuming free entry or covered by a city pass)\nLunch: The Tin Cow, Tampa, Cost: $67\nAccommodation: -, Cost: $0\n\nTotal cost for Day 3: Transportation + Breakfast + Lunch + Accommodation = $438 + $28 + $67 + $0 = $533\n\nThe total cost of this trip is the sum of the costs from Day 1, Day 2, and Day 3. It is $661 + $316 + $533 = $1510, which is less than the required budget of $2500.\n\nPlease note that attraction costs are assumed to be free or covered by a city pass, which is common in many travel plans. If there are entry fees for the attractions, they would need to be added to the total cost. Additionally, the accommodation chosen requires a minimum of 2 nights stay, which aligns with the travel plan.", "gpt-4-1106-preview_direct_sole-planning_parsed_results": [{"day": 1, "current_city": "from Akron to Tampa", "transportation": "Flight Number: F3620346, from Akron to Tampa, Departure Time: 19:40, Arrival Time: 21:47", "breakfast": "-", "attraction": "-", "lunch": "-", "dinner": "Kobe Hibachi & Sushi, Tampa", "accommodation": "Bright duplex apartment, Tampa"}, {"day": 2, "current_city": "Tampa", "transportation": "-", "breakfast": "Gallery Caf\u00e9 - Hyatt Place, Tampa", "attraction": "Tampa Bay History Center, Tampa;Tampa Museum of Art, Tampa;", "lunch": "Gulati, Tampa", "dinner": "Club India Cafe & Restaurant, Tampa", "accommodation": "Bright duplex apartment, Tampa"}, {"day": 3, "current_city": "from Tampa to Akron", "transportation": "Flight Number: F3620300, from Tampa to Akron, Departure Time: 17:00, Arrival Time: 19:18", "breakfast": "Butterburrs, Tampa", "attraction": "Henry B. Plant Museum, Tampa", "lunch": "The Tin Cow, Tampa", "dinner": "-", "accommodation": "-"}]}]