[{"gpt-4-1106-preview_direct_sole-planning_results": "Travel Plan:\n\nDay 1: March 2, 2022\nCurrent City: from Cleveland to Fort Myers\nTransportation: Flight Number: F3915178, from Cleveland to Fort Myers, Departure Time: 06:40, Arrival Time: 09:22, Cost: $316 * 6 = $1896\nBreakfast: - (Assuming breakfast is on the flight or before departure)\nAttraction: Edison & Ford Winter Estates, Fort Myers, Cost: Free (Assuming no entrance fee is listed)\nLunch: The Refinery, Fort Myers, Cost: $22 * 6 = $132, Cuisines: \"Bakery, Indian, Seafood\"\nDinner: Al Mukhtar Bakery, Fort Myers, Cost: $54 * 6 = $324, Cuisines: \"BBQ, Tea, American, Desserts\"\nAccommodation: Quiet and beautiful apartment near central park, Fort Myers, Cost: $930 * ceil(6/9) = $930, Maximum Occupancy: 9, House Rules: No parties & No smoking, Minimum Nights: 7\n\nNumber of People = 6\nTotal Cost = $1896 + $132 + $324 + $930 = $3282\nAccommodation Minimum Nights: 1/7\n\nDay 2: March 3, 2022\nCurrent City: Fort Myers\nTransportation: -\nBreakfast: Haunted, Fort Myers, Cost: $50 * 6 = $300, Cuisines: \"Desserts, French, Fast Food, Cafe, Seafood\"\nAttraction: Six Mile Cypress Slough Preserve, Fort Myers, Cost: Free (Assuming no entrance fee is listed)\nLunch: Maachh Bhaat, Fort Myers, Cost: $66 * 6 = $396, Cuisines: \"Desserts, Pizza, Fast Food, Mediterranean, Seafood\"\nDinner: Eggers Madhouse, Fort Myers, Cost: $76 * 6 = $456, Cuisines: \"BBQ, Mediterranean, Seafood\"\nAccommodation: Quiet and beautiful apartment near central park, Fort Myers, Cost: $930 * ceil(6/9) = $930, Maximum Occupancy: 9, House Rules: No parties & No smoking, Minimum Nights: 7\n\nNumber of People = 6\nTotal Cost = $300 + $396 + $456 + $930 = $2082\nAccommodation Minimum Nights: 2/7\n\nDay 3: March 4, 2022\nCurrent City: from Fort Myers to Tampa\nTransportation: Taxi from Fort Myers to Tampa, Cost: $204 * ceil(6/4) = $306\nBreakfast: Puran Chand Ambala Wale Di Hatti, Fort Myers, Cost: $36 * 6 = $216, Cuisines: \"Bakery, BBQ, Cafe, American, Seafood\"\nAttraction: The Florida Aquarium, Tampa, Cost: Free (Assuming no entrance fee is listed)\nLunch: Kobe Hibachi & Sushi, Tampa, Cost: $63 * 6 = $378, Cuisines: \"Desserts, French, BBQ, Bakery, Seafood\"\nDinner: The Tin Cow, Tampa, Cost: $67 * 6 = $402, Cuisines: \"BBQ, Desserts, Seafood\"\nAccommodation: Bright duplex apartment, Tampa, Cost: $164 * ceil(6/3) = $328, Maximum Occupancy: 3, House Rules: No children under 10, Minimum Nights: 2\n\nNumber of People = 6\nTotal Cost = $306 + $216 + $378 + $402 + $328 = $1630\nAccommodation Minimum Nights: 1/2\n\nDay 4: March 5, 2022\nCurrent City: Tampa\nTransportation: -\nBreakfast: Lalit Kathi Rolls Momos, Tampa, Cost: $23 * 6 = $138, Cuisines: \"Tea, Pizza, Fast Food\"\nAttraction: Busch Gardens Tampa Bay, Tampa, Cost: Free (Assuming no entrance fee is listed)\nLunch: Uptown Fresh Beer Cafe, Tampa, Cost: $61 * 6 = $366, Cuisines: \"Pizza, Mexican, BBQ, Cafe, Seafood\"\nDinner: Peg Leg Pete's, Tampa, Cost: $91 * 6 = $546, Cuisines: \"French, Bakery, Cafe\"\nAccommodation: Bright duplex apartment, Tampa, Cost: $164 * ceil(6/3) = $328, Maximum Occupancy: 3, House Rules: No children under 10, Minimum Nights: 2\n\nNumber of People = 6\nTotal Cost = $138 + $366 + $546 + $328 = $1378\nAccommodation Minimum Nights: 2/2\n\nDay 5: March 6, 2022\nCurrent City: from Tampa to Cleveland\nTransportation: Flight Number: F3560049, from Tampa to Cleveland, Departure Time: 08:53, Arrival Time: 11:22, Cost: $211 * 6 = $1266\nBreakfast: - (Assuming breakfast is on the flight or before departure)\nAttraction: - (No time for attractions due to departure)\nLunch: - (Assuming lunch is on the flight or after arrival)\nDinner: - (Back in Cleveland)\nAccommodation: -\n\nNumber of People = 6\nTotal Cost = $1266\n\nTotal cost across all days = $3282 + $2082 + $1630 + $1378 + $1266 = $9638\n\nRemaining Budget: $13900 - $9638 = $4262\n\nPet-Friendly Accommodations: Both accommodations chosen are pet-friendly as they do not list any restrictions against pets.\n\nCuisines: The prompt specifies no specific cuisines, so all cuisine constraints are satisfied.", "gpt-4-1106-preview_direct_sole-planning_parsed_results": [{"day": 1, "current_city": "from Cleveland to Fort Myers", "transportation": "Flight Number: F3915178, from Cleveland to Fort Myers, Departure Time: 06:40, Arrival Time: 09:22", "breakfast": "-", "attraction": "Edison & Ford Winter Estates, Fort Myers;", "lunch": "The Refinery, Fort Myers", "dinner": "Al Mukhtar Bakery, Fort Myers", "accommodation": "Quiet and beautiful apartment near central park, Fort Myers"}, {"day": 2, "current_city": "Fort Myers", "transportation": "-", "breakfast": "Haunted, Fort Myers", "attraction": "Six Mile Cypress Slough Preserve, Fort Myers;", "lunch": "Maachh Bhaat, Fort Myers", "dinner": "Eggers Madhouse, Fort Myers", "accommodation": "Quiet and beautiful apartment near central park, Fort Myers"}, {"day": 3, "current_city": "from Fort Myers to Tampa", "transportation": "Taxi from Fort Myers to Tampa", "breakfast": "Puran Chand Ambala Wale Di Hatti, Fort Myers", "attraction": "The Florida Aquarium, Tampa;", "lunch": "Kobe Hibachi & Sushi, Tampa", "dinner": "The Tin Cow, Tampa", "accommodation": "Bright duplex apartment, Tampa"}, {"day": 4, "current_city": "Tampa", "transportation": "-", "breakfast": "Lalit Kathi Rolls Momos, Tampa", "attraction": "Busch Gardens Tampa Bay, Tampa;", "lunch": "Uptown Fresh Beer Cafe, Tampa", "dinner": "Peg Leg Pete's, Tampa", "accommodation": "Bright duplex apartment, Tampa"}, {"day": 5, "current_city": "from Tampa to Cleveland", "transportation": "Flight Number: F3560049, from Tampa to Cleveland, Departure Time: 08:53, Arrival Time: 11:22", "breakfast": "-", "attraction": "-", "lunch": "-", "dinner": "-", "accommodation": "-"}]}]