[{"gpt-4-1106-preview_direct_sole-planning_results": "Travel Plan:\n\nDay 1: March 23, 2022\nCurrent City: from Missoula to Dallas\nTransportation: Flight Number: F3604254, from Missoula to Dallas, Departure Time: 14:27, Arrival Time: 18:26, Cost: $288\nBreakfast: - (Assuming breakfast is not required as the flight is post-lunchtime)\nAttraction: The Sixth Floor Museum at Dealey Plaza, Dallas\nLunch: - (Assuming lunch is not required as the flight is post-lunchtime)\nDinner: Coconuts Fish Cafe, Dallas, Cost: $38, Cuisines: \"Cafe, BBQ, Mediterranean, Fast Food\"\nAccommodation: Huge Private Room Near Prospect Park, Dallas, Cost: $73, Maximum Occupancy: 2, House Rules: No parties & No pets, Minimum Nights: 1\n\nNumber of People = 1 (Assuming 1 traveler based on the budget and costs)\nTotal Cost = $288 (Flight) + $38 (Dinner) + $73 (Accommodation) = $399\n\nDay 2: March 24, 2022\nCurrent City: Dallas\nTransportation: -\nBreakfast: Cafe Gatherings, Dallas, Cost: $17, Cuisines: \"Bakery, Indian, Desserts\"\nAttraction: Reunion Tower, Dallas; The Dallas Arboretum and Botanical Garden, Dallas\nLunch: 1918 Bistro & Grill, Dallas, Cost: $90, Cuisines: \"Tea, Pizza, BBQ, Seafood\"\nDinner: Yanki Sizzlers, Dallas, Cost: $96, Cuisines: \"Cafe, French, Tea, Mediterranean\"\nAccommodation: Huge Private Room Near Prospect Park, Dallas, Cost: $73, Maximum Occupancy: 2, House Rules: No parties & No pets, Minimum Nights: 1\n\nNumber of People = 1\nTotal Cost = $17 (Breakfast) + $90 (Lunch) + $96 (Dinner) + $73 (Accommodation) = $276\n\nDay 3: March 25, 2022\nCurrent City: from Dallas to Missoula\nTransportation: Flight Number: F3604227, from Dallas to Missoula, Departure Time: 11:28, Arrival Time: 13:48, Cost: $356\nBreakfast: Drifters Cafe, Dallas, Cost: $21, Cuisines: \"Tea, French, Mexican, Cafe, Seafood\"\nAttraction: - (Assuming no time for attractions due to morning flight)\nLunch: - (Assuming lunch is not required as the flight is around lunchtime)\nDinner: - (Assuming dinner is not required as the traveler will be back in Missoula)\nAccommodation: -\n\nNumber of People = 1\nTotal Cost = $21 (Breakfast) + $356 (Flight) = $377\n\nTotal cost across all days = $399 (Day 1) + $276 (Day 2) + $377 (Day 3) = $1052\n\nRemaining Budget: $1900 - $1052 = $848\n\nCuisines: The prompt specifies no cuisines, so all cuisines constraints are satisfied.\n\nNote: The travel plan assumes a single traveler based on the budget and costs provided. If the number of travelers is different, the plan would need to be adjusted accordingly. Additionally, no attractions are listed for Day 3 due to the morning flight, and meals are not included on flight days around meal times.", "gpt-4-1106-preview_direct_sole-planning_parsed_results": [{"day": 1, "current_city": "from Missoula to Dallas", "transportation": "Flight Number: F3604254, from Missoula to Dallas, Departure Time: 14:27, Arrival Time: 18:26", "breakfast": "-", "attraction": "The Sixth Floor Museum at Dealey Plaza, Dallas;", "lunch": "-", "dinner": "Coconuts Fish Cafe, Dallas", "accommodation": "Huge Private Room Near Prospect Park, Dallas"}, {"day": 2, "current_city": "Dallas", "transportation": "-", "breakfast": "Cafe Gatherings, Dallas", "attraction": "Reunion Tower, Dallas;The Dallas Arboretum and Botanical Garden, Dallas;", "lunch": "1918 Bistro & Grill, Dallas", "dinner": "Yanki Sizzlers, Dallas", "accommodation": "Huge Private Room Near Prospect Park, Dallas"}, {"day": 3, "current_city": "from Dallas to Missoula", "transportation": "Flight Number: F3604227, from Dallas to Missoula, Departure Time: 11:28, Arrival Time: 13:48", "breakfast": "Drifters Cafe, Dallas", "attraction": "-", "lunch": "-", "dinner": "-", "accommodation": "-"}]}]