[{"gpt-4-1106-preview_direct_sole-planning_results": "Travel Plan:\n\nDay 1: March 2, 2022\nCurrent City: from Boston to Wilmington\nTransportation: Taxi from Boston to Wilmington, duration: 12 hours 27 mins, cost: $1304\nBreakfast: -\nAttraction: Bellamy Mansion Museum, Wilmington\nLunch: Azteca, Wilmington\nDinner: Bandit Burrito, Wilmington\nAccommodation: Prime East Village location w/backyard garden!, Wilmington (Entire home/apt, No pets & No smoking, minimum nights: 4, price: $978)\n\nDay 2: March 3, 2022\nCurrent City: Wilmington\nTransportation: -\nBreakfast: Dunkin' Donuts, Wilmington\nAttraction: Airlie Gardens, Wilmington; Wilmington Riverwalk, Wilmington\nLunch: Moonie's Texas Barbecue, Wilmington\nDinner: Taco Bus, Wilmington\nAccommodation: Prime East Village location w/backyard garden!, Wilmington\n\nDay 3: March 4, 2022\nCurrent City: from Wilmington to Charlotte\nTransportation: Flight Number: F3635146, from Wilmington to Charlotte, Departure Time: 08:53, Arrival Time: 09:55, Price: $75\nBreakfast: -\nAttraction: Levine Museum of the New South, Charlotte; The Mint Museum, Charlotte\nLunch: Cafe Maple Street, Charlotte\nDinner: Kylin Skybar, Charlotte\nAccommodation: Elegant Studio Apt in Prospect Heights, Charlotte (Entire home/apt, No parties, minimum nights: 2, price: $640)\n\nDay 4: March 5, 2022\nCurrent City: Charlotte\nTransportation: -\nBreakfast: Olive Tree Cafe, Charlotte\nAttraction: Discovery Place Science, Charlotte; Romare Bearden Park, Charlotte\nLunch: Central Perk 7, Charlotte\nDinner: Bombay Vada Pav, Charlotte\nAccommodation: Elegant Studio Apt in Prospect Heights, Charlotte\n\nDay 5: March 6, 2022\nCurrent City: from Charlotte to Boston\nTransportation: Flight Number: F3662314, from Charlotte to Boston, Departure Time: 13:21, Arrival Time: 15:18, Price: $328\nBreakfast: Subway, Charlotte\nAttraction: -\nLunch: -\nDinner: -\nAccommodation: -\n\nTotal Estimated Cost:\nTaxi from Boston to Wilmington: $1304\nAccommodation in Wilmington (2 nights): $978 x 2 = $1956\nFlight from Wilmington to Charlotte: $75 x 4 = $300\nAccommodation in Charlotte (2 nights): $640 x 2 = $1280\nFlight from Charlotte to Boston: $328 x 4 = $1312\nMeals and Attractions: Estimated $1000 (for simplicity)\nTotal: $1304 + $1956 + $300 + $1280 + $1312 + $1000 = $7152\n\nRemaining Budget: $8800 - $7152 = $1648\n\nNote: The prices for meals and attractions are estimated and should be adjusted according to actual costs. The remaining budget can be used for additional meals, attractions, or saved. The accommodation choices are based on the requirement for entire rooms and the ability to accommodate visitors. Prices are based on the provided reference information and may vary.", "gpt-4-1106-preview_direct_sole-planning_parsed_results": [{"day": 1, "current_city": "from Boston to Wilmington", "transportation": "Taxi from Boston to Wilmington, Duration: 12 hours 27 mins, Cost: 1304", "breakfast": "-", "attraction": "Bellamy Mansion Museum, Wilmington;", "lunch": "Azteca, Wilmington", "dinner": "Bandit Burrito, Wilmington", "accommodation": "Prime East Village location w/backyard garden!, Wilmington"}, {"day": 2, "current_city": "Wilmington", "transportation": "-", "breakfast": "Dunkin' Donuts, Wilmington", "attraction": "Airlie Gardens, Wilmington; Wilmington Riverwalk, Wilmington;", "lunch": "Moonie's Texas Barbecue, Wilmington", "dinner": "Taco Bus, Wilmington", "accommodation": "Prime East Village location w/backyard garden!, Wilmington"}, {"day": 3, "current_city": "from Wilmington to Charlotte", "transportation": "Flight Number: F3635146, from Wilmington to Charlotte, Departure Time: 08:53, Arrival Time: 09:55, Cost: 75", "breakfast": "-", "attraction": "Levine Museum of the New South, Charlotte; The Mint Museum, Charlotte;", "lunch": "Cafe Maple Street, Charlotte", "dinner": "Kylin Skybar, Charlotte", "accommodation": "Elegant Studio Apt in Prospect Heights, Charlotte"}, {"day": 4, "current_city": "Charlotte", "transportation": "-", "breakfast": "Olive Tree Cafe, Charlotte", "attraction": "Discovery Place Science, Charlotte; Romare Bearden Park, Charlotte;", "lunch": "Central Perk 7, Charlotte", "dinner": "Bombay Vada Pav, Charlotte", "accommodation": "Elegant Studio Apt in Prospect Heights, Charlotte"}, {"day": 5, "current_city": "from Charlotte to Boston", "transportation": "Flight Number: F3662314, from Charlotte to Boston, Departure Time: 13:21, Arrival Time: 15:18, Cost: 328", "breakfast": "Subway, Charlotte", "attraction": "-", "lunch": "-", "dinner": "-", "accommodation": "-"}]}]