[{"gpt-4-1106-preview_direct_sole-planning_results": "Travel Plan:\n\nDay 1: March 15, 2022\nCurrent City: from Oakland to Tucson\nTransportation: Flight Number: F4002752, from Oakland to Tucson, Departure Time: 15:07, Arrival Time: 17:00\nBreakfast: - (Assuming breakfast is in Oakland before departure)\nAttraction: Pima Air & Space Museum, Tucson\nLunch: Villa Tevere, Tucson\nDinner: Consort Restaurant, Tucson\nAccommodation: Room for rent shared bathroom, Tucson\n\nDay 2: March 16, 2022\nCurrent City: Tucson\nTransportation: -\nBreakfast: Magic Spice Wok, Tucson\nAttraction: Arizona-Sonora Desert Museum, Tucson; Reid Park Zoo, Tucson\nLunch: Pizza Street, Tucson\nDinner: La Plage, Tucson\nAccommodation: Room for rent shared bathroom, Tucson\n\nDay 3: March 17, 2022\nCurrent City: from Tucson to Oakland\nTransportation: Self-driving, from Tucson to Oakland, duration: 12 hours 42 mins, distance: 1,373 km, cost: 68\nBreakfast: Chai Point, Tucson\nAttraction: Tucson Botanical Gardens, Tucson (morning visit before departure)\nLunch: - (On the road)\nDinner: - (Assuming dinner is in Oakland after arrival)\nAccommodation: -\n\nBudget Breakdown:\nFlight to Tucson: $190\nAccommodation (2 nights): $557 * 2 = $1,114\nTransportation back to Oakland (Self-driving): $68\nMeals and Attractions: Remaining budget\n\nTotal Estimated Cost: $1,372\n\nNote: The budget for meals and attractions is calculated with the remaining budget after accounting for transportation and accommodation. The actual cost of meals and attractions will vary based on choices made during the trip. The traveler should ensure that the total cost does not exceed the budget of $1,400.", "gpt-4-1106-preview_direct_sole-planning_parsed_results": [{"day": 1, "current_city": "from Oakland to Tucson", "transportation": "Flight Number: F4002752, from Oakland to Tucson, Departure Time: 15:07, Arrival Time: 17:00", "breakfast": "-", "attraction": "Pima Air & Space Museum, Tucson;", "lunch": "Villa Tevere, Tucson", "dinner": "Consort Restaurant, Tucson", "accommodation": "Room for rent shared bathroom, Tucson"}, {"day": 2, "current_city": "Tucson", "transportation": "-", "breakfast": "Magic Spice Wok, Tucson", "attraction": "Arizona-Sonora Desert Museum, Tucson;Reid Park Zoo, Tucson;", "lunch": "Pizza Street, Tucson", "dinner": "La Plage, Tucson", "accommodation": "Room for rent shared bathroom, Tucson"}, {"day": 3, "current_city": "from Tucson to Oakland", "transportation": "Self-driving, from Tucson to Oakland, duration: 12 hours 42 mins, distance: 1,373 km, Cost: 68", "breakfast": "Chai Point, Tucson", "attraction": "Tucson Botanical Gardens, Tucson;", "lunch": "-", "dinner": "-", "accommodation": "-"}]}]