[{"gpt-4-1106-preview_direct_sole-planning_results": "Travel Plan:\n\nDay 1: March 12, 2022\nCurrent City: from Myrtle Beach to Boston\nTransportation: Flight Number: F3613545, from Myrtle Beach to Boston, Departure Time: 18:13, Arrival Time: 20:03, Cost: 260\nBreakfast: - \nLunch: - \nAttraction: - \nDinner: Red Mesa Restaurant, Boston, Cost: 65, Cuisines: \"Desserts, Tea, Fast Food, Indian, Seafood\"\nAccommodation: IN MINT CONDITION-STUDIOS EAST 44TH/UNITED NATIONS, Boston, Cost: 1058, Entire home/apt, House Rules: No visitors & No smoking, Minimum Nights: 30, Maximum Occupancy: 7\n\nNumber of People = 3\nTotal Cost = 3 * 260 + 3 * 65 + 1058 = 1773\nAccommodation Minimum Nights: 1/30\n\nDay 2: March 13, 2022\nCurrent City: Boston\nTransportation: -\nBreakfast: Irish Democrat, Boston, Cost: 18, Cuisines: \"Tea, Cafe, Bakery, Fast Food\"\nAttraction: Museum of Science, Boston\nLunch: Club Cubana, Boston, Cost: 65, Cuisines: \"Desserts, BBQ, Fast Food, Cafe, Indian, Mediterranean\"\nDinner: Flirty Momo's, Boston, Cost: 36, Cuisines: \"Tea, Pizza, French, Fast Food, Indian, Seafood\"\nAccommodation: IN MINT CONDITION-STUDIOS EAST 44TH/UNITED NATIONS, Boston, Cost: 1058, Entire home/apt, House Rules: No visitors & No smoking, Minimum Nights: 30, Maximum Occupancy: 7\n\nNumber of People = 3\nTotal Cost = 3 * 18 + 3 * 65 + 3 * 36 + 1058 = 1443\nAccommodation Minimum Nights: 2/30\n\nDay 3: March 14, 2022\nCurrent City: from Boston to Martha's Vineyard\nTransportation: Self-driving, from Boston to Martha's Vineyard, duration: 2 hours 34 mins, distance: 146 km, cost: 7\nBreakfast: Double Roti, Boston, Cost: 78, Cuisines: \"Desserts, Tea, French, Bakery, Mediterranean, Seafood\"\nAttraction: Martha's Vineyard Museum, Martha's Vineyard\nLunch: Bern's Steak House, Martha's Vineyard, Cost: 35, Cuisines: \"Desserts, Mexican, Bakery, BBQ, Indian, Seafood\"\nDinner: The Punjab Kitchen, Martha's Vineyard, Cost: 80, Cuisines: \"Tea, French, Bakery, Italian\"\nAccommodation: Doorman Gym 2 Beds Luxury Building!5211, Martha's Vineyard, Cost: 1041, Private room, House Rules: No parties & No visitors, Minimum Nights: 30, Maximum Occupancy: 2\n\nNumber of People = 3\nTotal Cost = 3 * 7 + 3 * 78 + 3 * 35 + 3 * 80 + 1041 = 1508\nAccommodation Minimum Nights: 1/30\n\nDay 4: March 15, 2022\nCurrent City: Martha's Vineyard\nTransportation: -\nBreakfast: Yellow Dog Eats, Martha's Vineyard, Cost: 34, Cuisines: \"Cafe, Indian, Desserts, Seafood\"\nAttraction: Gay Head Light, Martha's Vineyard\nLunch: Midnight Chef, Martha's Vineyard, Cost: 39, Cuisines: \"Cafe, Desserts\"\nDinner: Brio Cafe and Grill, Martha's Vineyard, Cost: 56, Cuisines: \"Pizza, French, Bakery, Cafe, Mediterranean\"\nAccommodation: Doorman Gym 2 Beds Luxury Building!5211, Martha's Vineyard, Cost: 1041, Private room, House Rules: No parties & No visitors, Minimum Nights: 30, Maximum Occupancy: 2\n\nNumber of People = 3\nTotal Cost = 3 * 34 + 3 * 39 + 3 * 56 + 1041 = 1374\nAccommodation Minimum Nights: 2/30\n\nDay 5: March 16, 2022\nCurrent City: from Martha's Vineyard to Myrtle Beach\nTransportation: Self-driving, from Martha's Vineyard to Myrtle Beach, duration: 15 hours 35 mins, distance: 1,496 km, cost: 74\nBreakfast: -\nLunch: -\nAttraction: -\nDinner: -\nAccommodation: -\n\nNumber of People = 3\nTotal Cost = 3 * 74 = 222\n\nTotal cost across all days = 1773 + 1443 + 1508 + 1374 + 222 = 6320\n\nNote: The total cost exceeds the specified budget of $3,800. Adjustments to the plan, such as changing accommodations or dining options, are necessary to meet the budget constraint. Additionally, the accommodations selected have a minimum stay requirement that exceeds the duration of the trip, which may not be feasible. This plan is a draft and requires further refinement to meet all constraints.", "gpt-4-1106-preview_direct_sole-planning_parsed_results": [{"day": 1, "current_city": "from Myrtle Beach to Boston", "transportation": "Flight Number: F3613545, from Myrtle Beach to Boston, Departure Time: 18:13, Arrival Time: 20:03", "breakfast": "-", "attraction": "-", "lunch": "-", "dinner": "Red Mesa Restaurant, Boston", "accommodation": "IN MINT CONDITION-STUDIOS EAST 44TH/UNITED NATIONS, Boston"}, {"day": 2, "current_city": "Boston", "transportation": "-", "breakfast": "Irish Democrat, Boston", "attraction": "Museum of Science, Boston", "lunch": "Club Cubana, Boston", "dinner": "Flirty Momo's, Boston", "accommodation": "IN MINT CONDITION-STUDIOS EAST 44TH/UNITED NATIONS, Boston"}, {"day": 3, "current_city": "from Boston to Martha's Vineyard", "transportation": "Self-driving, from Boston to Martha's Vineyard, duration: 2 hours 34 mins, distance: 146 km", "breakfast": "Double Roti, Boston", "attraction": "Martha's Vineyard Museum, Martha's Vineyard", "lunch": "Bern's Steak House, Martha's Vineyard", "dinner": "The Punjab Kitchen, Martha's Vineyard", "accommodation": "Doorman Gym 2 Beds Luxury Building!5211, Martha's Vineyard"}, {"day": 4, "current_city": "Martha's Vineyard", "transportation": "-", "breakfast": "Yellow Dog Eats, Martha's Vineyard", "attraction": "Gay Head Light, Martha's Vineyard", "lunch": "Midnight Chef, Martha's Vineyard", "dinner": "Brio Cafe and Grill, Martha's Vineyard", "accommodation": "Doorman Gym 2 Beds Luxury Building!5211, Martha's Vineyard"}, {"day": 5, "current_city": "from Martha's Vineyard to Myrtle Beach", "transportation": "Self-driving, from Martha's Vineyard to Myrtle Beach, duration: 15 hours 35 mins, distance: 1,496 km", "breakfast": "-", "attraction": "-", "lunch": "-", "dinner": "-", "accommodation": "-"}]}]