[{"gpt-4-1106-preview_direct_sole-planning_results": "Travel Plan:\n\nDay 1: March 8, 2022\nCurrent City: from Rockford to Gainesville\nTransportation: Self-driving, from Rockford to Gainesville, duration: 16 hours 30 mins, distance: 1,822 km, cost: $91\nBreakfast: -\nAttraction: Florida Museum of Natural History-Exhibits, Gainesville\nLunch: The Machine Shed Restaurant, Gainesville\nDinner: Carnival By Tresind, Gainesville\nAccommodation: Suite Nest /free street parking+wifi, Gainesville (Entire home/apt, accommodates up to 8 people)\n\nDay 2: March 9, 2022\nCurrent City: Gainesville\nTransportation: -\nBreakfast: Parker's, Gainesville\nAttraction: Devil's Millhopper Geological State Park, Gainesville\nLunch: Aggarwal Sweet Corner, Gainesville\nDinner: The Food Garage, Gainesville\nAccommodation: Suite Nest /free street parking+wifi, Gainesville\n\nDay 3: March 10, 2022\nCurrent City: from Gainesville to Daytona Beach\nTransportation: Self-driving, from Gainesville to Daytona Beach, duration: 2 hours 2 mins, distance: 158 km, cost: $7\nBreakfast: CHA, Gainesville\nAttraction: Daytona Boardwalk Amusements, Daytona Beach\nLunch: Outback Steakhouse, Daytona Beach\nDinner: Bespoke Harvest, Daytona Beach\nAccommodation: Homey 1BR in Fun, Central West Village w/ Doorman by Blueground, Daytona Beach (Entire home/apt, accommodates up to 2 people, so 4 rooms will be needed)\n\nDay 4: March 11, 2022\nCurrent City: Daytona Beach\nTransportation: -\nBreakfast: Beach Box Cafe, Daytona Beach\nAttraction: Daytona Lagoon, Daytona Beach\nLunch: Rocks on the River, Daytona Beach\nDinner: Mom & Dad's Italian Restaurant, Daytona Beach\nAccommodation: Homey 1BR in Fun, Central West Village w/ Doorman by Blueground, Daytona Beach\n\nDay 5: March 12, 2022\nCurrent City: from Daytona Beach to Jacksonville\nTransportation: Self-driving, from Daytona Beach to Jacksonville, duration: 1 hour 28 mins, distance: 143 km, cost: $7\nBreakfast: Khaaja Chowk, Daytona Beach\nAttraction: Jacksonville Zoo and Gardens, Jacksonville\nLunch: Villa Gargano, Jacksonville\nDinner: Pirates' House Restaurant, Jacksonville\nAccommodation: NYC Sanctuary, Skyline Views & Rooftop, Jacksonville (Entire home/apt, accommodates up to 6 people, so 2 rooms will be needed)\n\nDay 6: March 13, 2022\nCurrent City: Jacksonville\nTransportation: -\nBreakfast: Goose Feathers Cafe and Bakery, Jacksonville\nAttraction: Southbank Riverwalk, Jacksonville\nLunch: Ashoka Restaurant, Jacksonville\nDinner: Sanjha Chulha, Jacksonville\nAccommodation: NYC Sanctuary, Skyline Views & Rooftop, Jacksonville\n\nDay 7: March 14, 2022\nCurrent City: from Jacksonville to Rockford\nTransportation: Self-driving, from Jacksonville to Rockford, duration: 16 hours 42 mins, distance: 1,852 km, cost: $92\nBreakfast: Touch of Spice, Jacksonville\nAttraction: -\nLunch: -\nDinner: -\nAccommodation: -\n\nPlease note that the transportation costs are calculated based on self-driving and the accommodation preferences are for entire homes or apartments that can accommodate the group size. The costs for meals and attractions are not specified in the provided information, so they are not included in the budget calculation. The total transportation cost for the trip is $197, and the accommodation costs will vary depending on the rates provided for the entire homes or apartments that can accommodate the group size. The remaining budget should cover meals, attractions, and any additional expenses.", "gpt-4-1106-preview_direct_sole-planning_parsed_results": [{"day": 1, "current_city": "from Rockford to Gainesville", "transportation": "Self-driving, from Rockford to Gainesville, Duration: 16 hours 30 mins, Distance: 1822 km, Cost: 91", "breakfast": "-", "attraction": "Florida Museum of Natural History-Exhibits, Gainesville", "lunch": "The Machine Shed Restaurant, Gainesville", "dinner": "Carnival By Tresind, Gainesville", "accommodation": "Suite Nest /free street parking+wifi, Gainesville"}, {"day": 2, "current_city": "Gainesville", "transportation": "-", "breakfast": "Parker's, Gainesville", "attraction": "Devil's Millhopper Geological State Park, Gainesville", "lunch": "Aggarwal Sweet Corner, Gainesville", "dinner": "The Food Garage, Gainesville", "accommodation": "Suite Nest /free street parking+wifi, Gainesville"}, {"day": 3, "current_city": "from Gainesville to Daytona Beach", "transportation": "Self-driving, from Gainesville to Daytona Beach, Duration: 2 hours 2 mins, Distance: 158 km, Cost: 7", "breakfast": "CHA, Gainesville", "attraction": "Daytona Boardwalk Amusements, Daytona Beach", "lunch": "Outback Steakhouse, Daytona Beach", "dinner": "Bespoke Harvest, Daytona Beach", "accommodation": "Homey 1BR in Fun, Central West Village w/ Doorman by Blueground, Daytona Beach"}, {"day": 4, "current_city": "Daytona Beach", "transportation": "-", "breakfast": "Beach Box Cafe, Daytona Beach", "attraction": "Daytona Lagoon, Daytona Beach", "lunch": "Rocks on the River, Daytona Beach", "dinner": "Mom & Dad's Italian Restaurant, Daytona Beach", "accommodation": "Homey 1BR in Fun, Central West Village w/ Doorman by Blueground, Daytona Beach"}, {"day": 5, "current_city": "from Daytona Beach to Jacksonville", "transportation": "Self-driving, from Daytona Beach to Jacksonville, Duration: 1 hour 28 mins, Distance: 143 km, Cost: 7", "breakfast": "Khaaja Chowk, Daytona Beach", "attraction": "Jacksonville Zoo and Gardens, Jacksonville", "lunch": "Villa Gargano, Jacksonville", "dinner": "Pirates' House Restaurant, Jacksonville", "accommodation": "NYC Sanctuary, Skyline Views & Rooftop, Jacksonville"}, {"day": 6, "current_city": "Jacksonville", "transportation": "-", "breakfast": "Goose Feathers Cafe and Bakery, Jacksonville", "attraction": "Southbank Riverwalk, Jacksonville", "lunch": "Ashoka Restaurant, Jacksonville", "dinner": "Sanjha Chulha, Jacksonville", "accommodation": "NYC Sanctuary, Skyline Views & Rooftop, Jacksonville"}, {"day": 7, "current_city": "from Jacksonville to Rockford", "transportation": "Self-driving, from Jacksonville to Rockford, Duration: 16 hours 42 mins, Distance: 1852 km, Cost: 92", "breakfast": "Touch of Spice, Jacksonville", "attraction": "-", "lunch": "-", "dinner": "-", "accommodation": "-"}]}]