[{"gpt-4-1106-preview_direct_sole-planning_results": "Travel Plan:\n\nDay 1: March 8th, 2022\nCurrent City: from Albuquerque to Houston\nTransportation: Self-driving from Albuquerque to Houston, duration: 12 hours 51 mins, distance: 1,422 km, cost: $71\nAccommodation: Sunny and Airy near Manhattan, Houston, price: $499, room type: Entire home/apt, house rules: No pets, minimum nights: 2, maximum occupancy: 4, review rate number: 5.0 (allows smoking)\nTotal cost for Day 1: Transportation $71 + Accommodation $499 = $570\n\nDay 2: March 9th, 2022\nCurrent City: Houston\nAttraction: Space Center Houston, Houston, cost: $0 (assuming free entry or covered by a city pass)\nLunch: Jalapenos, Houston, Average Cost: $57\nDinner: Super Bakery, Houston, Average Cost: $30\nAccommodation: Same as Day 1\nTotal cost for Day 2: Attractions $0 + Lunch $57 + Dinner $30 + Accommodation $499 = $586\n\nDay 3: March 10th, 2022\nCurrent City: from Houston to San Antonio\nTransportation: Self-driving from Houston to San Antonio, duration: 2 hours 56 mins, distance: 317 km, cost: $15\nAttraction: San Antonio River Walk, San Antonio, cost: $0 (assuming free entry or covered by a city pass)\nLunch: Cafe Le Rue @ The Landings, San Antonio, Average Cost: $19\nDinner: Burger Queen Drive In, San Antonio, Average Cost: $64\nAccommodation: Spacious, bright room, prime Williamsburg location, San Antonio, price: $900, room type: Private room, house rules: No pets, minimum nights: 3, maximum occupancy: 2, review rate number: 4.0 (allows smoking)\nTotal cost for Day 3: Transportation $15 + Attractions $0 + Lunch $19 + Dinner $64 + Accommodation $900 = $998\n\nDay 4: March 11th, 2022\nCurrent City: San Antonio\nAttraction: The Alamo, San Antonio, cost: $0 (assuming free entry or covered by a city pass)\nLunch: Martin's BBQ, San Antonio, Average Cost: $71\nDinner: Minerva's Food & Cocktails, San Antonio, Average Cost: $99\nAccommodation: Same as Day 3\nTotal cost for Day 4: Attractions $0 + Lunch $71 + Dinner $99 + Accommodation $900 = $1070\n\nDay 5: March 12th, 2022\nCurrent City: from San Antonio to Dallas\nTransportation: Self-driving from San Antonio to Dallas, duration: 4 hours 4 mins, distance: 440 km, cost: $22\nAttraction: The Dallas World Aquarium, Dallas, cost: $0 (assuming free entry or covered by a city pass)\nLunch: Coconuts Fish Cafe, Dallas, Average Cost: $38\nDinner: 1918 Bistro & Grill, Dallas, Average Cost: $90\nAccommodation: 1BR, elevator, kitchen, doorman!, Dallas, price: $475, room type: Entire home/apt, house rules: No parties, minimum nights: 1, maximum occupancy: 3, review rate number: 2.0 (allows smoking)\nTotal cost for Day 5: Transportation $22 + Attractions $0 + Lunch $38 + Dinner $90 + Accommodation $475 = $625\n\nDay 6: March 13th, 2022\nCurrent City: Dallas\nAttraction: Reunion Tower, Dallas, cost: $0 (assuming free entry or covered by a city pass)\nLunch: Yanki Sizzlers, Dallas, Average Cost: $96\nDinner: Aravali Owls, Dallas, Average Cost: $53\nAccommodation: Same as Day 5\nTotal cost for Day 6: Attractions $0 + Lunch $96 + Dinner $53 + Accommodation $475 = $624\n\nDay 7: March 14th, 2022\nCurrent City: from Dallas to Albuquerque\nTransportation: Self-driving from Dallas to Albuquerque, duration: 9 hours 33 mins, distance: 1,045 km, cost: $52\nTotal cost for Day 7: Transportation $52\n\nThe total cost of this trip is the sum of the costs from Day 1 to Day 7. It is $570 + $586 + $998 + $1070 + $625 + $624 + $52 = $4525, which is less than the required budget of $5000.\n\nPlease note that attraction costs are assumed to be free or covered by a city pass, and the accommodation costs are for the minimum nights required. Smoking is allowed in the accommodations selected, and no shared rooms are booked. Prices for meals are based on average costs and may vary. Transportation is by self-driving as per the preference to avoid flights.", "gpt-4-1106-preview_direct_sole-planning_parsed_results": [{"day": 1, "current_city": "from Albuquerque to Houston", "transportation": "Self-driving from Albuquerque to Houston, duration: 12 hours 51 mins, distance: 1,422 km", "breakfast": "-", "attraction": "-", "lunch": "-", "dinner": "-", "accommodation": "Sunny and Airy near Manhattan, Houston"}, {"day": 2, "current_city": "Houston", "transportation": "-", "breakfast": "-", "attraction": "Space Center Houston, Houston", "lunch": "Jalapenos, Houston", "dinner": "Super Bakery, Houston", "accommodation": "Sunny and Airy near Manhattan, Houston"}, {"day": 3, "current_city": "from Houston to San Antonio", "transportation": "Self-driving from Houston to San Antonio, duration: 2 hours 56 mins, distance: 317 km", "breakfast": "-", "attraction": "San Antonio River Walk, San Antonio", "lunch": "Cafe Le Rue @ The Landings, San Antonio", "dinner": "Burger Queen Drive In, San Antonio", "accommodation": "Spacious, bright room, prime Williamsburg location, San Antonio"}, {"day": 4, "current_city": "San Antonio", "transportation": "-", "breakfast": "-", "attraction": "The Alamo, San Antonio", "lunch": "Martin's BBQ, San Antonio", "dinner": "Minerva's Food & Cocktails, San Antonio", "accommodation": "Spacious, bright room, prime Williamsburg location, San Antonio"}, {"day": 5, "current_city": "from San Antonio to Dallas", "transportation": "Self-driving from San Antonio to Dallas, duration: 4 hours 4 mins, distance: 440 km", "breakfast": "-", "attraction": "The Dallas World Aquarium, Dallas", "lunch": "Coconuts Fish Cafe, Dallas", "dinner": "1918 Bistro & Grill, Dallas", "accommodation": "1BR, elevator, kitchen, doorman!, Dallas"}, {"day": 6, "current_city": "Dallas", "transportation": "-", "breakfast": "-", "attraction": "Reunion Tower, Dallas", "lunch": "Yanki Sizzlers, Dallas", "dinner": "Aravali Owls, Dallas", "accommodation": "1BR, elevator, kitchen, doorman!, Dallas"}, {"day": 7, "current_city": "from Dallas to Albuquerque", "transportation": "Self-driving from Dallas to Albuquerque, duration: 9 hours 33 mins, distance: 1,045 km", "breakfast": "-", "attraction": "-", "lunch": "-", "dinner": "-", "accommodation": "-"}]}]