[{"gpt-4-1106-preview_direct_sole-planning_results": "Travel Plan:\n\nDay 1: March 23, 2022\nCurrent City: from Panama City to Nashville\nTransportation: Flight Number: F3985882, from Panama City to Nashville, Departure Time: 07:24, Arrival Time: 08:51\nBreakfast: -\nAttraction: Country Music Hall of Fame and Museum, Nashville\nLunch: Bangkok 1, Nashville\nDinner: Oh! Calcutta, Nashville\nAccommodation: Brooklyn Heights gem, Nashville\n\nDay 2: March 24, 2022\nCurrent City: Nashville\nTransportation: -\nBreakfast: Govinda's Confectionery, Nashville\nAttraction: Nashville Zoo at Grassmere, Nashville; The Parthenon, Nashville\nLunch: Smoke House Deli, Nashville\nDinner: Kargo, Nashville\nAccommodation: Brooklyn Heights gem, Nashville\n\nDay 3: March 25, 2022\nCurrent City: from Nashville to Panama City\nTransportation: Flight Number: F4012165, from Nashville to Panama City, Departure Time: 07:32, Arrival Time: 08:46\nBreakfast: -\nAttraction: Belle Meade Historic Site & Winery, Nashville\nLunch: Town Hall, Nashville\nDinner: -\nAccommodation: -\n\nNote: The accommodation \"Brooklyn Heights gem\" was chosen as it is not a shared room and meets the minimum nights requirement. The attractions, restaurants, and flights were selected based on the provided reference information and within the budget limit of $2,900. Breakfast on Day 1 and Day 3 is not included as the flight times are early in the morning. Dinner on Day 3 is not included as the travelers will be returning to Panama City.", "gpt-4-1106-preview_direct_sole-planning_parsed_results": [{"day": 1, "current_city": "from Panama City to Nashville", "transportation": "Flight Number: F3985882, from Panama City to Nashville, Departure Time: 07:24, Arrival Time: 08:51", "breakfast": "-", "attraction": "Country Music Hall of Fame and Museum, Nashville;", "lunch": "Bangkok 1, Nashville", "dinner": "Oh! Calcutta, Nashville", "accommodation": "Brooklyn Heights gem, Nashville"}, {"day": 2, "current_city": "Nashville", "transportation": "-", "breakfast": "Govinda's Confectionery, Nashville", "attraction": "Nashville Zoo at Grassmere, Nashville; The Parthenon, Nashville;", "lunch": "Smoke House Deli, Nashville", "dinner": "Kargo, Nashville", "accommodation": "Brooklyn Heights gem, Nashville"}, {"day": 3, "current_city": "from Nashville to Panama City", "transportation": "Flight Number: F4012165, from Nashville to Panama City, Departure Time: 07:32, Arrival Time: 08:46", "breakfast": "-", "attraction": "Belle Meade Historic Site & Winery, Nashville;", "lunch": "Town Hall, Nashville", "dinner": "-", "accommodation": "-"}]}]