[{"gpt-4-1106-preview_direct_sole-planning_results": "Travel Plan:\n\nDay 1:\nCurrent City: from Valparaiso to Belleville\nTransportation: Flight Number: F3579167, from Valparaiso to Belleville, Departure Time: 17:23, Arrival Time: 19:06, Cost: 211 * 8 = 1688\nBreakfast: - \nAttraction: Belleville Square, Belleville, Cost: 0 (Assuming free entry as no price is provided)\nLunch: -\nDinner: Asian Haus, Belleville, Cost: 87 * 8 = 696, Cuisines: \"Tea, Pizza, Bakery, Mediterranean\"\nAccommodation: Near Yankee Stadium, Belleville, Cost: 73 * 8 = 584, Maximum Occupancy: 3, House Rules: No Pets, Minimum Nights: 1\n\nNumber of People = 8\nTotal Cost = 1688 + 696 + 584 = 2968\nAccommodation Minimum Nights: 1/1\n\nDay 2:\nCurrent City: Belleville\nTransportation: -\nBreakfast: Super Restaurant, Belleville, Cost: 96 * 8 = 768, Cuisines: \"Tea, American, BBQ, Italian\"\nAttraction: Labor & Industrial Museum, Belleville, Cost: 0 (Assuming free entry as no price is provided)\nLunch: Shanghai Cafe, Belleville, Cost: 96 * 8 = 768, Cuisines: \"Tea, Pizza, Bakery, Fast Food, Chinese\"\nDinner: Super Restaurant, Belleville, Cost: 96 * 8 = 768, Cuisines: \"Tea, American, BBQ, Italian\"\nAccommodation: Near Yankee Stadium, Belleville, Cost: 73 * 8 = 584, Maximum Occupancy: 3, House Rules: No Pets, Minimum Nights: 1\n\nNumber of people = 8\nTotal cost = 768 + 768 + 768 + 584 = 2888\nAccommodation Minimum Nights: 1/1\n\nDay 3:\nCurrent City: from Belleville to Valparaiso\nTransportation: Flight Number: F3571908, from Belleville to Valparaiso, Departure Time: 17:15, Arrival Time: 18:55, Cost: 124 * 8 = 992\nBreakfast: Super Restaurant, Belleville, Cost: 96 * 8 = 768, Cuisines: \"Tea, American, BBQ, Italian\"\nAttraction: St. Clair County Historical Society, Belleville, Cost: 0 (Assuming free entry as no price is provided)\nLunch: Shanghai Cafe, Belleville, Cost: 96 * 8 = 768, Cuisines: \"Tea, Pizza, Bakery, Fast Food, Chinese\"\nDinner: -\nAccommodation: -\n\nNumber of people = 8\nTotal cost = 992 + 768 + 768 = 2528\n\nTotal cost across all days = 2968 + 2888 + 2528 = 8384\nCuisines: Chinese and American cuisines were included in the meals as requested.\n\nRemaining Budget: $6,600 - $8,384 = -$1,784 (Over budget, adjustments needed)\n\n**Note**: The provided budget is not sufficient to cover the costs of the cheapest options available in the reference information for 8 people. Adjustments to the plan or an increase in the budget would be necessary to proceed.", "gpt-4-1106-preview_direct_sole-planning_parsed_results": [{"day": 1, "current_city": "from Valparaiso to Belleville", "transportation": "Flight Number: F3579167, from Valparaiso to Belleville, Departure Time: 17:23, Arrival Time: 19:06", "breakfast": "-", "attraction": "Belleville Square, Belleville;", "lunch": "-", "dinner": "Asian Haus, Belleville", "accommodation": "Near Yankee Stadium, Belleville"}, {"day": 2, "current_city": "Belleville", "transportation": "-", "breakfast": "Super Restaurant, Belleville", "attraction": "Labor & Industrial Museum, Belleville;", "lunch": "Shanghai Cafe, Belleville", "dinner": "Super Restaurant, Belleville", "accommodation": "Near Yankee Stadium, Belleville"}, {"day": 3, "current_city": "from Belleville to Valparaiso", "transportation": "Flight Number: F3571908, from Belleville to Valparaiso, Departure Time: 17:15, Arrival Time: 18:55", "breakfast": "Super Restaurant, Belleville", "attraction": "St. Clair County Historical Society, Belleville;", "lunch": "Shanghai Cafe, Belleville", "dinner": "-", "accommodation": "-"}]}]