[{"gpt-4-1106-preview_direct_sole-planning_results": "Travel Plan:\n\nDay 1: March 23, 2022\nCurrent City: from Gainesville to Wilmington\nTransportation: Self-driving, from Gainesville to Wilmington, Duration: 7 hours 29 mins, Distance: 814 km, Cost: $40\nBreakfast: -\nAttraction: Bellamy Mansion Museum, Wilmington\nLunch: Azteca, Wilmington\nDinner: Bandit Burrito, Wilmington\nAccommodation: Prime East Village location w/backyard garden!, Wilmington\n\nDay 2: March 24, 2022\nCurrent City: Wilmington\nTransportation: -\nBreakfast: Dunkin' Donuts, Wilmington\nAttraction: Airlie Gardens, Wilmington; Wilmington Riverwalk, Wilmington\nLunch: Moonie's Texas Barbecue, Wilmington\nDinner: Taco Bus, Wilmington\nAccommodation: Prime East Village location w/backyard garden!, Wilmington\n\nDay 3: March 25, 2022\nCurrent City: from Wilmington to Fayetteville\nTransportation: Self-driving, from Wilmington to Fayetteville, Duration: 1 hour 43 mins, Distance: 149 km, Cost: $7\nBreakfast: The Yellow Chef, Wilmington\nAttraction: Airborne & Special Operations Museum Foundation, Fayetteville; Cape Fear Botanical Garden, Fayetteville\nLunch: DiVine, Fayetteville\nDinner: Pind Balluchi, Fayetteville\nAccommodation: *CoZy Private Williamsburg Home*, Fayetteville\n\nDay 4: March 26, 2022\nCurrent City: Fayetteville\nTransportation: -\nBreakfast: Subway, Fayetteville\nAttraction: The Fayetteville Area Transportation and Local History Museum, Fayetteville; Festival Park, Fayetteville\nLunch: Eat Street, Fayetteville\nDinner: The Great Indian Pub, Fayetteville\nAccommodation: *CoZy Private Williamsburg Home*, Fayetteville\n\nDay 5: March 27, 2022\nCurrent City: from Fayetteville to Gainesville\nTransportation: Self-driving, from Fayetteville to Gainesville, Duration: 6 hours 45 mins, Distance: 743 km, Cost: $37\nBreakfast: Kay's Food Land, Fayetteville\nAttraction: -\nLunch: -\nDinner: -\nAccommodation: -\n\nTotal Estimated Cost: $40 (Day 1) + $7 (Day 3) + $37 (Day 5) + $978 x 2 nights (Accommodation in Wilmington) + $546 x 2 nights (Accommodation in Fayetteville) = $2,626\n\nNote: Meal costs are not included in the total estimated cost as prices vary and preferences are subjective. The budget allows for meal expenses within the remaining balance of $274. Attractions with no entry fee are chosen to keep the costs within budget.", "gpt-4-1106-preview_direct_sole-planning_parsed_results": [{"day": 1, "current_city": "from Gainesville to Wilmington", "transportation": "Self-driving, from Gainesville to Wilmington, Duration: 7 hours 29 mins, Distance: 814 km, Cost: 40", "breakfast": "-", "attraction": "Bellamy Mansion Museum, Wilmington;", "lunch": "Azteca, Wilmington", "dinner": "Bandit Burrito, Wilmington", "accommodation": "Prime East Village location w/backyard garden!, Wilmington"}, {"day": 2, "current_city": "Wilmington", "transportation": "-", "breakfast": "Dunkin' Donuts, Wilmington", "attraction": "Airlie Gardens, Wilmington; Wilmington Riverwalk, Wilmington;", "lunch": "Moonie's Texas Barbecue, Wilmington", "dinner": "Taco Bus, Wilmington", "accommodation": "Prime East Village location w/backyard garden!, Wilmington"}, {"day": 3, "current_city": "from Wilmington to Fayetteville", "transportation": "Self-driving, from Wilmington to Fayetteville, Duration: 1 hour 43 mins, Distance: 149 km, Cost: 7", "breakfast": "The Yellow Chef, Wilmington", "attraction": "Airborne & Special Operations Museum Foundation, Fayetteville; Cape Fear Botanical Garden, Fayetteville;", "lunch": "DiVine, Fayetteville", "dinner": "Pind Balluchi, Fayetteville", "accommodation": "CoZy Private Williamsburg Home, Fayetteville"}, {"day": 4, "current_city": "Fayetteville", "transportation": "-", "breakfast": "Subway, Fayetteville", "attraction": "The Fayetteville Area Transportation and Local History Museum, Fayetteville; Festival Park, Fayetteville;", "lunch": "Eat Street, Fayetteville", "dinner": "The Great Indian Pub, Fayetteville", "accommodation": "CoZy Private Williamsburg Home, Fayetteville"}, {"day": 5, "current_city": "from Fayetteville to Gainesville", "transportation": "Self-driving, from Fayetteville to Gainesville, Duration: 6 hours 45 mins, Distance: 743 km, Cost: 37", "breakfast": "Kay's Food Land, Fayetteville", "attraction": "-", "lunch": "-", "dinner": "-", "accommodation": "-"}]}]