[{"gpt-4-1106-preview_direct_sole-planning_results": "Travel Plan:\n\nDay 1:\nCurrent City: from Denver to Buffalo\nTransportation: Flight Number: F4026791, from Denver to Buffalo, Departure Time: 13:07, Arrival Time: 18:00, Cost: 1010 (505 * 2)\nDinner: Punjab Grill, Buffalo, Cost: 50 (25 * 2), Cuisines: \"Bakery, BBQ, Desserts, Seafood\"\nAccommodation: Yankee baseball stay, Buffalo, Cost: 911, Maximum Occupancy: 1, House Rules: No visitors, Minimum Nights: 1\n\nNumber of People = 2\nTotal Cost = 1010 + 50 + 911 = 1971\nAccommodation Minimum Nights: 1/1\n\nDay 2:\nCurrent City: Buffalo\nBreakfast: Shokitini, Buffalo, Cost: 82 (41 * 2), Cuisines: \"Tea, Cafe, Pizza, Mexican, Chinese, Seafood\"\nAttraction: The Buffalo Zoo, Buffalo\nLunch: Tibby's New Orleans Kitchen, Buffalo, Cost: 96 (48 * 2), Cuisines: \"Seafood, Indian, BBQ, Italian\"\nDinner: Punjab Grill, Buffalo, Cost: 50 (25 * 2), Cuisines: \"Bakery, BBQ, Desserts, Seafood\"\nAccommodation: Yankee baseball stay, Buffalo, Cost: 911, Maximum Occupancy: 1, House Rules: No visitors, Minimum Nights: 1\n\nNumber of people = 2\nTotal cost = 82 + 96 + 50 + 911 = 1139\nAccommodation Minimum Nights: 1/1\n\nDay 3:\nCurrent City: from Buffalo to New York\nTransportation: Flight Number: F3651086, from Buffalo to New York, Departure Time: 10:54, Arrival Time: 12:08, Cost: 146 (73 * 2)\nBreakfast: - (Assuming breakfast is included in the accommodation or skipped due to early flight)\nAttraction: Central Park, New York\nLunch: Gurgaon Hights, New York, Cost: 92 (46 * 2), Cuisines: \"Cafe, American, Indian, Fast Food\"\nDinner: G Dot, New York, Cost: 150 (75 * 2), Cuisines: \"Cafe, Mexican, BBQ\"\nAccommodation: Versatile private room in Harlem/Hamilton Heights!, New York, Cost: 796 (398 * 2), Maximum Occupancy: 1, House Rules: No pets & No visitors & No parties, Minimum Nights: 4\n\nNumber of people = 2\nTotal cost = 146 + 92 + 150 + 796 = 1184\nAccommodation Minimum Nights: 1/4\n\nDay 4:\nCurrent City: New York\nBreakfast: Gurgaon Hights, New York, Cost: 92 (46 * 2), Cuisines: \"Cafe, American, Indian, Fast Food\"\nAttraction: Statue of Liberty, New York\nLunch: G Dot, New York, Cost: 150 (75 * 2), Cuisines: \"Cafe, Mexican, BBQ\"\nDinner: Gurgaon Hights, New York, Cost: 92 (46 * 2), Cuisines: \"Cafe, American, Indian, Fast Food\"\nAccommodation: Versatile private room in Harlem/Hamilton Heights!, New York, Cost: 796 (398 * 2), Maximum Occupancy: 1, House Rules: No pets & No visitors & No parties, Minimum Nights: 4\n\nNumber of people = 2\nTotal cost = 92 + 150 + 92 + 796 = 1130\nAccommodation Minimum Nights: 2/4\n\nDay 5:\nCurrent City: from New York to Denver\nTransportation: Flight Number: F3766607, from New York to Denver, Departure Time: 07:23, Arrival Time: 09:56, Cost: 654 (327 * 2)\nBreakfast: - (Assuming breakfast is included in the accommodation or skipped due to early flight)\nAttraction: - (No time for attractions due to early flight)\nLunch: - (Assuming lunch is in-flight or upon arrival back in Denver)\nDinner: - (Assuming dinner is upon arrival back in Denver)\nAccommodation: -\n\nNumber of people = 2\nTotal cost = 654\n\nTotal cost across all days = 1971 + 1139 + 1184 + 1130 + 654 = 6078\nCuisines: Mexican and Indian cuisines were included in the meals as per the query preferences.\n\nPlease note that the attractions were chosen based on common sense and diversity, and no specific cost was associated with them in the provided data. The accommodation was chosen based on the minimum nights required and the house rules. The transportation was selected based on the cheapest available options that fit the schedule.", "gpt-4-1106-preview_direct_sole-planning_parsed_results": [{"day": 1, "current_city": "from Denver to Buffalo", "transportation": "Flight Number: F4026791, from Denver to Buffalo, Departure Time: 13:07, Arrival Time: 18:00", "breakfast": "-", "attraction": "-", "lunch": "-", "dinner": "Punjab Grill, Buffalo", "accommodation": "Yankee baseball stay, Buffalo"}, {"day": 2, "current_city": "Buffalo", "transportation": "-", "breakfast": "Shokitini, Buffalo", "attraction": "The Buffalo Zoo, Buffalo", "lunch": "Tibby's New Orleans Kitchen, Buffalo", "dinner": "Punjab Grill, Buffalo", "accommodation": "Yankee baseball stay, Buffalo"}, {"day": 3, "current_city": "from Buffalo to New York", "transportation": "Flight Number: F3651086, from Buffalo to New York, Departure Time: 10:54, Arrival Time: 12:08", "breakfast": "-", "attraction": "Central Park, New York", "lunch": "Gurgaon Hights, New York", "dinner": "G Dot, New York", "accommodation": "Versatile private room in Harlem/Hamilton Heights!, New York"}, {"day": 4, "current_city": "New York", "transportation": "-", "breakfast": "Gurgaon Hights, New York", "attraction": "Statue of Liberty, New York", "lunch": "G Dot, New York", "dinner": "Gurgaon Hights, New York", "accommodation": "Versatile private room in Harlem/Hamilton Heights!, New York"}, {"day": 5, "current_city": "from New York to Denver", "transportation": "Flight Number: F3766607, from New York to Denver, Departure Time: 07:23, Arrival Time: 09:56", "breakfast": "-", "attraction": "-", "lunch": "-", "dinner": "-", "accommodation": "-"}]}]