[{"gpt-4-1106-preview_direct_sole-planning_results": "Travel Plan:\n\nDay 1:\nCurrent City: from Seattle to San Francisco\nTransportation: Flight Number: F3748356, from Seattle to San Francisco, Departure Time: 13:43, Arrival Time: 15:39, Cost: $157\nBreakfast: - (Assuming breakfast is before the flight)\nAttraction: Golden Gate Bridge, San Francisco, Cost: $0 (No entry fee listed)\nLunch: Coffee & Chai Co., San Francisco, Cost: $10, Cuisines: \"Tea, Mexican, BBQ, Cafe, Seafood\"\nDinner: Tokyo Sushi, San Francisco, Cost: $18, Cuisines: \"Cafe, Pizza, BBQ\"\nAccommodation: Room in Down town Brooklyn Parkslop, San Francisco, Cost: $79, Maximum Occupancy: 2, House Rules: No Visitors, Minimum Nights: 1\n\nNumber of People = 1\nTotal Cost = $157 + $10 + $18 + $79 = $264\nAccommodation Minimum Nights: 1/1\n\nDay 2:\nCurrent City: San Francisco\nTransportation: -\nBreakfast: Bonne Bouche, San Francisco, Cost: $21, Cuisines: \"Tea, Chinese, American, Cafe\"\nAttraction: Exploratorium, San Francisco, Cost: $0 (No entry fee listed)\nLunch: Gupta's Rasoi, San Francisco, Cost: $13, Cuisines: \"Cafe, Bakery, BBQ, Mediterranean\"\nDinner: Empress, San Francisco, Cost: $24, Cuisines: \"Pizza, BBQ, Mediterranean, Fast Food\"\nAccommodation: Room in Down town Brooklyn Parkslop, San Francisco, Cost: $79, Maximum Occupancy: 2, House Rules: No Visitors, Minimum Nights: 1\n\nNumber of People = 1\nTotal Cost = $21 + $13 + $24 + $79 = $137\nAccommodation Minimum Nights: 1/1\n\nDay 3:\nCurrent City: from San Francisco to Seattle\nTransportation: Flight Number: F3749172, from San Francisco to Seattle, Departure Time: 21:36, Arrival Time: 23:31, Cost: $148\nBreakfast: Anupam Eating Point, San Francisco, Cost: $10, Cuisines: \"Desserts, Pizza, Mexican, BBQ, Fast Food\"\nAttraction: San Francisco Museum of Modern Art, San Francisco, Cost: $0 (No entry fee listed)\nLunch: That Baat, San Francisco, Cost: $59, Cuisines: \"Pizza, Bakery\"\nDinner: - (Assuming dinner is after the flight)\nAccommodation: -\n\nNumber of People = 1\nTotal Cost = $148 + $10 + $59 = $217\n\nTotal cost across all days = $264 + $137 + $217 = $618\nCuisines: The prompt specifies no cuisines, so all cuisines constraints are satisfied.\n\nNote: The attractions chosen do not have an entry fee listed in the provided information, so they are assumed to be free. The accommodation chosen is the same for the first two nights to satisfy the minimum nights requirement. The cheapest options were selected according to the budget constraints.", "gpt-4-1106-preview_direct_sole-planning_parsed_results": [{"day": 1, "current_city": "from Seattle to San Francisco", "transportation": "Flight Number: F3748356, from Seattle to San Francisco, Departure Time: 13:43, Arrival Time: 15:39", "breakfast": "-", "attraction": "Golden Gate Bridge, San Francisco;", "lunch": "Coffee & Chai Co., San Francisco", "dinner": "Tokyo Sushi, San Francisco", "accommodation": "Room in Down town Brooklyn Parkslop, San Francisco"}, {"day": 2, "current_city": "San Francisco", "transportation": "-", "breakfast": "Bonne Bouche, San Francisco", "attraction": "Exploratorium, San Francisco;", "lunch": "Gupta's Rasoi, San Francisco", "dinner": "Empress, San Francisco", "accommodation": "Room in Down town Brooklyn Parkslop, San Francisco"}, {"day": 3, "current_city": "from San Francisco to Seattle", "transportation": "Flight Number: F3749172, from San Francisco to Seattle, Departure Time: 21:36, Arrival Time: 23:31", "breakfast": "Anupam Eating Point, San Francisco", "attraction": "San Francisco Museum of Modern Art, San Francisco;", "lunch": "That Baat, San Francisco", "dinner": "-", "accommodation": "-"}]}]