[{"gpt-4-1106-preview_direct_sole-planning_results": "Travel Plan:\n\nDay 1: March 12, 2022\nCurrent City: from Evansville to Texarkana\nTransportation: Self-driving from Evansville to Texarkana, duration: 8 hours 45 mins, distance: 889 km, cost: $44 x 4 (for the group) = $176\nBreakfast: - (Assuming breakfast is had before departure)\nLunch: - (Assuming packed lunch or stops along the way, not included in the budget)\nDinner: Big City Bread Cafe, Texarkana, Average Cost: $61 x 4 = $244\nAccommodation: Lovely Factory Loft in Greenpoint!, Texarkana, price: $77 x 5 nights (to meet the minimum stay requirement) = $385\nTotal cost for Day 1: $176 (Transportation) + $244 (Dinner) + $385 (Accommodation) = $805\n\nDay 2: March 13, 2022\nCurrent City: Texarkana\nTransportation: -, Cost: $0\nBreakfast: Poets Cafe, Texarkana, Average Cost: $88 x 4 = $352\nAttraction: Museum of Regional History, Texarkana, Cost: Free (assuming no entrance fee)\nLunch: Columbia Restaurant, Texarkana, Average Cost: $91 x 4 = $364\nDinner: Club Mojo, Texarkana, Average Cost: $49 x 4 = $196\nAccommodation: Lovely Factory Loft in Greenpoint! (already paid for)\nTotal cost for Day 2: $352 (Breakfast) + $364 (Lunch) + $196 (Dinner) = $912\n\nDay 3: March 14, 2022\nCurrent City: from Texarkana to Longview\nTransportation: Self-driving from Texarkana to Longview, duration: 1 hour 36 mins, distance: 142 km, cost: $7 x 4 = $28\nBreakfast: Bansiwala Rasoi, Texarkana, Average Cost: $71 x 4 = $284\nAttraction: Discovery Place Interactive Museum, Texarkana, Cost: Free (assuming no entrance fee)\nLunch: The Beer Cafe - BIGGIE, Texarkana, Average Cost: $13 x 4 = $52\nDinner: Barbeque Nation, Longview, Average Cost: $26 x 4 = $104\nAccommodation: Unique 1 bedroom apt. in Gowanus, Brooklyn, Longview, price: $255 x 2 nights (to meet the minimum stay requirement) = $510\nTotal cost for Day 3: $28 (Transportation) + $284 (Breakfast) + $52 (Lunch) + $104 (Dinner) + $510 (Accommodation) = $978\n\nDay 4: March 15, 2022\nCurrent City: Longview\nTransportation: -, Cost: $0\nBreakfast: Apna Restaurant, Longview, Average Cost: $17 x 4 = $68\nAttraction: Longview World of Wonders, Longview, Cost: Free (assuming no entrance fee)\nLunch: Apni Rasoi, Longview, Average Cost: $25 x 4 = $100\nDinner: Monster's Cafe, Longview, Average Cost: $94 x 4 = $376\nAccommodation: Unique 1 bedroom apt. in Gowanus, Brooklyn (already paid for)\nTotal cost for Day 4: $68 (Breakfast) + $100 (Lunch) + $376 (Dinner) = $544\n\nDay 5: March 16, 2022\nCurrent City: from Longview to Evansville\nTransportation: Self-driving from Longview to Evansville, duration: 10 hours 8 mins, distance: 1,045 km, cost: $52 x 4 = $208\nBreakfast: Sham Sweets, Longview, Average Cost: $69 x 4 = $276\nLunch: - (Assuming packed lunch or stops along the way, not included in the budget)\nDinner: - (Assuming dinner upon arrival back home, not included in the budget)\nAccommodation: - (Returning home)\nTotal cost for Day 5: $208 (Transportation) + $276 (Breakfast) = $484\n\nThe total cost of this trip is the sum of the costs from Day 1, Day 2, Day 3, Day 4, and Day 5. It is $805 + $912 + $978 + $544 + $484 = $3,723 which is less than the required budget of $9,500.\n\nPlease note that the costs for attractions are assumed to be free based on common practice for museums and parks, but this may not be accurate. Also, the costs for meals are based on the average cost per person multiplied by the number of people in the group. The accommodation costs are calculated based on the minimum stay requirements. Any additional activities, snacks, or personal expenses are not included in this budget.", "gpt-4-1106-preview_direct_sole-planning_parsed_results": [{"day": 1, "current_city": "from Evansville to Texarkana", "transportation": "Self-driving from Evansville to Texarkana, duration: 8 hours 45 mins, distance: 889 km", "breakfast": "-", "attraction": "-", "lunch": "-", "dinner": "Big City Bread Cafe, Texarkana", "accommodation": "Lovely Factory Loft in Greenpoint!, Texarkana"}, {"day": 2, "current_city": "Texarkana", "transportation": "-", "breakfast": "Poets Cafe, Texarkana", "attraction": "Museum of Regional History, Texarkana", "lunch": "Columbia Restaurant, Texarkana", "dinner": "Club Mojo, Texarkana", "accommodation": "Lovely Factory Loft in Greenpoint!, Texarkana"}, {"day": 3, "current_city": "from Texarkana to Longview", "transportation": "Self-driving from Texarkana to Longview, duration: 1 hour 36 mins, distance: 142 km", "breakfast": "Bansiwala Rasoi, Texarkana", "attraction": "Discovery Place Interactive Museum, Texarkana", "lunch": "The Beer Cafe - BIGGIE, Texarkana", "dinner": "Barbeque Nation, Longview", "accommodation": "Unique 1 bedroom apt. in Gowanus, Brooklyn, Longview"}, {"day": 4, "current_city": "Longview", "transportation": "-", "breakfast": "Apna Restaurant, Longview", "attraction": "Longview World of Wonders, Longview", "lunch": "Apni Rasoi, Longview", "dinner": "Monster's Cafe, Longview", "accommodation": "Unique 1 bedroom apt. in Gowanus, Brooklyn, Longview"}, {"day": 5, "current_city": "from Longview to Evansville", "transportation": "Self-driving from Longview to Evansville, duration: 10 hours 8 mins, distance: 1,045 km", "breakfast": "Sham Sweets, Longview", "attraction": "-", "lunch": "-", "dinner": "-", "accommodation": "-"}]}]