[{"gpt-4-1106-preview_direct_sole-planning_results": "Travel Plan:\n\nDay 1: March 25th, 2022\nCurrent City: from Elmira to Detroit\nTransportation: Flight Number: F3808916, from Elmira to Detroit, Departure Time: 05:53, Arrival Time: 07:03, Cost: $145 per person\nBreakfast: Not available due to early flight.\nAttraction: Detroit Institute of Arts, Detroit\nLunch: Vapour Pub & Brewery, Detroit, Cost: $80, Cuisines: \"French, BBQ, Fast Food, Cafe, Seafood\"\nDinner: A Dong Restaurant, Detroit, Cost: $40, Cuisines: \"Tea, Cafe, Pizza\"\nAccommodation: Cozy 1 bedroom in the heart of Fort Greene, Detroit, Cost: $751, Entire home/apt, House Rules: No pets & No parties, Minimum Nights: 3, Maximum Occupancy: 6\n\nNumber of People = 2\nTotal Cost = 2 * 145 + 2 * 80 + 2 * 40 + 751 = $1181\n\nDay 2: March 26th, 2022\nCurrent City: Detroit\nTransportation: -\nBreakfast: Southern Bliss Bakery, Detroit, Cost: $28, Cuisines: \"Tea, BBQ, Desserts, Seafood\"\nAttraction: Belle Isle Aquarium, Detroit\nLunch: Turquoise Turkish Ice-cream, Detroit, Cost: $79, Cuisines: \"Fast Food, Tea, Desserts, Italian\"\nDinner: Bistro Flamme Bois, Detroit, Cost: $100, Cuisines: \"Chinese, Bakery, BBQ\"\nAccommodation: Cozy 1 bedroom in the heart of Fort Greene, Detroit, Cost: $751, Entire home/apt, House Rules: No pets & No parties, Minimum Nights: 3, Maximum Occupancy: 6\n\nNumber of People = 2\nTotal Cost = 2 * 28 + 2 * 79 + 2 * 100 + 751 = $1165\n\nDay 3: March 27th, 2022\nCurrent City: from Detroit to Elmira\nTransportation: Flight Number: F3807496, from Detroit to Elmira, Departure Time: 21:03, Arrival Time: 22:09, Cost: $122 per person\nBreakfast: Cafe And More, Detroit, Cost: $41, Cuisines: \"Tea, Bakery, Italian\"\nAttraction: Detroit Riverwalk, Detroit\nLunch: Mandap - Hotel Express Towers, Detroit, Cost: $37, Cuisines: \"Pizza, Fast Food\"\nDinner: Not available due to evening flight.\nAccommodation: -\n\nNumber of People = 2\nTotal Cost = 2 * 41 + 2 * 37 + 2 * 122 = $400\n\nTotal cost across all days = $1181 + $1165 + $400 = $2746\n\nUnfortunately, the total cost exceeds the specified budget of $2,200. To adjust the plan within the budget, we can consider the following changes:\n\n- Switch from flights to self-driving or taxi, although the taxi cost is also high.\n- Choose a less expensive accommodation option that is pet-friendly.\n- Reduce meal costs by selecting more budget-friendly restaurants.\n\nPlease note that the provided accommodation options do not explicitly mention being pet-friendly, which is a requirement. We may need to find alternative accommodations that meet this criterion. Additionally, the total cost needs to be recalculated after making the necessary adjustments to ensure it fits within the budget.", "gpt-4-1106-preview_direct_sole-planning_parsed_results": [{"day": 1, "current_city": "from Elmira to Detroit", "transportation": "Flight Number: F3808916, from Elmira to Detroit, Departure Time: 05:53, Arrival Time: 07:03", "breakfast": "-", "attraction": "Detroit Institute of Arts, Detroit;", "lunch": "Vapour Pub & Brewery, Detroit", "dinner": "A Dong Restaurant, Detroit", "accommodation": "Cozy 1 bedroom in the heart of Fort Greene, Detroit"}, {"day": 2, "current_city": "Detroit", "transportation": "-", "breakfast": "Southern Bliss Bakery, Detroit", "attraction": "Belle Isle Aquarium, Detroit;", "lunch": "Turquoise Turkish Ice-cream, Detroit", "dinner": "Bistro Flamme Bois, Detroit", "accommodation": "Cozy 1 bedroom in the heart of Fort Greene, Detroit"}, {"day": 3, "current_city": "from Detroit to Elmira", "transportation": "Flight Number: F3807496, from Detroit to Elmira, Departure Time: 21:03, Arrival Time: 22:09", "breakfast": "Cafe And More, Detroit", "attraction": "Detroit Riverwalk, Detroit;", "lunch": "Mandap - Hotel Express Towers, Detroit", "dinner": "-", "accommodation": "-"}]}]