[{"gpt-4-1106-preview_direct_sole-planning_results": "Travel Plan:\n\nDay 1: March 13, 2022\nCurrent City: from Palm Springs to Houston\nTransportation: Flight Number: F3839339, from Palm Springs to Houston, Departure Time: 06:07, Arrival Time: 10:59\nBreakfast: -\nAttraction: Downtown Aquarium, Houston\nLunch: Jalapenos, Houston\nDinner: Super Bakery, Houston\nAccommodation: Sunny and Airy near Manhattan, Houston\n\nDay 2: March 14, 2022\nCurrent City: Houston\nTransportation: -\nBreakfast: Sheetla Dhaba, Houston\nAttraction: Space Center Houston, Houston\nLunch: Royal Mart, Houston\nDinner: Matchbox, Houston\nAccommodation: Sunny and Airy near Manhattan, Houston\n\nDay 3: March 15, 2022\nCurrent City: from Houston to Austin\nTransportation: Flight Number: F4001665, from Houston to Austin, Departure Time: 10:45, Arrival Time: 11:29\nBreakfast: Earthen Spices, Houston\nAttraction: Texas Capitol, Austin\nLunch: Wildflour Cafe + Bakery, Austin\nDinner: The Kasbah, Austin\nAccommodation: Cozy room in south Harlem - 10 mins to Columbia, Austin\n\nDay 4: March 16, 2022\nCurrent City: Austin\nTransportation: -\nBreakfast: Mehfil-e-Handi, Austin\nAttraction: Zilker Metropolitan Park, Austin\nLunch: Chili's, Austin\nDinner: Tandoori Nights, Austin\nAccommodation: Cozy room in south Harlem - 10 mins to Columbia, Austin\n\nDay 5: March 17, 2022\nCurrent City: from Austin to Dallas\nTransportation: Flight Number: F4007286, from Austin to Dallas, Departure Time: 06:06, Arrival Time: 06:55\nBreakfast: Cup-a-licious, Austin\nAttraction: The Dallas World Aquarium, Dallas\nLunch: Coconuts Fish Cafe, Dallas\nDinner: 1918 Bistro & Grill, Dallas\nAccommodation: 1BR, elevator, kitchen, doorman!, Dallas\n\nDay 6: March 18, 2022\nCurrent City: Dallas\nTransportation: -\nBreakfast: Yanki Sizzlers, Dallas\nAttraction: The Sixth Floor Museum at Dealey Plaza, Dallas\nLunch: Aravali Owls, Dallas\nDinner: Kebab Xpress, Dallas\nAccommodation: 1BR, elevator, kitchen, doorman!, Dallas\n\nDay 7: March 19, 2022\nCurrent City: from Dallas to Palm Springs\nTransportation: Flight Number: F3675114, from Dallas to Palm Springs, Departure Time: 18:55, Arrival Time: 20:19\nBreakfast: Haldiram's, Dallas\nAttraction: Reunion Tower, Dallas\nLunch: Delhicacy, Dallas\nDinner: -\nAccommodation: -\n\nNote: The travel plan adheres to the budget, includes diverse meals and attractions, and ensures that the final day returns to the origin city. Accommodations are booked for at least the minimum nights required.", "gpt-4-1106-preview_direct_sole-planning_parsed_results": [{"day": 1, "current_city": "from Palm Springs to Houston", "transportation": "Flight Number: F3839339, from Palm Springs to Houston, Departure Time: 06:07, Arrival Time: 10:59", "breakfast": "-", "attraction": "Downtown Aquarium, Houston;", "lunch": "Jalapenos, Houston", "dinner": "Super Bakery, Houston", "accommodation": "Sunny and Airy near Manhattan, Houston"}, {"day": 2, "current_city": "Houston", "transportation": "-", "breakfast": "Sheetla Dhaba, Houston", "attraction": "Space Center Houston, Houston;", "lunch": "Royal Mart, Houston", "dinner": "Matchbox, Houston", "accommodation": "Sunny and Airy near Manhattan, Houston"}, {"day": 3, "current_city": "from Houston to Austin", "transportation": "Flight Number: F4001665, from Houston to Austin, Departure Time: 10:45, Arrival Time: 11:29", "breakfast": "Earthen Spices, Houston", "attraction": "Texas Capitol, Austin;", "lunch": "Wildflour Cafe + Bakery, Austin", "dinner": "The Kasbah, Austin", "accommodation": "Cozy room in south Harlem - 10 mins to Columbia, Austin"}, {"day": 4, "current_city": "Austin", "transportation": "-", "breakfast": "Mehfil-e-Handi, Austin", "attraction": "Zilker Metropolitan Park, Austin;", "lunch": "Chili's, Austin", "dinner": "Tandoori Nights, Austin", "accommodation": "Cozy room in south Harlem - 10 mins to Columbia, Austin"}, {"day": 5, "current_city": "from Austin to Dallas", "transportation": "Flight Number: F4007286, from Austin to Dallas, Departure Time: 06:06, Arrival Time: 06:55", "breakfast": "Cup-a-licious, Austin", "attraction": "The Dallas World Aquarium, Dallas;", "lunch": "Coconuts Fish Cafe, Dallas", "dinner": "1918 Bistro & Grill, Dallas", "accommodation": "1BR, elevator, kitchen, doorman!, Dallas"}, {"day": 6, "current_city": "Dallas", "transportation": "-", "breakfast": "Yanki Sizzlers, Dallas", "attraction": "The Sixth Floor Museum at Dealey Plaza, Dallas;", "lunch": "Aravali Owls, Dallas", "dinner": "Kebab Xpress, Dallas", "accommodation": "1BR, elevator, kitchen, doorman!, Dallas"}, {"day": 7, "current_city": "from Dallas to Palm Springs", "transportation": "Flight Number: F3675114, from Dallas to Palm Springs, Departure Time: 18:55, Arrival Time: 20:19", "breakfast": "Haldiram's, Dallas", "attraction": "Reunion Tower, Dallas;", "lunch": "Delhicacy, Dallas", "dinner": "-", "accommodation": "-"}]}]