[{"gpt-4-1106-preview_direct_sole-planning_results": "Travel Plan:\n\nDay 1: March 13, 2022\nCurrent City: from Las Vegas to Amarillo\nTransportation: Flight Number: F3974661, from Las Vegas to Amarillo, Departure Time: 12:00, Arrival Time: 16:01, Cost: $235\nLunch: The Cinnamon Kitchen, Amarillo, Cost: $69 (Assuming lunch after arrival)\nAttraction: Cadillac Ranch, Amarillo, Cost: $0 (Free attraction)\nDinner: Anand Restaurant, Amarillo, Cost: $53\nAccommodation: Harlem Humble Abode - 1 bedroom - Cute and Quaint, Amarillo, Cost: $409 (Pet-friendly as per requirement)\n\nTotal cost for Day 1: $235 (Flight) + $69 (Lunch) + $0 (Attraction) + $53 (Dinner) + $409 (Accommodation) = $766\n\nDay 2: March 14, 2022\nCurrent City: Amarillo\nTransportation: -, Cost: $0\nBreakfast: Wood Box Cafe, Amarillo, Cost: $11\nAttraction: Amarillo Zoo, Amarillo, Cost: $0 (Assuming free entry)\nLunch: Punjabi Chaap Corner, Amarillo, Cost: $62\nDinner: Sigree Global Grill, Amarillo, Cost: $35\nAccommodation: Harlem Humble Abode - 1 bedroom - Cute and Quaint, Amarillo, Cost: $409 (Pet-friendly as per requirement)\n\nTotal cost for Day 2: $0 (Transportation) + $11 (Breakfast) + $0 (Attraction) + $62 (Lunch) + $35 (Dinner) + $409 (Accommodation) = $517\n\nDay 3: March 15, 2022\nCurrent City: from Amarillo to Lubbock\nTransportation: Self-driving, from Amarillo to Lubbock, Cost: $9\nBreakfast: Subway, Amarillo, Cost: $92\nAttraction: National Ranching Heritage Center, Lubbock, Cost: $0 (Assuming free entry)\nLunch: Paris 6 Classique, Lubbock, Cost: $91\nDinner: The Town House Cafe, Lubbock, Cost: $90\nAccommodation: Private bedroom in UWS Apartment, Lubbock, Cost: $709 (Pet-friendly as per requirement)\n\nTotal cost for Day 3: $9 (Transportation) + $92 (Breakfast) + $0 (Attraction) + $91 (Lunch) + $90 (Dinner) + $709 (Accommodation) = $991\n\nDay 4: March 16, 2022\nCurrent City: Lubbock\nTransportation: -, Cost: $0\nBreakfast: Assam Tea Corner, Lubbock, Cost: $52\nAttraction: Buddy Holly Center, Lubbock, Cost: $0 (Assuming free entry)\nLunch: Sultanat, Lubbock, Cost: $72\nDinner: San Carlo, Lubbock, Cost: $56\nAccommodation: Private bedroom in UWS Apartment, Lubbock, Cost: $709 (Pet-friendly as per requirement)\n\nTotal cost for Day 4: $0 (Transportation) + $52 (Breakfast) + $0 (Attraction) + $72 (Lunch) + $56 (Dinner) + $709 (Accommodation) = $889\n\nDay 5: March 17, 2022\nCurrent City: from Lubbock to Las Vegas\nTransportation: Flight Number: F4024113, from Lubbock to Las Vegas, Departure Time: 17:40, Arrival Time: 17:47, Cost: $165\nBreakfast: Keventers, Lubbock, Cost: $51\nAttraction: American Windmill Museum, Lubbock, Cost: $0 (Assuming free entry)\nLunch: Grand Barbeque Buffet Restaurant, Lubbock, Cost: $20\nDinner: - (Assuming dinner will be in Las Vegas or on the flight), Cost: $0\nAccommodation: - (Last day, no accommodation needed), Cost: $0\n\nTotal cost for Day 5: $165 (Flight) + $51 (Breakfast) + $0 (Attraction) + $20 (Lunch) + $0 (Dinner) + $0 (Accommodation) = $236\n\nThe total cost of this trip is the sum of the costs from day 1, day 2, day 3, day 4, and day 5. It is $766 + $517 + $991 + $889 + $236 = $3399, which is less than the required budget of $3700.", "gpt-4-1106-preview_direct_sole-planning_parsed_results": [{"day": 1, "current_city": "from Las Vegas to Amarillo", "transportation": "Flight Number: F3974661, from Las Vegas to Amarillo, Departure Time: 12:00, Arrival Time: 16:01", "breakfast": "-", "attraction": "Cadillac Ranch, Amarillo;", "lunch": "The Cinnamon Kitchen, Amarillo", "dinner": "Anand Restaurant, Amarillo", "accommodation": "Harlem Humble Abode - 1 bedroom - Cute and Quaint, Amarillo"}, {"day": 2, "current_city": "Amarillo", "transportation": "-", "breakfast": "Wood Box Cafe, Amarillo", "attraction": "Amarillo Zoo, Amarillo;", "lunch": "Punjabi Chaap Corner, Amarillo", "dinner": "Sigree Global Grill, Amarillo", "accommodation": "Harlem Humble Abode - 1 bedroom - Cute and Quaint, Amarillo"}, {"day": 3, "current_city": "from Amarillo to Lubbock", "transportation": "Self-driving, from Amarillo to Lubbock", "breakfast": "Subway, Amarillo", "attraction": "National Ranching Heritage Center, Lubbock;", "lunch": "Paris 6 Classique, Lubbock", "dinner": "The Town House Cafe, Lubbock", "accommodation": "Private bedroom in UWS Apartment, Lubbock"}, {"day": 4, "current_city": "Lubbock", "transportation": "-", "breakfast": "Assam Tea Corner, Lubbock", "attraction": "Buddy Holly Center, Lubbock;", "lunch": "Sultanat, Lubbock", "dinner": "San Carlo, Lubbock", "accommodation": "Private bedroom in UWS Apartment, Lubbock"}, {"day": 5, "current_city": "from Lubbock to Las Vegas", "transportation": "Flight Number: F4024113, from Lubbock to Las Vegas, Departure Time: 17:40, Arrival Time: 17:47", "breakfast": "Keventers, Lubbock", "attraction": "American Windmill Museum, Lubbock;", "lunch": "Grand Barbeque Buffet Restaurant, Lubbock", "dinner": "-", "accommodation": "-"}]}]