[{"gpt-4-1106-preview_direct_sole-planning_results": "Travel Plan:\n\nDay 1:\nCurrent City: from Appleton to Charlotte\nTransportation: Flight Number: F3796721, from Appleton to Charlotte, Departure Time: 06:58, Arrival Time: 10:25\nBreakfast: -\nAttraction: Levine Museum of the New South, Charlotte\nLunch: Olive Tree Cafe, Charlotte\nDinner: Nagaland's Kitchen, Charlotte\nAccommodation: Elegant Studio Apt in Prospect Heights, Charlotte\n\nDay 2:\nCurrent City: Charlotte\nTransportation: -\nBreakfast: Central Perk 7, Charlotte\nAttraction: Discovery Place Science, Charlotte; The Mint Museum, Charlotte.\nLunch: Cafe Maple Street, Charlotte\nDinner: Kylin Skybar, Charlotte\nAccommodation: Elegant Studio Apt in Prospect Heights, Charlotte\n\nDay 3:\nCurrent City: from Charlotte to Appleton\nTransportation: Flight Number: F3788979, from Charlotte to Appleton, Departure Time: 22:52, Arrival Time: 00:07\nBreakfast: Subway, Charlotte\nAttraction: NASCAR Hall of Fame, Charlotte.\nLunch: Pind Balluchi, Charlotte\nDinner: -\nAccommodation: -\n\nNote: The chosen accommodation, \"Elegant Studio Apt in Prospect Heights,\" allows visitors as per the house rules and fits within the budget constraints. The minimum nights stay is 2, which aligns with the duration of the stay in Charlotte. The flight options and attractions have been selected to fit within the budget and to ensure a diverse experience without repeating any visits.", "gpt-4-1106-preview_direct_sole-planning_parsed_results": [{"day": 1, "current_city": "from Appleton to Charlotte", "transportation": "Flight Number: F3796721, from Appleton to Charlotte, Departure Time: 06:58, Arrival Time: 10:25", "breakfast": "-", "attraction": "Levine Museum of the New South, Charlotte;", "lunch": "Olive Tree Cafe, Charlotte", "dinner": "Nagaland's Kitchen, Charlotte", "accommodation": "Elegant Studio Apt in Prospect Heights, Charlotte"}, {"day": 2, "current_city": "Charlotte", "transportation": "-", "breakfast": "Central Perk 7, Charlotte", "attraction": "Discovery Place Science, Charlotte;The Mint Museum, Charlotte;", "lunch": "Cafe Maple Street, Charlotte", "dinner": "Kylin Skybar, Charlotte", "accommodation": "Elegant Studio Apt in Prospect Heights, Charlotte"}, {"day": 3, "current_city": "from Charlotte to Appleton", "transportation": "Flight Number: F3788979, from Charlotte to Appleton, Departure Time: 22:52, Arrival Time: 00:07", "breakfast": "Subway, Charlotte", "attraction": "NASCAR Hall of Fame, Charlotte;", "lunch": "Pind Balluchi, Charlotte", "dinner": "-", "accommodation": "-"}]}]