[{"gpt-4-1106-preview_direct_sole-planning_results": "Travel Plan:\n\nDay 1: March 3, 2022\nCurrent City: from Newark to Savannah\nTransportation: Flight Number: F4070527, from Newark to Savannah, Departure Time: 08:54, Arrival Time: 11:27\nBreakfast: - (Assuming breakfast will be had before departure or during the flight)\nAttraction: Forsyth Park, Savannah\nLunch: Sr. Sol 1, Savannah (Mediterranean cuisine)\nDinner: The Mad Teapot/The Wishing Chair, Savannah (Mexican cuisine)\nAccommodation: Lapp House, Savannah (Child-friendly, Entire home/apt, suitable for children under 10)\n\nDay 2: March 4, 2022\nCurrent City: Savannah\nTransportation: -\nBreakfast: Country's Barbecue, Savannah (Cafe, Bakery)\nAttraction: Savannah Historic District, Savannah; Savannah's Waterfront, Savannah\nLunch: Bosphorous Turkish Cuisine, Savannah (Mediterranean cuisine)\nDinner: Manohar Dairy And Restaurant, Savannah (Indian cuisine)\nAccommodation: Lapp House, Savannah (Child-friendly, Entire home/apt, suitable for children under 10)\n\nDay 3: March 5, 2022\nCurrent City: from Savannah to Newark\nTransportation: Flight Number: F3903501, from Savannah to Newark, Departure Time: 06:02, Arrival Time: 08:11\nBreakfast: - (Assuming breakfast will be had after arrival or during the flight)\nAttraction: - (No time for attractions due to early flight)\nLunch: - (Assuming lunch will be had after arrival in Newark)\nDinner: - (Not applicable as the travelers have returned to their origin city)\nAccommodation: -\n\nPlease note that the budget has been considered when selecting flights and accommodations. Attractions and meals have been chosen based on the dietary preferences mentioned and the suitability for children under 10. The attractions listed for Day 2 are close to each other, allowing for a leisurely exploration of Savannah.", "gpt-4-1106-preview_direct_sole-planning_parsed_results": [{"day": 1, "current_city": "from Newark to Savannah", "transportation": "Flight Number: F4070527, from Newark to Savannah, Departure Time: 08:54, Arrival Time: 11:27", "breakfast": "-", "attraction": "Forsyth Park, Savannah;", "lunch": "Sr. Sol 1, Savannah", "dinner": "The Mad Teapot/The Wishing Chair, Savannah", "accommodation": "Lapp House, Savannah"}, {"day": 2, "current_city": "Savannah", "transportation": "-", "breakfast": "Country's Barbecue, Savannah", "attraction": "Savannah Historic District, Savannah;Savannah's Waterfront, Savannah;", "lunch": "Bosphorous Turkish Cuisine, Savannah", "dinner": "Manohar Dairy And Restaurant, Savannah", "accommodation": "Lapp House, Savannah"}, {"day": 3, "current_city": "from Savannah to Newark", "transportation": "Flight Number: F3903501, from Savannah to Newark, Departure Time: 06:02, Arrival Time: 08:11", "breakfast": "-", "attraction": "-", "lunch": "-", "dinner": "-", "accommodation": "-"}]}]