[{"gpt-4-1106-preview_direct_sole-planning_results": "Travel Plan:\n\nDay 1: March 19th, 2022\nCurrent City: from Houston to Wichita\nTransportation: Flight Number: F3923935, from Houston to Wichita, Departure Time: 09:32, Arrival Time: 11:24\nBreakfast: - (Assuming breakfast will be had before departure or during the flight)\nAttraction: Exploration Place, Wichita\nLunch: Jahanpanah, Wichita\nDinner: The B.A.W.A, Wichita\nAccommodation: Secret Garden Apartment in Bed Stuy, Brooklyn, Wichita (Smoking allowed)\n\nDay 2: March 20th, 2022\nCurrent City: Wichita\nTransportation: -\nBreakfast: Cafe Cornucopia, Wichita\nAttraction: Old Cowtown Museum, Wichita; The Keeper of the Plains, Wichita\nLunch: Koramangala Social, Wichita\nDinner: Rumi's Kitchen, Wichita\nAccommodation: Secret Garden Apartment in Bed Stuy, Brooklyn, Wichita (Smoking allowed)\n\nDay 3: March 21st, 2022\nCurrent City: from Wichita to Houston\nTransportation: Flight Number: F3827300, from Wichita to Houston, Departure Time: 12:10, Arrival Time: 14:38\nBreakfast: - (Assuming breakfast will be had at the accommodation or before the flight)\nAttraction: - (No time for attractions due to travel back to Houston)\nLunch: - (Assuming lunch will be had during the flight or upon arrival in Houston)\nDinner: - (Back in Houston, end of travel plan)\nAccommodation: -\n\nNote: The accommodation chosen allows smoking, which is a necessity for the group. The travel plan includes diverse attractions and meals at different restaurants each day. The flights chosen are within the budget and time constraints. The accommodation has been booked for two nights, adhering to the minimum nights' requirement. The plan ensures the group returns to the origin city on the last day.", "gpt-4-1106-preview_direct_sole-planning_parsed_results": [{"day": 1, "current_city": "from Houston to Wichita", "transportation": "Flight Number: F3923935, from Houston to Wichita, Departure Time: 09:32, Arrival Time: 11:24", "breakfast": "-", "attraction": "Exploration Place, Wichita", "lunch": "Jahanpanah, Wichita", "dinner": "The B.A.W.A, Wichita", "accommodation": "Secret Garden Apartment in Bed Stuy, Wichita"}, {"day": 2, "current_city": "Wichita", "transportation": "-", "breakfast": "Cafe Cornucopia, Wichita", "attraction": "Old Cowtown Museum, Wichita;The Keeper of the Plains, Wichita", "lunch": "Koramangala Social, Wichita", "dinner": "Rumi's Kitchen, Wichita", "accommodation": "Secret Garden Apartment in Bed Stuy, Wichita"}, {"day": 3, "current_city": "from Wichita to Houston", "transportation": "Flight Number: F3827300, from Wichita to Houston, Departure Time: 12:10, Arrival Time: 14:38", "breakfast": "-", "attraction": "-", "lunch": "-", "dinner": "-", "accommodation": "-"}]}]