[{"gpt-4-1106-preview_direct_sole-planning_results": "Travel Plan:\n\nDay 1: March 23, 2022\nCurrent City: from Louisville to Fort Myers\nTransportation: Flight Number: F3987658, from Louisville to Fort Myers, Departure Time: 06:54, Arrival Time: 09:10\nBreakfast: - (Assuming breakfast in Louisville before departure)\nAttraction: Edison & Ford Winter Estates, Fort Myers\nLunch: The Refinery, Fort Myers\nDinner: Al Mukhtar Bakery, Fort Myers\nAccommodation: Quiet and beautiful apartment near central park, Fort Myers\n\nDay 2: March 24, 2022\nCurrent City: Fort Myers\nTransportation: -\nBreakfast: Haunted, Fort Myers\nAttraction: Six Mile Cypress Slough Preserve, Fort Myers\nLunch: Maachh Bhaat, Fort Myers\nDinner: Eggers Madhouse, Fort Myers\nAccommodation: Quiet and beautiful apartment near central park, Fort Myers\n\nDay 3: March 25, 2022\nCurrent City: from Fort Myers to Orlando\nTransportation: Flight Number: F4014747, from Fort Myers to Orlando, Departure Time: 16:49, Arrival Time: 17:39\nBreakfast: Enter The Dragon, Fort Myers\nAttraction: Manatee Park, Fort Myers\nLunch: Puran Chand Ambala Wale Di Hatti, Fort Myers\nDinner: - (Assuming dinner in Orlando after arrival)\nAccommodation: Private furnished bedroom in Williamsburg, Orlando\n\nDay 4: March 26, 2022\nCurrent City: Orlando\nTransportation: -\nBreakfast: Fuji Japanese Steakhouse, Orlando\nAttraction: SeaWorld Orlando, Orlando; The Wheel at ICON Park, Orlando\nLunch: Turquoise Villa, Orlando\nDinner: The Tandoori Times, Orlando\nAccommodation: Private furnished bedroom in Williamsburg, Orlando\n\nDay 5: March 27, 2022\nCurrent City: from Orlando to Tampa\nTransportation: Self-driving, from Orlando to Tampa, duration: 1 hour 18 mins, distance: 136 km, cost: 6\nBreakfast: Crust N Cakes, Orlando\nAttraction: Madame Tussauds Orlando, Orlando\nLunch: Indochi Cafe & Restaurant, Orlando\nDinner: - (Assuming dinner in Tampa after arrival)\nAccommodation: Lovely Guestroom in Elevator Building, Tampa\n\nDay 6: March 28, 2022\nCurrent City: Tampa\nTransportation: -\nBreakfast: Kobe Hibachi & Sushi, Tampa\nAttraction: The Florida Aquarium, Tampa; Busch Gardens Tampa Bay, Tampa\nLunch: The Tin Cow, Tampa\nDinner: Peg Leg Pete's, Tampa\nAccommodation: Lovely Guestroom in Elevator Building, Tampa\n\nDay 7: March 29, 2022\nCurrent City: from Tampa to Louisville\nTransportation: Flight Number: F3963197, from Tampa to Louisville, Departure Time: 11:38, Arrival Time: 13:42\nBreakfast: Butterburrs, Tampa\nAttraction: - (Assuming no time for attractions due to departure)\nLunch: - (Assuming lunch on the flight or after arrival in Louisville)\nDinner: - (Assuming dinner in Louisville after return)\nAccommodation: -\n\nPlease note that the travel plan adheres to the budget of $7,800, considering the costs of flights, accommodations, meals, and attractions. The plan also ensures that there are no repeated visits to the same city or attraction and that the final day returns to the origin city, Louisville.", "gpt-4-1106-preview_direct_sole-planning_parsed_results": [{"days": 1, "current_city": "from Louisville to Fort Myers", "transportation": "Flight Number: F3987658, from Louisville to Fort Myers, Departure Time: 06:54, Arrival Time: 09:10", "breakfast": "-", "attraction": "Edison & Ford Winter Estates, Fort Myers;", "lunch": "The Refinery, Fort Myers", "dinner": "Al Mukhtar Bakery, Fort Myers", "accommodation": "Quiet and beautiful apartment near central park, Fort Myers"}, {"days": 2, "current_city": "Fort Myers", "transportation": "-", "breakfast": "Haunted, Fort Myers", "attraction": "Six Mile Cypress Slough Preserve, Fort Myers;", "lunch": "Maachh Bhaat, Fort Myers", "dinner": "Eggers Madhouse, Fort Myers", "accommodation": "Quiet and beautiful apartment near central park, Fort Myers"}, {"days": 3, "current_city": "from Fort Myers to Orlando", "transportation": "Flight Number: F4014747, from Fort Myers to Orlando, Departure Time: 16:49, Arrival Time: 17:39", "breakfast": "Enter The Dragon, Fort Myers", "attraction": "Manatee Park, Fort Myers;", "lunch": "Puran Chand Ambala Wale Di Hatti, Fort Myers", "dinner": "-", "accommodation": "Private furnished bedroom in Williamsburg, Orlando"}, {"days": 4, "current_city": "Orlando", "transportation": "-", "breakfast": "Fuji Japanese Steakhouse, Orlando", "attraction": "SeaWorld Orlando, Orlando; The Wheel at ICON Park, Orlando;", "lunch": "Turquoise Villa, Orlando", "dinner": "The Tandoori Times, Orlando", "accommodation": "Private furnished bedroom in Williamsburg, Orlando"}, {"days": 5, "current_city": "from Orlando to Tampa", "transportation": "Self-driving, from Orlando to Tampa, duration: 1 hour 18 mins, distance: 136 km, Cost: 6", "breakfast": "Crust N Cakes, Orlando", "attraction": "Madame Tussauds Orlando, Orlando;", "lunch": "Indochi Cafe & Restaurant, Orlando", "dinner": "-", "accommodation": "Lovely Guestroom in Elevator Building, Tampa"}, {"days": 6, "current_city": "Tampa", "transportation": "-", "breakfast": "Kobe Hibachi & Sushi, Tampa", "attraction": "The Florida Aquarium, Tampa; Busch Gardens Tampa Bay, Tampa;", "lunch": "The Tin Cow, Tampa", "dinner": "Peg Leg Pete's, Tampa", "accommodation": "Lovely Guestroom in Elevator Building, Tampa"}, {"days": 7, "current_city": "from Tampa to Louisville", "transportation": "Flight Number: F3963197, from Tampa to Louisville, Departure Time: 11:38, Arrival Time: 13:42", "breakfast": "Butterburrs, Tampa", "attraction": "-", "lunch": "-", "dinner": "-", "accommodation": "-"}]}]