[{"gpt-4-1106-preview_direct_sole-planning_results": "Travel Plan:\n\nDay 1: March 11, 2022\nCurrent City: Rapid City\nTransportation: Self-driving from Rapid City to Colorado Springs, Duration: 6 hours 59 mins, Distance: 735 km, Cost: 36\nBreakfast: -\nAttraction: -\nLunch: -\nDinner: -\nAccommodation: Large sunny park slope apartment, Colorado Springs, Cost: 82, Room Type: Entire home/apt, House Rules: No smoking & No parties & No pets, Minimum Nights: 1, Maximum Occupancy: 3\n\nNumber of People = 7\nTotal Cost = 7 * 36 + 3 * 82 = 522\nAccommodation Minimum Nights: 1/1\n\nDay 2: March 12, 2022\nCurrent City: Colorado Springs\nTransportation: -\nBreakfast: Raglan Road Irish Pub and Restaurant, Colorado Springs, Cost: 97, Cuisines: Chinese, Bakery, Pizza, Mediterranean\nAttraction: Garden of the Gods, Colorado Springs\nLunch: Derby, Colorado Springs, Cost: 67, Cuisines: Desserts, Fast Food\nDinner: GoGourmet, Colorado Springs, Cost: 66, Cuisines: Desserts, Bakery, Fast Food, Indian, Seafood\nAccommodation: Large sunny park slope apartment, Colorado Springs, Cost: 82, Room Type: Entire home/apt, House Rules: No smoking & No parties & No pets, Minimum Nights: 1, Maximum Occupancy: 3\n\nNumber of People = 7\nTotal Cost = 7 * 97 + 7 * 67 + 7 * 66 + 3 * 82 = 2032\nAccommodation Minimum Nights: 1/1\n\nDay 3: March 13, 2022\nCurrent City: from Colorado Springs to Denver\nTransportation: Flight Number: F3822807, from Colorado Springs to Denver, Price: 24, DepTime: 09:08, ArrTime: 10:22, FlightDate: 2022-03-13\nBreakfast: Club Tokyo - Best Western Skycity Hotel, Colorado Springs, Cost: 64, Cuisines: Tea, Bakery, Mediterranean, Fast Food\nAttraction: Denver Zoo, Denver\nLunch: The Urban Socialite, Denver, Cost: 34, Cuisines: Cafe, Indian, Desserts, Italian\nDinner: Tasty Fare, Denver, Cost: 79, Cuisines: French, BBQ, Fast Food\nAccommodation: Harlem cozy nights, Denver, Cost: 457, Room Type: Entire home/apt, House Rules: No visitors, Minimum Nights: 4, Maximum Occupancy: 3\n\nNumber of People = 7\nTotal Cost = 7 * 24 + 7 * 64 + 7 * 34 + 7 * 79 + 3 * 457 = 3085\nAccommodation Minimum Nights: 1/4\n\nDay 4: March 14, 2022\nCurrent City: Denver\nTransportation: -\nBreakfast: Al Yousuf, Denver, Cost: 32, Cuisines: Desserts, Tea, Pizza, French, American\nAttraction: Denver Botanic Gardens, Denver\nLunch: Woods Spice, Denver, Cost: 69, Cuisines: Tea, Cafe, Mexican, Desserts\nDinner: Sweet Sensations, Denver, Cost: 14, Cuisines: Tea, Pizza, BBQ, Italian\nAccommodation: Harlem cozy nights, Denver, Cost: 457, Room Type: Entire home/apt, House Rules: No visitors, Minimum Nights: 4, Maximum Occupancy: 3\n\nNumber of People = 7\nTotal Cost = 7 * 32 + 7 * 69 + 7 * 14 + 3 * 457 = 2739\nAccommodation Minimum Nights: 2/4\n\nDay 5: March 15, 2022\nCurrent City: from Denver to Alamosa\nTransportation: Flight Number: F3837889, from Denver to Alamosa, Price: 69, DepTime: 16:17, ArrTime: 17:15, FlightDate: 2022-03-15\nBreakfast: Cafe Diva, Denver, Cost: 44, Cuisines: Chinese, Cafe, Desserts, Fast Food\nAttraction: San Luis Valley Museum | Alamosa, Alamosa\nLunch: Atlanta Highway Seafood Market, Alamosa, Cost: 68, Cuisines: Fast Food, Desserts, Seafood\nDinner: Riverwalk Cafe, Alamosa, Cost: 97, Cuisines: Tea, Pizza, Fast Food\nAccommodation: Comfortable studio suite in midtown Manhattan, Alamosa, Cost: 67, Room Type: Entire home/apt, House Rules: No parties & No smoking & No visitors, Minimum Nights: 30, Maximum Occupancy: 2\n\nNumber of People = 7\nTotal Cost = 7 * 69 + 7 * 44 + 7 * 68 + 7 * 97 + 4 * 67 = 3155\nAccommodation Minimum Nights: 1/30\n\nDay 6: March 16, 2022\nCurrent City: Alamosa\nTransportation: -\nBreakfast: Coffee to Cocktail Bar - Hyatt Place, Alamosa, Cost: 35, Cuisines: Tea, Indian, Desserts, Italian\nAttraction: Rio Grande Farm Park, Alamosa\nLunch: Burger Singh, Alamosa, Cost: 95, Cuisines: Desserts, Tea, BBQ, Chinese, Seafood\nDinner: Street Foods by Punjab Grill, Alamosa, Cost: 55, Cuisines: Pizza, BBQ, Fast Food, Chinese, Mediterranean\nAccommodation: Comfortable studio suite in midtown Manhattan, Alamosa, Cost: 67, Room Type: Entire home/apt, House Rules: No parties & No smoking & No visitors, Minimum Nights: 30, Maximum Occupancy: 2\n\nNumber of People = 7\nTotal Cost = 7 * 35 + 7 * 95 + 7 * 55 + 4 * 67 = 2739\nAccommodation Minimum Nights: 2/30\n\nDay 7: March 17, 2022\nCurrent City: from Alamosa to Rapid City\nTransportation: Self-driving from Alamosa to Rapid City, Duration: 9 hours 27 mins, Distance: 998 km, Cost: 49\nBreakfast: Cafe LazyMojo, Alamosa, Cost: 26, Cuisines: Tea, Pizza, American, Fast Food\nAttraction: -\nLunch: -\nDinner: -\nAccommodation: -\n\nNumber of People = 7\nTotal Cost = 7 * 49 + 7 * 26 = 525\n\nTotal cost across all days = 522 + 2032 + 3085 + 2739 + 3155 + 2739 + 525 = 14797\n\nRemaining Budget = 16300 - 14797 = 1503\n\nCuisines: The prompt specifies no cuisines, so all cuisines constraints are satisfied.\n\nPlease note that the accommodation on Day 5 and Day 6 has a minimum stay of 30 nights, which is not feasible for this travel plan. However, due to the lack of provided information on alternative accommodations, I have included it to meet the requirement of having entire rooms. Adjustments to the accommodation should be made based on actual availability.", "gpt-4-1106-preview_direct_sole-planning_parsed_results": [{"day": 1, "current_city": "from Rapid City to Colorado Springs", "transportation": "Self-driving from Rapid City to Colorado Springs, Duration: 6 hours 59 mins, Distance: 735 km", "breakfast": "-", "attraction": "-", "lunch": "-", "dinner": "-", "accommodation": "Large sunny park slope apartment, Colorado Springs"}, {"day": 2, "current_city": "Colorado Springs", "transportation": "-", "breakfast": "Raglan Road Irish Pub and Restaurant, Colorado Springs", "attraction": "Garden of the Gods, Colorado Springs", "lunch": "Derby, Colorado Springs", "dinner": "GoGourmet, Colorado Springs", "accommodation": "Large sunny park slope apartment, Colorado Springs"}, {"day": 3, "current_city": "from Colorado Springs to Denver", "transportation": "Flight Number: F3822807, from Colorado Springs to Denver, Departure Time: 09:08, Arrival Time: 10:22", "breakfast": "Club Tokyo - Best Western Skycity Hotel, Colorado Springs", "attraction": "Denver Zoo, Denver", "lunch": "The Urban Socialite, Denver", "dinner": "Tasty Fare, Denver", "accommodation": "Harlem cozy nights, Denver"}, {"day": 4, "current_city": "Denver", "transportation": "-", "breakfast": "Al Yousuf, Denver", "attraction": "Denver Botanic Gardens, Denver", "lunch": "Woods Spice, Denver", "dinner": "Sweet Sensations, Denver", "accommodation": "Harlem cozy nights, Denver"}, {"day": 5, "current_city": "from Denver to Alamosa", "transportation": "Flight Number: F3837889, from Denver to Alamosa, Departure Time: 16:17, Arrival Time: 17:15", "breakfast": "Cafe Diva, Denver", "attraction": "San Luis Valley Museum | Alamosa, Alamosa", "lunch": "Atlanta Highway Seafood Market, Alamosa", "dinner": "Riverwalk Cafe, Alamosa", "accommodation": "Comfortable studio suite in midtown Manhattan, Alamosa"}, {"day": 6, "current_city": "Alamosa", "transportation": "-", "breakfast": "Coffee to Cocktail Bar - Hyatt Place, Alamosa", "attraction": "Rio Grande Farm Park, Alamosa", "lunch": "Burger Singh, Alamosa", "dinner": "Street Foods by Punjab Grill, Alamosa", "accommodation": "Comfortable studio suite in midtown Manhattan, Alamosa"}, {"day": 7, "current_city": "from Alamosa to Rapid City", "transportation": "Self-driving from Alamosa to Rapid City, Duration: 9 hours 27 mins, Distance: 998 km", "breakfast": "Cafe LazyMojo, Alamosa", "attraction": "-", "lunch": "-", "dinner": "-", "accommodation": "-"}]}]