[{"gpt-4-1106-preview_direct_sole-planning_results": "Travel Plan:\n\nDay 1: March 26, 2022\nCurrent City: from Birmingham to Miami\nTransportation: Flight Number: F3592321, from Birmingham to Miami, Departure Time: 06:13, Arrival Time: 09:09, Cost: $201\nBreakfast: -\nAttraction: Bayfront Park, Miami\nLunch: Clocked, Miami, Cost: $49, Cuisines: \"Tea, Italian, Mexican, BBQ, Cafe\"\nDinner: Shorts Burger and Shine, Miami, Cost: $81, Cuisines: \"Chinese, Cafe, Seafood\"\nAccommodation: Simple and clean bedroom with good view and light, Miami, Cost: $669, Maximum Occupancy: 2, House Rules: No children under 10, Minimum Nights: 1\n\nTotal Cost for Day 1 = Flight ($201) + Lunch ($49) + Dinner ($81) + Accommodation ($669) = $1000\n\nDay 2: March 27, 2022\nCurrent City: Miami\nTransportation: -\nBreakfast: Papouli's Mediterranean Cafe & Market, Miami, Cost: $26, Cuisines: \"Tea, Desserts\"\nAttraction: Jungle Island, Miami; P\u00e9rez Art Museum Miami, Miami.\nLunch: Tako Cheena by Pom Pom, Miami, Cost: $60, Cuisines: \"Fast Food, Indian, Desserts, Italian\"\nDinner: AB's Absolute Barbecues, Miami, Cost: $55, Cuisines: \"Desserts, Tea, Pizza, Italian, Fast Food, American\"\nAccommodation: Simple and clean bedroom with good view and light, Miami, Cost: $669, Maximum Occupancy: 2, House Rules: No children under 10, Minimum Nights: 1\n\nTotal Cost for Day 2 = Breakfast ($26) + Lunch ($60) + Dinner ($55) + Accommodation ($669) = $810\n\nDay 3: March 28, 2022\nCurrent City: from Miami to Orlando\nTransportation: Flight Number: F3621691, from Miami to Orlando, Departure Time: 05:41, Arrival Time: 06:46, Cost: $38\nBreakfast: -\nAttraction: SeaWorld Orlando, Orlando\nLunch: Fuji Japanese Steakhouse, Orlando, Cost: $75, Cuisines: \"Tea, Bakery, Desserts\"\nDinner: Turquoise Villa, Orlando, Cost: $55, Cuisines: \"French, Bakery, BBQ, Fast Food\"\nAccommodation: Private furnished bedroom in Williamsburg, Orlando, Cost: $179, Maximum Occupancy: 1, House Rules: No parties & No smoking & No children under 10, Minimum Nights: 5\n\nTotal Cost for Day 3 = Flight ($38) + Lunch ($75) + Dinner ($55) + Accommodation ($179) = $347\n\nDay 4: March 29, 2022\nCurrent City: Orlando\nTransportation: -\nBreakfast: The Tandoori Times, Orlando, Cost: $84, Cuisines: \"Tea, Cafe, BBQ, Italian\"\nAttraction: The Wheel at ICON Park, Orlando; Madame Tussauds Orlando, Orlando.\nLunch: Crust N Cakes, Orlando, Cost: $61, Cuisines: \"Tea, Cafe, Indian, BBQ\"\nDinner: Indochi Cafe & Restaurant, Orlando, Cost: $72, Cuisines: \"Pizza, French, Bakery, Fast Food, Indian, Seafood\"\nAccommodation: Private furnished bedroom in Williamsburg, Orlando, Cost: $179, Maximum Occupancy: 1, House Rules: No parties & No smoking & No children under 10, Minimum Nights: 5\n\nTotal Cost for Day 4 = Breakfast ($84) + Lunch ($61) + Dinner ($72) + Accommodation ($179) = $396\n\nDay 5: March 30, 2022\nCurrent City: from Orlando to Birmingham\nTransportation: Flight Number: F3987879, from Orlando to Birmingham, Departure Time: 14:24, Arrival Time: 15:12, Cost: $116\nBreakfast: Bite N Sip, Orlando, Cost: $76, Cuisines: \"Chinese, Bakery, Cafe, Fast Food\"\nAttraction: Fun Spot America Theme Parks, Orlando\nLunch: Pure Bliss, Orlando, Cost: $84, Cuisines: \"BBQ, Bakery, Pizza, Desserts\"\nDinner: -\nAccommodation: -\n\nTotal Cost for Day 5 = Flight ($116) + Breakfast ($76) + Lunch ($84) = $276\n\nTotal cost across all days = $1000 (Day 1) + $810 (Day 2) + $347 (Day 3) + $396 (Day 4) + $276 (Day 5) = $2829\n\nRemaining Budget = $3500 - $2829 = $671\n\nAll attractions, restaurants, and accommodations are within the destination cities, and no restaurant or attraction is repeated. The travel plan starts and ends in Birmingham, forming a closed circle, and includes two cities in Florida: Miami and Orlando. The transportation modes do not conflict and are appropriate for the cities visited. The accommodations are private rooms, adhering to the solo traveler's needs. The total cost is within the specified budget.", "gpt-4-1106-preview_direct_sole-planning_parsed_results": [{"day": 1, "current_city": "from Birmingham to Miami", "transportation": "Flight Number: F3592321, from Birmingham to Miami, Departure Time: 06:13, Arrival Time: 09:09", "breakfast": "-", "attraction": "Bayfront Park, Miami", "lunch": "Clocked, Miami", "dinner": "Shorts Burger and Shine, Miami", "accommodation": "Simple and clean bedroom with good view and light, Miami"}, {"day": 2, "current_city": "Miami", "transportation": "-", "breakfast": "Papouli's Mediterranean Cafe & Market, Miami", "attraction": "Jungle Island, Miami;P\u00e9rez Art Museum Miami, Miami", "lunch": "Tako Cheena by Pom Pom, Miami", "dinner": "AB's Absolute Barbecues, Miami", "accommodation": "Simple and clean bedroom with good view and light, Miami"}, {"day": 3, "current_city": "from Miami to Orlando", "transportation": "Flight Number: F3621691, from Miami to Orlando, Departure Time: 05:41, Arrival Time: 06:46", "breakfast": "-", "attraction": "SeaWorld Orlando, Orlando", "lunch": "Fuji Japanese Steakhouse, Orlando", "dinner": "Turquoise Villa, Orlando", "accommodation": "Private furnished bedroom in Williamsburg, Orlando"}, {"day": 4, "current_city": "Orlando", "transportation": "-", "breakfast": "The Tandoori Times, Orlando", "attraction": "The Wheel at ICON Park, Orlando;Madame Tussauds Orlando, Orlando", "lunch": "Crust N Cakes, Orlando", "dinner": "Indochi Cafe & Restaurant, Orlando", "accommodation": "Private furnished bedroom in Williamsburg, Orlando"}, {"day": 5, "current_city": "from Orlando to Birmingham", "transportation": "Flight Number: F3987879, from Orlando to Birmingham, Departure Time: 14:24, Arrival Time: 15:12", "breakfast": "Bite N Sip, Orlando", "attraction": "Fun Spot America Theme Parks, Orlando", "lunch": "Pure Bliss, Orlando", "dinner": "-", "accommodation": "-"}]}]