[{"gpt-4-1106-preview_direct_sole-planning_results": "Travel Plan:\n\nDay 1: March 2nd, 2022\nCurrent City: from Daytona Beach to Atlanta\nTransportation: Self-driving, from Daytona Beach to Atlanta, duration: 6 hours 18 mins, distance: 696 km, cost: $34\nBreakfast: - (Assuming breakfast is had before departure)\nAttraction: Georgia Aquarium, Atlanta, Cost: $39.95 per adult, $36.95 per child (under 10)\nLunch: Saffron, Atlanta, Cost: $39, Cuisines: \"Tea, Cafe, Fast Food, Seafood\"\nDinner: Adda, Atlanta, Cost: $22, Cuisines: \"Tea, Mexican, Bakery\"\nAccommodation: Bright, Modern, Clean, Spacious, Brooklyn Home, Atlanta, Cost: $1034, Entire home/apt, House Rules: No children under 10, Minimum Nights: 3\n\nNumber of People = 3\nTotal Cost = 3 * $34 + 3 * $39.95 + 3 * $39 + 3 * $22 + $1034 = $1379.85\nAccommodation Minimum Nights: 1/3\n\nDay 2: March 3rd, 2022\nCurrent City: Atlanta\nTransportation: -\nBreakfast: Asian Bistro, Atlanta, Cost: $27, Cuisines: \"Tea, Bakery, Seafood\"\nAttraction: World of Coca-Cola, Atlanta, Cost: $18 per adult, $14 per child (under 10)\nLunch: Chef Style, Atlanta, Cost: $59, Cuisines: \"Pizza, American, Desserts, Seafood\"\nDinner: Daawat-e-Kashmir, Atlanta, Cost: $19, Cuisines: \"Cafe, Pizza, American, Seafood\"\nAccommodation: Bright, Modern, Clean, Spacious, Brooklyn Home, Atlanta, Cost: $1034, Entire home/apt, House Rules: No children under 10, Minimum Nights: 3\n\nNumber of People = 3\nTotal Cost = 3 * $27 + 3 * $18 + 3 * $14 + 3 * $59 + 3 * $19 + $1034 = $1392\nAccommodation Minimum Nights: 2/3\n\nDay 3: March 4th, 2022\nCurrent City: from Atlanta to Daytona Beach\nTransportation: Self-driving, from Atlanta to Daytona Beach, duration: 6 hours 20 mins, distance: 706 km, cost: $35\nBreakfast: Shri Ram Restaurant, Atlanta, Cost: $55, Cuisines: \"Tea, Mexican, Indian, Fast Food\"\nAttraction: Centennial Olympic Park, Atlanta, Cost: Free\nLunch: Bengali Sweet House, Atlanta, Cost: $39, Cuisines: \"Desserts, American, BBQ, Pizza\"\nDinner: - (Assuming dinner is had after arrival)\nAccommodation: -\n\nNumber of People = 3\nTotal Cost = 3 * $35 + 3 * $55 + 3 * $39 = $387\nAccommodation Minimum Nights: 3/3\n\nTotal cost across all days = $1379.85 + $1392 + $387 = $3158.85\n\nUnfortunately, the total cost exceeds the specified budget of $2,100. To adjust the plan to fit the budget, we can consider the following changes:\n\n- Opt for more budget-friendly meal options.\n- Choose a less expensive accommodation option that still meets the requirements.\n- Reduce the number of paid attractions visited.\n\nRevised Travel Plan with Budget Considerations:\n\nDay 1: March 2nd, 2022\n- Same as above, but with the following changes:\nLunch: Ahata, Atlanta, Cost: $17, Cuisines: \"Tea, Indian, Desserts\"\nDinner: The Krib, Atlanta, Cost: $45, Cuisines: \"Seafood, BBQ, Italian\"\nAccommodation: Unique 2BR Apartment, Atlanta, Cost: $394, Entire home/apt, House Rules: No parties & No pets & No children under 10, Minimum Nights: 2\n\nRevised Day 1 Total Cost = 3 * $34 + 3 * $39.95 + 3 * $17 + 3 * $45 + $394 = $1005.85\n\nDay 2: March 3rd, 2022\n- Same as above, but with the following changes:\nBreakfast: Beliram Degchiwala, Atlanta, Cost: $14, Cuisines: \"Cafe, Pizza\"\nLunch: Shri Rudram, Atlanta, Cost: $35, Cuisines: \"Tea, Chinese, Cafe, Desserts\"\nAccommodation: Unique 2BR Apartment, Atlanta, Cost: $394, Entire home/apt, House Rules: No parties & No pets & No children under 10, Minimum Nights: 2\n\nRevised Day 2 Total Cost = 3 * $14 + 3 * $18 + 3 * $14 + 3 * $35 + 3 * $19 + $394 = $691\n\nDay 3: March 3rd, 2022\n- Same as above, but with the following changes:\nBreakfast: Chawla Snacks, Atlanta, Cost: $48, Cuisines: \"Tea, Pizza\"\n\nRevised Day 3 Total Cost = 3 * $35 + 3 * $48 + 3 * $39 = $366\n\nRevised Total cost across all days = $1005.85 + $691 + $366 = $2062.85\n\nThe revised plan is still slightly over budget. To further reduce costs, consider removing one paid attraction or finding an even more budget-friendly accommodation.", "gpt-4-1106-preview_direct_sole-planning_parsed_results": [{"day": 1, "current_city": "from Daytona Beach to Atlanta", "transportation": "Self-driving, from Daytona Beach to Atlanta, duration: 6 hours 18 mins, distance: 696 km", "breakfast": "-", "attraction": "Georgia Aquarium, Atlanta", "lunch": "Saffron, Atlanta", "dinner": "Adda, Atlanta", "accommodation": "Bright, Modern, Clean, Spacious, Brooklyn Home, Atlanta"}, {"day": 2, "current_city": "Atlanta", "transportation": "-", "breakfast": "Asian Bistro, Atlanta", "attraction": "World of Coca-Cola, Atlanta", "lunch": "Chef Style, Atlanta", "dinner": "Daawat-e-Kashmir, Atlanta", "accommodation": "Bright, Modern, Clean, Spacious, Brooklyn Home, Atlanta"}, {"day": 3, "current_city": "from Atlanta to Daytona Beach", "transportation": "Self-driving, from Atlanta to Daytona Beach, duration: 6 hours 20 mins, distance: 706 km", "breakfast": "Shri Ram Restaurant, Atlanta", "attraction": "Centennial Olympic Park, Atlanta", "lunch": "Bengali Sweet House, Atlanta", "dinner": "-", "accommodation": "-"}, {"day": 1, "current_city": "from Daytona Beach to Atlanta", "transportation": "Self-driving, from Daytona Beach to Atlanta, duration: 6 hours 18 mins, distance: 696 km", "breakfast": "-", "attraction": "Georgia Aquarium, Atlanta", "lunch": "Ahata, Atlanta", "dinner": "The Krib, Atlanta", "accommodation": "Unique 2BR Apartment, Atlanta"}, {"day": 2, "current_city": "Atlanta", "transportation": "-", "breakfast": "Beliram Degchiwala, Atlanta", "attraction": "World of Coca-Cola, Atlanta", "lunch": "Shri Rudram, Atlanta", "dinner": "Daawat-e-Kashmir, Atlanta", "accommodation": "Unique 2BR Apartment, Atlanta"}, {"day": 3, "current_city": "from Atlanta to Daytona Beach", "transportation": "Self-driving, from Atlanta to Daytona Beach, duration: 6 hours 20 mins, distance: 706 km", "breakfast": "Chawla Snacks, Atlanta", "attraction": "Centennial Olympic Park, Atlanta", "lunch": "Bengali Sweet House, Atlanta", "dinner": "-", "accommodation": "-"}]}]