[{"gpt-4-1106-preview_direct_sole-planning_results": "Travel Plan:\n\nDay 1: March 9, 2022\nCurrent City: from Chattanooga to Augusta\nTransportation: Self-driving, duration: 3 hours 57 mins, distance: 423 km, cost: $21\nBreakfast: -\nAttraction: Phinizy Swamp Nature Park, Augusta\nLunch: B Merrell's, Augusta\nDinner: Vinny Vanucchi's, Augusta\nAccommodation: Planta Baja Studio, Augusta (Entire home/apt, No smoking, minimum nights: 1, cost: $637)\n\nDay 2: March 10, 2022\nCurrent City: Augusta\nTransportation: -\nBreakfast: Fish Tales Lakeside Grille, Augusta\nAttraction: Augusta Museum of History, Augusta; Augusta Riverwalk, Augusta\nLunch: The Charcoal Chimney, Augusta\nDinner: Nikhil Food Point, Augusta\nAccommodation: Planta Baja Studio, Augusta\n\nDay 3: March 11, 2022\nCurrent City: from Augusta to Decatur\nTransportation: Self-driving, duration: 2 hours 19 mins, distance: 229 km, cost: $11\nBreakfast: Karari Kurry, Augusta\nAttraction: DeKalb History Center Museum, Decatur; Decatur Square, Decatur\nLunch: Madhuban Restaurant - Welcome Hotel Rama International, Decatur\nDinner: Tandoori Hut, Decatur\nAccommodation: The Heart of the Lower East Side!, Decatur (Entire home/apt, No children under 10, minimum nights: 2, cost: $587)\n\nDay 4: March 12, 2022\nCurrent City: Decatur\nTransportation: -\nBreakfast: Cafe Coffee Day, Decatur\nAttraction: Glenlake Park, Decatur; Clyde Shepherd Nature Preserve, Decatur\nLunch: Joey's Pizza, Decatur\nDinner: Dawat-E-Chaman, Decatur\nAccommodation: The Heart of the Lower East Side!, Decatur\n\nDay 5: March 13, 2022\nCurrent City: from Decatur to Atlanta\nTransportation: Self-driving, duration: 19 mins, distance: 13.0 km, cost: $0\nBreakfast: Hwealthcafe, Decatur\nAttraction: Atlanta Botanical Garden, Atlanta; Georgia Aquarium, Atlanta\nLunch: Saffron, Atlanta\nDinner: Adda, Atlanta\nAccommodation: Bright, Modern, Clean, Spacious, Brooklyn Home, Atlanta (Entire home/apt, No children under 10, minimum nights: 3, cost: $1034)\n\nDay 6: March 14, 2022\nCurrent City: Atlanta\nTransportation: -\nBreakfast: Asian Bistro, Atlanta\nAttraction: World of Coca-Cola, Atlanta; Centennial Olympic Park, Atlanta\nLunch: Chef Style, Atlanta\nDinner: Pizza Central, Atlanta\nAccommodation: Bright, Modern, Clean, Spacious, Brooklyn Home, Atlanta\n\nDay 7: March 15, 2022\nCurrent City: from Atlanta to Chattanooga\nTransportation: Self-driving, duration: 1 hour 47 mins, distance: 190 km, cost: $9\nBreakfast: Daawat-e-Kashmir, Atlanta\nAttraction: Martin Luther King, Jr. National Historical Park, Atlanta\nLunch: Shri Ram Restaurant, Atlanta\nDinner: -\nAccommodation: -\n\nTotal Estimated Cost:\nAccommodations: $637 + $587 + $1034 = $2258\nTransportation: $21 + $11 + $0 + $9 = $41\nRemaining Budget: $6900 - $2258 - $41 = $4601 (for meals, attractions, and any additional expenses)\n\nNote: The plan avoids shared accommodations and air travel as requested. The accommodations chosen do not have visitor restrictions and are private rooms or entire homes. The remaining budget should cover meals and attractions, considering the average costs provided in the reference information.", "gpt-4-1106-preview_direct_sole-planning_parsed_results": [{"day": 1, "current_city": "from Chattanooga to Augusta", "transportation": "Self-driving, Duration: 3 hours 57 mins, Distance: 423 km, Cost: 21", "breakfast": "-", "attraction": "Phinizy Swamp Nature Park, Augusta;", "lunch": "B Merrell's, Augusta", "dinner": "Vinny Vanucchi's, Augusta", "accommodation": "Planta Baja Studio, Augusta"}, {"day": 2, "current_city": "Augusta", "transportation": "-", "breakfast": "Fish Tales Lakeside Grille, Augusta", "attraction": "Augusta Museum of History, Augusta;Augusta Riverwalk, Augusta;", "lunch": "The Charcoal Chimney, Augusta", "dinner": "Nikhil Food Point, Augusta", "accommodation": "Planta Baja Studio, Augusta"}, {"day": 3, "current_city": "from Augusta to Decatur", "transportation": "Self-driving, Duration: 2 hours 19 mins, Distance: 229 km, Cost: 11", "breakfast": "Karari Kurry, Augusta", "attraction": "DeKalb History Center Museum, Decatur;Decatur Square, Decatur;", "lunch": "Madhuban Restaurant - Welcome Hotel Rama International, Decatur", "dinner": "Tandoori Hut, Decatur", "accommodation": "The Heart of the Lower East Side!, Decatur"}, {"day": 4, "current_city": "Decatur", "transportation": "-", "breakfast": "Cafe Coffee Day, Decatur", "attraction": "Glenlake Park, Decatur;Clyde Shepherd Nature Preserve, Decatur;", "lunch": "Joey's Pizza, Decatur", "dinner": "Dawat-E-Chaman, Decatur", "accommodation": "The Heart of the Lower East Side!, Decatur"}, {"day": 5, "current_city": "from Decatur to Atlanta", "transportation": "Self-driving, Duration: 19 mins, Distance: 13.0 km, Cost: 0", "breakfast": "Hwealthcafe, Decatur", "attraction": "Atlanta Botanical Garden, Atlanta;Georgia Aquarium, Atlanta;", "lunch": "Saffron, Atlanta", "dinner": "Adda, Atlanta", "accommodation": "Bright, Modern, Clean, Spacious, Brooklyn Home, Atlanta"}, {"day": 6, "current_city": "Atlanta", "transportation": "-", "breakfast": "Asian Bistro, Atlanta", "attraction": "World of Coca-Cola, Atlanta;Centennial Olympic Park, Atlanta;", "lunch": "Chef Style, Atlanta", "dinner": "Pizza Central, Atlanta", "accommodation": "Bright, Modern, Clean, Spacious, Brooklyn Home, Atlanta"}, {"day": 7, "current_city": "from Atlanta to Chattanooga", "transportation": "Self-driving, Duration: 1 hour 47 mins, Distance: 190 km, Cost: 9", "breakfast": "Daawat-e-Kashmir, Atlanta", "attraction": "Martin Luther King, Jr. National Historical Park, Atlanta;", "lunch": "Shri Ram Restaurant, Atlanta", "dinner": "-", "accommodation": "-"}]}]