[{"gpt-4-1106-preview_direct_sole-planning_results": "Travel Plan:\n\nDay 1: March 14, 2022\nCurrent City: from Salt Lake City to Abilene\nTransportation: Self-driving, from Salt Lake City to Abilene, Duration: 16 hours 59 mins, Distance: 1,740 km, Cost: $87 * ceil(8/5) = $174\nBreakfast: - (Assuming breakfast is had before departure)\nLunch: - (Assuming packed lunch or stops along the way)\nDinner: Thai Garden, Abilene, Cost: $13 * 8 = $104, Cuisines: \"Cafe, American, Desserts\"\nAccommodation: Entire Home / Apt in Williamsburg + Rooftop, Abilene, Cost: $191 * ceil(8/3) = $510, Maximum Occupancy: 3, House Rules: No pets, Minimum Nights: 3\n\nNumber of People = 8\nTotal Cost = $174 + $104 + $510 = $788\nAccommodation Minimum Nights: 1/3\n\nDay 2: March 15, 2022\nCurrent City: Abilene\nTransportation: -\nBreakfast: Biryani Express, Abilene, Cost: $11 * 8 = $88, Cuisines: \"Tea, Pizza, French, Bakery, Fast Food\"\nAttraction: The Grace Museum, Abilene, Cost: Free\nLunch: Crispy Crust, Abilene, Cost: $54 * 8 = $432, Cuisines: \"Desserts, Bakery, Cafe, American, Seafood\"\nAttraction: Frontier Texas!, Abilene, Cost: Free\nDinner: Thai Garden, Abilene, Cost: $13 * 8 = $104, Cuisines: \"Cafe, American, Desserts\"\nAccommodation: Entire Home / Apt in Williamsburg + Rooftop, Abilene, Cost: $510\n\nNumber of People = 8\nTotal Cost = $88 + $432 + $104 + $510 = $1134\nAccommodation Minimum Nights: 2/3\n\nDay 3: March 16, 2022\nCurrent City: from Abilene to Amarillo\nTransportation: Self-driving, from Abilene to Amarillo, Duration: 4 hours 10 mins, Distance: 446 km, Cost: $22 * ceil(8/5) = $44\nBreakfast: Subway, Abilene, Cost: $57 * 8 = $456, Cuisines: \"Fast Food, Tea, Bakery, Italian\"\nAttraction: Historic Fort Phantom Hill, Abilene, Cost: Free\nLunch: - (Assuming packed lunch or stops along the way)\nDinner: The Cinnamon Kitchen, Amarillo, Cost: $69 * 8 = $552, Cuisines: \"Desserts, Tea, Pizza, Chinese, Seafood\"\nAccommodation: Harlem Humble Abode - 1 bedroom - Cute and Quaint, Amarillo, Cost: $409 * ceil(8/3) = $1096, Maximum Occupancy: 3, House Rules: No pets, Minimum Nights: 5\n\nNumber of People = 8\nTotal Cost = $44 + $456 + $552 + $1096 = $2148\nAccommodation Minimum Nights: 1/5\n\nDay 4: March 17, 2022\nCurrent City: Amarillo\nTransportation: -\nBreakfast: Wood Box Cafe, Amarillo, Cost: $11 * 8 = $88, Cuisines: \"Desserts, French, Fast Food, Cafe, American\"\nAttraction: Cadillac Ranch, Amarillo, Cost: Free\nLunch: Kanha North & South Indian Veg., Amarillo, Cost: $34 * 8 = $272, Cuisines: \"Tea, Cafe, BBQ, Fast Food\"\nAttraction: Amarillo Botanical Gardens, Amarillo, Cost: Free\nDinner: Komachi, Amarillo, Cost: $71 * 8 = $568, Cuisines: \"Desserts, Tea, Fast Food, Chinese, Mediterranean\"\nAccommodation: Harlem Humble Abode - 1 bedroom - Cute and Quaint, Amarillo, Cost: $1096\n\nNumber of People = 8\nTotal Cost = $88 + $272 + $568 + $1096 = $2024\nAccommodation Minimum Nights: 2/5\n\nDay 5: March 18, 2022\nCurrent City: from Amarillo to Salt Lake City\nTransportation: Self-driving, from Amarillo to Salt Lake City, Duration: 13 hours 45 mins, Distance: 1,419 km, Cost: $70 * ceil(8/5) = $112\nBreakfast: Cafe Coffee Day, Amarillo, Cost: $15 * 8 = $120, Cuisines: \"Tea, Bakery, American\"\nAttraction: Amarillo Zoo, Amarillo, Cost: Free\nLunch: - (Assuming packed lunch or stops along the way)\nDinner: - (Assuming dinner upon arrival in Salt Lake City or stops along the way)\nAccommodation: -\n\nNumber of People = 8\nTotal Cost = $112 + $120 = $232\n\nTotal cost across all days = $788 + $1134 + $2148 + $2024 + $232 = $6326\nCuisines: The prompt specifies no cuisines, so all cuisines constraints are satisfied.\nHouse Rules: Accommodations chosen are visitors-friendly as required.", "gpt-4-1106-preview_direct_sole-planning_parsed_results": [{"day": 1, "current_city": "from Salt Lake City to Abilene", "transportation": "Self-driving, from Salt Lake City to Abilene, Duration: 16 hours 59 mins, Distance: 1,740 km", "breakfast": "-", "attraction": "-", "lunch": "-", "dinner": "Thai Garden, Abilene", "accommodation": "Entire Home / Apt in Williamsburg + Rooftop, Abilene"}, {"day": 2, "current_city": "Abilene", "transportation": "-", "breakfast": "Biryani Express, Abilene", "attraction": "The Grace Museum, Abilene;Frontier Texas!, Abilene;", "lunch": "Crispy Crust, Abilene", "dinner": "Thai Garden, Abilene", "accommodation": "Entire Home / Apt in Williamsburg + Rooftop, Abilene"}, {"day": 3, "current_city": "from Abilene to Amarillo", "transportation": "Self-driving, from Abilene to Amarillo, Duration: 4 hours 10 mins, Distance: 446 km", "breakfast": "Subway, Abilene", "attraction": "Historic Fort Phantom Hill, Abilene", "lunch": "-", "dinner": "The Cinnamon Kitchen, Amarillo", "accommodation": "Harlem Humble Abode - 1 bedroom - Cute and Quaint, Amarillo"}, {"day": 4, "current_city": "Amarillo", "transportation": "-", "breakfast": "Wood Box Cafe, Amarillo", "attraction": "Cadillac Ranch, Amarillo;Amarillo Botanical Gardens, Amarillo;", "lunch": "Kanha North & South Indian Veg., Amarillo", "dinner": "Komachi, Amarillo", "accommodation": "Harlem Humble Abode - 1 bedroom - Cute and Quaint, Amarillo"}, {"day": 5, "current_city": "from Amarillo to Salt Lake City", "transportation": "Self-driving, from Amarillo to Salt Lake City, Duration: 13 hours 45 mins, Distance: 1,419 km", "breakfast": "Cafe Coffee Day, Amarillo", "attraction": "Amarillo Zoo, Amarillo", "lunch": "-", "dinner": "-", "accommodation": "-"}]}]