[{"gpt-4-1106-preview_direct_sole-planning_results": "Travel Plan:\n\nDay 1: March 4, 2022\nCurrent City: from Las Vegas to Twin Falls\nTransportation: Self-driving, from Las Vegas to Twin Falls, Duration: 7 hours 32 mins, Distance: 796 km, Cost: $39\nBreakfast: -\nAttraction: Snake River Canyon Rim Trail, Twin Falls\nLunch: Thai Paradise, Twin Falls\nDinner: Subway, Twin Falls\nAccommodation: Charming studio, great location!!!, Twin Falls (Allows smoking, Entire home/apt)\n\nDay 2: March 5, 2022\nCurrent City: Twin Falls\nTransportation: -\nBreakfast: Kaushik Bakery, Twin Falls\nAttraction: Shoshone Falls Park, Twin Falls\nLunch: Food Fever, Twin Falls\nDinner: Asia Kitchen, Twin Falls\nAccommodation: Charming studio, great location!!!, Twin Falls (Allows smoking, Entire home/apt)\n\nDay 3: March 6, 2022\nCurrent City: from Twin Falls to Pocatello\nTransportation: Self-driving, from Twin Falls to Pocatello, Duration: 1 hour 46 mins, Distance: 183 km, Cost: $9\nBreakfast: Mittal Fast Food, Twin Falls\nAttraction: Idaho Museum of Natural History, Pocatello\nLunch: Deorio's, Pocatello\nDinner: 650 - The Global Kitchen, Pocatello\nAccommodation: Chill in Alphabet City, Pocatello (Allows smoking, Private room)\n\nDay 4: March 7, 2022\nCurrent City: Pocatello\nTransportation: -\nBreakfast: Ghar Ki Handi, Pocatello\nAttraction: Zoo Idaho, Pocatello\nLunch: Oriental Kitchen Express, Pocatello\nDinner: Wrapchick, Pocatello\nAccommodation: Chill in Alphabet City, Pocatello (Allows smoking, Private room)\n\nDay 5: March 8, 2022\nCurrent City: from Pocatello to Boise\nTransportation: Self-driving, from Pocatello to Boise, Duration: 3 hours 23 mins, Distance: 377 km, Cost: $18\nBreakfast: The Baking Treats N More, Pocatello\nAttraction: Zoo Boise, Boise\nLunch: TGI Friday's, Boise\nDinner: California Pizza Kitchen, Boise\nAccommodation: Lovely Hell's Kitchen Studio..., Boise (Allows smoking, Entire home/apt)\n\nDay 6: March 9, 2022\nCurrent City: Boise\nTransportation: -\nBreakfast: Gopala Hari, Boise\nAttraction: Idaho State Museum, Boise\nLunch: The Brewhouse, Boise\nDinner: Underdoggs Sports Bar & Grill, Boise\nAccommodation: Lovely Hell's Kitchen Studio..., Boise (Allows smoking, Entire home/apt)\n\nDay 7: March 10, 2022\nCurrent City: from Boise to Las Vegas\nTransportation: Self-driving, from Boise to Las Vegas, Duration: 9 hours 30 mins, Distance: 1,004 km, Cost: $50\nBreakfast: Dhaba By Claridges, Boise\nAttraction: -\nLunch: -\nDinner: -\nAccommodation: -\n\nTotal Estimated Cost: Transportation ($39 + $9 + $18 + $50) + Accommodations (Assuming an average of $100 per night x 6 nights) = $116 + $600 = $716 (This is well within the budget of $5,100, leaving ample funds for meals, attractions, and any additional expenses.)\n\nNote: Smoking is allowed in the accommodations selected, and they are entire rooms or private rooms as requested. The plan avoids flights and uses self-driving as the mode of transportation. Attractions and restaurants are not repeated, and the plan returns to the origin city, Las Vegas, on the last day.", "gpt-4-1106-preview_direct_sole-planning_parsed_results": [{"day": 1, "current_city": "from Las Vegas to Twin Falls", "transportation": "Self-driving, from Las Vegas to Twin Falls, Duration: 7 hours 32 mins, Distance: 796 km, Cost: 39", "breakfast": "-", "attraction": "Snake River Canyon Rim Trail, Twin Falls", "lunch": "Thai Paradise, Twin Falls", "dinner": "Subway, Twin Falls", "accommodation": "Charming studio, great location!!!, Twin Falls"}, {"day": 2, "current_city": "Twin Falls", "transportation": "-", "breakfast": "Kaushik Bakery, Twin Falls", "attraction": "Shoshone Falls Park, Twin Falls", "lunch": "Food Fever, Twin Falls", "dinner": "Asia Kitchen, Twin Falls", "accommodation": "Charming studio, great location!!!, Twin Falls"}, {"day": 3, "current_city": "from Twin Falls to Pocatello", "transportation": "Self-driving, from Twin Falls to Pocatello, Duration: 1 hour 46 mins, Distance: 183 km, Cost: 9", "breakfast": "Mittal Fast Food, Twin Falls", "attraction": "Idaho Museum of Natural History, Pocatello", "lunch": "Deorio's, Pocatello", "dinner": "650 - The Global Kitchen, Pocatello", "accommodation": "Chill in Alphabet City, Pocatello"}, {"day": 4, "current_city": "Pocatello", "transportation": "-", "breakfast": "Ghar Ki Handi, Pocatello", "attraction": "Zoo Idaho, Pocatello", "lunch": "Oriental Kitchen Express, Pocatello", "dinner": "Wrapchick, Pocatello", "accommodation": "Chill in Alphabet City, Pocatello"}, {"day": 5, "current_city": "from Pocatello to Boise", "transportation": "Self-driving, from Pocatello to Boise, Duration: 3 hours 23 mins, Distance: 377 km, Cost: 18", "breakfast": "The Baking Treats N More, Pocatello", "attraction": "Zoo Boise, Boise", "lunch": "TGI Friday's, Boise", "dinner": "California Pizza Kitchen, Boise", "accommodation": "Lovely Hell's Kitchen Studio..., Boise"}, {"day": 6, "current_city": "Boise", "transportation": "-", "breakfast": "Gopala Hari, Boise", "attraction": "Idaho State Museum, Boise", "lunch": "The Brewhouse, Boise", "dinner": "Underdoggs Sports Bar & Grill, Boise", "accommodation": "Lovely Hell's Kitchen Studio..., Boise"}, {"day": 7, "current_city": "from Boise to Las Vegas", "transportation": "Self-driving, from Boise to Las Vegas, Duration: 9 hours 30 mins, Distance: 1,004 km, Cost: 50", "breakfast": "Dhaba By Claridges, Boise", "attraction": "-", "lunch": "-", "dinner": "-", "accommodation": "-"}]}]