[{"gpt-4-1106-preview_direct_sole-planning_results": "Travel Plan:\n\nDay 1: March 15, 2022\nCurrent City: Washington\nTransportation: Flight Number: F3785353, from Washington to Norfolk, Departure Time: 08:30, Arrival Time: 09:18, Cost: 63\nBreakfast: -\nAttraction: Chrysler Museum of Art, Norfolk\nLunch: Henry Campbell's Steakhouse, Norfolk, Cost: 83, Cuisines: \"Chinese, Cafe, Seafood\"\nDinner: Sunshine Family Restaurant, Norfolk, Cost: 95, Cuisines: \"Tea, American, Desserts, Italian\"\nAccommodation: Simple Spacious RM near Queens Center Mall & NYPD, Norfolk, Cost: 311, Room Type: Private room, House Rules: No visitors & No parties, Maximum Occupancy: 2\n\nNumber of People = 1\nTotal Cost = 63 + 83 + 95 + 311 = 552\n\nDay 2: March 16, 2022\nCurrent City: Norfolk\nTransportation: -\nBreakfast: Sonya Bakery Cafe, Norfolk, Cost: 32, Cuisines: \"Pizza, Indian, BBQ\"\nAttraction: Norfolk Botanical Garden, Norfolk\nLunch: Game n Grillz, Norfolk, Cost: 59, Cuisines: \"Mexican, Bakery, Cafe, American, Seafood\"\nDinner: Halki Aanch, Norfolk, Cost: 76, Cuisines: \"Tea, BBQ, Fast Food, American, Seafood\"\nAccommodation: Simple Spacious RM near Queens Center Mall & NYPD, Norfolk, Cost: 311, Room Type: Private room, House Rules: No visitors & No parties, Maximum Occupancy: 2\n\nTotal Cost = 32 + 59 + 76 + 311 = 478\n\nDay 3: March 17, 2022\nCurrent City: from Norfolk to Lynchburg\nTransportation: Self-driving, from Norfolk to Lynchburg, duration: 3 hours 27 mins, distance: 306 km, cost: 15\nBreakfast: Jonathan's Kitchen - Holiday Inn Express & Suites, Norfolk, Cost: 44, Cuisines: \"Tea, Seafood, BBQ, Fast Food\"\nAttraction: Amazement Square, Lynchburg\nLunch: Uptown Vietnam cuisine, Lynchburg, Cost: 63, Cuisines: \"Cafe, Bakery, Indian, Seafood\"\nDinner: The BrewMaster, Lynchburg, Cost: 87, Cuisines: \"Tea, Chinese, BBQ, Fast Food\"\nAccommodation: Design Hideaway in a Classic Brooklyn Townhouse, Lynchburg, Cost: 216, Room Type: Entire home/apt, House Rules: No smoking, Maximum Occupancy: 3\n\nTotal Cost = 15 + 44 + 63 + 87 + 216 = 425\n\nDay 4: March 18, 2022\nCurrent City: Lynchburg\nTransportation: -\nBreakfast: Bean Here, Lynchburg, Cost: 74, Cuisines: \"Tea, Indian, BBQ, Fast Food\"\nAttraction: Point of Honor, Lynchburg\nLunch: Khyen Chyen, Lynchburg, Cost: 30, Cuisines: \"Cafe, Bakery, Mediterranean, Desserts\"\nDinner: Mochamania, Lynchburg, Cost: 87, Cuisines: \"Tea, Chinese, Fast Food, Seafood\"\nAccommodation: Design Hideaway in a Classic Brooklyn Townhouse, Lynchburg, Cost: 216, Room Type: Entire home/apt, House Rules: No smoking, Maximum Occupancy: 3\n\nTotal Cost = 74 + 30 + 87 + 216 = 407\n\nDay 5: March 19, 2022\nCurrent City: from Lynchburg to Washington\nTransportation: Self-driving, from Lynchburg to Washington, duration: 3 hours 19 mins, distance: 291 km, cost: 14\nBreakfast: Pirates Of Grill, Lynchburg, Cost: 71, Cuisines: \"Tea, Pizza, American, Seafood\"\nAttraction: -\nLunch: -\nDinner: -\nAccommodation: -\n\nTotal Cost = 14 + 71 = 85\n\nTotal cost across all days = 552 + 478 + 425 + 407 + 85 = 1947\n\nRemaining Budget = 2200 - 1947 = 253\n\nCuisines: The prompt specifies no cuisines, so all cuisines constraints are satisfied.\n\nNote: The travel plan includes transportation, meals, attractions, and accommodation for each day, adhering to the budget and constraints provided. The plan ensures no repetition of restaurants or attractions, and accommodations follow the house rules specified. The transportation method is consistent, and the cities visited form a closed loop, starting and ending in Washington.", "gpt-4-1106-preview_direct_sole-planning_parsed_results": [{"day": 1, "current_city": "from Washington to Norfolk", "transportation": "Flight Number: F3785353, from Washington to Norfolk, Departure Time: 08:30, Arrival Time: 09:18", "breakfast": "-", "attraction": "Chrysler Museum of Art, Norfolk;", "lunch": "Henry Campbell's Steakhouse, Norfolk", "dinner": "Sunshine Family Restaurant, Norfolk", "accommodation": "Simple Spacious RM near Queens Center Mall & NYPD, Norfolk"}, {"day": 2, "current_city": "Norfolk", "transportation": "-", "breakfast": "Sonya Bakery Cafe, Norfolk", "attraction": "Norfolk Botanical Garden, Norfolk;", "lunch": "Game n Grillz, Norfolk", "dinner": "Halki Aanch, Norfolk", "accommodation": "Simple Spacious RM near Queens Center Mall & NYPD, Norfolk"}, {"day": 3, "current_city": "from Norfolk to Lynchburg", "transportation": "Self-driving, from Norfolk to Lynchburg, duration: 3 hours 27 mins, distance: 306 km", "breakfast": "Jonathan's Kitchen - Holiday Inn Express & Suites, Norfolk", "attraction": "Amazement Square, Lynchburg;", "lunch": "Uptown Vietnam cuisine, Lynchburg", "dinner": "The BrewMaster, Lynchburg", "accommodation": "Design Hideaway in a Classic Brooklyn Townhouse, Lynchburg"}, {"day": 4, "current_city": "Lynchburg", "transportation": "-", "breakfast": "Bean Here, Lynchburg", "attraction": "Point of Honor, Lynchburg;", "lunch": "Khyen Chyen, Lynchburg", "dinner": "Mochamania, Lynchburg", "accommodation": "Design Hideaway in a Classic Brooklyn Townhouse, Lynchburg"}, {"day": 5, "current_city": "from Lynchburg to Washington", "transportation": "Self-driving, from Lynchburg to Washington, duration: 3 hours 19 mins, distance: 291 km", "breakfast": "Pirates Of Grill, Lynchburg", "attraction": "-", "lunch": "-", "dinner": "-", "accommodation": "-"}]}]