[{"gpt-4-1106-preview_direct_sole-planning_results": "Travel Plan:\n\nDay 1: March 1, 2022\nCurrent City: Santa Ana to Durango\nTransportation: Taxi, from Santa Ana to Durango, duration: 11 hours 55 mins, distance: 1,245 km, cost: $1,245\nBreakfast: Not applicable (Assuming departure is early morning)\nAttraction: Animas Museum, Durango\nLunch: Samurai Japanese Cuisine & Sushi Bar, Durango, Cost: $67, Cuisines: \"Bakery, Desserts, Fast Food\"\nDinner: Dub's High on the Hog, Durango, Cost: $98, Cuisines: \"Tea, Italian, French, Cafe, Seafood\"\nAccommodation: Luxury in Best Location, Durango, Cost: $70, room type: Entire home/apt, house rules: No children under 10 & No visitors, maximum occupancy: 2\n\nNumber of People = 2\nTotal Cost for Day 1 = $1,245 (Taxi) + $67 (Lunch) + $98 (Dinner) + $70 (Accommodation) = $1,480\n\nDay 2: March 2, 2022\nCurrent City: Durango\nTransportation: -\nBreakfast: Chickenette, Durango, Cost: $31, Cuisines: \"Tea, Pizza, Desserts, Fast Food\"\nAttraction: Durango & Silverton Narrow Gauge Railroad, Durango\nLunch: Hot Pot, Durango, Cost: $21, Cuisines: \"Seafood, Bakery, Fast Food\"\nDinner: The Mashal, Durango, Cost: $85, Cuisines: \"Italian, BBQ, Fast Food, Cafe, American, Seafood\"\nAccommodation: Luxury in Best Location, Durango, Cost: $70, room type: Entire home/apt, house rules: No children under 10 & No visitors, maximum occupancy: 2\n\nNumber of People = 2\nTotal Cost for Day 2 = $31 (Breakfast) + $21 (Lunch) + $85 (Dinner) + $70 (Accommodation) = $207\n\nDay 3: March 3, 2022\nCurrent City: Durango to Alamosa\nTransportation: Taxi, from Durango to Alamosa, duration: 2 hours 52 mins, distance: 240 km, cost: $240\nBreakfast: Samurai Japanese Cuisine & Sushi Bar, Durango, Cost: $67, Cuisines: \"Bakery, Desserts, Fast Food\"\nAttraction: San Luis Valley Museum | Alamosa\nLunch: Riverwalk Cafe, Alamosa, Cost: $97, Cuisines: \"Tea, Pizza, Fast Food\"\nDinner: Cafe Dalal Street, Alamosa, Cost: $99, Cuisines: \"Cafe, Mexican, BBQ\"\nAccommodation: Comfortable studio suite in midtown Manhattan, Alamosa, Cost: $67, room type: Entire home/apt, house rules: No parties & No smoking & No visitors, maximum occupancy: 2\n\nNumber of People = 2\nTotal Cost for Day 3 = $240 (Taxi) + $67 (Breakfast) + $97 (Lunch) + $99 (Dinner) + $67 (Accommodation) = $570\n\nDay 4: March 4, 2022\nCurrent City: Alamosa\nTransportation: -\nBreakfast: Coffee to Cocktail Bar - Hyatt Place, Alamosa, Cost: $35, Cuisines: \"Tea, Indian, Desserts, Italian\"\nAttraction: Rio Grande Farm Park, Alamosa\nLunch: Cafe LazyMojo, Alamosa, Cost: $26, Cuisines: \"Tea, Pizza, American, Fast Food\"\nDinner: The Diet Kitchen, Alamosa, Cost: $50, Cuisines: \"Pizza, Bakery, BBQ, American, Mediterranean\"\nAccommodation: Comfortable studio suite in midtown Manhattan, Alamosa, Cost: $67, room type: Entire home/apt, house rules: No parties & No smoking & No visitors, maximum occupancy: 2\n\nNumber of People = 2\nTotal Cost for Day 4 = $35 (Breakfast) + $26 (Lunch) + $50 (Dinner) + $67 (Accommodation) = $178\n\nDay 5: March 5, 2022\nCurrent City: Alamosa to Colorado Springs\nTransportation: Taxi, from Alamosa to Colorado Springs, duration: 2 hours 36 mins, distance: 263 km, cost: $263\nBreakfast: Riverwalk Cafe, Alamosa, Cost: $97, Cuisines: \"Tea, Pizza, Fast Food\"\nAttraction: The Broadmoor Seven Falls, Colorado Springs\nLunch: Raglan Road Irish Pub and Restaurant, Colorado Springs, Cost: $97, Cuisines: \"Chinese, Bakery, Pizza, Mediterranean\"\nDinner: Derby, Colorado Springs, Cost: $67, Cuisines: \"Desserts, Fast Food\"\nAccommodation: Large sunny park slope apartment, Colorado Springs, Cost: $82, room type: Entire home/apt, house rules: No smoking & No parties & No pets, maximum occupancy: 3\n\nNumber of People = 2\nTotal Cost for Day 5 = $263 (Taxi) + $97 (Breakfast) + $97 (Lunch) + $67 (Dinner) + $82 (Accommodation) = $606\n\nDay 6: March 6, 2022\nCurrent City: Colorado Springs\nTransportation: -\nBreakfast: Club Tokyo - Best Western Skycity Hotel, Colorado Springs, Cost: $64, Cuisines: \"Tea, Bakery, Mediterranean, Fast Food\"\nAttraction: Garden of the Gods, Colorado Springs\nLunch: GoGourmet, Colorado Springs, Cost: $66, Cuisines: \"Desserts, Bakery, Fast Food, Indian, Seafood\"\nDinner: Mamu's Infusion, Colorado Springs, Cost: $42, Cuisines: \"Tea, BBQ\"\nAccommodation: Large sunny park slope apartment, Colorado Springs, Cost: $82, room type: Entire home/apt, house rules: No smoking & No parties & No pets, maximum occupancy: 3\n\nNumber of People = 2\nTotal Cost for Day 6 = $64 (Breakfast) + $66 (Lunch) + $42 (Dinner) + $82 (Accommodation) = $254\n\nDay 7: March 7, 2022\nCurrent City: Colorado Springs to Santa Ana\nTransportation: Taxi, from Colorado Springs to Santa Ana, duration: 15 hours 52 mins, distance: 1,744 km, cost: $1,744\nBreakfast: Deepak Rasoi, Colorado Springs, Cost: $60, Cuisines: \"Chinese, Pizza, Seafood\"\nAttraction: Not applicable (Assuming early departure)\nLunch: Not applicable (En route)\nDinner: Not applicable (En route)\nAccommodation: Not applicable (Returning home)\n\nNumber of People = 2\nTotal Cost for Day 7 = $1,744 (Taxi) + $60 (Breakfast) = $1,804\n\nTotal cost across all days = $1,480 + $207 + $570 + $178 + $606 + $254 + $1,804 = $5,099\n\nRemaining Budget = $7,700 - $5,099 = $2,601\n\nCuisines: Italian, French, Chinese, and American preferences have been met throughout the itinerary.\n\nPlease note that the costs are estimated based on the provided information and may vary. Additionally, the availability of accommodations, restaurants, and attractions should be confirmed prior to booking.", "gpt-4-1106-preview_direct_sole-planning_parsed_results": [{"day": 1, "current_city": "from Santa Ana to Durango", "transportation": "Taxi, from Santa Ana to Durango, duration: 11 hours 55 mins, distance: 1,245 km", "breakfast": "-", "attraction": "Animas Museum, Durango;", "lunch": "Samurai Japanese Cuisine & Sushi Bar, Durango", "dinner": "Dub's High on the Hog, Durango", "accommodation": "Luxury in Best Location, Durango"}, {"day": 2, "current_city": "Durango", "transportation": "-", "breakfast": "Chickenette, Durango", "attraction": "Durango & Silverton Narrow Gauge Railroad, Durango;", "lunch": "Hot Pot, Durango", "dinner": "The Mashal, Durango", "accommodation": "Luxury in Best Location, Durango"}, {"day": 3, "current_city": "from Durango to Alamosa", "transportation": "Taxi, from Durango to Alamosa, duration: 2 hours 52 mins, distance: 240 km", "breakfast": "Samurai Japanese Cuisine & Sushi Bar, Durango", "attraction": "San Luis Valley Museum, Alamosa;", "lunch": "Riverwalk Cafe, Alamosa", "dinner": "Cafe Dalal Street, Alamosa", "accommodation": "Comfortable studio suite in midtown Manhattan, Alamosa"}, {"day": 4, "current_city": "Alamosa", "transportation": "-", "breakfast": "Coffee to Cocktail Bar - Hyatt Place, Alamosa", "attraction": "Rio Grande Farm Park, Alamosa;", "lunch": "Cafe LazyMojo, Alamosa", "dinner": "The Diet Kitchen, Alamosa", "accommodation": "Comfortable studio suite in midtown Manhattan, Alamosa"}, {"day": 5, "current_city": "from Alamosa to Colorado Springs", "transportation": "Taxi, from Alamosa to Colorado Springs, duration: 2 hours 36 mins, distance: 263 km", "breakfast": "Riverwalk Cafe, Alamosa", "attraction": "The Broadmoor Seven Falls, Colorado Springs;", "lunch": "Raglan Road Irish Pub and Restaurant, Colorado Springs", "dinner": "Derby, Colorado Springs", "accommodation": "Large sunny park slope apartment, Colorado Springs"}, {"day": 6, "current_city": "Colorado Springs", "transportation": "-", "breakfast": "Club Tokyo - Best Western Skycity Hotel, Colorado Springs", "attraction": "Garden of the Gods, Colorado Springs;", "lunch": "GoGourmet, Colorado Springs", "dinner": "Mamu's Infusion, Colorado Springs", "accommodation": "Large sunny park slope apartment, Colorado Springs"}, {"day": 7, "current_city": "from Colorado Springs to Santa Ana", "transportation": "Taxi, from Colorado Springs to Santa Ana, duration: 15 hours 52 mins, distance: 1,744 km", "breakfast": "Deepak Rasoi, Colorado Springs", "attraction": "-", "lunch": "-", "dinner": "-", "accommodation": "-"}]}]