[{"gpt-4-1106-preview_direct_sole-planning_results": "Travel Plan:\n\nDay 1:\nCurrent City: from Washington to Buffalo\nTransportation: Flight Number: F3791094, from Washington to Buffalo, Departure Time: 10:24, Arrival Time: 11:53, Cost: $61 * 7 = $427\nBreakfast: - (Assuming breakfast is had before departure or during the flight)\nAttraction: The Buffalo Zoo, Buffalo, Cost: Free\nLunch: Punjab Grill, Buffalo, Cost: $25 * 7 = $175, Cuisines: \"Bakery, BBQ, Desserts, Seafood\"\nDinner: Shokitini, Buffalo, Cost: $41 * 7 = $287, Cuisines: \"Tea, Cafe, Pizza, Mexican, Chinese, Seafood\"\nAccommodation: Williamsburg Gem: Sleep up to 5, Buffalo, Cost: $486 * ceil(7/4) = $486 * 2 = $972, Maximum Occupancy: 4, House Rules: No smoking & No children under 10, Minimum Nights: 2\n\nNumber of People = 7\nTotal Cost = $427 + $175 + $287 + $972 = $1861\nAccommodation Minimum Nights: 1/2\n\nDay 2:\nCurrent City: Buffalo\nTransportation: -\nBreakfast: Red Mango, Buffalo, Cost: $18 * 7 = $126, Cuisines: \"Mexican, Bakery, BBQ, Fast Food, Cafe, American\"\nAttraction: Buffalo Naval Park, Buffalo, Cost: Free\nLunch: Ammu's South Indian Restaurant, Buffalo, Cost: $80 * 7 = $560, Cuisines: \"Desserts, Pizza, French, BBQ, Chinese\"\nDinner: Tibby's New Orleans Kitchen, Buffalo, Cost: $48 * 7 = $336, Cuisines: \"Seafood, Indian, BBQ, Italian\"\nAccommodation: Williamsburg Gem: Sleep up to 5, Buffalo, Cost: $972 (from Day 1)\n\nNumber of people = 7\nTotal cost = $126 + $560 + $336 + $972 (from Day 1) = $1994\nAccommodation Minimum Nights: 2/2\n\nDay 3:\nCurrent City: from Buffalo to New York\nTransportation: Flight Number: F3644292, from Buffalo to New York, Departure Time: 13:42, Arrival Time: 14:51, Cost: $77 * 7 = $539\nBreakfast: Shama Chicken Corner, Buffalo, Cost: $25 * 7 = $175, Cuisines: \"Tea, Chinese, Desserts\"\nAttraction: Central Park, New York, Cost: Free\nLunch: Seasons 52 Fresh Grill, New York, Cost: $30 * 7 = $210, Cuisines: \"Seafood, Indian, Desserts, Italian\"\nDinner: Lord of the Drinks Forum, New York, Cost: $71 * 7 = $497, Cuisines: \"Cafe, Bakery, BBQ, Chinese, Indian\"\nAccommodation: A Contemporary Homelike Stay in the Best of BK, New York, Cost: $228 * ceil(7/2) = $228 * 4 = $912, Maximum Occupancy: 2, House Rules: No pets & No visitors & No children under 10, Minimum Nights: 2\n\nNumber of people = 7\nTotal cost = $539 + $175 + $210 + $497 + $912 = $2333\nAccommodation Minimum Nights: 1/2\n\nDay 4:\nCurrent City: New York\nTransportation: -\nBreakfast: Gurgaon Hights, New York, Cost: $46 * 7 = $322, Cuisines: \"Cafe, American, Indian, Fast Food\"\nAttraction: Empire State Building, New York, Cost: Free\nLunch: Green Chick Chop, New York, Cost: $26 * 7 = $182, Cuisines: \"Tea, French, Cafe, Seafood\"\nDinner: Goosebumps, New York, Cost: $94 * 7 = $658, Cuisines: \"Chinese, Pizza, Bakery\"\nAccommodation: A Contemporary Homelike Stay in the Best of BK, New York, Cost: $912 (from Day 3)\n\nNumber of people = 7\nTotal cost = $322 + $182 + $658 + $912 (from Day 3) = $2074\nAccommodation Minimum Nights: 2/2\n\nDay 5:\nCurrent City: from New York to Washington\nTransportation: Flight Number: F3672134, from New York to Washington, Departure Time: 13:54, Arrival Time: 15:14, Cost: $44 * 7 = $308\nBreakfast: Sir John Bakery Cafe, New York, Cost: $78 * 7 = $546, Cuisines: \"Pizza, Bakery, Desserts\"\nAttraction: The High Line, New York, Cost: Free\nLunch: Baltazar, New York, Cost: $46 * 7 = $322, Cuisines: \"Tea, Fast Food, Bakery, Seafood\"\nDinner: - (Assuming dinner will be had after arrival in Washington)\nAccommodation: -\n\nNumber of people = 7\nTotal cost = $308 + $546 + $322 = $1176\n\nTotal cost across all days = $1861 + $1994 + $2333 + $2074 + $1176 = $9438\nCuisines: American, Mexican, Chinese, and Italian cuisines have been included in the dining options.\n\nRemaining Budget: $9100 - $9438 = -$338 (Over budget by $338)\n\nNote: The travel plan has gone over budget by $338. Adjustments would need to be made to either the accommodation, dining, or attraction choices to stay within the budget. This could include selecting cheaper restaurants or finding alternative accommodations with lower costs.", "gpt-4-1106-preview_direct_sole-planning_parsed_results": [{"day": 1, "current_city": "from Washington to Buffalo", "transportation": "Flight Number: F3791094, from Washington to Buffalo, Departure Time: 10:24, Arrival Time: 11:53", "breakfast": "-", "attraction": "The Buffalo Zoo, Buffalo;", "lunch": "Punjab Grill, Buffalo", "dinner": "Shokitini, Buffalo", "accommodation": "Williamsburg Gem: Sleep up to 5, Buffalo"}, {"day": 2, "current_city": "Buffalo", "transportation": "-", "breakfast": "Red Mango, Buffalo", "attraction": "Buffalo Naval Park, Buffalo;", "lunch": "Ammu's South Indian Restaurant, Buffalo", "dinner": "Tibby's New Orleans Kitchen, Buffalo", "accommodation": "Williamsburg Gem: Sleep up to 5, Buffalo"}, {"day": 3, "current_city": "from Buffalo to New York", "transportation": "Flight Number: F3644292, from Buffalo to New York, Departure Time: 13:42, Arrival Time: 14:51", "breakfast": "Shama Chicken Corner, Buffalo", "attraction": "Central Park, New York;", "lunch": "Seasons 52 Fresh Grill, New York", "dinner": "Lord of the Drinks Forum, New York", "accommodation": "A Contemporary Homelike Stay in the Best of BK, New York"}, {"day": 4, "current_city": "New York", "transportation": "-", "breakfast": "Gurgaon Hights, New York", "attraction": "Empire State Building, New York;", "lunch": "Green Chick Chop, New York", "dinner": "Goosebumps, New York", "accommodation": "A Contemporary Homelike Stay in the Best of BK, New York"}, {"day": 5, "current_city": "from New York to Washington", "transportation": "Flight Number: F3672134, from New York to Washington, Departure Time: 13:54, Arrival Time: 15:14", "breakfast": "Sir John Bakery Cafe, New York", "attraction": "The High Line, New York;", "lunch": "Baltazar, New York", "dinner": "-", "accommodation": "-"}]}]