[{"gpt-4-1106-preview_direct_sole-planning_results": "Travel Plan:\n\nDay 1: March 20, 2022\nCurrent City: from North Platte to Grand Junction\nTransportation: Self-driving, from North Platte to Grand Junction, Duration: 7 hours 27 mins, Distance: 809 km, Cost: $40\nBreakfast: -\nAttraction: Museum of the West, Museums of Western Colorado, Grand Junction\nLunch: Austin's BBQ and Oyster Bar, Grand Junction\nDinner: 2 Dog, Grand Junction\nAccommodation: NYC Apartment near Central Park!, Grand Junction (Note: This accommodation allows parties and is a non-shared room)\n\nDay 2: March 21, 2022\nCurrent City: Grand Junction\nTransportation: -\nBreakfast: Punjab Da Pind, Grand Junction\nAttraction: Eureka! McConnell Science Museum, Grand Junction\nLunch: Baba Chicken Ludhiana Wale, Grand Junction\nDinner: Penta Cafe, Grand Junction\nAccommodation: NYC Apartment near Central Park!, Grand Junction\n\nDay 3: March 22, 2022\nCurrent City: from Grand Junction to Durango\nTransportation: Self-driving, from Grand Junction to Durango, Duration: 3 hours 33 mins, Distance: 269 km, Cost: $13\nBreakfast: Cocoa Tree, Grand Junction\nAttraction: Animas Museum, Durango\nLunch: Samurai Japanese Cuisine & Sushi Bar, Durango\nDinner: Dub's High on the Hog, Durango\nAccommodation: Lux 1BR in the heart of NYC Theater district!, Durango (Note: This accommodation allows parties and is a non-shared room)\n\nDay 4: March 23, 2022\nCurrent City: Durango\nTransportation: -\nBreakfast: Chickenette, Durango\nAttraction: The Powerhouse, Durango\nLunch: Hot & Tasty Chinese Food, Durango\nDinner: Burger King, Durango\nAccommodation: Lux 1BR in the heart of NYC Theater district!, Durango\n\nDay 5: March 24, 2022\nCurrent City: from Durango to Colorado Springs\nTransportation: Self-driving, from Durango to Colorado Springs, Duration: 5 hours 27 mins, Distance: 504 km, Cost: $25\nBreakfast: Hot Pot, Durango\nAttraction: The Broadmoor Seven Falls, Colorado Springs\nLunch: Raglan Road Irish Pub and Restaurant, Colorado Springs\nDinner: Derby, Colorado Springs\nAccommodation: Large sunny park slope apartment, Colorado Springs (Note: This accommodation allows parties and is a non-shared room)\n\nDay 6: March 25, 2022\nCurrent City: Colorado Springs\nTransportation: -\nBreakfast: Club Tokyo - Best Western Skycity Hotel, Colorado Springs\nAttraction: Cheyenne Mountain Zoo, Colorado Springs\nLunch: GoGourmet, Colorado Springs\nDinner: Raj Restaurant, Colorado Springs\nAccommodation: Large sunny park slope apartment, Colorado Springs\n\nDay 7: March 26, 2022\nCurrent City: from Colorado Springs to North Platte\nTransportation: Self-driving, from Colorado Springs to North Platte, Duration: 4 hours 40 mins, Distance: 536 km, Cost: $26\nBreakfast: New Spice World, Colorado Springs\nAttraction: Garden of the Gods, Colorado Springs\nLunch: Mukhtalif Biryanis, Colorado Springs\nDinner: -\nAccommodation: -\n\nTotal Estimated Transportation Cost: $40 (Day 1) + $13 (Day 3) + $25 (Day 5) + $26 (Day 7) = $104\n(Note: The budget is $6,500, and the estimated transportation cost is well within the budget. Accommodation costs and meal costs are not provided in the reference information, so they are not included in the total cost calculation.)", "gpt-4-1106-preview_direct_sole-planning_parsed_results": [{"day": 1, "current_city": "from North Platte to Grand Junction", "transportation": "Self-driving, from North Platte to Grand Junction, Duration: 7 hours 27 mins, Distance: 809 km, Cost: 40", "breakfast": "-", "attraction": "Museum of the West, Grand Junction;Museums of Western Colorado, Grand Junction;", "lunch": "Austin's BBQ and Oyster Bar, Grand Junction", "dinner": "2 Dog, Grand Junction", "accommodation": "NYC Apartment near Central Park!, Grand Junction"}, {"day": 2, "current_city": "Grand Junction", "transportation": "-", "breakfast": "Punjab Da Pind, Grand Junction", "attraction": "Eureka! McConnell Science Museum, Grand Junction", "lunch": "Baba Chicken Ludhiana Wale, Grand Junction", "dinner": "Penta Cafe, Grand Junction", "accommodation": "NYC Apartment near Central Park!, Grand Junction"}, {"day": 3, "current_city": "from Grand Junction to Durango", "transportation": "Self-driving, from Grand Junction to Durango, Duration: 3 hours 33 mins, Distance: 269 km, Cost: 13", "breakfast": "Cocoa Tree, Grand Junction", "attraction": "Animas Museum, Durango", "lunch": "Samurai Japanese Cuisine & Sushi Bar, Durango", "dinner": "Dub's High on the Hog, Durango", "accommodation": "Lux 1BR in the heart of NYC Theater district!, Durango"}, {"day": 4, "current_city": "Durango", "transportation": "-", "breakfast": "Chickenette, Durango", "attraction": "The Powerhouse, Durango", "lunch": "Hot & Tasty Chinese Food, Durango", "dinner": "Burger King, Durango", "accommodation": "Lux 1BR in the heart of NYC Theater district!, Durango"}, {"day": 5, "current_city": "from Durango to Colorado Springs", "transportation": "Self-driving, from Durango to Colorado Springs, Duration: 5 hours 27 mins, Distance: 504 km, Cost: 25", "breakfast": "Hot Pot, Durango", "attraction": "The Broadmoor Seven Falls, Colorado Springs", "lunch": "Raglan Road Irish Pub and Restaurant, Colorado Springs", "dinner": "Derby, Colorado Springs", "accommodation": "Large sunny park slope apartment, Colorado Springs"}, {"day": 6, "current_city": "Colorado Springs", "transportation": "-", "breakfast": "Club Tokyo - Best Western Skycity Hotel, Colorado Springs", "attraction": "Cheyenne Mountain Zoo, Colorado Springs", "lunch": "GoGourmet, Colorado Springs", "dinner": "Raj Restaurant, Colorado Springs", "accommodation": "Large sunny park slope apartment, Colorado Springs"}, {"day": 7, "current_city": "from Colorado Springs to North Platte", "transportation": "Self-driving, from Colorado Springs to North Platte, Duration: 4 hours 40 mins, Distance: 536 km, Cost: 26", "breakfast": "New Spice World, Colorado Springs", "attraction": "Garden of the Gods, Colorado Springs", "lunch": "Mukhtalif Biryanis, Colorado Springs", "dinner": "-", "accommodation": "-"}]}]