[{"gpt-4-1106-preview_direct_sole-planning_results": "Travel Plan:\n\nDay 1: March 14, 2022\nCurrent City: from Tulsa to Kansas City\nTransportation: Self-driving, from Tulsa to Kansas City, Duration: 3 hours 59 mins, Distance: 436 km, Cost: $21\nBreakfast: -\nAttraction: Science City, Kansas City\nLunch: Gero, Kansas City\nDinner: Antebellum, Kansas City\nAccommodation: Beautiful large floor-through apartment, Kansas City (Minimum nights: 3)\n\nDay 2: March 15, 2022\nCurrent City: Kansas City\nTransportation: -\nBreakfast: MoMo Cafe, Kansas City\nAttraction: The Nelson-Atkins Museum of Art, Kansas City; Union Station Kansas City, Kansas City\nLunch: World Cafe - Vibe by The LaLiT Traveller, Kansas City\nDinner: Eddie's Patisserie, Kansas City\nAccommodation: Beautiful large floor-through apartment, Kansas City\n\nDay 3: March 16, 2022\nCurrent City: Kansas City\nTransportation: -\nBreakfast: Boombox Brewstreet, Kansas City\nAttraction: National WWI Museum and Memorial, Kansas City; Arabia Steamboat Museum, Kansas City\nLunch: Megha Vaishno Dhaba, Kansas City\nDinner: Basant, Kansas City\nAccommodation: Beautiful large floor-through apartment, Kansas City\n\nDay 4: March 17, 2022\nCurrent City: from Kansas City to Cape Girardeau\nTransportation: Self-driving, from Kansas City to Cape Girardeau, Duration: 5 hours 12 mins, Distance: 563 km, Cost: $28\nBreakfast: -\nAttraction: Cape River Heritage Museum, Cape Girardeau\nLunch: Cafe Totaram, Cape Girardeau\nDinner: Onesta, Cape Girardeau\nAccommodation: Huge new modern chic reno 2 bed TSQ, Cape Girardeau (Minimum nights: 20)\n\nDay 5: March 18, 2022\nCurrent City: Cape Girardeau\nTransportation: -\nBreakfast: Rock Cafe, Cape Girardeau\nAttraction: Cape Girardeau Conservation Nature Center, Cape Girardeau; Cape Splash Family Aquatic Center, Cape Girardeau\nLunch: Kumar Samose Wala, Cape Girardeau\nDinner: HotMess Bakes, Cape Girardeau\nAccommodation: Huge new modern chic reno 2 bed TSQ, Cape Girardeau\n\nDay 6: March 19, 2022\nCurrent City: from Cape Girardeau to St. Louis\nTransportation: Self-driving, from Cape Girardeau to St. Louis, Duration: 1 hour 51 mins, Distance: 186 km, Cost: $9\nBreakfast: -\nAttraction: Saint Louis Zoo, St. Louis; Missouri Botanical Garden, St. Louis\nLunch: The Latitude - Radisson Blu, St. Louis\nDinner: Wai Yu Mun Ching, St. Louis\nAccommodation: Lux 2Bed/2.5Bath Central Park Views, St. Louis (Minimum nights: 30)\n\nDay 7: March 20, 2022\nCurrent City: from St. Louis to Tulsa\nTransportation: Flight Number: F3954999, from St. Louis to Tulsa, Departure Time: 21:53, Arrival Time: 23:03, Cost: $124\nBreakfast: Starbucks, St. Louis\nAttraction: The Gateway Arch, St. Louis; City Museum, St. Louis\nLunch: Burger King, St. Louis\nDinner: -\nAccommodation: -\n\nTotal Estimated Cost: $21 (Day 1 driving) + $28 (Day 4 driving) + $9 (Day 6 driving) + $124 (Day 7 flight) + Accommodations + Food and Attractions\n\nPlease note that the accommodation costs, food, and attraction entry fees are not specified in the provided data and should be calculated based on the preferences and budget of the travelers. The accommodations selected have a minimum number of nights that exceed the one-night stay in each city, so it is assumed that exceptions can be made, or alternative accommodations must be found. The total estimated cost provided does not include these expenses and is for transportation only.", "gpt-4-1106-preview_direct_sole-planning_parsed_results": [{"day": 1, "current_city": "from Tulsa to Kansas City", "transportation": "Self-driving, from Tulsa to Kansas City, Duration: 3 hours 59 mins, Distance: 436 km, Cost: 21", "breakfast": "-", "attraction": "Science City, Kansas City;", "lunch": "Gero, Kansas City", "dinner": "Antebellum, Kansas City", "accommodation": "Beautiful large floor-through apartment, Kansas City"}, {"day": 2, "current_city": "Kansas City", "transportation": "-", "breakfast": "MoMo Cafe, Kansas City", "attraction": "The Nelson-Atkins Museum of Art, Kansas City;Union Station Kansas City, Kansas City;", "lunch": "World Cafe - Vibe by The LaLiT Traveller, Kansas City", "dinner": "Eddie's Patisserie, Kansas City", "accommodation": "Beautiful large floor-through apartment, Kansas City"}, {"day": 3, "current_city": "Kansas City", "transportation": "-", "breakfast": "Boombox Brewstreet, Kansas City", "attraction": "National WWI Museum and Memorial, Kansas City;Arabia Steamboat Museum, Kansas City;", "lunch": "Megha Vaishno Dhaba, Kansas City", "dinner": "Basant, Kansas City", "accommodation": "Beautiful large floor-through apartment, Kansas City"}, {"day": 4, "current_city": "from Kansas City to Cape Girardeau", "transportation": "Self-driving, from Kansas City to Cape Girardeau, Duration: 5 hours 12 mins, Distance: 563 km, Cost: 28", "breakfast": "-", "attraction": "Cape River Heritage Museum, Cape Girardeau;", "lunch": "Cafe Totaram, Cape Girardeau", "dinner": "Onesta, Cape Girardeau", "accommodation": "Huge new modern chic reno 2 bed TSQ, Cape Girardeau"}, {"day": 5, "current_city": "Cape Girardeau", "transportation": "-", "breakfast": "Rock Cafe, Cape Girardeau", "attraction": "Cape Girardeau Conservation Nature Center, Cape Girardeau;Cape Splash Family Aquatic Center, Cape Girardeau;", "lunch": "Kumar Samose Wala, Cape Girardeau", "dinner": "HotMess Bakes, Cape Girardeau", "accommodation": "Huge new modern chic reno 2 bed TSQ, Cape Girardeau"}, {"day": 6, "current_city": "from Cape Girardeau to St. Louis", "transportation": "Self-driving, from Cape Girardeau to St. Louis, Duration: 1 hour 51 mins, Distance: 186 km, Cost: 9", "breakfast": "-", "attraction": "Saint Louis Zoo, St. Louis;Missouri Botanical Garden, St. Louis;", "lunch": "The Latitude - Radisson Blu, St. Louis", "dinner": "Wai Yu Mun Ching, St. Louis", "accommodation": "Lux 2Bed/2.5Bath Central Park Views, St. Louis"}, {"day": 7, "current_city": "from St. Louis to Tulsa", "transportation": "Flight Number: F3954999, from St. Louis to Tulsa, Departure Time: 21:53, Arrival Time: 23:03, Cost: 124", "breakfast": "Starbucks, St. Louis", "attraction": "The Gateway Arch, St. Louis;City Museum, St. Louis;", "lunch": "Burger King, St. Louis", "dinner": "-", "accommodation": "-"}]}]