[{"gpt-4-1106-preview_direct_sole-planning_results": "Travel Plan:\n\nDay 1:\nCurrent City: from Charlotte to Hilton Head\nTransportation: Flight Number: F4055090, from Charlotte to Hilton Head, Departure Time: 18:07, Arrival Time: 19:27, Cost: 92\nBreakfast: -\nLunch: -\nDinner: Sikkim Fast Food, Hilton Head, Cost: 90, Cuisines: \"French, Bakery, Desserts, Seafood\"\nAttraction: Coastal Discovery Museum, Hilton Head\nAccommodation: Rustic room in renovated Bushwick apartment, Hilton Head, Cost: 309, Maximum Occupancy: 1, House Rules: No smoking, Minimum Nights: 1\n\nNumber of People = 5\nTotal Cost = 5 * 92 + 5 * 90 + 5 * 309 / 1 = 2455\nAccommodation Minimum Nights: 1/1\n\nDay 2:\nCurrent City: Hilton Head\nTransportation: -\nBreakfast: New Town Pastry Shop - Park Plaza, Hilton Head, Cost: 51, Cuisines: \"Tea, Cafe, Pizza, BBQ\"\nAttraction: Harbour Town Lighthouse, Hilton Head; Coligny Beach Park, Hilton Head\nLunch: Tadka, Hilton Head, Cost: 44, Cuisines: \"Pizza, Bakery, Desserts, Seafood\"\nDinner: Mr. Brown, Hilton Head, Cost: 23, Cuisines: \"Desserts, Italian, BBQ, Fast Food, Cafe\"\nAccommodation: Rustic room in renovated Bushwick apartment, Hilton Head, Cost: 309, Maximum Occupancy: 1, House Rules: No smoking, Minimum Nights: 1\n\nNumber of people = 5\nTotal cost = 5 * 51 + 5 * 44 + 5 * 23 + 5 * 309 / 1 = 2135\nAccommodation Minimum Nights: 1/1\n\nDay 3:\nCurrent City: from Hilton Head to Charlotte\nTransportation: Flight Number: F4056985, from Hilton Head to Charlotte, Departure Time: 20:07, Arrival Time: 21:31, Cost: 46\nBreakfast: Wrapster, Hilton Head, Cost: 18, Cuisines: \"French, Seafood, Desserts, Italian\"\nAttraction: Fish Haul Beach Park, Hilton Head\nLunch: Tpot, Hilton Head, Cost: 29, Cuisines: \"Cafe, Pizza, Fast Food\"\nDinner: -\nAccommodation: -\n\nNumber of people = 5\nTotal cost = 5 * 46 + 5 * 18 + 5 * 29 = 465\n\nTotal cost across all days = 2455 + 2135 + 465 = 5055\nCuisines: Italian and French cuisines were included in the meals as per the preference.\n\nPlease note that the costs for attractions are not provided in the reference information, so they are not included in the total cost calculation. The budget is capped at $7,000, and the total cost of the trip is $5,055, which is within the budget.", "gpt-4-1106-preview_direct_sole-planning_parsed_results": [{"day": 1, "current_city": "from Charlotte to Hilton Head", "transportation": "Flight Number: F4055090, from Charlotte to Hilton Head, Departure Time: 18:07, Arrival Time: 19:27", "breakfast": "-", "attraction": "Coastal Discovery Museum, Hilton Head;", "lunch": "-", "dinner": "Sikkim Fast Food, Hilton Head", "accommodation": "Rustic room in renovated Bushwick apartment, Hilton Head"}, {"day": 2, "current_city": "Hilton Head", "transportation": "-", "breakfast": "New Town Pastry Shop - Park Plaza, Hilton Head", "attraction": "Harbour Town Lighthouse, Hilton Head; Coligny Beach Park, Hilton Head;", "lunch": "Tadka, Hilton Head", "dinner": "Mr. Brown, Hilton Head", "accommodation": "Rustic room in renovated Bushwick apartment, Hilton Head"}, {"day": 3, "current_city": "from Hilton Head to Charlotte", "transportation": "Flight Number: F4056985, from Hilton Head to Charlotte, Departure Time: 20:07, Arrival Time: 21:31", "breakfast": "Wrapster, Hilton Head", "attraction": "Fish Haul Beach Park, Hilton Head;", "lunch": "Tpot, Hilton Head", "dinner": "-", "accommodation": "-"}]}]