[{"gpt-4-1106-preview_direct_sole-planning_results": "Travel Plan:\n\nDay 1: March 5, 2022\nCurrent City: from Augusta to Abilene\nTransportation: Self-driving, from Augusta to Abilene, Duration: 15 hours 59 mins, Distance: 1,782 km, Cost: $89\nBreakfast: -\nAttraction: The Grace Museum, Abilene\nLunch: Thai Garden, Abilene\nDinner: Crispy Crust, Abilene\nAccommodation: Joyce and Donovan's, Room for One, Abilene\n\nDay 2: March 6, 2022\nCurrent City: Abilene\nTransportation: -\nBreakfast: Thai Garden, Abilene\nAttraction: Frontier Texas!, Abilene\nLunch: Finger Licious, Abilene\nDinner: Mx Corn, Abilene\nAccommodation: Joyce and Donovan's, Room for One, Abilene\n\nDay 3: March 7, 2022\nCurrent City: from Abilene to Amarillo\nTransportation: Self-driving, from Abilene to Amarillo, Duration: 4 hours 10 mins, Distance: 446 km, Cost: $22\nBreakfast: LPK Waterfront, Abilene\nAttraction: Cadillac Ranch, Amarillo\nLunch: The Cinnamon Kitchen, Amarillo\nDinner: Komachi, Amarillo\nAccommodation: Gramercy Park restful, cozy, sun-filled home, Amarillo\n\nDay 4: March 8, 2022\nCurrent City: Amarillo\nTransportation: -\nBreakfast: Kanha North & South Indian Veg., Amarillo\nAttraction: Amarillo Botanical Gardens, Amarillo\nLunch: Sigree Global Grill, Amarillo\nDinner: Anand Restaurant, Amarillo\nAccommodation: Gramercy Park restful, cozy, sun-filled home, Amarillo\n\nDay 5: March 9, 2022\nCurrent City: from Amarillo to Lubbock\nTransportation: Self-driving, from Amarillo to Lubbock, Duration: 1 hour 47 mins, Distance: 197 km, Cost: $9\nBreakfast: Wood Box Cafe, Amarillo\nAttraction: Buddy Holly Center, Lubbock\nLunch: Paris 6 Classique, Lubbock\nDinner: 3 Squares Diner, Lubbock\nAccommodation: Private bedroom in UWS Apartment, Lubbock\n\nDay 6: March 10, 2022\nCurrent City: Lubbock\nTransportation: -\nBreakfast: Grand Barbeque Buffet Restaurant, Lubbock\nAttraction: National Ranching Heritage Center, Lubbock\nLunch: Mosaic - Country Inn & Suites By Carlson, Lubbock\nDinner: Assam Tea Corner, Lubbock\nAccommodation: Private bedroom in UWS Apartment, Lubbock\n\nDay 7: March 11, 2022\nCurrent City: from Lubbock to Augusta\nTransportation: Self-driving, from Lubbock to Augusta, Duration: 18 hours 17 mins, Distance: 2,047 km, Cost: $102\nBreakfast: Sultanat, Lubbock\nAttraction: -\nLunch: -\nDinner: -\nAccommodation: -\n\nTotal Estimated Cost: $89 (Day 1) + $22 (Day 3) + $9 (Day 5) + $102 (Day 7) + Accommodations + Food + Attractions\n\nPlease note that the accommodation costs, food, and attraction entry fees are not specified in the provided information, so they will need to be calculated and added to the transportation costs to ensure the total budget of $4,100 is not exceeded. The traveler should also confirm the availability of accommodations and attractions, as well as their current prices, as these can fluctuate and may not be reflected in the provided information.", "gpt-4-1106-preview_direct_sole-planning_parsed_results": [{"day": 1, "current_city": "from Augusta to Abilene", "transportation": "Self-driving, from Augusta to Abilene, Duration: 15 hours 59 mins, Distance: 1,782 km, Cost: 89", "breakfast": "-", "attraction": "The Grace Museum, Abilene", "lunch": "Thai Garden, Abilene", "dinner": "Crispy Crust, Abilene", "accommodation": "Joyce and Donovan's, Room for One, Abilene"}, {"day": 2, "current_city": "Abilene", "transportation": "-", "breakfast": "Thai Garden, Abilene", "attraction": "Frontier Texas!, Abilene", "lunch": "Finger Licious, Abilene", "dinner": "Mx Corn, Abilene", "accommodation": "Joyce and Donovan's, Room for One, Abilene"}, {"day": 3, "current_city": "from Abilene to Amarillo", "transportation": "Self-driving, from Abilene to Amarillo, Duration: 4 hours 10 mins, Distance: 446 km, Cost: 22", "breakfast": "LPK Waterfront, Abilene", "attraction": "Cadillac Ranch, Amarillo", "lunch": "The Cinnamon Kitchen, Amarillo", "dinner": "Komachi, Amarillo", "accommodation": "Gramercy Park restful, cozy, sun-filled home, Amarillo"}, {"day": 4, "current_city": "Amarillo", "transportation": "-", "breakfast": "Kanha North & South Indian Veg., Amarillo", "attraction": "Amarillo Botanical Gardens, Amarillo", "lunch": "Sigree Global Grill, Amarillo", "dinner": "Anand Restaurant, Amarillo", "accommodation": "Gramercy Park restful, cozy, sun-filled home, Amarillo"}, {"day": 5, "current_city": "from Amarillo to Lubbock", "transportation": "Self-driving, from Amarillo to Lubbock, Duration: 1 hour 47 mins, Distance: 197 km, Cost: 9", "breakfast": "Wood Box Cafe, Amarillo", "attraction": "Buddy Holly Center, Lubbock", "lunch": "Paris 6 Classique, Lubbock", "dinner": "3 Squares Diner, Lubbock", "accommodation": "Private bedroom in UWS Apartment, Lubbock"}, {"day": 6, "current_city": "Lubbock", "transportation": "-", "breakfast": "Grand Barbeque Buffet Restaurant, Lubbock", "attraction": "National Ranching Heritage Center, Lubbock", "lunch": "Mosaic - Country Inn & Suites By Carlson, Lubbock", "dinner": "Assam Tea Corner, Lubbock", "accommodation": "Private bedroom in UWS Apartment, Lubbock"}, {"day": 7, "current_city": "from Lubbock to Augusta", "transportation": "Self-driving, from Lubbock to Augusta, Duration: 18 hours 17 mins, Distance: 2,047 km, Cost: 102", "breakfast": "Sultanat, Lubbock", "attraction": "-", "lunch": "-", "dinner": "-", "accommodation": "-"}]}]