[{"gpt-4-1106-preview_direct_sole-planning_results": "Day 1:\nCurrent City: from Minneapolis to Seattle\nTransportation: Flight Number: F3526653, from Minneapolis to Seattle, Departure Time: 08:51, Arrival Time: 10:11\nBreakfast: -\nAttraction: Pike Place Market, Seattle\nLunch: Ting's Red Lantern, Seattle\nDinner: Ceviche Tapas Bar & Restaurant, Seattle\nAccommodation: Shared Apartment by Times Square Manhattan, Seattle\n\nDay 2:\nCurrent City: Seattle\nTransportation: -\nBreakfast: Mother Ringlet, Seattle\nAttraction: The Seattle Great Wheel, Seattle; Seattle Aquarium, Seattle\nLunch: Caf\u00e8 Burger BC, Seattle\nDinner: The Godinho's, Seattle\nAccommodation: Shared Apartment by Times Square Manhattan, Seattle\n\nDay 3:\nCurrent City: from Seattle to Minneapolis\nTransportation: Flight Number: F3502722, from Seattle to Minneapolis, Departure Time: 08:47, Arrival Time: 14:03\nBreakfast: -\nAttraction: Kerry Park, Seattle (before departure)\nLunch: -\nDinner: -\nAccommodation: -\n\nNote: The accommodation chosen is the \"Shared Apartment by Times Square Manhattan\" in Seattle, which has a price of $1050.0 and a minimum stay of 1 night. The flight prices for the chosen flights are $453 for the departure and $364 for the return, totaling $817. The remaining budget is allocated for meals and attractions. The plan avoids repeating any attractions or restaurants and ensures a return to the origin city on the last day.", "gpt-4-1106-preview_direct_sole-planning_parsed_results": [{"day": 1, "current_city": "from Minneapolis to Seattle", "transportation": "Flight Number: F3526653, from Minneapolis to Seattle, Departure Time: 08:51, Arrival Time: 10:11", "breakfast": "-", "attraction": "Pike Place Market, Seattle;", "lunch": "Ting's Red Lantern, Seattle", "dinner": "Ceviche Tapas Bar & Restaurant, Seattle", "accommodation": "Shared Apartment by Times Square Manhattan, Seattle", "cost": {"flight": 453, "accommodation": 1050}}, {"day": 2, "current_city": "Seattle", "transportation": "-", "breakfast": "Mother Ringlet, Seattle", "attraction": "The Seattle Great Wheel, Seattle; Seattle Aquarium, Seattle;", "lunch": "Caf\u00e8 Burger BC, Seattle", "dinner": "The Godinho's, Seattle", "accommodation": "Shared Apartment by Times Square Manhattan, Seattle"}, {"day": 3, "current_city": "from Seattle to Minneapolis", "transportation": "Flight Number: F3502722, from Seattle to Minneapolis, Departure Time: 08:47, Arrival Time: 14:03", "breakfast": "-", "attraction": "Kerry Park, Seattle;", "lunch": "-", "dinner": "-", "accommodation": "-", "cost": {"flight": 364}}]}]