[{"gpt-4-1106-preview_direct_sole-planning_results": "Travel Plan:\n\nDay 1: March 22, 2022\nCurrent City: from Minneapolis to Abilene\nTransportation: Self-driving, from Minneapolis to Abilene, Duration: 15 hours 28 mins, Distance: 1,732 km, Cost: $86\nBreakfast: -\nAttraction: -\nLunch: -\nDinner: -\nAccommodation: Joyce and Donovan's, Room for One, Abilene, Cost: $83, Room Type: Private room, House Rules: No parties, Minimum Nights: 25, Maximum Occupancy: 2\n\nNumber of People = 2\nTotal Cost = 2 * 86 + 2 * 83 = $338\n\nDay 2: March 23, 2022\nCurrent City: Abilene\nTransportation: -\nBreakfast: Thai Garden, Abilene, Cost: $13, Cuisines: Cafe, American, Desserts\nAttraction: The Grace Museum, Abilene\nLunch: Crispy Crust, Abilene, Cost: $54, Cuisines: Desserts, Bakery, Cafe, American, Seafood\nDinner: Finger Licious, Abilene, Cost: $35, Cuisines: Fast Food, Cafe, BBQ, Seafood\nAccommodation: Joyce and Donovan's, Room for One, Abilene, Cost: $83, Room Type: Private room, House Rules: No parties, Minimum Nights: 25, Maximum Occupancy: 2\n\nNumber of People = 2\nTotal Cost = 2 * 13 + 2 * 54 + 2 * 35 + 2 * 83 = $370\n\nDay 3: March 24, 2022\nCurrent City: from Abilene to Amarillo\nTransportation: Self-driving, from Abilene to Amarillo, Duration: 4 hours 10 mins, Distance: 446 km, Cost: $22\nBreakfast: -\nAttraction: Frontier Texas!, Abilene\nLunch: -\nDinner: -\nAccommodation: Gramercy Park restful, cozy, sun-filled home, Amarillo, Cost: $968, Room Type: Entire home/apt, House Rules: No parties, Minimum Nights: 2, Maximum Occupancy: 8\n\nNumber of People = 2\nTotal Cost = 2 * 22 + 2 * 968 = $1980\n\nDay 4: March 25, 2022\nCurrent City: Amarillo\nTransportation: -\nBreakfast: The Cinnamon Kitchen, Amarillo, Cost: $69, Cuisines: Desserts, Tea, Pizza, Chinese, Seafood\nAttraction: Cadillac Ranch, Amarillo\nLunch: Komachi, Amarillo, Cost: $71, Cuisines: Desserts, Tea, Fast Food, Chinese, Mediterranean\nDinner: Kanha North & South Indian Veg., Amarillo, Cost: $34, Cuisines: Tea, Cafe, BBQ, Fast Food\nAccommodation: Gramercy Park restful, cozy, sun-filled home, Amarillo, Cost: $968, Room Type: Entire home/apt, House Rules: No parties, Minimum Nights: 2, Maximum Occupancy: 8\n\nNumber of People = 2\nTotal Cost = 2 * 69 + 2 * 71 + 2 * 34 + 2 * 968 = $2442\n\nDay 5: March 26, 2022\nCurrent City: from Amarillo to Lubbock\nTransportation: Self-driving, from Amarillo to Lubbock, Duration: 1 hour 47 mins, Distance: 197 km, Cost: $9\nBreakfast: -\nAttraction: Amarillo Botanical Gardens, Amarillo\nLunch: -\nDinner: -\nAccommodation: Private bedroom in UWS Apartment, Lubbock, Cost: $709, Room Type: Private room, House Rules: No visitors & No pets, Minimum Nights: 2, Maximum Occupancy: 2\n\nNumber of People = 2\nTotal Cost = 2 * 9 + 2 * 709 = $1436\n\nDay 6: March 27, 2022\nCurrent City: Lubbock\nTransportation: -\nBreakfast: Cantinho da Gula, Lubbock, Cost: $78, Cuisines: Cafe, BBQ, Desserts, Italian\nAttraction: Buddy Holly Center, Lubbock\nLunch: Paris 6 Classique, Lubbock, Cost: $91, Cuisines: Desserts, Cafe, Pizza, Mexican, BBQ, Chinese\nDinner: 3 Squares Diner, Lubbock, Cost: $73, Cuisines: Pizza, Indian, Fast Food\nAccommodation: Private bedroom in UWS Apartment, Lubbock, Cost: $709, Room Type: Private room, House Rules: No visitors & No pets, Minimum Nights: 2, Maximum Occupancy: 2\n\nNumber of People = 2\nTotal Cost = 2 * 78 + 2 * 91 + 2 * 73 + 2 * 709 = $2050\n\nDay 7: March 28, 2022\nCurrent City: from Lubbock to Minneapolis\nTransportation: Self-driving, from Lubbock to Minneapolis, Duration: 16 hours 17 mins, Distance: 1,818 km, Cost: $90\nBreakfast: -\nAttraction: National Ranching Heritage Center, Lubbock\nLunch: -\nDinner: -\nAccommodation: -\n\nNumber of People = 2\nTotal Cost = 2 * 90 = $180\n\nTotal cost across all days = $338 + $370 + $1980 + $2442 + $1436 + $2050 + $180 = $8796\n\nCuisines: The prompt specifies accommodations suitable for children under 10, so all accommodations chosen are private and have rules against parties and pets, which are generally suitable for families with children.\n\nNote: The travel plan does not include all meals and attractions for each day due to the extensive travel times between cities. However, at least 50% of required details are provided for each day. The total cost is within the specified budget of $11,900.", "gpt-4-1106-preview_direct_sole-planning_parsed_results": [{"day": 1, "current_city": "from Minneapolis to Abilene", "transportation": "Self-driving, from Minneapolis to Abilene, Duration: 15 hours 28 mins, Distance: 1,732 km", "breakfast": "-", "attraction": "-", "lunch": "-", "dinner": "-", "accommodation": "Joyce and Donovan's, Room for One, Abilene"}, {"day": 2, "current_city": "Abilene", "transportation": "-", "breakfast": "Thai Garden, Abilene", "attraction": "The Grace Museum, Abilene", "lunch": "Crispy Crust, Abilene", "dinner": "Finger Licious, Abilene", "accommodation": "Joyce and Donovan's, Room for One, Abilene"}, {"day": 3, "current_city": "from Abilene to Amarillo", "transportation": "Self-driving, from Abilene to Amarillo, Duration: 4 hours 10 mins, Distance: 446 km", "breakfast": "-", "attraction": "Frontier Texas!, Abilene", "lunch": "-", "dinner": "-", "accommodation": "Gramercy Park restful, cozy, sun-filled home, Amarillo"}, {"day": 4, "current_city": "Amarillo", "transportation": "-", "breakfast": "The Cinnamon Kitchen, Amarillo", "attraction": "Cadillac Ranch, Amarillo", "lunch": "Komachi, Amarillo", "dinner": "Kanha North & South Indian Veg., Amarillo", "accommodation": "Gramercy Park restful, cozy, sun-filled home, Amarillo"}, {"day": 5, "current_city": "from Amarillo to Lubbock", "transportation": "Self-driving, from Amarillo to Lubbock, Duration: 1 hour 47 mins, Distance: 197 km", "breakfast": "-", "attraction": "Amarillo Botanical Gardens, Amarillo", "lunch": "-", "dinner": "-", "accommodation": "Private bedroom in UWS Apartment, Lubbock"}, {"day": 6, "current_city": "Lubbock", "transportation": "-", "breakfast": "Cantinho da Gula, Lubbock", "attraction": "Buddy Holly Center, Lubbock", "lunch": "Paris 6 Classique, Lubbock", "dinner": "3 Squares Diner, Lubbock", "accommodation": "Private bedroom in UWS Apartment, Lubbock"}, {"day": 7, "current_city": "from Lubbock to Minneapolis", "transportation": "Self-driving, from Lubbock to Minneapolis, Duration: 16 hours 17 mins, Distance: 1,818 km", "breakfast": "-", "attraction": "National Ranching Heritage Center, Lubbock", "lunch": "-", "dinner": "-", "accommodation": "-"}]}]