[{"gpt-4-1106-preview_direct_sole-planning_results": "Travel Plan:\n\nDay 1: March 23, 2022\nCurrent City: from Cedar Rapids to Denver\nTransportation: Flight Number: F3840860, from Cedar Rapids to Denver, Departure Time: 16:23, Arrival Time: 17:15, Cost: $294\nDinner: The Fatty Bao - Asian Gastro Bar, Denver, Cost: $93\nAccommodation: *NO GUEST SERVICE FEE* Luxury Studio Suite w/ Free Continental Breakfast, Denver, Cost: $390\nTotal cost for Day 1: $294 (Flight) + $93 (Dinner) + $390 (Accommodation) = $777\n\nDay 2: March 24, 2022\nCurrent City: Denver\nBreakfast: Included in accommodation, Cost: $0\nAttraction: Denver Zoo, Denver, Cost: $20 (estimated)\nLunch: The Urban Socialite, Denver, Cost: $34\nAttraction: Denver Art Museum, Denver, Cost: $15 (estimated)\nDinner: Tasty Fare, Denver, Cost: $79\nAccommodation: *NO GUEST SERVICE FEE* Luxury Studio Suite w/ Free Continental Breakfast, Denver, Cost: $390\nTotal cost for Day 2: $0 (Breakfast) + $20 (Attraction) + $34 (Lunch) + $15 (Attraction) + $79 (Dinner) + $390 (Accommodation) = $538\n\nDay 3: March 25, 2022\nCurrent City: from Denver to Alamosa\nTransportation: Flight Number: F3857649, from Denver to Alamosa, Departure Time: 15:44, Arrival Time: 16:33, Cost: $37\nLunch: Rain Tree Grill, Denver, Cost: $94\nAttraction: San Luis Valley Museum | Alamosa, Alamosa, Cost: $10 (estimated)\nDinner: Atlanta Highway Seafood Market, Alamosa, Cost: $68\nAccommodation: Comfortable studio suite in midtown Manhattan, Alamosa, Cost: $67\nTotal cost for Day 3: $37 (Flight) + $94 (Lunch) + $10 (Attraction) + $68 (Dinner) + $67 (Accommodation) = $276\n\nDay 4: March 26, 2022\nCurrent City: Alamosa\nBreakfast: Included in accommodation, Cost: $0\nAttraction: Rio Grande Farm Park, Alamosa, Cost: $5 (estimated)\nLunch: Riverwalk Cafe, Alamosa, Cost: $97\nAttraction: Alamosa National Wildlife Refuge and Visitor Center, Alamosa, Cost: $10 (estimated)\nDinner: Burger Singh, Alamosa, Cost: $95\nAccommodation: Comfortable studio suite in midtown Manhattan, Alamosa, Cost: $67\nTotal cost for Day 4: $0 (Breakfast) + $5 (Attraction) + $97 (Lunch) + $10 (Attraction) + $95 (Dinner) + $67 (Accommodation) = $274\n\nDay 5: March 27, 2022\nCurrent City: from Alamosa to Cedar Rapids\nTransportation: Self-driving, from Alamosa to Cedar Rapids, duration: 14 hours 27 mins, distance: 1,541 km, Cost: $77\nBreakfast: Included in accommodation, Cost: $0\nLunch: Cafe LazyMojo, Alamosa, Cost: $26\nDinner: On the road (estimated cost), Cost: $30\nTotal cost for Day 5: $77 (Transportation) + $0 (Breakfast) + $26 (Lunch) + $30 (Dinner) = $133\n\nThe total cost of this trip is the sum of the costs from Day 1 to Day 5. It is $777 + $538 + $276 + $274 + $133 = $1,998 which is less than the required budget of $4,300.\n\nPlease note that the estimated costs for attractions and on-the-road meals are based on common prices for similar activities and meals. The actual costs may vary. Also, the accommodation in Alamosa is named as if it's in Manhattan, which seems to be an error in the provided data. The prices and details are used as given for planning purposes.", "gpt-4-1106-preview_direct_sole-planning_parsed_results": [{"day": 1, "current_city": "from Cedar Rapids to Denver", "transportation": "Flight Number: F3840860, from Cedar Rapids to Denver, Departure Time: 16:23, Arrival Time: 17:15", "breakfast": "-", "attraction": "-", "lunch": "-", "dinner": "The Fatty Bao - Asian Gastro Bar, Denver", "accommodation": "*NO GUEST SERVICE FEE* Luxury Studio Suite w/ Free Continental Breakfast, Denver"}, {"day": 2, "current_city": "Denver", "transportation": "-", "breakfast": "Included in accommodation", "attraction": "Denver Zoo, Denver;Denver Art Museum, Denver;", "lunch": "The Urban Socialite, Denver", "dinner": "Tasty Fare, Denver", "accommodation": "*NO GUEST SERVICE FEE* Luxury Studio Suite w/ Free Continental Breakfast, Denver"}, {"day": 3, "current_city": "from Denver to Alamosa", "transportation": "Flight Number: F3857649, from Denver to Alamosa, Departure Time: 15:44, Arrival Time: 16:33", "breakfast": "-", "attraction": "San Luis Valley Museum | Alamosa, Alamosa", "lunch": "Rain Tree Grill, Denver", "dinner": "Atlanta Highway Seafood Market, Alamosa", "accommodation": "Comfortable studio suite in midtown Manhattan, Alamosa"}, {"day": 4, "current_city": "Alamosa", "transportation": "-", "breakfast": "Included in accommodation", "attraction": "Rio Grande Farm Park, Alamosa;Alamosa National Wildlife Refuge and Visitor Center, Alamosa;", "lunch": "Riverwalk Cafe, Alamosa", "dinner": "Burger Singh, Alamosa", "accommodation": "Comfortable studio suite in midtown Manhattan, Alamosa"}, {"day": 5, "current_city": "from Alamosa to Cedar Rapids", "transportation": "Self-driving, from Alamosa to Cedar Rapids, duration: 14 hours 27 mins, distance: 1,541 km", "breakfast": "Included in accommodation", "attraction": "-", "lunch": "Cafe LazyMojo, Alamosa", "dinner": "-", "accommodation": "-"}]}]