[{"gpt-4-1106-preview_direct_sole-planning_results": "Travel Plan:\n\nDay 1: March 5, 2022\nCurrent City: from Pittsburgh to Houston\nTransportation: Flight Number: F3902409, from Pittsburgh to Houston, Departure Time: 06:27, Arrival Time: 08:40, Cost: $334 per person, Total Cost: $2338\nBreakfast: - (Assuming breakfast is on the flight or before departure), Cost: $0\nAttraction: Space Center Houston, Cost: $30 per person, Total Cost: $210\nLunch: Jalapenos, Houston, Average Cost: $57 per person, Total Cost: $399\nDinner: Super Bakery, Houston, Average Cost: $30 per person, Total Cost: $210\nAccommodation: Sunny and Airy near Manhattan, Houston, Cost: $499 per night (children under 10 allowed), Total Cost: $499\n\nTotal cost for Day 1: $2338 (Flight) + $210 (Attraction) + $399 (Lunch) + $210 (Dinner) + $499 (Accommodation) = $3656\n\nDay 2: March 6, 2022\nCurrent City: Houston\nTransportation: -, Cost: $0\nBreakfast: Earthen Spices, Houston, Average Cost: $28 per person, Total Cost: $196\nAttraction: Houston Museum of Natural Science, Cost: $25 per person, Total Cost: $175\nLunch: The BrewMaster - The Mix Fine Dine, Houston, Average Cost: $52 per person, Total Cost: $364\nDinner: Al Arabian Express, Houston, Average Cost: $74 per person, Total Cost: $518\nAccommodation: Sunny and Airy near Manhattan, Houston, Cost: $499 per night (children under 10 allowed), Total Cost: $499\n\nTotal cost for Day 2: $196 (Breakfast) + $175 (Attraction) + $364 (Lunch) + $518 (Dinner) + $499 (Accommodation) = $1752\n\nDay 3: March 7, 2022\nCurrent City: from Houston to Dallas\nTransportation: Flight Number: F3673854, from Houston to Dallas, Departure Time: 07:44, Arrival Time: 09:06, Cost: $68 per person, Total Cost: $476\nBreakfast: - (Assuming breakfast is before departure), Cost: $0\nAttraction: The Dallas World Aquarium, Cost: $25 per person, Total Cost: $175\nLunch: Coconuts Fish Cafe, Dallas, Average Cost: $38 per person, Total Cost: $266\nDinner: 1918 Bistro & Grill, Dallas, Average Cost: $90 per person, Total Cost: $630\nAccommodation: Luxury Williamsburg duplex, private roof terrace, Dallas, Cost: $241 per night (children under 10 allowed), Total Cost: $241\n\nTotal cost for Day 3: $476 (Flight) + $175 (Attraction) + $266 (Lunch) + $630 (Dinner) + $241 (Accommodation) = $1788\n\nDay 4: March 8, 2022\nCurrent City: Dallas\nTransportation: -, Cost: $0\nBreakfast: Cafe Gatherings, Dallas, Average Cost: $17 per person, Total Cost: $119\nAttraction: Reunion Tower, Cost: $20 per person, Total Cost: $140\nLunch: Drifters Cafe, Dallas, Average Cost: $21 per person, Total Cost: $147\nDinner: Delhicacy, Dallas, Average Cost: $67 per person, Total Cost: $469\nAccommodation: Luxury Williamsburg duplex, private roof terrace, Dallas, Cost: $241 per night (children under 10 allowed), Total Cost: $241\n\nTotal cost for Day 4: $119 (Breakfast) + $140 (Attraction) + $147 (Lunch) + $469 (Dinner) + $241 (Accommodation) = $1116\n\nDay 5: March 9, 2022\nCurrent City: from Dallas to Pittsburgh\nTransportation: Flight Number: F3660424, from Dallas to Pittsburgh, Departure Time: 18:25, Arrival Time: 21:39, Cost: $389 per person, Total Cost: $2723\nBreakfast: Cafe Coffee Day, Dallas, Average Cost: $22 per person, Total Cost: $154\nAttraction: Dallas Museum of Art, Cost: $20 per person, Total Cost: $140\nLunch: Uma Foodies' Hut, Dallas, Average Cost: $49 per person, Total Cost: $343\nDinner: - (Assuming dinner is on the flight or after arrival), Cost: $0\nAccommodation: - (Returning to origin city), Cost: $0\n\nTotal cost for Day 5: $2723 (Flight) + $154 (Breakfast) + $140 (Attraction) + $343 (Lunch) = $3360\n\nThe total cost of this trip is the sum of the costs from Day 1, Day 2, Day 3, Day 4, and Day 5. It is $3656 + $1752 + $1788 + $1116 + $3360 = $11672, which is less than the required budget of $16,100.", "gpt-4-1106-preview_direct_sole-planning_parsed_results": [{"day": 1, "current_city": "from Pittsburgh to Houston", "transportation": "Flight Number: F3902409, from Pittsburgh to Houston, Departure Time: 06:27, Arrival Time: 08:40", "breakfast": "-", "attraction": "Space Center Houston, Houston", "lunch": "Jalapenos, Houston", "dinner": "Super Bakery, Houston", "accommodation": "Sunny and Airy near Manhattan, Houston"}, {"day": 2, "current_city": "Houston", "transportation": "-", "breakfast": "Earthen Spices, Houston", "attraction": "Houston Museum of Natural Science, Houston", "lunch": "The BrewMaster - The Mix Fine Dine, Houston", "dinner": "Al Arabian Express, Houston", "accommodation": "Sunny and Airy near Manhattan, Houston"}, {"day": 3, "current_city": "from Houston to Dallas", "transportation": "Flight Number: F3673854, from Houston to Dallas, Departure Time: 07:44, Arrival Time: 09:06", "breakfast": "-", "attraction": "The Dallas World Aquarium, Dallas", "lunch": "Coconuts Fish Cafe, Dallas", "dinner": "1918 Bistro & Grill, Dallas", "accommodation": "Luxury Williamsburg duplex, private roof terrace, Dallas"}, {"day": 4, "current_city": "Dallas", "transportation": "-", "breakfast": "Cafe Gatherings, Dallas", "attraction": "Reunion Tower, Dallas", "lunch": "Drifters Cafe, Dallas", "dinner": "Delhicacy, Dallas", "accommodation": "Luxury Williamsburg duplex, private roof terrace, Dallas"}, {"day": 5, "current_city": "from Dallas to Pittsburgh", "transportation": "Flight Number: F3660424, from Dallas to Pittsburgh, Departure Time: 18:25, Arrival Time: 21:39", "breakfast": "Cafe Coffee Day, Dallas", "attraction": "Dallas Museum of Art, Dallas", "lunch": "Uma Foodies' Hut, Dallas", "dinner": "-", "accommodation": "-"}]}]