[{"gpt-4-1106-preview_direct_sole-planning_results": "Travel Plan:\n\nDay 1: March 23, 2022\nCurrent City: from Washington to Evansville\nTransportation: Taxi, from Washington to Evansville, duration: 10 hours 59 mins, distance: 1,168 km, Cost: $1168\nAttraction: Mesker Park Zoo, Evansville, Cost: $50 (assuming $10 per person)\nLunch: Blue Orchid Thai Restaurant, Evansville, Average Cost: $86\nDinner: J. Christopher's, Evansville, Average Cost: $39\nAccommodation: Stylish 1 bed room in the East Village, Evansville, Cost: $674 (minimum nights: 3)\n\nTotal cost for Day 1: $1168 (Transportation) + $50 (Attraction) + $86 (Lunch) + $39 (Dinner) + $674 (Accommodation) = $2017\n\nDay 2: March 24, 2022\nCurrent City: Evansville\nTransportation: -, Cost: $0\nBreakfast: McDonald's, Evansville, Average Cost: $84\nAttraction: Children's Museum of Evansville, Evansville, Cost: $50 (assuming $10 per person)\nLunch: Punjabi Restaurant, Evansville, Average Cost: $29\nDinner: Twist of Italy, Evansville, Average Cost: $85\nAccommodation: Stylish 1 bed room in the East Village, Evansville, Cost: $674\n\nTotal cost for Day 2: $0 (Transportation) + $84 (Breakfast) + $50 (Attraction) + $29 (Lunch) + $85 (Dinner) + $674 (Accommodation) = $922\n\nDay 3: March 25, 2022\nCurrent City: from Evansville to South Bend\nTransportation: Taxi, from Evansville to South Bend, duration: 5 hours 1 min, distance: 512 km, Cost: $512\nAttraction: Studebaker National Museum, South Bend, Cost: $50 (assuming $10 per person)\nLunch: Madaan Confectionery, South Bend, Average Cost: $62\nDinner: Krips Restaurant, South Bend, Average Cost: $59\nAccommodation: Just Right in Lovely Greenpoint, South Bend, Cost: $614 (minimum nights: 7)\n\nTotal cost for Day 3: $512 (Transportation) + $50 (Attraction) + $62 (Lunch) + $59 (Dinner) + $614 (Accommodation) = $1297\n\nDay 4: March 26, 2022\nCurrent City: South Bend\nTransportation: -, Cost: $0\nBreakfast: It\u6f74\u7c79 Sinful, South Bend, Average Cost: $26\nAttraction: Potawatomi Zoo, South Bend, Cost: $50 (assuming $10 per person)\nLunch: MOB Brewpub, South Bend, Average Cost: $67\nDinner: Roadhouse Cafe, South Bend, Average Cost: $24\nAccommodation: Just Right in Lovely Greenpoint, South Bend, Cost: $614\n\nTotal cost for Day 4: $0 (Transportation) + $26 (Breakfast) + $50 (Attraction) + $67 (Lunch) + $24 (Dinner) + $614 (Accommodation) = $781\n\nDay 5: March 27, 2022\nCurrent City: from South Bend to Fort Wayne\nTransportation: Taxi, from South Bend to Fort Wayne, duration: 1 hour 46 mins, distance: 145 km, Cost: $145\nAttraction: Fort Wayne Museum of Art, Fort Wayne, Cost: $50 (assuming $10 per person)\nLunch: Shri Bikaner Misthan Bhandar, Fort Wayne, Average Cost: $29\nDinner: Good Food, Fort Wayne, Average Cost: $32\nAccommodation: Sunlit Brooklyn Bedroom w/ Private Entrance, Fort Wayne, Cost: $856 (minimum nights: 2)\n\nTotal cost for Day 5: $145 (Transportation) + $50 (Attraction) + $29 (Lunch) + $32 (Dinner) + $856 (Accommodation) = $1112\n\nDay 6: March 28, 2022\nCurrent City: Fort Wayne\nTransportation: -, Cost: $0\nBreakfast: Cafe Coffee Day, Fort Wayne, Average Cost: $48\nAttraction: Science Central, Fort Wayne, Cost: $50 (assuming $10 per person)\nLunch: Parikrama - The Revolving Restaurant, Fort Wayne, Average Cost: $80\nDinner: Roll's World, Fort Wayne, Average Cost: $52\nAccommodation: Sunlit Brooklyn Bedroom w/ Private Entrance, Fort Wayne, Cost: $856\n\nTotal cost for Day 6: $0 (Transportation) + $48 (Breakfast) + $50 (Attraction) + $80 (Lunch) + $52 (Dinner) + $856 (Accommodation) = $1086\n\nDay 7: March 29, 2022\nCurrent City: from Fort Wayne to Washington\nTransportation: Taxi, from Fort Wayne to Washington, duration: 8 hours 52 mins, distance: 893 km, Cost: $893\nBreakfast: Yellow Mirchi - Hotel City Park, Fort Wayne, Average Cost: $35\nLunch: Bukhara - ITC Maurya, Fort Wayne, Average Cost: $39\nDinner: -, Cost: $0 (assuming they will eat after arriving in Washington)\nAccommodation: -, Cost: $0 (assuming they will arrive home)\n\nTotal cost for Day 7: $893 (Transportation) + $35 (Breakfast) + $39 (Lunch) = $967\n\nThe total cost of this trip is the sum of the costs from Day 1 to Day 7: $2017 + $922 + $1297 + $781 + $1112 + $1086 + $967 = $8182\n\nThis total cost of $8182 is well within the budget of $23,800. Please note that the costs for attractions are assumed to be $10 per person and may vary. Also, the costs for meals are based on average costs and may vary depending on the actual menu items selected. The accommodation costs are based on the provided data and assume that the minimum nights' requirement is met.", "gpt-4-1106-preview_direct_sole-planning_parsed_results": [{"day": 1, "current_city": "from Washington to Evansville", "transportation": "Taxi, from Washington to Evansville, duration: 10 hours 59 mins, distance: 1,168 km", "breakfast": "-", "attraction": "Mesker Park Zoo, Evansville", "lunch": "Blue Orchid Thai Restaurant, Evansville", "dinner": "J. Christopher's, Evansville", "accommodation": "Stylish 1 bed room in the East Village, Evansville"}, {"day": 2, "current_city": "Evansville", "transportation": "-", "breakfast": "McDonald's, Evansville", "attraction": "Children's Museum of Evansville, Evansville", "lunch": "Punjabi Restaurant, Evansville", "dinner": "Twist of Italy, Evansville", "accommodation": "Stylish 1 bed room in the East Village, Evansville"}, {"day": 3, "current_city": "from Evansville to South Bend", "transportation": "Taxi, from Evansville to South Bend, duration: 5 hours 1 min, distance: 512 km", "breakfast": "-", "attraction": "Studebaker National Museum, South Bend", "lunch": "Madaan Confectionery, South Bend", "dinner": "Krips Restaurant, South Bend", "accommodation": "Just Right in Lovely Greenpoint, South Bend"}, {"day": 4, "current_city": "South Bend", "transportation": "-", "breakfast": "It's Sinful, South Bend", "attraction": "Potawatomi Zoo, South Bend", "lunch": "MOB Brewpub, South Bend", "dinner": "Roadhouse Cafe, South Bend", "accommodation": "Just Right in Lovely Greenpoint, South Bend"}, {"day": 5, "current_city": "from South Bend to Fort Wayne", "transportation": "Taxi, from South Bend to Fort Wayne, duration: 1 hour 46 mins, distance: 145 km", "breakfast": "-", "attraction": "Fort Wayne Museum of Art, Fort Wayne", "lunch": "Shri Bikaner Misthan Bhandar, Fort Wayne", "dinner": "Good Food, Fort Wayne", "accommodation": "Sunlit Brooklyn Bedroom w/ Private Entrance, Fort Wayne"}, {"day": 6, "current_city": "Fort Wayne", "transportation": "-", "breakfast": "Cafe Coffee Day, Fort Wayne", "attraction": "Science Central, Fort Wayne", "lunch": "Parikrama - The Revolving Restaurant, Fort Wayne", "dinner": "Roll's World, Fort Wayne", "accommodation": "Sunlit Brooklyn Bedroom w/ Private Entrance, Fort Wayne"}, {"day": 7, "current_city": "from Fort Wayne to Washington", "transportation": "Taxi, from Fort Wayne to Washington, duration: 8 hours 52 mins, distance: 893 km", "breakfast": "Yellow Mirchi - Hotel City Park, Fort Wayne", "lunch": "Bukhara - ITC Maurya, Fort Wayne", "dinner": "-", "accommodation": "-"}]}]