[{"gpt-4-1106-preview_direct_sole-planning_results": "Travel Plan:\n\nDay 1: March 10, 2022\nCurrent City: from Key West to Evansville\nTransportation: Self-driving, from Key West to Evansville, Duration: 18 hours 21 mins, Distance: 1,961 km, Cost: $98\nBreakfast: -\nAttraction: -\nLunch: -\nDinner: -\nAccommodation: Stylish 1 bed room in the East Village, Evansville (Minimum nights: 3, Cost: $674)\n\nDay 2: March 11, 2022\nCurrent City: Evansville\nTransportation: -\nBreakfast: Blue Orchid Thai Restaurant, Evansville (Average Cost: $86)\nAttraction: Mesker Park Zoo, Evansville\nLunch: J. Christopher's, Evansville (Average Cost: $39)\nDinner: Twist of Italy, Evansville (Average Cost: $85)\nAccommodation: Stylish 1 bed room in the East Village, Evansville\n\nDay 3: March 12, 2022\nCurrent City: from Evansville to South Bend\nTransportation: Self-driving, from Evansville to South Bend, Duration: 5 hours 1 min, Distance: 512 km, Cost: $25\nBreakfast: McDonald's, Evansville (Average Cost: $84)\nAttraction: Studebaker National Museum, South Bend\nLunch: Krips Restaurant, South Bend (Average Cost: $59)\nDinner: MOB Brewpub, South Bend (Average Cost: $67)\nAccommodation: Just Right in Lovely Greenpoint, South Bend (Minimum nights: 7, Cost: $614)\n\nDay 4: March 13, 2022\nCurrent City: South Bend\nTransportation: -\nBreakfast: Roadhouse Cafe, South Bend (Average Cost: $24)\nAttraction: Potawatomi Zoo, South Bend\nLunch: Stop My Starvation, South Bend (Average Cost: $56)\nDinner: Lotus Pond, South Bend (Average Cost: $83)\nAccommodation: Just Right in Lovely Greenpoint, South Bend\n\nDay 5: March 14, 2022\nCurrent City: from South Bend to Key West\nTransportation: Self-driving, from South Bend to Key West, Duration: 22 hours 38 mins, Distance: 2,406 km, Cost: $120\nBreakfast: -\nAttraction: -\nLunch: -\nDinner: -\nAccommodation: -\n\nTotal Estimated Cost: $98 (transportation Day 1) + $674 (accommodation Day 1) + $210 (meals Day 2) + $25 (transportation Day 3) + $190 (meals Day 3) + $614 (accommodation Day 3) + $163 (meals Day 4) + $120 (transportation Day 5) = $2094\n\nNote: The total estimated cost exceeds the budget by $94. Adjustments to meal choices or accommodation may be necessary to stay within budget.", "gpt-4-1106-preview_direct_sole-planning_parsed_results": [{"day": 1, "current_city": "from Key West to Evansville", "transportation": "Self-driving, from Key West to Evansville, Duration: 18 hours 21 mins, Distance: 1961 km, Cost: 98", "breakfast": "-", "attraction": "-", "lunch": "-", "dinner": "-", "accommodation": "Stylish 1 bed room in the East Village, Evansville"}, {"day": 2, "current_city": "Evansville", "transportation": "-", "breakfast": "Blue Orchid Thai Restaurant, Evansville", "attraction": "Mesker Park Zoo, Evansville", "lunch": "J. Christopher's, Evansville", "dinner": "Twist of Italy, Evansville", "accommodation": "Stylish 1 bed room in the East Village, Evansville"}, {"day": 3, "current_city": "from Evansville to South Bend", "transportation": "Self-driving, from Evansville to South Bend, Duration: 5 hours 1 min, Distance: 512 km, Cost: 25", "breakfast": "McDonald's, Evansville", "attraction": "Studebaker National Museum, South Bend", "lunch": "Krips Restaurant, South Bend", "dinner": "MOB Brewpub, South Bend", "accommodation": "Just Right in Lovely Greenpoint, South Bend"}, {"day": 4, "current_city": "South Bend", "transportation": "-", "breakfast": "Roadhouse Cafe, South Bend", "attraction": "Potawatomi Zoo, South Bend", "lunch": "Stop My Starvation, South Bend", "dinner": "Lotus Pond, South Bend", "accommodation": "Just Right in Lovely Greenpoint, South Bend"}, {"day": 5, "current_city": "from South Bend to Key West", "transportation": "Self-driving, from South Bend to Key West, Duration: 22 hours 38 mins, Distance: 2406 km, Cost: 120", "breakfast": "-", "attraction": "-", "lunch": "-", "dinner": "-", "accommodation": "-"}]}]