[{"gpt-4-1106-preview_direct_sole-planning_results": "Travel Plan:\n\nDay 1: March 21, 2022\nCurrent City: from Santa Ana to Houston\nTransportation: Flight Number: F3897390, from Santa Ana to Houston, Departure Time: 07:57, Arrival Time: 13:05\nBreakfast: - (Assuming breakfast will be had before departure or during the flight)\nAttraction: Space Center Houston, Houston\nLunch: Matchbox, Houston (Italian, Seafood)\nDinner: Earthen Spices, Houston (Mexican, BBQ)\nAccommodation: Spacious room in front of prospect park, Houston (Allows smoking, $259, minimum nights: 1)\n\nDay 2: March 22, 2022\nCurrent City: Houston\nTransportation: -\nBreakfast: Truth Coffee, Houston (American, Seafood)\nAttraction: The Museum of Fine Arts, Houston; Houston Museum of Natural Science, Houston\nLunch: Vinayaka Mylari, Houston (Italian, Cafe)\nDinner: Pebble Street, Houston (Mediterranean, BBQ)\nAccommodation: Spacious room in front of prospect park, Houston (Allows smoking, $259, minimum nights: 1)\n\nDay 3: March 23, 2022\nCurrent City: from Houston to Santa Ana\nTransportation: Flight Number: F3886573, from Houston to Santa Ana, Departure Time: 10:14, Arrival Time: 11:50\nBreakfast: - (Assuming breakfast will be had before departure or during the flight)\nAttraction: Gerald D. Hines Waterwall Park, Houston (Before departure)\nLunch: - (Assuming lunch will be had after arrival in Santa Ana or during the flight)\nDinner: - (Assuming dinner will be had after arrival in Santa Ana)\nAccommodation: -\n\nPlease note that the accommodation chosen allows smoking as per the requirement and the restaurants selected offer a variety of American, Italian, Mediterranean, and Mexican cuisines. The flights chosen fit within the budget and schedule constraints. The attractions were selected based on their popularity and diversity, ensuring a rich experience of Houston's culture and history.", "gpt-4-1106-preview_direct_sole-planning_parsed_results": [{"day": 1, "current_city": "from Santa Ana to Houston", "transportation": "Flight Number: F3897390, from Santa Ana to Houston, Departure Time: 07:57, Arrival Time: 13:05", "breakfast": "-", "attraction": "Space Center Houston, Houston;", "lunch": "Matchbox, Houston", "dinner": "Earthen Spices, Houston", "accommodation": "Spacious room in front of prospect park, Houston"}, {"day": 2, "current_city": "Houston", "transportation": "-", "breakfast": "Truth Coffee, Houston", "attraction": "The Museum of Fine Arts, Houston;Houston Museum of Natural Science, Houston;", "lunch": "Vinayaka Mylari, Houston", "dinner": "Pebble Street, Houston", "accommodation": "Spacious room in front of prospect park, Houston"}, {"day": 3, "current_city": "from Houston to Santa Ana", "transportation": "Flight Number: F3886573, from Houston to Santa Ana, Departure Time: 10:14, Arrival Time: 11:50", "breakfast": "-", "attraction": "Gerald D. Hines Waterwall Park, Houston;", "lunch": "-", "dinner": "-", "accommodation": "-"}]}]