[{"gpt-4-1106-preview_direct_sole-planning_results": "Travel Plan:\n\nDay 1: March 25, 2022\nCurrent City: from Baton Rouge to Dallas\nTransportation: Flight Number: F3815317, from Baton Rouge to Dallas, Departure Time: 09:48, Arrival Time: 11:29\nLunch: Coconuts Fish Cafe, Dallas\nAttraction: The Dallas World Aquarium, Dallas\nDinner: 1918 Bistro & Grill, Dallas\nAccommodation: Sunny Brooklyn room, Dallas (Smoking permitted)\n\nDay 2: March 26, 2022\nCurrent City: Dallas\nTransportation: -\nBreakfast: Cafe Gatherings, Dallas\nAttraction: The Sixth Floor Museum at Dealey Plaza, Dallas; Reunion Tower, Dallas\nLunch: Yanki Sizzlers, Dallas\nDinner: Aravali Owls, Dallas\nAccommodation: Sunny Brooklyn room, Dallas (Smoking permitted)\n\nDay 3: March 27, 2022\nCurrent City: from Dallas to Baton Rouge\nTransportation: Flight Number: F3814165, from Dallas to Baton Rouge, Departure Time: 20:39, Arrival Time: 21:58\nBreakfast: Drifters Cafe, Dallas\nAttraction: Dallas Museum of Art, Dallas\nLunch: Delhicacy, Dallas\nDinner: - (Assuming they will have dinner back in Baton Rouge or during the flight)\nAccommodation: -\n\nNote: The accommodation \"Sunny Brooklyn room\" in Dallas allows smoking, as per the requirement. The flight chosen for the return trip is the last available flight to ensure maximum time spent in Dallas on the last day. The total cost of flights, accommodation, and estimated meal costs are within the $5,500 budget for the group of 4 people.", "gpt-4-1106-preview_direct_sole-planning_parsed_results": [{"day": 1, "current_city": "from Baton Rouge to Dallas", "transportation": "Flight Number: F3815317, from Baton Rouge to Dallas, Departure Time: 09:48, Arrival Time: 11:29", "breakfast": "-", "attraction": "The Dallas World Aquarium, Dallas;", "lunch": "Coconuts Fish Cafe, Dallas", "dinner": "1918 Bistro & Grill, Dallas", "accommodation": "Sunny Brooklyn room, Dallas"}, {"day": 2, "current_city": "Dallas", "transportation": "-", "breakfast": "Cafe Gatherings, Dallas", "attraction": "The Sixth Floor Museum at Dealey Plaza, Dallas;Reunion Tower, Dallas;", "lunch": "Yanki Sizzlers, Dallas", "dinner": "Aravali Owls, Dallas", "accommodation": "Sunny Brooklyn room, Dallas"}, {"day": 3, "current_city": "from Dallas to Baton Rouge", "transportation": "Flight Number: F3814165, from Dallas to Baton Rouge, Departure Time: 20:39, Arrival Time: 21:58", "breakfast": "Drifters Cafe, Dallas", "attraction": "Dallas Museum of Art, Dallas;", "lunch": "Delhicacy, Dallas", "dinner": "-", "accommodation": "-"}]}]