[{"gpt-4-1106-preview_direct_sole-planning_results": "Travel Plan:\n\nDay 1: March 19, 2022\nCurrent City: Omaha to Traverse City\nTransportation: Self-driving, from Omaha to Traverse City, Duration: 11 hours 25 mins, Distance: 1,240 km, Cost: $62\nBreakfast: - (Assuming breakfast in Omaha before departure)\nAttraction: - (Traveling, no attractions visited)\nLunch: - (On the road, individual arrangements)\nDinner: Famous Dave's, Traverse City, Cost: $39, Cuisines: \"Desserts, Italian, BBQ, Fast Food, Indian\"\nAccommodation: One bedroom apartment in NoLita, Traverse City, Cost: $172, Room Type: Entire home/apt, House Rules: No children under 10 & No pets, Minimum Nights: 1, Maximum Occupancy: 2\n\nNumber of People = 3\nTotal Cost = 3 * $62 (Transportation) + 3 * $39 (Dinner) + 2 * $172 (Accommodation, 2 rooms needed) = $186 + $117 + $344 = $647\n\nDay 2: March 20, 2022\nCurrent City: Traverse City\nTransportation: -\nBreakfast: Daily Eats, Traverse City, Cost: $44, Cuisines: \"Desserts, Seafood\"\nAttraction: Clinch Park, Traverse City; Mission Point Lighthouse, Traverse City\nLunch: Arigato Sushi, Traverse City, Cost: $96, Cuisines: \"Desserts, Mexican, Bakery, BBQ, Fast Food, Mediterranean\"\nDinner: India on my Plate - Fortune Select Excalibur, Traverse City, Cost: $53, Cuisines: \"Tea, Chinese, Seafood\"\nAccommodation: One bedroom apartment in NoLita, Traverse City, Cost: $172, Room Type: Entire home/apt, House Rules: No children under 10 & No pets, Minimum Nights: 1, Maximum Occupancy: 2\n\nNumber of People = 3\nTotal Cost = 3 * $44 (Breakfast) + 3 * $96 (Lunch) + 3 * $53 (Dinner) + 2 * $172 (Accommodation, 2 rooms needed) = $132 + $288 + $159 + $344 = $923\n\nDay 3: March 21, 2022\nCurrent City: Traverse City to Alpena\nTransportation: Self-driving, from Traverse City to Alpena, Duration: 2 hours 29 mins, Distance: 204 km, Cost: $10\nBreakfast: French Toast, Traverse City, Cost: $18, Cuisines: \"Pizza, Desserts\"\nAttraction: Great Lakes Children's Museum, Traverse City\nLunch: Tasty Bites, Traverse City, Cost: $27, Cuisines: \"Chinese, Bakery, Desserts, Seafood\"\nDinner: @Mango, Alpena, Cost: $38, Cuisines: \"BBQ, Cafe, American, Desserts\"\nAccommodation: CHEERFUL RM IN BROOKLYN! EASY ACCESS TO TRAIN! R3, Alpena, Cost: $927, Room Type: Private room, House Rules: No pets, Minimum Nights: 15, Maximum Occupancy: 2\n\nNumber of People = 3\nTotal Cost = 3 * $10 (Transportation) + 3 * $18 (Breakfast) + 3 * $27 (Lunch) + 3 * $38 (Dinner) + 2 * $927 (Accommodation, 2 rooms needed) = $30 + $54 + $81 + $114 + $1854 = $2133\n\nDay 4: March 22, 2022\nCurrent City: Alpena\nTransportation: -\nBreakfast: Maplai, Alpena, Cost: $63, Cuisines: \"Tea, Indian, Bakery, Fast Food, American\"\nAttraction: Thunder Bay National Marine Sanctuary, Alpena; Besser Museum for Northeast Michigan, Alpena\nLunch: Jain Chawal Wale, Alpena, Cost: $20, Cuisines: \"Desserts, Pizza, Italian, Mexican, Cafe\"\nDinner: Handi Masala Restaurant, Alpena, Cost: $57, Cuisines: \"French, Bakery, BBQ, Fast Food, American, Seafood\"\nAccommodation: CHEERFUL RM IN BROOKLYN! EASY ACCESS TO TRAIN! R3, Alpena, Cost: $927, Room Type: Private room, House Rules: No pets, Minimum Nights: 15, Maximum Occupancy: 2\n\nNumber of People = 3\nTotal Cost = 3 * $63 (Breakfast) + 3 * $20 (Lunch) + 3 * $57 (Dinner) + 2 * $927 (Accommodation, 2 rooms needed) = $189 + $60 + $171 + $1854 = $2274\n\nDay 5: March 23, 2022\nCurrent City: Alpena to Omaha\nTransportation: Self-driving, from Alpena to Omaha, Duration: 12 hours 59 mins, Distance: 1,391 km, Cost: $69\nBreakfast: Zaffran - The Bristol Hotel, Alpena, Cost: $33, Cuisines: \"Pizza, Desserts, Seafood\"\nAttraction: - (Traveling, no attractions visited)\nLunch: - (On the road, individual arrangements)\nDinner: - (Assuming dinner in Omaha after arrival)\nAccommodation: - (End of travel plan)\n\nNumber of People = 3\nTotal Cost = 3 * $69 (Transportation) + 3 * $33 (Breakfast) = $207 + $99 = $306\n\nTotal cost across all days = $647 + $923 + $2133 + $2274 + $306 = $6283\n\nCuisines: The prompt specifies no cuisines, so all cuisines constraints are satisfied.\n\nPlease note that the accommodation on Day 3 and Day 4 exceeds the minimum nights required, but due to the lack of other options provided in the reference information, these were the only available accommodations that met the private room requirement. The cost of accommodation is significantly high due to the limited options and may not be the most cost-effective choice. Consideration for alternative accommodations or adjustments to the travel plan may be necessary to stay within budget or to optimize costs.", "gpt-4-1106-preview_direct_sole-planning_parsed_results": [{"day": 1, "current_city": "from Omaha to Traverse City", "transportation": "Self-driving, from Omaha to Traverse City, Duration: 11 hours 25 mins, Distance: 1,240 km", "breakfast": "-", "attraction": "-", "lunch": "-", "dinner": "Famous Dave's, Traverse City", "accommodation": "One bedroom apartment in NoLita, Traverse City"}, {"day": 2, "current_city": "Traverse City", "transportation": "-", "breakfast": "Daily Eats, Traverse City", "attraction": "Clinch Park, Traverse City;Mission Point Lighthouse, Traverse City;", "lunch": "Arigato Sushi, Traverse City", "dinner": "India on my Plate - Fortune Select Excalibur, Traverse City", "accommodation": "One bedroom apartment in NoLita, Traverse City"}, {"day": 3, "current_city": "from Traverse City to Alpena", "transportation": "Self-driving, from Traverse City to Alpena, Duration: 2 hours 29 mins, Distance: 204 km", "breakfast": "French Toast, Traverse City", "attraction": "Great Lakes Children's Museum, Traverse City", "lunch": "Tasty Bites, Traverse City", "dinner": "@Mango, Alpena", "accommodation": "CHEERFUL RM IN BROOKLYN! EASY ACCESS TO TRAIN! R3, Alpena"}, {"day": 4, "current_city": "Alpena", "transportation": "-", "breakfast": "Maplai, Alpena", "attraction": "Thunder Bay National Marine Sanctuary, Alpena;Besser Museum for Northeast Michigan, Alpena;", "lunch": "Jain Chawal Wale, Alpena", "dinner": "Handi Masala Restaurant, Alpena", "accommodation": "CHEERFUL RM IN BROOKLYN! EASY ACCESS TO TRAIN! R3, Alpena"}, {"day": 5, "current_city": "from Alpena to Omaha", "transportation": "Self-driving, from Alpena to Omaha, Duration: 12 hours 59 mins, Distance: 1,391 km", "breakfast": "Zaffran - The Bristol Hotel, Alpena", "attraction": "-", "lunch": "-", "dinner": "-", "accommodation": "-"}]}]