[{"gpt-4-1106-preview_direct_sole-planning_results": "Travel Plan:\n\nDay 1: March 23, 2022\nCurrent City: from Akron to Augusta\nTransportation: Self-driving, duration: 9 hours 36 mins, distance: 1,031 km, cost: $51\nBreakfast: -\nAttraction: Phinizy Swamp Nature Park, Augusta\nLunch: B Merrell's, Augusta (Cuisines: Tea, Pizza, Desserts, Fast Food)\nDinner: The Golden Dragon, Augusta (Cuisines: Desserts, Pizza, Fast Food, Indian, Mediterranean, Seafood)\nAccommodation: Planta Baja Studio, Augusta (price: $637, room type: Entire home/apt, minimum nights: 1)\n\nDay 2: March 24, 2022\nCurrent City: Augusta\nTransportation: -\nBreakfast: B Merrell's, Augusta (Cuisines: Tea, Pizza, Desserts, Fast Food)\nAttraction: Augusta Museum of History, Augusta\nLunch: Vinny Vanucchi's, Augusta (Cuisines: Desserts, Fast Food, Chinese, Indian, Seafood)\nDinner: The Charcoal Chimney, Augusta (Cuisines: Tea, Fast Food, BBQ, Italian)\nAccommodation: Planta Baja Studio, Augusta (price: $637, room type: Entire home/apt, minimum nights: 1)\n\nDay 3: March 25, 2022\nCurrent City: from Augusta to Decatur\nTransportation: Self-driving, duration: 2 hours 19 mins, distance: 229 km, cost: $11\nBreakfast: Fish Tales Lakeside Grille, Augusta (Cuisines: Tea, Cafe, Bakery, Desserts)\nAttraction: DeKalb History Center Museum, Decatur\nLunch: Madhuban Restaurant - Welcome Hotel Rama International, Decatur (Cuisines: Pizza, Bakery, Seafood)\nDinner: Joey's Pizza, Decatur (Cuisines: Tea, Pizza, Bakery, Chinese, Seafood)\nAccommodation: The Heart of the Lower East Side!, Decatur (price: $587, room type: Entire home/apt, minimum nights: 2)\n\nDay 4: March 26, 2022\nCurrent City: Decatur\nTransportation: -\nBreakfast: Tandoori Hut, Decatur (Cuisines: Pizza, American, Indian, Fast Food)\nAttraction: Decatur Square, Decatur\nLunch: Dawat-E-Chaman, Decatur (Cuisines: Chinese, BBQ, Fast Food, Cafe, Mediterranean)\nDinner: Carnatic Cafe, Decatur (Cuisines: Cafe, Indian, Desserts)\nAccommodation: The Heart of the Lower East Side!, Decatur (price: $587, room type: Entire home/apt, minimum nights: 2)\n\nDay 5: March 27, 2022\nCurrent City: from Decatur to Atlanta\nTransportation: Self-driving, duration: 19 mins, distance: 13.0 km, cost: $0\nBreakfast: Cafe Coffee Day, Decatur (Cuisines: Tea, Cafe, BBQ, Mediterranean)\nAttraction: Georgia Aquarium, Atlanta\nLunch: Saffron, Atlanta (Cuisines: Tea, Cafe, Fast Food, Seafood)\nDinner: Asian Bistro, Atlanta (Cuisines: Tea, Bakery, Seafood)\nAccommodation: Bright, Modern, Clean, Spacious, Brooklyn Home, Atlanta (price: $1034, room type: Entire home/apt, minimum nights: 3)\n\nDay 6: March 28, 2022\nCurrent City: Atlanta\nTransportation: -\nBreakfast: Adda, Atlanta (Cuisines: Tea, Mexican, Bakery)\nAttraction: World of Coca-Cola, Atlanta; Atlanta Botanical Garden, Atlanta\nLunch: Pizza Central, Atlanta (Cuisines: Cafe, Bakery, BBQ, Fast Food, Chinese, Indian)\nDinner: Daawat-e-Kashmir, Atlanta (Cuisines: Cafe, Pizza, American, Seafood)\nAccommodation: Bright, Modern, Clean, Spacious, Brooklyn Home, Atlanta (price: $1034, room type: Entire home/apt, minimum nights: 3)\n\nDay 7: March 29, 2022\nCurrent City: from Atlanta to Akron\nTransportation: Self-driving, duration: 10 hours 10 mins, distance: 1,114 km, cost: $55\nBreakfast: Sizzler's Ranch, Atlanta (Cuisines: Tea, Cafe, Indian, Italian)\nAttraction: -\nLunch: -\nDinner: -\nAccommodation: -\n\nTotal Estimated Cost: Transportation ($51 + $11 + $0 + $55 = $117) + Accommodation ($637 + $637 + $587 + $587 + $1034 + $1034 = $4516) + Estimated Food and Attractions ($200/day x 7 days = $1400) = $6033\n\nRemaining Budget: $8900 - $6033 = $2867\n\nNote: The estimated cost for food and attractions is a rough estimate and may vary. The remaining budget can be used for additional expenses or saved. The accommodation costs are based on the minimum nights required and the number of people. Attractions were chosen based on the availability of American and Chinese cuisines in nearby restaurants.", "gpt-4-1106-preview_direct_sole-planning_parsed_results": [{"day": 1, "current_city": "from Akron to Augusta", "transportation": "Self-driving, Duration: 9 hours 36 mins, Distance: 1031 km, Cost: 51", "breakfast": "-", "attraction": "Phinizy Swamp Nature Park, Augusta;", "lunch": "B Merrell's, Augusta", "dinner": "The Golden Dragon, Augusta", "accommodation": "Planta Baja Studio, Augusta"}, {"day": 2, "current_city": "Augusta", "transportation": "-", "breakfast": "B Merrell's, Augusta", "attraction": "Augusta Museum of History, Augusta;", "lunch": "Vinny Vanucchi's, Augusta", "dinner": "The Charcoal Chimney, Augusta", "accommodation": "Planta Baja Studio, Augusta"}, {"day": 3, "current_city": "from Augusta to Decatur", "transportation": "Self-driving, Duration: 2 hours 19 mins, Distance: 229 km, Cost: 11", "breakfast": "Fish Tales Lakeside Grille, Augusta", "attraction": "DeKalb History Center Museum, Decatur;", "lunch": "Madhuban Restaurant - Welcome Hotel Rama International, Decatur", "dinner": "Joey's Pizza, Decatur", "accommodation": "The Heart of the Lower East Side!, Decatur"}, {"day": 4, "current_city": "Decatur", "transportation": "-", "breakfast": "Tandoori Hut, Decatur", "attraction": "Decatur Square, Decatur;", "lunch": "Dawat-E-Chaman, Decatur", "dinner": "Carnatic Cafe, Decatur", "accommodation": "The Heart of the Lower East Side!, Decatur"}, {"day": 5, "current_city": "from Decatur to Atlanta", "transportation": "Self-driving, Duration: 19 mins, Distance: 13.0 km, Cost: 0", "breakfast": "Cafe Coffee Day, Decatur", "attraction": "Georgia Aquarium, Atlanta;", "lunch": "Saffron, Atlanta", "dinner": "Asian Bistro, Atlanta", "accommodation": "Bright, Modern, Clean, Spacious, Brooklyn Home, Atlanta"}, {"day": 6, "current_city": "Atlanta", "transportation": "-", "breakfast": "Adda, Atlanta", "attraction": "World of Coca-Cola, Atlanta; Atlanta Botanical Garden, Atlanta;", "lunch": "Pizza Central, Atlanta", "dinner": "Daawat-e-Kashmir, Atlanta", "accommodation": "Bright, Modern, Clean, Spacious, Brooklyn Home, Atlanta"}, {"day": 7, "current_city": "from Atlanta to Akron", "transportation": "Self-driving, Duration: 10 hours 10 mins, Distance: 1114 km, Cost: 55", "breakfast": "Sizzler's Ranch, Atlanta", "attraction": "-", "lunch": "-", "dinner": "-", "accommodation": "-"}]}]