[{"gpt-4-1106-preview_direct_sole-planning_results": "Travel Plan:\n\nDay 1: March 24, 2022\nCurrent City: from Providence to Orlando\nTransportation: Flight Number: F4011165, from Providence to Orlando, Departure Time: 18:30, Arrival Time: 21:49, Cost: 226\nBreakfast: - (Assuming travelers will have breakfast before departure or on the flight)\nAttraction: The Wheel at ICON Park, Orlando, Cost: Free (Assuming no entry fee)\nLunch: - (Assuming travelers will have lunch before departure or on the flight)\nDinner: Fuji Japanese Steakhouse, Orlando, Cost: 75, Cuisines: \"Tea, Bakery, Desserts\"\nAccommodation: Sixth Ave Chelsea, Studio Serviced Apartment, Orlando, Cost: 70, Maximum Occupancy: 3, House Rules: No visitors & No pets\n\nNumber of People = 1 (Assuming solo traveler due to budget constraints)\nTotal Cost = 226 (Flight) + 75 (Dinner) + 70 (Accommodation) = 371\n\nDay 2: March 25, 2022\nCurrent City: Orlando\nTransportation: -\nBreakfast: Turquoise Villa, Orlando, Cost: 55, Cuisines: \"French, Bakery, BBQ, Fast Food\"\nAttraction: Universal Orlando Resort, Orlando, Cost: Free (Assuming no entry fee)\nLunch: Veg O Non, Orlando, Cost: 45, Cuisines: \"BBQ, Mexican, Pizza, Desserts\"\nDinner: Nirula's Ice Cream, Orlando, Cost: 46, Cuisines: \"Tea, American, BBQ, Indian, Seafood\"\nAccommodation: Sixth Ave Chelsea, Studio Serviced Apartment, Orlando, Cost: 70, Maximum Occupancy: 3, House Rules: No visitors & No pets\n\nNumber of People = 1\nTotal Cost = 55 (Breakfast) + 45 (Lunch) + 46 (Dinner) + 70 (Accommodation) = 216\n\nDay 3: March 26, 2022\nCurrent City: from Orlando to Providence\nTransportation: Flight Number: F4032376, from Orlando to Providence, Departure Time: 19:22, Arrival Time: 21:58, Cost: 280\nBreakfast: Chaayos, Orlando, Cost: 73, Cuisines: \"Tea, Cafe, Mexican\"\nAttraction: Orlando Science Center, Orlando, Cost: Free (Assuming no entry fee)\nLunch: Milan Food, Orlando, Cost: 25, Cuisines: \"Cafe, BBQ, Seafood\"\nDinner: - (Assuming travelers will have dinner after arrival in Providence or on the flight)\nAccommodation: - (Assuming travelers will not stay overnight as they arrive on the same day)\n\nNumber of People = 1\nTotal Cost = 73 (Breakfast) + 25 (Lunch) + 280 (Flight) = 378\n\nTotal cost across all days = 371 + 216 + 378 = 965\n\nRemaining Budget = 1800 - 965 = 835\n\nCuisines: The prompt specifies no cuisines, so all cuisines constraints are satisfied.\n\nNote: The attractions listed as \"Cost: Free\" are assumed to have no entry fee, which may not be the case in reality. Additionally, the budget allows for only one traveler to maintain the cost under $1,800. If more travelers are to be included, the budget will need to be adjusted accordingly. The accommodation chosen is based on the assumption that the traveler is not sharing a room. The travel plan includes only one city visit, Orlando, as per the query.", "gpt-4-1106-preview_direct_sole-planning_parsed_results": [{"day": 1, "current_city": "from Providence to Orlando", "transportation": "Flight Number: F4011165, from Providence to Orlando, Departure Time: 18:30, Arrival Time: 21:49", "breakfast": "-", "attraction": "The Wheel at ICON Park, Orlando;", "lunch": "-", "dinner": "Fuji Japanese Steakhouse, Orlando", "accommodation": "Sixth Ave Chelsea, Studio Serviced Apartment, Orlando"}, {"day": 2, "current_city": "Orlando", "transportation": "-", "breakfast": "Turquoise Villa, Orlando", "attraction": "Universal Orlando Resort, Orlando;", "lunch": "Veg O Non, Orlando", "dinner": "Nirula's Ice Cream, Orlando", "accommodation": "Sixth Ave Chelsea, Studio Serviced Apartment, Orlando"}, {"day": 3, "current_city": "from Orlando to Providence", "transportation": "Flight Number: F4032376, from Orlando to Providence, Departure Time: 19:22, Arrival Time: 21:58", "breakfast": "Chaayos, Orlando", "attraction": "Orlando Science Center, Orlando;", "lunch": "Milan Food, Orlando", "dinner": "-", "accommodation": "-"}]}]