[{"gpt-4-1106-preview_direct_sole-planning_results": "Travel Plan:\n\nDay 1: March 16, 2022\nCurrent City: from Salt Lake City to Billings\nTransportation: Flight Number: F3829434, from Salt Lake City to Billings, Departure Time: 09:43, Arrival Time: 10:59, Cost: 92 * 2 = 184\nBreakfast: - \nAttraction: Western Heritage Center, Billings, Cost: Free\nLunch: Holy Smoke, Billings, Cost: 38 * 2 = 76, Cuisines: \"Tea, Bakery, Cafe, Indian, Seafood\"\nDinner: L'Angoor, Billings, Cost: 19 * 2 = 38, Cuisines: \"Cafe, Pizza, Indian, Fast Food\"\nAccommodation: Great Room! Great Price! \\nCan wait to see you!, Billings, Cost: 1152 * 2 / 2 = 1152, Maximum Occupancy: 2, House Rules: No children under 10 & No parties, Minimum Nights: 2\n\nNumber of People = 2\nTotal Cost = 184 + 76 + 38 + 1152 = 1450\nAccommodation Minimum Nights: 1/2\n\nDay 2: March 17, 2022\nCurrent City: Billings\nTransportation: -\nBreakfast: Choudhary Dhaba, Billings, Cost: 15 * 2 = 30, Cuisines: \"Pizza, Bakery, Mediterranean, Fast Food\"\nAttraction: Yellowstone Art Museum, Billings, Cost: Free\nLunch: Govardhan, Billings, Cost: 59 * 2 = 118, Cuisines: \"BBQ, Bakery, Desserts\"\nDinner: Hong Kong Express, Billings, Cost: 43 * 2 = 86, Cuisines: \"BBQ, Mediterranean, Seafood\"\nAccommodation: Great Room! Great Price! \\nCan wait to see you!, Billings, Cost: 1152 * 2 / 2 = 1152, Maximum Occupancy: 2, House Rules: No children under 10 & No parties, Minimum Nights: 2\n\nNumber of People = 2\nTotal Cost = 30 + 118 + 86 + 1152 = 1386\nAccommodation Minimum Nights: 2/2\n\nDay 3: March 18, 2022\nCurrent City: from Billings to Great Falls\nTransportation: Taxi, from Billings to Great Falls, Cost: 352 * 2 / 4 = 176\nBreakfast: Just Vada Pav, Billings, Cost: 15 * 2 = 30, Cuisines: \"Tea, Pizza, French, Mexican, BBQ, Seafood\"\nAttraction: C. M. Russell Museum, Great Falls, Cost: Free\nLunch: Flying Pie Pizzaria, Great Falls, Cost: 78 * 2 = 156, Cuisines: \"Desserts, Bakery, Fast Food, Cafe, Indian, Mediterranean\"\nDinner: Hula Grill, Great Falls, Cost: 76 * 2 = 152, Cuisines: \"Pizza, BBQ, Seafood\"\nAccommodation: Comfy & Sunny Studio Rental, Great Falls, Cost: 413 * 2 / 3 = 276, Maximum Occupancy: 3, House Rules: No parties, Minimum Nights: 2\n\nNumber of People = 2\nTotal Cost = 176 + 30 + 156 + 152 + 276 = 790\nAccommodation Minimum Nights: 1/2\n\nDay 4: March 19, 2022\nCurrent City: Great Falls\nTransportation: -\nBreakfast: SpiceKlub, Great Falls, Cost: 76 * 2 = 152, Cuisines: \"Tea, Pizza, Indian, Fast Food, Cafe, American\"\nAttraction: The Lewis and Clark Interpretive Center, Great Falls, Cost: Free\nLunch: Barbeque Nation, Great Falls, Cost: 46 * 2 = 92, Cuisines: \"Tea, BBQ, Fast Food\"\nDinner: Silver, Great Falls, Cost: 83 * 2 = 166, Cuisines: \"Cafe, American, BBQ, Seafood\"\nAccommodation: Comfy & Sunny Studio Rental, Great Falls, Cost: 413 * 2 / 3 = 276, Maximum Occupancy: 3, House Rules: No parties, Minimum Nights: 2\n\nNumber of People = 2\nTotal Cost = 152 + 92 + 166 + 276 = 686\nAccommodation Minimum Nights: 2/2\n\nDay 5: March 20, 2022\nCurrent City: from Great Falls to Bozeman\nTransportation: Taxi, from Great Falls to Bozeman, Cost: 299 * 2 / 4 = 150\nBreakfast: Taruveda Bistro, Great Falls, Cost: 27 * 2 = 54, Cuisines: \"Chinese, Pizza, BBQ, Seafood\"\nAttraction: Museum of the Rockies, Bozeman, Cost: Free\nLunch: Jiquitaia, Bozeman, Cost: 36 * 2 = 72, Cuisines: \"Tea, Pizza, American\"\nDinner: McGuire's Irish Pub & Brewery, Bozeman, Cost: 72 * 2 = 144, Cuisines: \"Fast Food, Desserts, Italian\"\nAccommodation: SPACIOUS STUDIO APT 3 IN PROSPECT LEFFERTS GARDENS, Bozeman, Cost: 1060 * 2 / 6 = 354, Maximum Occupancy: 6, House Rules: No children under 10 & No parties, Minimum Nights: 5\n\nNumber of People = 2\nTotal Cost = 150 + 54 + 72 + 144 + 354 = 774\nAccommodation Minimum Nights: 1/5\n\nDay 6: March 21, 2022\nCurrent City: Bozeman\nTransportation: -\nBreakfast: Saravana Bhavan, Bozeman, Cost: 38 * 2 = 76, Cuisines: \"Tea, American, Desserts\"\nAttraction: Gallatin History Museum, Bozeman, Cost: Free\nLunch: Indo Chinese, Bozeman, Cost: 66 * 2 = 132, Cuisines: \"Italian, BBQ, Bakery, Fast Food, Chinese, Seafood\"\nDinner: Zaroob, Bozeman, Cost: 67 * 2 = 134, Cuisines: \"Desserts, Tea, French, BBQ, Bakery, Indian\"\nAccommodation: SPACIOUS STUDIO APT 3 IN PROSPECT LEFFERTS GARDENS, Bozeman, Cost: 1060 * 2 / 6 = 354, Maximum Occupancy: 6, House Rules: No children under 10 & No parties, Minimum Nights: 5\n\nNumber of People = 2\nTotal Cost = 76 + 132 + 134 + 354 = 696\nAccommodation Minimum Nights: 2/5\n\nDay 7: March 22, 2022\nCurrent City: from Bozeman to Salt Lake City\nTransportation: Flight Number: F3500804, from Bozeman to Salt Lake City, Departure Time: 05:57, Arrival Time: 07:03, Cost: 71 * 2 = 142\nBreakfast: -\nAttraction: -\nLunch: -\nDinner: -\nAccommodation: -\n\nNumber of People = 2\nTotal Cost = 142\n\nTotal cost across all days = 1450 + 1386 + 790 + 686 + 774 + 696 + 142 = 5924\n\nCuisines: American, Mediterranean, Indian, and Chinese cuisines have been included in the meals throughout the trip.\n\nRemaining Budget: 7200 - 5924 = 1276\n\nNote: The accommodations chosen do not allow parties as per the house rules, but they were the only options available in the reference data. If party-friendly accommodations are a strict requirement, alternative arrangements would need to be sourced outside of the provided reference data.", "gpt-4-1106-preview_direct_sole-planning_parsed_results": [{"day": 1, "current_city": "from Salt Lake City to Billings", "transportation": "Flight Number: F3829434, from Salt Lake City to Billings, Departure Time: 09:43, Arrival Time: 10:59", "breakfast": "-", "attraction": "Western Heritage Center, Billings", "lunch": "Holy Smoke, Billings", "dinner": "L'Angoor, Billings", "accommodation": "Great Room! Great Price!, Billings"}, {"day": 2, "current_city": "Billings", "transportation": "-", "breakfast": "Choudhary Dhaba, Billings", "attraction": "Yellowstone Art Museum, Billings", "lunch": "Govardhan, Billings", "dinner": "Hong Kong Express, Billings", "accommodation": "Great Room! Great Price!, Billings"}, {"day": 3, "current_city": "from Billings to Great Falls", "transportation": "Taxi, from Billings to Great Falls", "breakfast": "Just Vada Pav, Billings", "attraction": "C. M. Russell Museum, Great Falls", "lunch": "Flying Pie Pizzaria, Great Falls", "dinner": "Hula Grill, Great Falls", "accommodation": "Comfy & Sunny Studio Rental, Great Falls"}, {"day": 4, "current_city": "Great Falls", "transportation": "-", "breakfast": "SpiceKlub, Great Falls", "attraction": "The Lewis and Clark Interpretive Center, Great Falls", "lunch": "Barbeque Nation, Great Falls", "dinner": "Silver, Great Falls", "accommodation": "Comfy & Sunny Studio Rental, Great Falls"}, {"day": 5, "current_city": "from Great Falls to Bozeman", "transportation": "Taxi, from Great Falls to Bozeman", "breakfast": "Taruveda Bistro, Great Falls", "attraction": "Museum of the Rockies, Bozeman", "lunch": "Jiquitaia, Bozeman", "dinner": "McGuire's Irish Pub & Brewery, Bozeman", "accommodation": "SPACIOUS STUDIO APT 3 IN PROSPECT LEFFERTS GARDENS, Bozeman"}, {"day": 6, "current_city": "Bozeman", "transportation": "-", "breakfast": "Saravana Bhavan, Bozeman", "attraction": "Gallatin History Museum, Bozeman", "lunch": "Indo Chinese, Bozeman", "dinner": "Zaroob, Bozeman", "accommodation": "SPACIOUS STUDIO APT 3 IN PROSPECT LEFFERTS GARDENS, Bozeman"}, {"day": 7, "current_city": "from Bozeman to Salt Lake City", "transportation": "Flight Number: F3500804, from Bozan to Salt Lake City, Departure Time: 05:57, Arrival Time: 07:03", "breakfast": "-", "attraction": "-", "lunch": "-", "dinner": "-", "accommodation": "-"}]}]