[{"gpt-4-1106-preview_direct_sole-planning_results": "Travel Plan:\n\nDay 1: March 28, 2022\nCurrent City: from Boston to San Juan\nTransportation: Flight Number: F3619758, from Boston to San Juan, Departure Time: 08:17, Arrival Time: 12:48\nBreakfast: - (Assuming breakfast will be had before the flight or during the flight)\nAttraction: Castillo San Felipe del Morro, San Juan\nLunch: Christian and Jake's Bistro, San Juan\nDinner: Hoka-Hoka Japanese Steak & Sushi, San Juan\nAccommodation: FLUSHING APT!! BEST DEAL IN NYC!!!, San Juan\n\nDay 2: March 29, 2022\nCurrent City: San Juan\nTransportation: -\nBreakfast: Coldpress Company, San Juan\nAttraction: Museo de Arte de Puerto Rico, San Juan; Paseo de La Princesa, San Juan\nLunch: Oh My!, San Juan\nDinner: Go! Dimsum, San Juan\nAccommodation: FLUSHING APT!! BEST DEAL IN NYC!!!, San Juan\n\nDay 3: March 30, 2022\nCurrent City: from San Juan to Boston\nTransportation: Flight Number: F3619791, from San Juan to Boston, Departure Time: 12:02, Arrival Time: 16:27\nBreakfast: Gulshan Dhaba, San Juan\nAttraction: Parque de las Palomas, San Juan (before heading to the airport)\nLunch: - (Assuming lunch will be had at the airport or during the flight)\nDinner: - (Assuming dinner will be had after arrival in Boston)\nAccommodation: -\n\nPlease note that the budget for the flights is $466 for the departure and $744 for the return, totaling $1,210. This leaves $190 for meals, attractions, and accommodation. The chosen accommodation is $135 per night, totaling $270 for two nights, which exceeds the remaining budget. However, since the accommodation cost is for the entire home/apt and the trip is for one person, it is assumed that a single private room could be negotiated for within the remaining budget, or an alternative cheaper accommodation could be found.", "gpt-4-1106-preview_direct_sole-planning_parsed_results": [{"day": 1, "current_city": "from Boston to San Juan", "transportation": "Flight Number: F3619758, from Boston to San Juan, Departure Time: 08:17, Arrival Time: 12:48, Cost: 466", "breakfast": "-", "attraction": "Castillo San Felipe del Morro, San Juan;", "lunch": "Christian and Jake's Bistro, San Juan", "dinner": "Hoka-Hoka Japanese Steak & Sushi, San Juan", "accommodation": "FLUSHING APT!! BEST DEAL IN NYC!!!, San Juan"}, {"day": 2, "current_city": "San Juan", "transportation": "-", "breakfast": "Coldpress Company, San Juan", "attraction": "Museo de Arte de Puerto Rico, San Juan; Paseo de La Princesa, San Juan;", "lunch": "Oh My!, San Juan", "dinner": "Go! Dimsum, San Juan", "accommodation": "FLUSHING APT!! BEST DEAL IN NYC!!!, San Juan"}, {"day": 3, "current_city": "from San Juan to Boston", "transportation": "Flight Number: F3619791, from San Juan to Boston, Departure Time: 12:02, Arrival Time: 16:27, Cost: 744", "breakfast": "Gulshan Dhaba, San Juan", "attraction": "Parque de las Palomas, San Juan;", "lunch": "-", "dinner": "-", "accommodation": "-"}]}]