[{"gpt-4-1106-preview_direct_sole-planning_results": "Travel Plan:\n\nDay 1: March 6, 2022\nCurrent City: from Richmond to Houston\nTransportation: Flight Number: F4041372, from Richmond to Houston, Departure Time: 08:27, Arrival Time: 10:43\nBreakfast: - (Assuming breakfast is had before the flight or on board)\nAttraction: Downtown Aquarium, Houston\nLunch: Jalapenos, Houston (Chinese, Seafood)\nDinner: The BrewMaster - The Mix Fine Dine, Houston (French, Indian, Cafe, Seafood)\nAccommodation: Sunny and Airy near Manhattan, Houston (Entire home/apt, No pets, 2 nights minimum)\n\nDay 2: March 7, 2022\nCurrent City: Houston\nTransportation: -\nBreakfast: Super Bakery, Houston (Seafood, Fast Food)\nAttraction: Space Center Houston, Houston; Houston Museum of Natural Science, Houston\nLunch: Chawla's\u5b8a, Houston (Chinese, Desserts, Bakery, Cafe, Mediterranean)\nDinner: Vinayaka Mylari, Houston (Fast Food, French, Cafe, Italian)\nAccommodation: Sunny and Airy near Manhattan, Houston\n\nDay 3: March 8, 2022\nCurrent City: from Houston to Texarkana\nTransportation: Flight Number: F3930024, from Houston to Texarkana, Departure Time: 17:56, Arrival Time: 19:00\nBreakfast: Earthen Spices, Houston (Tea, Mexican, Bakery, BBQ, Fast Food)\nAttraction: Gerald D. Hines Waterwall Park, Houston\nLunch: Al Arabian Express, Houston (BBQ, Desserts, Seafood)\nDinner: Big City Bread Cafe, Texarkana (Cafe, Pizza, Bakery, BBQ)\nAccommodation: sunny airy bohemian rm, private bath! hip 'shwick, Texarkana (Private room, No smoking, 2 nights minimum)\n\nDay 4: March 9, 2022\nCurrent City: Texarkana\nTransportation: -\nBreakfast: Columbia Restaurant, Texarkana (Desserts, Tea, Pizza, Indian, Seafood)\nAttraction: Museum of Regional History, Texarkana; Ace of Clubs House, Texarkana\nLunch: Polka Pastry & Snack Bar, Texarkana (Fast Food, BBQ, Italian)\nDinner: Teasta, Texarkana (Pizza, Italian, French, Bakery, Cafe, Seafood)\nAccommodation: sunny airy bohemian rm, private bath! hip 'shwick, Texarkana\n\nDay 5: March 10, 2022\nCurrent City: from Texarkana to Richmond\nTransportation: Self-driving, from Texarkana to Richmond, duration: 16 hours 8 mins, distance: 1,773 km, cost: 88\nBreakfast: Granma's Homemade, Texarkana (Tea, Mexican, Bakery, Cafe, Seafood)\nAttraction: - (Travel day, no attractions planned)\nLunch: - (On the road)\nDinner: - (Assuming arrival in Richmond is late)\nAccommodation: -\n\nPlease note that the travel plan adheres to the budget, preferences for Chinese and Indian cuisines, and includes diverse attractions and restaurants. Accommodations have been chosen based on the minimum nights required and the budget. The return to the origin city is on the last day, and no city or attraction is visited twice.", "gpt-4-1106-preview_direct_sole-planning_parsed_results": [{"days": 1, "current_city": "from Richmond to Houston", "transportation": "Flight Number: F4041372, from Richmond to Houston, Departure Time: 08:27, Arrival Time: 10:43", "breakfast": "-", "attraction": "Downtown Aquarium, Houston", "lunch": "Jalapenos, Houston", "dinner": "The BrewMaster - The Mix Fine Dine, Houston", "accommodation": "Sunny and Airy near Manhattan, Houston"}, {"days": 2, "current_city": "Houston", "transportation": "-", "breakfast": "Super Bakery, Houston", "attraction": "Space Center Houston, Houston;Houston Museum of Natural Science, Houston", "lunch": "Chawla's\u5b8a, Houston", "dinner": "Vinayaka Mylari, Houston", "accommodation": "Sunny and Airy near Manhattan, Houston"}, {"days": 3, "current_city": "from Houston to Texarkana", "transportation": "Flight Number: F3930024, from Houston to Texarkana, Departure Time: 17:56, Arrival Time: 19:00", "breakfast": "Earthen Spices, Houston", "attraction": "Gerald D. Hines Waterwall Park, Houston", "lunch": "Al Arabian Express, Houston", "dinner": "Big City Bread Cafe, Texarkana", "accommodation": "sunny airy bohemian rm, private bath! hip 'shwick, Texarkana"}, {"days": 4, "current_city": "Texarkana", "transportation": "-", "breakfast": "Columbia Restaurant, Texarkana", "attraction": "Museum of Regional History, Texarkana;Ace of Clubs House, Texarkana", "lunch": "Polka Pastry & Snack Bar, Texarkana", "dinner": "Teasta, Texarkana", "accommodation": "sunny airy bohemian rm, private bath! hip 'shwick, Texarkana"}, {"days": 5, "current_city": "from Texarkana to Richmond", "transportation": "Self-driving, from Texarkana to Richmond, duration: 16 hours 8 mins, distance: 1773 km, Cost: 88", "breakfast": "Granma's Homemade, Texarkana", "attraction": "-", "lunch": "-", "dinner": "-", "accommodation": "-"}]}]