[{"gpt-4-1106-preview_direct_sole-planning_results": "Travel Plan:\n\nDay 1: March 14, 2022\nCurrent City: from Myrtle Beach to Nashville\nTransportation: Flight Number: F3979006, from Myrtle Beach to Nashville, Departure Time: 06:00, Arrival Time: 06:26, Cost: 217 * 4 = 868\nBreakfast: - (Assuming breakfast is had before the flight)\nAttraction: Country Music Hall of Fame and Museum, Nashville, Cost: -\nLunch: Bablu Fast Food, Nashville, Cost: 13 * 4 = 52, Cuisines: \"Desserts, Pizza, Mexican, BBQ, Fast Food\"\nDinner: Bangkok 1, Nashville, Cost: 44 * 4 = 176, Cuisines: \"Cafe, Seafood\"\nAccommodation: Clean and large bedroom in a private house, Nashville, Cost: 474 * 4 / 1 = 1896, Maximum Occupancy: 1, House Rules: No smoking, Minimum Nights: 1\n\nNumber of People = 4\nTotal Cost = 868 + 52 + 176 + 1896 = 2992\nAccommodation Minimum Nights: 1/1\n\nDay 2: March 15, 2022\nCurrent City: Nashville\nTransportation: -\nBreakfast: Govinda's Confectionery, Nashville, Cost: 15 * 4 = 60, Cuisines: \"Tea, Bakery, Mediterranean, Fast Food\"\nAttraction: Nashville Zoo at Grassmere, Nashville, Cost: -\nLunch: Twigly, Nashville, Cost: 14 * 4 = 56, Cuisines: \"Pizza, French, Fast Food, Chinese, Seafood\"\nDinner: Dialogue Lounge & Caf\u6106, Nashville, Cost: 83 * 4 = 332, Cuisines: \"Tea, Indian, BBQ, Cafe, American, Seafood\"\nAccommodation: Clean and large bedroom in a private house, Nashville, Cost: 474 * 4 / 1 = 1896, Maximum Occupancy: 1, House Rules: No smoking, Minimum Nights: 1\n\nNumber of People = 4\nTotal Cost = 60 + 56 + 332 + 1896 = 2344\nAccommodation Minimum Nights: 1/1\n\nDay 3: March 16, 2022\nCurrent City: from Nashville to Memphis\nTransportation: Self-driving, from Nashville to Memphis, Cost: 17 * ceil(4/5) = 17\nBreakfast: Meenakshi Bhawan, Nashville, Cost: 24 * 4 = 96, Cuisines: \"Tea, Desserts\"\nAttraction: Graceland, Memphis, Cost: -\nLunch: Crust Stone Oven Pizza, Memphis, Cost: 73 * 4 = 292, Cuisines: \"Tea, Pizza, BBQ\"\nDinner: My Spice Kitchen, Memphis, Cost: 82 * 4 = 328, Cuisines: \"Desserts, French, Bakery, Fast Food, Mediterranean, Seafood\"\nAccommodation: ~*PLANT HAVEN*~ Private Room -Charming Garden Apt, Memphis, Cost: 354 * 4 / 2 = 708, Maximum Occupancy: 2, House Rules: No parties & No smoking, Minimum Nights: 3\n\nNumber of People = 4\nTotal Cost = 17 + 96 + 292 + 328 + 708 = 1441\nAccommodation Minimum Nights: 1/3\n\nDay 4: March 17, 2022\nCurrent City: Memphis\nTransportation: -\nBreakfast: Sultans of Spice, Memphis, Cost: 76 * 4 = 304, Cuisines: \"Cafe, Bakery, Desserts\"\nAttraction: National Civil Rights Museum, Memphis, Cost: -\nLunch: The Gathering Hut, Memphis, Cost: 76 * 4 = 304, Cuisines: \"Desserts, American, Bakery, BBQ, Fast Food, Indian\"\nDinner: Hops n Grains, Memphis, Cost: 95 * 4 = 380, Cuisines: \"Cafe, Bakery, American, Seafood\"\nAccommodation: ~*PLANT HAVEN*~ Private Room -Charming Garden Apt, Memphis, Cost: 354 * 4 / 2 = 708, Maximum Occupancy: 2, House Rules: No parties & No smoking, Minimum Nights: 3\n\nNumber of People = 4\nTotal Cost = 304 + 304 + 380 + 708 = 1696\nAccommodation Minimum Nights: 2/3\n\nDay 5: March 18, 2022\nCurrent City: from Memphis to Myrtle Beach\nTransportation: Self-driving, from Memphis to Myrtle Beach, Cost: 59 * ceil(4/5) = 59\nBreakfast: Bengali Sweet Corner, Memphis, Cost: 45 * 4 = 180, Cuisines: \"Desserts, Tea, Pizza, Mexican, BBQ\"\nAttraction: Memphis Zoo, Memphis, Cost: -\nLunch: - (Assuming lunch is on the road)\nDinner: - (Assuming dinner is after arrival in Myrtle Beach)\nAccommodation: -\n\nNumber of People = 4\nTotal Cost = 59 + 180 = 239\n\nTotal cost across all days = 2992 + 2344 + 1441 + 1696 + 239 = 8712\n\nCuisines: The prompt specifies no specific cuisines, so all cuisines constraints are satisfied.\n\n**Note: The total cost exceeds the budget of $5,500. Adjustments to the plan would be required to meet the budget constraint. This could involve selecting cheaper accommodations, attractions, or meals, or reconsidering the mode of transportation.**", "gpt-4-1106-preview_direct_sole-planning_parsed_results": [{"day": 1, "current_city": "from Myrtle Beach to Nashville", "transportation": "Flight Number: F3979006, from Myrtle Beach to Nashville, Departure Time: 06:00, Arrival Time: 06:26", "breakfast": "-", "attraction": "Country Music Hall of Fame and Museum, Nashville;", "lunch": "Bablu Fast Food, Nashville", "dinner": "Bangkok 1, Nashville", "accommodation": "Clean and large bedroom in a private house, Nashville"}, {"day": 2, "current_city": "Nashville", "transportation": "-", "breakfast": "Govinda's Confectionery, Nashville", "attraction": "Nashville Zoo at Grassmere, Nashville;", "lunch": "Twigly, Nashville", "dinner": "Dialogue Lounge & Caf\u6106, Nashville", "accommodation": "Clean and large bedroom in a private house, Nashville"}, {"day": 3, "current_city": "from Nashville to Memphis", "transportation": "Self-driving, from Nashville to Memphis", "breakfast": "Meenakshi Bhawan, Nashville", "attraction": "Graceland, Memphis;", "lunch": "Crust Stone Oven Pizza, Memphis", "dinner": "My Spice Kitchen, Memphis", "accommodation": "~*PLANT HAVEN*~ Private Room -Charming Garden Apt, Memphis"}, {"day": 4, "current_city": "Memphis", "transportation": "-", "breakfast": "Sultans of Spice, Memphis", "attraction": "National Civil Rights Museum, Memphis;", "lunch": "The Gathering Hut, Memphis", "dinner": "Hops n Grains, Memphis", "accommodation": "~*PLANT HAVEN*~ Private Room -Charming Garden Apt, Memphis"}, {"day": 5, "current_city": "from Memphis to Myrtle Beach", "transportation": "Self-driving, from Memphis to Myrtle Beach", "breakfast": "Bengali Sweet Corner, Memphis", "attraction": "Memphis Zoo, Memphis;", "lunch": "-", "dinner": "-", "accommodation": "-"}]}]