[{"gpt-4-1106-preview_direct_sole-planning_results": "Travel Plan:\n\nDay 1: March 2, 2022\nCurrent City: from Minneapolis to Nashville\nTransportation: Self-driving, from Minneapolis to Nashville, duration: 12 hours 45 mins, distance: 1,420 km, cost: $71\nBreakfast: -\nAttraction: -\nLunch: -\nDinner: -\nAccommodation: Huge 2 Bedroom, Great Location, Express Metro, Nashville (smoking-friendly not specified, but no smoking rule not listed)\n\nDay 2: March 3, 2022\nCurrent City: Nashville\nTransportation: -\nBreakfast: Bangkok 1, Nashville\nAttraction: Country Music Hall of Fame and Museum, Nashville\nLunch: Bablu Fast Food, Nashville\nDinner: GoGourmet, Nashville\nAccommodation: Huge 2 Bedroom, Great Location, Express Metro, Nashville\n\nDay 3: March 4, 2022\nCurrent City: from Nashville to Knoxville\nTransportation: Self-driving, from Nashville to Knoxville, duration: 2 hours 42 mins, distance: 290 km, cost: $14\nBreakfast: Full Dabba, Nashville\nAttraction: World's Fair Park, Knoxville\nLunch: Cafe Arabelle, Knoxville\nDinner: Les 3 Brasseurs, Knoxville\nAccommodation: Beautiful & Private Manhattan Room, Knoxville (smoking-friendly not specified, but no smoking rule not listed)\n\nDay 4: March 5, 2022\nCurrent City: Knoxville\nTransportation: -\nBreakfast: Sky On 57, Knoxville\nAttraction: Knoxville Museum of Art, Knoxville\nLunch: Cafe El Chico, Knoxville\nDinner: Rama Vaishnav Bhojnalaya, Knoxville\nAccommodation: Beautiful & Private Manhattan Room, Knoxville\n\nDay 5: March 6, 2022\nCurrent City: from Knoxville to Minneapolis\nTransportation: Self-driving, from Knoxville to Minneapolis, duration: 13 hours 58 mins, distance: 1,529 km, cost: $76\nBreakfast: -\nAttraction: -\nLunch: -\nDinner: -\nAccommodation: -\n\nTotal Estimated Cost:\n- Transportation: $71 (Minneapolis to Nashville) + $14 (Nashville to Knoxville) + $76 (Knoxville to Minneapolis) = $161\n- Accommodation: $745 (Nashville, 2 nights) + $721 (Knoxville, 2 nights) = $1,466\n- Meals and Attractions: Variable, but within the remaining budget of $373\n\nNote: Smoking-friendly accommodations were not explicitly listed, so accommodations were chosen where \"No smoking\" was not listed as a house rule. The budget does not include meals and attraction entry fees, but there is enough remaining budget to cover these expenses. The travelers should ensure they have enough funds for meals, attractions, and any additional incidentals.", "gpt-4-1106-preview_direct_sole-planning_parsed_results": [{"day": 1, "current_city": "from Minneapolis to Nashville", "transportation": "Self-driving, from Minneapolis to Nashville, Duration: 12 hours 45 mins, Distance: 1420 km, Cost: 71", "breakfast": "-", "attraction": "-", "lunch": "-", "dinner": "-", "accommodation": "Huge 2 Bedroom, Great Location, Express Metro, Nashville"}, {"day": 2, "current_city": "Nashville", "transportation": "-", "breakfast": "Bangkok 1, Nashville", "attraction": "Country Music Hall of Fame and Museum, Nashville;", "lunch": "Bablu Fast Food, Nashville", "dinner": "GoGourmet, Nashville", "accommodation": "Huge 2 Bedroom, Great Location, Express Metro, Nashville"}, {"day": 3, "current_city": "from Nashville to Knoxville", "transportation": "Self-driving, from Nashville to Knoxville, Duration: 2 hours 42 mins, Distance: 290 km, Cost: 14", "breakfast": "Full Dabba, Nashville", "attraction": "World's Fair Park, Knoxville;", "lunch": "Cafe Arabelle, Knoxville", "dinner": "Les 3 Brasseurs, Knoxville", "accommodation": "Beautiful & Private Manhattan Room, Knoxville"}, {"day": 4, "current_city": "Knoxville", "transportation": "-", "breakfast": "Sky On 57, Knoxville", "attraction": "Knoxville Museum of Art, Knoxville;", "lunch": "Cafe El Chico, Knoxville", "dinner": "Rama Vaishnav Bhojnalaya, Knoxville", "accommodation": "Beautiful & Private Manhattan Room, Knoxville"}, {"day": 5, "current_city": "from Knoxville to Minneapolis", "transportation": "Self-driving, from Knoxville to Minneapolis, Duration: 13 hours 58 mins, Distance: 1529 km, Cost: 76", "breakfast": "-", "attraction": "-", "lunch": "-", "dinner": "-", "accommodation": "-"}]}]