[{"gpt-4-1106-preview_direct_sole-planning_results": "Travel Plan:\n\nDay 1: March 14, 2022\nCurrent City: from Omaha to Colorado Springs\nTransportation: Self-driving, from Omaha to Colorado Springs, duration: 8 hours 35 mins, distance: 982 km, cost: $49 x 7 = $343\nBreakfast: - (Assuming travelers will have breakfast before departure)\nLunch: - (Assuming travelers will pack lunch for the road)\nDinner: Raglan Road Irish Pub and Restaurant, Colorado Springs, Average Cost: $97 x 7 = $679\nAccommodation: Large sunny park slope apartment, Colorado Springs, price: $82 x 5 nights = $410 (Pet-friendly, minimum nights: 1)\nTotal cost for Day 1: $343 (Transportation) + $679 (Dinner) + $410 (Accommodation) = $1,432\n\nDay 2: March 15, 2022\nCurrent City: Colorado Springs\nBreakfast: GoGourmet, Colorado Springs, Average Cost: $66 x 7 = $462\nAttraction: Garden of the Gods, Colorado Springs, Cost: Free\nLunch: New Spice World, Colorado Springs, Average Cost: $43 x 7 = $301\nAttraction: The Broadmoor Seven Falls, Colorado Springs, Cost: Free\nDinner: Derby, Colorado Springs, Average Cost: $67 x 7 = $469\nAccommodation: Large sunny park slope apartment, Colorado Springs, price: Included in Day 1\nTotal cost for Day 2: $462 (Breakfast) + $301 (Lunch) + $469 (Dinner) = $1,232\n\nDay 3: March 16, 2022\nCurrent City: from Colorado Springs to Denver\nTransportation: Flight Number: F3856135, from Colorado Springs to Denver, Price: $16 x 7 = $112\nBreakfast: Club Tokyo - Best Western Skycity Hotel, Colorado Springs, Average Cost: $64 x 7 = $448\nAttraction: Cheyenne Mountain Zoo, Colorado Springs, Cost: Free\nLunch: Deepak Rasoi, Colorado Springs, Average Cost: $60 x 7 = $420\nDinner: The Fatty Bao - Asian Gastro Bar, Denver, Average Cost: $93 x 7 = $651\nAccommodation: Harlem cozy nights, Denver, price: $457 x 2 nights = $914 (Pet-friendly, minimum nights: 4)\nTotal cost for Day 3: $112 (Transportation) + $448 (Breakfast) + $420 (Lunch) + $651 (Dinner) + $914 (Accommodation) = $2,545\n\nDay 4: March 17, 2022\nCurrent City: Denver\nBreakfast: The Urban Socialite, Denver, Average Cost: $34 x 7 = $238\nAttraction: Denver Zoo, Denver, Cost: Free\nLunch: Tasty Fare, Denver, Average Cost: $79 x 7 = $553\nAttraction: Denver Botanic Gardens, Denver, Cost: Free\nDinner: Nukkadwala, Denver, Average Cost: $31 x 7 = $217\nAccommodation: Harlem cozy nights, Denver, price: Included in Day 3\nTotal cost for Day 4: $238 (Breakfast) + $553 (Lunch) + $217 (Dinner) = $1,008\n\nDay 5: March 18, 2022\nCurrent City: from Denver to Omaha\nTransportation: Flight Number: F4026904, from Denver to Omaha, Price: $129 x 7 = $903\nBreakfast: Woods Spice, Denver, Average Cost: $69 x 7 = $483\nAttraction: Denver Art Museum, Denver, Cost: Free\nLunch: Al Yousuf, Denver, Average Cost: $32 x 7 = $224\nDinner: - (Assuming travelers will have dinner upon arrival in Omaha)\nAccommodation: - (Returning to Omaha)\nTotal cost for Day 5: $903 (Transportation) + $483 (Breakfast) + $224 (Lunch) = $1,610\n\nThe total cost of this trip is the sum of the costs from Day 1, Day 2, Day 3, Day 4, and Day 5. It is $1,432 + $1,232 + $2,545 + $1,008 + $1,610 = $7,827 which is less than the required budget of $23,400.\n\nPlease note that attraction costs are assumed to be free based on the provided information, and the accommodation costs are calculated based on the minimum nights required. Pet-friendly accommodations were selected as requested.", "gpt-4-1106-preview_direct_sole-planning_parsed_results": [{"day": 1, "current_city": "from Omaha to Colorado Springs", "transportation": "Self-driving, from Omaha to Colorado Springs, duration: 8 hours 35 mins, distance: 982 km", "breakfast": "-", "attraction": "-", "lunch": "-", "dinner": "Raglan Road Irish Pub and Restaurant, Colorado Springs", "accommodation": "Large sunny park slope apartment, Colorado Springs"}, {"day": 2, "current_city": "Colorado Springs", "transportation": "-", "breakfast": "GoGourmet, Colorado Springs", "attraction": "Garden of the Gods, Colorado Springs;The Broadmoor Seven Falls, Colorado Springs;", "lunch": "New Spice World, Colorado Springs", "dinner": "Derby, Colorado Springs", "accommodation": "Large sunny park slope apartment, Colorado Springs"}, {"day": 3, "current_city": "from Colorado Springs to Denver", "transportation": "Flight Number: F3856135, from Colorado Springs to Denver", "breakfast": "Club Tokyo - Best Western Skycity Hotel, Colorado Springs", "attraction": "Cheyenne Mountain Zoo, Colorado Springs", "lunch": "Deepak Rasoi, Colorado Springs", "dinner": "The Fatty Bao - Asian Gastro Bar, Denver", "accommodation": "Harlem cozy nights, Denver"}, {"day": 4, "current_city": "Denver", "transportation": "-", "breakfast": "The Urban Socialite, Denver", "attraction": "Denver Zoo, Denver;Denver Botanic Gardens, Denver;", "lunch": "Tasty Fare, Denver", "dinner": "Nukkadwala, Denver", "accommodation": "Harlem cozy nights, Denver"}, {"day": 5, "current_city": "from Denver to Omaha", "transportation": "Flight Number: F4026904, from Denver to Omaha", "breakfast": "Woods Spice, Denver", "attraction": "Denver Art Museum, Denver", "lunch": "Al Yousuf, Denver", "dinner": "-", "accommodation": "-"}]}]