[{"gpt-4-1106-preview_direct_sole-planning_results": "Travel Plan:\n\nDay 1: March 4, 2022\nCurrent City: Lake Charles\nTransportation: Flight Number: F3932451, from Lake Charles to Houston, Departure Time: 07:02, Arrival Time: 08:27, Cost: 57\nAttraction: Downtown Aquarium, Houston\nLunch: Jalapenos, Houston, Cost: 57, Cuisines: \"Desserts, Tea, Cafe, Chinese, Seafood\"\nDinner: The BrewMaster - The Mix Fine Dine, Houston, Cost: 52, Cuisines: \"French, Indian, Cafe, Seafood\"\nAccommodation: Sunny and Airy near Manhattan, Houston, Cost: 499, Maximum Occupancy: 4, House Rules: No pets, Minimum Nights: 2\n\nNumber of People = 2\nTotal Cost = 2 * 57 + 2 * 57 + 2 * 52 + 499 = 779\n\nDay 2: March 5, 2022\nCurrent City: Houston\nTransportation: -\nAttraction: Space Center Houston, Houston\nLunch: Super Bakery, Houston, Cost: 30, Cuisines: \"Seafood, Fast Food\"\nDinner: Pebble Street, Houston, Cost: 73, Cuisines: \"Tea, American, Mediterranean, BBQ\"\nAccommodation: Sunny and Airy near Manhattan, Houston, Cost: 499, Maximum Occupancy: 4, House Rules: No pets, Minimum Nights: 2\n\nNumber of People = 2\nTotal Cost = 2 * 30 + 2 * 73 + 499 = 705\n\nDay 3: March 6, 2022\nCurrent City: from Houston to Dallas\nTransportation: Flight Number: F3673853, from Houston to Dallas, Departure Time: 07:46, Arrival Time: 09:09, Cost: 53\nAttraction: The Dallas World Aquarium, Dallas\nLunch: Coconuts Fish Cafe, Dallas, Cost: 38, Cuisines: \"Cafe, BBQ, Mediterranean, Fast Food\"\nDinner: 1918 Bistro & Grill, Dallas, Cost: 90, Cuisines: \"Tea, Pizza, BBQ, Seafood\"\nAccommodation: Luxury Williamsburg duplex, private roof terrace, Dallas, Cost: 241, Maximum Occupancy: 3, House Rules: No visitors, Minimum Nights: 4\n\nNumber of People = 2\nTotal Cost = 2 * 53 + 2 * 38 + 2 * 90 + 241 = 603\n\nDay 4: March 7, 2022\nCurrent City: Dallas\nTransportation: -\nAttraction: The Sixth Floor Museum at Dealey Plaza, Dallas\nLunch: Yanki Sizzlers, Dallas, Cost: 96, Cuisines: \"Cafe, French, Tea, Mediterranean\"\nDinner: Aravali Owls, Dallas, Cost: 53, Cuisines: \"Pizza, Italian, Bakery, Fast Food, Cafe\"\nAccommodation: Luxury Williamsburg duplex, private roof terrace, Dallas, Cost: 241, Maximum Occupancy: 3, House Rules: No visitors, Minimum Nights: 4\n\nNumber of People = 2\nTotal Cost = 2 * 96 + 2 * 53 + 241 = 539\n\nDay 5: March 8, 2022\nCurrent City: from Dallas to Lake Charles\nTransportation: Flight Number: F3602526, from Dallas to Lake Charles, Departure Time: 09:30, Arrival Time: 10:39, Cost: 114\nAttraction: -\nLunch: -\nDinner: -\nAccommodation: -\n\nNumber of People = 2\nTotal Cost = 2 * 114 = 228\n\nTotal cost across all days = 779 + 705 + 603 + 539 + 228 = 2854\n\nRemaining Budget = $4,600 - $2,854 = $1,746\n\nCuisines: The prompt specifies no cuisines, so all cuisines constraints are satisfied.\n\nNote: The accommodations selected allow for parties as there are no specific house rules against parties. The budget has been adhered to, and all cities are visited consecutively without repetition, except for the starting and ending city, which is Lake Charles. The travel plan includes all required details for each day, and no restaurant or attraction is repeated.", "gpt-4-1106-preview_direct_sole-planning_parsed_results": [{"day": 1, "current_city": "from Lake Charles to Houston", "transportation": "Flight Number: F3932451, from Lake Charles to Houston, Departure Time: 07:02, Arrival Time: 08:27", "breakfast": "-", "attraction": "Downtown Aquarium, Houston;", "lunch": "Jalapenos, Houston", "dinner": "The BrewMaster - The Mix Fine Dine, Houston", "accommodation": "Sunny and Airy near Manhattan, Houston"}, {"day": 2, "current_city": "Houston", "transportation": "-", "breakfast": "-", "attraction": "Space Center Houston, Houston;", "lunch": "Super Bakery, Houston", "dinner": "Pebble Street, Houston", "accommodation": "Sunny and Airy near Manhattan, Houston"}, {"day": 3, "current_city": "from Houston to Dallas", "transportation": "Flight Number: F3673853, from Houston to Dallas, Departure Time: 07:46, Arrival Time: 09:09", "breakfast": "-", "attraction": "The Dallas World Aquarium, Dallas;", "lunch": "Coconuts Fish Cafe, Dallas", "dinner": "1918 Bistro & Grill, Dallas", "accommodation": "Luxury Williamsburg duplex, private roof terrace, Dallas"}, {"day": 4, "current_city": "Dallas", "transportation": "-", "breakfast": "-", "attraction": "The Sixth Floor Museum at Dealey Plaza, Dallas;", "lunch": "Yanki Sizzlers, Dallas", "dinner": "Aravali Owls, Dallas", "accommodation": "Luxury Williamsburg duplex, private roof terrace, Dallas"}, {"day": 5, "current_city": "from Dallas to Lake Charles", "transportation": "Flight Number: F3602526, from Dallas to Lake Charles, Departure Time: 09:30, Arrival Time: 10:39", "breakfast": "-", "attraction": "-", "lunch": "-", "dinner": "-", "accommodation": "-"}]}]