[{"gpt-4-1106-preview_direct_sole-planning_results": "Travel Plan:\n\nDay 1: March 18, 2022\nCurrent City: from Washington to Bemidji\nTransportation: Self-driving, from Washington to Bemidji, Duration: 20 hours 8 mins, Distance: 2,120 km, Cost: $106\nAccommodation: Sunny bedroom off Prospect Park, Bemidji, Price: $627, Room Type: Private room, Minimum Nights: 3\n\nDay 2: March 19, 2022\nCurrent City: Bemidji\nBreakfast: Pig and Whistle, Bemidji, Average Cost: $39\nAttraction: Paul Bunyan & Babe the Blue Ox Statues, Bemidji\nLunch: Outback Bar and Grill - Leisure Inn, Bemidji, Average Cost: $59\nAttraction: Headwaters Science Center, Bemidji\nDinner: Chao Chinese Bistro - Holiday Inn Jaipur City Centre, Bemidji, Average Cost: $22\nAccommodation: Sunny bedroom off Prospect Park, Bemidji\n\nDay 3: March 20, 2022\nCurrent City: from Bemidji to Minneapolis\nTransportation: Flight Number: F3847877, from Bemidji to Minneapolis, Departure Time: 08:06, Arrival Time: 10:37, Price: $63\nBreakfast: -\nAttraction: Minneapolis Sculpture Garden, Minneapolis\nLunch: The Cafe, Minneapolis, Average Cost: $14\nAttraction: Minneapolis Institute of Art, Minneapolis\nDinner: Court Avenue Brewing Company, Minneapolis, Average Cost: $31\nAccommodation: Light-filled Apartment in great area, close 2 all!, Minneapolis, Price: $343, Room Type: Entire home/apt, Minimum Nights: 1\n\nDay 4: March 21, 2022\nCurrent City: Minneapolis\nBreakfast: Malo, Minneapolis, Average Cost: $80\nAttraction: Mill City Museum, Minneapolis\nLunch: Troll Tavern, Minneapolis, Average Cost: $71\nAttraction: Weisman Art Museum, Minneapolis\nDinner: Monkeypod Kitchen by Merriman, Minneapolis, Average Cost: $50\nAccommodation: Light-filled Apartment in great area, close 2 all!, Minneapolis\n\nDay 5: March 22, 2022\nCurrent City: from Minneapolis to Duluth\nTransportation: Flight Number: F3640437, from Minneapolis to Duluth, Departure Time: 08:54, Arrival Time: 10:05, Price: $52\nBreakfast: -\nAttraction: Glensheen Mansion, Duluth\nLunch: Sodam Korean Restaurant, Duluth, Average Cost: $25\nAttraction: Lake Superior Railroad Museum, Duluth\nDinner: Skye - Hotel Unique, Duluth, Average Cost: $31\nAccommodation: Beautiful 1 bedroom in city center, Duluth, Price: $1154, Room Type: Entire home/apt, Minimum Nights: 2\n\nDay 6: March 23, 2022\nCurrent City: Duluth\nBreakfast: Chandlers Steakhouse, Duluth, Average Cost: $98\nAttraction: Enger Park, Duluth\nLunch: Lulu's Chocolate Bar, Duluth, Average Cost: $97\nAttraction: The St. Louis County Depot, Duluth\nDinner: Bitters & Love, Duluth, Average Cost: $33\nAccommodation: Beautiful 1 bedroom in city center, Duluth\n\nDay 7: March 24, 2022\nCurrent City: from Duluth to Washington\nTransportation: Self-driving, from Duluth to Washington, Duration: 17 hours 50 mins, Distance: 1,881 km, Cost: $94\nBreakfast: Tokyo Japanese Steak House, Duluth, Average Cost: $80\nAttraction: Aerial Lift Bridge, Duluth\nLunch: Blue - Rooftop Cafe Restaurant Bistro, Duluth, Average Cost: $36\nDinner: -\nAccommodation: -\n\nTotal Estimated Cost: $106 (transport to Bemidji) + $627 (accommodation in Bemidji) + $63 (flight to Minneapolis) + $343 (accommodation in Minneapolis) + $52 (flight to Duluth) + $1154 (accommodation in Duluth) + $94 (return transport) + $435 (meals and attractions) = $2874\n\nPlease note that the costs for some meals and attractions are estimated based on the average cost provided for restaurants and may vary. The total estimated cost is well within the budget of $7,200.", "gpt-4-1106-preview_direct_sole-planning_parsed_results": [{"day": 1, "current_city": "from Washington to Bemidji", "transportation": "Self-driving, from Washington to Bemidji, Duration: 20 hours 8 mins, Distance: 2,120 km, Cost: 106", "breakfast": "-", "attraction": "-", "lunch": "-", "dinner": "-", "accommodation": "Sunny bedroom off Prospect Park, Bemidji"}, {"day": 2, "current_city": "Bemidji", "transportation": "-", "breakfast": "Pig and Whistle, Bemidji", "attraction": "Paul Bunyan & Babe the Blue Ox Statues, Bemidji;Headwaters Science Center, Bemidji;", "lunch": "Outback Bar and Grill - Leisure Inn, Bemidji", "dinner": "Chao Chinese Bistro - Holiday Inn Jaipur City Centre, Bemidji", "accommodation": "Sunny bedroom off Prospect Park, Bemidji"}, {"day": 3, "current_city": "from Bemidji to Minneapolis", "transportation": "Flight Number: F3847877, from Bemidji to Minneapolis, Departure Time: 08:06, Arrival Time: 10:37, Cost: 63", "breakfast": "-", "attraction": "Minneapolis Sculpture Garden, Minneapolis;Minneapolis Institute of Art, Minneapolis;", "lunch": "The Cafe, Minneapolis", "dinner": "Court Avenue Brewing Company, Minneapolis", "accommodation": "Light-filled Apartment in great area, close 2 all!, Minneapolis"}, {"day": 4, "current_city": "Minneapolis", "transportation": "-", "breakfast": "Malo, Minneapolis", "attraction": "Mill City Museum, Minneapolis;Weisman Art Museum, Minneapolis;", "lunch": "Troll Tavern, Minneapolis", "dinner": "Monkeypod Kitchen by Merriman, Minneapolis", "accommodation": "Light-filled Apartment in great area, close 2 all!, Minneapolis"}, {"day": 5, "current_city": "from Minneapolis to Duluth", "transportation": "Flight Number: F3640437, from Minneapolis to Duluth, Departure Time: 08:54, Arrival Time: 10:05, Cost: 52", "breakfast": "-", "attraction": "Glensheen Mansion, Duluth;Lake Superior Railroad Museum, Duluth;", "lunch": "Sodam Korean Restaurant, Duluth", "dinner": "Skye - Hotel Unique, Duluth", "accommodation": "Beautiful 1 bedroom in city center, Duluth"}, {"day": 6, "current_city": "Duluth", "transportation": "-", "breakfast": "Chandlers Steakhouse, Duluth", "attraction": "Enger Park, Duluth;The St. Louis County Depot, Duluth;", "lunch": "Lulu's Chocolate Bar, Duluth", "dinner": "Bitters & Love, Duluth", "accommodation": "Beautiful 1 bedroom in city center, Duluth"}, {"day": 7, "current_city": "from Duluth to Washington", "transportation": "Self-driving, from Duluth to Washington, Duration: 17 hours 50 mins, Distance: 1,881 km, Cost: 94", "breakfast": "Tokyo Japanese Steak House, Duluth", "attraction": "Aerial Lift Bridge, Duluth", "lunch": "Blue - Rooftop Cafe Restaurant Bistro, Duluth", "dinner": "-", "accommodation": "-"}]}]