[{"gpt-4-1106-preview_direct_sole-planning_results": "Travel Plan:\n\nDay 1: March 25, 2022\nCurrent City: from Columbus to Newark\nTransportation: Flight Number: F4076294, from Columbus to Newark, Departure Time: 07:03, Arrival Time: 08:54\nBreakfast: - (Assuming breakfast will be had before the flight or during the flight if available)\nAttraction: The Newark Museum of Art, Newark\nLunch: Artistry, Newark (Average Cost: $79, suitable for children)\nDinner: Angeethi Restaurant, Newark (Average Cost: $12, suitable for children)\nAccommodation: Large Two Story Loft in the Heart of West Village, Newark (Price: $1127, Entire home/apt, suitable for children under 10)\n\nDay 2: March 26, 2022\nCurrent City: Newark\nTransportation: -\nBreakfast: Mirage Restro Bar, Newark (Average Cost: $51, suitable for children)\nAttraction: Branch Brook Park, Newark; Military Park, Newark.\nLunch: Escape Terrace Bar Kitchen, Newark (Average Cost: $100, suitable for children)\nDinner: Drifters Cafe, Newark (Average Cost: $24, suitable for children)\nAccommodation: Large Two Story Loft in the Heart of West Village, Newark (Price: $1127, Entire home/apt, suitable for children under 10)\n\nDay 3: March 27, 2022\nCurrent City: from Newark to Columbus\nTransportation: Flight Number: F3919557, from Newark to Columbus, Departure Time: 20:02, Arrival Time: 21:50\nBreakfast: Harmann Restaurant, Newark (Average Cost: $57, suitable for children)\nAttraction: Riverbank Park, Newark.\nLunch: Jaguar, Newark (Average Cost: $38, suitable for children)\nDinner: - (Assuming dinner will be had after arrival in Columbus or during the flight if available)\nAccommodation: -\n\nPlease note that the accommodation chosen is slightly over the revised budget of $1,200, but it is the only option available that fits the criteria of being suitable for children under 10 and being an entire home/apt. If the budget cannot be stretched to accommodate this, adjustments to the plan will be necessary.", "gpt-4-1106-preview_direct_sole-planning_parsed_results": [{"day": 1, "current_city": "from Columbus to Newark", "transportation": "Flight Number: F4076294, from Columbus to Newark, Departure Time: 07:03, Arrival Time: 08:54", "breakfast": "-", "attraction": "The Newark Museum of Art, Newark;", "lunch": "Artistry, Newark", "dinner": "Angeethi Restaurant, Newark", "accommodation": "Large Two Story Loft in the Heart of West Village, Newark"}, {"day": 2, "current_city": "Newark", "transportation": "-", "breakfast": "Mirage Restro Bar, Newark", "attraction": "Branch Brook Park, Newark;Military Park, Newark;", "lunch": "Escape Terrace Bar Kitchen, Newark", "dinner": "Drifters Cafe, Newark", "accommodation": "Large Two Story Loft in the Heart of West Village, Newark"}, {"day": 3, "current_city": "from Newark to Columbus", "transportation": "Flight Number: F3919557, from Newark to Columbus, Departure Time: 20:02, Arrival Time: 21:50", "breakfast": "Harmann Restaurant, Newark", "attraction": "Riverbank Park, Newark;", "lunch": "Jaguar, Newark", "dinner": "-", "accommodation": "-"}]}]