[{"gpt-4-1106-preview_direct_sole-planning_results": "Travel Plan:\n\nDay 1:\nCurrent City: from Asheville to Minneapolis\nTransportation: Self-driving, from Asheville to Minneapolis, duration: 15 hours 47 mins, distance: 1,711 km, cost: $85\nBreakfast: - (Assuming breakfast is had before departure)\nAttraction: - (Traveling for the majority of the day)\nLunch: - (On the road)\nDinner: The Cafe, Minneapolis (Indian, Mediterranean, Desserts, Seafood)\nAccommodation: Light-filled Apartment in great area, close 2 all!, Minneapolis (Entire home/apt, allows pets, cost: $343)\n\nDay 2:\nCurrent City: Minneapolis\nTransportation: -\nBreakfast: Monkeypod Kitchen by Merriman, Minneapolis (Desserts, Pizza, Bakery, Fast Food, Indian, Mediterranean)\nAttraction: Minneapolis Sculpture Garden, Minneapolis; Weisman Art Museum, Minneapolis.\nLunch: Court Avenue Brewing Company, Minneapolis (Pizza, French, Bakery, BBQ, Seafood)\nDinner: Texas Roadhouse, Minneapolis (Cafe, Pizza, BBQ, Desserts)\nAccommodation: Light-filled Apartment in great area, close 2 all!, Minneapolis (Entire home/apt, allows pets, cost: $343)\n\nDay 3:\nCurrent City: from Minneapolis to Asheville\nTransportation: Self-driving, from Minneapolis to Asheville, duration: 15 hours 43 mins, distance: 1,710 km, cost: $85\nBreakfast: Giani, Minneapolis (Cafe, Mexican, Bakery, Desserts)\nAttraction: - (Traveling for the majority of the day)\nLunch: - (On the road)\nDinner: - (Assuming dinner is had after arrival)\nAccommodation: -\n\nTotal Estimated Costs:\nTransportation: $85 (Day 1 self-driving) + $85 (Day 3 self-driving) = $170\nAccommodation: $343 (Day 1) + $343 (Day 2) = $686\nMeals and Attractions: Assuming an average of $50 per meal for 3 people and $20 per attraction per person, the estimated cost for meals and attractions would be around $600.\nMiscellaneous (snacks, additional travel expenses, etc.): $100\n\nTotal Estimated Cost: $170 (Transportation) + $686 (Accommodation) + $600 (Meals and Attractions) + $100 (Miscellaneous) = $1556\n\nRemaining Budget: $2300 - $1556 = $744\n\nNote: The costs for meals and attractions are estimated averages and may vary. The remaining budget can be used for any additional expenses or saved. The travel plan assumes that the group has their own vehicle for self-driving and that the cost of fuel is included in the transportation cost. The accommodation selected allows pets and provides an entire home/apt as requested.", "gpt-4-1106-preview_direct_sole-planning_parsed_results": [{"day": 1, "current_city": "from Asheville to Minneapolis", "transportation": "Self-driving, from Asheville to Minneapolis, Duration: 15 hours 47 mins, Distance: 1711 km, Cost: 85", "breakfast": "-", "attraction": "-", "lunch": "-", "dinner": "The Cafe, Minneapolis", "accommodation": "Light-filled Apartment in great area, close 2 all!, Minneapolis"}, {"day": 2, "current_city": "Minneapolis", "transportation": "-", "breakfast": "Monkeypod Kitchen by Merriman, Minneapolis", "attraction": "Minneapolis Sculpture Garden, Minneapolis;Weisman Art Museum, Minneapolis;", "lunch": "Court Avenue Brewing Company, Minneapolis", "dinner": "Texas Roadhouse, Minneapolis", "accommodation": "Light-filled Apartment in great area, close 2 all!, Minneapolis"}, {"day": 3, "current_city": "from Minneapolis to Asheville", "transportation": "Self-driving, from Minneapolis to Asheville, Duration: 15 hours 43 mins, Distance: 1710 km, Cost: 85", "breakfast": "Giani, Minneapolis", "attraction": "-", "lunch": "-", "dinner": "-", "accommodation": "-"}]}]