[{"gpt-4-1106-preview_direct_sole-planning_results": "Travel Plan:\n\nDay 1: March 10, 2022\nCurrent City: from Kona to Oakland\nTransportation: Flight Number: F4022663, from Kona to Oakland, Departure Time: 12:40, Arrival Time: 20:01\nAccommodation: Home away from home, Oakland (Price: $203)\n\nDay 2: March 11, 2022\nCurrent City: Oakland\nBreakfast: Cho Gao - Crowne Plaza Abu Dhabi, Oakland\nAttraction: Oakland Zoo, Oakland\nLunch: Malais By Anands, Oakland\nAttraction: Chabot Space & Science Center, Oakland\nDinner: Chef Sack Kitchen, Oakland\nAccommodation: Home away from home, Oakland (Price: $203)\n\nDay 3: March 12, 2022\nCurrent City: from Oakland to Bakersfield\nTransportation: Self-driving, from Oakland to Bakersfield, duration: 4 hours 11 mins, cost: $21\nBreakfast: Bikanervala, Oakland\nAttraction: Children's Fairyland, Oakland\nLunch: Pind Balluchi, Oakland\nDinner: Frick's Tap, Bakersfield\nAccommodation: DaDukes Dreams, Bakersfield (Price: $491)\n\nDay 4: March 13, 2022\nCurrent City: Bakersfield\nBreakfast: Kihei Caffe, Bakersfield\nAttraction: Kern County Museum, Bakersfield\nLunch: Tybee Island Social Club, Bakersfield\nAttraction: California Living Museum, Bakersfield\nDinner: Momo-Cha, Bakersfield\nAccommodation: DaDukes Dreams, Bakersfield (Price: $491)\n\nDay 5: March 14, 2022\nCurrent City: from Bakersfield to Los Angeles\nTransportation: Self-driving, from Bakersfield to Los Angeles, duration: 1 hour 55 mins, cost: $9\nBreakfast: DePalma's Italian Cafe - East Side, Bakersfield\nAttraction: Buena Vista Museum of Natural History & Science, Bakersfield\nLunch: Gurgaon Mughlai Chicken, Bakersfield\nDinner: Palmshore, Los Angeles\nAccommodation: Midtown East 2 Bed/2 Bath Elevator Building Apt, Los Angeles (Price: $540)\n\nDay 6: March 15, 2022\nCurrent City: Los Angeles\nBreakfast: Punjabi Zaika, Los Angeles\nAttraction: Santa Monica Pier, Los Angeles\nLunch: The Hangout by 1861, Los Angeles\nAttraction: Griffith Observatory, Los Angeles\nDinner: Chicken Minar, Los Angeles\nAccommodation: Midtown East 2 Bed/2 Bath Elevator Building Apt, Los Angeles (Price: $540)\n\nDay 7: March 16, 2022\nCurrent City: from Los Angeles to Kona\nTransportation: Flight Number: F3583996, from Los Angeles to Kona, Departure Time: 10:55, Arrival Time: 13:42\nBreakfast: Heat - Edsa Shangri-La, Los Angeles\nAttraction: Hollywood Walk of Fame, Los Angeles\nLunch: Village - The House of Food, Los Angeles\nAccommodation: -\n\nTotal Estimated Cost: $2,007 (Flights) + $21 (Self-driving Oakland to Bakersfield) + $9 (Self-driving Bakersfield to Los Angeles) + $203 (2 nights in Oakland) + $982 (2 nights in Bakersfield) + $1,080 (2 nights in Los Angeles) = $4,302\n\nNote: The total estimated cost exceeds the budget of $2,500. Adjustments to the accommodation or transportation choices may be necessary to stay within budget.", "gpt-4-1106-preview_direct_sole-planning_parsed_results": [{"day": 1, "current_city": "from Kona to Oakland", "transportation": "Flight Number: F4022663, from Kona to Oakland, Departure Time: 12:40, Arrival Time: 20:01", "breakfast": "-", "attraction": "-", "lunch": "-", "dinner": "-", "accommodation": "Home away from home, Oakland"}, {"day": 2, "current_city": "Oakland", "transportation": "-", "breakfast": "Cho Gao - Crowne Plaza Abu Dhabi, Oakland", "attraction": "Oakland Zoo, Oakland;Chabot Space & Science Center, Oakland;", "lunch": "Malais By Anands, Oakland", "dinner": "Chef Sack Kitchen, Oakland", "accommodation": "Home away from home, Oakland"}, {"day": 3, "current_city": "from Oakland to Bakersfield", "transportation": "Self-driving, from Oakland to Bakersfield, duration: 4 hours 11 mins, Cost: 21", "breakfast": "Bikanervala, Oakland", "attraction": "Children's Fairyland, Oakland", "lunch": "Pind Balluchi, Oakland", "dinner": "Frick's Tap, Bakersfield", "accommodation": "DaDukes Dreams, Bakersfield"}, {"day": 4, "current_city": "Bakersfield", "transportation": "-", "breakfast": "Kihei Caffe, Bakersfield", "attraction": "Kern County Museum, Bakersfield;California Living Museum, Bakersfield;", "lunch": "Tybee Island Social Club, Bakersfield", "dinner": "Momo-Cha, Bakersfield", "accommodation": "DaDukes Dreams, Bakersfield"}, {"day": 5, "current_city": "from Bakersfield to Los Angeles", "transportation": "Self-driving, from Bakersfield to Los Angeles, duration: 1 hour 55 mins, Cost: 9", "breakfast": "DePalma's Italian Cafe - East Side, Bakersfield", "attraction": "Buena Vista Museum of Natural History & Science, Bakersfield", "lunch": "Gurgaon Mughlai Chicken, Bakersfield", "dinner": "Palmshore, Los Angeles", "accommodation": "Midtown East 2 Bed/2 Bath Elevator Building Apt, Los Angeles"}, {"day": 6, "current_city": "Los Angeles", "transportation": "-", "breakfast": "Punjabi Zaika, Los Angeles", "attraction": "Santa Monica Pier, Los Angeles;Griffith Observatory, Los Angeles;", "lunch": "The Hangout by 1861, Los Angeles", "dinner": "Chicken Minar, Los Angeles", "accommodation": "Midtown East 2 Bed/2 Bath Elevator Building Apt, Los Angeles"}, {"day": 7, "current_city": "from Los Angeles to Kona", "transportation": "Flight Number: F3583996, from Los Angeles to Kona, Departure Time: 10:55, Arrival Time: 13:42", "breakfast": "Heat - Edsa Shangri-La, Los Angeles", "attraction": "Hollywood Walk of Fame, Los Angeles", "lunch": "Village - The House of Food, Los Angeles", "dinner": "-", "accommodation": "-"}]}]