[{"gpt-4-1106-preview_direct_sole-planning_results": "Travel Plan:\n\nDay 1: March 5th, 2022\nCurrent City: from Colorado Springs to Moline\nTransportation: Self-driving, from Colorado Springs to Moline, Duration: 12 hours 49 mins, Distance: 1,467 km, Cost: 73\nBreakfast: - (Assuming breakfast in Colorado Springs before departure)\nAttraction: - (Traveling, no time for attractions)\nLunch: - (On the road)\nDinner: Royal Hotel, Moline, Cost: 74, Cuisines: \"Tea, Pizza, Mexican, Chinese, Seafood\"\nAccommodation: Sunny duplex near Central Park, Moline, Cost: 541, Room Type: Entire home/apt, House Rules: No pets, Minimum Nights: 1, Maximum Occupancy: 5\n\nTotal Cost for Day 1: 73 (Transportation) + 74 (Dinner) + 541 (Accommodation) = $688\n\nDay 2: March 6th, 2022\nCurrent City: Moline\nTransportation: -\nBreakfast: Lovecrumbs Bakery, Moline, Cost: 24, Cuisines: \"Tea, Pizza, American, Desserts\"\nAttraction: John Deere Pavilion, Moline\nLunch: Mummy's Kitchen, Moline, Cost: 54, Cuisines: \"Desserts, Indian, Mediterranean, BBQ\"\nDinner: ZASTY, Moline, Cost: 82, Cuisines: \"Pizza, Indian, BBQ, Cafe, American, Seafood\"\nAccommodation: Sunny duplex near Central Park, Moline (Continued from Day 1)\n\nTotal Cost for Day 2: 24 (Breakfast) + 54 (Lunch) + 82 (Dinner) = $160\n\nDay 3: March 7th, 2022\nCurrent City: from Moline to Rockford\nTransportation: Self-driving, from Moline to Rockford, Duration: 2 hours 1 min, Distance: 194 km, Cost: 9\nBreakfast: Hucka, Moline, Cost: 29, Cuisines: \"Desserts, Tea, Pizza, Fast Food, American\"\nAttraction: - (Traveling, no time for attractions)\nLunch: - (On the road)\nDinner: Coco Bambu, Rockford, Cost: 72, Cuisines: \"Tea, French, Bakery, BBQ, Cafe\"\nAccommodation: Park Side Zen Home - Terrace & next to CentralPark, Rockford, Cost: 250, Room Type: Entire home/apt, House Rules: No children under 10, Minimum Nights: 3, Maximum Occupancy: 3\n\nTotal Cost for Day 3: 9 (Transportation) + 29 (Breakfast) + 72 (Dinner) + 250 (Accommodation) = $360\n\nDay 4: March 8th, 2022\nCurrent City: Rockford\nTransportation: -\nBreakfast: Nutri Punch, Rockford, Cost: 34, Cuisines: \"Tea, Chinese, Cafe, Desserts\"\nAttraction: Anderson Japanese Gardens, Rockford\nLunch: Flying Mango, Rockford, Cost: 20, Cuisines: \"American, BBQ, Seafood\"\nDinner: Eggspectation - Jaypee Vasant Continental, Rockford, Cost: 77, Cuisines: \"Tea, Mediterranean, Seafood\"\nAccommodation: Park Side Zen Home - Terrace & next to CentralPark, Rockford (Continued from Day 3)\n\nTotal Cost for Day 4: 34 (Breakfast) + 20 (Lunch) + 77 (Dinner) = $131\n\nDay 5: March 9th, 2022\nCurrent City: from Rockford to Colorado Springs\nTransportation: Self-driving, from Rockford to Colorado Springs, Duration: 14 hours 38 mins, Distance: 1,653 km, Cost: 82\nBreakfast: Moets Arabica, Rockford, Cost: 43, Cuisines: \"Tea, Bakery, Indian, Fast Food\"\nAttraction: - (Traveling, no time for attractions)\nLunch: - (On the road)\nDinner: - (Assuming dinner in Colorado Springs after arrival)\nAccommodation: - (End of trip)\n\nTotal Cost for Day 5: 82 (Transportation) + 43 (Breakfast) = $125\n\nTotal cost across all days: 688 (Day 1) + 160 (Day 2) + 360 (Day 3) + 131 (Day 4) + 125 (Day 5) = $1464\n\nRemaining Budget: $1900 - $1464 = $436\n\nCuisines: All restaurants chosen offer a variety of cuisines to cater to different tastes.\n\nNote: The travel plan assumes that the traveler will have breakfast before departure on Day 1 and dinner after arrival on Day 5. Attractions are not scheduled on travel days due to time constraints. Accommodations are booked for the minimum nights required. The remaining budget can be used for additional meals, attractions, or unforeseen expenses.", "gpt-4-1106-preview_direct_sole-planning_parsed_results": [{"day": 1, "current_city": "from Colorado Springs to Moline", "transportation": "Self-driving, from Colorado Springs to Moline, Duration: 12 hours 49 mins, Distance: 1,467 km", "breakfast": "-", "attraction": "-", "lunch": "-", "dinner": "Royal Hotel, Moline", "accommodation": "Sunny duplex near Central Park, Moline"}, {"day": 2, "current_city": "Moline", "transportation": "-", "breakfast": "Lovecrumbs Bakery, Moline", "attraction": "John Deere Pavilion, Moline", "lunch": "Mummy's Kitchen, Moline", "dinner": "ZASTY, Moline", "accommodation": "Sunny duplex near Central Park, Moline"}, {"day": 3, "current_city": "from Moline to Rockford", "transportation": "Self-driving, from Moline to Rockford, Duration: 2 hours 1 min, Distance: 194 km", "breakfast": "Hucka, Moline", "attraction": "-", "lunch": "-", "dinner": "Coco Bambu, Rockford", "accommodation": "Park Side Zen Home - Terrace & next to CentralPark, Rockford"}, {"day": 4, "current_city": "Rockford", "transportation": "-", "breakfast": "Nutri Punch, Rockford", "attraction": "Anderson Japanese Gardens, Rockford", "lunch": "Flying Mango, Rockford", "dinner": "Eggspectation - Jaypee Vasant Continental, Rockford", "accommodation": "Park Side Zen Home - Terrace & next to CentralPark, Rockford"}, {"day": 5, "current_city": "from Rockford to Colorado Springs", "transportation": "Self-driving, from Rockford to Colorado Springs, Duration: 14 hours 38 mins, Distance: 1,653 km", "breakfast": "Moets Arabica, Rockford", "attraction": "-", "lunch": "-", "dinner": "-", "accommodation": "-"}]}]