[{"gpt-4-1106-preview_direct_sole-planning_results": "Travel Plan:\n\nDay 1:\nCurrent City: from Jacksonville to Detroit\nTransportation: Flight Number: F3553781, from Jacksonville to Detroit, Departure Time: 12:10, Arrival Time: 14:15, Cost: 178\nBreakfast: - (Assuming breakfast was had before departure)\nAttraction: Detroit Institute of Arts, Detroit, Cost: Free\nLunch: Southern Bliss Bakery, Detroit, Cost: 28, Cuisines: \"Tea, BBQ, Desserts, Seafood\"\nDinner: BMG - All Day Dining, Detroit, Cost: 15, Cuisines: \"Desserts, Bakery, BBQ, Indian, Seafood\"\nAccommodation: Lovely, charming and clean bedroom in Manhattan., Detroit, Cost: 69, Maximum Occupancy: 2, House Rules: No smoking, Minimum Nights: 1\n\nNumber of People = 1\nTotal Cost = 178 + 28 + 15 + 69 = 290\nAccommodation Minimum Nights: 1/1\n\nDay 2:\nCurrent City: Detroit\nTransportation: -\nBreakfast: N. Iqbal Restaurant, Detroit, Cost: 11, Cuisines: \"Tea, Cafe, Bakery, Desserts\"\nAttraction: Motown Museum, Detroit, Cost: Free\nLunch: A Dong Restaurant, Detroit, Cost: 40, Cuisines: \"Tea, Cafe, Pizza\"\nDinner: The Dosa King, Detroit, Cost: 69, Cuisines: \"BBQ, Mediterranean, Desserts, Fast Food\"\nAccommodation: Lovely, charming and clean bedroom in Manhattan., Detroit, Cost: 69, Maximum Occupancy: 2, House Rules: No smoking, Minimum Nights: 1\n\nNumber of People = 1\nTotal Cost = 11 + 40 + 69 + 69 = 189\nAccommodation Minimum Nights: 1/1\n\nDay 3:\nCurrent City: from Detroit to Lansing\nTransportation: Flight Number: F3656087, from Detroit to Lansing, Departure Time: 10:10, Arrival Time: 10:46, Cost: 27\nBreakfast: - (Assuming breakfast was had before departure)\nAttraction: Impression 5 Science Center, Lansing, Cost: Free\nLunch: Manuel's Bread Cafe, Lansing, Cost: 28, Cuisines: \"French, Pizza, Seafood\"\nDinner: Huey's On The River, Lansing, Cost: 75, Cuisines: \"Tea, French, Bakery, Fast Food, Cafe\"\nAccommodation: Magical Brooklyn Space *20 MIN to Manhattan!*, Lansing, Cost: 207, Maximum Occupancy: 1, House Rules: No children under 10 & No pets, Minimum Nights: 1\n\nNumber of People = 1\nTotal Cost = 27 + 28 + 75 + 207 = 337\nAccommodation Minimum Nights: 1/1\n\nDay 4:\nCurrent City: Lansing\nTransportation: -\nBreakfast: Orchid - Fortune Select Global, Lansing, Cost: 16, Cuisines: \"Tea, Cafe, BBQ\"\nAttraction: Potter Park Zoo, Lansing, Cost: Free\nLunch: Tony's Italian Restaurant & Pizza, Lansing, Cost: 83, Cuisines: \"Tea, Pizza, Indian, BBQ, American\"\nDinner: Front Street Brewery, Lansing, Cost: 25, Cuisines: \"BBQ, Mediterranean, Desserts, Italian\"\nAccommodation: Magical Brooklyn Space *20 MIN to Manhattan!*, Lansing, Cost: 207, Maximum Occupancy: 1, House Rules: No children under 10 & No pets, Minimum Nights: 1\n\nNumber of People = 1\nTotal Cost = 16 + 83 + 25 + 207 = 331\nAccommodation Minimum Nights: 1/1\n\nDay 5:\nCurrent City: from Lansing to Jacksonville\nTransportation: Self-driving, from Lansing to Jacksonville, duration: 15 hours 55 mins, distance: 1,704 km, Cost: 85\nBreakfast: Nini's Kitchen, Lansing, Cost: 30, Cuisines: \"Cafe, Mexican, Desserts\"\nAttraction: - (Assuming attractions were visited before departure)\nLunch: - (Assuming lunch was on the road)\nDinner: - (Assuming dinner was after arrival or on the road)\nAccommodation: -\n\nNumber of People = 1\nTotal Cost = 85 + 30 = 115\n\nTotal cost across all days = 290 + 189 + 337 + 331 + 115 = 1262\n\nRemaining Budget = $4600 - $1262 = $3338\n\nCuisines: The prompt specifies no cuisines, so all cuisines constraints are satisfied.\nHouse Rules: All accommodations chosen abide by the house rules specified in the query.", "gpt-4-1106-preview_direct_sole-planning_parsed_results": [{"day": 1, "current_city": "from Jacksonville to Detroit", "transportation": "Flight Number: F3553781, from Jacksonville to Detroit, Departure Time: 12:10, Arrival Time: 14:15", "breakfast": "-", "attraction": "Detroit Institute of Arts, Detroit;", "lunch": "Southern Bliss Bakery, Detroit", "dinner": "BMG - All Day Dining, Detroit", "accommodation": "Lovely, charming and clean bedroom in Manhattan., Detroit"}, {"day": 2, "current_city": "Detroit", "transportation": "-", "breakfast": "N. Iqbal Restaurant, Detroit", "attraction": "Motown Museum, Detroit;", "lunch": "A Dong Restaurant, Detroit", "dinner": "The Dosa King, Detroit", "accommodation": "Lovely, charming and clean bedroom in Manhattan., Detroit"}, {"day": 3, "current_city": "from Detroit to Lansing", "transportation": "Flight Number: F3656087, from Detroit to Lansing, Departure Time: 10:10, Arrival Time: 10:46", "breakfast": "-", "attraction": "Impression 5 Science Center, Lansing;", "lunch": "Manuel's Bread Cafe, Lansing", "dinner": "Huey's On The River, Lansing", "accommodation": "Magical Brooklyn Space *20 MIN to Manhattan!*, Lansing"}, {"day": 4, "current_city": "Lansing", "transportation": "-", "breakfast": "Orchid - Fortune Select Global, Lansing", "attraction": "Potter Park Zoo, Lansing;", "lunch": "Tony's Italian Restaurant & Pizza, Lansing", "dinner": "Front Street Brewery, Lansing", "accommodation": "Magical Brooklyn Space *20 MIN to Manhattan!*, Lansing"}, {"day": 5, "current_city": "from Lansing to Jacksonville", "transportation": "Self-driving, from Lansing to Jacksonville, duration: 15 hours 55 mins, distance: 1,704 km", "breakfast": "Nini's Kitchen, Lansing", "attraction": "-", "lunch": "-", "dinner": "-", "accommodation": "-"}]}]