[{"gpt-4-1106-preview_direct_sole-planning_results": "Travel Plan:\n\nDay 1: March 2, 2022\nCurrent City: from Omaha to Seattle\nTransportation: Flight Number: F3736891, from Omaha to Seattle, Departure Time: 14:43, Arrival Time: 16:28, Cost: $451\nAccommodation: Shared Apartment by Times Square Manhattan, Seattle, Cost: $1050 (minimum nights: 1)\nTotal cost for Day 1: $451 (Transportation) + $1050 (Accommodation) = $1501\n\nDay 2: March 3, 2022\nCurrent City: Seattle\nBreakfast: Ting's Red Lantern, Seattle, Cost: $24\nAttraction: Space Needle, Seattle, Cost: (Assumed Cost) $35\nLunch: The Godinho's, Seattle, Cost: $96\nAttraction: Pike Place Market, Seattle, Cost: (Assumed Cost) $0 (free entry)\nDinner: Teddy Choco Studio, Seattle, Cost: $70\nAccommodation: Shared Apartment by Times Square Manhattan, Seattle, Cost: $1050 (minimum nights: 1)\nTotal cost for Day 2: $24 (Breakfast) + $35 (Attraction) + $96 (Lunch) + $0 (Attraction) + $70 (Dinner) + $1050 (Accommodation) = $1275\n\nDay 3: March 4, 2022\nCurrent City: from Seattle to Spokane\nTransportation: Flight Number: F3738208, from Seattle to Spokane, Departure Time: 11:28, Arrival Time: 12:38, Cost: $50\nAccommodation: Renovated 2 Bedroom Apartment, Spokane, Cost: $372 (minimum nights: 2)\nTotal cost for Day 3: $50 (Transportation) + $372 (Accommodation) = $422\n\nDay 4: March 5, 2022\nCurrent City: Spokane\nBreakfast: Chick-fil-A, Spokane, Cost: $83\nAttraction: Riverfront Park, Spokane, Cost: (Assumed Cost) $0 (free entry)\nLunch: Moon River Brewing Company, Spokane, Cost: $79\nAttraction: Manito Park, Spokane, Cost: (Assumed Cost) $0 (free entry)\nDinner: Friends Grille and Bar, Spokane, Cost: $69\nAccommodation: Renovated 2 Bedroom Apartment, Spokane, Cost: $372 (minimum nights: 2)\nTotal cost for Day 4: $83 (Breakfast) + $0 (Attraction) + $79 (Lunch) + $0 (Attraction) + $69 (Dinner) + $372 (Accommodation) = $603\n\nDay 5: March 6, 2022\nCurrent City: from Spokane to Omaha\nTransportation: Self-driving from Spokane to Omaha, Cost: $110\nTotal cost for Day 5: $110 (Transportation)\n\nThe total cost of this trip is the sum of the costs from Day 1 to Day 5. It is $1501 + $1275 + $422 + $603 + $110 = $3911, which is less than the required budget of $5000.\n\nPlease note that some attraction costs are assumed to be free entry as no price was provided, and the actual costs may vary. Additionally, meal costs are based on average costs from the provided restaurant data, and actual meal choices may affect the total cost.", "gpt-4-1106-preview_direct_sole-planning_parsed_results": [{"day": 1, "current_city": "from Omaha to Seattle", "transportation": "Flight Number: F3736891, from Omaha to Seattle, Departure Time: 14:43, Arrival Time: 16:28", "breakfast": "-", "attraction": "-", "lunch": "-", "dinner": "-", "accommodation": "Shared Apartment by Times Square Manhattan, Seattle"}, {"day": 2, "current_city": "Seattle", "transportation": "-", "breakfast": "Ting's Red Lantern, Seattle", "attraction": "Space Needle, Seattle;Pike Place Market, Seattle;", "lunch": "The Godinho's, Seattle", "dinner": "Teddy Choco Studio, Seattle", "accommodation": "Shared Apartment by Times Square Manhattan, Seattle"}, {"day": 3, "current_city": "from Seattle to Spokane", "transportation": "Flight Number: F3738208, from Seattle to Spokane, Departure Time: 11:28, Arrival Time: 12:38", "breakfast": "-", "attraction": "-", "lunch": "-", "dinner": "-", "accommodation": "Renovated 2 Bedroom Apartment, Spokane"}, {"day": 4, "current_city": "Spokane", "transportation": "-", "breakfast": "Chick-fil-A, Spokane", "attraction": "Riverfront Park, Spokane;Manito Park, Spokane;", "lunch": "Moon River Brewing Company, Spokane", "dinner": "Friends Grille and Bar, Spokane", "accommodation": "Renovated 2 Bedroom Apartment, Spokane"}, {"day": 5, "current_city": "from Spokane to Omaha", "transportation": "Self-driving from Spokane to Omaha", "breakfast": "-", "attraction": "-", "lunch": "-", "dinner": "-", "accommodation": "-"}]}]