[{"gpt-4-1106-preview_direct_sole-planning_results": "Day 1: March 13, 2022\nCurrent City: from Los Angeles to Colorado Springs\nTransportation: Flight Number: F3822873, from Los Angeles to Colorado Springs, Departure Time: 18:45, Arrival Time: 22:03, Cost: $411\nBreakfast: -\nLunch: -\nDinner: -\nAccommodation: Large sunny park slope apartment, Colorado Springs, Cost: $82, Maximum Occupancy: 3, House Rules: No smoking & No parties & No pets, Minimum Nights: 1\n\nNumber of People = 1\nTotal Cost = 411 + 82 = $493\nAccommodation Minimum Nights: 1/1\n\nDay 2: March 14, 2022\nCurrent City: Colorado Springs\nTransportation: -\nBreakfast: Raglan Road Irish Pub and Restaurant, Colorado Springs, Cost: $97, Cuisines: \"Chinese, Bakery, Pizza, Mediterranean\"\nAttraction: Garden of the Gods, Colorado Springs, Cost: $0\nLunch: New Spice World, Colorado Springs, Cost: $43, Cuisines: \"Desserts, French, Bakery, Fast Food, Cafe\"\nDinner: Mamu's Infusion, Colorado Springs, Cost: $42, Cuisines: \"Tea, BBQ\"\nAccommodation: Large sunny park slope apartment, Colorado Springs, Cost: $82, Maximum Occupancy: 3, House Rules: No smoking & No parties & No pets, Minimum Nights: 1\n\nNumber of People = 1\nTotal Cost = 97 + 43 + 42 + 82 = $264\nAccommodation Minimum Nights: 1/1\n\nDay 3: March 15, 2022\nCurrent City: from Colorado Springs to Grand Junction\nTransportation: Self-driving, from Colorado Springs to Grand Junction, Cost: $25\nBreakfast: Deepak Rasoi, Colorado Springs, Cost: $60, Cuisines: \"Chinese, Pizza, Seafood\"\nAttraction: The Broadmoor Seven Falls, Colorado Springs, Cost: $0\nLunch: Derby, Colorado Springs, Cost: $67, Cuisines: \"Desserts, Fast Food\"\nDinner: -\nAccommodation: Lovely 1 BD on the Upper West Side, Grand Junction, Cost: $854, Maximum Occupancy: 3, House Rules: No children under 10, Minimum Nights: 1\n\nNumber of People = 1\nTotal Cost = 25 + 60 + 67 + 854 = $1006\nAccommodation Minimum Nights: 1/1\n\nDay 4: March 16, 2022\nCurrent City: Grand Junction\nTransportation: -\nBreakfast: Austin's BBQ and Oyster Bar, Grand Junction, Cost: $15, Cuisines: \"Tea, Bakery, Fast Food, Indian, Seafood\"\nAttraction: Museum of the West, Museums of Western Colorado, Grand Junction, Cost: $0\nLunch: 2 Dog, Grand Junction, Cost: $29, Cuisines: \"Desserts, BBQ, Fast Food, Cafe, American\"\nDinner: Punjab Da Pind, Grand Junction, Cost: $52, Cuisines: \"Desserts, Pizza, Bakery, Chinese, Mediterranean, Seafood\"\nAccommodation: Lovely 1 BD on the Upper West Side, Grand Junction, Cost: $854, Maximum Occupancy: 3, House Rules: No children under 10, Minimum Nights: 1\n\nNumber of People = 1\nTotal Cost = 15 + 29 + 52 + 854 = $950\nAccommodation Minimum Nights: 1/1\n\nDay 5: March 17, 2022\nCurrent City: from Grand Junction to Los Angeles\nTransportation: Self-driving, from Grand Junction to Los Angeles, Cost: $62\nBreakfast: Thakur Bakers, Grand Junction, Cost: $100, Cuisines: \"French, Pizza, Cafe, BBQ\"\nLunch: -\nDinner: -\nAccommodation: -\n\nNumber of People = 1\nTotal Cost = 62 + 100 = $162\n\nTotal cost across all days = 493 + 264 + 1006 + 950 + 162 = $2875\n\nCuisines: The prompt specifies no cuisines, so all cuisines constraints are satisfied.", "gpt-4-1106-preview_direct_sole-planning_parsed_results": [{"day": 1, "current_city": "from Los Angeles to Colorado Springs", "transportation": "Flight Number: F3822873, from Los Angeles to Colorado Springs, Departure Time: 18:45, Arrival Time: 22:03", "breakfast": "-", "attraction": "-", "lunch": "-", "dinner": "-", "accommodation": "Large sunny park slope apartment, Colorado Springs"}, {"day": 2, "current_city": "Colorado Springs", "transportation": "-", "breakfast": "Raglan Road Irish Pub and Restaurant, Colorado Springs", "attraction": "Garden of the Gods, Colorado Springs;", "lunch": "New Spice World, Colorado Springs", "dinner": "Mamu's Infusion, Colorado Springs", "accommodation": "Large sunny park slope apartment, Colorado Springs"}, {"day": 3, "current_city": "from Colorado Springs to Grand Junction", "transportation": "Self-driving, from Colorado Springs to Grand Junction", "breakfast": "Deepak Rasoi, Colorado Springs", "attraction": "The Broadmoor Seven Falls, Colorado Springs;", "lunch": "Derby, Colorado Springs", "dinner": "-", "accommodation": "Lovely 1 BD on the Upper West Side, Grand Junction"}, {"day": 4, "current_city": "Grand Junction", "transportation": "-", "breakfast": "Austin's BBQ and Oyster Bar, Grand Junction", "attraction": "Museum of the West, Museums of Western Colorado, Grand Junction;", "lunch": "2 Dog, Grand Junction", "dinner": "Punjab Da Pind, Grand Junction", "accommodation": "Lovely 1 BD on the Upper West Side, Grand Junction"}, {"day": 5, "current_city": "from Grand Junction to Los Angeles", "transportation": "Self-driving, from Grand Junction to Los Angeles", "breakfast": "Thakur Bakers, Grand Junction", "attraction": "-", "lunch": "-", "dinner": "-", "accommodation": "-"}]}]