[{"gpt-4-1106-preview_direct_sole-planning_results": "Travel Plan:\n\nDay 1:\nCurrent City: from St. Petersburg to Appleton\nTransportation: Flight Number: F3574992, from St. Petersburg to Appleton, Departure Time: 22:51, Arrival Time: 00:42, Cost: 542\nBreakfast: -\nAttraction: The History Museum at the Castle, Appleton\nLunch: New Bakers Shoppee, Appleton, Cost: 15, Cuisines: \"Chinese, Pizza, Cafe\"\nDinner: Mathew's Cafe, Appleton, Cost: 13, Cuisines: \"Mexican, Bakery, BBQ, Cafe, Indian\"\nAccommodation: Stylish, convenient, renovated- 2 min to subway -, Appleton, Cost: 64, Maximum Occupancy: 2, House Rules: No smoking & No pets & No children under 10, Minimum Nights: 1\n\nNumber of People = 1\nTotal Cost = 542 + 15 + 13 + 64 = 634\nAccommodation Minimum Nights: 1/1\n\nDay 2:\nCurrent City: Appleton\nTransportation: -\nBreakfast: Fat Lulu's, Appleton, Cost: 23, Cuisines: \"Tea, Cafe, Seafood, Fast Food\"\nAttraction: Hearthstone Historic House Museum, Appleton; Butterfly Garden of Wisconsin, Appleton.\nLunch: Fire n Ice, Appleton, Cost: 22, Cuisines: \"Mexican, BBQ, Fast Food\"\nDinner: Side Wok, Appleton, Cost: 15, Cuisines: \"Tea, Italian, Bakery, Chinese, Seafood\"\nAccommodation: Stylish, convenient, renovated- 2 min to subway -, Appleton, Cost: 64, Maximum Occupancy: 2, House Rules: No smoking & No pets & No children under 10, Minimum Nights: 1\n\nNumber of people = 1\nTotal cost = 23 + 22 + 15 + 64 = 124\nAccommodation Minimum Nights: 1/1\n\nDay 3:\nCurrent City: from Appleton to St. Petersburg\nTransportation: Flight Number: F3578689, from Appleton to St. Petersburg, Departure Time: 07:19, Arrival Time: 11:01, Cost: 332\nBreakfast: Destination Live, Appleton, Cost: 30, Cuisines: \"Tea, Indian, BBQ\"\nAttraction: Gordon Bubolz Nature Preserve, Appleton\nLunch: -\nDinner: -\nAccommodation: -\n\nNumber of people = 1\nTotal cost = 332 + 30 = 362\n\nTotal cost across all days = 634 + 124 + 362 = 1120\n\nCuisines: The prompt specifies no cuisines, so all cuisines constraints are satisfied.", "gpt-4-1106-preview_direct_sole-planning_parsed_results": [{"day": 1, "current_city": "from St. Petersburg to Appleton", "transportation": "Flight Number: F3574992, from St. Petersburg to Appleton, Departure Time: 22:51, Arrival Time: 00:42", "breakfast": "-", "attraction": "The History Museum at the Castle, Appleton;", "lunch": "New Bakers Shoppee, Appleton", "dinner": "Mathew's Cafe, Appleton", "accommodation": "Stylish, convenient, renovated- 2 min to subway, Appleton"}, {"day": 2, "current_city": "Appleton", "transportation": "-", "breakfast": "Fat Lulu's, Appleton", "attraction": "Hearthstone Historic House Museum, Appleton;Butterfly Garden of Wisconsin, Appleton;", "lunch": "Fire n Ice, Appleton", "dinner": "Side Wok, Appleton", "accommodation": "Stylish, convenient, renovated- 2 min to subway, Appleton"}, {"day": 3, "current_city": "from Appleton to St. Petersburg", "transportation": "Flight Number: F3578689, from Appleton to St. Petersburg, Departure Time: 07:19, Arrival Time: 11:01", "breakfast": "Destination Live, Appleton", "attraction": "Gordon Bubolz Nature Preserve, Appleton;", "lunch": "-", "dinner": "-", "accommodation": "-"}]}]