[{"gpt-4-1106-preview_direct_sole-planning_results": "Travel Plan:\n\nDay 1: March 5, 2022\nCurrent City: from Richmond to Nashville\nTransportation: Self-driving from Richmond to Nashville, duration: 9 hours 3 mins, distance: 989 km, cost: $49\nBreakfast: - , Cost $0\nAttraction: Country Music Hall of Fame and Museum, Nashville, Cost: $25 per person, Total: $175\nLunch: Bangkok 1, Nashville, Average Cost: $44\nDinner: Bablu Fast Food, Nashville, Average Cost: $13\nAccommodation: Clean and large bedroom in a private house, Nashville, Cost: $474\n\nTotal cost for Day 1: $49 (transportation) + $175 (attraction) + $44 (lunch) + $13 (dinner) + $474 (accommodation) = $755\n\nDay 2: March 6, 2022\nCurrent City: Nashville\nTransportation: -, Cost $0\nBreakfast: Veg Hut, Nashville, Average Cost: $35\nAttraction: Nashville Zoo at Grassmere, Nashville, Cost: $20 per person, Total: $140\nLunch: The Toddy Shop, Nashville, Average Cost: $92\nDinner: GoGourmet, Nashville, Average Cost: $34\nAccommodation: Clean and large bedroom in a private house, Nashville, Cost: $474\n\nTotal cost for Day 2: $0 (transportation) + $35 (breakfast) + $140 (attraction) + $92 (lunch) + $34 (dinner) + $474 (accommodation) = $775\n\nDay 3: March 7, 2022\nCurrent City: from Nashville to Knoxville\nTransportation: Self-driving from Nashville to Knoxville, duration: 2 hours 42 mins, distance: 290 km, cost: $14\nBreakfast: Govinda's Confectionery, Nashville, Average Cost: $15\nAttraction: World's Fair Park, Knoxville, Cost: $0 (assuming no entry fee)\nLunch: Cafe Arabelle, Knoxville, Average Cost: $29\nDinner: Les 3 Brasseurs, Knoxville, Average Cost: $24\nAccommodation: Cozy Private Room in Chinatown/ Lower East Side, Knoxville, Cost: $132\n\nTotal cost for Day 3: $14 (transportation) + $15 (breakfast) + $0 (attraction) + $29 (lunch) + $24 (dinner) + $132 (accommodation) = $214\n\nDay 4: March 8, 2022\nCurrent City: Knoxville\nTransportation: -, Cost $0\nBreakfast: Cafe Coffee Day, Knoxville, Average Cost: $82\nAttraction: Knoxville Museum of Art, Knoxville, Cost: $10 per person, Total: $70\nLunch: Sky On 57, Knoxville, Average Cost: $150\nDinner: Cafe El Chico, Knoxville, Average Cost: $67\nAccommodation: Cozy Private Room in Chinatown/ Lower East Side, Knoxville, Cost: $132\n\nTotal cost for Day 4: $0 (transportation) + $82 (breakfast) + $70 (attraction) + $150 (lunch) + $67 (dinner) + $132 (accommodation) = $501\n\nDay 5: March 9, 2022\nCurrent City: from Knoxville to Richmond\nTransportation: Self-driving from Knoxville to Richmond, duration: 6 hours 23 mins, distance: 701 km, cost: $35\nBreakfast: Burger Planet, Knoxville, Average Cost: $45\nAttraction: Sunsphere, Knoxville, Cost: $0 (assuming no entry fee)\nLunch: Mamagoto, Knoxville, Average Cost: $14\nDinner: - , Cost $0\nAccommodation: -, Cost $0\n\nTotal cost for Day 5: $35 (transportation) + $45 (breakfast) + $0 (attraction) + $14 (lunch) = $94\n\nThe total cost of this trip is the sum of the costs from day 1, day 2, day 3, day 4, and day 5. It is $755 + $775 + $214 + $501 + $94 = $2339, which is less than the required budget of $2600.\n\nPlease note that the costs for attractions are estimated based on typical entry fees, and the actual costs may vary. The costs for meals are based on the average cost of a meal at each restaurant. Accommodation costs are for one night, and the chosen accommodation complies with the minimum stay requirements. The transportation costs are based on self-driving, as there were no available flights for the specified dates.", "gpt-4-1106-preview_direct_sole-planning_parsed_results": [{"day": 1, "current_city": "from Richmond to Nashville", "transportation": "Self-driving from Richmond to Nashville, duration: 9 hours 3 mins, distance: 989 km", "breakfast": "-", "attraction": "Country Music Hall of Fame and Museum, Nashville", "lunch": "Bangkok 1, Nashville", "dinner": "Bablu Fast Food, Nashville", "accommodation": "Clean and large bedroom in a private house, Nashville"}, {"day": 2, "current_city": "Nashville", "transportation": "-", "breakfast": "Veg Hut, Nashville", "attraction": "Nashville Zoo at Grassmere, Nashville", "lunch": "The Toddy Shop, Nashville", "dinner": "GoGourmet, Nashville", "accommodation": "Clean and large bedroom in a private house, Nashville"}, {"day": 3, "current_city": "from Nashville to Knoxville", "transportation": "Self-driving from Nashville to Knoxville, duration: 2 hours 42 mins, distance: 290 km", "breakfast": "Govinda's Confectionery, Nashville", "attraction": "World's Fair Park, Knoxville", "lunch": "Cafe Arabelle, Knoxville", "dinner": "Les 3 Brasseurs, Knoxville", "accommodation": "Cozy Private Room in Chinatown/ Lower East Side, Knoxville"}, {"day": 4, "current_city": "Knoxville", "transportation": "-", "breakfast": "Cafe Coffee Day, Knoxville", "attraction": "Knoxville Museum of Art, Knoxville", "lunch": "Sky On 57, Knoxville", "dinner": "Cafe El Chico, Knoxville", "accommodation": "Cozy Private Room in Chinatown/ Lower East Side, Knoxville"}, {"day": 5, "current_city": "from Knoxville to Richmond", "transportation": "Self-driving from Knoxville to Richmond, duration: 6 hours 23 mins, distance: 701 km", "breakfast": "Burger Planet, Knoxville", "attraction": "Sunsphere, Knoxville", "lunch": "Mamagoto, Knoxville", "dinner": "-", "accommodation": "-"}]}]