[{"gpt-4-1106-preview_direct_sole-planning_results": "Travel Plan:\n\nDay 1: March 15, 2022\nCurrent City: Philadelphia to Richmond\nTransportation: Flight Number: F3730367, from Philadelphia to Richmond, Departure Time: 14:03, Arrival Time: 15:03, Cost: $73\nBreakfast: - (Assuming travelers will have breakfast before departure)\nAttraction: Virginia Museum of Fine Arts, Richmond\nLunch: Guang Zhou Chinese Restaurant, Richmond, Cost: $84, Cuisines: \"Desserts, Tea, Cafe, Fast Food, Chinese, Indian\"\nDinner: Sandpiper Restaurant & Lounge, Richmond, Cost: $20, Cuisines: \"Tea, Cafe, Desserts, Seafood\"\nAccommodation: Inviting Brooklyn Studio, Richmond, Cost: $398, Maximum Occupancy: 3, House Rules: No parties & No smoking & No children under 10, Minimum Nights: 3\n\nNumber of People = 1 (Assuming solo traveler for cost calculation)\nTotal Cost = $73 (Flight) + $84 (Lunch) + $20 (Dinner) + $398 (Accommodation) = $575\nAccommodation Minimum Nights: 1/3\n\nDay 2: March 16, 2022\nCurrent City: Richmond\nTransportation: -\nBreakfast: Perfect Bake, Richmond, Cost: $33, Cuisines: \"Desserts, Tea, Italian, Bakery, Cafe, American\"\nAttraction: Maymont, Richmond\nLunch: Paradise, Richmond, Cost: $80, Cuisines: \"Tea, Pizza, Italian, Fast Food, Seafood\"\nDinner: Welcome, Richmond, Cost: $86, Cuisines: \"Tea, French, Bakery, Indian\"\nAccommodation: Inviting Brooklyn Studio, Richmond, Cost: $398, Maximum Occupancy: 3, House Rules: No parties & No smoking & No children under 10, Minimum Nights: 3\n\nTotal Cost = $33 (Breakfast) + $80 (Lunch) + $86 (Dinner) + $398 (Accommodation) = $597\nAccommodation Minimum Nights: 2/3\n\nDay 3: March 17, 2022\nCurrent City: Richmond to Petersburg\nTransportation: Taxi, from Richmond to Petersburg, duration: 25 mins, distance: 38.0 km, Cost: $38\nBreakfast: Mother's Kitchen, Richmond, Cost: $46, Cuisines: \"Tea, Cafe, Mexican, Fast Food, Chinese\"\nAttraction: Petersburg National Battlefield, Petersburg\nLunch: 5 Little Pigs, Petersburg, Cost: $46, Cuisines: \"Tea, French, Desserts\"\nDinner: J's Homestyle Cooking, Petersburg, Cost: $63, Cuisines: \"Fast Food, BBQ, Desserts, Italian\"\nAccommodation: Charming cozy bedroom in Clinton Hill!, Petersburg, Cost: $274, Maximum Occupancy: 2, House Rules: No smoking & No parties & No pets, Minimum Nights: 3\n\nTotal Cost = $38 (Taxi) + $46 (Breakfast) + $46 (Lunch) + $63 (Dinner) + $274 (Accommodation) = $467\nAccommodation Minimum Nights: 1/3\n\nDay 4: March 18, 2022\nCurrent City: Petersburg\nTransportation: -\nBreakfast: Tea'se Me - Rooftop Tea Boutique, Petersburg, Cost: $49, Cuisines: \"Tea, Cafe, Desserts, Seafood\"\nAttraction: Centre Hill Mansion-Museum, Petersburg\nLunch: Bake-a-boo, Petersburg, Cost: $40, Cuisines: \"Tea, Cafe, Pizza, BBQ\"\nDinner: Silver Crown, Petersburg, Cost: $54, Cuisines: \"Pizza, Indian, Desserts, Seafood\"\nAccommodation: Charming cozy bedroom in Clinton Hill!, Petersburg, Cost: $274, Maximum Occupancy: 2, House Rules: No smoking & No parties & No pets, Minimum Nights: 3\n\nTotal Cost = $49 (Breakfast) + $40 (Lunch) + $54 (Dinner) + $274 (Accommodation) = $417\nAccommodation Minimum Nights: 2/3\n\nDay 5: March 19, 2022\nCurrent City: Petersburg to Charlottesville\nTransportation: Self-driving, from Petersburg to Charlottesville, duration: 1 hour 30 mins, distance: 152 km, Cost: $7\nBreakfast: Raju Vaishno Amritsari Dhaba, Petersburg, Cost: $83, Cuisines: \"BBQ, Mediterranean, Seafood\"\nAttraction: Monticello, Charlottesville\nLunch: Mama's Fish House, Charlottesville, Cost: $63, Cuisines: \"Tea, Pizza, Desserts, Fast Food\"\nDinner: Restaurant Andre, Charlottesville, Cost: $250, Cuisines: \"Desserts, Tea, BBQ, Fast Food, Chinese\"\nAccommodation: Williamsburg Hidden Gem, Charlottesville, Cost: $391, Maximum Occupancy: 2, House Rules: No visitors & No smoking, Minimum Nights: 1\n\nTotal Cost = $7 (Self-driving) + $83 (Breakfast) + $63 (Lunch) + $250 (Dinner) + $391 (Accommodation) = $794\nAccommodation Minimum Nights: 1/1\n\nDay 6: March 20, 2022\nCurrent City: Charlottesville\nTransportation: -\nBreakfast: Takamaka, Charlottesville, Cost: $72, Cuisines: \"Tea, Pizza, Italian, BBQ, Fast Food\"\nAttraction: The Fralin Museum of Art at the University of Virginia, Charlottesville\nLunch: Sandys Cocktails & Kitchen, Charlottesville, Cost: $82, Cuisines: \"Tea, Pizza, BBQ, Indian, Seafood\"\nDinner: Dawat-e-Ishq, Charlottesville, Cost: $26, Cuisines: \"Desserts, Tea, Italian, BBQ, Fast Food\"\nAccommodation: Williamsburg Hidden Gem, Charlottesville, Cost: $391, Maximum Occupancy: 2, House Rules: No visitors & No smoking, Minimum Nights: 1\n\nTotal Cost = $72 (Breakfast) + $82 (Lunch) + $26 (Dinner) + $391 (Accommodation) = $571\nAccommodation Minimum Nights: 1/1\n\nDay 7: March 21, 2022\nCurrent City: Charlottesville to Philadelphia\nTransportation: Self-driving, from Charlottesville to Philadelphia, duration: 4 hours 24 mins, distance: 411 km, Cost: $20\nBreakfast: Firefly, Charlottesville, Cost: $30, Cuisines: \"Pizza, Bakery\"\nAttraction: - (Assuming travelers will be departing)\nLunch: - (Assuming travelers will have lunch on the way or after arrival)\nDinner: - (Assuming travelers will have dinner at their destination)\nAccommodation: -\n\nTotal Cost = $20 (Self-driving) + $30 (Breakfast) = $50\n\nTotal cost across all days = $575 + $597 + $467 + $417 + $794 + $571 + $50 = $3471\n\nThe total cost exceeds the specified budget of $1,800. To adjust the plan within the budget, we would need to make significant changes, such as opting for cheaper accommodations, meals, and attractions, or reducing the number of cities visited. Additionally, we may need to consider alternative transportation options or adjust the number of days spent in each city. Please note that the cost calculations are based on a single traveler, and the budget would be further exceeded if there are more travelers.", "gpt-4-1106-preview_direct_sole-planning_parsed_results": [{"day": 1, "current_city": "from Philadelphia to Richmond", "transportation": "Flight Number: F3730367, from Philadelphia to Richmond, Departure Time: 14:03, Arrival Time: 15:03", "breakfast": "-", "attraction": "Virginia Museum of Fine Arts, Richmond;", "lunch": "Guang Zhou Chinese Restaurant, Richmond", "dinner": "Sandpiper Restaurant & Lounge, Richmond", "accommodation": "Inviting Brooklyn Studio, Richmond"}, {"day": 2, "current_city": "Richmond", "transportation": "-", "breakfast": "Perfect Bake, Richmond", "attraction": "Maymont, Richmond;", "lunch": "Paradise, Richmond", "dinner": "Welcome, Richmond", "accommodation": "Inviting Brooklyn Studio, Richmond"}, {"day": 3, "current_city": "from Richmond to Petersburg", "transportation": "Taxi, from Richmond to Petersburg, duration: 25 mins, distance: 38.0 km", "breakfast": "Mother's Kitchen, Richmond", "attraction": "Petersburg National Battlefield, Petersburg;", "lunch": "5 Little Pigs, Petersburg", "dinner": "J's Homestyle Cooking, Petersburg", "accommodation": "Charming cozy bedroom in Clinton Hill!, Petersburg"}, {"day": 4, "current_city": "Petersburg", "transportation": "-", "breakfast": "Tea'se Me - Rooftop Tea Boutique, Petersburg", "attraction": "Centre Hill Mansion-Museum, Petersburg;", "lunch": "Bake-a-boo, Petersburg", "dinner": "Silver Crown, Petersburg", "accommodation": "Charming cozy bedroom in Clinton Hill!, Petersburg"}, {"day": 5, "current_city": "from Petersburg to Charlottesville", "transportation": "Self-driving, from Petersburg to Charlottesville, duration: 1 hour 30 mins, distance: 152 km", "breakfast": "Raju Vaishno Amritsari Dhaba, Petersburg", "attraction": "Monticello, Charlottesville;", "lunch": "Mama's Fish House, Charlottesville", "dinner": "Restaurant Andre, Charlottesville", "accommodation": "Williamsburg Hidden Gem, Charlottesville"}, {"day": 6, "current_city": "Charlottesville", "transportation": "-", "breakfast": "Takamaka, Charlottesville", "attraction": "The Fralin Museum of Art at the University of Virginia, Charlottesville;", "lunch": "Sandys Cocktails & Kitchen, Charlottesville", "dinner": "Dawat-e-Ishq, Charlottesville", "accommodation": "Williamsburg Hidden Gem, Charlottesville"}, {"day": 7, "current_city": "from Charlottesville to Philadelphia", "transportation": "Self-driving, from Charlottesville to Philadelphia, duration: 4 hours 24 mins, distance: 411 km", "breakfast": "Firefly, Charlottesville", "attraction": "-", "lunch": "-", "dinner": "-", "accommodation": "-"}]}]