[{"gpt-4-1106-preview_direct_sole-planning_results": "Travel Plan:\n\nDay 1: March 23, 2022\nCurrent City: from St. Louis to Philadelphia\nTransportation: Flight Number: F3787538, from St. Louis to Philadelphia, Departure Time: 05:26, Arrival Time: 08:29, Cost: $464 (2 people)\nBreakfast: -\nAttraction: Liberty Bell, Philadelphia, Cost: $0 (Free Entry)\nLunch: Red Ginger Sushi, Grill & Bar, Philadelphia, Cost: $196, Cuisines: \"Tea, Cafe, Indian, Fast Food\"\nDinner: Red Mesa Cantina, Philadelphia, Cost: $72, Cuisines: \"Tea, Cafe, American, Fast Food\"\nAccommodation: Industrial Loft Living in NYC, Philadelphia, Cost: $356, Maximum Occupancy: 3, House Rules: No smoking, Minimum Nights: 4\n\nNumber of People = 2\nTotal Cost = $464 + $196 + $72 + $356 = $1088\nAccommodation Minimum Nights: 1/4\n\nDay 2: March 24, 2022\nCurrent City: Philadelphia\nTransportation: -\nBreakfast: Hong Kong Cafe, Philadelphia, Cost: $94, Cuisines: \"Tea, Pizza, Italian, BBQ, Cafe\"\nAttraction: Philadelphia Museum of Art, Philadelphia, Cost: $0 (Free Entry)\nLunch: Marukame Udon, Philadelphia, Cost: $200, Cuisines: \"Tea, Pizza, Italian, BBQ, Fast Food, Chinese\"\nDinner: The Moon Under Water, Philadelphia, Cost: $188, Cuisines: \"Pizza, Italian, BBQ, Bakery, Fast Food, Mediterranean\"\nAccommodation: Industrial Loft Living in NYC, Philadelphia, Cost: $356, Maximum Occupancy: 3, House Rules: No smoking, Minimum Nights: 4\n\nNumber of People = 2\nTotal Cost = $94 + $200 + $188 + $356 = $838\nAccommodation Minimum Nights: 2/4\n\nDay 3: March 25, 2022\nCurrent City: from Philadelphia to Harrisburg\nTransportation: Flight Number: F3732413, from Philadelphia to Harrisburg, Departure Time: 11:17, Arrival Time: 12:01, Cost: $44 (2 people)\nBreakfast: -\nAttraction: The National Civil War Museum, Harrisburg, Cost: $0 (Free Entry)\nLunch: Viva! Argentine Cuisine, Harrisburg, Cost: $56, Cuisines: \"Mexican, Pizza, BBQ\"\nDinner: Square - Sayaji Hotel, Harrisburg, Cost: $198, Cuisines: \"Cafe, Mexican, American, BBQ\"\nAccommodation: Cozy Nolita Apartment, Harrisburg, Cost: $340, Maximum Occupancy: 3, House Rules: No smoking & No parties, Minimum Nights: 2\n\nNumber of People = 2\nTotal Cost = $44 + $56 + $198 + $340 = $638\nAccommodation Minimum Nights: 1/2\n\nDay 4: March 26, 2022\nCurrent City: Harrisburg\nTransportation: -\nBreakfast: Spiral - Sofitel Philippine Plaza Manila, Harrisburg, Cost: $444, Cuisines: \"Tea, Cafe, Pizza\"\nAttraction: Pennsylvania National Fire Museum, Harrisburg, Cost: $0 (Free Entry)\nLunch: Cakes & More, Harrisburg, Cost: $196, Cuisines: \"Cafe, Bakery, BBQ, Seafood\"\nDinner: Masala Fusion, Harrisburg, Cost: $26, Cuisines: \"Desserts, Pizza, French, Bakery, Indian\"\nAccommodation: Cozy Nolita Apartment, Harrisburg, Cost: $340, Maximum Occupancy: 3, House Rules: No smoking & No parties, Minimum Nights: 2\n\nNumber of People = 2\nTotal Cost = $444 + $196 + $26 + $340 = $1006\nAccommodation Minimum Nights: 2/2\n\nDay 5: March 27, 2022\nCurrent City: from Harrisburg to State College\nTransportation: Self-driving, from Harrisburg to State College, Cost: $12 (2 people)\nBreakfast: -\nAttraction: The Arboretum at Penn State, State College, Cost: $0 (Free Entry)\nLunch: Los Agaves, State College, Cost: $78, Cuisines: \"French, BBQ, Cafe\"\nDinner: Amici Cafe, State College, Cost: $192, Cuisines: \"Pizza, Bakery, BBQ, Chinese, Seafood\"\nAccommodation: \u2606 HUGE, SUNLIT Room - 3 min walk from Train !, State College, Cost: $824, Maximum Occupancy: 1, House Rules: No smoking & No visitors, Minimum Nights: 29\n\nNumber of People = 2\nTotal Cost = $12 + $78 + $192 + $824 = $1106\nAccommodation Minimum Nights: 1/29\n\nDay 6: March 28, 2022\nCurrent City: State College\nTransportation: -\nBreakfast: Kawa Sushi, State College, Cost: $164, Cuisines: \"French, Mexican, Desserts, Fast Food\"\nAttraction: Penn State All-Sports Museum, State College, Cost: $0 (Free Entry)\nLunch: Fusion Food Corner, State College, Cost: $92, Cuisines: \"Bakery, Mexican, BBQ, Italian\"\nDinner: The Chocolate Heaven, State College, Cost: $90, Cuisines: \"Pizza, BBQ\"\nAccommodation: \u2606 HUGE, SUNLIT Room - 3 min walk from Train !, State College, Cost: $824, Maximum Occupancy: 1, House Rules: No smoking & No visitors, Minimum Nights: 29\n\nNumber of People = 2\nTotal Cost = $164 + $92 + $90 + $824 = $1170\nAccommodation Minimum Nights: 2/29\n\nDay 7: March 29, 2022\nCurrent City: from State College to St. Louis\nTransportation: Self-driving, from State College to St. Louis, Cost: $118 (2 people)\nBreakfast: -\nAttraction: -\nLunch: -\nDinner: -\nAccommodation: -\n\nNumber of People = 2\nTotal Cost = $118\n\nTotal cost across all days = $1088 + $838 + $638 + $1006 + $1106 + $1170 + $118 = $5964\nCuisines: Indian and American cuisine preferences are satisfied with multiple meals.\n\nRemaining Budget: $7200 - $5964 = $1236\n\nPlease note that the accommodation on Day 5 and Day 6 has a minimum stay of 29 nights, which is not suitable for a 7-day trip. However, due to the lack of provided information on alternative accommodations, this plan includes the available option. Adjustments to the accommodation would be necessary with more information.", "gpt-4-1106-preview_direct_sole-planning_parsed_results": [{"day": 1, "current_city": "from St. Louis to Philadelphia", "transportation": "Flight Number: F3787538, from St. Louis to Philadelphia, Departure Time: 05:26, Arrival Time: 08:29", "breakfast": "-", "attraction": "Liberty Bell, Philadelphia;", "lunch": "Red Ginger Sushi, Grill & Bar, Philadelphia", "dinner": "Red Mesa Cantina, Philadelphia", "accommodation": "Industrial Loft Living in NYC, Philadelphia"}, {"day": 2, "current_city": "Philadelphia", "transportation": "-", "breakfast": "Hong Kong Cafe, Philadelphia", "attraction": "Philadelphia Museum of Art, Philadelphia;", "lunch": "Marukame Udon, Philadelphia", "dinner": "The Moon Under Water, Philadelphia", "accommodation": "Industrial Loft Living in NYC, Philadelphia"}, {"day": 3, "current_city": "from Philadelphia to Harrisburg", "transportation": "Flight Number: F3732413, from Philadelphia to Harrisburg, Departure Time: 11:17, Arrival Time: 12:01", "breakfast": "-", "attraction": "The National Civil War Museum, Harrisburg;", "lunch": "Viva! Argentine Cuisine, Harrisburg", "dinner": "Square - Sayaji Hotel, Harrisburg", "accommodation": "Cozy Nolita Apartment, Harrisburg"}, {"day": 4, "current_city": "Harrisburg", "transportation": "-", "breakfast": "Spiral - Sofitel Philippine Plaza Manila, Harrisburg", "attraction": "Pennsylvania National Fire Museum, Harrisburg;", "lunch": "Cakes & More, Harrisburg", "dinner": "Masala Fusion, Harrisburg", "accommodation": "Cozy Nolita Apartment, Harrisburg"}, {"day": 5, "current_city": "from Harrisburg to State College", "transportation": "Self-driving, from Harrisburg to State College", "breakfast": "-", "attraction": "The Arboretum at Penn State, State College;", "lunch": "Los Agaves, State College", "dinner": "Amici Cafe, State College", "accommodation": "\u2606 HUGE, SUNLIT Room - 3 min walk from Train !, State College"}, {"day": 6, "current_city": "State College", "transportation": "-", "breakfast": "Kawa Sushi, State College", "attraction": "Penn State All-Sports Museum, State College;", "lunch": "Fusion Food Corner, State College", "dinner": "The Chocolate Heaven, State College", "accommodation": "\u2606 HUGE, SUNLIT Room - 3 min walk from Train !, State College"}, {"day": 7, "current_city": "from State College to St. Louis", "transportation": "Self-driving, from State College to St. Louis", "breakfast": "-", "attraction": "-", "lunch": "-", "dinner": "-", "accommodation": "-"}]}]