[{"gpt-4-1106-preview_direct_sole-planning_results": "Travel Plan:\n\nDay 1: March 12, 2022\nCurrent City: from Houston to Pensacola\nTransportation: Self-driving, from Houston to Pensacola, duration: 7 hours 38 mins, distance: 845 km, cost: $42\nBreakfast: Not applicable (Assuming departure is in the morning and breakfast is not required)\nAttraction: Palafox Street Downtown Pensacola, Address: 200 N Palafox St, Pensacola, FL 32502, USA\nLunch: Frog Hollow Tavern, Pensacola, Cost: $20, Cuisines: \"American, BBQ, Fast Food, Cafe, Indian\"\nDinner: Berry Patch Restaurant, Pensacola, Cost: $13, Cuisines: \"Bakery, BBQ, Desserts, Seafood\"\nAccommodation: Chic Historic Harlem Brownstone, Pensacola, Cost: $526, Maximum Occupancy: 2, House Rules: No smoking, Minimum Nights: 3\n\nNumber of People = 2\nTotal Cost = 2 * $42 + 2 * $20 + 2 * $13 + $526 = $676\n\nDay 2: March 13, 2022\nCurrent City: Pensacola\nTransportation: -\nBreakfast: Bailey's Bar-B-Que, Pensacola, Cost: $13, Cuisines: \"Tea, Bakery, Mediterranean\"\nAttraction: Historic Pensacola Village, Address: 205 E Zaragoza St, Pensacola, FL 32502, USA\nLunch: Watershed Cafe, Pensacola, Cost: $12, Cuisines: \"Chinese, BBQ, Desserts\"\nDinner: Blue Point Grill, Pensacola, Cost: $75, Cuisines: \"French, Indian, Cafe, Desserts\"\nAccommodation: Chic Historic Harlem Brownstone, Pensacola, Cost: $526, Maximum Occupancy: 2, House Rules: No smoking, Minimum Nights: 3\n\nNumber of People = 2\nTotal Cost = 2 * $13 + 2 * $12 + 2 * $75 + $526 = $714\n\nDay 3: March 14, 2022\nCurrent City: from Pensacola to Houston\nTransportation: Self-driving, from Pensacola to Houston, duration: 7 hours 37 mins, distance: 845 km, cost: $42\nBreakfast: Kalpana Restaurant, Pensacola, Cost: $36, Cuisines: \"Tea, Cafe, Bakery, American\"\nAttraction: Pensacola Lighthouse & Maritime Museum, Address: 2081 Radford Blvd, Pensacola, FL 32508, USA\nLunch: Chicago Pizza, Pensacola, Cost: $32, Cuisines: \"Pizza, Mediterranean, Fast Food\"\nDinner: Not applicable (Assuming arrival in Houston in the evening and dinner is not required)\nAccommodation: -\n\nNumber of People = 2\nTotal Cost = 2 * $42 + 2 * $36 + 2 * $32 = $220\n\nTotal cost across all days = $676 + $714 + $220 = $1610\n\nNote: The total cost exceeds the specified budget of $1,100. To adhere to the budget, we need to adjust the accommodation and meal choices. However, the provided accommodation options do not permit smoking, which is a requirement. Additionally, the cost of self-driving is significantly lower than the cost of flights, but the budget constraint is still not met due to high accommodation costs. Further adjustments or increased budget would be necessary to finalize the travel plan.", "gpt-4-1106-preview_direct_sole-planning_parsed_results": [{"day": 1, "current_city": "from Houston to Pensacola", "transportation": "Self-driving, from Houston to Pensacola, duration: 7 hours 38 mins, distance: 845 km", "breakfast": "-", "attraction": "Palafox Street Downtown, Pensacola", "lunch": "Frog Hollow Tavern, Pensacola", "dinner": "Berry Patch Restaurant, Pensacola", "accommodation": "Chic Historic Harlem Brownstone, Pensacola"}, {"day": 2, "current_city": "Pensacola", "transportation": "-", "breakfast": "Bailey's Bar-B-Que, Pensacola", "attraction": "Historic Pensacola Village, Pensacola", "lunch": "Watershed Cafe, Pensacola", "dinner": "Blue Point Grill, Pensacola", "accommodation": "Chic Historic Harlem Brownstone, Pensacola"}, {"day": 3, "current_city": "from Pensacola to Houston", "transportation": "Self-driving, from Pensacola to Houston, duration: 7 hours 37 mins, distance: 845 km", "breakfast": "Kalpana Restaurant, Pensacola", "attraction": "Pensacola Lighthouse & Maritime Museum, Pensacola", "lunch": "Chicago Pizza, Pensacola", "dinner": "-", "accommodation": "-"}]}]