[{"gpt-4-1106-preview_direct_sole-planning_results": "Travel Plan:\n\nDay 1:\nCurrent City: from Manchester to Charlotte\nTransportation: Flight Number: F3785421, from Manchester to Charlotte, Departure Time: 14:16, Arrival Time: 16:46\nBreakfast: - (Assuming breakfast is before the flight)\nAttraction: Levine Museum of the New South, Charlotte\nLunch: Olive Tree Cafe, Charlotte\nDinner: Nagaland's Kitchen, Charlotte\nAccommodation: Elegant Studio Apt in Prospect Heights, Charlotte\n\nDay 2:\nCurrent City: Charlotte\nTransportation: -\nBreakfast: Cafe Maple Street, Charlotte\nAttraction: Discovery Place Science, Charlotte; The Mint Museum, Charlotte.\nLunch: China Garden, Charlotte\nDinner: Kylin Skybar, Charlotte\nAccommodation: Elegant Studio Apt in Prospect Heights, Charlotte\n\nDay 3:\nCurrent City: from Charlotte to Manchester\nTransportation: Flight Number: F3786316, from Charlotte to Manchester, Departure Time: 17:05, Arrival Time: 19:04\nBreakfast: Subway, Charlotte\nAttraction: NASCAR Hall of Fame, Charlotte.\nLunch: Central Perk 7, Charlotte\nDinner: - (Assuming dinner is after the flight)\nAccommodation: -\n\nNote: The accommodation chosen is an entire home/apt type as requested, and the minimum nights stay is 2 nights, which fits within the travel plan. Attractions, restaurants, and flights were selected based on the provided reference information and to ensure a diverse experience without repeating any visits. The budget has been considered, but without specific costs for each item in the reference information, it is assumed that the choices made fit within the $4,800 budget.", "gpt-4-1106-preview_direct_sole-planning_parsed_results": [{"day": 1, "current_city": "from Manchester to Charlotte", "transportation": "Flight Number: F3785421, from Manchester to Charlotte, Departure Time: 14:16, Arrival Time: 16:46", "breakfast": "-", "attraction": "Levine Museum of the New South, Charlotte;", "lunch": "Olive Tree Cafe, Charlotte", "dinner": "Nagaland's Kitchen, Charlotte", "accommodation": "Elegant Studio Apt in Prospect Heights, Charlotte"}, {"day": 2, "current_city": "Charlotte", "transportation": "-", "breakfast": "Cafe Maple Street, Charlotte", "attraction": "Discovery Place Science, Charlotte;The Mint Museum, Charlotte;", "lunch": "China Garden, Charlotte", "dinner": "Kylin Skybar, Charlotte", "accommodation": "Elegant Studio Apt in Prospect Heights, Charlotte"}, {"day": 3, "current_city": "from Charlotte to Manchester", "transportation": "Flight Number: F3786316, from Charlotte to Manchester, Departure Time: 17:05, Arrival Time: 19:04", "breakfast": "Subway, Charlotte", "attraction": "NASCAR Hall of Fame, Charlotte;", "lunch": "Central Perk 7, Charlotte", "dinner": "-", "accommodation": "-"}]}]