[{"gpt-4-1106-preview_direct_sole-planning_results": "Travel Plan:\n\nDay 1: March 2, 2022\nCurrent City: Philadelphia to Richmond\nTransportation: Flight Number: F3734535, from Philadelphia to Richmond, Departure Time: 09:40, Arrival Time: 10:51, Cost: 47\nBreakfast: - \nAttraction: Virginia Museum of Fine Arts, Richmond\nLunch: Guang Zhou Chinese Restaurant, Richmond, Cost: 84, Cuisines: \"Desserts, Tea, Cafe, Fast Food, Chinese, Indian\"\nDinner: Sandpiper Restaurant & Lounge, Richmond, Cost: 20, Cuisines: \"Tea, Cafe, Desserts, Seafood\"\nAccommodation: Cool Summer Vibes UWS Pent House w/ rooftop, Richmond, Cost: 498, Maximum Occupancy: 2, House Rules: No pets & No parties\n\nNumber of People = 1 (assuming single traveler based on accommodation)\nTotal Cost = 47 + 84 + 20 + 498 = 649\n\nDay 2: March 3, 2022\nCurrent City: Richmond\nTransportation: -\nBreakfast: Paradise, Richmond, Cost: 80, Cuisines: \"Tea, Pizza, Italian, Fast Food, Seafood\"\nAttraction: Maymont, Richmond\nLunch: Welcome, Richmond, Cost: 86, Cuisines: \"Tea, French, Bakery, Indian\"\nDinner: Perfect Bake, Richmond, Cost: 33, Cuisines: \"Desserts, Tea, Italian, Bakery, Cafe, American\"\nAccommodation: Cool Summer Vibes UWS Pent House w/ rooftop, Richmond, Cost: 498, Maximum Occupancy: 2, House Rules: No pets & No parties\n\nTotal Cost = 80 + 86 + 33 + 498 = 697\n\nDay 3: March 4, 2022\nCurrent City: Richmond to Jamestown\nTransportation: Self-driving, from Richmond to Jamestown, Cost: 4\nBreakfast: Mother's Kitchen, Richmond, Cost: 46, Cuisines: \"Tea, Cafe, Mexican, Fast Food, Chinese\"\nAttraction: Historic Jamestowne, Jamestown\nLunch: Cafe Soul Garden, Jamestown, Cost: 99, Cuisines: \"Desserts, Bakery, Cafe, American, Seafood\"\nDinner: Chauhan Hotel, Jamestown, Cost: 13, Cuisines: \"Desserts, Mexican, BBQ, Bakery, Cafe\"\nAccommodation: COZY APT CLOSE TO LGA & JFK AND TRANSPORTATION, Jamestown, Cost: 652, Maximum Occupancy: 2, House Rules: No children under 10\n\nTotal Cost = 4 + 46 + 99 + 13 + 652 = 814\n\nDay 4: March 5, 2022\nCurrent City: Jamestown\nTransportation: -\nBreakfast: BarShala, Jamestown, Cost: 13, Cuisines: \"Fast Food, Seafood, Desserts, Italian\"\nAttraction: Jamestown Settlement, Jamestown\nLunch: Mughlai Flavours, Jamestown, Cost: 12, Cuisines: \"Pizza, French, Bakery, BBQ, Cafe\"\nDinner: Janaab, Jamestown, Cost: 38, Cuisines: \"Pizza, Fast Food, Cafe, Indian, Seafood\"\nAccommodation: COZY APT CLOSE TO LGA & JFK AND TRANSPORTATION, Jamestown, Cost: 652, Maximum Occupancy: 2, House Rules: No children under 10\n\nTotal Cost = 13 + 12 + 38 + 652 = 715\n\nDay 5: March 6, 2022\nCurrent City: Jamestown to Charlottesville\nTransportation: Self-driving, from Jamestown to Charlottesville, Cost: 10\nBreakfast: The Food Junction, Jamestown, Cost: 78, Cuisines: \"Tea, Indian, Fast Food\"\nAttraction: Monticello, Charlottesville\nLunch: Mama's Fish House, Charlottesville, Cost: 63, Cuisines: \"Tea, Pizza, Desserts, Fast Food\"\nDinner: Restaurant Andre, Charlottesville, Cost: 250, Cuisines: \"Desserts, Tea, BBQ, Fast Food, Chinese\"\nAccommodation: Gorgeous natural light in Chelsea photo studio, Charlottesville, Cost: 1094, Maximum Occupancy: 8, House Rules: No pets\n\nTotal Cost = 10 + 78 + 63 + 250 + 1094 = 1495\n\nDay 6: March 7, 2022\nCurrent City: Charlottesville\nTransportation: -\nBreakfast: Domino's Pizza, Charlottesville, Cost: 53, Cuisines: \"Tea, Chinese, Indian, BBQ\"\nAttraction: Virginia Discovery Museum, Charlottesville\nLunch: Takamaka, Charlottesville, Cost: 72, Cuisines: \"Tea, Pizza, Italian, BBQ, Fast Food\"\nDinner: Sandys Cocktails & Kitchen, Charlottesville, Cost: 82, Cuisines: \"Tea, Pizza, BBQ, Indian, Seafood\"\nAccommodation: Gorgeous natural light in Chelsea photo studio, Charlottesville, Cost: 1094, Maximum Occupancy: 8, House Rules: No pets\n\nTotal Cost = 53 + 72 + 82 + 1094 = 1301\n\nDay 7: March 8, 2022\nCurrent City: Charlottesville to Philadelphia\nTransportation: Self-driving, from Charlottesville to Philadelphia, Cost: 20\nBreakfast: Dawat-e-Ishq, Charlottesville, Cost: 26, Cuisines: \"Desserts, Tea, Italian, BBQ, Fast Food\"\nAttraction: -\nLunch: Firefly, Charlottesville, Cost: 30, Cuisines: \"Pizza, Bakery\"\nDinner: -\nAccommodation: -\n\nTotal Cost = 20 + 26 + 30 = 76\n\nTotal cost across all days = 649 + 697 + 814 + 715 + 1495 + 1301 + 76 = 5747\n\nGiven the budget of $2,900, the above plan exceeds the budget. Adjustments will need to be made to fit within the budget constraints. This could include choosing more affordable accommodations, dining options, and potentially removing certain attractions or meals from the itinerary.", "gpt-4-1106-preview_direct_sole-planning_parsed_results": [{"day": 1, "current_city": "from Philadelphia to Richmond", "transportation": "Flight Number: F3734535, from Philadelphia to Richmond, Departure Time: 09:40, Arrival Time: 10:51", "breakfast": "-", "attraction": "Virginia Museum of Fine Arts, Richmond;", "lunch": "Guang Zhou Chinese Restaurant, Richmond", "dinner": "Sandpiper Restaurant & Lounge, Richmond", "accommodation": "Cool Summer Vibes UWS Pent House w/ rooftop, Richmond"}, {"day": 2, "current_city": "Richmond", "transportation": "-", "breakfast": "Paradise, Richmond", "attraction": "Maymont, Richmond;", "lunch": "Welcome, Richmond", "dinner": "Perfect Bake, Richmond", "accommodation": "Cool Summer Vibes UWS Pent House w/ rooftop, Richmond"}, {"day": 3, "current_city": "from Richmond to Jamestown", "transportation": "Self-driving, from Richmond to Jamestown", "breakfast": "Mother's Kitchen, Richmond", "attraction": "Historic Jamestowne, Jamestown;", "lunch": "Cafe Soul Garden, Jamestown", "dinner": "Chauhan Hotel, Jamestown", "accommodation": "COZY APT CLOSE TO LGA & JFK AND TRANSPORTATION, Jamestown"}, {"day": 4, "current_city": "Jamestown", "transportation": "-", "breakfast": "BarShala, Jamestown", "attraction": "Jamestown Settlement, Jamestown;", "lunch": "Mughlai Flavours, Jamestown", "dinner": "Janaab, Jamestown", "accommodation": "COZY APT CLOSE TO LGA & JFK AND TRANSPORTATION, Jamestown"}, {"day": 5, "current_city": "from Jamestown to Charlottesville", "transportation": "Self-driving, from Jamestown to Charlottesville", "breakfast": "The Food Junction, Jamestown", "attraction": "Monticello, Charlottesville;", "lunch": "Mama's Fish House, Charlottesville", "dinner": "Restaurant Andre, Charlottesville", "accommodation": "Gorgeous natural light in Chelsea photo studio, Charlottesville"}, {"day": 6, "current_city": "Charlottesville", "transportation": "-", "breakfast": "Domino's Pizza, Charlottesville", "attraction": "Virginia Discovery Museum, Charlottesville;", "lunch": "Takamaka, Charlottesville", "dinner": "Sandys Cocktails & Kitchen, Charlottesville", "accommodation": "Gorgeous natural light in Chelsea photo studio, Charlottesville"}, {"day": 7, "current_city": "from Charlottesville to Philadelphia", "transportation": "Self-driving, from Charlottesville to Philadelphia", "breakfast": "Dawat-e-Ishq, Charlottesville", "attraction": "-", "lunch": "Firefly, Charlottesville", "dinner": "-", "accommodation": "-"}]}]