[{"gpt-4-1106-preview_direct_sole-planning_results": "Travel Plan:\n\nDay 1: March 22, 2022\nCurrent City: from Chicago to Albany\nTransportation: Flight Number: F3605761, from Chicago to Albany, Departure Time: 13:45, Arrival Time: 16:36, Cost: $297 per person\nBreakfast: - (Assuming breakfast is not required as the flight is post-noon)\nAttraction: New York State Capitol, Albany\nLunch: Kaiser, Albany, Cost: $96, Cuisines: \"Cafe, Pizza, American\"\nDinner: Echoes Satyaniketan, Albany, Cost: $91, Cuisines: \"Chinese, Bakery, Cafe\"\nAccommodation: Mid Town East Side Apartment, Albany, Cost: $737, Room Type: Entire home/apt, House Rules: No pets & No children under 10, Maximum Occupancy: 6\n\nNumber of People = 2\nTotal Cost = 2 * $297 (Flight) + 2 * $96 (Lunch) + 2 * $91 (Dinner) + $737 (Accommodation) = $1705\nAccommodation Minimum Nights: 1/1\n\nDay 2: March 23, 2022\nCurrent City: Albany\nTransportation: -\nBreakfast: Cafe Coffee Day, Albany, Cost: $82, Cuisines: \"Mexican, Fast Food, Cafe, American, Seafood\"\nAttraction: Albany Institute of History & Art, Albany; USS SLATER, Albany\nLunch: Jahangeer Foods, Albany, Cost: $59, Cuisines: \"Tea, Pizza, Italian, BBQ, Cafe\"\nDinner: Pizza Hut, Albany, Cost: $97, Cuisines: \"Desserts, Tea, Mexican, BBQ, Seafood\"\nAccommodation: Mid Town East Side Apartment, Albany, Cost: $737, Room Type: Entire home/apt, House Rules: No pets & No children under 10, Maximum Occupancy: 6\n\nNumber of People = 2\nTotal Cost = 2 * $82 (Breakfast) + 2 * $59 (Lunch) + 2 * $97 (Dinner) + $737 (Accommodation) = $1213\nAccommodation Minimum Nights: 2/2\n\nDay 3: March 24, 2022\nCurrent City: from Albany to Chicago\nTransportation: Flight Number: F4008387, from Albany to Chicago, Departure Time: 05:05, Arrival Time: 06:11, Cost: $181 per person\nBreakfast: - (Assuming breakfast is not required as the flight is early morning)\nAttraction: - (No time for attractions due to early departure)\nLunch: - (Assuming lunch is not required as the travelers will have arrived at their destination)\nDinner: - (Assuming dinner is not required as the travelers will have arrived at their destination)\nAccommodation: -\n\nNumber of People = 2\nTotal Cost = 2 * $181 (Flight) = $362\nAccommodation Minimum Nights: -\n\nTotal cost across all days = $1705 + $1213 + $362 = $3280\n\nUnfortunately, the total cost exceeds the specified budget of $2,300. To adjust the plan within the budget, we can consider changing the accommodation to a less expensive option or selecting a cheaper flight. However, given the provided data, there are no cheaper flights or accommodations that allow smoking and are entire rooms. Therefore, we would need to either increase the budget or adjust the requirements to fit within the budget.", "gpt-4-1106-preview_direct_sole-planning_parsed_results": [{"day": 1, "current_city": "from Chicago to Albany", "transportation": "Flight Number: F3605761, from Chicago to Albany, Departure Time: 13:45, Arrival Time: 16:36", "breakfast": "-", "attraction": "New York State Capitol, Albany;", "lunch": "Kaiser, Albany", "dinner": "Echoes Satyaniketan, Albany", "accommodation": "Mid Town East Side Apartment, Albany"}, {"day": 2, "current_city": "Albany", "transportation": "-", "breakfast": "Cafe Coffee Day, Albany", "attraction": "Albany Institute of History & Art, Albany;USS SLATER, Albany;", "lunch": "Jahangeer Foods, Albany", "dinner": "Pizza Hut, Albany", "accommodation": "Mid Town East Side Apartment, Albany"}, {"day": 3, "current_city": "from Albany to Chicago", "transportation": "Flight Number: F4008387, from Albany to Chicago, Departure Time: 05:05, Arrival Time: 06:11", "breakfast": "-", "attraction": "-", "lunch": "-", "dinner": "-", "accommodation": "-"}]}]